name,description,address,city,region,province,postal_code,phone,fax,hours,url,latitude,longitude,distance,materials,pickup,dropoff,notes,groups,curbside,municipal,national,event_only
"Trumbull County Recycling Drop-Off Site - Hubbard Township","","2600 Elmwood Drive Extension","Hubbard","","OH","44425","3306752673","0","","https://www.gottagogreen.org","41.1726533","-80.5556091","10.7246173842854","","false","false","","","false","false","false","false"
"Mercer Auto Wrecker","Mercer Auto Wrecker","748 Wilson Ave","Mercer","Mercer","PA","16137","7246623440","0","Monday: 8:30 AM - 12:00 PM Tuesday: 8:30 AM - 12:00 PM Wednesday: 8:30 AM - 12:00 PM Thursday: 8:30 AM - 12:00 PM Friday: 8:30 AM - 12:00 PM Saturday: 12:30 PM - 4:30 PM ","","41.22209","-80.22427","10.7907146789749","Aluminum Cans; Antifreeze; Automobile Parts; Cardboard; Ferrous Metals (Steel or Iron); Large Household Appliances; Non-ferrous (Copper/Brass/Tin); Used Motor Oil; Computer (Recycling); Computer Monitors; Electronics; Laptop Computers; Computer Peripherals; Printers/Scanners/Fax Machines; Small Televisions; Tablets; Televisions; Video Game Consoles; PlayStation Consoles","false","true","","","false","false","false","false"
"Mercer Auto Wreckers","Mercer Auto Wreckers","748 Wilson Ave","Mercer","Mercer","PA","16137","7246623440","0","","","41.22209","-80.22427","10.7907146789749","Aluminum Cans; Antifreeze; Cardboard; Ferrous Metals (Steel or Iron); Tin or Steel Cans; Used Motor Oil; Computer (Recycling); Computer Monitors; Electronics; Laptop Computers; Computer Peripherals; Printers/Scanners/Fax Machines; Small Televisions; Tablets; Televisions; Video Game Consoles; PlayStation Consoles","false","true","","","false","false","false","false"
"Mercer Auto Wreckers","","748 Wilson Ave","Mercer","","PA","16137","7246623440","0","","","41.2214317","-80.2242888","10.8084497447365","","false","false","","","false","false","false","false"
"Trumbull County Christmas Tree Drop-Of Event - Hubbard Township Road Department","","2600 Elmwood Drive","Hubbard","","OH","44425","3306752673","0","","https://www.gottagogreen.org/","41.1636468","-80.557988","11.2676217756532","","false","false","","","false","false","false","false"
"Greenville Borough Compost Site","","E Jamestown Rd","Greenville","","PA","16125","7245882073","0","","https://greenvilleborough.com","41.4552954","-80.4034483","11.7357633294719","","false","false","","","false","false","false","false"
"AutoZone","AutoZone","420 N Main St","Hubbard","Trumbull","OH","44425","3305345801","0","","http://www.autozone.com","41.16184","-80.56902","11.7466962951411","Lead Acid (Pb) Batteries; Used Motor Oil; Video Game Consoles; PlayStation Consoles","false","true","Most AutoZone stores accept used motor oil, transmission fluid, gear oil and automotive batteries. Call to see what your local store is currently accepting.","","false","false","false","false"
"Lawrence County Recycling Drop-off Site - Pulaski Township","","Route 208","Pulaski","","PA","16143","7246582541","0","","http://co.lawrence.pa.us","41.1134127","-80.4322824","11.9354782695753","","false","false","","","false","false","false","false"
"My Extreme PC LLC","","44 N Main St","Hubbard","","OH","44425","3305348324","0","","","41.1574187","-80.5690683","11.9727895610631","","false","false","","","false","false","false","false"
"Walgreens","Walgreens","15 S Main St","Hubbard","Trumbull","OH","44425","3305344519","0","","http://www.walgreens.com","41.15565","-80.5688","12.0542387893792","Cell Phones; Inkjet Printer Cartridges; Video Game Consoles; PlayStation Consoles","false","true","","","false","false","false","false"
"Trumbull County Recycling Drop-Off Site - Hubbard City","","33 W Liberty St","Hubbard","","OH","44425","3306752673","0","","https://www.gottagogreen.org","41.155658","-80.570017","12.0961129283822","","false","false","","","false","false","false","false"
"O'Reilly Auto Parts","","840 W Liberty St","Hubbard","","OH","44425","3305347789","0","","http://oreillyauto.custhelp.com/app/error/error_id/6","41.1569418","-80.5831177","12.4991633333568","","false","false","","","false","false","false","false"
"Trumbull County Recycling Drop-Off Site - Fowler Township","","3364 Youngstown Kingsville Rd","Fowler","","OH","44418","3306752673","0","","https://www.gottagogreen.org","41.3083166","-80.655365","12.6235609426013","","false","false","","","false","false","false","false"
"Cash For Cans","Cash For Cans","135 Youngstown Hubbard Rd","Hubbard","Trumbull","OH","44425","7249621894","0","Sunday: 12:00 AM - 11:59 PM Monday: 12:00 AM - 11:59 PM Tuesday: 12:00 AM - 11:59 PM Wednesday: 12:00 AM - 11:59 PM Thursday: 12:00 AM - 11:59 PM Friday: 12:00 AM - 11:59 PM Saturday: 12:00 AM - 11:59 PM ","","41.15529","-80.58586","12.6806052476597","Aluminum Cans; Video Game Consoles; PlayStation Consoles","false","true","This site is located at the Hub Restaurant formerly known as the Hubbard Family Restaurant and Juliano's.","","false","false","false","false"
"Hadley Recycling, Inc.","Hadley Recycling, Inc.","1093 Fredonia Rd ","Hadley","Mercer County","PA","16130","7242532969","0","","","41.4130761","-80.2350786","12.7950061102351","Non-ferrous (Copper/Brass/Tin); Computer (Recycling); Computer Monitors; Electronics; Laptop Computers; Computer Peripherals; Printers/Scanners/Fax Machines; Small Televisions; Tablets; Televisions; Video Game Consoles; PlayStation Consoles","false","true","","","false","false","false","false"
"Hadley Recycling","","1092 Fredonia Road","Hadley","","PA","16130","7242532969","0","","","41.4114221","-80.2325151","12.8140925083409","","false","false","","","false","false","false","false"
"Trumbull County Recycling Drop-Off Site - Vienna Township","","833 Youngstown Kingsville Rd","Vienna","","OH","44473","3306752673","0","","https://www.gottagogreen.org","41.2404401","-80.6642072","13.3612520472608","","false","false","","","false","false","false","false"
"USPS Post Office Box Lobby Recycling Program","US Post Office","425 State Route 208","New Bedford","Lawrence","PA","16140","8002758777","0","","https://www.usps.com/","41.09778","-80.50374","13.7901118899247","Catalogs; Greeting Cards; Magazines; Paper (Mixed)","false","true","","","false","false","false","false"
"Mercer County Recycling Drop-off Site - Jamestown","","Washington St & Water St","Jamestown","","PA","16134","7249812412","0","","http://countyrecycling.com","41.48709","-80.4401998","13.9853864114827","","false","false","","","false","false","false","false"
"New Horizons Recycling, Inc.","","Conneaut Lake Rd & Hwy 18","Adamsville","","PA","16110","7245880788","0","","","41.4852343","-80.3686432","13.9907988549075","","false","false","","","false","false","false","false"
"Mercer County Recycling Drop-off Site - Findley Township","","369 McClelland Road","Mercer","","PA","16137","7249812412","0","","http://countyrecycling.com","41.1943934","-80.166058","14.3430739457724","","false","false","","","false","false","false","false"
"Lawrence County Recycling Drop-off Site - Volant Borough","","525 Main St","Volant","","PA","16156","7246582541","0","","http://co.lawrence.pa.us","41.1125401","-80.2578541","14.4544517785878","","false","false","","","false","false","false","false"
"Trumbull County Christmas Tree Drop-Of Event - Johnston Township Maintenance Garage","","4424 Greenville Road","Farmdale","","OH","44417","3306752673","0","","https://www.gottagogreen.org/","41.3884887","-80.6603064","14.6184126032137","","false","false","","","false","false","false","false"
"PSC Metals Inc.","PSC Metals Inc.","2700 Hubbard Rd ","Youngstown","Mahoning County","OH","44505","3307592820","3307593530","Monday: 8:00 AM - 4:00 PM Tuesday: 8:00 AM - 4:00 PM Wednesday: 8:00 AM - 4:00 PM Thursday: 8:00 AM - 4:00 PM Friday: 8:00 AM - 4:00 PM Saturday: 9:00 AM - 11:59 PM ","http://www.pscmetals.com","41.1327125","-80.6246314","15.2119397670615","Aluminum Cans; Car; Lead Acid (Pb) Batteries; Cell Phones; Computer (Recycling); Electronics; Ferrous Metals (Steel or Iron); Video Game Systems; Large Household Appliances; Non-ferrous (Copper/Brass/Tin); Office Equipment; Telephones; Stereo Equipment; Printers/Scanners/Fax Machines; Laptop Computers; Tablets; MP3 Players; AC Power Plugs; Portable Media Players; Cables & Connectors; Servers; Wire; Microwaves; Power Supplies; Computer Peripherals; VCRs; DVD Players/Blu-Ray Players/DVRs; Network Equipment; Catalytic Converters; Car Audio/Video Equipment; Radiators; High-Temp Alloys; Special Metals; Video Game Consoles; PlayStation Consoles","false","true","","","false","false","false","false"
"PSC Metals, Inc.","","2700 Hubbard Road","Youngstown","","OH","44505","3307592820","0","","https://www.pscmetals.com/","41.1332027","-80.6256396","15.2262154754116","","false","false","","","false","false","false","false"
"PSC Metals, Inc.","","2700 Hubbard Road","Youngstown","","OH","44505","3307592820","0","","https://www.pscmetals.com/","41.1332027","-80.6256396","15.2262154754116","","false","false","","","false","false","false","false"
"Allhouse Appliance","Allhouse Appliance","3457 Wilmington Rd","New Castle","Lawrence","PA","16105","7246544334","0","","","41.06507","-80.36009","15.4940648051566","Large Household Appliances; Computer (Recycling); Computer Monitors; Electronics; Laptop Computers; Computer Peripherals; Printers/Scanners/Fax Machines; Small Televisions; Tablets; Televisions; Video Game Consoles; PlayStation Consoles","false","true","If you order new products from Allhouse they will take your old ones for no charge.","","false","false","false","false"
"Coitsville Recycling Drop-Off","","3737 McCartney Rd.","Coitsville","","OH","44405","3307402060","0","","http://www.mahoningcountyoh.gov","41.0893913","-80.5655139","15.6786590366358","","false","false","","","false","false","false","false"
"Blind Association of Pennsylvania","Blind Association of Pennsylvania","428 Eleanor Dr","New Castle","Lawrence","PA","16105","7246524571","0","Monday: 8:00 AM - 2:30 PM Tuesday: 8:00 AM - 2:30 PM Wednesday: 8:00 AM - 2:30 PM Thursday: 8:00 AM - 2:30 PM Friday: 8:00 AM - 2:30 PM ","http://www.pablind.org/","41.06686","-80.33321","15.6879464568663","Cell Phones; Eyeglasses; Inkjet Printer Cartridges; Laser Toner Cartridges; Computer (Recycling); Computer Monitors; Electronics; Laptop Computers; Computer Peripherals; Printers/Scanners/Fax Machines; Small Televisions; Tablets; Televisions; Video Game Consoles; PlayStation Consoles","false","true","","","false","false","false","false"
"Trebco Corporation","","229 E Dennick Ave","Youngstown","","OH","44505","3307438228","0","","","41.1300767","-80.637487","15.8228607626088","","false","false","","","false","false","false","false"
"K&M Shingle Recycling","K&M Shingle Recycling","24 E Dennick Ave","Youngstown","Mahoning","OH","44505","3306466882","0","","http://www.shinglerecycling.org/","41.12985","-80.63912","15.8958803759263","Shingles; Video Game Consoles; PlayStation Consoles","false","true","For more information on shingle recycling visit <a href="http://www.shinglerecycling.org/index.php" target="_blank">ShingleRecycling.org</a>","","false","false","false","false"
"Walmart Supercenter","","200 Goldie Rd","Youngstown","","OH","44505","3307592066","0","","https://www.walmart.com/","41.1473517","-80.66165","16.0262527035177","","false","false","","","false","false","false","false"
"Walmart Tire and Lube Express","","200 Goldie Rd","Youngstown","","OH","44505","3307592066","0","","https://www.walmart.com/cp/ideas/8932632","41.1473517","-80.66165","16.0262527035177","","false","false","","","false","false","false","false"
"Walmart 38601","Walmart 38601","200 Goldie Rd","Youngstown","Trumbull","OH","44505","8583244111","0","","http://www.ecoatm.com/","41.14575","-80.66049","16.0444207591744","Cell Phones; Tablets; MP3 Players; Video Game Consoles; PlayStation Consoles","false","true","ecoATM is an automated, consumer self-serve kiosk that quickly buys back and recycles old phones, mp3 players and tablets.
</br>
Call or email <a href="mailto:max@ecoATM.com">customer support</a> with questions.","","false","false","false","false"
"RadioShack","RadioShack","3551 Belmont Ave","Youngstown","Trumbull","OH","44505","3307598403","0","Monday: 10:00 AM - 8:00 PM Tuesday: 10:00 AM - 8:00 PM Wednesday: 10:00 AM - 8:00 PM Thursday: 10:00 AM - 8:00 PM Friday: 9:00 AM - 9:00 PM Saturday: 9:00 AM - 9:00 PM Sunday: 10:00 AM - 7:00 PM ","http://www.radioshack.com","41.1496","-80.6651","16.079111281733","Ni-Cd Batteries; Batteries (Rechargeable); Video Game Consoles; PlayStation Consoles","false","true","This site is located in Liberty Plaza.","","false","false","false","false"
"Call2Recycle at RadioShack","Call2Recycle at RadioShack","3551 Belmont Ave","Youngstown","Trumbull","OH","44505","3307598403","0","","http://www.radioshack.com/","41.1496","-80.6651","16.079111281733","Cell Phones; Ni-Cd Batteries; Li-Ion Batteries; Ni-MH Batteries; Ni-Zn Batteries; Small Sealed Lead Acid Batteries; Video Game Consoles; PlayStation Consoles","false","true","As the first national retailer to partner with Call2Recycle, RadioShack is at the forefront of the rechargeable battery recycling cause and is pleased to offer battery recycling at thousands of convenient RadioShack locations for free.  Simply drop them off at your local RadioShack and theyll take care of the rest.  Ask a store associate for more details.","","false","false","false","false"
"Recycling Drop-off Site - Four Seasons Flea Market","","3000 McCartney Road ","Youngstown","","OH","44505","3307402060","0","","http://www.greenteam.cc/","41.0909008","-80.5864582","16.1659808878604","","false","false","","","false","false","false","false"
"Campbell Hardware","Campbell Hardware","765 McCartney Rd","Youngstown","Mahoning","OH","44505","3307437431","0","","http://www.acehardware.com/","41.09026","-80.58548","16.1747849748142","Cell Phones; Ni-Cd Batteries; Li-Ion Batteries; Ni-MH Batteries; Ni-Zn Batteries; Small Sealed Lead Acid Batteries; Video Game Consoles; PlayStation Consoles","false","true","The U.S. EPA estimates that more than 350 million rechargeable batteries are purchased annually in the U.S. Thanks to the environmental commitment of this location, its easy and free to recycle your batteries. Bring your rechargeable batteries to this location and look for the recycling box or ask an associate how you can do your part for the environment.","","false","false","false","false"
"East Library","","430 Early Rd.","Youngstown","","OH","44505","3307448636","0","","https://www.libraryvisit.org/locations-hours/east-library/","41.103245","-80.60939","16.1832202258053","","false","false","","","false","false","false","false"
"Trumbull County Christmas Tree Drop-Of Event - Willow Park","","184 Willow Avenue","Cortland","","OH","44410","3306752673","0","","https://www.gottagogreen.org/","41.3296845","-80.7204316","16.189431477391","","false","false","","","false","false","false","false"
"O'Reilly Auto Parts","","3489 Belmont Ave","Youngstown","","OH","44505","3307593375","0","","http://oreillyauto.custhelp.com/app/error/error_id/6","41.1447149","-80.6637305","16.2220769620033","","false","false","","","false","false","false","false"
"Walgreens","Walgreens","2864 McCartney Rd","Youngstown","Mahoning","OH","44505","3307431614","0","","http://www.walgreens.com","41.09033","-80.5881","16.2462290381465","Cell Phones; Inkjet Printer Cartridges; Video Game Consoles; PlayStation Consoles","false","true","","","false","false","false","false"
"Trumbull County Recycling Drop-Off Site - Johnston Township","","Greenville Rd","Cortland","","OH","44410","3306752673","0","","https://www.gottagogreen.org","41.3889449","-80.6971807","16.3302165308128","","false","false","","","false","false","false","false"
"Firestone Complete Auto Care","","3335 Belmont Ave","Youngstown","","OH","44505","3307593697","0","","https://www.firestonecompleteautocare.com/","41.1428294","-80.6649874","16.3527858789308","","false","false","","","false","false","false","false"
"Firestone Complete Auto Care Store","Firestone Complete Auto Care Store","3335 Belmont Ave","Youngstown","Trumbull","OH","44505","3304234420","0","","http://www.firestonecompleteautocare.com/","41.14226","-80.6654","16.3936768066865","Lead Acid (Pb) Batteries; Used Motor Oil; Video Game Consoles; PlayStation Consoles","false","true","","","false","false","false","false"
"Youngstown Recycling Drop-Off - Four Seasons Flea Market","","3000 McCartney Rd","Youngstown","","OH","44505","3307402060","0","","http://www.mahoningcountyoh.gov","41.0905376","-80.593879","16.4036963030234","","false","false","","","false","false","false","false"
"AutoZone","AutoZone","3109 Belmont Ave","Youngstown","Trumbull","OH","44505","3307590424","0","","http://www.autozone.com","41.14099","-80.66541","16.4473522112223","Lead Acid (Pb) Batteries; Used Motor Oil; Video Game Consoles; PlayStation Consoles","false","true","Most AutoZone stores accept used motor oil, transmission fluid, gear oil and automotive batteries. Call to see what your local store is currently accepting.","","false","false","false","false"
"Advance Auto Parts","Advance Auto Parts","3179 Belmont Ave","Youngstown","Trumbull","OH","44505","3307590123","0","Monday: 7:00 AM - 9:00 PM Tuesday: 7:00 AM - 9:00 PM Wednesday: 7:00 AM - 9:00 PM Thursday: 7:00 AM - 9:00 PM Friday: 7:00 AM - 9:00 PM Saturday: 7:00 AM - 9:00 PM Sunday: 10:00 AM - 8:00 PM ","http://www.advanceautoparts.com","41.14099","-80.66541","16.4473522112223","Lead Acid (Pb) Batteries; Used Motor Oil; Video Game Consoles; PlayStation Consoles","false","true","","","false","false","false","false"
"Dart Metals Trading Co","Dart Metals Trading Co","19 Colonial Dr Ste 26","Youngstown","Trumbull","OH","44505","3307598396","0","","","41.13692","-80.66273","16.5107424431678","Aluminum; Video Game Consoles; PlayStation Consoles","false","true","","","false","false","false","false"
"Lawrence County Recycling Drop-off Site - Hickory Township","","Eastbrook-Neshannock Falls Road","New Castle","","PA","16101","7246582541","0","","http://co.lawrence.pa.us","41.0653099","-80.285888","16.6165386735358","","false","false","","","false","false","false","false"
"Walgreens","Walgreens","600 S Mecca St","Cortland","Trumbull","OH","44410","3306385016","0","","http://www.walgreens.com","41.32017","-80.73123","16.6343926175671","Cell Phones; Inkjet Printer Cartridges; Video Game Consoles; PlayStation Consoles","false","true","","","false","false","false","false"
"Youngstown Area Goodwill Industries","","2747 Belmont Avenue","Youngstown","","OH","44505","8778607866","0","","https://sunnking.com/","41.1350759","-80.6640772","16.6450734161135","","false","false","","","false","false","false","false"
"AutoZone","AutoZone","1960 McCartney Rd","Youngstown","Mahoning","OH","44505","3307440648","0","","http://www.autozone.com","41.09035","-80.60318","16.6945477796283","Lead Acid (Pb) Batteries; Used Motor Oil; Video Game Consoles; PlayStation Consoles","false","true","Most AutoZone stores accept used motor oil, transmission fluid, gear oil and automotive batteries. Call to see what your local store is currently accepting.","","false","false","false","false"
"Walgreens","Walgreens","2560 Belmont Ave","Youngstown","Mahoning","OH","44505","3307464814","0","","http://www.walgreens.com","41.13315","-80.66554","16.787822681038","Cell Phones; Inkjet Cartridge Refilling; Inkjet Printer Cartridges; Video Game Consoles; PlayStation Consoles","false","true","","","false","false","false","false"
"Nike Factory Store","","1911 Leesburg-Grove City Road","Grove City","","PA","16127","7247485138","0","","https://www.nike.com/us/en_us/c/better-world/stories/2012/09/reuse-a-shoe","41.1385211","-80.1569006","16.7905807239336","","false","false","","","false","false","false","false"
"Direct Tools Factory Outlet","Direct Tools Factory Outlet","1911 Leesburg Grove City Rd ","Grove City","Mercer County","PA","16127","7247486300","0","","null","41.1385211","-80.1569006","16.7905807239336","Batteries (Rechargeable); Cell Phone Batteries; Cell Phones; Li-Ion Batteries; Ni-Cd Batteries; Ni-MH Batteries; Small Sealed Lead Acid Batteries","false","true","Call or Check Online for Hours","Call2Recycle","false","false","false","false"
"Trumbull County Recycling Drop-Off Site - Kinsman Township","","6380 State Route 87","6380 Oh-87","","OH","44428","3306752673","0","","https://www.gottagogreen.org","41.4609724","-80.6414546","16.9049483786819","","false","false","","","false","false","false","false"
"Trumbull County Recycling Drop-Off Site - Bazetta Township Road Department","","3372 Highway 5","Cortland","","OH","44410","3306752673","0","","https://www.gottagogreen.org","41.3086907","-80.7403666","17.0127660812748","","false","false","","","false","false","false","false"
"Call2Recycle at the Home Depot","Call2Recycle at the Home Depot","1900 Niles Cortland Rd SE ","Warren","Trumbull County","OH","44484","3305050225","0","","http://www.homedepot.com/","41.2633249","-80.7408527","17.0388313555497","Cell Phones; Compact Fluorescent Lights; Ni-Cd Batteries; Li-Ion Batteries; Ni-MH Batteries; Ni-Zn Batteries; Small Sealed Lead Acid Batteries; Video Game Consoles; PlayStation Consoles","false","true","The Home Depot accepts used rechargeable batteries and compact fluorescent bulbs. Look for the orange drop boxes, usually located near the front entrance near the customer service desk, or ask a store associate for more details.","","false","false","false","false"
"Walmart","Walmart","1275 N Hermitage Rd","Hermitage","Mercer","PA","16148","7243465940","0","","http://www.walmart.com","41.25164","-80.45057","3.01785133542732","Lead Acid (Pb) Batteries; Plastic Shopping Bags; Food Storage Bags; Computer (Recycling); Computer Monitors; Electronics; Laptop Computers; Computer Peripherals; Printers/Scanners/Fax Machines; Small Televisions; Tablets; Televisions; Video Game Consoles; PlayStation Consoles","false","true","","","false","false","false","false"
"Walmart Tire & Lube Express","Walmart Tire & Lube Express","1275 N Hermitage Rd","Hermitage","Mercer","PA","16148","7243465940","0","","http://www.walmart.com/catalog/catalog.gsp?cat=495843","41.25164","-80.45057","3.01785133542732","Lead Acid (Pb) Batteries; Used Motor Oil; Oil Filters; Computer (Recycling); Computer Monitors; Electronics; Laptop Computers; Computer Peripherals; Printers/Scanners/Fax Machines; Small Televisions; Tablets; Televisions; Video Game Consoles; PlayStation Consoles","false","true","","","false","false","false","false"
"Walmart Supercenter","","1275 N Hermitage Rd","Hermitage","","PA","16148","7243465940","0","","https://www.walmart.com/","41.2497536","-80.4529907","3.19828574955057","","false","false","","","false","false","false","false"
"Walmart Tire and Lube Express","","1275 N Hermitage Rd","Hermitage","","PA","16148","7243465940","0","","https://www.walmart.com/cp/ideas/8932632","41.2497536","-80.4529907","3.19828574955057","","false","false","","","false","false","false","false"
"JCPenney","","3405 E State St","Hermitage","","PA","16148","7249812500","0","","https://www.jcpenney.com/","41.2339584","-80.4459712","3.93545400941644","","false","false","","","false","false","false","false"
"Firestone Complete Auto Care","","3405 E State St","Sharon","","PA","16146","7243462621","0","","https://www.firestonecompleteautocare.com/","41.2339584","-80.4459712","3.93545400941644","","false","false","","","false","false","false","false"
"Firestone Complete Auto Care Store","Firestone Complete Auto Care Store","3405 E State St","Hermitage","Mercer","PA","16148","7247344828","0","","http://www.firestonecompleteautocare.com/","41.23352","-80.44676","3.98025848110205","Lead Acid (Pb) Batteries; Used Motor Oil; Computer (Recycling); Computer Monitors; Electronics; Laptop Computers; Computer Peripherals; Printers/Scanners/Fax Machines; Small Televisions; Tablets; Televisions; Video Game Consoles; PlayStation Consoles","false","true","","","false","false","false","false"
"Call2Recycle at the Home Depot","Call2Recycle at the Home Depot","3300 Shenango Valley Fwy","Hermitage","Mercer","PA","16148","7249813054","0","","http://www.homedepot.com/","41.23285","-80.44544","3.99370397417047","Cell Phones; Compact Fluorescent Lights; Ni-Cd Batteries; Li-Ion Batteries; Ni-MH Batteries; Ni-Zn Batteries; Small Sealed Lead Acid Batteries; Computer (Recycling); Computer Monitors; Electronics; Laptop Computers; Computer Peripherals; Printers/Scanners/Fax Machines; Small Televisions; Tablets; Televisions; Video Game Consoles; PlayStation Consoles","false","true","The Home Depot accepts used rechargeable batteries and compact fluorescent bulbs. Look for the orange drop boxes, usually located near the front entrance near the customer service desk, or ask a store associate for more details.","","false","false","false","false"
"PM Recovery-Greenville Warehouse","PM Recovery-Greenville Warehouse","209 Reynolds Industrial Park Dr","Greenville","Mercer","PA","16125","7246460266","7246460295","","http://www.pmrecovery.com","41.34207","-80.39616","4.00915119944159","Non-ferrous (Copper/Brass/Tin); High-Temp Alloys; Special Metals; Computer (Recycling); Computer Monitors; Electronics; Laptop Computers; Computer Peripherals; Printers/Scanners/Fax Machines; Small Televisions; Tablets; Televisions; Video Game Consoles; PlayStation Consoles","false","true","","","false","false","false","false"
