name,description,address,city,region,province,postal_code,phone,fax,hours,url,latitude,longitude,distance,materials,pickup,dropoff,notes,groups,curbside,municipal,national,event_only
"Walgreens","Walgreens","3229 E State St","Hermitage","Mercer","PA","16148","7243424603","0","","http://www.walgreens.com","41.23348","-80.44965","4.04905179217412","Cell Phones; Inkjet Cartridge Refilling; Inkjet Printer Cartridges; Computer (Recycling); Computer Monitors; Electronics; Laptop Computers; Computer Peripherals; Printers/Scanners/Fax Machines; Small Televisions; Tablets; Televisions; Video Game Consoles; PlayStation Consoles","false","true","","","false","false","false","false"
"Verizon Wireless","Verizon Wireless","3372 E State St","Hermitage","Mercer","PA","16148","8666444532","0","","http://www.verizonwireless.com/","41.2333","-80.44971","4.06154103889645","Cell Phones; Cell Phone Batteries; Computer (Recycling); Computer Monitors; Electronics; Laptop Computers; Computer Peripherals; Printers/Scanners/Fax Machines; Small Televisions; Tablets; Televisions; Video Game Consoles; PlayStation Consoles","false","true","<A Href="https://www.trade-in.vzw.com/home.aspx">
The Verizon Wireless Trade-In Program</A> allows you to trade in your used handset or tablet in a convenient and responsible way. 
<P>
<P>
Verizon Wireless works every day to protect our environment and give our customers opportunities to do the same. <A Href="http://aboutus.vzw.com/Green_Initiative/overview.html">Click here</A> for more examples of the earth-friendly initiatives and programs Verizon Wireless is proud to offer and support.","","false","false","false","false"
"Shenango Valley Mall Drop-off Depot","","62 S Hermitage Rd","Hermitage","","PA","16148","7249812412","0","","http://countyrecycling.com","41.2327568","-80.449685","4.09439482731152","","false","false","","","false","false","false","false"
"L & M Tire Sales","L & M Tire Sales","3090 E State St","Hermitage","Mercer","PA","16148","7249838331","0","Monday: 8:00 AM - 5:00 PM Tuesday: 8:00 AM - 5:00 PM Wednesday: 8:00 AM - 5:00 PM Thursday: 8:00 AM - 5:00 PM Friday: 8:00 AM - 5:00 PM Saturday: 8:00 AM - 12:00 PM ","","41.23329","-80.45239","4.12747067537379","Used Tires; Computer (Recycling); Computer Monitors; Electronics; Laptop Computers; Computer Peripherals; Printers/Scanners/Fax Machines; Small Televisions; Tablets; Televisions; Video Game Consoles; PlayStation Consoles","false","true","","","false","false","false","false"
"Tractor Supply","Tractor Supply","2998 E State St","Hermitage","Mercer","PA","16148","7249824440","0","","http://www.tractorsupply.com","41.23328","-80.45446","4.18099107743372","Transmission Fluid; Used Motor Oil; Computer (Recycling); Computer Monitors; Electronics; Laptop Computers; Computer Peripherals; Printers/Scanners/Fax Machines; Small Televisions; Tablets; Televisions; Video Game Consoles; PlayStation Consoles","false","true","","","false","false","false","false"
"AutoZone","AutoZone","2975 E State St","Hermitage","Mercer","PA","16148","7243471633","0","","http://www.autozone.com","41.23346","-80.45585","4.20702974536515","Lead Acid (Pb) Batteries; Used Motor Oil; Computer (Recycling); Computer Monitors; Electronics; Laptop Computers; Computer Peripherals; Printers/Scanners/Fax Machines; Small Televisions; Tablets; Televisions; Video Game Consoles; PlayStation Consoles","false","true","Most AutoZone stores accept used motor oil, transmission fluid, gear oil and automotive batteries. Call to see what your local store is currently accepting.","","false","false","false","false"
"Call2Recycle at Lowe's","Call2Recycle at Lowe's","3000 Glimcher Blvd","Hermitage","Mercer","PA","16148","7249835360","0","Monday: 6:00 AM - 10:00 PM Tuesday: 6:00 AM - 10:00 PM Wednesday: 6:00 AM - 10:00 PM Thursday: 6:00 AM - 10:00 PM Friday: 6:00 AM - 10:00 PM Saturday: 6:00 AM - 10:00 PM Sunday: 8:00 AM - 8:00 PM ","http://www.lowes.com/","41.23132","-80.45112","4.21669623282004","Cell Phones; Compact Fluorescent Lights; Ni-Cd Batteries; Plastic Shopping Bags; Li-Ion Batteries; Ni-MH Batteries; Ni-Zn Batteries; Small Sealed Lead Acid Batteries; Computer (Recycling); Computer Monitors; Electronics; Laptop Computers; Computer Peripherals; Printers/Scanners/Fax Machines; Small Televisions; Tablets; Televisions; Video Game Consoles; PlayStation Consoles","false","true","As an environmentally-committed retailer, Lowes offers a recycling center near store entrances to give consumers a free and easy way to properly dispose of rechargeable batteries, cell phones, CFLs and plastic shopping bags; materials that otherwise could be potentially harmful to the environment.  Look for the recycling center or ask a store associate for more details.","","false","false","false","false"
"Lowe's","","3000 Glimcher Blvd","Hermitage","","PA","16148","7249835360","0","","https://newsroom.lowes.com/responsibility/operational-excellence/","41.2299507","-80.4524692","4.33291052079882","Batteries (Rechargeable); Cell Phone Batteries; Li-Ion Batteries; Ni-Cd Batteries; Ni-MH Batteries; Small Sealed Lead Acid Batteries; Cell Phones","false","true","","Call2Recycle","false","false","false","false"
"Home Depot","","3300 Shenango Valley Fwy","Hermitage","","PA","16148","7249813054","0","","https://ecooptions.homedepot.com/","41.2282168","-80.4484714","4.3502412801422","Batteries (Rechargeable); Cell Phone Batteries; Li-Ion Batteries; Ni-Cd Batteries; Ni-MH Batteries; Small Sealed Lead Acid Batteries","false","true","","Call2Recycle","false","false","false","false"
"Tractor Supply","","2998 East State Street","Hermitage","","PA","16148","7249824440","0","","https://www.tractorsupply.com/","41.229276","-80.4546419","4.426957873191","","false","false","","","false","false","false","false"
"Wireless Experts","","2331 E State St","Hermitage","","PA","16148","7247342510","0","","","41.2349857","-80.4666773","4.43935988603742","","false","false","","","false","false","false","false"
"Staples","Staples","439 S. Hermitage Rd.","Hermitage","Mercer County","PA","16148","7243420439","0","Monday: 9:00 AM - 9:00 PM Tuesday: 9:00 AM - 9:00 PM Wednesday: 9:00 AM - 9:00 PM Thursday: 9:00 AM - 9:00 PM Friday: 9:00 AM - 9:00 PM Saturday: 10:00 AM - 7:00 PM Sunday: 11:00 AM - 6:00 PM ","https://www.staples.com/recycle","41.227343","-80.4501227","4.44084930513548","AC Power Plugs; Batteries (Rechargeable); Cables & Connectors; Cell Phone Batteries; Cell Phones; Computer (Recycling); Hard Drives; Computer Monitors; Cameras; DVD Players/Blu-Ray Players/DVRs; Electronics; E-Readers; GPS Units; Headphones; Inkjet Printer Cartridges; Laptop Computers; Laser Toner Cartridges; Li-Ion Batteries; MP3 Players; Network Equipment; Ni-Cd Batteries; Ni-MH Batteries; Ni-Zn Batteries; Computer Peripherals; Portable Media Players; Printers/Scanners/Fax Machines; Small Electronics; Small Sealed Lead Acid Batteries; Stereo Equipment; Tablets; Telephones; UPS Batteries/Backup Systems; VCRs; Video Game Systems; Blu-Ray Players; Digital Converter Boxes; Small Televisions; Televisions; Video Game Consoles; PlayStation Consoles; Alkaline/Single-Use Batteries","false","true","NO TVs; Limit 6 CEDs per day; ","Sony, Vizio, OEM","false","false","false","false"
"Staples","null","439 S. Hermitage Rd.","Hermitage","","PA","16148","7243420439","0","","https://www.staples.com/sbd/cre/marketing/sustainability-center/recycling-services/","41.227343","-80.4501227","4.44084930513548","Alkaline/Single-Use Batteries; Batteries (Rechargeable); Cell Phone Batteries; Li-Ion Batteries; Ni-Cd Batteries; Ni-MH Batteries; Small Sealed Lead Acid Batteries; Alkaline/Single-Use Batteries; Button Batteries; Non-rechargeable lithium batteries; Cell Phones","false","true","","Call2Recycle","false","false","false","false"
"PM Recovery-Greenville Warehouse","","209 Reynolds Industrial Park Road","Greenville","","PA","16125","7246460266","0","","http://www.pmrecovery.com/","41.3507437","-80.4057208","4.52012710267366","","false","false","","","false","false","false","false"
"AT&T Wireless","AT&T Wireless","2085 East State Street","Hermitage","Mercer","PA","16148","7249838221","0","","http://www.att.com/","41.23343","-80.47124","4.67152728061915","Cell Phones; Ni-Cd Batteries; Batteries (Rechargeable); Cell Phone Batteries; Tablets; Li-Ion Batteries; Computer (Recycling); Computer Monitors; Electronics; Laptop Computers; Computer Peripherals; Printers/Scanners/Fax Machines; Small Televisions; Televisions; Video Game Consoles; PlayStation Consoles","false","true","Receive an AT&T Promotion Card worth the trade-in value of your smartphone, tablet, or netbook. You can also donate the trade-in value to Cell Phones for Soldiers.","","false","false","false","false"
"BP Oil Corporation","BP Oil Corporation","470 N Buhl Farm Dr","Hermitage","Mercer","PA","16148","7249816666","0","Monday: 7:00 AM - 8:45 PM Tuesday: 7:00 AM - 8:45 PM Wednesday: 7:00 AM - 8:45 PM Thursday: 7:00 AM - 8:45 PM Friday: 7:00 AM - 8:45 PM ","null","41.22705","-80.47133","5.02244525385876","Used Motor Oil; Computer (Recycling); Computer Monitors; Electronics; Laptop Computers; Computer Peripherals; Printers/Scanners/Fax Machines; Small Televisions; Tablets; Televisions; Video Game Consoles; PlayStation Consoles","false","true","This site is located at the corner of Highland and North Buhl Farm Road.","","false","false","false","false"
"Cash For Cans","Cash For Cans","1362 N Hermitage Rd","Hermitage","Mercer","PA","16148","7249621894","0","Sunday: 12:00 AM - 11:59 PM Monday: 12:00 AM - 11:59 PM Tuesday: 12:00 AM - 11:59 PM Wednesday: 12:00 AM - 11:59 PM Thursday: 12:00 AM - 11:59 PM Friday: 12:00 AM - 11:59 PM Saturday: 12:00 AM - 11:59 PM ","","41.21531","-80.45659","5.33660122726005","Aluminum Cans; Computer (Recycling); Computer Monitors; Electronics; Laptop Computers; Computer Peripherals; Printers/Scanners/Fax Machines; Small Televisions; Tablets; Televisions; Video Game Consoles; PlayStation Consoles","false","true","This site is located at Erme's Distributing on Route 18, across from Wal-Mart.","","false","false","false","false"
"Shenango Valley Mall","null","3303 E. State St. (Rte 62) ","Hermitage","Mercer","PA","16148","8583244111","0","","http://www.ecoatm.com/","41.201446","-80.422287","5.83128795450924","Cell Phones; Tablets; MP3 Players; Computer (Recycling); Computer Monitors; Electronics; Laptop Computers; Computer Peripherals; Printers/Scanners/Fax Machines; Small Televisions; Televisions; Video Game Consoles; PlayStation Consoles","false","true","ecoATM is an automated, consumer self-serve kiosk that quickly buys back and recycles old phones, mp3 players and tablets.
</br>
Call or email <a href="mailto:max@ecoATM.com">customer support</a> with questions.","","false","false","false","false"
"Cash For Cans","Cash For Cans","52 S Water Ave","Sharon","Mercer","PA","16146","7249621894","0","Sunday: 12:00 AM - 11:59 PM Monday: 12:00 AM - 11:59 PM Tuesday: 12:00 AM - 11:59 PM Wednesday: 12:00 AM - 11:59 PM Thursday: 12:00 AM - 11:59 PM Friday: 12:00 AM - 11:59 PM Saturday: 12:00 AM - 11:59 PM ","","41.23215","-80.5104","6.21990216008501","Aluminum Cans; Computer (Recycling); Computer Monitors; Electronics; Laptop Computers; Computer Peripherals; Printers/Scanners/Fax Machines; Small Televisions; Tablets; Televisions; Video Game Consoles; PlayStation Consoles","false","true","This site is located at Pizza Joes.","","false","false","false","false"
"Mercer Co","Mercer Co","200 Stewart Way","Sharon","Mercer","PA","16146","7243474534","0","Monday: 7:00 AM - 3:00 PM Tuesday: 7:00 AM - 3:00 PM Wednesday: 7:00 AM - 3:00 PM Thursday: 7:00 AM - 3:00 PM Friday: 7:00 AM - 3:00 PM ","http://www.mercerco.net","41.22485","-80.50983","6.50963546469549","Aluminum Cans; Aluminum; Ferrous Metals (Steel or Iron); Non-ferrous (Copper/Brass/Tin); Tin or Steel Cans; High-Temp Alloys; Special Metals; Computer (Recycling); Computer Monitors; Electronics; Laptop Computers; Computer Peripherals; Printers/Scanners/Fax Machines; Small Televisions; Tablets; Televisions; Video Game Consoles; PlayStation Consoles","true","true","","","false","false","false","false"
"Trumbull County Recycling Drop-Off Site - Hartford Township","","State St","Masury","","OH","44438","3306752673","0","","https://www.gottagogreen.org","41.2345367","-80.5253497","6.77261883711303","","false","false","","","false","false","false","false"
"Mercer County Recycling Drop-off Site - West Middlesex Area","","North St","West Middlesex","","PA","16159","7249812412","0","","http://countyrecycling.com","41.1742897","-80.4569478","8.00820992693852","","false","false","","","false","false","false","false"
"Fredonia Area Recycling Drop-off Program","","90 Water St","Fredonia","","PA","16124","7249812412","0","","http://countyrecycling.com","41.322648","-80.2576977","8.50882447002425","","false","false","","","false","false","false","false"
"Fredonia Area Recycling Drop-off Program","","90 Water St","Fredonia","","PA","16124","7249812412","0","","http://countyrecycling.com","41.322648","-80.2576977","8.50882447002425","","false","false","","","false","false","false","false"
"Trumbull County Recycling Drop-Off Site - Brookfield Township","","774 State Route 7","Brookfield","","OH","44403","3306752673","0","","https://www.gottagogreen.org","41.2385297","-80.566326","8.55134010425213","","false","false","","","false","false","false","false"
"Diversified Alloy & Metal Inc","","3822 New Castle Road","Pulaski","","PA","16143","3307441040","0","","","41.1608837","-80.4370227","8.7002936456142","","false","false","","","false","false","false","false"
"AutoZone","","15 Hadley Rd","Greenville","","PA","16125","7245888332","0","","https://www.autozone.com/landing/page.jsp?name=in-our-stores","41.4107363","-80.3652995","9.00655891001347","","false","false","","","false","false","false","false"
"Cash For Cans","","40 Hadley Rd","Greenville","","PA","16125","7249621894","0","","","41.4122077","-80.3625155","9.14532347226554","","false","false","","","false","false","false","false"
"Walmart Tire & Lube Express","Walmart Tire & Lube Express","45 Williamson Rd","Greenville","Mercer","PA","16125","7245890211","0","","http://www.walmart.com/catalog/catalog.gsp?cat=495843","41.41371","-80.35924","9.29516995770553","Lead Acid (Pb) Batteries; Used Motor Oil; Oil Filters; Computer (Recycling); Computer Monitors; Electronics; Laptop Computers; Computer Peripherals; Printers/Scanners/Fax Machines; Small Televisions; Tablets; Televisions; Video Game Consoles; PlayStation Consoles","false","true","","","false","false","false","false"
"Walmart","Walmart","45 Williamson Rd","Greenville","Mercer","PA","16125","7245890211","0","","http://www.walmart.com","41.41371","-80.35924","9.29516995770553","Lead Acid (Pb) Batteries; Plastic Shopping Bags; Food Storage Bags; Computer (Recycling); Computer Monitors; Electronics; Laptop Computers; Computer Peripherals; Printers/Scanners/Fax Machines; Small Televisions; Tablets; Televisions; Video Game Consoles; PlayStation Consoles","false","true","","","false","false","false","false"
"Walmart Supercenter","","45 Williamson Rd","Greenville","","PA","16125","7245890211","0","","https://www.walmart.com/","41.4149852","-80.3582089","9.395429760217","","false","false","","","false","false","false","false"
"Walmart Tire and Lube Express","","45 Williamson Rd","Greenville","","PA","16125","7245890211","0","","https://www.walmart.com/cp/ideas/8932632","41.4149852","-80.3582089","9.395429760217","","false","false","","","false","false","false","false"
