name,description,address,city,region,province,postal_code,phone,fax,hours,url,latitude,longitude,distance,materials,pickup,dropoff,notes,groups,curbside,municipal,national,event_only
"USPS Post Office Box Lobby Recycling Program","US Post Office","50 N Linden Rd","Hershey","Dauphin","PA","17033","8002758777","0","","https://www.usps.com/","40.285","-76.65271","0.925337279294688","Catalogs; Greeting Cards; Magazines; Paper (Mixed)","false","true","","","false","false","false","false"
"US Post Office","USPS Discarded Lobby Mail Recycling Program","50 N Linden Rd","Hershey","Dauphin","PA","17033","0","0","","","40.285","-76.65271","0.925337279294688","Computer (Recycling); Computer Monitors; Electronics; Laptop Computers; Computer Peripherals; Printers/Scanners/Fax Machines; Small Televisions; Tablets; Televisions; Video Game Consoles; PlayStation Consoles","false","true","","","false","false","false","false"
"Staples","Staples","710 West Chocolate Avenue","Hershey","Dauphin County","PA","17033","7175333670","0","Monday: 8:00 AM - 9:00 PM Tuesday: 8:00 AM - 9:00 PM Wednesday: 8:00 AM - 9:00 PM Thursday: 8:00 AM - 9:00 PM Friday: 8:00 AM - 9:00 PM Saturday: 9:00 AM - 9:00 PM Sunday: 10:00 AM - 6:00 PM ","https://www.staples.com/recycle","40.2784871","-76.6626272","0.999034768753654","AC Power Plugs; Batteries (Rechargeable); Cables & Connectors; Cell Phone Batteries; Cell Phones; Computer (Recycling); Hard Drives; Computer Monitors; Cameras; DVD Players/Blu-Ray Players/DVRs; Electronics; E-Readers; GPS Units; Headphones; Inkjet Printer Cartridges; Laptop Computers; Laser Toner Cartridges; Li-Ion Batteries; MP3 Players; Network Equipment; Ni-Cd Batteries; Ni-MH Batteries; Ni-Zn Batteries; Computer Peripherals; Portable Media Players; Printers/Scanners/Fax Machines; Small Electronics; Small Sealed Lead Acid Batteries; Stereo Equipment; Tablets; Telephones; UPS Batteries/Backup Systems; VCRs; Video Game Systems; Blu-Ray Players; Digital Converter Boxes; Small Televisions; Televisions; Video Game Consoles; PlayStation Consoles; Alkaline/Single-Use Batteries; Batteries (Rechargeable); Cell Phone Batteries; Li-Ion Batteries; Ni-Cd Batteries; Ni-MH Batteries; Small Sealed Lead Acid Batteries; Alkaline/Single-Use Batteries; Button Batteries; Non-rechargeable lithium batteries; Cell Phones","false","true","NO TVs; Limit 6 CEDs per day; ","Sony, Vizio, OEM, Call2Recycle","false","false","false","false"
"USPS Post Office Box Lobby Recycling Program","US Post Office","53 S Kister St","Etters","York","PA","17319","8002758777","0","","https://www.usps.com/","40.15281","-76.75177","10.025574238439","Catalogs; Greeting Cards; Magazines; Paper (Mixed)","false","true","","","false","false","false","false"
"Sprint Store","Sprint Store","3725 Walnut St","Harrisburg","Dauphin","PA","17109","7176570914","0","Monday: 10:00 AM - 9:00 PM Tuesday: 10:00 AM - 9:00 PM Wednesday: 10:00 AM - 9:00 PM Thursday: 10:00 AM - 9:00 PM Friday: 10:00 AM - 9:00 PM Saturday: 10:00 AM - 9:00 PM Sunday: 12:00 PM - 5:00 PM ","http://www.sprint.com/","40.28929","-76.83553","10.098691691595","Cell Phones; Cell Phone Batteries; Computer (Recycling); Computer Monitors; Electronics; Laptop Computers; Computer Peripherals; Printers/Scanners/Fax Machines; Small Televisions; Tablets; Televisions; Video Game Consoles; PlayStation Consoles","false","true","Sprint Buyback: You could earn up to $300 in credit towards a new device when you recycle your old eligible model from any carrier. Or donate the proceeds from your recycled phones with Sprint Project Connect.","","false","false","false","false"
"Lebanon County Door-to Door HHW Collection","Lebanon County Door-to Door HHW Collection","1610 Russell Rd","Lebanon","Lebanon","PA","17046","8004497587","0","","http://www.portal.state.pa.us","40.36337","-76.49428","10.1098320649339","Glue & Adhesives; Antifreeze; Brake Fluid; Lead Acid (Pb) Batteries; Cell Phones; Compact Fluorescent Lights; Computer Monitors; Degreasers; Electronics; Fertilizer; Fluorescent Lamps/Tubes; Fungicides; Gasoline and Unwanted Fuels; Herbicides; Household Cleaners; Insecticides; Mercury Containing Items; Office Equipment; Unused Paint; Latex Paint; Paint Thinner; Pesticides; Photography Chemicals; Pool Chemicals; Solvents; Telephones; Televisions; Transmission Fluid; Used Motor Oil; Oil Filters; MP3 Players","false","true","This program is organized by Curbside Inc.  This annual program is offered to Lebanon County residents for door-to-door collection of household hazardous waste.  To arrange for a pick-up residents must call the toll-free hotline.","","false","false","false","false"
"Tires Plus Store","Tires Plus Store","1015 S 29th St","Harrisburg","Dauphin","PA","17111","7175647920","0","","http://www.firestone.com","40.2569","-76.83923","10.2922669189754","Lead Acid (Pb) Batteries; Used Motor Oil; Computer (Recycling); Computer Monitors; Electronics; Laptop Computers; Computer Peripherals; Printers/Scanners/Fax Machines; Small Televisions; Tablets; Televisions; Video Game Consoles; PlayStation Consoles","false","true","","","false","false","false","false"
"True Value Hardware #5960","True Value Hardware #5960","509 S 29th St","Harrisburg","Dauphin","PA","17104","7175589935","0","","http://www.truevalue.com","40.26741","-76.84123","10.3442397163492","Transmission Fluid; Used Motor Oil; Computer (Recycling); Computer Monitors; Electronics; Laptop Computers; Computer Peripherals; Printers/Scanners/Fax Machines; Small Televisions; Tablets; Televisions; Video Game Consoles; PlayStation Consoles","false","true","","","false","false","false","false"
"Advance Auto Parts","Advance Auto Parts","2890 Paxton St","Harrisburg","Dauphin","PA","17111","7175614543","0","Monday: 7:00 AM - 9:00 PM Tuesday: 7:00 AM - 9:00 PM Wednesday: 7:00 AM - 9:00 PM Thursday: 7:00 AM - 9:00 PM Friday: 7:00 AM - 9:00 PM Saturday: 7:00 AM - 9:00 PM Sunday: 10:00 AM - 8:00 PM ","http://www.advanceautoparts.com","40.25618","-76.84029","10.3533203320848","Lead Acid (Pb) Batteries; Used Motor Oil; Computer (Recycling); Computer Monitors; Electronics; Laptop Computers; Computer Peripherals; Printers/Scanners/Fax Machines; Small Televisions; Tablets; Televisions; Video Game Consoles; PlayStation Consoles","false","true","","","false","false","false","false"
"Weis Markets","Weis Markets","4300 Linglestown Rd","Harrisburg","Dauphin","PA","17112","7175406010","0","","","40.33631","-76.82395","10.3897816763733","Plastic Shopping Bags; Food Storage Bags; Computer (Recycling); Computer Monitors; Electronics; Laptop Computers; Computer Peripherals; Printers/Scanners/Fax Machines; Small Televisions; Tablets; Televisions; Video Game Consoles; PlayStation Consoles","false","true","The recycle bin is located inside of the store.","","false","false","false","false"
"Henise Tire Service Inc.","Henise Tire Service Inc.","558 E Penn Ave","Cleona","Lebanon","PA","17042","7172722102","0","","","40.33877","-76.46574","10.4901263168348","Used Motor Oil; Used Tires; Computer (Recycling); Computer Monitors; Electronics; Laptop Computers; Computer Peripherals; Printers/Scanners/Fax Machines; Small Televisions; Tablets; Televisions; Video Game Consoles; PlayStation Consoles","false","true","","","false","false","false","false"
"AT&T Wireless","AT&T Wireless","2545 Brindle Dr","Harrisburg","Dauphin","PA","17110","2236663983","0","","http://www.att.com/","40.30468","-76.84118","10.5622455793395","Cell Phones; Ni-Cd Batteries; Batteries (Rechargeable); Cell Phone Batteries; Tablets; Li-Ion Batteries; Computer (Recycling); Computer Monitors; Electronics; Laptop Computers; Computer Peripherals; Printers/Scanners/Fax Machines; Small Televisions; Televisions; Video Game Consoles; PlayStation Consoles","false","true","Receive an AT&T Promotion Card worth the trade-in value of your smartphone, tablet, or netbook. You can also donate the trade-in value to Cell Phones for Soldiers.","","false","false","false","false"
"USPS Post Office Box Lobby Recycling Program","US Post Office","10 Main St","Ono","Lebanon","PA","17077","8002758777","0","","https://www.usps.com/","40.40373","-76.53592","10.7128361014724","Catalogs; Greeting Cards; Magazines; Paper (Mixed)","false","true","","","false","false","false","false"
"Advance Auto Parts","Advance Auto Parts","350 N Front St","Steelton","Dauphin","PA","17113","7179861687","0","Monday: 7:00 AM - 9:00 PM Tuesday: 7:00 AM - 9:00 PM Wednesday: 7:00 AM - 9:00 PM Thursday: 7:00 AM - 9:00 PM Friday: 7:00 AM - 9:00 PM Saturday: 7:00 AM - 9:00 PM Sunday: 10:00 AM - 8:00 PM ","http://www.advanceautoparts.com","40.23641","-76.84476","10.8237241760874","Lead Acid (Pb) Batteries; Used Motor Oil; Computer (Recycling); Computer Monitors; Electronics; Laptop Computers; Computer Peripherals; Printers/Scanners/Fax Machines; Small Televisions; Tablets; Televisions; Video Game Consoles; PlayStation Consoles","false","true","","","false","false","false","false"
"Dauphin County Recycling Center","","1620 South 19th Street","Harrisburg","","PA","17104","7179826772","0","","http://www.dauphincounty.org/government/","40.24779","-76.8514754","11.0165577220505","","false","false","","","false","false","false","false"
"Dauphin County Recycling Center","Dauphin County Recycling Center","1620 S 19th St","Harrisburg","Dauphin","PA","17104","7179826772","7179826773","Monday: 8:30 AM - 4:30 PM Tuesday: 8:30 AM - 4:30 PM Thursday: 8:30 AM - 4:30 PM Friday: 8:30 AM - 4:30 PM Wednesday: 8:30 AM - 8:30 PM Saturday: 9:00 AM - 2:00 PM ","http://www.dauphincounty.org/Pages/default.aspx","40.24824","-76.85177","11.0270107377736","Plastic #6 (Polystyrene); Cell Phones; Computer Monitors; Computer (Recycling); Electronics; Large Household Appliances; Mercury Containing Items; MP3 Players; Laptop Computers; Computer Peripherals; Printers/Scanners/Fax Machines; Small Televisions; Tablets; Televisions; Video Game Consoles; PlayStation Consoles","false","true","(located in City of Harrisburg's Public Works Complex). Confidential document shredding available.","","false","false","false","false"
"AT&T Wireless","AT&T Wireless","2420 Cumberland Street","Lebanon","Lebanon County","PA","17042","7172790600","0","","http://www.att.com/","40.33931","-76.4527584","11.1256760901907","Cell Phones; Ni-Cd Batteries; Batteries (Rechargeable); Cell Phone Batteries; Tablets; Li-Ion Batteries; Computer (Recycling); Computer Monitors; Electronics; Laptop Computers; Computer Peripherals; Printers/Scanners/Fax Machines; Small Televisions; Televisions; Video Game Consoles; PlayStation Consoles","false","true","Receive an AT&T Promotion Card worth the trade-in value of your smartphone, tablet, or netbook. You can also donate the trade-in value to Cell Phones for Soldiers.","","false","false","false","false"
"RadioShack","RadioShack","2205 Lebanon Valley Mall","Lebanon","Lebanon","PA","17042","7172742149","0","Monday: 10:00 AM - 9:00 PM Tuesday: 10:00 AM - 9:00 PM Wednesday: 10:00 AM - 9:00 PM Thursday: 10:00 AM - 9:00 PM Friday: 10:00 AM - 9:00 PM Saturday: 10:00 AM - 9:00 PM Sunday: 11:00 AM - 5:00 PM ","","40.3402","-76.45324","11.1280489270041","Cell Phones; Ni-Cd Batteries; Batteries (Rechargeable); Cell Phone Batteries; Computer (Recycling); Computer Monitors; Electronics; Laptop Computers; Computer Peripherals; Printers/Scanners/Fax Machines; Small Televisions; Tablets; Televisions; Video Game Consoles; PlayStation Consoles","false","true","","","false","false","false","false"
"Derry Township","Derry Township","650 Clearwater Rd","Hershey","Dauphin","PA","17033","6073212079","0","Monday: 4:00 AM - 8:00 PM Friday: 8:00 AM - 3:00 PM Saturday: 8:00 AM - 1:00 PM ","","40.28184","-76.68336","2.10695871291778","Electronics; MP3 Players; Computer (Recycling); Computer Monitors; Laptop Computers; Computer Peripherals; Printers/Scanners/Fax Machines; Small Televisions; Tablets; Televisions; Video Game Consoles; PlayStation Consoles","false","true","","","false","false","false","false"
"Derry Township Recycling Center","","650 Clearwater Rd","Hershey","","PA","17033","7175332057","0","","https://www.derrytownship.org/resident-services/trash-and-recycling","40.28495","-76.682624","2.14368282418396","","false","false","","","false","false","false","false"
"Mail Boxes Etc.","","1152 Mae St","Hummelstown","","PA","17036","7175346245","0","","","40.2698744","-76.6859815","2.16335757545066","","false","false","","","false","false","false","false"
"Mail Boxes Etc.","Mail Boxes Etc.","1152 Mae St","Hummelstown","Dauphin","PA","17036","7175346245","0","","","40.27016","-76.68809","2.27226304826931","Plastic #1 (PETE); Plastics (Other); Packing Peanut (Reuse); Computer (Recycling); Computer Monitors; Electronics; Laptop Computers; Computer Peripherals; Printers/Scanners/Fax Machines; Small Televisions; Tablets; Televisions; Video Game Consoles; PlayStation Consoles","false","true","","","false","false","false","false"
"NAPA Auto Parts","NAPA Auto Parts","25 S Water St","Hummelstown","Dauphin","PA","17036","7175669595","0","","null","40.26469","-76.70574","3.24498269317947","Lead Acid (Pb) Batteries; Computer (Recycling); Computer Monitors; Electronics; Laptop Computers; Computer Peripherals; Printers/Scanners/Fax Machines; Small Televisions; Tablets; Televisions; Video Game Consoles; PlayStation Consoles","false","true","","","false","false","false","false"
"Palmyra Auto Service","","130 West Main Street","Palmyra","","PA","17078","7178386385","0","","","40.3061317","-76.5978994","3.38578792325714","","false","false","","","false","false","false","false"
"Palmyra Auto Service","","130 W Main St","Palmyra","","PA","17078","7178386385","0","","","40.3061317","-76.5978994","3.38578792325714","","false","false","","","false","false","false","false"
"Palmyra Auto Service","Palmyra Auto Service","130 W Main St","Palmyra","Lebanon","PA","17078","7178386385","0","","null","40.30664","-76.59742","3.42817087614771","Antifreeze; Lead Acid (Pb) Batteries; Used Motor Oil; Used Tires; Computer (Recycling); Computer Monitors; Electronics; Laptop Computers; Computer Peripherals; Printers/Scanners/Fax Machines; Small Televisions; Tablets; Televisions; Video Game Consoles; PlayStation Consoles","false","true","","","false","false","false","false"
"Dayne's Auto Center","Dayne's Auto Center","328 E Main St","Palmyra","Lebanon","PA","17078","7178385321","0","","","40.30955","-76.59148","3.79496069018327","Lead Acid (Pb) Batteries; Used Motor Oil; Used Tires; Computer (Recycling); Computer Monitors; Electronics; Laptop Computers; Computer Peripherals; Printers/Scanners/Fax Machines; Small Televisions; Tablets; Televisions; Video Game Consoles; PlayStation Consoles","false","true","","","false","false","false","false"
"Klick-Lewis, Inc.","Klick-Lewis, Inc.","720 E Main St","Palmyra","Lebanon","PA","17078","7178381353","0","","","40.31187","-76.58673","4.08861917111904","Lead Acid (Pb) Batteries; Used Tires; Computer (Recycling); Computer Monitors; Electronics; Laptop Computers; Computer Peripherals; Printers/Scanners/Fax Machines; Small Televisions; Tablets; Televisions; Video Game Consoles; PlayStation Consoles","false","true","","","false","false","false","false"
"In Gear Cycling & Fitness","In Gear Cycling & Fitness","9030 bridge rd","Hummelstown","Dauphin ","PA","17036","7175660455","0","","","40.2624658","-76.7268306","4.36683118229924","E-Bike Batteries","false","true","Call or Check Online for Hours","Call2Recycle","false","false","false","false"
"Lowe's","Lowe's","70 N Londonderry Sq","Palmyra","Lebanon","PA","17078","7174732030","0","Monday: 6:00 AM - 10:00 PM Tuesday: 6:00 AM - 10:00 PM Wednesday: 6:00 AM - 10:00 PM Thursday: 6:00 AM - 10:00 PM Friday: 6:00 AM - 10:00 PM Saturday: 6:00 AM - 10:00 PM Sunday: 8:00 AM - 7:00 PM ","http://www.lowes.com/cd_Recycling_368967519_","40.31929","-76.56969","5.10603018543637","Compact Fluorescent Lights; Ni-Cd Batteries; Batteries (Rechargeable); Plant Trays, Pots & Tags; Computer (Recycling); Computer Monitors; Electronics; Laptop Computers; Computer Peripherals; Printers/Scanners/Fax Machines; Small Televisions; Tablets; Televisions; Video Game Consoles; PlayStation Consoles","false","true","","","false","false","false","false"
"Call2Recycle at Lowe's","Call2Recycle at Lowe's","70 N Londonderry Sq","Palmyra","Lebanon","PA","17078","7174732030","0","Monday: 6:00 AM - 10:00 PM Tuesday: 6:00 AM - 10:00 PM Wednesday: 6:00 AM - 10:00 PM Thursday: 6:00 AM - 10:00 PM Friday: 6:00 AM - 10:00 PM Saturday: 6:00 AM - 10:00 PM Sunday: 8:00 AM - 8:00 PM ","http://www.lowes.com/","40.31929","-76.56969","5.10603018543637","Cell Phones; Compact Fluorescent Lights; Ni-Cd Batteries; Plastic Shopping Bags; Li-Ion Batteries; Ni-MH Batteries; Ni-Zn Batteries; Small Sealed Lead Acid Batteries; Computer (Recycling); Computer Monitors; Electronics; Laptop Computers; Computer Peripherals; Printers/Scanners/Fax Machines; Small Televisions; Tablets; Televisions; Video Game Consoles; PlayStation Consoles; Batteries (Rechargeable); Cell Phone Batteries; Li-Ion Batteries; Ni-Cd Batteries; Ni-MH Batteries; Small Sealed Lead Acid Batteries; Cell Phones","false","true","As an environmentally-committed retailer, Lowes offers a recycling center near store entrances to give consumers a free and easy way to properly dispose of rechargeable batteries, cell phones, CFLs and plastic shopping bags; materials that otherwise could be potentially harmful to the environment.  Look for the recycling center or ask a store associate for more details.","Call2Recycle","false","false","false","false"
"Lower Paxton Township Compost Facility","","Conway Rd","Harrisburg","","PA","17111","7176575600","0","","https://www.lowerpaxton-pa.gov/index.php","40.2797152","-76.758592","5.99876721275475","","false","false","","","false","false","false","false"
"Frank's Foreign Cars","","2777 E Harrisburg Pike","Middletown","","PA","17057","7179442757","0","","","40.191628","-76.686854","6.03191822705012","","false","false","","","false","false","false","false"
"Frank's Foreign Cars","Frank's Foreign Cars","2777 E Harrisburg Pike","Middletown","Dauphin","PA","17057","7179442757","0","","null","40.19135","-76.68693","6.05126653821133","Antifreeze; Lead Acid (Pb) Batteries; Transmission Fluid; Used Motor Oil; Oil Filters; Used Tires; Computer (Recycling); Computer Monitors; Electronics; Laptop Computers; Computer Peripherals; Printers/Scanners/Fax Machines; Small Televisions; Tablets; Televisions; Video Game Consoles; PlayStation Consoles","false","true","","","false","false","false","false"
"Giant Food Inc.","Giant Food Inc.","450 E Main St","Middletown","Dauphin","PA","17057","7179481606","0","Sunday: 12:00 AM - 11:59 PM Monday: 12:00 AM - 11:59 PM Tuesday: 12:00 AM - 11:59 PM Wednesday: 12:00 AM - 11:59 PM Thursday: 12:00 AM - 11:59 PM Friday: 12:00 AM - 11:59 PM Saturday: 12:00 AM - 11:59 PM ","null","40.20124","-76.72353","6.45125841659776","Plastic Shopping Bags; Food Storage Bags; Computer (Recycling); Computer Monitors; Electronics; Laptop Computers; Computer Peripherals; Printers/Scanners/Fax Machines; Small Televisions; Tablets; Televisions; Video Game Consoles; PlayStation Consoles","false","true","","","false","false","false","false"
"Annville Equipment Company","Annville Equipment Company","470 Palmyra Bellegrove Rd","Annville","Lebanon","PA","17003","7178674631","0","","null","40.3463","-76.56212","6.69590121702813","Lead Acid (Pb) Batteries; Used Motor Oil; Computer (Recycling); Computer Monitors; Electronics; Laptop Computers; Computer Peripherals; Printers/Scanners/Fax Machines; Small Televisions; Tablets; Televisions; Video Game Consoles; PlayStation Consoles","false","true","","","false","false","false","false"
"Walmart","Walmart","6535 Grayson Rd","Harrisburg","Dauphin","PA","17111","7175618402","0","","http://www.walmart.com","40.26235","-76.77174","6.71406652314151","Lead Acid (Pb) Batteries; Plastic Shopping Bags; Food Storage Bags; Computer (Recycling); Computer Monitors; Electronics; Laptop Computers; Computer Peripherals; Printers/Scanners/Fax Machines; Small Televisions; Tablets; Televisions; Video Game Consoles; PlayStation Consoles","false","true","","","false","false","false","false"
"Zeager Brothers  Inc.","","4000 E Harrisburg Pike","Middletown","","PA","17057","7179447481","0","","","40.177067","-76.666686","6.71913040900548","","false","false","","","false","false","false","false"
"QBP-East","","400 First Street Extension","Middletown","","PA","17057","7179480720","0","","https://www.ecologicdesigns.com/","40.2082598","-76.7406957","6.73453029635032","","false","false","","","false","false","false","false"
"Tractor Supply","Tractor Supply","7150 Allentown Blvd","Harrisburg","Dauphin","PA","17112","7176573945","0","","http://www.tractorsupply.com","40.33136","-76.74852","6.78069274702685","Transmission Fluid; Used Motor Oil; Computer (Recycling); Computer Monitors; Electronics; Laptop Computers; Computer Peripherals; Printers/Scanners/Fax Machines; Small Televisions; Tablets; Televisions; Video Game Consoles; PlayStation Consoles","false","true","","","false","false","false","false"
"Green Guru Recycling Drop-off - QBP - East","Green Guru Recycling Drop-off - QBP - East","400 1st St","Middletown","Dauphin","PA","17057","7179480720","0","","http://www.greengurugear.com/recycling.html","40.20745","-76.74331","6.87502173119281","Sporting Goods; Bike Inner Tubes; Computer (Recycling); Computer Monitors; Electronics; Laptop Computers; Computer Peripherals; Printers/Scanners/Fax Machines; Small Televisions; Tablets; Televisions; Video Game Consoles; PlayStation Consoles","false","true","Green Guru accepts climbing rope, tent and rain flys, road and mountain bike inner tubes, and neoprene wetsuits. Different locations may only accept certain items - please contact individual location or visit website for details.","","false","false","false","false"
"Mail Boxes Etc.","","6301 Grayson Rd","Harrisburg","","PA","17111","7175618003","0","","","40.2605214","-76.7765718","6.98179582531716","","false","false","","","false","false","false","false"
"Mail Boxes Etc.","Mail Boxes Etc.","6301 Grayson Rd","Harrisburg","Dauphin","PA","17111","7175618003","0","","","40.26163","-76.77734","7.01300412705001","Plastics (Other); Packing Peanut (Reuse); Computer (Recycling); Computer Monitors; Electronics; Laptop Computers; Computer Peripherals; Printers/Scanners/Fax Machines; Small Televisions; Tablets; Televisions; Video Game Consoles; PlayStation Consoles","false","true","","","false","false","false","false"
"US Post Office","US Post Office","330 W Main St ","Middletown","Dauphin County","PA","17057","8002758777","0","","","40.1968799","-76.7353154","7.08666716788142","Catalogs; Greeting Cards; Magazines; Paper (Mixed)","false","true","","","false","false","false","false"
"BHM Farm Equipment, Inc.","BHM Farm Equipment, Inc.","683 N State Route 934","Annville","Lebanon","PA","17003","7178672211","0","Monday: 9:00 AM - 5:00 PM Tuesday: 9:00 AM - 5:00 PM Wednesday: 9:00 AM - 5:00 PM Thursday: 9:00 AM - 5:00 PM Friday: 9:00 AM - 5:00 PM Saturday: 8:00 AM - 12:00 PM ","","40.3399","-76.53793","7.30222851693913","Used Motor Oil; Computer (Recycling); Computer Monitors; Electronics; Laptop Computers; Computer Peripherals; Printers/Scanners/Fax Machines; Small Televisions; Tablets; Televisions; Video Game Consoles; PlayStation Consoles","false","true","","","false","false","false","false"
"USPS Post Office Box Lobby Recycling Program","US Post Office","51 N Lancaster St","Annville","Lebanon","PA","17003","8002758777","0","","https://www.usps.com/","40.32983","-76.51758","7.78691069701326","Catalogs; Greeting Cards; Magazines; Paper (Mixed)","false","true","","","false","false","false","false"
"US Post Office","USPS Discarded Lobby Mail Recycling Program","51 N Lancaster St","Annville","Lebanon","PA","17003","0","0","","","40.32983","-76.51758","7.78691069701326","Computer (Recycling); Computer Monitors; Electronics; Laptop Computers; Computer Peripherals; Printers/Scanners/Fax Machines; Small Televisions; Tablets; Televisions; Video Game Consoles; PlayStation Consoles","false","true","","","false","false","false","false"
"BHM Farm Equipment Inc.","BHM Farm Equipment Inc.","683 PA-934 ","Annville","Lebanon County","PA","17003","7178672211","0","","null","40.3197031","-76.5090712","7.86502875838508","Used Motor Oil; Computer (Recycling); Computer Monitors; Electronics; Laptop Computers; Computer Peripherals; Printers/Scanners/Fax Machines; Small Televisions; Tablets; Televisions; Video Game Consoles; PlayStation Consoles","false","true","","","false","false","false","false"
"Weis Markets","Weis Markets","1629 S Market St","Elizabethtown","Lancaster","PA","17022","7173610171","0","Monday: 7:00 AM - 10:00 PM Tuesday: 7:00 AM - 10:00 PM Wednesday: 7:00 AM - 10:00 PM Thursday: 7:00 AM - 10:00 PM Friday: 7:00 AM - 10:00 PM Saturday: 7:00 AM - 10:00 PM Sunday: 7:00 AM - 9:00 PM ","","40.15965","-76.63012","7.86561935756956","Plastic Shopping Bags; Food Storage Bags; Computer (Recycling); Computer Monitors; Electronics; Laptop Computers; Computer Peripherals; Printers/Scanners/Fax Machines; Small Televisions; Tablets; Televisions; Video Game Consoles; PlayStation Consoles","false","true","The recycle bin is located inside of the store.","","false","false","false","false"
"USPS Post Office Box Lobby Recycling Program","US Post Office","5120 Derry St","Harrisburg","Dauphin","PA","17111","8002758777","0","","https://www.usps.com/","40.25915","-76.79743","8.08491512823992","Catalogs; Greeting Cards; Magazines; Paper (Mixed)","false","true","","","false","false","false","false"
