name,description,address,city,region,province,postal_code,phone,fax,hours,url,latitude,longitude,distance,materials,pickup,dropoff,notes,groups,curbside,municipal,national,event_only
"US Post Office","USPS Discarded Lobby Mail Recycling Program","5120 Derry St","Harrisburg","Dauphin","PA","17111","0","0","","","40.25915","-76.79743","8.08491512823992","Computer (Recycling); Computer Monitors; Electronics; Laptop Computers; Computer Peripherals; Printers/Scanners/Fax Machines; Small Televisions; Tablets; Televisions; Video Game Consoles; PlayStation Consoles","false","true","","","false","false","false","false"
"Mail Boxes Etc.","","6059 Allentown Blvd","Harrisburg","","PA","17112","7175408033","0","","","40.322005","-76.7864092","8.18045237797891","","false","false","","","false","false","false","false"
"Lasher's Garage","Lasher's Garage","812 Horseshoe Pike","Lebanon","Lebanon","PA","17042","7178672221","0","","","40.28466","-76.49066","8.18269386236746","Lead Acid (Pb) Batteries; Used Motor Oil; Computer (Recycling); Computer Monitors; Electronics; Laptop Computers; Computer Peripherals; Printers/Scanners/Fax Machines; Small Televisions; Tablets; Televisions; Video Game Consoles; PlayStation Consoles","false","true","","","false","false","false","false"
"American Foundation for Children with AIDS","","6221 Blue Grass Ave","Harrisburg","","PA","17112","7174890206","0","","http://www.AFCAids.org/","40.3329811","-76.7838063","8.40277944111503","","false","false","","","false","false","false","false"
"The Salvation Army","null","5051 Hampton Court Rd ","Harrisburg","Dauphin County","PA","17112","8007287825","0","Monday: 9:00 AM - 9:00 PM Tuesday: 9:00 AM - 9:00 PM Wednesday: 9:00 AM - 9:00 PM Thursday: 9:00 AM - 9:00 PM Friday: 9:00 AM - 9:00 PM Saturday: 9:00 AM - 9:00 PM Sunday:  -  ","http://www.salvationarmyusa.org","40.3070957","-76.8000992","8.50114444786022","Bikes; Books (Reuse); CD/DVD/Blu-ray/UHD discs; Cell Phones; Children's Toys; Clothing; Computer (Reuse); Hard Drives; Computer Monitors; Cameras; DVD Players/Blu-Ray Players/DVRs; Electronics; E-Readers; Furniture; Gift Bags; Headphones; Household Goods; Laptop Computers; Lawn Equipment; Miscellaneous Tools; MP3 Players; Musical Instruments; Network Equipment; Ornaments; Computer Peripherals; Portable Media Players; Printers/Scanners/Fax Machines; Reusable Appliance Donation; Small Appliances; Small Electronics; Small Televisions; Sporting Goods; Stereo Equipment; Tablets; Telephones; Televisions; VCRs; VHS & Cassette Tapes; Video Game Systems; Blu-Ray Players; Digital Converter Boxes; Computer (Recycling); Video Game Consoles; PlayStation Consoles","false","true","","Sony, Vizio, OEM, Salvation Army","false","false","false","false"
"Cosey's Sunoco Service","Cosey's Sunoco Service","116 N Mountain Rd","Harrisburg","Dauphin","PA","17112","7176524939","0","","","40.32588","-76.79136","8.52972721936898","Used Motor Oil; Computer (Recycling); Computer Monitors; Electronics; Laptop Computers; Computer Peripherals; Printers/Scanners/Fax Machines; Small Televisions; Tablets; Televisions; Video Game Consoles; PlayStation Consoles","false","true","","","false","false","false","false"
"Target","Target","4600 High Pointe Blvd","Harrisburg","Dauphin","PA","17111","7175584150","0","","http://www.target.com/","40.24504","-76.80293","8.53962439620603","Aluminum Cans; Cell Phones; Inkjet Printer Cartridges; MP3 Players; Plastic #1 (PETE); Plastic #2 (HDPE); Plastic Shopping Bags; Computer (Recycling); Computer Monitors; Electronics; Laptop Computers; Computer Peripherals; Printers/Scanners/Fax Machines; Small Televisions; Tablets; Televisions; Video Game Consoles; PlayStation Consoles","false","true","","","false","false","false","false"
"Battery Warehouse Harrisburg","Battery Warehouse Harrisburg","5399 Jonestown Rd","Harrisburg","Dauphin","PA","17112","7176520565","0","Saturday: 9:00 AM - 5:00 PM Monday: 9:00 AM - 7:00 PM Tuesday: 9:00 AM - 7:00 PM Wednesday: 9:00 AM - 7:00 PM Thursday: 9:00 AM - 7:00 PM Friday: 9:00 AM - 7:00 PM ","http://www.batterywarehouse.net/","40.3154","-76.79763","8.55522721175525","Lead Acid (Pb) Batteries; Computer (Recycling); Computer Monitors; Electronics; Laptop Computers; Computer Peripherals; Printers/Scanners/Fax Machines; Small Televisions; Tablets; Televisions; Video Game Consoles; PlayStation Consoles","false","true","","","false","false","false","false"
"Call2Recycle at Grainger","Call2Recycle at Grainger","4320 Lewis Rd","Harrisburg","Dauphin","PA","17111","7175618322","0","","http://www.grainger.com/","40.25185","-76.80517","8.56189745404355","Cell Phones; Ni-Cd Batteries; Li-Ion Batteries; Ni-MH Batteries; Ni-Zn Batteries; Small Sealed Lead Acid Batteries; Computer (Recycling); Computer Monitors; Electronics; Laptop Computers; Computer Peripherals; Printers/Scanners/Fax Machines; Small Televisions; Tablets; Televisions; Video Game Consoles; PlayStation Consoles","false","true","The U.S. EPA estimates that more than 350 million rechargeable batteries are purchased annually in the U.S. Thanks to the environmental commitment of this location, its easy and free to recycle your batteries. Bring your rechargeable batteries to this location and look for the recycling box or ask an associate how you can do your part for the environment.","","false","false","false","false"
"Home Depot","Home Depot","5101 Jonestown Rd","Harrisburg","Dauphin","PA","17112","7176519699","0","","http://www.homedepot.com","40.31382","-76.79912","8.5925939869241","Compact Fluorescent Lights; Batteries (Rechargeable); Computer (Recycling); Computer Monitors; Electronics; Laptop Computers; Computer Peripherals; Printers/Scanners/Fax Machines; Small Televisions; Tablets; Televisions; Video Game Consoles; PlayStation Consoles","false","true","Home Depot accepts compact fluorescent bulbs and used power tool rechargeable batteries. Look for the orange drop boxes, usually located near the front entrance near the customer service desk.","","false","false","false","false"
"Call2Recycle at the Home Depot","Call2Recycle at the Home Depot","5101 Jonestown Rd","Harrisburg","Dauphin","PA","17112","7176519699","0","","http://www.homedepot.com/","40.31382","-76.79912","8.5925939869241","Cell Phones; Compact Fluorescent Lights; Ni-Cd Batteries; Li-Ion Batteries; Ni-MH Batteries; Ni-Zn Batteries; Small Sealed Lead Acid Batteries; Computer (Recycling); Computer Monitors; Electronics; Laptop Computers; Computer Peripherals; Printers/Scanners/Fax Machines; Small Televisions; Tablets; Televisions; Video Game Consoles; PlayStation Consoles; Batteries (Rechargeable); Cell Phone Batteries; Li-Ion Batteries; Ni-Cd Batteries; Ni-MH Batteries; Small Sealed Lead Acid Batteries","false","true","The Home Depot accepts used rechargeable batteries and compact fluorescent bulbs. Look for the orange drop boxes, usually located near the front entrance near the customer service desk, or ask a store associate for more details.","Call2Recycle","false","false","false","false"
"Target","Target","5125 Jonestown Rd Ste 331","Harrisburg","Dauphin","PA","17112","7176718098","0","","http://www.target.com/","40.31304","-76.79985","8.61147863841193","Aluminum Cans; Cell Phones; Inkjet Printer Cartridges; MP3 Players; Plastic #1 (PETE); Plastic #2 (HDPE); Plastic Shopping Bags; Computer (Recycling); Computer Monitors; Electronics; Laptop Computers; Computer Peripherals; Printers/Scanners/Fax Machines; Small Televisions; Tablets; Televisions; Video Game Consoles; PlayStation Consoles","false","true","","","false","false","false","false"
"Call2Recycle at Verizon Wireless","Call2Recycle at Verizon Wireless","4672 High Pointe Blvd ","Harrisburg","Dauphin County","PA","17111","7175460454","0","","http://www.verizon.com/","40.2462428","-76.8071625","8.73920127517347","Cell Phones; Ni-Cd Batteries; Li-Ion Batteries; Ni-MH Batteries; Ni-Zn Batteries; Small Sealed Lead Acid Batteries; Computer (Recycling); Computer Monitors; Electronics; Laptop Computers; Computer Peripherals; Printers/Scanners/Fax Machines; Small Televisions; Tablets; Televisions; Video Game Consoles; PlayStation Consoles","false","true","The U.S. EPA estimates that more than 350 million rechargeable batteries are purchased annually in the U.S. Thanks to the environmental commitment of this location, its easy and free to recycle your batteries. Bring your rechargeable batteries to this location and look for the recycling box or ask an associate how you can do your part for the environment.","","false","false","false","false"
"Pep Boys","","4949 Jonestown Rd","Harrisburg","","PA","17109","7176574941","0","","","40.3055256","-76.8055072","8.74681767254982","","false","false","","","false","false","false","false"
"Pearle Vision Center","Pearle Vision Center","5030 Jonestown Rd","Harrisburg","Dauphin","PA","17112","7176570802","0","Monday: 10:00 AM - 9:00 PM Tuesday: 10:00 AM - 9:00 PM Wednesday: 10:00 AM - 9:00 PM Thursday: 10:00 AM - 9:00 PM Friday: 10:00 AM - 9:00 PM Saturday: 10:00 AM - 6:00 PM Sunday: 12:00 PM - 5:00 PM ","","40.30775","-76.80471","8.74712432480707","Eyeglasses; Computer (Recycling); Computer Monitors; Electronics; Laptop Computers; Computer Peripherals; Printers/Scanners/Fax Machines; Small Televisions; Tablets; Televisions; Video Game Consoles; PlayStation Consoles","false","true","This site accepts eyeglasses and all types of sunglasses in any condition.","","false","false","false","false"
"Call2Recycle at the Home Depot","Call2Recycle at the Home Depot","4200 Derry Street","Swatara","Dauphin","PA","17111","7175588105","0","","http://www.homedepot.com/","40.25813","-76.81024","8.76391949785207","Cell Phones; Compact Fluorescent Lights; Ni-Cd Batteries; Li-Ion Batteries; Ni-MH Batteries; Ni-Zn Batteries; Small Sealed Lead Acid Batteries; Computer (Recycling); Computer Monitors; Electronics; Laptop Computers; Computer Peripherals; Printers/Scanners/Fax Machines; Small Televisions; Tablets; Televisions; Video Game Consoles; PlayStation Consoles","false","true","The Home Depot accepts used rechargeable batteries and compact fluorescent bulbs. Look for the orange drop boxes, usually located near the front entrance near the customer service desk, or ask a store associate for more details.","","false","false","false","false"
"Best Buy","Best Buy","5000 Jonestown Rd ","Harrisburg","Dauphin County","PA","17112","7176510980","0","","https://www.bestbuy.com/recycle","40.3078975","-76.8054924","8.78956077507944","Large Household Appliances; Refrigerators; Televisions; AC Power Plugs; Batteries (Rechargeable); Cables & Connectors; Car Audio/Video Equipment; Cell Phone Batteries; Cell Phones; Computer (Recycling); Hard Drives; Computer Monitors; Cameras; DVD Players/Blu-Ray Players/DVRs; Electronics; E-Readers; GPS Units; Headphones; Inkjet Printer Cartridges; Laptop Computers; Laser Toner Cartridges; Li-Ion Batteries; MP3 Players; Network Equipment; Ni-Cd Batteries; Ni-MH Batteries; Ni-Zn Batteries; Computer Peripherals; Portable Media Players; Printers/Scanners/Fax Machines; Small Electronics; Small Sealed Lead Acid Batteries; Stereo Equipment; Tablets; Telephones; UPS Batteries/Backup Systems; VCRs; Video Game Systems; Blu-Ray Players; Digital Converter Boxes; Small Televisions; Video Game Consoles; PlayStation Consoles","true","true","3 e-waste items per day; $19.99 pick-up fee with delivery; $99.99 standalone pickup fee; TVs and Monitors not accepted at Best Buy Stores","Sony, Vizio, OEM","false","false","false","false"
"Best Buy","","5000 Jonestown Rd","Harrisburg","","PA","17112","7176510980","0","","https://www.bestbuy.com/site/services/recycling/pcmcat149900050025.c?id=pcmcat149900050025","40.3078975","-76.8054924","8.78956077507944","","false","false","","","false","false","false","false"
"Batteries Plus","Batteries Plus","4909 Jonestown Rd","Harrisburg","Dauphin","PA","17109","7176521584","7175401945","","http://www.batteriesplus.com/store_details/188.aspx","40.30524","-76.80668","8.8015446450547","Compact Fluorescent Lights; Batteries (Rechargeable); Alkaline/Single-Use Batteries; Computer (Recycling); Computer Monitors; Electronics; Laptop Computers; Computer Peripherals; Printers/Scanners/Fax Machines; Small Televisions; Tablets; Televisions; Video Game Consoles; PlayStation Consoles","false","true","Some fees for battery recycling may apply.  Please contact your Local store for details. 
<p>
Batteries Plus lead by example by recycling the majority of the batteries we sell. Not only do we recycle to protect our environment, we support retail and business customers alike by keeping them in full compliance with federal, state, municipal, EPA and DOT regulations governing the disposal and recycling of spent batteries and select electronics.","","false","false","false","false"
"Home Depot","Home Depot","4200 Derry St","Harrisburg","Dauphin","PA","17111","7175588105","0","","http://www.homedepot.com","40.25796","-76.81116","8.81347301324259","Compact Fluorescent Lights; Batteries (Rechargeable); Computer (Recycling); Computer Monitors; Electronics; Laptop Computers; Computer Peripherals; Printers/Scanners/Fax Machines; Small Televisions; Tablets; Televisions; Video Game Consoles; PlayStation Consoles; Batteries (Rechargeable); Cell Phone Batteries; Li-Ion Batteries; Ni-Cd Batteries; Ni-MH Batteries; Small Sealed Lead Acid Batteries","false","true","Home Depot accepts compact fluorescent bulbs and used power tool rechargeable batteries. Look for the orange drop boxes, usually located near the front entrance near the customer service desk.","Call2Recycle","false","false","false","false"
"USPS Post Office Box Lobby Recycling Program","US Post Office","101 Princeton Ave","Mount Gretna","Lebanon","PA","17064","8002758777","0","","https://www.usps.com/","40.24562","-76.48004","8.90661868024576","Catalogs; Greeting Cards; Magazines; Paper (Mixed)","false","true","","","false","false","false","false"
"CAC","CAC","4120 Swatara Dr","Harrisburg","Dauphin","PA","17113","7178026101","0","","http://www.call2recycle.org/","40.24553","-76.81269","9.03452135201763","Cell Phones; Ni-Cd Batteries; Li-Ion Batteries; Ni-MH Batteries; Ni-Zn Batteries; Small Sealed Lead Acid Batteries; Computer (Recycling); Computer Monitors; Electronics; Laptop Computers; Computer Peripherals; Printers/Scanners/Fax Machines; Small Televisions; Tablets; Televisions; Video Game Consoles; PlayStation Consoles","false","true","The U.S. EPA estimates that more than 350 million rechargeable batteries are purchased annually in the U.S. Thanks to the environmental commitment of this location, its easy and free to recycle your batteries. Bring your rechargeable batteries to this location and look for the recycling box or ask an associate how you can do your part for the environment.","","false","false","false","false"
"K & C Communications","K & C Communications","4120 Swatara Dr","Harrisburg","Dauphin","PA","17113","7175610800","0","Monday: 8:30 AM - 4:30 PM Tuesday: 8:30 AM - 4:30 PM Wednesday: 8:30 AM - 4:30 PM Thursday: 8:30 AM - 4:30 PM Friday: 8:30 AM - 4:30 PM ","http://www.kccom.com","40.2456","-76.81289","9.04381767618168","Ni-Cd Batteries; Other Batteries; Batteries (Rechargeable); Computer (Recycling); Computer Monitors; Electronics; Laptop Computers; Computer Peripherals; Printers/Scanners/Fax Machines; Small Televisions; Tablets; Televisions; Video Game Consoles; PlayStation Consoles","false","true","","","false","false","false","false"
"Staples","Staples","4203 Union Deposit Rd","Harrisburg","Dauphin County","PA","17111","7175616010","0","Monday: 8:00 AM - 9:00 PM Tuesday: 8:00 AM - 9:00 PM Wednesday: 8:00 AM - 9:00 PM Thursday: 8:00 AM - 9:00 PM Friday: 8:00 AM - 9:00 PM Saturday: 9:00 AM - 9:00 PM Sunday: 10:00 AM - 6:00 PM ","https://www.staples.com/recycle","40.2783078","-76.8170434","9.06914041698832","AC Power Plugs; Batteries (Rechargeable); Cables & Connectors; Cell Phone Batteries; Cell Phones; Computer (Recycling); Hard Drives; Computer Monitors; Cameras; DVD Players/Blu-Ray Players/DVRs; Electronics; E-Readers; GPS Units; Headphones; Inkjet Printer Cartridges; Laptop Computers; Laser Toner Cartridges; Li-Ion Batteries; MP3 Players; Network Equipment; Ni-Cd Batteries; Ni-MH Batteries; Ni-Zn Batteries; Computer Peripherals; Portable Media Players; Printers/Scanners/Fax Machines; Small Electronics; Small Sealed Lead Acid Batteries; Stereo Equipment; Tablets; Telephones; UPS Batteries/Backup Systems; VCRs; Video Game Systems; Blu-Ray Players; Digital Converter Boxes; Small Televisions; Televisions; Video Game Consoles; PlayStation Consoles; Alkaline/Single-Use Batteries; Batteries (Rechargeable); Cell Phone Batteries; Li-Ion Batteries; Ni-Cd Batteries; Ni-MH Batteries; Small Sealed Lead Acid Batteries; Alkaline/Single-Use Batteries; Button Batteries; Non-rechargeable lithium batteries; Cell Phones","false","true","NO TVs; Limit 6 CEDs per day; ","Sony, Vizio, OEM, Call2Recycle","false","false","false","false"
"Verizon Wireless","Verizon Wireless","4650 Jonestown Rd","Harrisburg","Dauphin","PA","17109","8666444532","0","","http://www.verizonwireless.com/","40.30221","-76.81291","9.07070993800879","Cell Phones; Cell Phone Batteries; Computer (Recycling); Computer Monitors; Electronics; Laptop Computers; Computer Peripherals; Printers/Scanners/Fax Machines; Small Televisions; Tablets; Televisions; Video Game Consoles; PlayStation Consoles","false","true","<A Href="https://www.trade-in.vzw.com/home.aspx">
The Verizon Wireless Trade-In Program</A> allows you to trade in your used handset or tablet in a convenient and responsible way. 
<P>
<P>
Verizon Wireless works every day to protect our environment and give our customers opportunities to do the same. <A Href="http://aboutus.vzw.com/Green_Initiative/overview.html">Click here</A> for more examples of the earth-friendly initiatives and programs Verizon Wireless is proud to offer and support.","","false","false","false","false"
"AT&T Wireless","AT&T Wireless","4920 Jonestown Road","Harrisburg","Dauphin","PA","17109","7175457700","0","","http://www.att.com/","40.30156","-76.8146","9.14777516154227","Cell Phones; Ni-Cd Batteries; Batteries (Rechargeable); Cell Phone Batteries; Tablets; Li-Ion Batteries; Computer (Recycling); Computer Monitors; Electronics; Laptop Computers; Computer Peripherals; Printers/Scanners/Fax Machines; Small Televisions; Televisions; Video Game Consoles; PlayStation Consoles","false","true","Receive an AT&T Promotion Card worth the trade-in value of your smartphone, tablet, or netbook. You can also donate the trade-in value to Cell Phones for Soldiers.","","false","false","false","false"
"Batteries Plus Bulbs","","4513 Jonestown Rd","Harrisburg","","PA","17109","7176521584","0","","https://www.batteriesplus.com/store-locator/pa/188?utm_source=local&utm_medium=earth911","40.3001384","-76.8169082","9.24619613786866","","false","false","","","false","false","false","false"
"Lowe's","","4000 Union Deposit Rd","Harrisburg","","PA","17109","7175400660","0","","https://newsroom.lowes.com/responsibility/operational-excellence/","40.2801308","-76.8212791","9.29800281970128","Batteries (Rechargeable); Cell Phone Batteries; Li-Ion Batteries; Ni-Cd Batteries; Ni-MH Batteries; Small Sealed Lead Acid Batteries; Cell Phones","false","true","","Call2Recycle","false","false","false","false"
"Call2Recycle at Lowe's","Call2Recycle at Lowe's","4000 Union Deposit Rd","Harrisburg","Dauphin","PA","17109","7175400660","0","Monday: 6:00 AM - 10:00 PM Tuesday: 6:00 AM - 10:00 PM Wednesday: 6:00 AM - 10:00 PM Thursday: 6:00 AM - 10:00 PM Friday: 6:00 AM - 10:00 PM Saturday: 6:00 AM - 10:00 PM Sunday: 8:00 AM - 8:00 PM ","http://www.lowes.com/","40.27858","-76.82159","9.30935538161479","Cell Phones; Compact Fluorescent Lights; Ni-Cd Batteries; Plastic Shopping Bags; Li-Ion Batteries; Ni-MH Batteries; Ni-Zn Batteries; Small Sealed Lead Acid Batteries; Computer (Recycling); Computer Monitors; Electronics; Laptop Computers; Computer Peripherals; Printers/Scanners/Fax Machines; Small Televisions; Tablets; Televisions; Video Game Consoles; PlayStation Consoles","false","true","As an environmentally-committed retailer, Lowes offers a recycling center near store entrances to give consumers a free and easy way to properly dispose of rechargeable batteries, cell phones, CFLs and plastic shopping bags; materials that otherwise could be potentially harmful to the environment.  Look for the recycling center or ask a store associate for more details.","","false","false","false","false"
"Mail Boxes Etc.","","3863 Union Deposit Rd","Harrisburg","","PA","17109","7175614623","0","","","40.2750212","-76.8241386","9.43683888326507","","false","false","","","false","false","false","false"
"Colonial Park Mall 1","Colonial Park Mall 1","22 Colonial Rd ","Harrisburg","Dauphin","PA","17109","8583244111","0","","http://www.ecoatm.com/","40.299059","-76.8209429","9.4400120932516","Cell Phones; Tablets; MP3 Players; Computer (Recycling); Computer Monitors; Electronics; Laptop Computers; Computer Peripherals; Printers/Scanners/Fax Machines; Small Televisions; Televisions; Video Game Consoles; PlayStation Consoles","false","true","ecoATM is an automated, consumer self-serve kiosk that quickly buys back and recycles old phones, mp3 players and tablets.
</br>
Call or email <a href="mailto:max@ecoATM.com">customer support</a> with questions.","","false","false","false","false"
"Colonial Park Mall 2","Colonial Park Mall 2","22 Colonial Rd ","Harrisburg","Dauphin","PA","17109","8583244111","0","","http://www.ecoatm.com/","40.299059","-76.8209429","9.4400120932516","Cell Phones; Tablets; MP3 Players; Computer (Recycling); Computer Monitors; Electronics; Laptop Computers; Computer Peripherals; Printers/Scanners/Fax Machines; Small Televisions; Televisions; Video Game Consoles; PlayStation Consoles","false","true","ecoATM is an automated, consumer self-serve kiosk that quickly buys back and recycles old phones, mp3 players and tablets.
</br>
Call or email <a href="mailto:max@ecoATM.com">customer support</a> with questions.","","false","false","false","false"
"The Ups Store","The Ups Store","3915 Union Deposit Rd","Harrisburg","Dauphin","PA","17109","7175614623","0","Monday: 8:00 AM - 6:30 PM Tuesday: 8:00 AM - 6:30 PM Wednesday: 8:00 AM - 6:30 PM Thursday: 8:00 AM - 6:30 PM Friday: 8:00 AM - 6:30 PM Saturday: 8:30 AM - 2:00 PM ","http://www.theupsstore.com","40.27829","-76.82476","9.47552042153338","Packing Peanut (Reuse); Computer (Recycling); Computer Monitors; Electronics; Laptop Computers; Computer Peripherals; Printers/Scanners/Fax Machines; Small Televisions; Tablets; Televisions; Video Game Consoles; PlayStation Consoles","false","true","","","false","false","false","false"
"USPS Post Office Box Lobby Recycling Program","US Post Office","5901 Jonestown Rd","Harrisburg","Dauphin","PA","17112","8002758777","0","","https://www.usps.com/","40.33658","-76.80457","9.4822376065186","Catalogs; Greeting Cards; Magazines; Paper (Mixed)","false","true","","","false","false","false","false"
"US Post Office","US Post Office","5901 Jonestown Rd","Harrisburg","Dauphin","PA","17112","0","0","","https://www.usps.com/ship/recycle-through-usps.htm","40.33658","-76.80457","9.4822376065186","Inkjet Printer Cartridges; Computer (Recycling); Computer Monitors; Electronics; Laptop Computers; Computer Peripherals; Printers/Scanners/Fax Machines; Small Televisions; Tablets; Televisions; Video Game Consoles; PlayStation Consoles","false","true","Free, postage-paid Mail Back envelopes can be found on display in the lobby. There is no limit to the number of envelopes customers may take. The contents of the envelope must weigh less than 13 ounces and the envelope must be able to seal completely. For more details visit<a href="http://www.maxback.com/mxb-postoffice-collaboration" target="_blank">MaxBack</a>.","","false","false","false","false"
"Mail Boxes Etc.","Mail Boxes Etc.","3863 Union Deposit Rd","Harrisburg","Dauphin","PA","17109","7175614623","0","","","40.27825","-76.82545","9.51175906845203","Plastics (Other); Packing Peanut (Reuse); Computer (Recycling); Computer Monitors; Electronics; Laptop Computers; Computer Peripherals; Printers/Scanners/Fax Machines; Small Televisions; Tablets; Televisions; Video Game Consoles; PlayStation Consoles","false","true","","","false","false","false","false"
"Weis Markets","Weis Markets","3885 Union Deposit Rd","Harrisburg","Dauphin","PA","17109","7175589343","0","Monday: 7:00 AM - 10:00 PM Tuesday: 7:00 AM - 10:00 PM Wednesday: 7:00 AM - 10:00 PM Thursday: 7:00 AM - 10:00 PM Friday: 7:00 AM - 10:00 PM Saturday: 7:00 AM - 10:00 PM Sunday: 7:00 AM - 9:00 PM ","","40.27824","-76.82554","9.51647354634602","Plastic Shopping Bags; Food Storage Bags; Computer (Recycling); Computer Monitors; Electronics; Laptop Computers; Computer Peripherals; Printers/Scanners/Fax Machines; Small Televisions; Tablets; Televisions; Video Game Consoles; PlayStation Consoles","false","true","The recycle bin is located inside of the store.","","false","false","false","false"
