name,description,address,city,region,province,postal_code,phone,fax,hours,url,latitude,longitude,distance,materials,pickup,dropoff,notes,groups,curbside,municipal,national,event_only
"The Salvation Army","null","3847 Union Deposit Rd ","Harrisburg","Dauphin County","PA","17109","8007287825","0","Monday: 9:00 AM - 9:00 PM Tuesday: 9:00 AM - 9:00 PM Wednesday: 9:00 AM - 9:00 PM Thursday: 9:00 AM - 9:00 PM Friday: 9:00 AM - 9:00 PM Saturday: 9:00 AM - 9:00 PM Sunday:  -  ","http://www.salvationarmyusa.org","40.2748006","-76.8262972","9.55040760752221","Bikes; Books (Reuse); CD/DVD/Blu-ray/UHD discs; Cell Phones; Children's Toys; Clothing; Computer (Reuse); Hard Drives; Computer Monitors; Cameras; DVD Players/Blu-Ray Players/DVRs; Electronics; E-Readers; Furniture; Gift Bags; Headphones; Household Goods; Laptop Computers; Lawn Equipment; Miscellaneous Tools; MP3 Players; Musical Instruments; Network Equipment; Ornaments; Computer Peripherals; Portable Media Players; Printers/Scanners/Fax Machines; Reusable Appliance Donation; Small Appliances; Small Electronics; Small Televisions; Sporting Goods; Stereo Equipment; Tablets; Telephones; Televisions; VCRs; VHS & Cassette Tapes; Video Game Systems; Blu-Ray Players; Digital Converter Boxes; Computer (Recycling); Video Game Consoles; PlayStation Consoles","false","true","","Sony, Vizio, OEM, Salvation Army","false","false","false","false"
"US Post Office","USPS Discarded Lobby Mail Recycling Program","1425 Crooked Hill Rd","Harrisburg","Dauphin","PA","17106","0","0","","","40.23387","-76.81908","9.56037616927776","Computer (Recycling); Computer Monitors; Electronics; Laptop Computers; Computer Peripherals; Printers/Scanners/Fax Machines; Small Televisions; Tablets; Televisions; Video Game Consoles; PlayStation Consoles","false","true","","","false","false","false","false"
"USPS Post Office Box Lobby Recycling Program","US Post Office","29 Locust St","Steelton","Dauphin","PA","17113","8002758777","0","","https://www.usps.com/","40.23156","-76.81862","9.58362597690314","Catalogs; Greeting Cards; Magazines; Paper (Mixed)","false","true","","","false","false","false","false"
"US Post Office","USPS Discarded Lobby Mail Recycling Program","29 Locust St","Steelton","Dauphin","PA","17113","0","0","","","40.23156","-76.81862","9.58362597690314","Computer (Recycling); Computer Monitors; Electronics; Laptop Computers; Computer Peripherals; Printers/Scanners/Fax Machines; Small Televisions; Tablets; Televisions; Video Game Consoles; PlayStation Consoles","false","true","","","false","false","false","false"
"R Davis Enterprises","","1909 Cloverleaf Road","Mount Joy","","PA","17552","7173612281","0","","http://www.ronthebagman.com/","40.158547","-76.538844","9.68951835708299","","false","false","","","false","false","false","false"
"Pearle Vision Center","Pearle Vision Center","3539 Paxton St ","Harrisburg","Dauphin County","PA","17111","7175611300","0","Monday: 10:00 AM - 9:00 PM Tuesday: 10:00 AM - 9:00 PM Wednesday: 10:00 AM - 9:00 PM Thursday: 10:00 AM - 9:00 PM Friday: 10:00 AM - 9:00 PM Saturday: 10:00 AM - 6:30 PM Sunday: 12:00 PM - 5:00 PM ","http://www.pearlevision.com","40.2536296","-76.8282811","9.74712908615239","Eyeglasses; Computer (Recycling); Computer Monitors; Electronics; Laptop Computers; Computer Peripherals; Printers/Scanners/Fax Machines; Small Televisions; Tablets; Televisions; Video Game Consoles; PlayStation Consoles","false","true","This site accepts eyeglasses and all types of sunglasses in any condition.","","false","false","false","false"
"Anspach Auto Parts","Anspach Auto Parts","12 Park Dr","Grantville","Lebanon","PA","17028","7178656661","0","","null","40.41376","-76.62651","9.78015455821523","Antifreeze; Lead Acid (Pb) Batteries; Transmission Fluid; Used Motor Oil; Computer (Recycling); Computer Monitors; Electronics; Laptop Computers; Computer Peripherals; Printers/Scanners/Fax Machines; Small Televisions; Tablets; Televisions; Video Game Consoles; PlayStation Consoles","false","true","","","false","false","false","false"
"AT&T Wireless","AT&T Wireless","3501 Paxton St Unit J4","Harrisburg","Dauphin","PA","17111","2236663980","0","","http://www.att.com/","40.25396","-76.82903","9.78313722191309","Cell Phones; Ni-Cd Batteries; Batteries (Rechargeable); Cell Phone Batteries; Tablets; Li-Ion Batteries; Computer (Recycling); Computer Monitors; Electronics; Laptop Computers; Computer Peripherals; Printers/Scanners/Fax Machines; Small Televisions; Televisions; Video Game Consoles; PlayStation Consoles","false","true","Receive an AT&T Promotion Card worth the trade-in value of your smartphone, tablet, or netbook. You can also donate the trade-in value to Cell Phones for Soldiers.","","false","false","false","false"
"Monro","Monro","10 Anchor Rd","Elizabethtown","Lancaster","PA","17022","7173610088","0","Monday: 7:30 AM - 7:00 PM Tuesday: 7:30 AM - 7:00 PM Wednesday: 7:30 AM - 7:00 PM Thursday: 7:30 AM - 7:00 PM Friday: 7:30 AM - 7:00 PM Saturday: 7:30 AM - 4:00 PM ","http://monro.com","40.1383","-76.58739","9.78711322485236","Used Motor Oil; Computer (Recycling); Computer Monitors; Electronics; Laptop Computers; Computer Peripherals; Printers/Scanners/Fax Machines; Small Televisions; Tablets; Televisions; Video Game Consoles; PlayStation Consoles","false","true","","","false","false","false","false"
"Call2Recycle at RadioShack","Call2Recycle at RadioShack","3450 Paxton St ","Harrisburg","Dauphin County","PA","17111","7175642370","0","","http://www.radioshack.com/","40.253788","-76.8294239","9.80532446005705","Cell Phones; Ni-Cd Batteries; Li-Ion Batteries; Ni-MH Batteries; Ni-Zn Batteries; Small Sealed Lead Acid Batteries; Computer (Recycling); Computer Monitors; Electronics; Laptop Computers; Computer Peripherals; Printers/Scanners/Fax Machines; Small Televisions; Tablets; Televisions; Video Game Consoles; PlayStation Consoles","false","true","As the first national retailer to partner with Call2Recycle, RadioShack is at the forefront of the rechargeable battery recycling cause and is pleased to offer battery recycling at thousands of convenient RadioShack locations for free.  Simply drop them off at your local RadioShack and theyll take care of the rest.  Ask a store associate for more details.","","false","false","false","false"
"RadioShack","RadioShack","3501 Paxton St Unit M2","Harrisburg","Dauphin","PA","17111","7175642354","0","Monday: 10:00 AM - 9:00 PM Tuesday: 10:00 AM - 9:00 PM Wednesday: 10:00 AM - 9:00 PM Thursday: 10:00 AM - 9:00 PM Friday: 10:00 AM - 9:00 PM Saturday: 10:00 AM - 9:00 PM Sunday: 12:00 PM - 6:00 PM ","","40.25425","-76.83169","9.91948520291551","Ni-Cd Batteries; Batteries (Rechargeable); Computer (Recycling); Computer Monitors; Electronics; Laptop Computers; Computer Peripherals; Printers/Scanners/Fax Machines; Small Televisions; Tablets; Televisions; Video Game Consoles; PlayStation Consoles","false","true","","","false","false","false","false"
"LensCrafters","LensCrafters","3501 Paxton St Unit S1","Harrisburg","Dauphin","PA","17111","7175642229","0","Monday: 10:00 AM - 9:00 PM Tuesday: 10:00 AM - 9:00 PM Wednesday: 10:00 AM - 9:00 PM Thursday: 10:00 AM - 9:00 PM Friday: 10:00 AM - 9:00 PM Saturday: 10:00 AM - 9:00 PM Sunday: 12:00 PM - 5:00 PM ","http://www.lenscrafters.com","40.25425","-76.83169","9.91948520291551","Eyeglasses; Computer (Recycling); Computer Monitors; Electronics; Laptop Computers; Computer Peripherals; Printers/Scanners/Fax Machines; Small Televisions; Tablets; Televisions; Video Game Consoles; PlayStation Consoles","false","true","","","false","false","false","false"
"Whitmoyer Ford-Mercury","Whitmoyer Ford-Mercury","199 Merts Dr","Elizabethtown","Lancaster","PA","17022","7173677022","0","Monday: 7:30 AM - 5:00 PM Tuesday: 7:30 AM - 5:00 PM Wednesday: 7:30 AM - 5:00 PM Thursday: 7:30 AM - 5:00 PM Friday: 7:30 AM - 5:00 PM ","","40.14506","-76.55939","9.92485263919394","Used Motor Oil; Computer (Recycling); Computer Monitors; Electronics; Laptop Computers; Computer Peripherals; Printers/Scanners/Fax Machines; Small Televisions; Tablets; Televisions; Video Game Consoles; PlayStation Consoles","false","true","","","false","false","false","false"
