name,description,address,city,region,province,postal_code,phone,fax,hours,url,latitude,longitude,distance,materials,pickup,dropoff,notes,groups,curbside,municipal,national,event_only
"MinnKota Recycling","MinnKota Recycling","2004 Demers Ave","Grand Forks","Grand Forks","ND","58201","7017469600","0","Monday: 9:00 AM - 5:00 PM Tuesday: 9:00 AM - 5:00 PM Wednesday: 9:00 AM - 5:00 PM Thursday: 9:00 AM - 5:00 PM Friday: 9:00 AM - 5:00 PM Saturday: 8:00 AM - 11:59 PM ","http://www.minnkota.biz","47.91679","-97.05701","44.8000126419509","Plastic #1 (PETE); Plastic #2 (HDPE); Plastic #2 (Color HDPE); Aluminum Cans; Brown Paper Bags; Computer Paper; Greeting Cards; Magazines; Paper (Mixed); Newspapers; Tin or Steel Cans; Office Paper; Video Game Consoles; PlayStation Consoles","false","true","This site provides document destruction services as well as pick-up services for commercial locations.  Please contact the site for further information.","","false","false","false","false"
"MinnKota Recycling","","2004 DeMers Avenue","Grand Forks","","ND","58201","7017469600","0","","http://www.minnkota.biz","47.9168614","-97.0567429","44.813218753808","","false","false","","","false","false","false","false"
"Firestone Complete Auto Care","","1439 S Washington","Grand Forks","","ND","58201","7017755361","0","","https://www.firestonecompleteautocare.com/","47.906568","-97.0441911","44.9845277719089","","false","false","","","false","false","false","false"
"O'Reilly Auto Parts","null","1106 South Washington St","Grand Forks","","ND","58201","7017723699","0","","http://oreillyauto.custhelp.com/app/error/error_id/6","47.9108636","-97.0456804","45.0635718570118","","false","false","","","false","false","false","false"
"City of Grand Forks Yard Waste Drop-off Site - Lewis & Clark School","","12th Avenue South & South 11th Street","Grand Forks","","ND","58203","7017388740","0","","https://www.grandforksgov.com/","47.9098837","-97.0419714","45.1829179864474","","false","false","","","false","false","false","false"
"Dakota Science Center","Dakota Science Center","1701 Cherry St","Grand Forks","Grand Forks","ND","58201","7017728207","0","","http://www.dakota-science.org","47.90369","-97.03545","45.2505686732508","Cell Phones; CD/DVD/Blu-ray/UHD discs; Video Game Systems; Inkjet Printer Cartridges; Laser Toner Cartridges; Laptop Computers; Tablets; MP3 Players; Portable Media Players; Cameras; GPS Units; Video Game Consoles; PlayStation Consoles","false","true","Drop box located on the porch of the Boy Scout Office.","","false","false","false","false"
"Dakota Science Center","","1701 Cherry St","Grand Forks","","ND","58201","7017958500","0","","http://www.dakota-science.org/","47.903747","-97.0354485","45.2524465758523","","false","false","","","false","false","false","false"
"Dakota Science Center","","1701 Cherry St","Grand Forks","","ND","58201","7017958500","0","","http://www.dakota-science.org/","47.903747","-97.0354485","45.2524465758523","","false","false","","","false","false","false","false"
"Dakota Science Center","","1701 Cherry St","Grand Forks","","ND","58201","7017728207","0","","http://www.dakota-science.org/","47.903747","-97.0354485","45.2524465758523","","false","false","","","false","false","false","false"
"City of Grand Forks Yard Waste Drop-off Site - Williamson Field","","5th Avenue South & Demers Avenue","Grand Forks","","ND","58203","7017388740","0","","https://www.grandforksgov.com/","47.9171839","-97.0419457","45.4239002098146","","false","false","","","false","false","false","false"
"Acme Tools","Acme Tools","1705 13th Ave N","Grand Forks","Grand Forks","ND","58203","7017462807","0","Monday: 7:00 AM - 5:30 PM Tuesday: 7:00 AM - 5:30 PM Wednesday: 7:00 AM - 5:30 PM Thursday: 7:00 AM - 5:30 PM Friday: 7:00 AM - 5:30 PM Saturday: 8:00 AM - 5:30 PM ","http://www.acmetools.com/","47.9319","-97.05085","45.5633797843307","Cell Phones; Ni-Cd Batteries; Li-Ion Batteries; Ni-MH Batteries; Ni-Zn Batteries; Small Sealed Lead Acid Batteries; Video Game Consoles; PlayStation Consoles","false","true","The U.S. EPA estimates that more than 350 million rechargeable batteries are purchased annually in the U.S. Thanks to the environmental commitment of this location, its easy and free to recycle your batteries. Bring your rechargeable batteries to this location and look for the recycling box or ask an associate how you can do your part for the environment.","","false","false","false","false"
"Habitat for Humanity of the Red River Valley","Habitat for Humanity of the Red River Valley","711 N Washington St","Grand Forks","Grand Forks","ND","58203","7017462545","0","","http://www.rrvhabitat.org/","47.92653","-97.0454","45.5980938044742","Brick(s); Construction Materials (Reuse); Furniture; Large Household Appliances; Lumber; Roofing Materials; Windows; Air Conditioners; Video Game Consoles; PlayStation Consoles","false","true","This site is an affiliate of Habitat for Humanity.  PLEASE call to verify if they are currently accepting aluminum cans.","","false","false","false","false"
"C & R Cleaners and Laundry","C & R Cleaners and Laundry","1010 N 5th St","Grand Forks","Grand Forks","ND","58203","7017755336","0","Monday: 7:00 AM - 7:00 PM Tuesday: 7:00 AM - 7:00 PM Wednesday: 7:00 AM - 7:00 PM Thursday: 7:00 AM - 7:00 PM Friday: 7:00 AM - 7:00 PM Saturday: 8:00 AM - 5:00 PM ","","47.93127","-97.04519","45.7686569793524","Video Game Consoles; PlayStation Consoles","false","true","","","false","false","false","false"
"Residual Materials","","222 Red Dot Pl","Grand Forks","","ND","58203","7017469381","0","","http://www.residualmaterials.com/","47.9414424","-97.0536585","45.7855615885429","","false","false","","","false","false","false","false"
"City of Grand Forks Yard Waste Drop-off Site - Pump Station","","8th Avenue North & North 3rd Street","Grand Forks","","ND","58203","7017388740","0","","https://www.grandforksgov.com/","47.930906","-97.0404373","45.9471612983696","","false","false","","","false","false","false","false"
"City of Grand Forks Yard Waste Drop-off Site - Fire Station","","North Columbia Road","Grand Forks","","ND","58203","7017388740","0","","https://www.grandforksgov.com/","47.9622709","-97.0663404","46.0457225046073","","false","false","","","false","false","false","false"
"East Grand Forks Police Department","","520 Demers Avenue","East Grand Forks","","MN","56721","2187732283","0","","https://www.pca.state.mn.us/living-green/managing-unwanted-medications","47.9311192","-97.0225116","46.6771482566398","","false","false","","","false","false","false","false"
"Call2Recycle at Valley Recycling","Call2Recycle at Valley Recycling","115 12th Ave SE","Valley City","Barnes","ND","58072","7018400476","0","","http://valleyrecycling1.com/","46.92308","-97.98631","46.8450174892818","Cell Phones; Ni-Cd Batteries; Li-Ion Batteries; Ni-MH Batteries; Ni-Zn Batteries; Small Sealed Lead Acid Batteries; Video Game Consoles; PlayStation Consoles","false","true","The U.S. EPA estimates that more than 350 million rechargeable batteries are purchased annually in the U.S. Thanks to the environmental commitment of this location, its easy and free to recycle your batteries. Bring your rechargeable batteries to this location and look for the recycling box or ask an associate how you can do your part for the environment.","","false","false","false","false"
"O'Reilly Auto Parts","null","1223 Central Avenue Nw","East Grand Forks","","MN","56721","2187732461","0","","http://oreillyauto.custhelp.com/app/error/error_id/6","47.9372578","-97.0212166","46.9374890194097","","false","false","","","false","false","false","false"
"USPS Post Office Box Lobby Recycling Program","US Post Office","68 Lovick Ave","Pisek","Walsh","ND","58273","8002758777","0","","https://www.usps.com/","48.30632","-97.68563","49.880287749052","Catalogs; Greeting Cards; Magazines; Paper (Mixed)","false","true","","","false","false","false","false"
"KaMaR Recycling Drop-off Site","KaMaR Recycling Drop-off Site","211 A51 ","Oslo","Marshall County","MN","56744","2184363130","0","Sunday: 12:00 AM - 11:59 PM Monday: 12:00 AM - 11:59 PM Tuesday: 12:00 AM - 11:59 PM Wednesday: 12:00 AM - 11:59 PM Thursday: 12:00 AM - 11:59 PM Friday: 12:00 AM - 11:59 PM Saturday: 12:00 AM - 11:59 PM ","","48.193646","-97.1337998","54.2404508038302","Plastic #1 (PETE); Plastic #2 (HDPE); Plastic #2 (Color HDPE); Plastic #3 (PVC); Plastic #4 (LDPE); Plastic #5 (Polypropylene); Plastic #6 (Polystyrene); Plastic #7; Aluminum Cans; Glass (Brown); Glass (Clear); Glass (Green); Newspapers; Tin or Steel Cans; Computer (Recycling); Computer Monitors; DVD Players/Blu-Ray Players/DVRs; Electronics; Laptop Computers; Computer Peripherals; Printers/Scanners/Fax Machines; Small Electronics; Small Televisions; Tablets; Televisions; VCRs; Video Game Consoles; PlayStation Consoles","false","true","This site is located south of the Fire Hall.","","false","false","false","false"
"Jim's Bumper to Bumper","Jim's Bumper to Bumper","106 E Industrial Rd","Oslo","Marshall","MN","56744","2186953030","0","","null","48.19358","-97.12471","54.5125020302695","Used Motor Oil; Oil Filters; Computer (Recycling); Computer Monitors; DVD Players/Blu-Ray Players/DVRs; Electronics; Laptop Computers; Computer Peripherals; Printers/Scanners/Fax Machines; Small Electronics; Small Televisions; Tablets; Televisions; VCRs; Video Game Consoles; PlayStation Consoles","false","true","","","false","false","false","false"
"O'Reilly Auto Parts","null","901 Hwy 20 South","Devils Lake","","ND","58301","7016626072","0","","http://oreillyauto.custhelp.com/app/error/error_id/6","48.1006008","-98.8677874","56.8197468063207","","false","false","","","false","false","false","false"
"Tractor Supply","Tractor Supply","223 4TH ST Southwest","Devils Lake","Ramsey","ND","58301","7016628105","0","","http://www.tractorsupply.com","48.10581","-98.86235","56.8397945910039","Transmission Fluid; Used Motor Oil; Video Game Consoles; PlayStation Consoles","false","true","","","false","false","false","false"
"Walmart","null","1424 Hwy 2 E","Devils Lake","","ND","58301","7016625203","0","","https://www.walmart.com/","48.104116","-98.867704","56.9641079891858","","false","false","","","false","false","false","false"
"Tractor Supply","","223 4th Street Southwest","Devils Lake","","ND","58301","7016628105","0","","https://www.tractorsupply.com/","48.1063","-98.867722","57.0566891122888","","false","false","","","false","false","false","false"
"Lake Region Corporation","Lake Region Corporation","224 3rd St NW ","Devils Lake","Ramsey County","ND","58301","7016628681","0","Monday: 8:00 AM - 4:00 PM Tuesday: 8:00 AM - 4:00 PM Wednesday: 8:00 AM - 4:00 PM Thursday: 8:00 AM - 4:00 PM Friday: 8:00 AM - 4:00 PM ","","48.1104269","-98.8677902","57.2335539427535","Aluminum Cans; Video Game Consoles; PlayStation Consoles","false","true","","","false","false","false","false"
"Walmart","Walmart","210 Highway 2 W","Devils Lake","Ramsey","ND","58301","7016625203","0","","http://www.walmart.com","48.10975","-98.87006","57.2876907026736","Lead Acid (Pb) Batteries; Plastic Shopping Bags; Food Storage Bags; Video Game Consoles; PlayStation Consoles","false","true","","","false","false","false","false"
"US Post Office","US Post Office","502 3rd St NE","Devils Lake","Ramsey","ND","58301","0","0","","https://www.usps.com/ship/recycle-through-usps.htm","48.11388","-98.88644","58.0604957012414","Inkjet Printer Cartridges; Video Game Consoles; PlayStation Consoles","false","true","Free, postage-paid Mail Back envelopes can be found on display in the lobby. There is no limit to the number of envelopes customers may take. The contents of the envelope must weigh less than 13 ounces and the envelope must be able to seal completely. For more details visit<a href="http://www.maxback.com/mxb-postoffice-collaboration" target="_blank">MaxBack</a>.","","false","false","false","false"
"4R'S Recycling/Rosenau Seed & Supply Inc.","4R'S Recycling/Rosenau Seed & Supply Inc.","191 11th Ave N","Carrington","Foster","ND","58421","7016522589","0","Monday: 8:00 AM - 5:00 PM Tuesday: 8:00 AM - 5:00 PM Wednesday: 8:00 AM - 5:00 PM Thursday: 8:00 AM - 5:00 PM Friday: 8:00 AM - 5:00 PM ","","47.45146","-99.12789","58.303089573424","Aluminum Cans; Tin or Steel Cans; Video Game Consoles; PlayStation Consoles","false","true","","","false","false","false","false"
"D and O Salvage","D and O Salvage","710 River Dr","New Rockford","Eddy","ND","58356","7019472236","0","Monday: 10:00 AM - 5:00 PM Tuesday: 10:00 AM - 5:00 PM Wednesday: 10:00 AM - 5:00 PM Thursday: 10:00 AM - 5:00 PM Friday: 10:00 AM - 5:00 PM ","","47.68815","-99.14291","58.312346656452","Aluminum Cans; Aluminum; Car; Lead Acid (Pb) Batteries; Ferrous Metals (Steel or Iron); Non-ferrous (Copper/Brass/Tin); Tin or Steel Cans; Video Game Consoles; PlayStation Consoles","false","true","Please call ahead for further information before dropping off items for recycling.","","false","false","false","false"
"Polk County Regional Recycling Center - Crookston","","320 Ingersoll Ave","Crookston","","MN","56716","2182816828","0","","http://www.co.polk.mn.us/404.htm?aspxerrorpath=/list_departments/environmentalServices/recycling.aspx","47.7612258","-96.6255092","60.2178328949901","Batteries (Rechargeable); Cell Phone Batteries; Li-Ion Batteries; Ni-Cd Batteries; Ni-MH Batteries; Small Sealed Lead Acid Batteries; Cell Phones","false","true","","Call2Recycle","false","false","false","false"
"Polk County Transfer Station - Crookston Household Hazardous Waste Drop-Off Site","","320 Ingersoll Ave","Crookston","","MN","56716","2182816445","0","","http://www.co.polk.mn.us/404.htm?aspxerrorpath=/list_departments/environmentalservices/hazardousWaste.aspx","47.7612258","-96.6255092","60.2178328949901","","false","false","","","false","false","false","false"
"Nelson Motors of Crookston, Inc.","Nelson Motors of Crookston, Inc.","933 Tuttle Ave","Crookston","Polk","MN","56716","2182811925","0","","null","47.76928","-96.62433","60.3735575144231","Used Motor Oil; Oil Filters; Computer (Recycling); Computer Monitors; DVD Players/Blu-Ray Players/DVRs; Electronics; Laptop Computers; Computer Peripherals; Printers/Scanners/Fax Machines; Small Electronics; Small Televisions; Tablets; Televisions; VCRs; Video Game Consoles; PlayStation Consoles","false","true","","","false","false","false","false"
"Friendship Inc.","Friendship Inc.","554 W 12th St","Grafton","Walsh","ND","58237","7013520060","0","Monday: 8:30 AM - 3:30 PM Tuesday: 8:30 AM - 3:30 PM Wednesday: 8:30 AM - 3:30 PM Thursday: 8:30 AM - 3:30 PM Friday: 8:30 AM - 3:30 PM ","","48.4124","-97.41933","60.4223195482872","Plastic #1 (PETE); Plastic #2 (HDPE); Plastic #2 (Color HDPE); Aluminum Cans; Brown Paper Bags; Cardboard; Catalogs; Computer Paper; Gift Boxes; Magazines; Newspapers; Paperboard; Phone books; Tin or Steel Cans; Office Paper; Video Game Consoles; PlayStation Consoles","false","true","","","false","false","false","false"
"Dakota East Gift Shop","Dakota East Gift Shop","701 W 6th St","Grafton","Walsh","ND","58237","7013524282","0","Monday: 8:00 AM - 12:00 PM Tuesday: 8:00 AM - 12:00 PM Wednesday: 8:00 AM - 12:00 PM Thursday: 8:00 AM - 12:00 PM Friday: 8:00 AM - 12:00 PM Monday: 1:00 PM - 4:00 PM Tuesday: 1:00 PM - 4:00 PM Wednesday: 1:00 PM - 4:00 PM Thursday: 1:00 PM - 4:00 PM Friday: 1:00 PM - 4:00 PM ","null","48.41803","-97.42026","60.7684759973322","Aluminum Cans; Video Game Consoles; PlayStation Consoles","false","true","","","false","false","false","false"
"Gerdau-Jamestown","","1510 10th Street Southeast","Jamestown","","ND","58401","7012520110","0","","https://www.gerdau.com/en","46.8985753","-98.6847009","60.8406273457969","","false","false","","","false","false","false","false"
"Porter Brothers","Porter Brothers","1510 10th St SE","Jamestown","Stutsman","ND","58401","7012520110","0","Monday: 8:00 AM - 5:00 PM Tuesday: 8:00 AM - 5:00 PM Wednesday: 8:00 AM - 5:00 PM Thursday: 8:00 AM - 5:00 PM Friday: 8:00 AM - 5:00 PM ","","46.899","-98.6869","60.8798984365873","Aluminum Cans; Aluminum; Lead Acid (Pb) Batteries; Ferrous Metals (Steel or Iron); Non-ferrous (Copper/Brass/Tin); Tin or Steel Cans; Video Game Consoles; PlayStation Consoles","false","true","","","false","false","false","false"
"Gerdau-Jamestown","Gerdau-Jamestown","1510 10th St SE","Jamestown","Stutsman","ND","58401","7012520110","0","","http://www.gerdau.com","46.899","-98.6869","60.8798984365873","Ferrous Metals (Steel or Iron); Non-ferrous (Copper/Brass/Tin); High-Temp Alloys; Special Metals; Video Game Consoles; PlayStation Consoles","true","true","","","false","false","false","false"
"Central Valley Health","","122 2nd St NW","Jamestown","","ND","58401","7012528130","0","","http://www.centralvalleyhealth.org/","46.9096941","-98.7088474","60.9303023276758","","false","false","","","false","false","false","false"
"Central Valley Health","Central Valley Health","122 2nd St NW","Jamestown","Stutsman","ND","58401","7012528130","0","","http://www.centralvalleyhealth.org/","46.90964","-98.70876","60.9306737725114","Mercury Containing Items; Video Game Consoles; PlayStation Consoles","false","true","Please contact Jim Michaels or Tim Dodd.","","false","false","false","false"
"Renaissance Recycling","Renaissance Recycling","297 1st St W ","Jamestown","Stutsman County","ND","58401","7013209218","0","Tuesday: 9:00 AM - 6:00 PM Thursday: 9:00 AM - 6:00 PM Saturday: 9:00 AM - 12:00 PM ","http://www.jamestownrecycling.com/","46.9086329","-98.7114948","61.0653585144984","Plastic #1 (PETE); Plastic #2 (HDPE); Plastic #2 (Color HDPE); Plastic #3 (PVC); Plastic #4 (LDPE); Plastic #5 (Polypropylene); Plastic #6 (Polystyrene); Plastic #7; Aluminum Cans; Aluminum; Book Recycling; Glass (Brown); Lead Acid (Pb) Batteries; Cardboard; Cell Phones; Glass (Clear); Clothing; Compact Fluorescent Lights; Computer Monitors; Computer (Recycling); Electronics; Fluorescent Lamps/Tubes; Glass (Green); Magazines; Mercury Containing Items; Paper (Mixed); Newspapers; Ni-Cd Batteries; Paperboard; Phone books; Batteries (Rechargeable); Telephones; Televisions; Tin or Steel Cans; Office Paper; Memory (RAM), Flash Card/Drive; Laptop Computers; Shoes; MP3 Players; Microwaves; Power Supplies; Computer Peripherals; Video Game Consoles; PlayStation Consoles","true","true","There is a charge for escrap, battery, appliances, and lamps. See website or call for fees.","","false","false","false","false"
"City of Jamestown Landfill and Baler","City of Jamestown Landfill and Baler","302 1st St W ","Jamestown","Stutsman County","ND","58401","7012525223","0","Sunday: 12:00 AM - 11:59 PM Monday: 12:00 AM - 11:59 PM Tuesday: 12:00 AM - 11:59 PM Wednesday: 12:00 AM - 11:59 PM Thursday: 12:00 AM - 11:59 PM Friday: 12:00 AM - 11:59 PM Saturday: 12:00 AM - 11:59 PM ","null","46.9086567","-98.7115703","61.0662836960023","Brush; Grass Clippings; Leaves; Tree Trimmings; Weeds; Video Game Consoles; PlayStation Consoles","false","true","Please note, free compost is available during regular business hours, Monday to Friday 8am to 3:30pm and Saturday 8am to 11:30am.","","false","false","false","false"
"Renaissance Recycling","","302 1st St W","Jamestown","","ND","58401","7013209218","0","","","46.9086441","-98.7115697","61.0669482735526","","false","false","","","false","false","false","false"
"City of Jamestown Recycling Center","","302 1st St W","Jamestown","","ND","58401","7013207312","0","","http://www.jamestownnd.org/departments/public-works/recycling/","46.9086441","-98.7115697","61.0669482735526","","false","false","","","false","false","false","false"
"US Post Office","US Post Office","212 2nd St SW","Jamestown","Stutsman","ND","58401","0","0","","https://www.usps.com/ship/recycle-through-usps.htm","46.90769","-98.71016","61.077338423878","Inkjet Printer Cartridges; Video Game Consoles; PlayStation Consoles","false","true","Free, postage-paid Mail Back envelopes can be found on display in the lobby. There is no limit to the number of envelopes customers may take. The contents of the envelope must weigh less than 13 ounces and the envelope must be able to seal completely. For more details visit<a href="http://www.maxback.com/mxb-postoffice-collaboration" target="_blank">MaxBack</a>.","","false","false","false","false"
"Crookston Police Department","","321 West Robert Street","Crookston","","MN","56716","2182813111","0","","https://www.pca.state.mn.us/living-green/managing-unwanted-medications","47.7746714","-96.6098983","61.1020808359009","","false","false","","","false","false","false","false"
"Hugo's Family Market","Hugo's Family Market","310 1st Ave S","Jamestown","Stutsman","ND","58401","7012520981","0","","http://www.gohugos.com/","46.90575","-98.70838","61.1305808300462","Plastic Shopping Bags; Food Storage Bags; Video Game Consoles; PlayStation Consoles","false","true","","","false","false","false","false"
