name,description,address,city,region,province,postal_code,phone,fax,hours,url,latitude,longitude,distance,materials,pickup,dropoff,notes,groups,curbside,municipal,national,event_only
"City of Cooperstown Aluminum Can Drop-off Site","","Hwy 45","Cooperstown","","ND","58425","7017973613","0","","","47.4444236","-98.1238324","14.9971296958107","","false","false","","","false","false","false","false"
"Mayport Recycling","Mayport Recycling","53 Center Ave S ","Mayville","Traill County","ND","58257","7017862826","0","Monday: 9:00 AM - 5:00 PM Tuesday: 9:00 AM - 5:00 PM Wednesday: 9:00 AM - 5:00 PM Thursday: 9:00 AM - 5:00 PM Friday: 9:00 AM - 5:00 PM ","","47.4997185","-97.3259491","27.5018246094099","Aluminum Cans; Lead Acid (Pb) Batteries; Video Game Consoles; PlayStation Consoles","false","true","This site asks that you please call ahead before dropping off car batteries for recycling.","","false","false","false","false"
"Grand Fork Main Store","","550 Holzapple St","Grand Forks Afb","","ND","58205","7017274717","0","","","47.9495575","-97.3754928","34.2866464180498","","false","false","","","false","false","false","false"
"Grand Fork Express","","1839 I St","Grand Forks Afb","","ND","58204","7015945684","0","","","47.956502","-97.377938","34.5473307385764","","false","false","","","false","false","false","false"
"USPS Post Office Box Lobby Recycling Program","US Post Office","209 Main Ave","Gilby","Grand Forks","ND","58235","8002758777","0","","https://www.usps.com/","48.0822","-97.49098","38.3696108374125","Catalogs; Greeting Cards; Magazines; Paper (Mixed)","false","true","","","false","false","false","false"
"Wimbledon Recycle Center","","288 Out Stunstarred ","Wimbledon","","ND","58492","7014352927","0","","","47.1709337","-98.4586198","39.5193320530957","","false","false","","","false","false","false","false"
"City of Grand Forks Inert Waste Landfill","City of Grand Forks Inert Waste Landfill","2701 S 69th St ","GF","Grand Forks County","ND","58201","7017462570","0","Monday: 8:00 AM - 4:00 PM Tuesday: 8:00 AM - 4:00 PM Wednesday: 8:00 AM - 4:00 PM Thursday: 8:00 AM - 4:00 PM Friday: 8:00 AM - 4:00 PM Saturday: 8:00 AM - 11:00 AM ","http://www.grandforksgov.com/","47.9040581","-97.1315819","41.3650858120329","Broken Asphalt/Aggregate; Automobile Parts; Brick(s); Brush; Carpet; Carpet Padding; Ceramic Tiles; Christmas Trees; Concrete (Set); Soil; Ferrous Metals (Steel or Iron); Grass Clippings; Drywall; Furniture; Inner Tubes; Large Household Appliances; Leaves; Linoleum; Bed Mattresses; Clothes Hangers (Metal); Non-ferrous (Copper/Brass/Tin); Office Furniture; Organic Waste; Wood Pallets; Porcelain; Shingles; Stone; Tree Trimmings; Used Tires; Weeds; Windows; Wood","false","true","","","false","false","false","false"
"Tractor Supply","","4460 32nd Avenue South","Grand Forks","","ND","58201","7017460391","0","","https://www.tractorsupply.com/","47.8905092","-97.0937133","42.4382570467954","","false","false","","","false","false","false","false"
"Tractor Supply","Tractor Supply","4460 32nd Ave S","Grand Forks","Grand Forks","ND","58201","7017460391","0","Monday: 8:00 AM - 8:00 PM Tuesday: 8:00 AM - 8:00 PM Wednesday: 8:00 AM - 8:00 PM Thursday: 8:00 AM - 8:00 PM Friday: 8:00 AM - 8:00 PM Saturday: 8:00 AM - 8:00 PM Sunday: 12:00 PM - 7:00 PM ","http://www.tractorsupply.com","47.8904","-97.09352","42.4426052169558","Brake Fluid; Transmission Fluid; Used Motor Oil; Video Game Consoles; PlayStation Consoles","false","true","","","false","false","false","false"
"Lowe's","","4001 32nd Ave S","Grand Forks","","ND","58201","7017659000","0","","https://newsroom.lowes.com/responsibility/operational-excellence/","47.8864736","-97.0849165","42.6687459611881","Batteries (Rechargeable); Cell Phone Batteries; Li-Ion Batteries; Ni-Cd Batteries; Ni-MH Batteries; Small Sealed Lead Acid Batteries; Cell Phones","false","true","","Call2Recycle","false","false","false","false"
"Call2Recycle at Lowe's","Call2Recycle at Lowe's","4001 32nd Ave S","Grand Forks","Grand Forks","ND","58201","7017659000","0","Monday: 6:00 AM - 10:00 PM Tuesday: 6:00 AM - 10:00 PM Wednesday: 6:00 AM - 10:00 PM Thursday: 6:00 AM - 10:00 PM Friday: 6:00 AM - 10:00 PM Saturday: 6:00 AM - 10:00 PM Sunday: 8:00 AM - 8:00 PM ","http://www.lowes.com/","47.88811","-97.08575","42.6868648381949","Cell Phones; Compact Fluorescent Lights; Ni-Cd Batteries; Plastic Shopping Bags; Li-Ion Batteries; Ni-MH Batteries; Ni-Zn Batteries; Small Sealed Lead Acid Batteries; Video Game Consoles; PlayStation Consoles","false","true","As an environmentally-committed retailer, Lowes offers a recycling center near store entrances to give consumers a free and easy way to properly dispose of rechargeable batteries, cell phones, CFLs and plastic shopping bags; materials that otherwise could be potentially harmful to the environment.  Look for the recycling center or ask a store associate for more details.","","false","false","false","false"
"Best Buy","Best Buy","3751 32nd Ave S ","Grand Forks","Grand Forks County","ND","58201","7017752784","0","","https://www.bestbuy.com/recycle","47.8887622","-97.0817694","42.8711533393269","Large Household Appliances; Refrigerators; Televisions; AC Power Plugs; Batteries (Rechargeable); Cables & Connectors; Car Audio/Video Equipment; Cell Phone Batteries; Cell Phones; Computer (Recycling); Hard Drives; Computer Monitors; Cameras; DVD Players/Blu-Ray Players/DVRs; Electronics; E-Readers; GPS Units; Headphones; Inkjet Printer Cartridges; Laptop Computers; Laser Toner Cartridges; Li-Ion Batteries; MP3 Players; Network Equipment; Ni-Cd Batteries; Ni-MH Batteries; Ni-Zn Batteries; Computer Peripherals; Portable Media Players; Printers/Scanners/Fax Machines; Small Electronics; Small Sealed Lead Acid Batteries; Stereo Equipment; Tablets; Telephones; UPS Batteries/Backup Systems; VCRs; Video Game Systems; Blu-Ray Players; Digital Converter Boxes; Small Televisions; Video Game Consoles; PlayStation Consoles","true","true","2 TVs per visit, 3 e-waste items per day; $25 fee for TVs and Monitors; $19.99 pick-up fee with delivery; $99.99 standalone pickup fee; ","Sony, Vizio, OEM","false","false","false","false"
"Target Store","","3601 32nd Ave S","Grand Forks","","ND","58201","7017876177","0","","https://corporate.target.com/corporate-responsibility/planet","47.8866414","-97.0799518","42.8782398179907","","false","false","","","false","false","false","false"
"Best Buy","","3751 32nd Ave S","Grand Forks","","ND","58201","7017752784","0","","https://www.bestbuy.com/site/services/recycling/pcmcat149900050025.c?id=pcmcat149900050025","47.8887187","-97.0815604","42.8783429837614","","false","false","","","false","false","false","false"
"Target","Target","3601 32nd Ave S","Grand Forks","Grand Forks","ND","58201","7017876177","0","","http://www.target.com/","47.88711","-97.07997","42.8923850396212","Aluminum Cans; Cell Phones; Inkjet Printer Cartridges; MP3 Players; Plastic #1 (PETE); Plastic #2 (HDPE); Plastic Shopping Bags; Video Game Consoles; PlayStation Consoles","false","true","","","false","false","false","false"
"USPS Post Office Box Lobby Recycling Program","US Post Office","104 Main St N","Fordville","Walsh","ND","58231","8002758777","0","","https://www.usps.com/","48.21644","-97.79067","42.9840999387496","Catalogs; Greeting Cards; Magazines; Paper (Mixed)","false","true","","","false","false","false","false"
"Kohl's","","3301 32nd Avenue South","Grand Forks","","ND","58201","7017460191","0","","https://corporate.kohls.com/","47.8871631","-97.0762705","43.0463037407694","","false","false","","","false","false","false","false"
"Verizon Wireless","Verizon Wireless","3221 32nd Ave S","Grand Forks","Grand Forks","ND","58201","8666444532","0","Monday: 10:00 AM - 8:00 PM Tuesday: 10:00 AM - 8:00 PM Wednesday: 10:00 AM - 8:00 PM Thursday: 10:00 AM - 8:00 PM Friday: 10:00 AM - 8:00 PM Saturday: 10:00 AM - 7:00 PM Sunday: 12:00 PM - 6:00 PM ","http://www.verizonwireless.com/","47.88866","-97.07474","43.1567945031917","Cell Phones; Cell Phone Batteries; Video Game Consoles; PlayStation Consoles","false","true","<A Href="https://www.trade-in.vzw.com/home.aspx">
The Verizon Wireless Trade-In Program</A> allows you to trade in your used handset or tablet in a convenient and responsible way. 
<P>
<P>
Verizon Wireless works every day to protect our environment and give our customers opportunities to do the same. <A Href="http://aboutus.vzw.com/Green_Initiative/overview.html">Click here</A> for more examples of the earth-friendly initiatives and programs Verizon Wireless is proud to offer and support.","","false","false","false","false"
"Handle With Care Packaging Store","","4700 Demers Ave","Grand Forks","","ND","58201","7017726686","0","","https://www.gopackagingstore.com/","47.9175611","-97.0982299","43.1693646905131","","false","false","","","false","false","false","false"
"OfficeMax","OfficeMax","3225 30th Ave S","Grand Forks","Grand Forks","ND","58201","7017808491","0","Monday: 8:00 AM - 9:00 PM Tuesday: 8:00 AM - 9:00 PM Wednesday: 8:00 AM - 9:00 PM Thursday: 8:00 AM - 9:00 PM Friday: 8:00 AM - 9:00 PM Saturday: 9:00 AM - 7:00 PM Sunday: 12:00 PM - 6:00 PM ","http://www.officemax.com","47.89117","-97.07536","43.211373950299","Inkjet Cartridge Refilling; Inkjet Printer Cartridges; Laser Toner Cartridges; Video Game Consoles; PlayStation Consoles","false","true","This site can accept HP, Lexmark, and Dell cartridges only.

This location features Phoenix Ink refill kiosks.","","false","false","false","false"
"Salvation Army","Salvation Army","3401 S 31st St","Grand Forks","Grand Forks","ND","58201","7017757255","0","Monday: 10:00 AM - 6:00 PM Tuesday: 10:00 AM - 6:00 PM Wednesday: 10:00 AM - 6:00 PM Thursday: 10:00 AM - 6:00 PM Friday: 10:00 AM - 6:00 PM Saturday: 10:00 AM - 6:00 PM ","http://satruck.org/","47.88776","-97.07271","43.2118207895844","Bikes; Books (Reuse); Cell Phones; Clothing; CD/DVD/Blu-ray/UHD discs; Computer (Reuse); Computer Monitors; Hard Drives; Gift Bags; Eyeglasses; Furniture; Household Goods; Bed Mattresses; Musical Instruments; Office Furniture; Office Equipment; Ornaments; Reusable Appliance Donation; Sporting Goods; Telephones; Televisions; Miscellaneous Tools; Children's Toys; Small Appliances; Video Game Consoles; PlayStation Consoles","false","true","This site accepts gently used items that are in good, clean, condition.","Sony","false","false","false","false"
"City of Grand Forks Yard Waste Drop-off Site - Lift Station","","24th Avenue South & South 34th Street","Grand Forks","","ND","58203","7017388740","0","","https://www.grandforksgov.com/","47.8933066","-97.0768104","43.2205385075977","","false","false","","","false","false","false","false"
"OfficeMax","","3225 30th Ave S","Grand Forks","","ND","58201","7017808491","0","","","47.8909329","-97.0743031","43.2471893269603","","false","false","","","false","false","false","false"
"JCPenney","","2800 S Columbia Rd","Grand Forks","","ND","58201","7017464521","0","","https://www.jcpenney.com/","47.8932253","-97.073718","43.3446765805382","","false","false","","","false","false","false","false"
"Grand Forks MRF","Grand Forks MRF","5170 21st Ave N","Grand Forks","Grand Forks","ND","58203","8002471012","0","","http://www.wmnorthdakota.com/","47.94664","-97.11992","43.3789874706038","Plastic #1 (PETE); Aluminum Cans; Glass (Brown); Glass (Clear); Glass (Green); Office Paper; Video Game Consoles; PlayStation Consoles","true","true","","","false","false","false","false"
"Firestone Complete Auto Care","","3450 Columbia Rd","Grand Forks","","ND","58201","7017460081","0","","https://www.firestonecompleteautocare.com/","47.8872814","-97.0674364","43.4141267837887","","false","false","","","false","false","false","false"
"RadioShack","RadioShack","2800 S Columbia Rd","Grand Forks","Grand Forks","ND","58201","7017757222","0","Monday: 10:00 AM - 9:00 PM Tuesday: 10:00 AM - 9:00 PM Wednesday: 10:00 AM - 9:00 PM Thursday: 10:00 AM - 9:00 PM Friday: 10:00 AM - 9:00 PM Saturday: 10:00 AM - 9:00 PM Sunday: 12:00 PM - 6:00 PM ","http://www.radioshack.com","47.89286","-97.07087","43.4498077121454","Ni-Cd Batteries; Batteries (Rechargeable); Video Game Consoles; PlayStation Consoles","false","true","","","false","false","false","false"
"Sears","Sears","2800 S Columbia Rd","Grand Forks","Grand Forks","ND","58201","7017879349","0","","http://www.sears.com/","47.89286","-97.07087","43.4498077121454","Cell Phones; Ni-Cd Batteries; Li-Ion Batteries; Ni-MH Batteries; Ni-Zn Batteries; Small Sealed Lead Acid Batteries; Video Game Consoles; PlayStation Consoles","false","true","The U.S. EPA estimates that more than 350 million rechargeable batteries are purchased annually in the U.S. Thanks to the environmental commitment of this location, its easy and free to recycle your batteries. Bring your rechargeable batteries to this location and look for the recycling box or ask an associate how you can do your part for the environment.","","false","false","false","false"
"Walmart","Walmart","2551 32nd Ave S","Grand Forks","Grand Forks","ND","58201","7017467225","0","","http://www.walmart.com","47.88741","-97.06483","43.5257324780889","Lead Acid (Pb) Batteries; Plastic Shopping Bags; Food Storage Bags; Video Game Consoles; PlayStation Consoles","false","true","","","false","false","false","false"
"Wal-mart Tire and Lube Express Center","Wal-mart Tire and Lube Express Center","2551 32nd Ave S","Grand Forks","Grand Forks","ND","58201","7017467225","0","","","47.88741","-97.06483","43.5257324780889","Lead Acid (Pb) Batteries; Used Motor Oil; Oil Filters; Used Tires; Video Game Consoles; PlayStation Consoles","false","true","","","false","false","false","false"
"Walmart Tire and Lube Express","","2551 32nd Ave S","Grand Forks","","ND","58201","7017467225","0","","https://www.walmart.com/cp/ideas/8932632","47.8871396","-97.0640717","43.5485688264206","","false","false","","","false","false","false","false"
"Walmart Supercenter","","2551 32nd Ave S","Grand Forks","","ND","58201","7017467225","0","","https://www.walmart.com/","47.8871396","-97.0640717","43.5485688264206","","false","false","","","false","false","false","false"
"Call2Recycle at RadioShack","Call2Recycle at RadioShack","2800 S Columbia Rd Bldg 1","Grand Forks","Grand Forks","ND","58201","7017757222","0","","http://www.radioshack.com/","47.8909","-97.06668","43.5595612682538","Cell Phones; Ni-Cd Batteries; Li-Ion Batteries; Ni-MH Batteries; Ni-Zn Batteries; Small Sealed Lead Acid Batteries; Video Game Consoles; PlayStation Consoles","false","true","As the first national retailer to partner with Call2Recycle, RadioShack is at the forefront of the rechargeable battery recycling cause and is pleased to offer battery recycling at thousands of convenient RadioShack locations for free.  Simply drop them off at your local RadioShack and theyll take care of the rest.  Ask a store associate for more details.","","false","false","false","false"
"Sams Club","","2501 32nd Ave S","Grand Forks","","ND","58201","7017959449","0","","https://www.samsclub.com/","47.8864548","-97.0625883","43.5884485247299","","false","false","","","false","false","false","false"
"Public Works Facility Recycling Drop Site","Public Works Facility Recycling Drop Site","724 N 47th St","Grand Forks","Grand Forks","ND","58203","7017388740","0","","http://grandforksgov.com","47.92639","-97.0954","43.5936198931918","Plastic #1 (PETE); Plastic #2 (HDPE); Plastic #2 (Color HDPE); Plastic #3 (PVC); Plastic #4 (LDPE); Plastic #5 (Polypropylene); Plastic #6 (Polystyrene); Plastic #7; Aerosol Spray Cans; Aluminum Cans; Glass (Blue); Glass (Brown); Brown Paper Bags; Brush; Lead Acid (Pb) Batteries; Cardboard; Catalogs; Christmas Trees; Glass (Clear); Computer Paper; Gift Boxes; Grass Clippings; Glass (Green); Greeting Cards; Leaves; Magazines; Clothes Hangers (Metal); Milk Cartons; Paper (Mixed); Newspapers; Organic Waste; Glass (Other); Plastics (Other); Paperboard; Phone books; Propane Tanks; Tin or Steel Cans; Tree Trimmings; Used Motor Oil; Oil Filters; Weeds; Office Paper","false","true","For household trash, misc. junk, please haul to the City of Grand Forks Landfill, only 2 miles NW of Public Works/Hwy 2 at 2701 N. 69th St. Landfill Hours: M-F 7:30 a.m. - 4:00 p.m.; Sat 8-12. Thank you for your cooperation!","","false","false","false","false"
"City of Grand Forks - Curbside Recycling","City of Grand Forks - Curbside Recycling","724 N 47th St","Grand Forks","Grand Forks","ND","58203","7017388740","0","","http://grandforksgov.com","47.92639","-97.0954","43.5936198931918","Aluminum Cans; Brown Paper Bags; Cardboard; Catalogs; Computer Paper; Gift Boxes; Glass (Blue); Glass (Brown); Glass (Clear); Glass (Green); Glass (Other); Greeting Cards; Lead Acid (Pb) Batteries; Magazines; Milk Cartons; Newspapers; Office Paper; Oil Filters; Paper (Mixed); Paperboard; Phone books; Plastic #1 (PETE); Plastic #2 (Color HDPE); Plastic #2 (HDPE); Plastic #3 (PVC); Plastic #4 (LDPE); Plastic #5 (Polypropylene); Plastic #6 (Polystyrene); Plastic #7; Plastics (Other); Tin or Steel Cans","false","false","Residential curbside pick-up occurs every other week. Place items on the berm by 7 a.m. on your designated day.","","true","false","false","false"
"City of Grand Forks Yard Waste Drop-off Site - Public Works","","724 North 47th Street","Grand Forks","","ND","58203","7017388740","0","","https://www.grandforksgov.com/","47.9271062","-97.095501","43.6151368584796","","false","false","","","false","false","false","false"
"City of Grand Forks Recycling Drop-off Site","","724 North 47th Street","Grand Forks","","ND","58203","7017388740","0","","","47.9271062","-97.095501","43.6151368584796","","false","false","","","false","false","false","false"
"Sam's Club","Sam's Club","2501 32nd Ave S","Grand Forks","Grand Forks","ND","58201","7017959449","0","Monday: 10:00 AM - 8:30 PM Tuesday: 10:00 AM - 8:30 PM Wednesday: 10:00 AM - 8:30 PM Thursday: 10:00 AM - 8:30 PM Friday: 10:00 AM - 8:30 PM Saturday: 9:00 AM - 8:30 PM Sunday: 12:00 PM - 6:00 PM ","http://www.samsclub.com","47.88892","-97.06348","43.6288680675674","Lead Acid (Pb) Batteries; Video Game Consoles; PlayStation Consoles","false","true","","","false","false","false","false"
"US Post Office","US Post Office","2501 28th Ave S","Grand Forks","Grand Forks","ND","58201","0","0","","https://www.usps.com/ship/recycle-through-usps.htm","47.89215","-97.06356","43.7276201664644","Inkjet Printer Cartridges; Video Game Consoles; PlayStation Consoles","false","true","Free, postage-paid Mail Back envelopes can be found on display in the lobby. There is no limit to the number of envelopes customers may take. The contents of the envelope must weigh less than 13 ounces and the envelope must be able to seal completely. For more details visit<a href="http://www.maxback.com/mxb-postoffice-collaboration" target="_blank">MaxBack</a>.","","false","false","false","false"
"Batteries Plus Bulbs","","2501 S. Columbia Rd.","Grand Forks","","ND","58201","7017720092","0","","https://www.batteriesplus.com/store-locator/nd/024?utm_source=local&utm_medium=earth911","47.8955845","-97.0662226","43.7278704122657","","false","false","","","false","false","false","false"
"Batteries Plus","Batteries Plus","2501 S Columbia Rd","Grand Forks","Grand Forks","ND","58201","7017720092","0","Monday: 8:00 AM - 8:00 PM Tuesday: 8:00 AM - 8:00 PM Wednesday: 8:00 AM - 8:00 PM Thursday: 8:00 AM - 8:00 PM Friday: 8:00 AM - 8:00 PM Saturday: 8:00 AM - 7:00 PM Sunday: 12:00 PM - 5:00 PM ","http://www.batteriesplus.com/store_details/024.aspx","47.89526","-97.06589","43.7311007663452","Compact Fluorescent Lights; Batteries (Rechargeable); Alkaline/Single-Use Batteries; Video Game Consoles; PlayStation Consoles","false","true","Some fees for battery recycling may apply.  Please contact your Local store for details. 
<p>
Batteries Plus lead by example by recycling the majority of the batteries we sell. Not only do we recycle to protect our environment, we support retail and business customers alike by keeping them in full compliance with federal, state, municipal, EPA and DOT regulations governing the disposal and recycling of spent batteries and select electronics.","","false","false","false","false"
"Call2Recycle at Stones Mobile Radio","Call2Recycle at Stones Mobile Radio","1550 47th Ave S","Grand Forks","Grand Forks","ND","58201","7017726691","0","","http://www.stonesmobileradio.com/","47.87583","-97.04898","43.8295450042804","Cell Phones; Ni-Cd Batteries; Li-Ion Batteries; Ni-MH Batteries; Ni-Zn Batteries; Small Sealed Lead Acid Batteries; Video Game Consoles; PlayStation Consoles","false","true","The U.S. EPA estimates that more than 350 million rechargeable batteries are purchased annually in the U.S. Thanks to the environmental commitment of this location, its easy and free to recycle your batteries. Bring your rechargeable batteries to this location and look for the recycling box or ask an associate how you can do your part for the environment.","","false","false","false","false"
"City of Grand Forks Yard Waste Drop-off Site - Duke Drive","","Duke Drive & South 34th Street","Grand Forks","","ND","58203","7017388740","0","","https://www.grandforksgov.com/","47.9143481","-97.0772796","43.8989379339769","","false","false","","","false","false","false","false"
"University of North Dakota Recycling","University of North Dakota Recycling","3791 Campus Rd","Grand Forks","Grand Forks","ND","58202","7017774847","0","","http://und.edu/finance-operations/facilities-management/recycling-at-und.cfm","47.92276","-97.08347","43.9405837751387","Plastic #1 (PETE); Plastic #2 (HDPE); Plastic #2 (Color HDPE); Aluminum Cans; Aluminum; Glass (Blue); Glass (Brown); Cardboard; Catalogs; Glass (Clear); Computer Paper; Glass (Green); Magazines; Newspapers; Phone books; Office Paper; Video Game Consoles; PlayStation Consoles","false","true","This site is located at the Campus Station.","","false","false","false","false"
"City of Grand Forks Yard Waste Drop-off Site - Kraft Field","","20th Avenue South & South 25th Street","Grand Forks","","ND","58203","7017388740","0","","https://www.grandforksgov.com/","47.9003623","-97.0626631","44.0278060617101","","false","false","","","false","false","false","false"
"Altru Hospital Sharps Disposal","Altru Hospital Sharps Disposal","1300 S Columbia Rd","Grand Forks","Grand Forks","ND","58201","7017462570","0","Monday: 8:00 AM - 5:00 PM Tuesday: 8:00 AM - 5:00 PM Wednesday: 8:00 AM - 5:00 PM Thursday: 8:00 AM - 5:00 PM Friday: 8:00 AM - 5:00 PM ","","47.90947","-97.06995","44.0307261658335","Needles / Medical Sharps; Video Game Consoles; PlayStation Consoles","false","true","Sharps Disposal Site - Behind Altru Hospital at the Boiler Plant Entrance. Please place sharps into sturdy plastic container, seal with lid, tape lid, label with permanent marker "Sharps", and bring to this location for proper disposal. Altru provides this disposal location as a service to their customers in their service area. Thank you for your cooperation!","","false","false","false","false"
"O'Reilly Auto Parts","null","3100 Gateway Drive","Grand Forks","","ND","58203","7017467413","0","","http://oreillyauto.custhelp.com/app/error/error_id/6","47.9337926","-97.0901251","44.0675590520413","","false","false","","","false","false","false","false"
"O'Reilly Auto Parts","O'Reilly Auto Parts","4218 Gateway Dr","Grand Forks","Grand Forks","ND","58203","7017467413","0","Monday: 7:30 AM - 9:00 PM Tuesday: 7:30 AM - 9:00 PM Wednesday: 7:30 AM - 9:00 PM Thursday: 7:30 AM - 9:00 PM Friday: 7:30 AM - 9:00 PM Saturday: 7:30 AM - 9:00 PM Saturday: 12:00 PM - 7:00 PM ","http://www.oreillyauto.com/","47.93403","-97.08967","44.0940871470884","Lead Acid (Pb) Batteries; Used Motor Oil; Video Game Consoles; PlayStation Consoles","false","true","Most stores offer Used Oil & Battery Recycling, Battery Testing, 
Electrical & Module Testing, Loaner Tool Program, Drum / Rotor Resurfacing. Call your location for more details.","","false","false","false","false"
"Altru Hospital Sharps Disposal","","1300 South Columbia Road","Grand Forks","","ND","58201","7017462570","0","","","47.9105921","-97.0682767","44.1360489568484","","false","false","","","false","false","false","false"
"O'Reilly Auto Parts","O'Reilly Auto Parts","3105 S Washington St","Grand Forks","Grand Forks","ND","58201","7017723795","0","Monday: 7:30 AM - 9:00 PM Tuesday: 7:30 AM - 9:00 PM Wednesday: 7:30 AM - 9:00 PM Thursday: 7:30 AM - 9:00 PM Friday: 7:30 AM - 9:00 PM Saturday: 7:30 AM - 9:00 PM Sunday: 12:00 PM - 7:00 PM ","http://www.oreillyauto.com/","47.89017","-97.0441","44.4688860469107","Lead Acid (Pb) Batteries; Used Motor Oil; Video Game Consoles; PlayStation Consoles","false","true","Most stores offer Used Oil & Battery Recycling, Battery Testing, 
Electrical & Module Testing, Loaner Tool Program, Drum / Rotor Resurfacing. Call your location for more details.","","false","false","false","false"
"City of Grand Forks Yard Waste Drop-off Site - Kelly/Schroeder School","","32nd Avenue South & Cherry Street","Grand Forks","","ND","58203","7017388740","0","","https://www.grandforksgov.com/","47.8894026","-97.0359341","44.7838099026041","","false","false","","","false","false","false","false"
