name,description,address,city,region,province,postal_code,phone,fax,hours,url,latitude,longitude,distance,materials,pickup,dropoff,notes,groups,curbside,municipal,national,event_only
"Walmart Supercenter","","7016 GB Alford Hwy","Holly Springs","","NC","27540","9195579181","0","","https://www.walmart.com/","35.6368236","-78.8345803","21.7186561099421","","false","false","","","false","false","false","false"
"Harnett County Solid Waste","null","102 E Front St ","Lillington","Harnett County","NC","27546","9108935626","0","","http://harnett.org/","35.3980328","-78.8145935","21.7929363476743","Computer (Recycling); Electronics; Laptop Computers; Printers/Scanners/Fax Machines; Small Televisions; Tablets; Televisions; Video Game Consoles; PlayStation Consoles","false","true","County Residents Only ","Vizio, OEM Indiv, OEM, OEM Municipal sites, Sony","false","false","false","false"
"Lowe's","Lowe's","2240 Ralph Stevens Rd","Holly Springs","Wake ","NC","27540","9195863155","0","","","35.6303504","-78.828566785235","21.8330419360643","Batteries (Rechargeable); Cell Phone Batteries; Cell Phones; Li-Ion Batteries; Ni-Cd Batteries; Ni-MH Batteries; Small Sealed Lead Acid Batteries","false","true","Call or Check Online for Hours","Call2Recycle","false","false","false","false"
"Advance Auto Parts","Advance Auto Parts","106 W Cornelius Harnett Blvd","Lillington","Harnett","NC","27546","9108142192","0","Monday: 7:00 AM - 9:00 PM Tuesday: 7:00 AM - 9:00 PM Wednesday: 7:00 AM - 9:00 PM Thursday: 7:00 AM - 9:00 PM Friday: 7:00 AM - 9:00 PM Saturday: 7:00 AM - 9:00 PM Sunday: 10:00 AM - 8:00 PM ","http://www.advanceautoparts.com","35.41958","-78.8056","21.8523988421973","Lead Acid (Pb) Batteries; Used Motor Oil; Computer (Recycling); Electronics; Laptop Computers; Printers/Scanners/Fax Machines; Small Televisions; Tablets; Televisions; Video Game Consoles; PlayStation Consoles","false","true","","","false","false","false","false"
"Walmart","Walmart","7016 Gb Alford Hwy","Holly Springs","Wake","NC","27540","9195579181","0","","http://www.walmart.com","35.63698","-78.83148","21.879961296067","Lead Acid (Pb) Batteries; Plastic Shopping Bags; Food Storage Bags; Computer (Recycling); Electronics; Laptop Computers; Printers/Scanners/Fax Machines; Small Televisions; Tablets; Televisions; Video Game Consoles; PlayStation Consoles","false","true","","","false","false","false","false"
"Firestone Complete Auto Care","","7200 GB Alford Highway","Holly Springs","","NC","27540","9195521872","0","","https://www.firestonecompleteautocare.com/","35.6352097","-78.8303685","21.8832913347882","","false","false","","","false","false","false","false"
"Johnson Brothers Utility & Paving Company, Inc","Johnson Brothers Utility & Paving Company, Inc","1924 N Main St","Lillington","Harnett","NC","27546","9108938378","0","","http://www.shinglerecycling.org/","35.42402","-78.80056","22.0529877778822","Shingles; Computer (Recycling); Electronics; Laptop Computers; Printers/Scanners/Fax Machines; Small Televisions; Tablets; Televisions; Video Game Consoles; PlayStation Consoles","false","true","For more information on shingle recycling visit <a href="http://www.shinglerecycling.org/index.php" target="_blank">ShingleRecycling.org</a>","","false","false","false","false"
"Town of Fuquay-Varina Christmas Tree Drop-Off Site - Action Park","","609 Wake Chapel Road","Fuquay-varina","","NC","27526","9197531027","0","","https://www.fuquay-varina.org","35.591424","-78.801715","22.3004581541415","","false","false","","","false","false","false","false"
"Advance Auto Parts","null","650 N Main St","HOLLY SPRINGS","WAKE","NC","27540","9195673465","0","Monday: 7:30 AM - 9:00 PM Tuesday: 7:30 AM - 9:00 PM Wednesday: 7:30 AM - 9:00 PM Thursday: 7:30 AM - 9:00 PM Friday: 7:30 AM - 9:00 PM Saturday: 7:30 AM - 9:00 PM Sunday: 9:00 AM - 8:00 PM ","http://www.advanceautoparts.com","35.6626739","-78.8352751","22.5250599755344","Lead Acid (Pb) Batteries; Used Motor Oil; Computer (Recycling); Electronics; Laptop Computers; Printers/Scanners/Fax Machines; Small Televisions; Tablets; Televisions; Video Game Consoles; PlayStation Consoles","false","true","","","false","false","false","false"
"GreenZone Textile Recycling - Fuquay Varina","","1520 Broad Street","Fuquay-varina","","NC","27526","8007671284","0","","http://GZRUSA.com/","35.6051117","-78.8024456","22.5502792235952","","false","false","","","false","false","false","false"
"Barnhill Contracting Corporation","Barnhill Contracting Corporation","1715 Ushy 401 S ","Lillington","Harnett County","NC","27546","2528248273","0","","http://www.shinglerecycling.org/","35.376333","-78.807098","22.709555220974","Shingles; Computer (Recycling); Electronics; Laptop Computers; Printers/Scanners/Fax Machines; Small Televisions; Tablets; Televisions; Video Game Consoles; PlayStation Consoles","false","true","For more information on shingle recycling visit <a href="http://www.shinglerecycling.org/index.php" target="_blank">ShingleRecycling.org</a>","","false","false","false","false"
"Barnhill Contracting Corporation","","1715 U.S. 401","Lillington","","NC","27546","9108932926","0","","http://www.barnhillcontracting.com/","35.376333","-78.807098","22.709555220974","","false","false","","","false","false","false","false"
"Shred Nations","Shred Nations (inside The UPS Store)","624 Holly Springs Rd","Holly Springs","Wake","NC","27540","9192619676","0","Monday: 8:00 AM - 7:00 PM Tuesday: 8:00 AM - 7:00 PM Wednesday: 8:00 AM - 7:00 PM Thursday: 8:00 AM - 7:00 PM Friday: 8:00 AM - 7:00 PM Saturday: 9:00 AM - 4:00 PM ","http://www.shrednations.com/dropoff/location/holly-springs/7348832a-a74a-dfea-5d0d-5273f279cd8d","35.65489","-78.82509","22.7620553165677","Cell Phones; Computer (Recycling); Laptop Computers; Small Televisions; Documents to Shred; Electronics; Printers/Scanners/Fax Machines; Tablets; Televisions; Video Game Consoles; PlayStation Consoles","true","true","Shred Nations offers document shredding, hard drive destruction, electronics recycling and more. Visit website for quotes and full list of services offered in your area. ","","false","false","false","false"
"Wake County Convenience Center Site 2","Wake County Convenience Center Site 2","6025 Old Smithfield Rd ","Apex","Wake County","NC","27539","9199966890","0","Sunday: 7:00 AM - 7:00 PM Monday: 7:00 AM - 7:00 PM Tuesday: 7:00 AM - 7:00 PM Wednesday: 7:00 AM - 7:00 PM Thursday: 7:00 AM - 7:00 PM Friday: 7:00 AM - 7:00 PM Saturday: 7:00 AM - 7:00 PM ","http://www.wakegov.com/","35.682063","-78.84331","22.8495551881721","Aluminum Cans; Bikes; Book Recycling; Cardboard; Carpet; Catalogs; Clothing; Drywall; Glass (Brown); Glass (Clear); Glass (Green); Magazines; Newspapers; Oyster Shells; Paper (Mixed); Paperboard; Phone books; Plastic #1 (PETE); Plastic #2 (HDPE); Plastic #3 (PVC); Plastic #4 (LDPE); Plastic #5 (Polypropylene); Plastic #6 (Polystyrene); Plastic #7; Plastic Bottle Caps; Scrap Metal; Shingles; Shoes; Tin or Steel Cans; Wood; Wood Pallets","false","true","","","false","false","false","false"
"Wake County South Landfill","null","6130 Old Smithfield Rd ","Apex","Wake County","NC","27539","9198567400","0","","http://www.wakegov.com/recycling/division/swl/Pages/default.aspx","35.6830108","-78.8436689","22.8691245003879","Computer (Recycling); Electronics; Laptop Computers; Printers/Scanners/Fax Machines; Small Televisions; Tablets; Televisions; Video Game Consoles; PlayStation Consoles","false","true","County Residents Only ","Vizio, OEM, Sony, OEM Indiv, OEM Municipal sites","false","false","false","false"
"South Wake Household Hazardous Waste Drop-off Facility","","6130 Old Smithfield Rd","Apex","","NC","27540","9198567400","0","","http://www.wakegov.com/recycling/residents/houshazwaste.htm","35.6830108","-78.8436689","22.8691245003879","","false","false","","","false","false","false","false"
"South Wake Multi-Material Recycling Facility","","6130 Old Smithfield Rd","Apex","","NC","27540","9195180273","0","","http://www.wakegov.com/recycling/business/multimaterialdropoff.htm","35.6830108","-78.8436689","22.8691245003879","","false","false","","","false","false","false","false"
"Walmart","Walmart","1051 E Broad St","Fuquay Varina","Wake","NC","27526","9195672350","0","","http://www.walmart.com","35.59311","-78.7912","22.8999316813247","Lead Acid (Pb) Batteries; Plastic Shopping Bags; Food Storage Bags; Computer (Recycling); Electronics; Laptop Computers; Printers/Scanners/Fax Machines; Small Televisions; Tablets; Televisions; Video Game Consoles; PlayStation Consoles","false","true","","","false","false","false","false"
"Wake County Convenience Center #2 - Old Smithfield Road","","6025 Old Smithfield Road","Apex","","NC","27539","9198567400","0","","http://www.wakegov.com/recycling/residents/conveniencectrs.htm","35.6834092","-78.8430676","22.9124762913979","","false","false","","","false","false","false","false"
"Multi-Material Recycling Facility","Multi-Material Recycling Facility","6130 Old Smithfield Rd ","Apex","Wake County","NC","27539","9193874312","0","Monday: 8:00 AM - 4:00 PM Tuesday: 8:00 AM - 4:00 PM Wednesday: 8:00 AM - 4:00 PM Thursday: 8:00 AM - 4:00 PM Friday: 8:00 AM - 4:00 PM Saturday: 8:00 AM - 4:00 PM ","http://www.wakegov.com/","35.6837646","-78.8429052","22.9337105338578","Air Conditioners; Aluminum Cans; Antifreeze; Bikes; Book Recycling; Brake Fluid; Brown Paper Bags; Cardboard; Carpet; Carpet Padding; Catalogs; CD/DVD/Blu-ray/UHD discs; Cell Phones; Children's Toys; Clothing; Computer (Recycling); Computer Monitors; Computer Paper; Cooking Oil; Electronics; Glass (Brown); Glass (Clear); Glass (Green); Laptop Computers; Large Household Appliances; Magazines; Milk Cartons; Newspapers; Office Equipment; Office Paper; Paper (Mixed); Paperboard; Computer Peripherals; Phone books; Plastic #1 (PETE); Plastic #2 (HDPE); Plastic #3 (PVC); Plastic #5 (Polypropylene); Printers/Scanners/Fax Machines; Propane Tanks; Refrigerators; Rigid Plastics; Scrap Metal; Shoes; Small Appliances; Small Electronics; Tablets; Transmission Fluid; Used Motor Oil; Used Tires; VHS & Cassette Tapes; Wood Pallets","false","true","","","false","false","false","false"
"South Wake HHW Drop-off","South Wake HHW Drop-off","6130 Old Smithfield Rd ","Apex","Wake County","NC","27539","9193874312","0","Monday: 8:00 AM - 4:00 PM Tuesday: 8:00 AM - 4:00 PM Wednesday: 8:00 AM - 4:00 PM Thursday: 8:00 AM - 4:00 PM Friday: 8:00 AM - 4:00 PM Saturday: 8:00 AM - 4:00 PM ","http://www.wakegov.com/","35.6837646","-78.8429052","22.9337105338578","Compact Fluorescent Lights; Fire Extinguishers; Fluorescent Lamps/Tubes; Gasoline and Unwanted Fuels; Herbicides; Household Cleaners; Latex Paint; Lead Acid (Pb) Batteries; Mercury Containing Items; Oil-Based Paint; Paint Thinner; Pesticides; Photography Chemicals; Propane Tanks; Small Sealed Lead Acid Batteries; Solvents","false","true","","","false","false","false","false"
"AT&T Wireless","AT&T Wireless","2001 Creekside Landing Dr","Apex","Wake","NC","27502","9193679557","0","","http://www.att.com/","35.7238","-78.87471","23.2259366685477","Cell Phones; Ni-Cd Batteries; Batteries (Rechargeable); Cell Phone Batteries; Tablets; Li-Ion Batteries; Computer (Recycling); Electronics; Laptop Computers; Printers/Scanners/Fax Machines; Small Televisions; Televisions; Video Game Consoles; PlayStation Consoles","false","true","Receive an AT&T Promotion Card worth the trade-in value of your smartphone, tablet, or netbook. You can also donate the trade-in value to Cell Phones for Soldiers.","","false","false","false","false"
"Toner Solutions Inc.","Toner Solutions Inc.","1412 Stewart St","Fuquay Varina","Wake","NC","27526","9193871414","0","Monday: 8:00 AM - 5:00 PM Tuesday: 8:00 AM - 5:00 PM Wednesday: 8:00 AM - 5:00 PM Thursday: 8:00 AM - 5:00 PM Friday: 8:00 AM - 5:00 PM ","http://www.tonersolutions.com","35.6013","-78.78797","23.2395416683274","Laser Toner Cartridges; Computer (Recycling); Electronics; Laptop Computers; Printers/Scanners/Fax Machines; Small Televisions; Tablets; Televisions; Video Game Consoles; PlayStation Consoles","false","true","Toner cartridges may be dropped off or mailed to this site. Please call for mailing labels and instructions.","","false","false","false","false"
"Home Depot","","901 E Broad St","Fuquay-varina","","NC","27526","9195522881","0","","https://ecooptions.homedepot.com/","35.5937577","-78.7836802","23.317890703693","","false","false","","","false","false","false","false"
"Staples","","921 East Broad Street","Fuquay-varina","","NC","27526","9195521693","0","","https://www.staples.com/sbd/cre/marketing/sustainability-center/recycling-services/","35.59387","-78.7833039","23.3403590680284","Alkaline/Single-Use Batteries","false","true","","","false","false","false","false"
"Staples","Staples","921 E Broad St","Fuquay Varina","Wake County","NC","27526","9195521693","0","Monday: 8:00 AM - 9:00 PM Tuesday: 8:00 AM - 9:00 PM Wednesday: 8:00 AM - 9:00 PM Thursday: 8:00 AM - 9:00 PM Friday: 8:00 AM - 9:00 PM Saturday: 9:00 AM - 9:00 PM Sunday: 10:00 AM - 6:00 PM ","https://www.staples.com/recycle","35.5938739","-78.783297","23.3408067098383","AC Power Plugs; Batteries (Rechargeable); Cables & Connectors; Cell Phone Batteries; Cell Phones; Computer (Recycling); Hard Drives; Computer Monitors; Cameras; DVD Players/Blu-Ray Players/DVRs; Electronics; E-Readers; GPS Units; Headphones; Inkjet Printer Cartridges; Laptop Computers; Laser Toner Cartridges; Li-Ion Batteries; MP3 Players; Network Equipment; Ni-Cd Batteries; Ni-MH Batteries; Ni-Zn Batteries; Computer Peripherals; Portable Media Players; Printers/Scanners/Fax Machines; Small Electronics; Small Sealed Lead Acid Batteries; Stereo Equipment; Tablets; Telephones; UPS Batteries/Backup Systems; VCRs; Video Game Systems; Blu-Ray Players; Digital Converter Boxes; Small Televisions; Televisions; Video Game Consoles; PlayStation Consoles; LEGOs; Alkaline/Single-Use Batteries; Batteries (Rechargeable); Cell Phone Batteries; Li-Ion Batteries; Ni-Cd Batteries; Ni-MH Batteries; Small Sealed Lead Acid Batteries; Alkaline/Single-Use Batteries; Button Batteries; Non-rechargeable lithium batteries; Cell Phones","false","true","NO TVs; Limit 6 CEDs per day; ","Vizio, Sony, Call2Recycle, OEM","false","false","false","false"
"Advance Auto Parts","Advance Auto Parts","1233 N Main St","Fuquay Varina","Wake","NC","27526","9195525300","0","Monday: 7:00 AM - 9:00 PM Tuesday: 7:00 AM - 9:00 PM Wednesday: 7:00 AM - 9:00 PM Thursday: 7:00 AM - 9:00 PM Friday: 7:00 AM - 9:00 PM Saturday: 7:00 AM - 9:00 PM Sunday: 10:00 AM - 8:00 PM ","http://www.advanceautoparts.com","35.59213","-78.78056","23.4551765016477","Lead Acid (Pb) Batteries; Used Motor Oil; Computer (Recycling); Electronics; Laptop Computers; Printers/Scanners/Fax Machines; Small Televisions; Tablets; Televisions; Video Game Consoles; PlayStation Consoles","false","true","","","false","false","false","false"
"Chatham County Collection Center & Recycling - Martha's Chapel","","24 Gardner Rd","Apex","","NC","27523","9193875843","0","","https://www.chathamnc.org/services/solid-waste-recycling/collection-centers-recycling/locations-and-hours-of-operation","35.7957736","-78.9761206","23.5563798219036","","false","false","","","false","false","false","false"
"Call2Recycle at the Home Depot","Call2Recycle at the Home Depot","901 E Broad St","Fuquay Varina","Wake","NC","27526","9195522881","0","","http://www.homedepot.com/","35.59328","-78.77738","23.6487785300623","Cell Phones; Compact Fluorescent Lights; Ni-Cd Batteries; Li-Ion Batteries; Ni-MH Batteries; Ni-Zn Batteries; Small Sealed Lead Acid Batteries; Computer (Recycling); Electronics; Laptop Computers; Printers/Scanners/Fax Machines; Small Televisions; Tablets; Televisions; Video Game Consoles; PlayStation Consoles; Batteries (Rechargeable); Cell Phone Batteries; Li-Ion Batteries; Ni-Cd Batteries; Ni-MH Batteries; Small Sealed Lead Acid Batteries","false","true","The Home Depot accepts used rechargeable batteries and compact fluorescent bulbs. Look for the orange drop boxes, usually located near the front entrance near the customer service desk, or ask a store associate for more details.","Call2Recycle","false","false","false","false"
"Shred Nations","Shred Nations (inside The UPS Store)","1421 E Broad St","Fuquay Varina","Wake","NC","27526","9192298575","0","Monday: 8:00 AM - 7:00 PM Tuesday: 8:00 AM - 7:00 PM Wednesday: 8:00 AM - 7:00 PM Thursday: 8:00 AM - 7:00 PM Friday: 8:00 AM - 7:00 PM Saturday: 9:00 AM - 4:00 PM ","http://www.shrednations.com/dropoff/location/fuquay-varina/74b201fd-b388-d447-b15f-5273efdef382","35.59328","-78.77738","23.6487785300623","Cell Phones; Computer (Recycling); Laptop Computers; Small Televisions; Documents to Shred; Electronics; Printers/Scanners/Fax Machines; Tablets; Televisions; Video Game Consoles; PlayStation Consoles","true","true","Shred Nations offers document shredding, hard drive destruction, electronics recycling and more. Visit website for quotes and full list of services offered in your area. ","","false","false","false","false"
"Lee Iron & Metal Co Inc","Lee Iron & Metal Co Inc","2219 S Horner Blvd","Sanford","Lee","NC","27330","9197757951","0","Monday: 8:00 AM - 12:00 PM Tuesday: 8:00 AM - 12:00 PM Wednesday: 8:00 AM - 12:00 PM Thursday: 8:00 AM - 12:00 PM Friday: 8:00 AM - 12:00 PM Monday: 1:00 AM - 4:00 PM Tuesday: 1:00 AM - 4:00 PM Wednesday: 1:00 AM - 4:00 PM Thursday: 1:00 AM - 4:00 PM Friday: 1:00 AM - 4:00 PM ","http://www.leeironandmetal.com","35.46187","-79.14757","3.17502951913066","Aluminum Cans; Aluminum; Cardboard; Ferrous Metals (Steel or Iron); Paper (Mixed); Non-ferrous (Copper/Brass/Tin); High-Temp Alloys; Motors; Computer (Recycling); Electronics; Laptop Computers; Printers/Scanners/Fax Machines; Small Televisions; Tablets; Televisions; Video Game Consoles; PlayStation Consoles","false","true","","","false","false","false","false"
"Lee County Convenience Center & Recycling - Colon Road","","2501 Colon Road","Sanford","","NC","27330","9197184622","0","","https://leecountync.gov/Departments/SolidWaste/GarbageandTrashDisposalInformation","35.5393062","-79.1552987","3.18321361971517","","false","false","","","false","false","false","false"
"Colon Road Convenience Center","Colon Road Convenience Center","2501 Colon Rd ","Sanford","Lee County","NC","27330","9197184622","0","Monday: 7:00 AM - 6:00 PM Tuesday: 7:00 AM - 6:00 PM Wednesday: 7:00 AM - 6:00 PM Thursday: 7:00 AM - 6:00 PM Friday: 7:00 AM - 6:00 PM Saturday: 8:00 AM - 5:00 PM Sunday: 1:00 AM - 5:00 PM ","http://www.leecountync.gov/","35.5390737","-79.1542502","3.19696776345537","Plastic #1 (PETE); Plastic #2 (HDPE); Plastic #2 (Color HDPE); Aerosol Spray Cans; Aluminum Cans; Antifreeze; Brake Fluid; Glass (Brown); Lead Acid (Pb) Batteries; Cardboard; Catalogs; Cell Phones; Christmas Trees; Glass (Clear); Computer Monitors; Computer (Recycling); Ferrous Metals (Steel or Iron); Glass (Green); Inkjet Printer Cartridges; Large Household Appliances; Magazines; Newspapers; Non-ferrous (Copper/Brass/Tin); Tin or Steel Cans; Laser Toner Cartridges; Transmission Fluid; Used Motor Oil; Oil Filters; Electronics; Laptop Computers; Printers/Scanners/Fax Machines; Small Televisions; Tablets; Televisions; Video Game Consoles; PlayStation Consoles","false","true","Lee Countys Convenience Centers are open to all rural county residents only.  All sites are staffed and accept bagged household garbage, furniture, appliances and recyclables. City of Sanford and Town of Broadway residents are not authorized to use this site.","","false","false","false","false"
"Lee Iron & Metal Co Inc","","2219 South Horner Boulevard","Sanford","","NC","27330","9197757951","0","","http://www.leeironandmetal.com","35.4621469","-79.146034","3.21292105580922","","false","false","","","false","false","false","false"
"Carolina Telecom Wireless","","2815 S Horner Blvd","Sanford","","NC","27332","9197181122","0","","","35.4551353","-79.1388092","3.8451899684459","","false","false","","","false","false","false","false"
"Verizon Wireless","Verizon Wireless","2807 S Horner Blvd","Sanford","Lee","NC","27332","9197085566","9197085578","","http://www.verizonwireless.com/","35.45469","-79.13901","3.86220019779715","Cell Phones; Cell Phone Batteries; Computer (Recycling); Electronics; Laptop Computers; Printers/Scanners/Fax Machines; Small Televisions; Tablets; Televisions; Video Game Consoles; PlayStation Consoles","false","true","<A Href="https://www.trade-in.vzw.com/home.aspx">
The Verizon Wireless Trade-In Program</A> allows you to trade in your used handset or tablet in a convenient and responsible way. 
<P>
<P>
Verizon Wireless works every day to protect our environment and give our customers opportunities to do the same. <A Href="http://aboutus.vzw.com/Green_Initiative/overview.html">Click here</A> for more examples of the earth-friendly initiatives and programs Verizon Wireless is proud to offer and support.","","false","false","false","false"
"Lowe's","","3015 S Horner Blvd","Sanford","","NC","27332","9197765644","0","","https://newsroom.lowes.com/responsibility/operational-excellence/","35.4515063","-79.1349719","4.17592493313357","Batteries (Rechargeable); Cell Phone Batteries; Li-Ion Batteries; Ni-Cd Batteries; Ni-MH Batteries; Small Sealed Lead Acid Batteries; Cell Phones","false","true","","Call2Recycle","false","false","false","false"
"Lee County Convenience Center & Recycling - Carbonton Road","","330 Country Estates Dr","Sanford","","NC","27330","9197184622","0","","https://leecountync.gov/Departments/SolidWaste/GarbageandTrashDisposalInformation","35.4913865","-79.2555516","4.18773200498587","","false","false","","","false","false","false","false"
"Call2Recycle at Lowe's","Call2Recycle at Lowe's","3015 S Horner Blvd","Sanford","Lee","NC","27332","9197765644","0","Monday: 6:00 AM - 10:00 PM Tuesday: 6:00 AM - 10:00 PM Wednesday: 6:00 AM - 10:00 PM Thursday: 6:00 AM - 10:00 PM Friday: 6:00 AM - 10:00 PM Saturday: 6:00 AM - 10:00 PM Sunday: 8:00 AM - 8:00 PM ","http://www.lowes.com/","35.45088","-79.13437","4.2308727570772","Cell Phones; Compact Fluorescent Lights; Ni-Cd Batteries; Plastic Shopping Bags; Li-Ion Batteries; Ni-MH Batteries; Ni-Zn Batteries; Small Sealed Lead Acid Batteries; Computer (Recycling); Electronics; Laptop Computers; Printers/Scanners/Fax Machines; Small Televisions; Tablets; Televisions; Video Game Consoles; PlayStation Consoles","false","true","As an environmentally-committed retailer, Lowes offers a recycling center near store entrances to give consumers a free and easy way to properly dispose of rechargeable batteries, cell phones, CFLs and plastic shopping bags; materials that otherwise could be potentially harmful to the environment.  Look for the recycling center or ask a store associate for more details.","","false","false","false","false"
"Carbonton Road Convenience Center","Carbonton Road Convenience Center","330 State Rd 1392 ","Sanford","Lee County","NC","27330","9197184622","0","Monday: 7:00 AM - 6:00 PM Tuesday: 7:00 AM - 6:00 PM Wednesday: 7:00 AM - 6:00 PM Friday: 7:00 AM - 6:00 PM Saturday: 8:00 AM - 5:00 PM Sunday: 1:00 AM - 5:00 PM ","http://www.leecountync.gov/","35.4913728","-79.2563674","4.2334167951955","Plastic #1 (PETE); Plastic #2 (HDPE); Plastic #2 (Color HDPE); Aerosol Spray Cans; Aluminum Cans; Antifreeze; Brake Fluid; Glass (Brown); Lead Acid (Pb) Batteries; Cardboard; Catalogs; Cell Phones; Christmas Trees; Glass (Clear); Computer Monitors; Computer (Recycling); Ferrous Metals (Steel or Iron); Glass (Green); Furniture; Inkjet Printer Cartridges; Large Household Appliances; Magazines; Newspapers; Non-ferrous (Copper/Brass/Tin); Tin or Steel Cans; Laser Toner Cartridges; Transmission Fluid; Used Motor Oil; Oil Filters","false","true","Lee Countys Convenience Centers are open to all rural county residents only.  All sites are staffed and accept bagged household garbage, furniture, appliances and recyclables.","","false","false","false","false"
"Wilson Road Convenience Center","Wilson Road Convenience Center","211 State Rd 1136 ","Sanford","Lee County","NC","27332","9197184622","0","Monday: 7:00 AM - 6:00 PM Tuesday: 7:00 AM - 6:00 PM Wednesday: 7:00 AM - 6:00 PM Thursday: 7:00 AM - 6:00 PM Friday: 7:00 AM - 6:00 PM Saturday: 8:00 AM - 5:00 PM Sunday: 1:00 AM - 5:00 PM ","http://leecountync.gov/","35.444708","-79.1349819","4.55057113168941","Plastic #1 (PETE); Plastic #2 (HDPE); Plastic #2 (Color HDPE); Aerosol Spray Cans; Aluminum Cans; Antifreeze; Brake Fluid; Glass (Brown); Lead Acid (Pb) Batteries; Cardboard; Catalogs; Cell Phones; Christmas Trees; Glass (Clear); Computer Monitors; Computer (Recycling); Ferrous Metals (Steel or Iron); Glass (Green); Inkjet Printer Cartridges; Large Household Appliances; Magazines; Newspapers; Non-ferrous (Copper/Brass/Tin); Tin or Steel Cans; Laser Toner Cartridges; Transmission Fluid; Used Motor Oil; Oil Filters","false","true","Lee Countys Convenience Centers are open to all rural county residents only.  Residents of the City of Sanford or Town of Broadway are not authorized to use the centers. No commercial, industrial or institutional waste is accepted at the centers.","","false","false","false","false"
"Lee County Convenience Center & Recycling - Wilson Road","","211 Wilson Rd","Sanford","","NC","27332","9197184622","0","","https://leecountync.gov/Departments/SolidWaste/GarbageandTrashDisposalInformation","35.444708","-79.1349819","4.55057113168941","","false","false","","","false","false","false","false"
"Walmart Supercenter","","3310 NC Highway 87 S","Sanford","","NC","27332","9197769388","0","","https://www.walmart.com/","35.4424657","-79.1305102","4.823659634002","","false","false","","","false","false","false","false"
