name,description,address,city,region,province,postal_code,phone,fax,hours,url,latitude,longitude,distance,materials,pickup,dropoff,notes,groups,curbside,municipal,national,event_only
"City of Sanford Curbside Recycling","City of Sanford Curbside Recycling","225 E Weatherspoon St","Sanford","Lee","NC","27330","9197758247","0","","http://www.sanfordnc.net/","35.48857","-79.17908","0.701945157557247","Aluminum Cans; Book Recycling; Cardboard; Computer Paper; Milk Cartons; Newspapers; Office Paper; Paper (Mixed); Phone books; Plastic #1 (PETE); Plastic #2 (HDPE); Plastic #3 (PVC); Plastic #4 (LDPE); Plastic #5 (Polypropylene); Plastic #6 (Polystyrene); Plastic #7; Tin or Steel Cans","false","false","","","true","false","false","false"
"OfficeMax","","856 Spring Lane Galleria","Sanford","","NC","27330","9197085323","0","","","35.4890016","-79.1951467","1.00552518433722","","false","false","","","false","false","false","false"
"Lee County Household Hazardous Waste Collection Program","","","Sanford","","NC","27330","9197184622","0","","https://leecountync.gov/Departments/SolidWaste/HouseholdHazardousWaste","35.4798757","-79.1802994","1.29007147447804","","false","false","","","false","false","false","false"
"Lee County Public Works","Lee County Public Works","805 S 5th St","Sanford","Lee","NC","27330","9197748440","0","","http://www.call2recycle.org/","35.4767","-79.16697","1.71795750745093","Cell Phones; Ni-Cd Batteries; Li-Ion Batteries; Ni-MH Batteries; Ni-Zn Batteries; Small Sealed Lead Acid Batteries; Computer (Recycling); Electronics; Laptop Computers; Printers/Scanners/Fax Machines; Small Televisions; Tablets; Televisions; Video Game Consoles; PlayStation Consoles","false","true","The U.S. EPA estimates that more than 350 million rechargeable batteries are purchased annually in the U.S. Thanks to the environmental commitment of this location, its easy and free to recycle your rechargeable batteries. Look for the recycling box or ask a staff member how you can do your part for the environment.","","false","false","false","false"
"Chatham County Collection Center & Recycling - Asbury","","34 Mt View Church Rd","Moncure","","NC","27559","9195427297","0","","https://www.chathamnc.org/services/solid-waste-recycling/collection-centers-recycling/locations-and-hours-of-operation","35.6446567","-79.1789146","10.0979373136244","","false","false","","","false","false","false","false"
"Lee County Convenience Center & Recycling - Rocky Fork Church Road","","5150 Rocky Fork Church Rd","Sanford","","NC","27332","9197184622","0","","https://leecountync.gov/Departments/SolidWaste/GarbageandTrashDisposalInformation","35.3546366","-79.230044","10.3077312720948","","false","false","","","false","false","false","false"
"Chatham County Collection Center & Recycling - Goldston","","7235 Pittsboro Goldston Rd","Pittsboro","","NC","27207","9198984729","0","","https://www.chathamnc.org/services/solid-waste-recycling/collection-centers-recycling/locations-and-hours-of-operation","35.6142559","-79.3013005","10.4495806954558","","false","false","","","false","false","false","false"
"Chatham County Solid Waste & Recycling - Moncure","","2855 Old US 1","Moncure","","NC","27559","9195427298","0","","https://www.chathamnc.org/services/solid-waste-recycling","35.615751","-79.044289","11.1887770478211","","false","false","","","false","false","false","false"
"Cameron Compactor Site","Cameron Compactor Site","276 Cranes Creek Rd ","Cameron","Moore County","NC","28326","9192452994","0","Monday: 7:00 AM - 7:00 PM Tuesday: 7:00 AM - 7:00 PM Wednesday: 7:00 AM - 7:00 PM Thursday: 7:00 AM - 7:00 PM Friday: 7:00 AM - 7:00 PM Saturday: 7:00 AM - 7:00 PM ","http://www.moorecountync.gov/index.php/en/solid-waste/compactor-sites","35.312928","-79.29057","14.2145662625783","Plastic #1 (PETE); Plastic #2 (HDPE); Plastic #2 (Color HDPE); Plastic #3 (PVC); Plastic #4 (LDPE); Plastic #5 (Polypropylene); Plastic #6 (Polystyrene); Plastic #7; Ag Pesticide Container Recycling; Aluminum Cans; Glass (Brown); Cardboard; Glass (Clear); Electronics; Glass (Green); Large Household Appliances; Magazines; Paper (Mixed); Newspapers; Non-ferrous (Copper/Brass/Tin); Tin or Steel Cans; Small Appliances","false","true","This site is located off of Highway 24-47.","","false","false","false","false"
"Moore County Recycling Site - Cameron","","276 Cranes Creek Road","Cameron","","NC","28326","9102452994","0","","","35.312928","-79.29057","14.2145662625783","","false","false","","","false","false","false","false"
"Davis Electronic Solution","Davis Electronic Solution","630 East St Ste 9","Pittsboro","Chatham","NC","27312","9195425550","0","","http://www.radioshack.com/","35.71865","-79.16637","15.2330961736323","Cell Phones; Ni-Cd Batteries; Li-Ion Batteries; Ni-MH Batteries; Ni-Zn Batteries; Small Sealed Lead Acid Batteries; Computer (Recycling); Electronics; Laptop Computers; Printers/Scanners/Fax Machines; Small Televisions; Tablets; Televisions; Video Game Consoles; PlayStation Consoles","false","true","The U.S. EPA estimates that more than 350 million rechargeable batteries are purchased annually in the U.S. Thanks to the environmental commitment of this location, its easy and free to recycle your batteries. Bring your rechargeable batteries to this location and look for the recycling box or ask an associate how you can do your part for the environment.","","false","false","false","false"
"Pittsboro Curbside Recycling","Pittsboro Curbside Recycling","PO Box 759","Pittsboro","Chatham","NC","27312","9195961363","0","","http://pittsboronc.gov/","35.71886","-79.1613","15.2662305413497","Aluminum Cans; Cardboard; Catalogs; Computer Paper; Glass (Brown); Glass (Clear); Glass (Green); Magazines; Milk Cartons; Newspapers; Office Paper; Paperboard; Plastic #1 (PETE); Plastic #2 (HDPE); Tin or Steel Cans","false","false","","","true","false","false","false"
"Advance Auto Parts","Advance Auto Parts","462 East St","Pittsboro","Chatham","NC","27312","9195422899","0","Monday: 7:00 AM - 9:00 PM Tuesday: 7:00 AM - 9:00 PM Wednesday: 7:00 AM - 9:00 PM Thursday: 7:00 AM - 9:00 PM Friday: 7:00 AM - 9:00 PM Saturday: 7:00 AM - 9:00 PM Sunday: 10:00 AM - 8:00 PM ","http://www.advanceautoparts.com","35.71952","-79.16905","15.2854159168122","Lead Acid (Pb) Batteries; Used Motor Oil; Computer (Recycling); Electronics; Laptop Computers; Printers/Scanners/Fax Machines; Small Televisions; Tablets; Televisions; Video Game Consoles; PlayStation Consoles","false","true","","","false","false","false","false"
"Habitat for Humanity Restore","Habitat for Humanity Restore","467 West St ","Pittsboro","Chatham County","NC","27312","9195420788","0","","http://www.habitat.org","35.720133","-79.1854275","15.3129422369115","Aluminum Cans; Carpet; Ceiling Tiles; Ceramic Tiles; Construction Materials (Reuse); Gift Bags; Household Goods; Linoleum; Ornaments; Porcelain; Roofing Materials; Windows; Computer (Recycling); Electronics; Laptop Computers; Printers/Scanners/Fax Machines; Small Televisions; Tablets; Televisions; Video Game Consoles; PlayStation Consoles","false","true","The ReStore raises funds by selling merchandise and, after expenses, uses all profits to build more homes.  Habitat also provides families an opportunity to buy building materials that they may not otherwise be able to afford. This will help raise the standards of housing. By recycling goods that would have been sent to a landfill, the ReStore also helps reduce waste disposal costs. If you have materials to donate, please call for more information. The Habitat ReStore takes most materials and the staff will be glad to talk with you.","","false","false","false","false"
"Chatham County Collection Center & Recycling - Pittsboro","","180 Martin Luther King Jr Dr","Pittsboro","","NC","27312","9195450640","0","","https://www.chathamnc.org/services/solid-waste-recycling/collection-centers-recycling/locations-and-hours-of-operation","35.7201463","-79.1772371","15.3143482098501","","false","false","","","false","false","false","false"
"Harnett County Convenience/Recycling Center - Johnsonville","","501 Brooks Mangum Rd","Cameron","","NC","28326","9104992401","0","","http://www.harnett.org/waste/recycle.asp","35.283892","-79.091415","15.6746968513446","","false","false","","","false","false","false","false"
"Harnett County Convenience/Recycling Center - Northwest","","1260 Cokesbury Rd","Fuquay-varina","","NC","27526","9105522363","0","","http://www.harnett.org/waste/recycle.asp","35.5048483","-78.8961992","16.0598052480409","","false","false","","","false","false","false","false"
"Advance Auto Parts","Advance Auto Parts","3836 Us Highway 15-501","Carthage","Moore County","NC","28327","9109471047","0","Monday: 7:00 AM - 9:00 PM Tuesday: 7:00 AM - 9:00 PM Wednesday: 7:00 AM - 9:00 PM Thursday: 7:00 AM - 9:00 PM Friday: 7:00 AM - 9:00 PM Saturday: 7:00 AM - 9:00 PM Sunday: 10:00 AM - 8:00 PM ","http://www.advanceautoparts.com","35.3434201","-79.3954914","16.118968500048","Lead Acid (Pb) Batteries; Used Motor Oil; Computer (Recycling); Electronics; Laptop Computers; Printers/Scanners/Fax Machines; Small Televisions; Tablets; Televisions; Video Game Consoles; PlayStation Consoles","false","true","","","false","false","false","false"
"Chatham County Collection Center & Recycling - Bonlee","","1528 Elmer Moore Rd","Siler City","","NC","27213","9198375898","0","","https://www.chathamnc.org/services/solid-waste-recycling/collection-centers-recycling/locations-and-hours-of-operation","35.6471531","-79.4079871","16.3486757896327","","false","false","","","false","false","false","false"
"Chatham County Collection Center & Recycling - Harper's Cross Roads","","19921 Nc Highway 902","Bear Creek","","NC","27207","9198375899","0","","https://www.chathamnc.org/services/solid-waste-recycling/collection-centers-recycling/locations-and-hours-of-operation","35.568437","-79.461543","16.4629718444086","","false","false","","","false","false","false","false"
"Harnett County Convenience/Recycling Center - Mamers","","5375 Old Us 421","Lillington","","NC","27546","9108937508","0","","http://www.harnett.org/waste/recycle.asp","35.4118505","-78.9083594","16.5033414889195","","false","false","","","false","false","false","false"
"Walmart","Walmart","87 Carolina Way ","Sanford","Harnett County","NC","27332","9197769388","0","","http://www.walmart.com","35.282694","-79.055802","16.5095097801801","Lead Acid (Pb) Batteries; Plastic Shopping Bags; Food Storage Bags; Computer (Recycling); Electronics; Laptop Computers; Printers/Scanners/Fax Machines; Small Televisions; Tablets; Televisions; Video Game Consoles; PlayStation Consoles","false","true","","","false","false","false","false"
"Moore County Household Hazardous Waste Collection Program","","","Carthage","","NC","28327","9109473637","0","","","35.3459867","-79.4169711","16.9302708123714","","false","false","","","false","false","false","false"
"Keep America Beautiful Cars to Donate","","","Carthage","","NC","28327","8554262474","0","","https://www.kab.org/?pagename=car_donation","35.3459867","-79.4169711","16.9302708123714","","false","false","","","false","false","false","false"
"Lowe's","","121 Lowes Drive","Pittsboro","","NC","27312","9196424030","0","","https://newsroom.lowes.com/responsibility/operational-excellence/","35.7452829","-79.1654353","17.0732721169218","","false","false","","","false","false","false","false"
"Call2Recycle at Lowe's","Call2Recycle at Lowe's","121 Lowes Dr","Pittsboro","Chatham","NC","27312","9196424030","0","Monday: 6:00 AM - 10:00 PM Tuesday: 6:00 AM - 10:00 PM Wednesday: 6:00 AM - 10:00 PM Thursday: 6:00 AM - 10:00 PM Friday: 6:00 AM - 10:00 PM Saturday: 6:00 AM - 10:00 PM Sunday: 8:00 AM - 8:00 PM ","http://www.lowes.com/","35.74526","-79.1644","17.0748869238633","Cell Phones; Compact Fluorescent Lights; Ni-Cd Batteries; Plastic Shopping Bags; Li-Ion Batteries; Ni-MH Batteries; Ni-Zn Batteries; Small Sealed Lead Acid Batteries; Computer (Recycling); Electronics; Laptop Computers; Printers/Scanners/Fax Machines; Small Televisions; Tablets; Televisions; Video Game Consoles; PlayStation Consoles; Batteries (Rechargeable); Cell Phone Batteries; Li-Ion Batteries; Ni-Cd Batteries; Ni-MH Batteries; Small Sealed Lead Acid Batteries; Cell Phones","false","true","As an environmentally-committed retailer, Lowes offers a recycling center near store entrances to give consumers a free and easy way to properly dispose of rechargeable batteries, cell phones, CFLs and plastic shopping bags; materials that otherwise could be potentially harmful to the environment.  Look for the recycling center or ask a store associate for more details.","Call2Recycle","false","false","false","false"
"Chatham County Solid Waste & Recycling Main Facility","","28 County Services Rd.","Pittsboro","","NC","27312","9195425516","0","","https://www.chathamnc.org/services/solid-waste-recycling/main-facility-office","35.7415212","-79.2634849","17.4073238708353","","false","false","","","false","false","false","false"
"Chatham County Household Hazardous Waste Facility","","39 County Services Rd.","Pittsboro","","NC","27312","9195425516","0","","https://www.chathamnc.org/services/solid-waste-recycling/household-hazardous-waste","35.7419213","-79.263072","17.4278823833705","","false","false","","","false","false","false","false"
"Southeastern IT Asset Management","","","Raleigh","","NC","27312","9194751883","0","","http://www.SEITAM.com/","35.7524399","-79.1774268","17.5451143082422","","false","false","","","false","false","false","false"
"Harnett County Solid Waste","null","1086 Poplar Dr ","Lillington","Harnett County","NC","27546","9108935626","0","","http://harnett.org/","35.292989","-78.995762","17.6411010410958","Computer (Recycling); Electronics; Laptop Computers; Printers/Scanners/Fax Machines; Small Televisions; Tablets; Televisions; Video Game Consoles; PlayStation Consoles","false","true","County Residents Only ","Vizio, OEM, Sony, OEM Municipal sites, OEM Indiv","false","false","false","false"
"Harnett County Landfill/Transfer Station/Recycling Center - Anderson Creek Facility","","1086 Poplar Dr","Spring Lake","","NC","28390","9108973222","0","","http://www.harnett.org/waste/recycle.asp","35.2911387","-78.9969832","17.7037474369022","","false","false","","","false","false","false","false"
"Wake County Convenience Center Site 9","Wake County Convenience Center Site 9","3337 New Hill Holleman Rd ","New Hill","Wake County","NC","27562","9198566186","0","Sunday: 7:00 AM - 7:00 PM Monday: 7:00 AM - 7:00 PM Tuesday: 7:00 AM - 7:00 PM Wednesday: 7:00 AM - 7:00 PM Thursday: 7:00 AM - 7:00 PM Friday: 7:00 AM - 7:00 PM Saturday: 7:00 AM - 7:00 PM ","http://www.wakegov.com/","35.6644964","-78.928993","18.248480405172","Plastic #1 (PETE); Plastic #2 (HDPE); Plastic #3 (PVC); Plastic #4 (LDPE); Plastic #5 (Polypropylene); Plastic #6 (Polystyrene); Plastic #7; Aluminum Cans; Book Recycling; Glass (Brown); Brown Paper Bags; Cardboard; Catalogs; Chipboard; Glass (Clear); Clothing; Computer Paper; Gift Boxes; Glass (Green); Greeting Cards; Furniture; Magazines; Paper (Mixed); Newspapers; Paperboard; Phone books; Tin or Steel Cans; Office Paper; Shoes; Milk Cartons; Oyster Shells","false","true","","","false","false","false","false"
"Wake County Convenience Center #9 - New Hill-Holleman Road","","3337 New Hill-Holleman Road","New Hill","","NC","27562","9198567400","0","","http://www.wakegov.com/recycling/residents/conveniencectrs.htm","35.6649478","-78.9289955","18.267954565028","","false","false","","","false","false","false","false"
"Chatham County Collection Center & Recycling - Hadley","","65 E Perry Rd","Pittsboro","","NC","27312","9195426086","0","","https://www.chathamnc.org/services/solid-waste-recycling/collection-centers-recycling/locations-and-hours-of-operation","35.7679736","-79.1662813","18.6366734749792","","false","false","","","false","false","false","false"
"Moore County Public Utilities","null","5227 US-15 ","Carthage","Moore County","NC","28327","9109476315","0","","https://www.moorecountync.gov/public-works/public-utilities","35.3077687","-79.4168916","18.6875138084687","Computer (Recycling); Electronics; Laptop Computers; Printers/Scanners/Fax Machines; Small Televisions; Tablets; Televisions; Video Game Consoles; PlayStation Consoles","false","true","County Residents Only ","OEM, Vizio, OEM Indiv, OEM Municipal sites, Sony","false","false","false","false"
"Carthage Compactor Site","Carthage Compactor Site","5361 Us 15 501 Hwy ","Carthage","Moore County","NC","28327","9109472704","0","Monday: 7:00 AM - 7:00 PM Tuesday: 7:00 AM - 7:00 PM Wednesday: 7:00 AM - 7:00 PM Thursday: 7:00 AM - 7:00 PM Friday: 7:00 AM - 7:00 PM Saturday: 7:00 AM - 7:00 PM ","http://www.moorecountync.gov/index.php/en/solid-waste/compactor-sites","35.304129","-79.4175829","18.8932671038284","Plastic #1 (PETE); Plastic #2 (HDPE); Plastic #2 (Color HDPE); Plastic #3 (PVC); Plastic #4 (LDPE); Plastic #5 (Polypropylene); Plastic #6 (Polystyrene); Plastic #7; Aluminum Cans; Glass (Brown); Lead Acid (Pb) Batteries; Cardboard; Glass (Clear); Electronics; Glass (Green); Greeting Cards; Large Household Appliances; Magazines; Paper (Mixed); Newspapers; Non-ferrous (Copper/Brass/Tin); Tin or Steel Cans; Used Motor Oil; Oil Filters; Small Appliances","false","true","This siet is located near the intersection of Highway 15-501 and Highway 22.","","false","false","false","false"
"Moore County Recycling Site - Carthage","","5361 US Highway 15-501","Carthage","","NC","28327","9109472704","0","","","35.304129","-79.4175829","18.8932671038284","","false","false","","","false","false","false","false"
"USPS Post Office Box Lobby Recycling Program","US Post Office","278 Camp Easter Rd","Lakeview","Moore","NC","28350","8002758777","0","","https://www.usps.com/","35.24253","-79.30749","19.0547683820351","Catalogs; Greeting Cards; Magazines; Paper (Mixed)","false","true","","","false","false","false","false"
"Moore County Recycling Site - Midway","","10496 NC Highway 24 27","Carthage","","NC","28327","9109483720","0","","","35.385528","-79.492722","19.1724138661933","","false","false","","","false","false","false","false"
"Midway Compactor Site","Midway Compactor Site","10496 State Hwy 27 ","Carthage","Moore County","NC","28327","9109473636","9109471992","Monday: 7:00 AM - 7:00 PM Tuesday: 7:00 AM - 7:00 PM Wednesday: 7:00 AM - 7:00 PM Thursday: 7:00 AM - 7:00 PM Friday: 7:00 AM - 7:00 PM Saturday: 7:00 AM - 7:00 PM Sunday: 1:00 AM - 6:00 PM ","http://www.moorecountync.gov","35.3852127","-79.492949","19.1929907825359","Aluminum Cans; Aluminum; Automobile Parts; Cardboard; Cell Phones; Computer Monitors; Computer (Recycling); Electronics; Ferrous Metals (Steel or Iron); Large Household Appliances; Magazines; Newspapers; Non-ferrous (Copper/Brass/Tin); Tin or Steel Cans; MP3 Players; Laptop Computers; Printers/Scanners/Fax Machines; Small Televisions; Tablets; Televisions; Video Game Consoles; PlayStation Consoles","false","true","This site is located on the right hand side just before the intersection with Plank Road.","","false","false","false","false"
"Walmart","Walmart","14215 US Highway 64 W","Siler City","Chatham","NC","27344","9196636000","0","","http://www.walmart.com","35.75196","-79.3373","19.5716690751213","Lead Acid (Pb) Batteries; Plastic Shopping Bags; Food Storage Bags; Computer (Recycling); Electronics; Laptop Computers; Printers/Scanners/Fax Machines; Small Televisions; Tablets; Televisions; Video Game Consoles; PlayStation Consoles","false","true","","","false","false","false","false"
"US Post Office","US Post Office","1200 S Horner Blvd","Sanford","Lee","NC","27330","0","0","","https://www.usps.com/ship/recycle-through-usps.htm","35.46933","-79.16534","2.2148017923633","Inkjet Printer Cartridges; Computer (Recycling); Electronics; Laptop Computers; Printers/Scanners/Fax Machines; Small Televisions; Tablets; Televisions; Video Game Consoles; PlayStation Consoles","false","true","Free, postage-paid Mail Back envelopes can be found on display in the lobby. There is no limit to the number of envelopes customers may take. The contents of the envelope must weigh less than 13 ounces and the envelope must be able to seal completely. For more details visit<a href="http://www.maxback.com/mxb-postoffice-collaboration" target="_blank">MaxBack</a>.","","false","false","false","false"
"Walgreens","Walgreens","1956 S Horner Blvd","Sanford","Lee","NC","27330","9197754361","0","","http://www.walgreens.com","35.4653","-79.15553","2.72424602407308","Cell Phones; Inkjet Cartridge Refilling; Inkjet Printer Cartridges; Computer (Recycling); Electronics; Laptop Computers; Printers/Scanners/Fax Machines; Small Televisions; Tablets; Televisions; Video Game Consoles; PlayStation Consoles","false","true","","","false","false","false","false"
"JE Womble & Sons","JE Womble & Sons","807 W Front St","Lillington","Harnett","NC","27546","9108935753","0","","http://www.radioshack.com/","35.40114","-78.82874","20.9695148659293","Cell Phones; Ni-Cd Batteries; Li-Ion Batteries; Ni-MH Batteries; Ni-Zn Batteries; Small Sealed Lead Acid Batteries; Computer (Recycling); Electronics; Laptop Computers; Printers/Scanners/Fax Machines; Small Televisions; Tablets; Televisions; Video Game Consoles; PlayStation Consoles","false","true","The U.S. EPA estimates that more than 350 million rechargeable batteries are purchased annually in the U.S. Thanks to the environmental commitment of this location, its easy and free to recycle your batteries. Bring your rechargeable batteries to this location and look for the recycling box or ask an associate how you can do your part for the environment.","","false","false","false","false"
"Chatham County Collection Center & Recycling - Siler City East","","135 Silk Hope Rd","Siler City","","NC","27344","9196635990","0","","https://www.chathamnc.org/services/solid-waste-recycling/collection-centers-recycling/locations-and-hours-of-operation","35.736795","-79.413893","21.0048169784581","","false","false","","","false","false","false","false"
"Chatham County Collection Center & Recycling - Bennett","","3142 Bennett-Siler City Rd","Bennett","","NC","27344","9195813730","0","","www.chathamnc.org/recycle","35.5742843","-79.5441111","21.0413726267086","","false","false","","","false","false","false","false"
"Walmart Supercenter","","14215 Us Highway 64 W","Siler City","","NC","27344","9196636000","0","","https://www.walmart.com/","35.7330512","-79.4281238","21.3132416944459","","false","false","","","false","false","false","false"
"Walmart Tire and Lube Express","","14215 U.S. 64","Siler City","","NC","27344","9196636000","0","","https://www.walmart.com/cp/ideas/8932632","35.7330512","-79.4281238","21.3132416944459","","false","false","","","false","false","false","false"
"Target","Target","100 Grand Hill Place","Holly Springs","Wake","NC","27540","9197623149","0","","http://www.target.com/","35.66713","-78.86245","21.3854204369179","Aluminum Cans; Cell Phones; Inkjet Printer Cartridges; MP3 Players; Plastic #1 (PETE); Plastic #2 (HDPE); Plastic Shopping Bags; Computer (Recycling); Electronics; Laptop Computers; Printers/Scanners/Fax Machines; Small Televisions; Tablets; Televisions; Video Game Consoles; PlayStation Consoles","false","true","","","false","false","false","false"
"Winn Dixie","Winn Dixie","1348 N Main St","Fuquay Varina","Wake","NC","27526","9195521195","0","Sunday: 12:00 AM - 11:59 PM Monday: 12:00 AM - 11:59 PM Tuesday: 12:00 AM - 11:59 PM Wednesday: 12:00 AM - 11:59 PM Thursday: 12:00 AM - 11:59 PM Friday: 12:00 AM - 11:59 PM Saturday: 12:00 AM - 11:59 PM ","","35.55989","-78.80748","21.4598188815804","Brown Paper Bags; Plastic Shopping Bags; Food Storage Bags; Computer (Recycling); Electronics; Laptop Computers; Printers/Scanners/Fax Machines; Small Televisions; Tablets; Televisions; Video Game Consoles; PlayStation Consoles","false","true","","","false","false","false","false"
"Verizon Wireless","Verizon Wireless","1382 N Main St","Fuquay Varina","Wake","NC","27526","8666444532","0","","http://www.verizonwireless.com/","35.55989","-78.80748","21.4598188815804","Cell Phones; Cell Phone Batteries; Computer (Recycling); Electronics; Laptop Computers; Printers/Scanners/Fax Machines; Small Televisions; Tablets; Televisions; Video Game Consoles; PlayStation Consoles","false","true","<A Href="https://www.trade-in.vzw.com/home.aspx">
The Verizon Wireless Trade-In Program</A> allows you to trade in your used handset or tablet in a convenient and responsible way. 
<P>
<P>
Verizon Wireless works every day to protect our environment and give our customers opportunities to do the same. <A Href="http://aboutus.vzw.com/Green_Initiative/overview.html">Click here</A> for more examples of the earth-friendly initiatives and programs Verizon Wireless is proud to offer and support.","","false","false","false","false"
"Habitat for Humanity Fuquay-Varina ReStore","Habitat for Humanity Fuquay-Varina ReStore","1348 N Main St","Fuquay Varina","Wake","NC","27526","9195525800","0","Monday: 10:00 AM - 6:00 PM Tuesday: 10:00 AM - 6:00 PM Wednesday: 10:00 AM - 6:00 PM Thursday: 10:00 AM - 6:00 PM Friday: 10:00 AM - 6:00 PM Saturday: 9:00 AM - 5:00 PM ","http://wakerestore.org/","35.55989","-78.80748","21.4598188815804","Carpet; Ceiling Tiles; Ceramic Tiles; Construction Materials (Reuse); Furniture; Lumber; Miscellaneous Tools; Office Furniture; Paint Donation; Reusable Appliance Donation; Windows; Computer (Recycling); Electronics; Laptop Computers; Printers/Scanners/Fax Machines; Small Televisions; Tablets; Televisions; Video Game Consoles; PlayStation Consoles","true","true","","","false","false","false","false"
"O'Reilly Auto Parts","null","1718 East 11th Street","Siler City","","NC","27344","9196630321","0","","http://oreillyauto.custhelp.com/app/error/error_id/6","35.7332664","-79.4365884","21.6362266202057","","false","false","","","false","false","false","false"
