name,description,address,city,region,province,postal_code,phone,fax,hours,url,latitude,longitude,distance,materials,pickup,dropoff,notes,groups,curbside,municipal,national,event_only
"Call2Recycle at RadioShack","Call2Recycle at RadioShack","720 NC-24 ","Albemarle","Stanly County","NC","28001","7049823414","0","","http://www.radioshack.com/","35.3437592","-80.1701483","22.0690666665958","Cell Phones; Ni-Cd Batteries; Li-Ion Batteries; Ni-MH Batteries; Ni-Zn Batteries; Small Sealed Lead Acid Batteries; Computer (Recycling); Electronics; Laptop Computers; Printers/Scanners/Fax Machines; Small Televisions; Tablets; Televisions; Video Game Consoles; PlayStation Consoles","false","true","As the first national retailer to partner with Call2Recycle, RadioShack is at the forefront of the rechargeable battery recycling cause and is pleased to offer battery recycling at thousands of convenient RadioShack locations for free.  Simply drop them off at your local RadioShack and theyll take care of the rest.  Ask a store associate for more details.","","false","false","false","false"
"Moore County Household Hazardous Waste Collection Program","","","Carthage","","NC","28327","9109473637","0","","","35.3459867","-79.4169711","22.2689321738698","","false","false","","","false","false","false","false"
"Keep America Beautiful Cars to Donate","","","Carthage","","NC","28327","8554262474","0","","https://www.kab.org/?pagename=car_donation","35.3459867","-79.4169711","22.2689321738698","","false","false","","","false","false","false","false"
"Tractor Supply","null","636 NC 24 27 Bypass East STE 24","Albemarle","","NC","28001","7049838731","0","","https://www.tractorsupply.com/","35.3424158","-80.1740796","22.308213515348","","false","false","","","false","false","false","false"
"AT&T Wireless","AT&T Wireless","723 Leonard Ave ","Albemarle","Stanly County","NC","28001","7049822030","0","","http://www.att.com/","35.3421547","-80.1752434","22.3761971742203","Cell Phones; Ni-Cd Batteries; Batteries (Rechargeable); Cell Phone Batteries; Tablets; Li-Ion Batteries; Computer (Recycling); Electronics; Laptop Computers; Printers/Scanners/Fax Machines; Small Televisions; Televisions; Video Game Consoles; PlayStation Consoles","false","true","Receive an AT&T Promotion Card worth the trade-in value of your smartphone, tablet, or netbook. You can also donate the trade-in value to Cell Phones for Soldiers.","","false","false","false","false"
"Walmart Supercenter","","781 Leonard Ave","Albemarle","","NC","28001","7049836830","0","","https://www.walmart.com/","35.3398415","-80.1758235","22.4555358145738","","false","false","","","false","false","false","false"
"OfficeMax","OfficeMax","619 State Hwy 27 ","Albemarle","Stanly County","NC","28001","7049825040","0","Monday: 9:00 AM - 8:00 PM Tuesday: 9:00 AM - 8:00 PM Wednesday: 9:00 AM - 8:00 PM Thursday: 9:00 AM - 8:00 PM Friday: 9:00 AM - 8:00 PM Saturday: 9:00 AM - 8:00 PM Sunday: 11:00 AM - 6:00 PM ","http://www.officemax.com","35.3443218","-80.1776427","22.4613335425729","Inkjet Cartridge Refilling; Inkjet Printer Cartridges; Laser Toner Cartridges; Computer (Recycling); Electronics; Laptop Computers; Printers/Scanners/Fax Machines; Small Televisions; Tablets; Televisions; Video Game Consoles; PlayStation Consoles","false","true","This location features Phoenix Ink refill kiosks.","","false","false","false","false"
"Walmart","Walmart","781 Leonard Ave","Albemarle","Stanly","NC","28001","7049836830","0","","http://www.walmart.com","35.34193","-80.17707","22.4790891217621","Lead Acid (Pb) Batteries; Plastic Shopping Bags; Food Storage Bags; Computer (Recycling); Electronics; Laptop Computers; Printers/Scanners/Fax Machines; Small Televisions; Tablets; Televisions; Video Game Consoles; PlayStation Consoles","false","true","","","false","false","false","false"
"Stanly County - Norwood Drop-off Site","Stanly County - Norwood Drop-off Site","13095 Indian Mound Rd ","Norwood","Stanly County","NC","28128","7044743469","0","Monday: 7:00 AM - 6:00 PM Tuesday: 7:00 AM - 6:00 PM Thursday: 7:00 AM - 6:00 PM Friday: 7:00 AM - 6:00 PM Saturday: 7:00 AM - 6:00 PM ","http://www.stanlycountync.gov/","35.243755","-80.124682","22.8896474164281","Plastic #1 (PETE); Plastic #2 (HDPE); Plastic #2 (Color HDPE); Aluminum Cans; Glass (Brown); Brown Paper Bags; Cardboard; Catalogs; Glass (Clear); Magazines; Newspapers; Phone books; Tin or Steel Cans; Used Motor Oil; Oil Filters; Computer (Recycling); Electronics; Laptop Computers; Printers/Scanners/Fax Machines; Small Televisions; Tablets; Televisions; Video Game Consoles; PlayStation Consoles","false","true","At Lakeshore Drive","","false","false","false","false"
"Norwood Trash Drop-off Site","Norwood Trash Drop-off Site","13095 Indian Mound Rd ","Norwood","Stanly County","NC","28128","7044743469","0","Monday: 7:00 AM - 6:00 PM Tuesday: 7:00 AM - 6:00 PM Thursday: 7:00 AM - 6:00 PM Friday: 7:00 AM - 6:00 PM Saturday: 7:00 AM - 6:00 PM ","null","35.243755","-80.124682","22.8896474164281","Plastic #1 (PETE); Plastic #2 (HDPE); Plastic #2 (Color HDPE); Plastic #3 (PVC); Plastic #4 (LDPE); Plastic #5 (Polypropylene); Plastic #6 (Polystyrene); Plastic #7; Aluminum Cans; Cardboard; Catalogs; Glass (Clear); Magazines; Newspapers; Tin or Steel Cans; Used Motor Oil; Computer (Recycling); Electronics; Laptop Computers; Printers/Scanners/Fax Machines; Small Televisions; Tablets; Televisions; Video Game Consoles; PlayStation Consoles","false","true","","","false","false","false","false"
"Advance Auto Parts","Advance Auto Parts","1417 Us 52 North","Albemarle","Stanly County","NC","28001","7049831101","0","","http://www.advanceautoparts.com","35.372919","-80.1977692","23.0791727310833","Lead Acid (Pb) Batteries; Used Motor Oil; Computer (Recycling); Electronics; Laptop Computers; Printers/Scanners/Fax Machines; Small Televisions; Tablets; Televisions; Video Game Consoles; PlayStation Consoles","false","true","","","false","false","false","false"
"City of Albemarle","null","1442 N 2nd St ","Albemarle","Stanly County","NC","28001","7049849400","0","","http://www.albemarlenc.gov/home/showdocument?id=3219","35.3703647","-80.198664","23.1639971663355","Computer (Recycling); Electronics; Laptop Computers; Printers/Scanners/Fax Machines; Small Televisions; Tablets; Televisions; Video Game Consoles; PlayStation Consoles","false","true","Municipal Residents Only","Vizio, OEM Indiv, OEM, Sony, OEM Municipal sites","false","false","false","false"
"Moore County Public Utilities","null","5227 US-15 ","Carthage","Moore County","NC","28327","9109476315","0","","https://www.moorecountync.gov/public-works/public-utilities","35.3077687","-79.4168916","23.171608942423","Computer (Recycling); Electronics; Laptop Computers; Printers/Scanners/Fax Machines; Small Televisions; Tablets; Televisions; Video Game Consoles; PlayStation Consoles","false","true","County Residents Only ","Vizio, OEM Indiv, OEM, Sony, OEM Municipal sites","false","false","false","false"
"Carthage Compactor Site","Carthage Compactor Site","5361 Us 15 501 Hwy ","Carthage","Moore County","NC","28327","9109472704","0","Monday: 7:00 AM - 7:00 PM Tuesday: 7:00 AM - 7:00 PM Wednesday: 7:00 AM - 7:00 PM Thursday: 7:00 AM - 7:00 PM Friday: 7:00 AM - 7:00 PM Saturday: 7:00 AM - 7:00 PM ","http://www.moorecountync.gov/index.php/en/solid-waste/compactor-sites","35.304129","-79.4175829","23.2352641388157","Plastic #1 (PETE); Plastic #2 (HDPE); Plastic #2 (Color HDPE); Plastic #3 (PVC); Plastic #4 (LDPE); Plastic #5 (Polypropylene); Plastic #6 (Polystyrene); Plastic #7; Aluminum Cans; Glass (Brown); Lead Acid (Pb) Batteries; Cardboard; Glass (Clear); Electronics; Glass (Green); Greeting Cards; Large Household Appliances; Magazines; Paper (Mixed); Newspapers; Non-ferrous (Copper/Brass/Tin); Tin or Steel Cans; Used Motor Oil; Oil Filters; Small Appliances","false","true","This siet is located near the intersection of Highway 15-501 and Highway 22.","","false","false","false","false"
"Moore County Recycling Site - Carthage","","5361 US Highway 15-501","Carthage","","NC","28327","9109472704","0","","","35.304129","-79.4175829","23.2352641388157","","false","false","","","false","false","false","false"
"Advance Auto Parts","Advance Auto Parts","3836 Us Highway 15-501","Carthage","Moore County","NC","28327","9109471047","0","Monday: 7:00 AM - 9:00 PM Tuesday: 7:00 AM - 9:00 PM Wednesday: 7:00 AM - 9:00 PM Thursday: 7:00 AM - 9:00 PM Friday: 7:00 AM - 9:00 PM Saturday: 7:00 AM - 9:00 PM Sunday: 10:00 AM - 8:00 PM ","http://www.advanceautoparts.com","35.3434201","-79.3954914","23.4799029122767","Lead Acid (Pb) Batteries; Used Motor Oil; Computer (Recycling); Electronics; Laptop Computers; Printers/Scanners/Fax Machines; Small Televisions; Tablets; Televisions; Video Game Consoles; PlayStation Consoles","false","true","","","false","false","false","false"
"Stanly County Household Hazardous Waste Collection Program",""," ","Albemarle","","NC","28001","7049863698","0","","","35.3501426","-80.2000578","23.5650797066897","","false","false","","","false","false","false","false"
"JCPenney","","NC 24 27 Byp East","Albemarle","","NC","28001","7049822176","0","","https://www.jcpenney.com/","35.3394065","-80.1998743","23.7589031460024","","false","false","","","false","false","false","false"
"AL Lowder Inc","","435 Willow Street","Albemarle","","NC","28001","7049824456","0","","","35.3446749","-80.2022824","23.7867084979076","","false","false","","","false","false","false","false"
"AL Lowder Inc","AL Lowder Inc","435 Willow St","Albemarle","Stanly","NC","28001","7049824456","0","","null","35.34476","-80.2027","23.8077393596977","Aluminum Cans; Aluminum; Ferrous Metals (Steel or Iron); Non-ferrous (Copper/Brass/Tin); Scrap Metal; Computer (Recycling); Electronics; Laptop Computers; Printers/Scanners/Fax Machines; Small Televisions; Tablets; Televisions; Video Game Consoles; PlayStation Consoles","false","true","","","false","false","false","false"
"Stanly County - Bethany Drop-off Site","Stanly County - Bethany Drop-off Site","34103 Bethany Rd ","Albemarle","Stanly County","NC","28001","7049824713","0","Monday: 7:00 AM - 6:00 PM Tuesday: 7:00 AM - 6:00 PM Thursday: 7:00 AM - 6:00 PM Friday: 7:00 AM - 6:00 PM Saturday: 7:00 AM - 6:00 PM ","http://www.stanlycountync.gov/","35.393766","-80.2178474","23.9593367316305","Plastic #1 (PETE); Plastic #2 (HDPE); Plastic #2 (Color HDPE); Aluminum Cans; Antifreeze; Glass (Brown); Brown Paper Bags; Cardboard; Catalogs; Glass (Clear); Cooking Oil; Magazines; Newspapers; Phone books; Tin or Steel Cans; Used Motor Oil; Oil Filters; Office Paper; Computer (Recycling); Electronics; Laptop Computers; Printers/Scanners/Fax Machines; Small Televisions; Tablets; Televisions; Video Game Consoles; PlayStation Consoles","false","true","Near Bethany Woods Nursing and Rehabilitation","","false","false","false","false"
"AutoZone","AutoZone","631 State Hwy 27 ","Albemarle","Stanly County","NC","28001","7049851452","0","","http://www.autozone.com","35.3384859","-80.2038828","23.9935622997246","Lead Acid (Pb) Batteries; Used Motor Oil; Computer (Recycling); Electronics; Laptop Computers; Printers/Scanners/Fax Machines; Small Televisions; Tablets; Televisions; Video Game Consoles; PlayStation Consoles","false","true","Most AutoZone stores accept used motor oil, transmission fluid, gear oil and automotive batteries. Call to see what your local store is currently accepting.","","false","false","false","false"
"Stanly County Recycling - Bethany","","34103 Bethany Rd","Albemarle","","NC","28001","7049824713","0","","","35.3930242","-80.219935","24.0826127155014","","false","false","","","false","false","false","false"
"DART Container Corporation","DART Container Corporation","3219 Wesleyan Rd","Randleman","Randolph","NC","27317","3364951101","0","","http://www.foamfacts.com/recycling/public-drop-off-locations/","35.79013","-79.81691","24.3447524497976","Plastic #6 (Polystyrene); Computer (Recycling); Electronics; Laptop Computers; Printers/Scanners/Fax Machines; Small Televisions; Tablets; Televisions; Video Game Consoles; PlayStation Consoles","false","true","Dart Container has pioneered onsite programs for large users of foam products, mail-back programs for users of foam products, curbside recycling programs for foam in coordination with material recovery facilities, as well as public drop-off programs.","","false","false","false","false"
"Dart Container Corporation","","3219 Wesleyan Rd","Randleman","","NC","27317","3364951101","0","","https://www.dartcontainer.com/home/","35.7904062","-79.8163671","24.3623497722284","","false","false","","","false","false","false","false"
"Tabernacle Volunteer Fire Department","Tabernacle Volunteer Fire Department","8136 US Highway 64 W","Trinity","Randolph","NC","27370","3364765115","0","Sunday: 12:00 AM - 11:59 PM Monday: 12:00 AM - 11:59 PM Tuesday: 12:00 AM - 11:59 PM Wednesday: 12:00 AM - 11:59 PM Thursday: 12:00 AM - 11:59 PM Friday: 12:00 AM - 11:59 PM Saturday: 12:00 AM - 11:59 PM ","","35.74805","-80.00768","24.4946420764246","Plastic #1 (PETE); Plastic #2 (HDPE); Plastic #2 (Color HDPE); Aluminum Cans; Glass (Brown); Glass (Clear); Computer Paper; Glass (Green); Greeting Cards; Paper (Mixed); Newspapers; Tin or Steel Cans; Computer (Recycling); Electronics; Laptop Computers; Printers/Scanners/Fax Machines; Small Televisions; Tablets; Televisions; Video Game Consoles; PlayStation Consoles","false","true","","","false","false","false","false"
"Habitat for Humanity Restore","Habitat for Humanity Restore","1506 NC-24 ","Albemarle","Stanly County","NC","28001","7049851050","0","","http://www.habitat.org","35.3345244","-80.2231553","25.1125841602922","Aluminum Cans; Carpet; Ceiling Tiles; Ceramic Tiles; Construction Materials (Reuse); Gift Bags; Household Goods; Linoleum; Ornaments; Porcelain; Roofing Materials; Windows; Computer (Recycling); Electronics; Laptop Computers; Printers/Scanners/Fax Machines; Small Televisions; Tablets; Televisions; Video Game Consoles; PlayStation Consoles","false","true","The ReStore raises funds by selling merchandise and, after expenses, uses all profits to build more homes.  Habitat also provides families an opportunity to buy building materials that they may not otherwise be able to afford. This will help raise the standards of housing. By recycling goods that would have been sent to a landfill, the ReStore also helps reduce waste disposal costs. If you have materials to donate, please call for more information. The Habitat ReStore takes most materials and the staff will be glad to talk with you.","","false","false","false","false"
"Call2Recycle at Lowe's","Call2Recycle at Lowe's","814 NC 24 27 Byp E","Albemarle","Stanly","NC","28001","7049838956","0","Monday: 6:00 AM - 10:00 PM Tuesday: 6:00 AM - 10:00 PM Wednesday: 6:00 AM - 10:00 PM Thursday: 6:00 AM - 10:00 PM Friday: 6:00 AM - 10:00 PM Saturday: 6:00 AM - 10:00 PM Sunday: 8:00 AM - 8:00 PM ","http://www.lowes.com/","35.34547","-80.23847","25.7403923146732","Cell Phones; Compact Fluorescent Lights; Ni-Cd Batteries; Plastic Shopping Bags; Li-Ion Batteries; Ni-MH Batteries; Ni-Zn Batteries; Small Sealed Lead Acid Batteries; Computer (Recycling); Electronics; Laptop Computers; Printers/Scanners/Fax Machines; Small Televisions; Tablets; Televisions; Video Game Consoles; PlayStation Consoles; Batteries (Rechargeable); Cell Phone Batteries; Li-Ion Batteries; Ni-Cd Batteries; Ni-MH Batteries; Small Sealed Lead Acid Batteries; Cell Phones","false","true","As an environmentally-committed retailer, Lowes offers a recycling center near store entrances to give consumers a free and easy way to properly dispose of rechargeable batteries, cell phones, CFLs and plastic shopping bags; materials that otherwise could be potentially harmful to the environment.  Look for the recycling center or ask a store associate for more details.","Call2Recycle","false","false","false","false"
"Stanly County Recycling - Richfield","","175 High Rock Rd.","New London","","NC","28127","7044635404","0","","","35.4819501","-80.2545714","25.9921086729954","","false","false","","","false","false","false","false"
"Chatham County Collection Center & Recycling - Bonlee","","1528 Elmer Moore Rd","Siler City","","NC","27213","9198375898","0","","https://www.chathamnc.org/services/solid-waste-recycling/collection-centers-recycling/locations-and-hours-of-operation","35.6471531","-79.4079871","26.1503726273732","","false","false","","","false","false","false","false"
"Randolph County Recycling Drop-Off Site - Randleman City Hall","","101 Hilliary St","Randleman","","NC","27317","3363186605","0","","","35.8176558","-79.8050282","26.222792492773","","false","false","","","false","false","false","false"
"Walmart Tire and Lube Express","","1021 High Point St","Randleman","","NC","27317","3364956278","0","","https://www.walmart.com/cp/ideas/8932632","35.8196538","-79.8230209","26.3999375669797","","false","false","","","false","false","false","false"
"Walmart Supercenter","","1021 High Point St","Randleman","","NC","27317","3364956278","0","","https://www.walmart.com/","35.8196538","-79.8230209","26.3999375669797","","false","false","","","false","false","false","false"
"Davidson County Recycle Center - Silver Valley","","11331 Old US Highway 64","Lexington","","NC","27292","3362422282","0","","https://www.co.davidson.nc.us","35.7314502","-80.0988264","26.4645734307032","","false","false","","","false","false","false","false"
"Walmart Express","","139 Hwy 49","Richfield","","NC","28137","7044630296","0","","https://www.walmart.com/","35.4734525","-80.2653233","26.5342026012884","","false","false","","","false","false","false","false"
"Walmart Tire & Lube Express","Walmart Tire & Lube Express","1021 High Point St","Randleman","Randolph","NC","27317","3364956278","0","","http://www.walmart.com/catalog/catalog.gsp?cat=495843","35.82196","-79.82399","26.5621906207885","Lead Acid (Pb) Batteries; Used Motor Oil; Oil Filters; Computer (Recycling); Electronics; Laptop Computers; Printers/Scanners/Fax Machines; Small Televisions; Tablets; Televisions; Video Game Consoles; PlayStation Consoles","false","true","","","false","false","false","false"
"Call2Recycle at RadioShack","Call2Recycle at RadioShack","1019 High Point St","Randleman","Randolph","NC","27317","3364950060","0","","http://www.radioshack.com/","35.82196","-79.82399","26.5621906207885","Cell Phones; Ni-Cd Batteries; Li-Ion Batteries; Ni-MH Batteries; Ni-Zn Batteries; Small Sealed Lead Acid Batteries; Computer (Recycling); Electronics; Laptop Computers; Printers/Scanners/Fax Machines; Small Televisions; Tablets; Televisions; Video Game Consoles; PlayStation Consoles","false","true","As the first national retailer to partner with Call2Recycle, RadioShack is at the forefront of the rechargeable battery recycling cause and is pleased to offer battery recycling at thousands of convenient RadioShack locations for free.  Simply drop them off at your local RadioShack and theyll take care of the rest.  Ask a store associate for more details.","","false","false","false","false"
"Advance Auto Parts","","981 High Point St","Randleman","","NC","27317","3364950002","0","","http://shop.advanceautoparts.com/webapp/wcs/stores/servlet/home___","35.8220313","-79.8227145","26.5629410842028","","false","false","","","false","false","false","false"
"Charlotte Road Drop-off Site","Charlotte Road Drop-off Site","26162 Newt Rd","Albemarle","Stanly","NC","28001","7049822645","0","Monday: 7:00 AM - 6:00 PM Thursday: 7:00 AM - 6:00 PM Friday: 7:00 AM - 6:00 PM Saturday: 7:00 AM - 6:00 PM ","null","35.3283203","-80.247856","26.5692950794551","Plastic #1 (PETE); Plastic #2 (HDPE); Plastic #2 (Color HDPE); Plastic #3 (PVC); Plastic #4 (LDPE); Plastic #5 (Polypropylene); Plastic #6 (Polystyrene); Plastic #7; Aluminum Cans; Antifreeze; Cardboard; Catalogs; Glass (Clear); Magazines; Newspapers; Tin or Steel Cans; Used Motor Oil; Computer (Recycling); Electronics; Laptop Computers; Printers/Scanners/Fax Machines; Small Televisions; Tablets; Televisions; Video Game Consoles; PlayStation Consoles","false","true","","","false","false","false","false"
"Stanly County - Newt Road Drop-off Site","Stanly County - Newt Road Drop-off Site","26162 State Rd 1258 ","Albemarle","Stanly County","NC","28001","7049822645","0","Monday: 7:00 AM - 6:00 PM Tuesday: 7:00 AM - 6:00 PM Thursday: 7:00 AM - 6:00 PM Friday: 7:00 AM - 6:00 PM Saturday: 7:00 AM - 6:00 PM ","http://www.stanlycountync.gov/","35.3283203","-80.247856","26.5692950794551","Plastic #1 (PETE); Plastic #2 (HDPE); Plastic #2 (Color HDPE); Aluminum Cans; Glass (Brown); Brown Paper Bags; Cardboard; Cell Phones; Glass (Clear); Computer Monitors; Computer (Recycling); Large Household Appliances; Magazines; Newspapers; Office Equipment; Phone books; Telephones; Televisions; Tin or Steel Cans; Used Motor Oil; Oil Filters; Laptop Computers; Computer Peripherals; Refrigerators; VCRs; DVD Players/Blu-Ray Players/DVRs; Electronics; Printers/Scanners/Fax Machines; Small Televisions; Tablets; Video Game Consoles; PlayStation Consoles","false","true","Beside the Agri-Civic Center on the right.","","false","false","false","false"
"Stanly County Recycling - Newt Road","","26162 Newt Road","Albemarle","","NC","28001","7049822645","0","","","35.3283203","-80.247856","26.5692950794551","","false","false","","","false","false","false","false"
"Moore County Recycling Site - Landfill","","456 Turning Leaf Way","Aberdeen","","NC","28315","9106733027","0","","","35.1475599","-79.4812972","26.7914542669212","","false","false","","","false","false","false","false"
"Bish Enterprises Inc","Bish Enterprises Inc","277 Bish Rd ","Siler City","","NC","27344","9196633336","0","","null","35.756308","-79.5040439","27.4188425245215","Aluminum; Ferrous Metals (Steel or Iron); Non-ferrous (Copper/Brass/Tin); High-Temp Alloys; Special Metals; Computer (Recycling); Electronics; Laptop Computers; Printers/Scanners/Fax Machines; Small Televisions; Tablets; Televisions; Video Game Consoles; PlayStation Consoles","false","true","","","false","false","false","false"
"Bish Enterprises, Inc","","277 Bish Road","Siler City","","NC","27344","9196633336","0","","","35.756308","-79.5040439","27.4188425245215","","false","false","","","false","false","false","false"
"Kohl's","","190 Brucewood Road","Southern Pines","","NC","28387","9102460148","0","","https://corporate.kohls.com/","35.1718691","-79.4209808","28.0223388542649","","false","false","","","false","false","false","false"
"Sandhills Recycling Company","Sandhills Recycling Company","  ","Southern Pines","Moore County","NC","28387","9109445601","0","Monday: 8:00 AM - 4:00 PM Tuesday: 8:00 AM - 4:00 PM Wednesday: 8:00 AM - 4:00 PM Thursday: 8:00 AM - 4:00 PM Friday: 8:00 AM - 4:00 PM ","","35.1675991","-79.4241026","28.085736485378","Aluminum Cans; Glass (Brown); Glass (Clear); Ferrous Metals (Steel or Iron); Glass (Green); Non-ferrous (Copper/Brass/Tin); Tin or Steel Cans; Computer (Recycling); Electronics; Laptop Computers; Printers/Scanners/Fax Machines; Small Televisions; Tablets; Televisions; Video Game Consoles; PlayStation Consoles","false","true","","","false","false","false","false"
"Call2Recycle at Lowe's","Call2Recycle at Lowe's","10845 S US Highway 15 501","Southern Pines","Moore","NC","28387","9106931010","0","Monday: 6:00 AM - 10:00 PM Tuesday: 6:00 AM - 10:00 PM Wednesday: 6:00 AM - 10:00 PM Thursday: 6:00 AM - 10:00 PM Friday: 6:00 AM - 10:00 PM Saturday: 6:00 AM - 10:00 PM Sunday: 8:00 AM - 8:00 PM ","http://www.lowes.com/","35.1679","-79.42149","28.1820333801993","Cell Phones; Compact Fluorescent Lights; Ni-Cd Batteries; Plastic Shopping Bags; Li-Ion Batteries; Ni-MH Batteries; Ni-Zn Batteries; Small Sealed Lead Acid Batteries; Computer (Recycling); Electronics; Laptop Computers; Printers/Scanners/Fax Machines; Small Televisions; Tablets; Televisions; Video Game Consoles; PlayStation Consoles; Batteries (Rechargeable); Cell Phone Batteries; Li-Ion Batteries; Ni-Cd Batteries; Ni-MH Batteries; Small Sealed Lead Acid Batteries; Cell Phones","false","true","As an environmentally-committed retailer, Lowes offers a recycling center near store entrances to give consumers a free and easy way to properly dispose of rechargeable batteries, cell phones, CFLs and plastic shopping bags; materials that otherwise could be potentially harmful to the environment.  Look for the recycling center or ask a store associate for more details.","Call2Recycle","false","false","false","false"
"Stanly County - Millingport Drop-off Site","Stanly County - Millingport Drop-off Site","34877 State Rd 1427 ","New London","Stanly County","NC","28127","7049824573","0","Monday: 7:00 AM - 6:00 PM Thursday: 7:00 AM - 6:00 PM Friday: 7:00 AM - 6:00 PM Saturday: 7:00 AM - 6:00 PM ","http://www.stanlycountync.gov/","35.3859405","-80.2924974","28.1985452512313","Plastic #1 (PETE); Plastic #2 (HDPE); Plastic #2 (Color HDPE); Aluminum Cans; Glass (Brown); Brown Paper Bags; Cardboard; Glass (Clear); Newspapers; Phone books; Tin or Steel Cans; Used Motor Oil; Oil Filters; Computer (Recycling); Electronics; Laptop Computers; Printers/Scanners/Fax Machines; Small Televisions; Tablets; Televisions; Video Game Consoles; PlayStation Consoles","false","true","This site is located off Harwood Rd near Millingport School.","","false","false","false","false"
"Millingport Drop-off Site","","Esther Rd","New London","","NC","28127","7049824573","0","","","35.39025","-80.2932979","28.2060006714576","","false","false","","","false","false","false","false"
