name,description,address,city,region,province,postal_code,phone,fax,hours,url,latitude,longitude,distance,materials,pickup,dropoff,notes,groups,curbside,municipal,national,event_only
"Robbins Compactor Site","Robbins Compactor Site","1465 Leaman Rd","Robbins","Moore","NC","27325","9104642390","0","Monday: 7:00 AM - 7:00 PM Tuesday: 7:00 AM - 7:00 PM Wednesday: 7:00 AM - 7:00 PM Thursday: 7:00 AM - 7:00 PM Friday: 7:00 AM - 7:00 PM Saturday: 7:00 AM - 7:00 PM ","http://www.moorecountync.gov/index.php/en/solid-waste/compactor-sites","35.4471","-79.61065","10.4415941762219","Plastic #1 (PETE); Plastic #2 (HDPE); Plastic #2 (Color HDPE); Plastic #3 (PVC); Plastic #4 (LDPE); Plastic #5 (Polypropylene); Plastic #6 (Polystyrene); Plastic #7; Aluminum Cans; Glass (Brown); Cardboard; Glass (Clear); Electronics; Glass (Green); Large Household Appliances; Magazines; Paper (Mixed); Newspapers; Non-ferrous (Copper/Brass/Tin); Tin or Steel Cans; Small Appliances","false","true","This site is located off of Highway 705 on the left just past the Shopping Cart Store.","","false","false","false","false"
"Moore County Recycling Site - Robbins","","1465 Leaman Road","Robbins","","NC","27325","9104642390","0","","","35.4491609","-79.6106439","10.4511703792367","","false","false","","","false","false","false","false"
"Uwharrie Environmental Recycling Facility","Uwharrie Environmental Recycling Facility","500 Landfill Rd","Mount Gilead","Montgomery","NC","27306","8006769696","0","","","35.33389","-79.96469","11.9325422117774","Plastic #1 (PETE); Plastic #2 (HDPE); Plastic #2 (Color HDPE); Plastic #3 (PVC); Plastic #4 (LDPE); Plastic #5 (Polypropylene); Plastic #6 (Polystyrene); Plastic #7; Aluminum Cans; Aluminum; Brown Paper Bags; Glass (Clear); Inner Tubes; Magazines; Paper (Mixed); Newspapers; Used Tires; Computer (Recycling); Electronics; Laptop Computers; Printers/Scanners/Fax Machines; Small Televisions; Tablets; Televisions; Video Game Consoles; PlayStation Consoles","false","true","","","false","false","false","false"
"Randolph County Recycling Drop-Off Site - North Carolina Zoo","","4401 Zoo Pkwy","Asheboro","","NC","27205","3363186609","0","","","35.6275205","-79.7572487","13.259911516943","","false","false","","","false","false","false","false"
"Eagle Springs Recycling Center","Eagle Springs Recycling Center","363 State Rd 1138 ","Eagle Springs","Moore County","NC","27242","9106732420","0","Monday: 7:00 AM - 7:00 PM Tuesday: 7:00 AM - 7:00 PM Wednesday: 7:00 AM - 7:00 PM Thursday: 7:00 AM - 7:00 PM Friday: 7:00 AM - 7:00 PM Saturday: 7:00 AM - 7:00 PM ","http://www.moorecountync.gov/index.php/en/solid-waste/compactor-sites","35.2902714","-79.6437834","13.3350191235698","Plastic #1 (PETE); Plastic #2 (HDPE); Plastic #2 (Color HDPE); Plastic #3 (PVC); Plastic #4 (LDPE); Plastic #5 (Polypropylene); Plastic #6 (Polystyrene); Plastic #7; Aluminum Cans; Glass (Brown); Cardboard; Glass (Clear); Electronics; Glass (Green); Large Household Appliances; Magazines; Paper (Mixed); Newspapers; Non-ferrous (Copper/Brass/Tin); Tin or Steel Cans; Small Appliances","false","true","This site is located near the intersection of Highway 705 and Highway 211.","","false","false","false","false"
"Moore County Recycling Site - Eagle Springs","","363 Eagle Springs Road","Eagle Springs","","NC","27242","9106732420","0","","","35.2892357","-79.6428975","13.421959670253","","false","false","","","false","false","false","false"
"North Carolina Zoological Park","North Carolina Zoological Park","4401 Zoo Pkwy","Asheboro","Randolph","NC","27205","3368797000","0","","null","35.63555","-79.78202","13.6581095170289","Plastic #1 (PETE); Plastic #2 (HDPE); Plastic #2 (Color HDPE); Aluminum Cans; Glass (Brown); Glass (Clear); Computer Paper; Glass (Green); Greeting Cards; Paper (Mixed); Newspapers; Tin or Steel Cans; Computer (Recycling); Electronics; Laptop Computers; Printers/Scanners/Fax Machines; Small Televisions; Tablets; Televisions; Video Game Consoles; PlayStation Consoles","false","true","","","false","false","false","false"
"Chatham County Collection Center & Recycling - Bennett","","3142 Bennett-Siler City Rd","Bennett","","NC","27344","9195813730","0","","www.chathamnc.org/recycle","35.5742843","-79.5441111","16.9957131286576","","false","false","","","false","false","false","false"
"Winn Dixie","Winn Dixie","837 E Dixie Dr","Asheboro","Randolph","NC","27203","3366298293","0","","","35.6872","-79.82542","17.2846961643161","Plastic Shopping Bags; Food Storage Bags; Computer (Recycling); Electronics; Laptop Computers; Printers/Scanners/Fax Machines; Small Televisions; Tablets; Televisions; Video Game Consoles; PlayStation Consoles","false","true","","","false","false","false","false"
"Advance Auto Parts","Advance Auto Parts","810 E Dixie Dr","Asheboro","Randolph","NC","27203","3366255560","0","Monday: 7:00 AM - 9:00 PM Tuesday: 7:00 AM - 9:00 PM Wednesday: 7:00 AM - 9:00 PM Thursday: 7:00 AM - 9:00 PM Friday: 7:00 AM - 9:00 PM Saturday: 7:00 AM - 9:00 PM Sunday: 10:00 AM - 8:00 PM ","http://www.advanceautoparts.com","35.69029","-79.80257","17.4221196556641","Lead Acid (Pb) Batteries; Used Motor Oil; Computer (Recycling); Electronics; Laptop Computers; Printers/Scanners/Fax Machines; Small Televisions; Tablets; Televisions; Video Game Consoles; PlayStation Consoles","false","true","","","false","false","false","false"
"Randolph County Recycling Drop-Off Site - Farmer Convenience Site","","5488 Nc Highway 49 S","Asheboro","","NC","27205","3368573002","0","","","35.641839","-79.978628","17.4237998007111","","false","false","","","false","false","false","false"
"Midway Compactor Site","Midway Compactor Site","10496 State Hwy 27 ","Carthage","Moore County","NC","28327","9109473636","9109471992","Monday: 7:00 AM - 7:00 PM Tuesday: 7:00 AM - 7:00 PM Wednesday: 7:00 AM - 7:00 PM Thursday: 7:00 AM - 7:00 PM Friday: 7:00 AM - 7:00 PM Saturday: 7:00 AM - 7:00 PM Sunday: 1:00 AM - 6:00 PM ","http://www.moorecountync.gov","35.3852127","-79.492949","17.4432846927562","Aluminum Cans; Aluminum; Automobile Parts; Cardboard; Cell Phones; Computer Monitors; Computer (Recycling); Electronics; Ferrous Metals (Steel or Iron); Large Household Appliances; Magazines; Newspapers; Non-ferrous (Copper/Brass/Tin); Tin or Steel Cans; MP3 Players; Laptop Computers; Printers/Scanners/Fax Machines; Small Televisions; Tablets; Televisions; Video Game Consoles; PlayStation Consoles","false","true","This site is located on the right hand side just before the intersection with Plank Road.","","false","false","false","false"
"Moore County Recycling Site - Midway","","10496 NC Highway 24 27","Carthage","","NC","28327","9109483720","0","","","35.385528","-79.492722","17.451195624735","","false","false","","","false","false","false","false"
"Walmart Supercenter","","1226 E Dixie Dr","Asheboro","","NC","27203","3366260004","0","","https://www.walmart.com/","35.6924204","-79.7895104","17.5687855711257","","false","false","","","false","false","false","false"
"Walmart Tire and Lube Express","","1226 E Dixie Dr","Asheboro","","NC","27203","3366260004","0","","https://www.walmart.com/cp/ideas/8932632","35.6924204","-79.7895104","17.5687855711257","","false","false","","","false","false","false","false"
"Lowe's","","1120 E Dixie Dr","Asheboro","","NC","27203","3366296100","0","","https://newsroom.lowes.com/responsibility/operational-excellence/","35.6930863","-79.7937754","17.6115791923335","Batteries (Rechargeable); Cell Phone Batteries; Li-Ion Batteries; Ni-Cd Batteries; Ni-MH Batteries; Small Sealed Lead Acid Batteries; Cell Phones","false","true","","Call2Recycle","false","false","false","false"
"Call2Recycle at Lowe's","Call2Recycle at Lowe's","1120 E Dixie Dr","Asheboro","Randolph","NC","27203","3366296100","0","Monday: 6:00 AM - 10:00 PM Tuesday: 6:00 AM - 10:00 PM Wednesday: 6:00 AM - 10:00 PM Thursday: 6:00 AM - 10:00 PM Friday: 6:00 AM - 10:00 PM Saturday: 6:00 AM - 10:00 PM Sunday: 8:00 AM - 8:00 PM ","http://www.lowes.com/","35.69328","-79.79347","17.6250825521246","Cell Phones; Compact Fluorescent Lights; Ni-Cd Batteries; Plastic Shopping Bags; Li-Ion Batteries; Ni-MH Batteries; Ni-Zn Batteries; Small Sealed Lead Acid Batteries; Computer (Recycling); Electronics; Laptop Computers; Printers/Scanners/Fax Machines; Small Televisions; Tablets; Televisions; Video Game Consoles; PlayStation Consoles","false","true","As an environmentally-committed retailer, Lowes offers a recycling center near store entrances to give consumers a free and easy way to properly dispose of rechargeable batteries, cell phones, CFLs and plastic shopping bags; materials that otherwise could be potentially harmful to the environment.  Look for the recycling center or ask a store associate for more details.","","false","false","false","false"
"Tractor Supply","","1200 East Dixie Drive","Asheboro","","NC","27203","3366250019","0","","https://www.tractorsupply.com/","35.6943418","-79.7921552","17.6991487028247","","false","false","","","false","false","false","false"
"N Touch Wireless, Inc","","1214 E Dixie Dr","Asheboro","","NC","27203","3366252780","0","","","35.6954691","-79.7895279","17.7793579298704","","false","false","","","false","false","false","false"
"West End/Seven Lakes Compactor Site","West End/Seven Lakes Compactor Site","561 State Rd 1238 ","West End","Moore County","NC","27376","9106733027","0","Monday: 7:00 AM - 7:00 PM Tuesday: 7:00 AM - 7:00 PM Wednesday: 7:00 AM - 7:00 PM Thursday: 7:00 AM - 7:00 PM Friday: 7:00 AM - 7:00 PM Saturday: 7:00 AM - 7:00 PM Sunday: 1:00 PM - 6:00 PM ","http://www.co.moore.nc.us/main/page.asp?rec=/pages/PropertyManagement/recycle.htm","35.2592005","-79.5691414","17.7794722184077","Aluminum Cans; Glass (Brown); Cardboard; Glass (Clear); Glass (Green); Large Household Appliances; Magazines; Newspapers; Non-ferrous (Copper/Brass/Tin); Computer (Recycling); Electronics; Laptop Computers; Printers/Scanners/Fax Machines; Small Televisions; Tablets; Televisions; Video Game Consoles; PlayStation Consoles","false","true","This site is located off of Highway 211 near the elementary 
school ball field.","","false","false","false","false"
"Moore County Recycling Site - West End/Seven Lakes","","561 Love Grove Church Rd","West End","","NC","27376","9106733027","0","","","35.2589919","-79.5687373","17.805870860781","","false","false","","","false","false","false","false"
"GreenZone Textile Recycling - Asheboro","","1212 East Dixie Dr","Asheboro","","NC","27703","8007671284","0","","http://GZRUSA.com/","35.6959258","-79.7898097","17.8105970662443","","false","false","","","false","false","false","false"
"Walmart","Walmart","1226 E Dixie Dr","Asheboro","Randolph","NC","27203","3366260004","0","","http://www.walmart.com","35.69621","-79.79035","17.8296783521765","Lead Acid (Pb) Batteries; Plastic Shopping Bags; Food Storage Bags; Computer (Recycling); Electronics; Laptop Computers; Printers/Scanners/Fax Machines; Small Televisions; Tablets; Televisions; Video Game Consoles; PlayStation Consoles","false","true","","","false","false","false","false"
"Tractor Supply","Tractor Supply","1200 East Dixie DR","Asheboro","Randolph","NC","27203","3366250019","0","","http://www.tractorsupply.com","35.69621","-79.79035","17.8296783521765","Transmission Fluid; Used Motor Oil; Computer (Recycling); Electronics; Laptop Computers; Printers/Scanners/Fax Machines; Small Televisions; Tablets; Televisions; Video Game Consoles; PlayStation Consoles","false","true","","","false","false","false","false"
"Walmart Tire & Lube Express","Walmart Tire & Lube Express","1226 E Dixie Dr","Asheboro","Randolph","NC","27203","3366260004","0","","http://www.walmart.com/catalog/catalog.gsp?cat=495843","35.69621","-79.79035","17.8296783521765","Lead Acid (Pb) Batteries; Used Motor Oil; Oil Filters; Computer (Recycling); Electronics; Laptop Computers; Printers/Scanners/Fax Machines; Small Televisions; Tablets; Televisions; Video Game Consoles; PlayStation Consoles","false","true","","","false","false","false","false"
"Verizon Wireless","Verizon Wireless","1304 E Dixie Dr","Asheboro","Randolph","NC","27203","8666444532","0","","http://www.verizonwireless.com/","35.69745","-79.78916","17.9166120401707","Cell Phones; Cell Phone Batteries; Computer (Recycling); Electronics; Laptop Computers; Printers/Scanners/Fax Machines; Small Televisions; Tablets; Televisions; Video Game Consoles; PlayStation Consoles","false","true","<A Href="https://www.trade-in.vzw.com/home.aspx">
The Verizon Wireless Trade-In Program</A> allows you to trade in your used handset or tablet in a convenient and responsible way. 
<P>
<P>
Verizon Wireless works every day to protect our environment and give our customers opportunities to do the same. <A Href="http://aboutus.vzw.com/Green_Initiative/overview.html">Click here</A> for more examples of the earth-friendly initiatives and programs Verizon Wireless is proud to offer and support.","","false","false","false","false"
"JCPenney","","64 Highway 42","Asheboro","","NC","27203","3366260696","0","","https://www.jcpenney.com/","35.6984947","-79.7874095","17.9910940004486","","false","false","","","false","false","false","false"
"Staples","Staples","176 N. Highway 42","Asheboro","Randolph County","NC","27203","3366292235","0","Monday: 8:00 AM - 9:00 PM Tuesday: 8:00 AM - 9:00 PM Wednesday: 8:00 AM - 9:00 PM Thursday: 8:00 AM - 9:00 PM Friday: 8:00 AM - 9:00 PM Saturday: 9:00 AM - 9:00 PM Sunday: 10:00 AM - 6:00 PM ","https://www.staples.com/recycle","35.6997307","-79.7894841","18.0737825946538","AC Power Plugs; Batteries (Rechargeable); Cables & Connectors; Cell Phone Batteries; Cell Phones; Computer (Recycling); Hard Drives; Computer Monitors; Cameras; DVD Players/Blu-Ray Players/DVRs; Electronics; E-Readers; GPS Units; Headphones; Inkjet Printer Cartridges; Laptop Computers; Laser Toner Cartridges; Li-Ion Batteries; MP3 Players; Network Equipment; Ni-Cd Batteries; Ni-MH Batteries; Ni-Zn Batteries; Computer Peripherals; Portable Media Players; Printers/Scanners/Fax Machines; Small Electronics; Small Sealed Lead Acid Batteries; Stereo Equipment; Tablets; Telephones; UPS Batteries/Backup Systems; VCRs; Video Game Systems; Blu-Ray Players; Digital Converter Boxes; Small Televisions; Televisions; Video Game Consoles; PlayStation Consoles; Alkaline/Single-Use Batteries; Batteries (Rechargeable); Cell Phone Batteries; Li-Ion Batteries; Ni-Cd Batteries; Ni-MH Batteries; Small Sealed Lead Acid Batteries; Alkaline/Single-Use Batteries; Button Batteries; Non-rechargeable lithium batteries; Cell Phones","false","true","NO TVs; Limit 6 CEDs per day; ","Vizio, Call2Recycle, OEM, Sony","false","false","false","false"
"Staples","null","176 North Highway 42","Asheboro","","NC","27203","3366292235","0","","https://www.staples.com/sbd/cre/marketing/sustainability-center/recycling-services/","35.6997307","-79.7894841","18.0737825946538","Alkaline/Single-Use Batteries","false","true","","","false","false","false","false"
"Randolph Mall 1","null","345 Randolph Rd ","Asheboro","Randolph","NC","27203","8583244111","0","","http://www.ecoatm.com/","35.702375","-79.8075558","18.2648431762613","Cell Phones; Tablets; MP3 Players; Computer (Recycling); Electronics; Laptop Computers; Printers/Scanners/Fax Machines; Small Televisions; Televisions; Video Game Consoles; PlayStation Consoles","false","true","ecoATM is an automated, consumer self-serve kiosk that quickly buys back and recycles old phones, mp3 players and tablets.
</br>
Call or email <a href="mailto:max@ecoATM.com">customer support</a> with questions.","","false","false","false","false"
"Call2Recycle at Sears","Call2Recycle at Sears","1437 E Dixie Dr","Asheboro","Randolph","NC","27203","3366333200","0","","http://www.sears.com/","35.70247","-79.78708","18.2661427521617","Cell Phones; Ni-Cd Batteries; Li-Ion Batteries; Ni-MH Batteries; Ni-Zn Batteries; Small Sealed Lead Acid Batteries; Computer (Recycling); Electronics; Laptop Computers; Printers/Scanners/Fax Machines; Small Televisions; Tablets; Televisions; Video Game Consoles; PlayStation Consoles","false","true","The U.S. EPA estimates that more than 350 million rechargeable batteries are purchased annually in the U.S. Thanks to the environmental commitment of this location, its easy and free to recycle your batteries. Bring your rechargeable batteries to this location and look for the recycling box or ask an associate how you can do your part for the environment.","","false","false","false","false"
"City of Asheboro Recycling Drop-Off Site - West Wainman Ave","","134 West Wainman Ave","Asheboro","","NC","27203","3366720206","0","","https://www.ci.asheboro.nc.us/Services/sanitation.html","35.7023464","-79.8157105","18.2851375947349","","false","false","","","false","false","false","false"
"AutoZone","AutoZone","340 S Fayetteville St","Asheboro","Randolph","NC","27203","3366262500","0","","http://www.autozone.com","35.70263","-79.8146","18.3009921360831","Lead Acid (Pb) Batteries; Used Motor Oil; Computer (Recycling); Electronics; Laptop Computers; Printers/Scanners/Fax Machines; Small Televisions; Tablets; Televisions; Video Game Consoles; PlayStation Consoles","false","true","Most AutoZone stores accept used motor oil, transmission fluid, gear oil and automotive batteries. Call to see what your local store is currently accepting.","","false","false","false","false"
"Call2Recycle at RadioShack","Call2Recycle at RadioShack","1558 E Salisbury St ","Asheboro","Randolph County","NC","27203","3366293945","0","","http://www.radioshack.com/","35.7040352","-79.7874504","18.3736979099086","Cell Phones; Ni-Cd Batteries; Li-Ion Batteries; Ni-MH Batteries; Ni-Zn Batteries; Small Sealed Lead Acid Batteries; Computer (Recycling); Electronics; Laptop Computers; Printers/Scanners/Fax Machines; Small Televisions; Tablets; Televisions; Video Game Consoles; PlayStation Consoles","false","true","As the first national retailer to partner with Call2Recycle, RadioShack is at the forefront of the rechargeable battery recycling cause and is pleased to offer battery recycling at thousands of convenient RadioShack locations for free.  Simply drop them off at your local RadioShack and theyll take care of the rest.  Ask a store associate for more details.","","false","false","false","false"
"ERI","ERI","293 NC-740 ","Badin","Stanly County","NC","28009","8008848466","0","Monday: 8:00 AM - 3:00 PM Tuesday: 8:00 AM - 3:00 PM Wednesday: 8:00 AM - 3:00 PM Thursday: 8:00 AM - 3:00 PM Friday: 8:00 AM - 3:00 PM ","http://eridirect.com/","35.4043377","-80.1203383","18.4194910709968","Cell Phones; Computer Monitors; Electronics; Medical Equipment; Batteries (Rechargeable); Televisions; Printers/Scanners/Fax Machines; Small Appliances; Laptop Computers; MP3 Players; Servers; DVD Players/Blu-Ray Players/DVRs; Network Equipment; Computer (Recycling); Small Televisions; Tablets; Video Game Consoles; PlayStation Consoles","true","true","ERI works with towns and businesses to recycle e-waste, please check with your towns DPW for more information on your area.","","false","false","false","false"
"Electronic Recyclers International, Inc","null","293 NC-740 ","Badin","Stanly County","NC","28009","8003743473","0","","https://eridirect.com/","35.4042952","-80.1204383","18.4254534300718","Video Game Consoles; PlayStation Consoles; Solar Panels","true","true","","ERI","false","false","false","false"
"Davidson County Recycle Center - 49/109","","23351 Hwy 109","Denton","","NC","27239","3368592609","0","","https://www.co.davidson.nc.us","35.5564031","-80.0923073","18.569242747123","","false","false","","","false","false","false","false"
"Walgreens","Walgreens","207 N Fayetteville St ","Asheboro","Randolph County","NC","27203","3366337611","0","","http://www.walgreens.com","35.708216","-79.814336","18.6854670906511","Cell Phones; Inkjet Cartridge Refilling; Inkjet Printer Cartridges; Computer (Recycling); Electronics; Laptop Computers; Printers/Scanners/Fax Machines; Small Televisions; Tablets; Televisions; Video Game Consoles; PlayStation Consoles","false","true","","","false","false","false","false"
"O'Reilly Auto Parts","null","1341 N Fayetteville St","Asheboro","","NC","27203","3366253120","0","","http://oreillyauto.custhelp.com/app/error/error_id/6","35.73053","-79.8085442","20.2108106763271","","false","false","","","false","false","false","false"
"Hayes Iron & Metal Inc","Hayes Iron & Metal Inc","4675 US-64 16","Franklinville","Randolph County","NC","27248","3368248600","0","","http://www.hayesironandmetal.com/","35.727296","-79.707589","20.5809436232339","Aluminum Cans; Ferrous Metals (Steel or Iron); Non-ferrous (Copper/Brass/Tin); Tin or Steel Cans; Computer (Recycling); Electronics; Laptop Computers; Printers/Scanners/Fax Machines; Small Televisions; Tablets; Televisions; Video Game Consoles; PlayStation Consoles","false","true","","","false","false","false","false"
"Chatham County Collection Center & Recycling - Harper's Cross Roads","","19921 Nc Highway 902","Bear Creek","","NC","27207","9198375899","0","","https://www.chathamnc.org/services/solid-waste-recycling/collection-centers-recycling/locations-and-hours-of-operation","35.568437","-79.461543","20.8447100666418","","false","false","","","false","false","false","false"
"Lowe's","","814 14 Nc 24 27 Bypass E","Albemarle","","NC","28001","7049838956","0","","https://newsroom.lowes.com/responsibility/operational-excellence/","35.3456428","-80.1664075","21.8291737527246","","false","false","","","false","false","false","false"
"Randolph County","null","1254 County Land Rd ","Randleman","Randolph County","NC","27317","3368788234","0","","https://www.wmsolutions.com/locations/details/id/888","35.7530765","-79.7634096","21.8320408487366","Computer (Recycling); Electronics; Laptop Computers; Printers/Scanners/Fax Machines; Small Televisions; Tablets; Televisions; Video Game Consoles; PlayStation Consoles","false","true","County Residents Only ","Vizio, OEM, Sony, OEM Municipal sites, OEM Indiv","false","false","false","false"
"Randolph County Solid Waste Facility & Recycling","","1254 County Land Rd","Randleman","","NC","27317","3366838230","0","","","35.7530765","-79.7634096","21.8320408487366","","false","false","","","false","false","false","false"
"City of Albemarle Landfill and Recycling Center","City of Albemarle Landfill and Recycling Center","40592 Stony Gap Rd","Albemarle","Stanly","NC","28001","7049823302","0","","http://www.ci.albemarle.nc.us/","35.3148","-80.15306","21.8549959916053","Plastic #1 (PETE); Plastic #2 (HDPE); Plastic #2 (Color HDPE); Plastic #3 (PVC); Plastic #4 (LDPE); Plastic #5 (Polypropylene); Plastic #6 (Polystyrene); Plastic #7; Aerosol Spray Cans; Aluminum Cans; Asbestos; Glass (Blue); Glass (Brown); Brown Paper Bags; Lead Acid (Pb) Batteries; Cardboard; Catalogs; Cell Phones; Glass (Clear); Computer Paper; Computer (Recycling); Drink Boxes; Electronics; Video Game Systems; Glass (Green); Inkjet Printer Cartridges; Large Household Appliances; Magazines; Milk Cartons; Paper (Mixed); Newspapers; Non-ferrous (Copper/Brass/Tin); Office Equipment; Plastics (Other); Latex Paint; Wood Pallets; Phone books; Plastic Shopping Bags; Televisions; Tin or Steel Cans; Laser Toner Cartridges; Used Oil Filters; Used Tires; Office Paper; Yard Waste; Printers/Scanners/Fax Machines; Laptop Computers; Tablets; Portable Media Players; Air Conditioners; Refrigerators; VCRs; DVD Players/Blu-Ray Players/DVRs; Small Televisions; Video Game Consoles; PlayStation Consoles","false","true","Hours may vary please call for details and refer to website for brochure with fee details.","","false","false","false","false"
"Advance Auto Parts","Advance Auto Parts","640 NC 24 27 Byp E","Albemarle","Stanly","NC","28001","7049834298","0","Monday: 7:00 AM - 9:00 PM Tuesday: 7:00 AM - 9:00 PM Wednesday: 7:00 AM - 9:00 PM Thursday: 7:00 AM - 9:00 PM Friday: 7:00 AM - 9:00 PM Saturday: 7:00 AM - 9:00 PM Sunday: 10:00 AM - 8:00 PM ","http://www.advanceautoparts.com","35.34247","-80.16805","21.9829824951509","Lead Acid (Pb) Batteries; Used Motor Oil; Computer (Recycling); Electronics; Laptop Computers; Printers/Scanners/Fax Machines; Small Televisions; Tablets; Televisions; Video Game Consoles; PlayStation Consoles","false","true","","","false","false","false","false"
"Verizon Wireless","Verizon Wireless","830 NC 24 27 Byp E Ste A","Albemarle","Stanly","NC","28001","8666444532","0","","http://www.verizonwireless.com/","35.34067","-80.16823","22.0305872078837","Cell Phones; Cell Phone Batteries; Computer (Recycling); Electronics; Laptop Computers; Printers/Scanners/Fax Machines; Small Televisions; Tablets; Televisions; Video Game Consoles; PlayStation Consoles","false","true","<A Href="https://www.trade-in.vzw.com/home.aspx">
The Verizon Wireless Trade-In Program</A> allows you to trade in your used handset or tablet in a convenient and responsible way. 
<P>
<P>
Verizon Wireless works every day to protect our environment and give our customers opportunities to do the same. <A Href="http://aboutus.vzw.com/Green_Initiative/overview.html">Click here</A> for more examples of the earth-friendly initiatives and programs Verizon Wireless is proud to offer and support.","","false","false","false","false"
"Randolph County Recycling Drop-Off Site - North Asheboro Fire Station","","2105 N Fayetteville St","Asheboro","","NC","27203","3366720206","0","","","35.7573978","-79.8058163","22.061612901669","","false","false","","","false","false","false","false"
