name,description,address,city,region,province,postal_code,phone,fax,hours,url,latitude,longitude,distance,materials,pickup,dropoff,notes,groups,curbside,municipal,national,event_only
"Hall Brothers Recycling","Hall Brothers Recycling","1865 E Midland Trl","Grayson","Carter","KY","41143","6064745205","0","Monday: 9:00 AM - 5:00 PM Tuesday: 9:00 AM - 5:00 PM Wednesday: 9:00 AM - 5:00 PM Thursday: 9:00 AM - 5:00 PM Friday: 9:00 AM - 5:00 PM ","","38.33495","-82.89861","35.7244998714524","Aluminum Cans; Non-ferrous (Copper/Brass/Tin); Video Game Consoles; PlayStation Consoles","false","true","Please call ahead if you will be dropping off a large quantity of recycling items or to see if this site accepts an item not listed.  If you are dropping off glass you also need to call ahead to verify the colors of glass this site is currently accepting.","","false","false","false","false"
"Wayne County Solid Waste Authority Recycling Drop-Off Site","","Rte 52 & Rte 37","Fort Gay","","WV","25570","3042726706","0","","http://waynecountyswa.weebly.com/drop-off-locations.html","38.0026593","-82.5045207","35.892748209778","","false","false","","","false","false","false","false"
"Advance Auto Parts","Advance Auto Parts","909 Highway 11 N","Beattyville","Lee","KY","41311","6064641114","0","Monday: 7:00 AM - 9:00 PM Tuesday: 7:00 AM - 9:00 PM Wednesday: 7:00 AM - 9:00 PM Thursday: 7:00 AM - 9:00 PM Friday: 7:00 AM - 9:00 PM Saturday: 7:00 AM - 9:00 PM Sunday: 10:00 AM - 8:00 PM ","http://www.advanceautoparts.com","37.58213","-83.69899","36.0411280035354","Lead Acid (Pb) Batteries; Used Motor Oil; Video Game Consoles; PlayStation Consoles","false","true","","","false","false","false","false"
"Advance Auto Parts","null","909 Highway 11 N","Beattyville","","KY","41311","6064641114","0","","http://shop.advanceautoparts.com/webapp/wcs/stores/servlet/home___","37.5816787","-83.7030997","36.2495607043381","","false","false","","","false","false","false","false"
"East Kentucky Iron and Metal","East Kentucky Iron and Metal","575 Highway 721","Hazard","Knott","KY","41701","6062513800","0","Monday: 8:00 AM - 5:00 PM Tuesday: 8:00 AM - 5:00 PM Wednesday: 8:00 AM - 5:00 PM Thursday: 8:00 AM - 5:00 PM Friday: 8:00 AM - 5:00 PM Saturday: 8:00 AM - 2:00 PM ","null","37.32601","-83.10077","36.4244844471516","Car; Ferrous Metals (Steel or Iron); Large Household Appliances; Video Game Consoles; PlayStation Consoles","false","true","Call for material requirements.  Please cut scrap iron.    Please call ahead if you will be dropping off a large quantity of recycling items or to see if this site accepts an item not listed.","","false","false","false","false"
"Goodwill Industries of KYOWVA Area Inc. - Dell Reconnect Donation Site","","4493 North Mayo Trail","Pikeville","","KY","41501","6064323113","0","","http://www.goodwillhunting.org","37.5270815","-82.575532","37.9637352808869","","false","false","","","false","false","false","false"
"JCPenney","","4257 N Mayo Trail","Pikeville","","KY","41501","6064379169","0","","https://www.jcpenney.com/","37.5237664","-82.5738634","38.1736636812654","","false","false","","","false","false","false","false"
"AutoZone","","35 Weddington Branch Rd","Pikeville","","KY","41501","6064372342","0","","https://www.autozone.com/landing/page.jsp?name=in-our-stores","37.5226269","-82.5696856","38.4043507708691","","false","false","","","false","false","false","false"
"Call2Recycle at Lowe's","Call2Recycle at Lowe's","81 Commerce Dr","Hazard","Perry","KY","41701","6064357040","0","Monday: 6:00 AM - 10:00 PM Tuesday: 6:00 AM - 10:00 PM Wednesday: 6:00 AM - 10:00 PM Thursday: 6:00 AM - 10:00 PM Friday: 6:00 AM - 10:00 PM Saturday: 6:00 AM - 10:00 PM Sunday: 8:00 AM - 8:00 PM ","http://www.lowes.com/","37.29657","-83.14539","38.414359913662","Cell Phones; Compact Fluorescent Lights; Ni-Cd Batteries; Plastic Shopping Bags; Li-Ion Batteries; Ni-MH Batteries; Ni-Zn Batteries; Small Sealed Lead Acid Batteries; Video Game Consoles; PlayStation Consoles; Batteries (Rechargeable); Cell Phone Batteries; Li-Ion Batteries; Ni-Cd Batteries; Ni-MH Batteries; Small Sealed Lead Acid Batteries; Cell Phones","false","true","As an environmentally-committed retailer, Lowes offers a recycling center near store entrances to give consumers a free and easy way to properly dispose of rechargeable batteries, cell phones, CFLs and plastic shopping bags; materials that otherwise could be potentially harmful to the environment.  Look for the recycling center or ask a store associate for more details.","Call2Recycle","false","false","false","false"
"Walmart Supercenter","","120 Daniel Boone Pkwy","Hazard","","KY","41701","6064391882","0","","https://www.walmart.com/","37.298941","-83.2136227","38.4877091699954","","false","false","","","false","false","false","false"
"Walmart Tire and Lube Express","null","120 Daniel Boone Plz","Hazard","","KY","41701","6064391882","0","","https://www.walmart.com/cp/ideas/8932632","37.2982302","-83.2141908","38.539999303326","","false","false","","","false","false","false","false"
"Childers Enterprise","Childers Enterprise","62 Holly Hills Mall Road ","Hindman","Knott County","KY","41822","6067853911","0","","","37.3146812","-82.9430083","38.6175063021292","Cardboard; Video Game Consoles; PlayStation Consoles","false","true","","","false","false","false","false"
"Lowe's","","81 Commerce Drive","Hazard","","KY","41701","6064357040","0","","https://newsroom.lowes.com/responsibility/operational-excellence/","37.2965081","-83.2176455","38.6799001327789","","false","false","","","false","false","false","false"
"Advance Auto Parts","Advance Auto Parts","3705 N Mayo Trl","Pikeville","Pike","KY","41501","6064330302","0","Monday: 7:00 AM - 9:00 PM Tuesday: 7:00 AM - 9:00 PM Wednesday: 7:00 AM - 9:00 PM Thursday: 7:00 AM - 9:00 PM Friday: 7:00 AM - 9:00 PM Saturday: 7:00 AM - 9:00 PM Sunday: 10:00 AM - 8:00 PM ","http://www.advanceautoparts.com","37.51866","-82.56627","38.7181297832308","Lead Acid (Pb) Batteries; Used Motor Oil; Video Game Consoles; PlayStation Consoles","false","true","","","false","false","false","false"
"Advance Auto Parts","null","3705 N Mayo Trl","Pikeville","","KY","41501","6064330302","0","","http://shop.advanceautoparts.com/webapp/wcs/stores/servlet/home___","37.5182178","-82.5660052","38.7480366061084","","false","false","","","false","false","false","false"
"AT&T Wireless","AT&T Wireless","4565 N Mayo Trl","Pikeville","Pike","KY","41501","6064324518","0","","http://www.att.com/","37.52851","-82.55621","38.7626348064889","Cell Phones; Ni-Cd Batteries; Batteries (Rechargeable); Cell Phone Batteries; Tablets; Li-Ion Batteries; Video Game Consoles; PlayStation Consoles","false","true","Receive an AT&T Promotion Card worth the trade-in value of your smartphone, tablet, or netbook. You can also donate the trade-in value to Cell Phones for Soldiers.","","false","false","false","false"
"Bath County Recycling Drop-off Location","","Kindle Springs Road","Owingsville","","KY","40360","6066746346","0","","","38.121589","-83.7713009","39.3193172785052","","false","false","","","false","false","false","false"
"Advance Auto Parts","Advance Auto Parts","8 W College Ave","Stanton","Powell","KY","40380","6066634208","0","Monday: 7:00 AM - 9:00 PM Tuesday: 7:00 AM - 9:00 PM Wednesday: 7:00 AM - 9:00 PM Thursday: 7:00 AM - 9:00 PM Friday: 7:00 AM - 9:00 PM Saturday: 7:00 AM - 9:00 PM Sunday: 10:00 AM - 8:00 PM ","http://www.advanceautoparts.com","37.84561","-83.85771","39.4289769067956","Lead Acid (Pb) Batteries; Used Motor Oil; Video Game Consoles; PlayStation Consoles","false","true","","","false","false","false","false"
"Advance Auto Parts","","8 W College Ave","Stanton","","KY","40380","6066634208","0","","http://shop.advanceautoparts.com/webapp/wcs/stores/servlet/home___","37.8459794","-83.8589821","39.4979725175459","","false","false","","","false","false","false","false"
"AutoZone","","117 Village Lane","Hazard","","KY","41701","6064350242","0","","https://www.autozone.com/landing/page.jsp?name=in-our-stores","37.2828779","-83.2255809","39.6673259617541","","false","false","","","false","false","false","false"
"USPS Post Office Box Lobby Recycling Program","US Post Office","101 Ohio Ave","Kermit","Mingo","WV","25674","8002758777","0","","https://www.usps.com/","37.88835","-82.40555","39.8624928330087","Catalogs; Greeting Cards; Magazines; Paper (Mixed)","false","true","","","false","false","false","false"
"Call2Recycle at UPS","Call2Recycle at UPS","984 Dawahare Dr","Hazard","Perry","KY","41701","8004725877","0","","https://www.ups.com/","37.27788","-83.22822","40.0281361076742","Cell Phones; Ni-Cd Batteries; Li-Ion Batteries; Ni-MH Batteries; Ni-Zn Batteries; Small Sealed Lead Acid Batteries; Video Game Consoles; PlayStation Consoles","false","true","The U.S. EPA estimates that more than 350 million rechargeable batteries are purchased annually in the U.S. Thanks to the environmental commitment of this location, its easy and free to recycle your batteries. Bring your rechargeable batteries to this location and look for the recycling box or ask an associate how you can do your part for the environment.","","false","false","false","false"
"Walmart Tire and Lube Express","","254 Cassidy Blvd","Pikeville","","KY","41501","6064326177","0","","https://www.walmart.com/cp/ideas/8932632","37.5070729","-82.5403966","40.3337989757876","","false","false","","","false","false","false","false"
"Walmart Supercenter","","254 Cassidy Blvd","Pikeville","","KY","41501","6064326177","0","","https://www.walmart.com/","37.5070729","-82.5403966","40.3337989757876","","false","false","","","false","false","false","false"
"Call2Recycle at Lowe's","Call2Recycle at Lowe's","183 Cassidy Blvd","Pikeville","Pike","KY","41501","6064330020","0","Monday: 6:00 AM - 10:00 PM Tuesday: 6:00 AM - 10:00 PM Wednesday: 6:00 AM - 10:00 PM Thursday: 6:00 AM - 10:00 PM Friday: 6:00 AM - 10:00 PM Saturday: 6:00 AM - 10:00 PM Sunday: 8:00 AM - 8:00 PM ","http://www.lowes.com/","37.50499","-82.53811","40.5201349926692","Cell Phones; Compact Fluorescent Lights; Ni-Cd Batteries; Plastic Shopping Bags; Li-Ion Batteries; Ni-MH Batteries; Ni-Zn Batteries; Small Sealed Lead Acid Batteries; Video Game Consoles; PlayStation Consoles; Batteries (Rechargeable); Cell Phone Batteries; Li-Ion Batteries; Ni-Cd Batteries; Ni-MH Batteries; Small Sealed Lead Acid Batteries; Cell Phones","false","true","As an environmentally-committed retailer, Lowes offers a recycling center near store entrances to give consumers a free and easy way to properly dispose of rechargeable batteries, cell phones, CFLs and plastic shopping bags; materials that otherwise could be potentially harmful to the environment.  Look for the recycling center or ask a store associate for more details.","Call2Recycle","false","false","false","false"
"Staples","","238 Cassidy Boulevard","Pikeville","","KY","41501","6064321161","0","","https://www.staples.com/sbd/cre/marketing/sustainability-center/recycling-services/","37.5060478","-82.5366348","40.5417598733021","Alkaline/Single-Use Batteries","false","true","","","false","false","false","false"
"Staples, Inc.","Staples","238 Cassidy Blvd ","Pikeville","Pike County","KY","41501","6064321161","0","Monday: 9:00 AM - 8:00 PM Tuesday: 9:00 AM - 8:00 PM Wednesday: 9:00 AM - 8:00 PM Thursday: 9:00 AM - 8:00 PM Friday: 9:00 AM - 8:00 PM Saturday: 10:00 AM - 7:00 PM Sunday: 11:00 AM - 6:00 PM ","https://www.staples.com/recycle","37.5060621","-82.536584","40.5434159549508","AC Power Plugs; Batteries (Rechargeable); Cables & Connectors; Cell Phone Batteries; Cell Phones; Computer (Recycling); Hard Drives; Computer Monitors; Cameras; DVD Players/Blu-Ray Players/DVRs; Electronics; E-Readers; GPS Units; Headphones; Inkjet Printer Cartridges; Laptop Computers; Laser Toner Cartridges; Li-Ion Batteries; MP3 Players; Network Equipment; Ni-Cd Batteries; Ni-MH Batteries; Ni-Zn Batteries; Computer Peripherals; Portable Media Players; Printers/Scanners/Fax Machines; Small Electronics; Small Sealed Lead Acid Batteries; Stereo Equipment; Tablets; Telephones; UPS Batteries/Backup Systems; VCRs; Video Game Systems; Blu-Ray Players; Digital Converter Boxes; Video Game Consoles; PlayStation Consoles","false","true","NO TVs; Limit 6 CEDs per day; ","Sony, Vizio, OEM","false","false","false","false"
"Call2Recycle at RadioShack","Call2Recycle at RadioShack","38 Daniel Boone Plz","Hazard","Perry","KY","41701","6064392558","0","","http://www.radioshack.com/","37.26558","-83.14999","40.5595466220766","Cell Phones; Ni-Cd Batteries; Li-Ion Batteries; Ni-MH Batteries; Ni-Zn Batteries; Small Sealed Lead Acid Batteries; Video Game Consoles; PlayStation Consoles","false","true","As the first national retailer to partner with Call2Recycle, RadioShack is at the forefront of the rechargeable battery recycling cause and is pleased to offer battery recycling at thousands of convenient RadioShack locations for free.  Simply drop them off at your local RadioShack and theyll take care of the rest.  Ask a store associate for more details.","","false","false","false","false"
"Magoffin County Recycling Center","","133 Broadway St","Salyersville","","KY","41465","6063496336","0","","https://magoffincounty.ky.gov/Pages/index.aspx","37.7527113","-83.0663229","7.84945470771986","","false","false","","","false","false","false","false"
"Advance Auto Parts","Advance Auto Parts","323 Main St","West Liberty","Morgan","KY","41472","6067431241","0","Monday: 7:00 AM - 9:00 PM Tuesday: 7:00 AM - 9:00 PM Wednesday: 7:00 AM - 9:00 PM Thursday: 7:00 AM - 9:00 PM Friday: 7:00 AM - 9:00 PM Saturday: 7:00 AM - 9:00 PM Sunday: 10:00 AM - 8:00 PM ","http://www.advanceautoparts.com","37.91781","-83.26085","8.21112600847601","Lead Acid (Pb) Batteries; Used Motor Oil; Video Game Consoles; PlayStation Consoles","false","true","","","false","false","false","false"
"Gevedon Recycling","Gevedon Recycling","136 June Creek Rd","West Liberty","Morgan","KY","41472","6067434209","0","Monday: 9:00 AM - 4:00 PM Wednesday: 9:00 AM - 4:00 PM Thursday: 9:00 AM - 4:00 PM Friday: 9:00 AM - 4:00 PM Saturday: 9:00 AM - 12:00 PM ","","37.85953","-83.29551","8.76765377904594","Aluminum Cans; Ferrous Metals (Steel or Iron); Non-ferrous (Copper/Brass/Tin); Tin or Steel Cans; Video Game Consoles; PlayStation Consoles","false","true","Please call for material requirements.  Please call ahead if you will be dropping off a large quantity of recycling items or to see if this site accepts an item not listed.","","false","false","false","false"
"Freedom Metals Inc.","","32 Revis Road","West Liberty","","KY","41472","6067439437","0","","http://freedommetals.com/","37.8719319","-83.3008514","9.14381214433362","","false","false","","","false","false","false","false"
"Advance Auto Parts","null","400 E Mountain Pkwy","Salyersville","","KY","41465","6063496603","0","","http://shop.advanceautoparts.com/webapp/wcs/stores/servlet/home___","37.739976","-83.0438151","9.23327121007121","","false","false","","","false","false","false","false"
"Advance Auto Parts","Advance Auto Parts","400 E Mountain Pkwy","Salyersville","Magoffin","KY","41465","6063496603","0","Monday: 7:00 AM - 9:00 PM Tuesday: 7:00 AM - 9:00 PM Wednesday: 7:00 AM - 9:00 PM Thursday: 7:00 AM - 9:00 PM Friday: 7:00 AM - 9:00 PM Saturday: 7:00 AM - 9:00 PM Sunday: 10:00 AM - 8:00 PM ","http://www.advanceautoparts.com","37.73953","-83.04397","9.25469700543498","Lead Acid (Pb) Batteries; Used Motor Oil; Video Game Consoles; PlayStation Consoles","false","true","","","false","false","false","false"
"Ivyton Recycling","Ivyton Recycling","440 Ivyton Rd","Salyersville","Magoffin","KY","41465","6063491108","0","Monday: 8:00 AM - 4:30 PM Tuesday: 8:00 AM - 4:30 PM Wednesday: 8:00 AM - 4:30 PM Thursday: 8:00 AM - 4:30 PM Friday: 8:00 AM - 4:30 PM Saturday: 8:00 AM - 12:00 PM ","","37.74816","-83.01916","9.59133427106707","Aluminum Cans; Aluminum; Car; Automobile Parts; Lead Acid (Pb) Batteries; Ferrous Metals (Steel or Iron); Large Household Appliances; Non-ferrous (Copper/Brass/Tin); Tin or Steel Cans; Video Game Consoles; PlayStation Consoles","false","true","Please call ahead if you will be dropping off a large quantity of recycling items or to see if this site accepts an item not listed.","","false","false","false","false"
"Napa Auto Parts","Napa Auto Parts","630 E Mountain Pkwy","Salyersville","Magoffin","KY","41465","6063496141","0","Monday: 8:00 AM - 6:00 PM Tuesday: 8:00 AM - 6:00 PM Wednesday: 8:00 AM - 6:00 PM Thursday: 8:00 AM - 6:00 PM Friday: 8:00 AM - 6:00 PM Saturday: 8:00 AM - 4:00 PM ","","37.73737","-83.03615","9.61402921544811","Lead Acid (Pb) Batteries; Video Game Consoles; PlayStation Consoles","false","true","","","false","false","false","false"
