name,description,address,city,region,province,postal_code,phone,fax,hours,url,latitude,longitude,distance,materials,pickup,dropoff,notes,groups,curbside,municipal,national,event_only
"Grassy Auto Parts","Grassy Auto Parts","6374 Highway 460 W","West Liberty","Morgan","KY","41472","6067433167","0","Monday: 8:00 AM - 5:00 PM Tuesday: 8:00 AM - 5:00 PM Wednesday: 8:00 AM - 5:00 PM Thursday: 8:00 AM - 5:00 PM Friday: 8:00 AM - 5:00 PM ","","37.86669","-83.3376","11.093053138637","Car; Ferrous Metals (Steel or Iron); Large Household Appliances; Tin or Steel Cans; Video Game Consoles; PlayStation Consoles","false","true","Please call for material requirements.","","false","false","false","false"
"AutoZone","null","237 N Mayo Trl","Paintsville","","KY","41240","6067891866","0","","https://www.autozone.com/landing/page.jsp?name=in-our-stores","37.818402","-82.8146946","17.6374542335219","","false","false","","","false","false","false","false"
"Advance Auto Parts","null","272 S Mayo Trl","Paintsville","","KY","41240","6067896063","0","","http://shop.advanceautoparts.com/webapp/wcs/stores/servlet/home___","37.8104154","-82.8072927","18.1191141606913","","false","false","","","false","false","false","false"
"AutoZone","AutoZone","237 N Mayo Trl","Paintsville","Johnson","KY","41240","6067891866","0","","http://www.autozone.com","37.81274","-82.80334","18.3069652821257","Lead Acid (Pb) Batteries; Used Motor Oil; Video Game Consoles; PlayStation Consoles","false","true","Most AutoZone stores accept used motor oil, transmission fluid, gear oil and automotive batteries. Call to see what your local store is currently accepting.","","false","false","false","false"
"Walmart","Walmart","470 N Mayo Trl","Paintsville","Johnson","KY","41240","6067898920","0","","http://www.walmart.com","37.81274","-82.80334","18.3069652821257","Lead Acid (Pb) Batteries; Plastic Shopping Bags; Food Storage Bags; Video Game Consoles; PlayStation Consoles","false","true","","","false","false","false","false"
"Walmart Tire & Lube Express","Walmart Tire & Lube Express","470 N Mayo Trl","Paintsville","Johnson","KY","41240","6067898920","0","","http://www.walmart.com/catalog/catalog.gsp?cat=495843","37.81274","-82.80334","18.3069652821257","Lead Acid (Pb) Batteries; Used Motor Oil; Oil Filters; Video Game Consoles; PlayStation Consoles","false","true","","","false","false","false","false"
"Call2Recycle at Lowe's","Call2Recycle at Lowe's","527 N Mayo Trl","Paintsville","Johnson","KY","41240","6067881360","0","Monday: 6:00 AM - 10:00 PM Tuesday: 6:00 AM - 10:00 PM Wednesday: 6:00 AM - 10:00 PM Thursday: 6:00 AM - 10:00 PM Friday: 6:00 AM - 10:00 PM Saturday: 6:00 AM - 10:00 PM Sunday: 8:00 AM - 8:00 PM ","http://www.lowes.com/","37.81274","-82.80334","18.3069652821257","Cell Phones; Compact Fluorescent Lights; Ni-Cd Batteries; Plastic Shopping Bags; Li-Ion Batteries; Ni-MH Batteries; Ni-Zn Batteries; Small Sealed Lead Acid Batteries; Video Game Consoles; PlayStation Consoles; Batteries (Rechargeable); Cell Phone Batteries; Li-Ion Batteries; Ni-Cd Batteries; Ni-MH Batteries; Small Sealed Lead Acid Batteries; Cell Phones","false","true","As an environmentally-committed retailer, Lowes offers a recycling center near store entrances to give consumers a free and easy way to properly dispose of rechargeable batteries, cell phones, CFLs and plastic shopping bags; materials that otherwise could be potentially harmful to the environment.  Look for the recycling center or ask a store associate for more details.","Call2Recycle","false","false","false","false"
"Lowe's","","527 North Mayo Trail","Paintsville","","KY","41240","6067881360","0","","https://newsroom.lowes.com/responsibility/operational-excellence/","37.8097148","-82.8028952","18.3638243961176","","false","false","","","false","false","false","false"
"Walmart Supercenter","","S Mayo Trail","Paintsville","","KY","41240","6067898920","0","","https://www.walmart.com/","37.8082876","-82.8007683","18.4945908269606","","false","false","","","false","false","false","false"
"Walmart Tire and Lube Express","null","470 N. Mayo Trail","Paintsville","","KY","41240","6067898920","0","","https://www.walmart.com/cp/ideas/8932632","37.8082876","-82.8007683","18.4945908269606","","false","false","","","false","false","false","false"
"Advance Auto Parts","Advance Auto Parts","272 S Mayo Trl","Paintsville","Johnson","KY","41240","6067896063","0","Monday: 7:00 AM - 9:00 PM Tuesday: 7:00 AM - 9:00 PM Wednesday: 7:00 AM - 9:00 PM Thursday: 7:00 AM - 9:00 PM Friday: 7:00 AM - 9:00 PM Saturday: 7:00 AM - 9:00 PM Sunday: 10:00 AM - 8:00 PM ","http://www.advanceautoparts.com","37.8094","-82.80051","18.4958238268345","Lead Acid (Pb) Batteries; Used Motor Oil; Video Game Consoles; PlayStation Consoles","false","true","","","false","false","false","false"
"Apple Valley Sanitation","Apple Valley Sanitation","4890 KY-321 ","Hagerhill","Johnson County","KY","41222","6067895980","0","Monday: 7:00 AM - 3:30 PM Tuesday: 7:00 AM - 3:30 PM Wednesday: 7:00 AM - 3:30 PM Thursday: 7:00 AM - 3:30 PM Friday: 7:00 AM - 3:30 PM ","null","37.7599934","-82.7727253","20.7845504162353","Car; Lead Acid (Pb) Batteries; Cardboard; Ferrous Metals (Steel or Iron); Large Household Appliances; Non-ferrous (Copper/Brass/Tin); Tin or Steel Cans; Used Motor Oil; Video Game Consoles; PlayStation Consoles","false","true","Please call ahead if you will be dropping off a large quantity of recycling items or to see if this site accepts an item not listed.","","false","false","false","false"
"Mountain Comprehensive Care Center","Mountain Comprehensive Care Center","40 Greenhouse Ln","Prestonsburg","Floyd","KY","41653","6068866815","0","Monday: 8:00 AM - 6:00 PM Tuesday: 8:00 AM - 6:00 PM Wednesday: 8:00 AM - 6:00 PM Thursday: 8:00 AM - 6:00 PM Friday: 8:00 AM - 6:00 PM Saturday: 8:00 AM - 6:00 PM ","http://www.mtcomp.org","37.72728","-82.76421","22.0178161566116","Plastics (Other); Video Game Consoles; PlayStation Consoles","false","true","They accept plastic products to grow plants in. Flats, pots, trays, cell packs, hanging baskets. If you drop off after hours, please leave materials outside the gates.","","false","false","false","false"
"Advance Auto Parts","null","1125 N Lake Dr","Prestonsburg","","KY","41653","6068863594","0","","http://shop.advanceautoparts.com/webapp/wcs/stores/servlet/home___","37.6815129","-82.7793438","22.736720373081","","false","false","","","false","false","false","false"
"Advance Auto Parts","Advance Auto Parts","1125 N Lake Dr","Prestonsburg","Floyd","KY","41653","6068863594","0","Monday: 7:00 AM - 9:00 PM Tuesday: 7:00 AM - 9:00 PM Wednesday: 7:00 AM - 9:00 PM Thursday: 7:00 AM - 9:00 PM Friday: 7:00 AM - 9:00 PM Saturday: 7:00 AM - 9:00 PM Sunday: 10:00 AM - 8:00 PM ","http://www.advanceautoparts.com","37.68158","-82.77891","22.7545524801085","Lead Acid (Pb) Batteries; Used Motor Oil; Video Game Consoles; PlayStation Consoles","false","true","","","false","false","false","false"
"Walmart","Walmart","477 Village Dr","Prestonsburg","Floyd","KY","41653","6068866681","0","","http://www.walmart.com","37.67111","-82.78292","22.9555988849977","Lead Acid (Pb) Batteries; Plastic Shopping Bags; Food Storage Bags; Video Game Consoles; PlayStation Consoles","false","true","","","false","false","false","false"
"Walmart","null","477 Village Dr","Prestonsburg","","KY","41653","6068866681","0","","https://www.walmart.com/","37.7198889","-82.7431648","23.2760861243777","","false","false","","","false","false","false","false"
"Panbowl Recycling","Panbowl Recycling","1216 Panbowl Rd","Jackson","Breathitt","KY","41339","6066934718","0","","http://www.waste.ky.gov","37.57334","-83.37887","23.4445947661514","Aluminum Cans; Non-ferrous (Copper/Brass/Tin); Video Game Consoles; PlayStation Consoles","false","true","Please call ahead if you will be dropping off a large quantity of recycling items or to see if this site accepts an item not listed.  If you are dropping off glass you will also need to call ahead to verify the colors of glass this site is currently accepting.","","false","false","false","false"
"Panbowl Recycling","","1216 Panbowl Road","Jackson","","KY","41339","6066934718","0","","https://eec.ky.gov/Pages/index.aspx","37.5727045","-83.3794646","23.4992238646907","","false","false","","","false","false","false","false"
"Prestonsburg Recycling and Drop-off","","41 Thursday Street","Prestonsburg","","KY","41653","6068863537","0","","","37.6656527","-82.7715486","23.6824421514232","","false","false","","","false","false","false","false"
"Advance Auto Parts","Advance Auto Parts","695 Highway 15 N","Jackson","Breathitt","KY","41339","6066667546","0","Monday: 7:00 AM - 9:00 PM Tuesday: 7:00 AM - 9:00 PM Wednesday: 7:00 AM - 9:00 PM Thursday: 7:00 AM - 9:00 PM Friday: 7:00 AM - 9:00 PM Saturday: 7:00 AM - 9:00 PM Sunday: 10:00 AM - 8:00 PM ","http://www.advanceautoparts.com","37.56095","-83.36616","23.7780760799079","Lead Acid (Pb) Batteries; Used Motor Oil; Video Game Consoles; PlayStation Consoles","false","true","","","false","false","false","false"
"Advance Auto Parts","null","615 Highway 15 N","Jackson","","KY","41339","6066667546","0","","http://shop.advanceautoparts.com/webapp/wcs/stores/servlet/home___","37.5580225","-83.3687845","24.0257848462544","","false","false","","","false","false","false","false"
"Brethitt County Recycling Drop-off Location","","460 highway 30 E","Jackson","","KY","41339","6066669101","0","","","37.5584177","-83.3739642","24.1545560818962","","false","false","","","false","false","false","false"
"Walmart","null","1589 Kentucky","Jackson","","KY","41339","6066664907","0","","https://www.walmart.com/","37.5515845","-83.3602896","24.164001038421","","false","false","","","false","false","false","false"
"Walmart","Walmart","1589 Kentucky Ave ","Jackson","Breathitt County","KY","41339","6066664907","0","","http://www.walmart.com","37.554783","-83.3786006","24.5031335708571","Lead Acid (Pb) Batteries; Plastic Shopping Bags; Food Storage Bags; Video Game Consoles; PlayStation Consoles","false","true","","","false","false","false","false"
"Menifee County Maintenance Garage","","State Route 36","Frenchburg","","KY","40322","6067682454","0","","","37.9509003","-83.6254935","27.5888559643593","","false","false","","","false","false","false","false"
"O'Reilly Auto Parts","null","225 Stone Street","Morehead","","KY","40351","6067800500","0","","http://oreillyauto.custhelp.com/app/error/error_id/6","38.1756644","-83.435329","27.6707076094146","","false","false","","","false","false","false","false"
"The Mountain Metal Company","The Mountain Metal Company","35 Depot St ","Allen","Floyd County","KY","41601","6068862102","0","","","37.6117826","-82.730067","27.6816087141541","Ferrous Metals (Steel or Iron); Non-ferrous (Copper/Brass/Tin); Video Game Consoles; PlayStation Consoles","false","true","Please call ahead if you will be dropping off a large quantity of recycling items or to see if this site accepts an item not listed.  This site does not accept car bodies or tin.","","false","false","false","false"
"Mountain Metals Co Inc","Mountain Metals Co Inc","35 Depot St ","Allen","Floyd County","KY","41601","6068862102","0","","","37.6117826","-82.730067","27.6816087141541","Aluminum; Ferrous Metals (Steel or Iron); Non-ferrous (Copper/Brass/Tin); High-Temp Alloys; Special Metals; Video Game Consoles; PlayStation Consoles","false","true","","","false","false","false","false"
"Advance Auto Parts","","135 Stone St","Morehead","","KY","40351","6067843777","0","","http://shop.advanceautoparts.com/webapp/wcs/stores/servlet/home___","38.1762321","-83.4353815","27.7040132322811","","false","false","","","false","false","false","false"
"911 Cell Phone Bank - Elliott County Sheriffs Office","911 Cell Phone Bank - Elliott County Sheriffs Office","600 W Main St","Morehead","Rowan","KY","40351","8662907864","0","","http://www.911cellphonebank.org/","38.17447","-83.43973","27.7467782058153","Cell Phones; Cameras; Laptop Computers; MP3 Players; Video Games; Video Game Consoles; Smart watches & Apple Watch®
","false","true","Please call to verify drop-off procedures and directions to the location.  For prepaid shipping labels, visit http://www.911cellphonebank.org/drop-off-locations.asp - click on "print shipping label."","","false","false","false","false"
"911 Cell Phone Bank - RSVP Leesburg","911 Cell Phone Bank - RSVP Leesburg","627 E Main St","Morehead","Rowan","KY","40351","8662907864","0","","http://www.911cellphonebank.org/","38.17474","-83.43981","27.7643186953613","Cell Phones; Cameras; Laptop Computers; MP3 Players; Video Games; Video Game Consoles; Smart watches & Apple Watch®
","false","true","Please call to verify drop-off procedures and directions to the location.  For prepaid shipping labels, visit http://www.911cellphonebank.org/drop-off-locations.asp - click on "print shipping label."","","false","false","false","false"
"Advance Auto Parts","Advance Auto Parts","135 Stone St","Morehead","Rowan","KY","40351","6067843777","0","Monday: 7:00 AM - 9:00 PM Tuesday: 7:00 AM - 9:00 PM Wednesday: 7:00 AM - 9:00 PM Thursday: 7:00 AM - 9:00 PM Friday: 7:00 AM - 9:00 PM Saturday: 7:00 AM - 9:00 PM Sunday: 10:00 AM - 8:00 PM ","http://www.advanceautoparts.com","38.18205","-83.42777","27.7895355739398","Lead Acid (Pb) Batteries; Used Motor Oil; Video Game Consoles; PlayStation Consoles","false","true","","","false","false","false","false"
"Community Recycling Center","","325 Triplett Street","Morehead","","KY","40351","6067841250","0","","https://moreheadrecycling.org/","38.1817128","-83.4296312","27.8287237330178","","false","false","","","false","false","false","false"
"Mr. Metal Recycling","Mr. Metal Recycling","4729 KY-1428 ","Allen","Floyd County","KY","41601","6068749657","0","Monday: 8:30 AM - 5:00 PM Tuesday: 8:30 AM - 5:00 PM Wednesday: 8:30 AM - 5:00 PM Thursday: 8:30 AM - 5:00 PM Friday: 8:30 AM - 5:00 PM ","","37.6304736","-82.7088685","27.8827989838211","Car; Automobile Parts; Ferrous Metals (Steel or Iron); Large Household Appliances; Clothes Hangers (Metal); Non-ferrous (Copper/Brass/Tin); Video Game Consoles; PlayStation Consoles","false","true","Please call ahead if you will be dropping off a large quantity of recycling items or to see if this site accepts an item not listed.","","false","false","false","false"
"Call2Recycle at RadioShack","Call2Recycle at RadioShack","332 Pine Crest Rd","Morehead","Rowan","KY","40351","6067848513","0","","http://www.radioshack.com/","38.17943","-83.44754","28.2756029949709","Cell Phones; Ni-Cd Batteries; Li-Ion Batteries; Ni-MH Batteries; Ni-Zn Batteries; Small Sealed Lead Acid Batteries; Video Game Consoles; PlayStation Consoles","false","true","As the first national retailer to partner with Call2Recycle, RadioShack is at the forefront of the rechargeable battery recycling cause and is pleased to offer battery recycling at thousands of convenient RadioShack locations for free.  Simply drop them off at your local RadioShack and theyll take care of the rest.  Ask a store associate for more details.","","false","false","false","false"
"Shred Nations","Shred Nations (inside PostNet)","312 Pine Crest Rd","Morehead","Rowan","KY","40351","5024373010","0","Monday: 9:00 AM - 6:00 PM Tuesday: 9:00 AM - 6:00 PM Wednesday: 9:00 AM - 6:00 PM Thursday: 9:00 AM - 6:00 PM Friday: 9:00 AM - 6:00 PM ","http://www.shrednations.com/dropoff/location/morehead/8725cff3-3fee-a347-7839-54400f13ee2d","38.17943","-83.44754","28.2756029949709","Cell Phones; Computer (Recycling); Laptop Computers; Small Televisions; Documents to Shred; Video Game Consoles; PlayStation Consoles","true","true","Shred Nations offers document shredding, hard drive destruction, electronics recycling and more. Visit website for quotes and full list of services offered in your area. ","","false","false","false","false"
"AutoZone","","1535 Flemingsburg Road","Morehead","","KY","40351","6067802304","0","","https://www.autozone.com/landing/page.jsp?name=in-our-stores","38.1862366","-83.4763159","29.6088320984407","","false","false","","","false","false","false","false"
"Call2Recycle at Lowe's","Call2Recycle at Lowe's","100 Kroger Ctr","Morehead","Rowan","KY","40351","6067802200","0","Monday: 6:00 AM - 10:00 PM Tuesday: 6:00 AM - 10:00 PM Wednesday: 6:00 AM - 10:00 PM Thursday: 6:00 AM - 10:00 PM Friday: 6:00 AM - 10:00 PM Saturday: 6:00 AM - 10:00 PM Sunday: 8:00 AM - 8:00 PM ","http://www.lowes.com/","38.17855","-83.48897","29.6408015601331","Cell Phones; Compact Fluorescent Lights; Ni-Cd Batteries; Plastic Shopping Bags; Li-Ion Batteries; Ni-MH Batteries; Ni-Zn Batteries; Small Sealed Lead Acid Batteries; Video Game Consoles; PlayStation Consoles; Batteries (Rechargeable); Cell Phone Batteries; Li-Ion Batteries; Ni-Cd Batteries; Ni-MH Batteries; Small Sealed Lead Acid Batteries; Cell Phones","false","true","As an environmentally-committed retailer, Lowes offers a recycling center near store entrances to give consumers a free and easy way to properly dispose of rechargeable batteries, cell phones, CFLs and plastic shopping bags; materials that otherwise could be potentially harmful to the environment.  Look for the recycling center or ask a store associate for more details.","Call2Recycle","false","false","false","false"
"Walmart","Walmart","275 Walton Dr","Louisa","Lawrence","KY","41230","6066734427","0","","http://www.walmart.com","38.07972","-82.66401","30.0771984561451","Lead Acid (Pb) Batteries; Plastic Shopping Bags; Food Storage Bags; Video Game Consoles; PlayStation Consoles","false","true","","","false","false","false","false"
"Lowe's","","100 Kroger Center Dr","Morehead","","KY","40351","6067802200","0","","https://newsroom.lowes.com/responsibility/operational-excellence/","38.1917159","-83.4825247","30.1152065703814","","false","false","","","false","false","false","false"
"Kroger Food Store","Kroger Food Store","300 Trademore Center ","Morehead","Rowan County","KY","40351","6067847529","0","","null","38.1916937","-83.4849624","30.1975187197761","Brown Paper Bags; Plastic Shopping Bags; Food Storage Bags; Video Game Consoles; PlayStation Consoles","false","true","","","false","false","false","false"
"Walmart Tire and Lube Express","","200 Walmart Way","Morehead","","KY","40351","6067843262","0","","https://www.walmart.com/cp/ideas/8932632","38.2014","-83.4820856","30.6232379762677","","false","false","","","false","false","false","false"
"Walmart Supercenter","","200 Walmart Way","Morehead","","KY","40351","6067843262","0","","https://www.walmart.com/","38.2014","-83.4820856","30.6232379762677","","false","false","","","false","false","false","false"
"Walmart Supercenter","","200 Walmart Way","Morehead","","KY","40351","6067843262","0","","https://www.walmart.com/","38.2014","-83.4820856","30.6232379762677","","false","false","","","false","false","false","false"
"Napa Auto Parts","Napa Auto Parts","670 E Tom T Hall Blvd","Olive Hill","Carter","KY","41164","6062868788","0","Monday: 7:30 AM - 7:00 PM Tuesday: 7:30 AM - 7:00 PM Wednesday: 7:30 AM - 7:00 PM Thursday: 7:30 AM - 7:00 PM Friday: 7:30 AM - 7:00 PM Saturday: 7:00 AM - 6:00 PM Sunday: 10:00 AM - 4:00 PM ","","38.30355","-83.163","31.1991822741831","Lead Acid (Pb) Batteries; Video Game Consoles; PlayStation Consoles","false","true","","","false","false","false","false"
"Lawrence County Recycling Drop-off Location","","Poor House Branch ","Louisa","","KY","41230","6066733299","0","","","38.1698825","-82.714624","31.6939898810133","","false","false","","","false","false","false","false"
"Cecil Salvage and Recycling","Cecil Salvage and Recycling","10900 US-60 ","Olive Hill","Carter County","KY","41164","6062866561","0","Monday: 8:00 AM - 5:00 PM Tuesday: 8:00 AM - 5:00 PM Wednesday: 8:00 AM - 5:00 PM Thursday: 8:00 AM - 5:00 PM Friday: 8:00 AM - 5:00 PM Saturday: 9:00 AM - 1:00 PM ","","38.3113797","-83.130093","31.7041680644803","Car; Automobile Parts; Ferrous Metals (Steel or Iron); Large Household Appliances; Clothes Hangers (Metal); Tin or Steel Cans; Car Donation; Video Game Consoles; PlayStation Consoles","false","true","","","false","false","false","false"
"Office Depot","Office Depot","3131 W US. Hwy 60 ","Olive Hill","Carter County","KY","41164","6087837787","0","Monday: 8:00 AM - 9:00 PM Tuesday: 8:00 AM - 9:00 PM Wednesday: 8:00 AM - 9:00 PM Thursday: 8:00 AM - 9:00 PM Friday: 8:00 AM - 9:00 PM Saturday: 9:00 AM - 7:00 PM Sunday: 10:00 AM - 6:00 PM ","http://www.officedepot.com/","38.311506","-83.130423","31.7127469596798","Cell Phones; Computer Monitors; Electronics; Inkjet Printer Cartridges; Ni-Cd Batteries; Office Equipment; Batteries (Rechargeable); Laser Toner Cartridges; MP3 Players; Small Televisions; Video Game Consoles; PlayStation Consoles","false","true","Office Depot offers electronics recycling for a small fee. Visit their Web site for more details and store locations. Recycle cell phones, PDAs, rechargeable batteries and ink and toner cartridges for FREE!","","false","false","false","false"
"Bath County Recycling Drop-off Location","","Main St ","Salt Lick","","KY","40371","6066746346","0","","","38.1164631","-83.6169969","31.9591413934917","","false","false","","","false","false","false","false"
"Advance Auto Parts","","50 Boardwalk","Inez","","KY","41224","6062984971","0","","http://shop.advanceautoparts.com/webapp/wcs/stores/servlet/home___","37.869505","-82.5442427","32.2468111344218","","false","false","","","false","false","false","false"
"Veolia Enviromental Services","","300 Old Phelps Road","Morehead","","KY","40351","6067846544","0","","","38.1841108","-83.5532957","32.2980707498779","","false","false","","","false","false","false","false"
"Cecil Salvage and Recycling","","10900 West US 60","Olive Hill","","KY","41164","6062866561","0","","","38.3213652","-83.1199542","32.4033015258487","","false","false","","","false","false","false","false"
"911 Cell Phone Bank - Martin County Sheriffs Office","911 Cell Phone Bank - Martin County Sheriffs Office","32 W Main St ","Inez","Martin County","KY","41224","8662907864","0","","http://www.911cellphonebank.org/","37.8667672","-82.5393672","32.5069005828628","Cell Phones; Cameras; Laptop Computers; MP3 Players; Video Games; Video Game Consoles; Smart watches & Apple Watch®
","false","true","Please call to verify drop-off procedures and directions to the location.  For prepaid shipping labels, visit http://www.911cellphonebank.org/drop-off-locations.asp - click on "print shipping label."","","false","false","false","false"
"Walmart Supercenter","","275 Walton Dr","Louisa","","KY","41230","6066734427","0","","https://www.walmart.com/","38.102241","-82.6243304","32.7298306375939","","false","false","","","false","false","false","false"
"Lawrence County Recycling Drop-off Location","","275 Walton Dr","Louisa","","KY","41230","6066733299","0","","","38.102241","-82.6243304","32.7298306375939","","false","false","","","false","false","false","false"
"AutoZone","","4411 Hwy 2565","Louisa","","KY","41230","6066389619","0","","https://www.autozone.com/landing/page.jsp?name=in-our-stores","38.1197857","-82.6206978","33.5469104532019","","false","false","","","false","false","false","false"
"Goodwill Industries of KYOWVA Area Inc. - Dell Reconnect Donation Site","","220 Townhill Road","Louisa","","KY","41230","6066380515","0","","http://www.goodwillhunting.org","38.111202","-82.6135206","33.5556839570166","","false","false","","","false","false","false","false"
"Advance Auto Parts","","4796 Hwy 2565","Louisa","","KY","41230","6066383656","0","","http://shop.advanceautoparts.com/webapp/wcs/stores/servlet/home___","38.1248784","-82.6233152","33.6228529213831","","false","false","","","false","false","false","false"
"Advance Auto Parts","Advance Auto Parts","4796 Highway 2565","Louisa","Lawrence","KY","41230","6066383656","0","Monday: 7:30 AM - 9:00 PM Tuesday: 7:30 AM - 9:00 PM Wednesday: 7:30 AM - 9:00 PM Thursday: 7:30 AM - 9:00 PM Friday: 7:30 AM - 9:00 PM Saturday: 7:30 AM - 9:00 PM Sunday: 9:00 AM - 7:00 PM ","http://www.advanceautoparts.com","38.15729","-82.64692","33.9042660428639","Lead Acid (Pb) Batteries; Used Motor Oil; Video Game Consoles; PlayStation Consoles","false","true","","","false","false","false","false"
"AutoZone","null","400 N Carol Malone","Grayson","","KY","41143","6064746773","0","","https://www.autozone.com/landing/page.jsp?name=in-our-stores","38.3347642","-82.944316","34.8950776723322","","false","false","","","false","false","false","false"
"Advance Auto Parts","","606 N Carol Malone Blvd","Grayson","","KY","41143","6064740447","0","","http://shop.advanceautoparts.com/webapp/wcs/stores/servlet/home___","38.3374116","-82.9433917","35.0846028125933","","false","false","","","false","false","false","false"
"AutoZone","AutoZone","400 N Carol Malone Blvd","Grayson","Carter","KY","41143","6064746773","0","","http://www.autozone.com","38.33862","-82.94254","35.1780571201118","Lead Acid (Pb) Batteries; Used Motor Oil; Video Game Consoles; PlayStation Consoles","false","true","Most AutoZone stores accept used motor oil, transmission fluid, gear oil and automotive batteries. Call to see what your local store is currently accepting.","","false","false","false","false"
"Advance Auto Parts","Advance Auto Parts","606 N Carol Malone Blvd","Grayson","Carter","KY","41143","6064740447","0","Monday: 7:00 AM - 9:00 PM Tuesday: 7:00 AM - 9:00 PM Wednesday: 7:00 AM - 9:00 PM Thursday: 7:00 AM - 9:00 PM Friday: 7:00 AM - 9:00 PM Saturday: 7:00 AM - 9:00 PM Sunday: 10:00 AM - 8:00 PM ","http://www.advanceautoparts.com","38.34121","-82.94262","35.3475943169199","Lead Acid (Pb) Batteries; Used Motor Oil; Video Game Consoles; PlayStation Consoles","false","true","","","false","false","false","false"
