name,description,address,city,region,province,postal_code,phone,fax,hours,url,latitude,longitude,distance,materials,pickup,dropoff,notes,groups,curbside,municipal,national,event_only
"Swampscott Middle School","","207 Forest Ave","Swampscott","","MA","1907","9782842500","0","","","42.4737022","-70.9025748","0.284390968495122","","false","false","","","false","false","false","false"
"Town of Swampscott Recycling Drop-Off Site","","200 Paradise Rd","Swampscott","","MA","1907","7815968864","0","","http://www.swampscottma.gov/health","42.4757419","-70.9145082","0.342510914097623","","false","false","","","false","false","false","false"
"Town of Swampscott Bulky Item Drop-off Site","Town of Swampscott Bulky Item Drop-off Site","200 Paradise Rd ","Swampscott","Essex County","MA","01907","7815968864","0","Saturday: 8:00 AM - 11:59 PM ","http://www.town.swampscott.ma.us/Public_Documents/SwampscottMA_Health/pickup","42.475725","-70.915237","0.377707701709601","Large Household Appliances; Propane Tanks; Microwaves","false","true","Dumpster available March-November, the last Saturday of the month. No items with freon accepted.","","false","false","false","false"
"Whole Foods Market","Whole Foods Market","331 Paradise Rd","Swampscott","Essex","MA","01907","7815922200","0","","http://www.wholefoodsmarket.com/","42.47922","-70.90488","0.382616603593233","Plastic #5 (Polypropylene); Plastic Shopping Bags; Alkaline/Single-Use Batteries; Gift Cards; Cork; Water Filters; Bubble Wrap (Reuse); Food Storage Bags; Computer (Recycling); Computer Monitors; Electronics; Laptop Computers; Computer Peripherals; Small Electronics; Small Televisions; Televisions; Video Game Consoles; PlayStation Consoles","false","true","Most Whole Foods stores participate in a variety of recycling programs. Items accepted may vary slightly by location - check with your local store to see what they are currently accepting.","","false","false","false","false"
"Whole Foods Market","","331 Paradise Rd","Swampscott","","MA","1907","7815922200","0","","https://www.preserve.eco/","42.4792134","-70.9048013","0.383949649139476","","false","false","","","false","false","false","false"
"Whole Foods Market","","331 Paradise Rd","Swampscott","","MA","1907","7815922200","0","","https://www.preserve.eco/","42.4792134","-70.9048013","0.383949649139476","","false","false","","","false","false","false","false"
"USPS Post Office Box Lobby Recycling Program","US Post Office","49 Elmwood Rd","Swampscott","Essex","MA","01907","8002758777","0","","https://www.usps.com/","42.47024","-70.91878","0.60931528558131","Catalogs; Greeting Cards; Magazines; Paper (Mixed)","false","true","","","false","false","false","false"
"US Post Office","USPS Discarded Lobby Mail Recycling Program","49 Elmwood Rd","Swampscott","Essex","MA","01907","0","0","","","42.47024","-70.91878","0.60931528558131","Computer (Recycling); Computer Monitors; Electronics; Laptop Computers; Computer Peripherals; Small Electronics; Small Televisions; Televisions; Video Game Consoles; PlayStation Consoles","false","true","","","false","false","false","false"
"Walgreens","Walgreens","450 Paradise Rd","Swampscott","Essex","MA","01907","7815811327","0","","http://www.walgreens.com","42.48264","-70.90381","0.621587063110912","Cell Phones; Inkjet Cartridge Refilling; Inkjet Printer Cartridges; Computer (Recycling); Computer Monitors; Electronics; Laptop Computers; Computer Peripherals; Small Electronics; Small Televisions; Televisions; Video Game Consoles; PlayStation Consoles","false","true","","","false","false","false","false"
"Swampscott Curbside Recycling","Swampscott Curbside Recycling","22 Monument Ave","Swampscott","Essex","MA","01907","7815968864","0","","http://www.town.swampscott.ma.us/Public_Documents/SwampscottMA_Health/index","42.46939","-70.91882","0.639721712499631","Aerosol Spray Cans; Aluminum; Aluminum Cans; Book Recycling; Cardboard; Catalogs; Chipboard; Drink Boxes; Glass (Blue); Glass (Brown); Glass (Clear); Glass (Green); Magazines; Newspapers; Paper (Mixed); Phone books; Plastic #1 (PETE); Plastic #2 (Color HDPE); Plastic #2 (HDPE); Plastic #3 (PVC); Plastic #4 (LDPE); Plastic #5 (Polypropylene); Plastic #6 (Polystyrene); Plastic #7; Tin or Steel Cans","false","false","","","true","false","false","false"
"Swampscott High School","","100 Essex Street","Swampscott","","MA","1907","9782842500","0","","","42.4758661","-70.9220937","0.721550054304677","","false","false","","","false","false","false","false"
"Blue Rhino Exchange - Mobil #01CYM","Blue Rhino Exchange - Mobil #01CYM","525 Paradise Rd","Swampscott","Essex","MA","01907","7815959877","0","","http://www.bluerhino.com","42.48457","-70.89982","0.830496111216997","Propane Tank Exchange; Computer (Recycling); Computer Monitors; Electronics; Laptop Computers; Computer Peripherals; Small Electronics; Small Televisions; Televisions; Video Game Consoles; PlayStation Consoles","false","true","","","false","false","false","false"
"Staples","Staples","17 Paradise Road","Salem","Essex County","MA","01970","9787414244","0","Monday: 8:00 AM - 9:00 PM Tuesday: 8:00 AM - 9:00 PM Wednesday: 8:00 AM - 9:00 PM Thursday: 8:00 AM - 9:00 PM Friday: 8:00 AM - 9:00 PM Sunday: 10:00 AM - 7:00 PM Saturday: 9:00 AM - 8:00 PM ","https://www.staples.com/recycle","42.4856199","-70.8992171","0.908632892831186","AC Power Plugs; Batteries (Rechargeable); Cables & Connectors; Cell Phone Batteries; Cell Phones; Computer (Recycling); Hard Drives; Computer Monitors; Cameras; DVD Players/Blu-Ray Players/DVRs; Electronics; E-Readers; GPS Units; Headphones; Inkjet Printer Cartridges; Laptop Computers; Laser Toner Cartridges; Li-Ion Batteries; MP3 Players; Network Equipment; Ni-Cd Batteries; Ni-MH Batteries; Ni-Zn Batteries; Computer Peripherals; Portable Media Players; Printers/Scanners/Fax Machines; Small Electronics; Small Sealed Lead Acid Batteries; Stereo Equipment; Tablets; Telephones; UPS Batteries/Backup Systems; VCRs; Video Game Systems; Blu-Ray Players; Digital Converter Boxes; Small Televisions; Televisions; Video Game Consoles; PlayStation Consoles; Alkaline/Single-Use Batteries","false","true","NO TVs; Limit 6 CEDs per day; ","Sony, Vizio, OEM","false","false","false","false"
"Staples","null","17 Paradise Road","Salem","","MA","01970","9787414244","0","","https://www.staples.com/sbd/cre/marketing/sustainability-center/recycling-services/","42.4856654","-70.8991242","0.913721978723794","Alkaline/Single-Use Batteries; Batteries (Rechargeable); Cell Phone Batteries; Li-Ion Batteries; Ni-Cd Batteries; Ni-MH Batteries; Small Sealed Lead Acid Batteries; Alkaline/Single-Use Batteries; Button Batteries; Non-rechargeable lithium batteries; Cell Phones","false","true","","Call2Recycle","false","false","false","false"
"911 Cell Phone Bank - Nextel Communications","911 Cell Phone Bank - Nextel Communications","58 Ocean St","Lynn","Essex","MA","01902","8662907864","0","","http://www.911cellphonebank.org/","42.4673","-70.92433","0.954906200843768","Cell Phones; Cameras; Laptop Computers; MP3 Players; Video Games; Video Game Consoles; Smart watches & Apple Watch®
","false","true","Please call to verify drop-off procedures and directions to the location.  For prepaid shipping labels, visit http://www.911cellphonebank.org/drop-off-locations.asp - click on "print shipping label."","","false","false","false","false"
"Thurgood Marshall Middle School","","19 Porter Street","Lynn","","MA","1902","9782842500","0","","","42.4736823","-70.932853","1.26139426185306","","false","false","","","false","false","false","false"
"Got Books Inc. - Clifton Lutheran Church","Got Books Inc. - Clifton Lutheran Church","150 Humphrey St","Marblehead","Essex","MA","01945","9786646555","0","Sunday: 12:00 AM - 11:59 PM Monday: 12:00 AM - 11:59 PM Tuesday: 12:00 AM - 11:59 PM Wednesday: 12:00 AM - 11:59 PM Thursday: 12:00 AM - 11:59 PM Friday: 12:00 AM - 11:59 PM Saturday: 12:00 AM - 11:59 PM ","http://www.gotbooks.com","42.4878","-70.88213","1.62256195577698","Books (Reuse); Book Recycling; CD/DVD/Blu-ray/UHD discs; VHS & Cassette Tapes; Computer (Recycling); Computer Monitors; Electronics; Laptop Computers; Computer Peripherals; Small Electronics; Small Televisions; Televisions; Video Game Consoles; PlayStation Consoles","true","true","","","false","false","false","false"
"Salem Transfer Station","Salem Transfer Station","12 Swampscott Rd","Salem","Essex","MA","01970","9787450226","0","Monday: 7:30 AM - 4:00 PM Tuesday: 7:30 AM - 4:00 PM Wednesday: 7:30 AM - 4:00 PM Thursday: 7:30 AM - 4:00 PM Friday: 7:30 AM - 4:00 PM Saturday: 8:30 AM - 11:30 PM ","http://salem.com/Pages/SalemMA_Recycling/transfer","42.49679","-70.92371","1.75015924670672","Cardboard; Large Household Appliances; Yard Waste; Microwaves","false","true","","","false","false","false","false"
"Walgreens","Walgreens","21 Joyce St","Lynn","Essex","MA","01902","7815931070","0","","http://www.walgreens.com","42.46799","-70.94287","1.8229506194601","Cell Phones; Inkjet Printer Cartridges; Computer (Recycling); Computer Monitors; Electronics; Laptop Computers; Computer Peripherals; Small Electronics; Small Televisions; Televisions; Video Game Consoles; PlayStation Consoles","false","true","","","false","false","false","false"
"911 Cell Phone Bank - Lynx Central Florida Transportation","911 Cell Phone Bank - Lynx Central Florida Transportation","8 Silsbee St","Lynn","Essex","MA","01901","8662907864","0","","http://www.911cellphonebank.org/","42.46538","-70.9423","1.8463434723291","Cell Phones; Cameras; Laptop Computers; MP3 Players; Video Games; Video Game Consoles; Smart watches & Apple Watch®
","false","true","Please call to verify drop-off procedures and directions to the location.  For prepaid shipping labels, visit http://www.911cellphonebank.org/drop-off-locations.asp - click on "print shipping label."","","false","false","false","false"
"Blue Rhino Exchange - Walmart #2640","Blue Rhino Exchange - Walmart #2640","450 Highland Ave","Salem","Essex","MA","01970","9788251713","0","","http://www.bluerhino.com","42.49387","-70.93412","1.89712624510518","Propane Tank Exchange; Computer (Recycling); Computer Monitors; Electronics; Laptop Computers; Computer Peripherals; Small Electronics; Small Televisions; Televisions; Video Game Consoles; PlayStation Consoles","false","true","","","false","false","false","false"
"Call2Recycle at the Home Depot","Call2Recycle at the Home Depot","50 Traders Way","Salem","Essex","MA","01970","9787419299","0","","http://www.homedepot.com/","42.5001","-70.92232","1.92897712185563","Cell Phones; Compact Fluorescent Lights; Ni-Cd Batteries; Li-Ion Batteries; Ni-MH Batteries; Ni-Zn Batteries; Small Sealed Lead Acid Batteries; Computer (Recycling); Computer Monitors; Electronics; Laptop Computers; Computer Peripherals; Small Electronics; Small Televisions; Televisions; Video Game Consoles; PlayStation Consoles; Batteries (Rechargeable); Cell Phone Batteries; Li-Ion Batteries; Ni-Cd Batteries; Ni-MH Batteries; Small Sealed Lead Acid Batteries","false","true","The Home Depot accepts used rechargeable batteries and compact fluorescent bulbs. Look for the orange drop boxes, usually located near the front entrance near the customer service desk, or ask a store associate for more details.","Call2Recycle","false","false","false","false"
"Dymes Redemption Center","Dymes Redemption Center","780 Washington St","Lynn","Essex","MA","01901","7815816992","0","","http://www.mass.gov/","42.46059","-70.94168","1.95292457023412","Plastic #1 (PETE); Plastic #2 (HDPE); Plastic #2 (Color HDPE); Aluminum Cans; Computer (Recycling); Computer Monitors; Electronics; Laptop Computers; Computer Peripherals; Small Electronics; Small Televisions; Televisions; Video Game Consoles; PlayStation Consoles","false","true","Clean, empty bottles and cans accepted.  Redemption centers deduct processing fees from refunds.","","false","false","false","false"
"Walmart","","450 Highland Ave","Salem","","MA","1970","9788251713","0","","https://www.walmart.com/","42.494502","-70.9355466","1.9792582030308","","false","false","","","false","false","false","false"
"Shaws","","11 Traders Way","Salem","","MA","1970","9787418660","0","","","42.5017904","-70.9215472","2.02404502118832","","false","false","","","false","false","false","false"
"USPS Post Office Box Lobby Recycling Program","US Post Office","51 Willow St","Lynn","Essex","MA","01901","8002758777","0","","https://www.usps.com/","42.46426","-70.94553","2.02738599711877","Catalogs; Greeting Cards; Magazines; Paper (Mixed)","false","true","","","false","false","false","false"
"US Post Office","USPS Discarded Lobby Mail Recycling Program","51 Willow St","Lynn","Essex","MA","01901","0","0","","","42.46426","-70.94553","2.02738599711877","Computer (Recycling); Computer Monitors; Electronics; Laptop Computers; Computer Peripherals; Small Electronics; Small Televisions; Televisions; Video Game Consoles; PlayStation Consoles","false","true","","","false","false","false","false"
"St. Anne's Church","","11 Cleveland Street","Salem","","MA","1970","9782842500","0","","","42.5034379","-70.9019689","2.04270664771765","","false","false","","","false","false","false","false"
"Target","Target","227 Highland Ave","Salem","Essex","MA","01970","9782244000","0","","http://www.target.com/","42.50368","-70.91996","2.12296080823152","Aluminum Cans; Cell Phones; Inkjet Printer Cartridges; MP3 Players; Plastic #1 (PETE); Plastic #2 (HDPE); Plastic Shopping Bags; Computer (Recycling); Computer Monitors; Electronics; Laptop Computers; Computer Peripherals; Small Electronics; Small Televisions; Televisions; Video Game Consoles; PlayStation Consoles","false","true","","","false","false","false","false"
"The Salvation Army","null","10 Munroe Street","Lynn","Essex County","MA","01901","8007287825","0","Monday: 8:30 AM - 5:00 PM Tuesday: 8:30 AM - 5:00 PM Wednesday: 8:30 AM - 5:00 PM Thursday: 8:30 AM - 5:00 PM Friday: 8:30 AM - 5:00 PM Saturday: 8:30 AM - 5:00 PM Sunday:  -  ","http://www.salvationarmyusa.org","42.4626187","-70.9474122","2.15740454074903","Bikes; Books (Reuse); CD/DVD/Blu-ray/UHD discs; Cell Phones; Children's Toys; Clothing; Computer (Reuse); Hard Drives; Computer Monitors; Cameras; DVD Players/Blu-Ray Players/DVRs; Electronics; E-Readers; Furniture; Gift Bags; Headphones; Household Goods; Laptop Computers; Lawn Equipment; Miscellaneous Tools; MP3 Players; Musical Instruments; Network Equipment; Ornaments; Computer Peripherals; Portable Media Players; Printers/Scanners/Fax Machines; Reusable Appliance Donation; Small Appliances; Small Electronics; Small Televisions; Sporting Goods; Stereo Equipment; Tablets; Telephones; Televisions; VCRs; VHS & Cassette Tapes; Video Game Systems; Blu-Ray Players; Digital Converter Boxes; Computer (Recycling); Video Game Consoles; PlayStation Consoles","false","true","","Sony, Vizio, OEM, Salvation Army","false","false","false","false"
"USPS Post Office Box Lobby Recycling Program","US Post Office","245 Maple St Ste 1","Lynn","Essex","MA","01904","8002758777","0","","https://www.usps.com/","42.47827","-70.9503","2.16798443370763","Catalogs; Greeting Cards; Magazines; Paper (Mixed)","false","true","","","false","false","false","false"
"US Post Office","USPS Discarded Lobby Mail Recycling Program","245 Maple St Ste 1","Lynn","Essex","MA","01904","0","0","","","42.47827","-70.9503","2.16798443370763","Computer (Recycling); Computer Monitors; Electronics; Laptop Computers; Computer Peripherals; Small Electronics; Small Televisions; Televisions; Video Game Consoles; PlayStation Consoles","false","true","","","false","false","false","false"
"Blue Rhino Exchange - Richdale Store 61","Blue Rhino Exchange - Richdale Store 61","573 Chestnut St","Lynn","Essex","MA","01904","7815933820","0","","http://www.bluerhino.com","42.47817","-70.95075","2.18985595416995","Propane Tank Exchange; Computer (Recycling); Computer Monitors; Electronics; Laptop Computers; Computer Peripherals; Small Electronics; Small Televisions; Televisions; Video Game Consoles; PlayStation Consoles","false","true","","","false","false","false","false"
"Shaw's","Shaw's","43 State St","Lynn","Essex","MA","01901","9782329104","0","","null","42.46152","-70.94976","2.29686151736331","Plastic Shopping Bags; Food Storage Bags; Computer (Recycling); Computer Monitors; Electronics; Laptop Computers; Computer Peripherals; Small Electronics; Small Televisions; Televisions; Video Game Consoles; PlayStation Consoles","false","true","","","false","false","false","false"
"St. Mary's School","","35 Tremont Street","Lynn","","MA","1902","9782842500","0","","","42.4629781","-70.9506862","2.30465382364048","","false","false","","","false","false","false","false"
"Shaws","","43 State Street","Lynn","","MA","1901","7815998473","0","","","42.4621156","-70.9504075","2.31218152751239","","false","false","","","false","false","false","false"
"Extras for Creative Learning","","20 Wheeler ST","Lynn","","MA","1902","7815999939","0","","http://www.exclrecycles.org/","42.46064","-70.951076","2.38228171281366","","false","false","","","false","false","false","false"
"Newark Recovery & Recycling-Salem MA","Newark Recovery & Recycling-Salem MA","53 Jefferson Ave","Salem","Essex","MA","01970","9787444330","9787448857","","http://www.newarkgroup.com","42.51013","-70.90107","2.50674979285313","Plastic #1 (PETE); Plastic #2 (HDPE); Aluminum Cans; Aluminum; Book Recycling; Cardboard; Catalogs; Computer Paper; Ferrous Metals (Steel or Iron); Magazines; Newspapers; Non-ferrous (Copper/Brass/Tin); Paperboard; Phone books; Tin or Steel Cans; Office Paper; Wire; Plastic Film; Computer (Recycling); Computer Monitors; Electronics; Laptop Computers; Computer Peripherals; Small Electronics; Small Televisions; Televisions; Video Game Consoles; PlayStation Consoles","false","true","Headquarters","","false","false","false","false"
"North Shore Recycled Fiber","North Shore Recycled Fiber","53 Jefferson Ave","Salem","Essex","MA","01970","9787450635","0","Monday: 7:00 AM - 3:00 PM Tuesday: 7:00 AM - 3:00 PM Wednesday: 7:00 AM - 3:00 PM Thursday: 7:00 AM - 3:00 PM Friday: 7:00 AM - 3:00 PM ","http://www.newarkgroup.com","42.51013","-70.90107","2.50674979285313","Plastic #1 (PETE); Plastic #2 (HDPE); Plastic #2 (Color HDPE); Plastic #3 (PVC); Plastic #4 (LDPE); Plastic #5 (Polypropylene); Plastic #6 (Polystyrene); Plastic #7; Aluminum Cans; Aluminum; Glass (Brown); Brown Paper Bags; Cardboard; Catalogs; Chipboard; Glass (Clear); Computer Paper; Gift Boxes; Glass (Green); Greeting Cards; Magazines; Paper (Mixed); Newspapers; Paperboard; Phone books; Tin or Steel Cans; Office Paper","false","true","Also open select Saturdays.","","false","false","false","false"
"USPS Post Office Box Lobby Recycling Program","US Post Office","27 Smith St","Marblehead","Essex","MA","01945","8002758777","0","","https://www.usps.com/","42.49311","-70.86568","2.52529158762413","Catalogs; Greeting Cards; Magazines; Paper (Mixed)","false","true","","","false","false","false","false"
"US Post Office","USPS Discarded Lobby Mail Recycling Program","27 Smith St","Marblehead","Essex","MA","01945","0","0","","","42.49311","-70.86568","2.52529158762413","Computer (Recycling); Computer Monitors; Electronics; Laptop Computers; Computer Peripherals; Small Electronics; Small Televisions; Televisions; Video Game Consoles; PlayStation Consoles","false","true","","","false","false","false","false"
"Blue Rhino Exchange - Stop & Shop #067","Blue Rhino Exchange - Stop & Shop #067","35 Washington St","Lynn","Essex","MA","01904","7815961882","0","","http://www.bluerhino.com","42.46986","-70.95851","2.58600925290169","Propane Tank Exchange; Computer (Recycling); Computer Monitors; Electronics; Laptop Computers; Computer Peripherals; Small Electronics; Small Televisions; Televisions; Video Game Consoles; PlayStation Consoles","false","true","","","false","false","false","false"
"Advance Auto Parts","null","152 Boston St","Lynn","Essex","MA","01904","7815818550","0","Monday: 7:30 AM - 9:00 PM Tuesday: 7:30 AM - 9:00 PM Wednesday: 7:30 AM - 9:00 PM Thursday: 7:30 AM - 9:00 PM Friday: 7:30 AM - 9:00 PM Saturday: 7:30 AM - 9:00 PM Sunday: 9:00 AM - 7:00 PM ","http://www.advanceautoparts.com","42.47054","-70.95933","2.6225311878173","Lead Acid (Pb) Batteries; Used Motor Oil; Computer (Recycling); Computer Monitors; Electronics; Laptop Computers; Computer Peripherals; Small Electronics; Small Televisions; Televisions; Video Game Consoles; PlayStation Consoles","false","true","","","false","false","false","false"
"North Shore Recycled Fibers","","53 Jefferson Ave","Salem","","MA","1970","9787444330","0","","","42.5136473","-70.8993755","2.7600750565956","","false","false","","","false","false","false","false"
"Newark Recovery & Recycling-Divisional Headquarters","","53 Jefferson Ave","Salem","","MA","1970","9787444330","0","","","42.5136473","-70.8993755","2.7600750565956","","false","false","","","false","false","false","false"
"City of Lynn Yard Waste Collection Center","","250 Commercial St","Lynn","","MA","1901","7813349500","0","","https://patch.com/massachusetts/lynnfield/recycling-center-announces-dates-for-christmas-trees","42.4548164","-70.9566304","2.81294297965566","","false","false","","","false","false","false","false"
"Lynn Transfer Station","Lynn Transfer Station","247 Commercial St ","Lynn","Essex County","MA","01905","5082914408","0","","","42.4540978","-70.9569308","2.85030958618856","Construction Materials; Computer (Recycling); Computer Monitors; Electronics; Laptop Computers; Computer Peripherals; Small Electronics; Small Televisions; Televisions; Video Game Consoles; PlayStation Consoles","false","true","","","false","false","false","false"
"City of Lynn Transfer Station","","247 Commercial St","Lynn","","MA","1901","7814777099","0","","http://www.ci.lynn.ma.us/citydepartments_publicworks.shtml#gpm1_14","42.4540978","-70.9569308","2.85030958618856","","false","false","","","false","false","false","false"
"J & K Redemption Center","J & K Redemption Center","676 Western Ave","Lynn","Essex","MA","01905","7815815777","0","Monday: 7:30 AM - 8:00 PM Tuesday: 7:30 AM - 8:00 PM Wednesday: 7:30 AM - 8:00 PM Thursday: 7:30 AM - 8:00 PM Friday: 7:30 AM - 8:00 PM Saturday: 7:30 AM - 8:00 PM ","","42.46394","-70.96379","2.92515909050372","Plastic #2 (HDPE); Plastic #2 (Color HDPE); Aluminum Cans; Glass (Brown); Glass (Clear); Glass (Green); Computer (Recycling); Computer Monitors; Electronics; Laptop Computers; Computer Peripherals; Small Electronics; Small Televisions; Televisions; Video Game Consoles; PlayStation Consoles","false","true","This is a registered redemption center collecting beverage containers under the Massachusetts Bottle Deposit Law.  Please call this redemption center for more information on what their collection policies are.","","false","false","false","false"
"Connery Elementary School","","50 Elm Street","Lynn","","MA","1905","9782842500","0","","","42.4610546","-70.9627603","2.92998194505822","","false","false","","","false","false","false","false"
"J & K Redemption Center","J & K Redemption Center","680 Western Ave ","Lynn","Essex County","MA","01905","7815815777","0","","http://www.mass.gov/eea/agencies/massdep/recycle/reduce/bottle-and-can-recycling.html","42.4637798","-70.9641376","2.94504209568139","Plastic #1 (PETE); Plastic #2 (HDPE); Plastic #2 (Color HDPE); Aluminum Cans; Computer (Recycling); Computer Monitors; Electronics; Laptop Computers; Computer Peripherals; Small Electronics; Small Televisions; Televisions; Video Game Consoles; PlayStation Consoles","false","true","Clean, empty bottles and cans accepted.  Redemption centers deduct processing fees from refunds.","","false","false","false","false"
"Solomon Metals Corp","","580 Lynnway","Lynn","","MA","1905","7815817000","0","","https://www.solomonmetals.com/","42.454462","-70.959523","2.95462823944501","","false","false","","","false","false","false","false"
"Advance Auto Parts","Advance Auto Parts","424 Essex St","Salem","Essex","MA","01970","9787455073","0","Monday: 7:00 AM - 9:00 PM Tuesday: 7:00 AM - 9:00 PM Wednesday: 7:00 AM - 9:00 PM Thursday: 7:00 AM - 9:00 PM Friday: 7:00 AM - 9:00 PM Saturday: 7:00 AM - 9:00 PM Sunday: 10:00 AM - 8:00 PM ","http://www.advanceautoparts.com","42.51707","-70.9061","2.96220939915712","Lead Acid (Pb) Batteries; Used Motor Oil; Computer (Recycling); Computer Monitors; Electronics; Laptop Computers; Computer Peripherals; Small Electronics; Small Televisions; Televisions; Video Game Consoles; PlayStation Consoles","false","true","","","false","false","false","false"
"Solomon Metals Corp","Solomon Metals Corp","580 Lynnway","Lynn","Essex","MA","01905","7815817000","0","Monday: 7:00 AM - 4:00 PM Tuesday: 7:00 AM - 4:00 PM Wednesday: 7:00 AM - 4:00 PM Thursday: 7:00 AM - 4:00 PM Friday: 7:00 AM - 4:00 PM Saturday: 7:00 AM - 11:59 PM ","http://www.solomonmetals.com","42.45418","-70.95951","2.96310007689931","Aluminum Cans; Aluminum; Lead Acid (Pb) Batteries; Ferrous Metals (Steel or Iron); Non-ferrous (Copper/Brass/Tin); Tin or Steel Cans; Wire; High-Temp Alloys; Computer (Recycling); Computer Monitors; Electronics; Laptop Computers; Computer Peripherals; Small Electronics; Small Televisions; Televisions; Video Game Consoles; PlayStation Consoles","false","true","","","false","false","false","false"
"Sewell Anderson Elementary School","","25 Ontario Street","Lynn","","MA","1905","9782842500","0","","","42.4732496","-70.9680078","3.05307158846309","","false","false","","","false","false","false","false"
"Marblehead Cycle","Marblehead Cycle","25 Bessom St","Marblehead","Essex ","MA","01945","7816311570","0","","","42.5004775146627","-70.8591128910311","3.08590486588689","E-Bike Batteries","false","true","Call or Check Online for Hours","Call2Recycle","false","false","false","false"
