name,description,address,city,region,province,postal_code,phone,fax,hours,url,latitude,longitude,distance,materials,pickup,dropoff,notes,groups,curbside,municipal,national,event_only
"Firestone Complete Auto Care","","6414 NW Expwy ","Oklahoma City","","OK","73132","4057225527","0","","https://www.firestonecompleteautocare.com/","35.5529217","-97.628402","3.34048817963664","","false","false","","","false","false","false","false"
"Freedom Telecom Enterprise, LLC","","4236 Nw Expy","Oklahoma City","","OK","73116","4057227243","0","","","35.5381691","-97.5960047","3.34978937174856","","false","false","","","false","false","false","false"
"Sprint Store","","6401 NW Expressway","Oklahoma City","","OK","73132","4057732990","0","","https://newsroom.sprint.com/csr/device-donations/","35.5542298","-97.6277319","3.43654402423243","","false","false","","","false","false","false","false"
"Target Store","","8315 N Rockwell Ave","Oklahoma City","","OK","73132","4055066086","0","","https://corporate.target.com/corporate-responsibility/planet","35.5554671","-97.6397234","3.45178635612062","","false","false","","","false","false","false","false"
"Firestone Complete Auto Care","","6501 Northwest Expwy","Oklahoma City","","OK","73132","4057283093","0","","https://www.firestonecompleteautocare.com/","35.5549362","-97.6298448","3.46274651432719","","false","false","","","false","false","false","false"
"RadioShack","RadioShack","8325 N Rockwell Ave","Oklahoma City","Oklahoma","OK","73132","4057213920","0","Monday: 10:00 AM - 9:00 PM Tuesday: 10:00 AM - 9:00 PM Wednesday: 10:00 AM - 9:00 PM Thursday: 10:00 AM - 9:00 PM Friday: 10:00 AM - 9:00 PM Saturday: 10:00 AM - 9:00 PM Sunday: 12:00 PM - 6:00 PM ","http://www.radioshack.com","35.55577","-97.6384","3.47387981091608","Ni-Cd Batteries; Batteries (Rechargeable); Computer (Recycling); Computer Monitors; Electronics; Laptop Computers; Tablets; Video Game Consoles; PlayStation Consoles","false","true","","","false","false","false","false"
"Target","Target","8315 N Rockwell Ave","Oklahoma City","Oklahoma","OK","73132","4055066086","0","","http://www.target.com/","35.55577","-97.6384","3.47387981091608","Aluminum Cans; Cell Phones; Inkjet Printer Cartridges; MP3 Players; Plastic #1 (PETE); Plastic #2 (HDPE); Plastic Shopping Bags; Computer (Recycling); Computer Monitors; Electronics; Laptop Computers; Tablets; Video Game Consoles; PlayStation Consoles","false","true","","","false","false","false","false"
"Tires Plus","","3508 NW 23rd St","Oklahoma City","","OK","73107","4059432433","0","","https://www.tiresplus.com/","35.4929376","-97.58021","3.47500286982331","","false","false","","","false","false","false","false"
"Cartridge World","","8500 North Rockwell Avenue","Oklahoma City","","OK","73132","4057283388","0","","","35.5570251","-97.6379436","3.56131810369069","","false","false","","","false","false","false","false"
"Cartridge World","Cartridge World","8500 N Rockwell Ave","Oklahoma City","Oklahoma","OK","73132","4057283388","0","","null","35.55703","-97.63791","3.56171918457019","Inkjet Cartridge Refilling; Inkjet Printer Cartridges; Laser Toner Refilling; Laser Toner Cartridges; Computer (Recycling); Computer Monitors; Electronics; Laptop Computers; Tablets; Video Game Consoles; PlayStation Consoles","false","true","","","false","false","false","false"
"Sams Club","","5510 SW 5th St","Oklahoma City","","OK","73128","4059439810","0","","https://www.samsclub.com/","35.4579746","-97.6131161","3.61627921931454","","false","false","","","false","false","false","false"
"Sam's Club","Sam's Club","5510 SW 5th St","Oklahoma City","Oklahoma","OK","73128","4059439810","0","","http://www.samsclub.com","35.4579","-97.61295","3.62487835945529","Lead Acid (Pb) Batteries; Computer (Recycling); Computer Monitors; Electronics; Laptop Computers; Tablets; Video Game Consoles; PlayStation Consoles","false","true","","","false","false","false","false"
"Sams Club","","9000 NW Passage","Oklahoma City","","OK","73132","4057733602","0","","https://www.samsclub.com/","35.559719","-97.650403","3.79064159674304","","false","false","","","false","false","false","false"
"Home Depot","","7620 Northwest Expy","Oklahoma City","","OK","73132","4057736077","0","","https://ecooptions.homedepot.com/","35.5607306","-97.6478601","3.8407130840705","","false","false","","","false","false","false","false"
"AT&T Wireless","AT&T Wireless","6959 NW Expressway","Oklahoma City","Oklahoma","OK","73132","4057204572","0","","http://www.att.com/","35.56119","-97.63702","3.85085893090822","Cell Phones; Ni-Cd Batteries; Batteries (Rechargeable); Cell Phone Batteries; Tablets; Li-Ion Batteries; Computer (Recycling); Computer Monitors; Electronics; Laptop Computers; Video Game Consoles; PlayStation Consoles","false","true","Receive an AT&T Promotion Card worth the trade-in value of your smartphone, tablet, or netbook. You can also donate the trade-in value to Cell Phones for Soldiers.","","false","false","false","false"
"Shred Nations","Shred Nations (inside Mail It)","6957 NW Expressway","Oklahoma City","Oklahoma","OK","73132","4054450899","0","","http://www.shrednations.com/dropoff/location/oklahoma-city/d7fc7148-f773-e5b1-9e05-51ad10da8aa7","35.56119","-97.63702","3.85085893090822","Cell Phones; Computer (Recycling); Laptop Computers; Small Televisions; Documents to Shred; Computer Monitors; Electronics; Tablets; Video Game Consoles; PlayStation Consoles","true","true","Shred Nations offers document shredding, hard drive destruction, electronics recycling and more. Visit website for quotes and full list of services offered in your area. ","","false","false","false","false"
"Pep Boys Auto","","7401 Northwest Expressway","Oklahoma City","","OK","73132","8007372697","0","","https://www.pepboys.com/","35.5613279","-97.6437695","3.86239266871069","","false","false","","","false","false","false","false"
"HiTech Assets Inc","HiTech Assets Inc","401 N Portland Ave","Oklahoma City","Oklahoma","OK","73107","4056044872","0","","http://www.htassets.com","35.47054","-97.58508","3.92329363799455","Electronics; Computer (Recycling); Computer Monitors; Laptop Computers; Tablets; Video Game Consoles; PlayStation Consoles","true","true","","","false","false","false","false"
"Call2Recycle at the Home Depot","Call2Recycle at the Home Depot","7620 NW Expressway","Oklahoma City","Oklahoma","OK","73132","4057736077","0","","http://www.homedepot.com/","35.56198","-97.64772","3.92560190370692","Cell Phones; Compact Fluorescent Lights; Ni-Cd Batteries; Li-Ion Batteries; Ni-MH Batteries; Ni-Zn Batteries; Small Sealed Lead Acid Batteries; Computer (Recycling); Computer Monitors; Electronics; Laptop Computers; Tablets; Video Game Consoles; PlayStation Consoles; Batteries (Rechargeable); Cell Phone Batteries; Li-Ion Batteries; Ni-Cd Batteries; Ni-MH Batteries; Small Sealed Lead Acid Batteries","false","true","The Home Depot accepts used rechargeable batteries and compact fluorescent bulbs. Look for the orange drop boxes, usually located near the front entrance near the customer service desk, or ask a store associate for more details.","Call2Recycle","false","false","false","false"
"Verizon Wireless","Verizon Wireless","7640 NW Expressway","Oklahoma City","Oklahoma","OK","73132","4057733200","4058633579","","http://www.verizonwireless.com/","35.56198","-97.64772","3.92560190370692","Cell Phones; Cell Phone Batteries; Computer (Recycling); Computer Monitors; Electronics; Laptop Computers; Tablets; Video Game Consoles; PlayStation Consoles","false","true","<A Href="https://www.trade-in.vzw.com/home.aspx">
The Verizon Wireless Trade-In Program</A> allows you to trade in your used handset or tablet in a convenient and responsible way. 
<P>
<P>
Verizon Wireless works every day to protect our environment and give our customers opportunities to do the same. <A Href="http://aboutus.vzw.com/Green_Initiative/overview.html">Click here</A> for more examples of the earth-friendly initiatives and programs Verizon Wireless is proud to offer and support.","","false","false","false","false"
"Kohl's","","9001 Northwest Passage","Oklahoma City","","OK","73132","4056211779","0","","https://corporate.kohls.com/","35.5615013","-97.6519841","3.92659493590632","","false","false","","","false","false","false","false"
"Walmart Supercenter","","7800 Northwest Expy","Oklahoma City","","OK","73132","4057732625","0","","https://www.walmart.com/","35.5622601","-97.6548163","4.00823217725427","","false","false","","","false","false","false","false"
"Walmart Tire and Lube Express","","7800 Nw Expy","Oklahoma City","","OK","73132","4057732625","0","","https://www.walmart.com/cp/ideas/8932632","35.5622601","-97.6548163","4.00823217725427","","false","false","","","false","false","false","false"
"Rite-Way Shredding","Rite-Way Shredding","1131 Enterprise Ave Ste 20","Oklahoma City","Oklahoma","OK","73128","4056051405","0","Monday: 7:00 AM - 4:00 PM Tuesday: 7:00 AM - 4:00 PM Wednesday: 7:00 AM - 4:00 PM Thursday: 7:00 AM - 4:00 PM Friday: 7:00 AM - 4:00 PM ","http://www.ritewayshredding.com/","35.45559","-97.60333","4.01961100172617","Book Recycling; Brown Paper Bags; Cardboard; Catalogs; Drink Boxes; Magazines; Paper (Mixed); Newspapers; Paperboard; Phone books; Office Paper; Computer (Recycling); Computer Monitors; Electronics; Laptop Computers; Tablets; Video Game Consoles; PlayStation Consoles","true","true","","","false","false","false","false"
"HiTech Assets Inc","","401 North Portland Avenue","Oklahoma City","","OK","73107","4056044872","0","","https://www.htassets.com/","35.4691598","-97.5841228","4.02468071322062","","false","false","","","false","false","false","false"
"RiteWay Shredding","","1131 Enterprise Ave #20","Oklahoma City","","OK","73128","4056051405","0","","https://ritewayshredding.com/","35.4542106","-97.6044451","4.07045946679803","","false","false","","","false","false","false","false"
"Lowe's","","3801 North May Avenue","Oklahoma City","","OK","73112","4052461200","0","","https://newsroom.lowes.com/responsibility/operational-excellence/","35.509886","-97.5670435","4.11602999476304","","false","false","","","false","false","false","false"
"Advance Auto Parts","","3217 N May Ave","Oklahoma City","","OK","73112","4059422284","0","","http://shop.advanceautoparts.com/webapp/wcs/stores/servlet/home___","35.5027538","-97.5661545","4.15943109087212","","false","false","","","false","false","false","false"
"Walgreens","Walgreens","7930 Northwest Expy ","Oklahoma City","Oklahoma County","OK","73132","4057735069","0","","http://www.walgreens.com","35.56482","-97.65537","4.18770829624053","Cell Phones; Inkjet Printer Cartridges; Computer (Recycling); Computer Monitors; Electronics; Laptop Computers; Tablets; Video Game Consoles; PlayStation Consoles","false","true","","","false","false","false","false"
"Call2Recycle at Lowe's","Call2Recycle at Lowe's","3801 N May Ave","Oklahoma City","Oklahoma","OK","73112","4052461200","0","Monday: 6:00 AM - 10:00 PM Tuesday: 6:00 AM - 10:00 PM Wednesday: 6:00 AM - 10:00 PM Thursday: 6:00 AM - 10:00 PM Friday: 6:00 AM - 10:00 PM Saturday: 6:00 AM - 10:00 PM Sunday: 8:00 AM - 8:00 PM ","http://www.lowes.com/","35.51065","-97.56563","4.19943362761002","Cell Phones; Compact Fluorescent Lights; Ni-Cd Batteries; Plastic Shopping Bags; Li-Ion Batteries; Ni-MH Batteries; Ni-Zn Batteries; Small Sealed Lead Acid Batteries; Computer (Recycling); Computer Monitors; Electronics; Laptop Computers; Tablets; Video Game Consoles; PlayStation Consoles; Batteries (Rechargeable); Cell Phone Batteries; Li-Ion Batteries; Ni-Cd Batteries; Ni-MH Batteries; Small Sealed Lead Acid Batteries; Cell Phones","false","true","As an environmentally-committed retailer, Lowes offers a recycling center near store entrances to give consumers a free and easy way to properly dispose of rechargeable batteries, cell phones, CFLs and plastic shopping bags; materials that otherwise could be potentially harmful to the environment.  Look for the recycling center or ask a store associate for more details.","Call2Recycle","false","false","false","false"
"NTR Metals","","1000 Cornell Parkway #800","Oklahoma City","","OK","73108","4056052402","0","","https://elemetal.com/","35.4558889","-97.5962588","4.22094426108081","","false","false","","","false","false","false","false"
"O'Reilly Auto Parts","null","4200 North May Avenue","Oklahoma City","","OK","73112","4059423903","0","","http://oreillyauto.custhelp.com/app/error/error_id/6","35.5140513","-97.5650539","4.25780675802406","","false","false","","","false","false","false","false"
"RadioShack","RadioShack","4903 N May Ave","Oklahoma City","Oklahoma","OK","73112","4059438491","0","Monday: 10:00 AM - 9:00 PM Tuesday: 10:00 AM - 9:00 PM Wednesday: 10:00 AM - 9:00 PM Thursday: 10:00 AM - 9:00 PM Friday: 10:00 AM - 9:00 PM Saturday: 10:00 AM - 9:00 PM Sunday: 12:00 PM - 6:00 PM ","http://www.radioshack.com","35.52054","-97.56576","4.30400426022333","Ni-Cd Batteries; Batteries (Rechargeable); Computer (Recycling); Computer Monitors; Electronics; Laptop Computers; Tablets; Video Game Consoles; PlayStation Consoles","false","true","","","false","false","false","false"
"The UPS Store","The UPS Store","5030 N May Ave","Oklahoma City","Oklahoma","OK","73112","4059421677","0","Monday: 8:00 AM - 7:30 PM Tuesday: 8:00 AM - 7:30 PM Wednesday: 8:00 AM - 7:30 PM Thursday: 8:00 AM - 7:30 PM Friday: 8:00 AM - 7:30 PM Saturday: 9:00 AM - 5:00 PM ","http://www.upsstore.com","35.52127","-97.56487","4.36488504564741","Plastics (Other); Packing Peanut (Reuse); Computer (Recycling); Computer Monitors; Electronics; Laptop Computers; Tablets; Video Game Consoles; PlayStation Consoles","false","true","","","false","false","false","false"
"Home Depot","","3040 NW 59th St","Oklahoma City","","OK","73112","4058435008","0","","https://ecooptions.homedepot.com/","35.5313564","-97.5691642","4.36697974639985","Batteries (Rechargeable); Cell Phone Batteries; Li-Ion Batteries; Ni-Cd Batteries; Ni-MH Batteries; Small Sealed Lead Acid Batteries","false","true","","Call2Recycle","false","false","false","false"
"Goodwill Industries of Central Oklahoma Inc. - Dell Reconnect Donation Site","","5801 W Britton Suite B","Oklahoma City","","OK","73132","0","0","","https://www.okgoodwill.org/","35.5665946","-97.6197246","4.37221340331034","","false","false","","","false","false","false","false"
"Walgreens","Walgreens","5120 N May Ave","Oklahoma City","Oklahoma","OK","73112","4059422471","0","","http://www.walgreens.com","35.52274","-97.56515","4.37613516105503","Cell Phones; Inkjet Cartridge Refilling; Inkjet Printer Cartridges; Computer (Recycling); Computer Monitors; Electronics; Laptop Computers; Tablets; Video Game Consoles; PlayStation Consoles","false","true","","","false","false","false","false"
"Call2Recycle at Grainger","Call2Recycle at Grainger","4314 Will Rogers Pkwy","Oklahoma City","Oklahoma","OK","73108","4059439631","0","","http://www.grainger.com/","35.45215","-97.59811","4.37634000070965","Cell Phones; Ni-Cd Batteries; Li-Ion Batteries; Ni-MH Batteries; Ni-Zn Batteries; Small Sealed Lead Acid Batteries; Computer (Recycling); Computer Monitors; Electronics; Laptop Computers; Tablets; Video Game Consoles; PlayStation Consoles","false","true","The U.S. EPA estimates that more than 350 million rechargeable batteries are purchased annually in the U.S. Thanks to the environmental commitment of this location, its easy and free to recycle your batteries. Bring your rechargeable batteries to this location and look for the recycling box or ask an associate how you can do your part for the environment.","","false","false","false","false"
"Goodwill Industries of Central Oklahoma Inc. - Dell Reconnect Donation Site","","8015 Northwest Expressway","Oklahoma City","","OK","73162","4057280722","0","","https://www.okgoodwill.org/","35.5677122","-97.6577048","4.41114132320898","","false","false","","","false","false","false","false"
"Wheeler Dealer Bicycle Shop","Wheeler Dealer Bicycle Shop","2729 NW 50th Street","Oklahoma City","Oklahoma ","OK","73112","4059476260","0","","","35.5221719052229","-97.5637907352922","4.43941518782507","E-Bike Batteries","false","true","Call or Check Online for Hours","Call2Recycle","false","false","false","false"
"Target","Target","5400 N May Ave","Oklahoma City","Oklahoma","OK","73112","4059476761","0","","http://www.target.com/","35.52438","-97.56434","4.45180442222322","Aluminum Cans; Cell Phones; Inkjet Printer Cartridges; MP3 Players; Plastic #1 (PETE); Plastic #2 (HDPE); Plastic Shopping Bags; Computer (Recycling); Computer Monitors; Electronics; Laptop Computers; Tablets; Video Game Consoles; PlayStation Consoles","false","true","","","false","false","false","false"
"Call2Recycle at the Home Depot","Call2Recycle at the Home Depot","3040 NW 59th St","Oklahoma City","Oklahoma","OK","73112","4058435008","0","","http://www.homedepot.com/","35.53195","-97.56761","4.46349503820003","Cell Phones; Compact Fluorescent Lights; Ni-Cd Batteries; Li-Ion Batteries; Ni-MH Batteries; Ni-Zn Batteries; Small Sealed Lead Acid Batteries; Computer (Recycling); Computer Monitors; Electronics; Laptop Computers; Tablets; Video Game Consoles; PlayStation Consoles","false","true","The Home Depot accepts used rechargeable batteries and compact fluorescent bulbs. Look for the orange drop boxes, usually located near the front entrance near the customer service desk, or ask a store associate for more details.","","false","false","false","false"
"Best Buy","Best Buy","5801 N May Ave ","Oklahoma City","Oklahoma County","OK","73112","4058403796","0","","https://www.bestbuy.com/recycle","35.5305512","-97.5666686","4.47362127408844","Large Household Appliances; Refrigerators; Televisions; AC Power Plugs; Batteries (Rechargeable); Cables & Connectors; Car Audio/Video Equipment; Cell Phone Batteries; Cell Phones; Computer (Recycling); Hard Drives; Computer Monitors; Cameras; DVD Players/Blu-Ray Players/DVRs; Electronics; E-Readers; GPS Units; Headphones; Inkjet Printer Cartridges; Laptop Computers; Laser Toner Cartridges; Li-Ion Batteries; MP3 Players; Network Equipment; Ni-Cd Batteries; Ni-MH Batteries; Ni-Zn Batteries; Computer Peripherals; Portable Media Players; Printers/Scanners/Fax Machines; Small Electronics; Small Sealed Lead Acid Batteries; Stereo Equipment; Tablets; Telephones; UPS Batteries/Backup Systems; VCRs; Video Game Systems; Blu-Ray Players; Digital Converter Boxes; Small Televisions; Video Game Consoles; PlayStation Consoles","true","true","2 TVs per visit, 3 e-waste items per day; $25 fee for TVs and Monitors; $19.99 pick-up fee with delivery; $99.99 standalone pickup fee; ","Sony, Vizio, OEM","false","false","false","false"
"Target Store","","5400 N May Ave","Oklahoma City","","OK","73112","4059476761","0","","https://corporate.target.com/corporate-responsibility/planet","35.5242071","-97.5638263","4.47597596424557","","false","false","","","false","false","false","false"
