name,description,address,city,region,province,postal_code,phone,fax,hours,url,latitude,longitude,distance,materials,pickup,dropoff,notes,groups,curbside,municipal,national,event_only
"Firestone Complete Auto Care","","7021 N W 23 Rd St","Bethany","","OK","73008","4054959460","0","","https://www.firestonecompleteautocare.com/","35.4936622","-97.636142","0.847073816405249","","false","false","","","false","false","false","false"
"Goodwill Industries of Central Oklahoma Inc. - Dell Reconnect Donation Site","","7465 NW 23rd St","Bethany","","OK","73008","0","0","","https://www.okgoodwill.org/","35.4936993","-97.6448159","0.859060992810672","","false","false","","","false","false","false","false"
"Firestone Complete Auto Care Store","Firestone Complete Auto Care Store","7021 NW 23rd St","Bethany","Oklahoma","OK","73008","4053848061","0","","http://www.firestonecompleteautocare.com/","35.49293","-97.63527","0.909257782535104","Lead Acid (Pb) Batteries; Used Motor Oil; Computer (Recycling); Computer Monitors; Electronics; Laptop Computers; Tablets; Video Game Consoles; PlayStation Consoles","false","true","","","false","false","false","false"
"Shred Nations","Shred Nations (inside The Mail Drop)","7916 NW 23rd St","Bethany","Oklahoma","OK","73008","4058965772","0","Monday: 9:30 AM - 5:30 PM Tuesday: 9:30 AM - 5:30 PM Wednesday: 9:30 AM - 5:30 PM Thursday: 9:30 AM - 5:30 PM Friday: 9:30 AM - 5:30 PM Saturday: 10:00 AM - 1:00 PM ","http://www.shrednations.com/dropoff/location/bethany/660498e5-86bd-5173-aaec-54403c0a3554","35.49292","-97.65298","1.13439235119198","Cell Phones; Computer (Recycling); Laptop Computers; Small Televisions; Documents to Shred; Computer Monitors; Electronics; Tablets; Video Game Consoles; PlayStation Consoles","true","true","Shred Nations offers document shredding, hard drive destruction, electronics recycling and more. Visit website for quotes and full list of services offered in your area. ","","false","false","false","false"
"Walgreens","Walgreens","5901 NW 39th St","Oklahoma City","Oklahoma","OK","73122","4054958258","0","","http://www.walgreens.com","35.51176","-97.62067","1.17140549508826","Cell Phones; Inkjet Cartridge Refilling; Inkjet Printer Cartridges; Computer (Recycling); Computer Monitors; Electronics; Laptop Computers; Tablets; Video Game Consoles; PlayStation Consoles","false","true","","","false","false","false","false"
"Walmart","Walmart","6437 N. Macarthur Blvd","Oklahoma City","Oklahoma","OK","73127","4054951001","0","","http://www.walmart.com","35.49194","-97.62262","1.35558223550959","Lead Acid (Pb) Batteries; Plastic Shopping Bags; Food Storage Bags; Computer (Recycling); Computer Monitors; Electronics; Laptop Computers; Tablets; Video Game Consoles; PlayStation Consoles","false","true","","","false","false","false","false"
"PaceButler Corporation","","5915 NW 23rd St","Oklahoma City","","OK","73127","4057553131","0","","https://www.pacebutler.com/index.cfm?utm=sell old cell phones","35.4936267","-97.6204444","1.37380632320145","","false","false","","","false","false","false","false"
"Neighborhood Market by Walmart","","6000 NW 23rd St","Oklahoma City","","OK","73127","4054951001","0","","https://www.walmart.com/","35.4920069","-97.6210749","1.41659035361161","","false","false","","","false","false","false","false"
"Trashy Friends Community Organization Drop off Location","","5998 NW 49th St","Oklahoma City","","OK","73122","4054916474","0","","https://www.warracres-ok.gov","35.5210832","-97.6233569","1.42734965781267","","false","false","","","false","false","false","false"
"After Tech, Inc","After Tech, Inc","1429 N Rockwell Ave Ste A","Oklahoma City","Oklahoma","OK","73127","4056586404","0","Monday: 9:00 AM - 4:00 PM Tuesday: 9:00 AM - 4:00 PM Wednesday: 9:00 AM - 4:00 PM Thursday: 9:00 AM - 4:00 PM Friday: 9:00 AM - 4:00 PM ","http://www.aftertech.net/","35.48446","-97.63696","1.46435544058257","Computer (Recycling); Computer Monitors; DVD Players/Blu-Ray Players/DVRs; Electronics; Memory (RAM), Flash Card/Drive; Network Equipment; Computer Peripherals; Projectors; Servers; Telephones; UPS Batteries/Backup Systems; VCRs; Hard Drives; Laptop Computers; Tablets; Video Game Consoles; PlayStation Consoles","true","true","","","false","false","false","false"
"AfterTech, Inc. E-Waste Recycling","","1429 North Rockwell Avenue","Oklahoma City","","OK","73127","4056586404","0","","","35.4842302","-97.6366735","1.48208945930866","","false","false","","","false","false","false","false"
"Trashy Friends Community Organization","","5929 NW 52nd St","Oklahoma City","","OK","73122","4054916474","0","","https://www.warracres-ok.gov","35.5243695","-97.6229655","1.61842193297609","","false","false","","","false","false","false","false"
"Goodwill","Goodwill","5825 NW 50th St","Oklahoma City","Oklahoma","OK","73122","4057895458","0","Monday: 10:00 AM - 7:00 PM Tuesday: 10:00 AM - 7:00 PM Wednesday: 10:00 AM - 7:00 PM Thursday: 10:00 AM - 7:00 PM Friday: 10:00 AM - 7:00 PM Saturday: 10:00 AM - 7:00 PM Sunday: 1:00 AM - 5:00 PM ","http://www.goodwill.org","35.52238","-97.61759","1.71800804768562","Bikes; Books (Reuse); Cell Phones; Clothing; CD/DVD/Blu-ray/UHD discs; Computer (Reuse); Computer Monitors; Electronics; Gift Bags; Eyeglasses; Furniture; Household Goods; Lawn Equipment; Musical Instruments; Ornaments; Reusable Appliance Donation; Sporting Goods; Telephones; Televisions; Miscellaneous Tools; Children's Toys; Car Donation; VHS & Cassette Tapes; MP3 Players; Computer (Recycling); Laptop Computers; Tablets; Video Game Consoles; PlayStation Consoles","false","true","This site accepts gently used items.  All electronics and appliances must be in working condition.  Please call ahead to verify that this site is currently accepting the items listed.","","false","false","false","false"
"Goodwill Industries","Goodwill Industries","5845 NW 50th St","Oklahoma City","Oklahoma","OK","73122","4057895458","0","Monday: 9:00 AM - 9:00 PM Tuesday: 9:00 AM - 9:00 PM Wednesday: 9:00 AM - 9:00 PM Thursday: 9:00 AM - 9:00 PM Friday: 9:00 AM - 9:00 PM Saturday: 9:00 AM - 9:00 PM Sunday: 1:00 PM - 7:00 PM ","http://www.okgoodwill.org","35.52238","-97.61759","1.71800804768562","Books (Reuse); Clothing; Electronics; Video Game Systems; Furniture; Household Goods; Reusable Appliance Donation; Sporting Goods; Miscellaneous Tools; Children's Toys; MP3 Players; Computer (Recycling); Computer Monitors; Laptop Computers; Tablets; Video Game Consoles; PlayStation Consoles","false","true","","","false","false","false","false"
"O'Reilly Auto Parts","null","1100 North Rockwell","Oklahoma City","","OK","73127","4054910565","0","","http://oreillyauto.custhelp.com/app/error/error_id/6","35.4792918","-97.6360412","1.82505383841437","","false","false","","","false","false","false","false"
"Advance Auto Parts","Advance Auto Parts","1010 N Rockwell Ave","Oklahoma City","Oklahoma","OK","73127","4054916088","0","Monday: 7:00 AM - 9:00 PM Tuesday: 7:00 AM - 9:00 PM Wednesday: 7:00 AM - 9:00 PM Thursday: 7:00 AM - 9:00 PM Friday: 7:00 AM - 9:00 PM Saturday: 7:00 AM - 9:00 PM Sunday: 10:00 AM - 8:00 PM ","http://www.advanceautoparts.com","35.4779","-97.63657","1.91727261248741","Lead Acid (Pb) Batteries; Used Motor Oil; Computer (Recycling); Computer Monitors; Electronics; Laptop Computers; Tablets; Video Game Consoles; PlayStation Consoles","false","true","","","false","false","false","false"
"Goodwill Industries of Central Oklahoma Inc. - Dell Reconnect Donation Site","","4605 NW 23rd St Ste 200","Oklahoma City","","OK","73127","4056020326","0","","https://www.okgoodwill.org/","35.4949059","-97.6048225","2.11142595482941","","false","false","","","false","false","false","false"
"Advance Auto Parts","","4535 NW 39th St","Oklahoma City","","OK","73122","4054400690","0","","http://shop.advanceautoparts.com/webapp/wcs/stores/servlet/home___","35.5119811","-97.6021956","2.17435378076077","","false","false","","","false","false","false","false"
"O'Reilly Auto Parts","null","4500 Nw 39th St","Oklahoma City","","OK","73122","4054956120","0","","http://oreillyauto.custhelp.com/app/error/error_id/6","35.510745","-97.601529","2.19538905447181","","false","false","","","false","false","false","false"
"RadioShack","RadioShack","4557 NW 23rd St","Oklahoma City","Oklahoma","OK","73127","4059435683","0","Monday: 9:00 AM - 9:00 PM Tuesday: 9:00 AM - 9:00 PM Wednesday: 9:00 AM - 9:00 PM Thursday: 9:00 AM - 9:00 PM Friday: 9:00 AM - 9:00 PM Saturday: 9:00 AM - 9:00 PM Sunday: 12:00 PM - 6:00 PM ","http://www.radioshack.com","35.49339","-97.60306","2.24166412689234","Ni-Cd Batteries; Batteries (Rechargeable); Computer (Recycling); Computer Monitors; Electronics; Laptop Computers; Tablets; Video Game Consoles; PlayStation Consoles","false","true","","","false","false","false","false"
"Goodwill Industries of Central Oklahoma Inc. - Dell Reconnect Donation Site","","6305 N MacArthur Blvd","Oklahoma City","","OK","73122","4054707943","0","","https://www.okgoodwill.org/","35.535204","-97.61938","2.35757370779885","","false","false","","","false","false","false","false"
"Walgreens","Walgreens","6350 N MacArthur Blvd","Warr Acres","Oklahoma","OK","73122","4057288396","0","","http://www.walgreens.com","35.53518","-97.6189","2.36955009209967","Cell Phones; Inkjet Printer Cartridges; Computer (Recycling); Computer Monitors; Electronics; Laptop Computers; Tablets; Video Game Consoles; PlayStation Consoles","false","true","","","false","false","false","false"
"Taylor Foam","","370 N Rockwell Ave","Oklahoma City","","OK","73127","1405787581","0","","","35.470006","-97.634946","2.46938257018853","","false","false","","","false","false","false","false"
"US Post Office","USPS Discarded Lobby Mail Recycling Program","6421 N MacArthur Blvd ","Oklahoma City","Oklahoma County","OK","73132","0","0","","null","35.5370414","-97.6189969","2.47904406978777","Computer (Recycling); Computer Monitors; Electronics; Laptop Computers; Tablets; Video Game Consoles; PlayStation Consoles","false","true","","","false","false","false","false"
"USPS Post Office Box Lobby Recycling Program","US Post Office","6421 N MacArthur Blvd","Oklahoma City","Oklahoma","OK","73132","8002758777","0","","https://www.usps.com/","35.5371","-97.61908","2.48037997682716","Catalogs; Greeting Cards; Magazines; Paper (Mixed)","false","true","","","false","false","false","false"
"Hite Plastics","Hite Plastics","7636 NW 3rd St","Oklahoma City","Oklahoma","OK","73127","4054954483","0","Monday: 8:00 AM - 5:00 PM Tuesday: 8:00 AM - 5:00 PM Wednesday: 8:00 AM - 5:00 PM Thursday: 8:00 AM - 5:00 PM Friday: 8:00 AM - 5:00 PM ","","35.47001","-97.64679","2.4817969296432","Plastic #1 (PETE); Plastic #2 (HDPE); Plastic #2 (Color HDPE); Plastic #3 (PVC); Plastic #4 (LDPE); Plastic #5 (Polypropylene); Plastic #6 (Polystyrene); Plastic #7; Plastics (Other); Computer (Recycling); Computer Monitors; Electronics; Laptop Computers; Tablets; Video Game Consoles; PlayStation Consoles","false","true","","","false","false","false","false"
"Hite Plastics","","7636 Northwest 3rd Street","Oklahoma City","","OK","73127","4054954483","0","","","35.4697241","-97.6473091","2.50592446301681","","false","false","","","false","false","false","false"
"Recycle America","","5519 NW 4th St","Oklahoma City","","OK","73127","4059497563","0","","https://www.wm.com/us","35.470564","-97.6145564","2.80749045831013","","false","false","","","false","false","false","false"
"Waste Management Recycle America Oklahoma City","","5519 NW 4th St","Oklahoma City","","OK","73127","4059491149","0","","http://www0.wm.com/wm/services/recycling_ecycle.asp","35.470564","-97.6145564","2.80749045831013","","false","false","","","false","false","false","false"
"American Textile Recycling Service","American Textile Recycling Service","6000 NW 2nd St Ste 500","Oklahoma City","Oklahoma","OK","73127","8669009308","0","","http://www.atrscorp.com/","35.46743","-97.62163","2.82706088519557","Bags & Belts; Bras; CD/DVD/Blu-ray/UHD discs; Clothing; Denim; Household Goods; Jewelry; Purses, Handbags, & Totes; Shoes; Textiles; VHS & Cassette Tapes; Computer (Recycling); Computer Monitors; Electronics; Laptop Computers; Tablets; Video Game Consoles; PlayStation Consoles","false","true","Please only drop off items that fit inside Clothing & Shoe Recyclers and are not breakable when dropped into a bin. Please kindly observe our NO DUMPING policy and follow your city’s trash requirements. If you are unsure, kindly call our attended 24-Hour Hotline.","","false","false","false","false"
"Oklahoma City MRF","Oklahoma City MRF","5519 NW 4th St","Oklahoma City","Oklahoma","OK","73127","4059497563","4059497517","","","35.47041","-97.61416","2.82805648056629","Plastic #1 (PETE); Plastic #2 (HDPE); Plastic #2 (Color HDPE); Plastic #3 (PVC); Plastic #4 (LDPE); Plastic #5 (Polypropylene); Plastic #6 (Polystyrene); Plastic #7; Aluminum Cans; Books (Reuse); Book Recycling; Brown Paper Bags; Cardboard; Cell Phones; Glass (Clear); CD/DVD/Blu-ray/UHD discs; Computer (Reuse); Computer Monitors; Computer (Recycling); Electronics; Ferrous Metals (Steel or Iron); Hard Drives; Video Game Systems; Inkjet Cartridge Refilling; Inkjet Printer Cartridges; Paper (Mixed); Newspapers; Ni-Cd Batteries; Office Equipment; Phone books; Batteries (Rechargeable); Alkaline/Single-Use Batteries; Telephones; Televisions; Tin or Steel Cans; Laser Toner Refilling; Laser Toner Cartridges; VHS & Cassette Tapes; Office Paper; Windows; Stereo Equipment; Printers/Scanners/Fax Machines; Unused Paper; MP3 Players; Laptop Computers; Tablets; Video Game Consoles; PlayStation Consoles","false","true","","","false","false","false","false"
"AutoZone","AutoZone","4524 NW 10th","Oklahoma City","Oklahoma","OK","73127","4059425242","0","","http://www.autozone.com","35.47868","-97.60205","2.82841424302519","Lead Acid (Pb) Batteries; Used Motor Oil; Computer (Recycling); Computer Monitors; Electronics; Laptop Computers; Tablets; Video Game Consoles; PlayStation Consoles","false","true","Most AutoZone stores accept used motor oil, transmission fluid, gear oil and automotive batteries. Call to see what your local store is currently accepting.","","false","false","false","false"
"American Textile Recycling Service","","6000 Northwest 2nd Street","Oklahoma City","","OK","73127","8669009308","0","","http://atrscorp.com/","35.4674053","-97.6215084","2.83115953394061","","false","false","","","false","false","false","false"
"Walgreens","Walgreens","235 N MacArthur Blvd Ste 1000","Oklahoma City","Oklahoma","OK","73127","4057891600","0","","http://www.walgreens.com","35.46805","-97.61899","2.84574129760364","Cell Phones; Inkjet Printer Cartridges; Computer (Recycling); Computer Monitors; Electronics; Laptop Computers; Tablets; Video Game Consoles; PlayStation Consoles","false","true","","","false","false","false","false"
"Levi’s® ","Levi’s® Store","7628 W Reno Ave Ste 140","Oklahoma City","Oklahoma","OK","73127","4057878163","4057878611","","http://www.levistrauss.com/","35.46406","-97.64505","2.87746583978647","Clothing; Denim; Shoes; Computer (Recycling); Computer Monitors; Electronics; Laptop Computers; Tablets; Video Game Consoles; PlayStation Consoles","false","true","Customers may drop off no-longer-wanted clothing and shoes for recycling in the collection boxes at local Levi’s® stores and Levi’s® Outlet  stores and receive a voucher for 20% off a single regular-priced Levi’s®  item in-store.","","false","false","false","false"
"Nike Reuse-A-Shoe Drop-Off","Nike Reuse-A-Shoe Drop-Off","7654 W Reno Ave Ste 760","Oklahoma City","Oklahoma","OK","73127","4054955935","0","","http://www.nikereuseashoe.com/","35.46406","-97.64568","2.88116031711485","Shoes; Computer (Recycling); Computer Monitors; Electronics; Laptop Computers; Tablets; Video Game Consoles; PlayStation Consoles","false","true","Nike's Reuse-A-Shoe program collects old, worn-out athletic shoes for recycling, transforming them into Nike Grind, a material used in creating athletic and playground surfaces as well as select Nike products.","","false","false","false","false"
"Home Depot","","6800 W Reno Ave","Oklahoma City","","OK","73127","4057893895","0","","https://ecooptions.homedepot.com/","35.4634233","-97.6319266","2.94308512016815","Batteries (Rechargeable); Cell Phone Batteries; Li-Ion Batteries; Ni-Cd Batteries; Ni-MH Batteries; Small Sealed Lead Acid Batteries","false","true","","Call2Recycle","false","false","false","false"
"O'Reilly Auto Parts","","11 S MacArthur Blvd","Oklahoma City","","OK","73127","4057876499","0","","http://oreillyauto.custhelp.com/app/error/error_id/6","35.4657586","-97.620633","2.95507609786274","","false","false","","","false","false","false","false"
"Home Depot","Home Depot","6800 W Reno Ave","Oklahoma City","Oklahoma","OK","73127","4057893895","0","","http://www.homedepot.com","35.46297","-97.63209","2.97263452859321","Compact Fluorescent Lights; Batteries (Rechargeable); Computer (Recycling); Computer Monitors; Electronics; Laptop Computers; Tablets; Video Game Consoles; PlayStation Consoles","false","true","Home Depot accepts compact fluorescent bulbs and used power tool rechargeable batteries. Look for the orange drop boxes, usually located near the front entrance near the customer service desk.","","false","false","false","false"
"Call2Recycle at the Home Depot","Call2Recycle at the Home Depot","6800 W Reno Ave","Oklahoma City","Oklahoma","OK","73127","4057893895","0","","http://www.homedepot.com/","35.46297","-97.63209","2.97263452859321","Cell Phones; Compact Fluorescent Lights; Ni-Cd Batteries; Li-Ion Batteries; Ni-MH Batteries; Ni-Zn Batteries; Small Sealed Lead Acid Batteries; Computer (Recycling); Computer Monitors; Electronics; Laptop Computers; Tablets; Video Game Consoles; PlayStation Consoles","false","true","The Home Depot accepts used rechargeable batteries and compact fluorescent bulbs. Look for the orange drop boxes, usually located near the front entrance near the customer service desk, or ask a store associate for more details.","","false","false","false","false"
"Best Buy","Best Buy","6421 SW 3rd St ","Oklahoma City","Oklahoma County","OK","73128","4054401732","0","","https://www.bestbuy.com/recycle","35.4630499","-97.6287518","3.00119755195265","Large Household Appliances; Refrigerators; Televisions; AC Power Plugs; Batteries (Rechargeable); Cables & Connectors; Car Audio/Video Equipment; Cell Phone Batteries; Cell Phones; Computer (Recycling); Hard Drives; Computer Monitors; Cameras; DVD Players/Blu-Ray Players/DVRs; Electronics; E-Readers; GPS Units; Headphones; Inkjet Printer Cartridges; Laptop Computers; Laser Toner Cartridges; Li-Ion Batteries; MP3 Players; Network Equipment; Ni-Cd Batteries; Ni-MH Batteries; Ni-Zn Batteries; Computer Peripherals; Portable Media Players; Printers/Scanners/Fax Machines; Small Electronics; Small Sealed Lead Acid Batteries; Stereo Equipment; Tablets; Telephones; UPS Batteries/Backup Systems; VCRs; Video Game Systems; Blu-Ray Players; Digital Converter Boxes; Small Televisions; Video Game Consoles; PlayStation Consoles","true","true","2 TVs per visit, 3 e-waste items per day; $25 fee for TVs and Monitors; $19.99 pick-up fee with delivery; $99.99 standalone pickup fee; ","Sony, Vizio, OEM","false","false","false","false"
"Best Buy","","6421 SW 3rd St","Oklahoma City","","OK","73128","4054401732","0","","https://www.bestbuy.com/site/services/recycling/pcmcat149900050025.c?id=pcmcat149900050025","35.4630499","-97.6287518","3.00119755195265","","false","false","","","false","false","false","false"
"Nike Factory Store","","7654 West Reno Avenue","Oklahoma City","","OK","73127","4054955935","0","","https://www.nike.com/us/en_us/c/better-world/stories/2012/09/reuse-a-shoe","35.4619123","-97.6479396","3.04465106617016","","false","false","","","false","false","false","false"
"Hibdon Tires Plus Store","Hibdon Tires Plus Store","6625 SW 3rd St","Oklahoma City","Oklahoma","OK","73128","4054955527","0","","http://www.firestone.com","35.46207","-97.63049","3.04867666884469","Lead Acid (Pb) Batteries; Used Motor Oil; Computer (Recycling); Computer Monitors; Electronics; Laptop Computers; Tablets; Video Game Consoles; PlayStation Consoles","false","true","","","false","false","false","false"
"Tires Plus","","6625 SW 3rd St","Oklahoma City","","OK","73120","4054955527","0","","https://www.tiresplus.com/","35.462039","-97.630545","3.05024222172888","","false","false","","","false","false","false","false"
"Walmart Supercenter","","6100 W Reno Ave","Oklahoma City","","OK","73127","4054910320","0","","https://www.walmart.com/","35.4635026","-97.6226054","3.06317317643701","","false","false","","","false","false","false","false"
"Walmart Tire and Lube Express","","6100 W Reno Ave","Oklahoma City","","OK","73127","4054910320","0","","https://www.walmart.com/cp/ideas/8932632","35.4635026","-97.6226054","3.06317317643701","","false","false","","","false","false","false","false"
"Walmart Tire & Lube Express","Walmart Tire & Lube Express","6100 W Reno Ave","Oklahoma City","Oklahoma","OK","73127","4054910320","0","","http://www.walmart.com/catalog/catalog.gsp?cat=495843","35.46285","-97.62219","3.11337976110751","Lead Acid (Pb) Batteries; Used Motor Oil; Oil Filters; Computer (Recycling); Computer Monitors; Electronics; Laptop Computers; Tablets; Video Game Consoles; PlayStation Consoles","false","true","","","false","false","false","false"
"Cartridge World","","5909 Southwest 3rd Street","Oklahoma City","","OK","73128","4054919919","0","","","35.4625428","-97.6195523","3.18411392969114","","false","false","","","false","false","false","false"
"Tires Plus","","4848 NW Expwy","Oklahoma City","","OK","73132","4057213382","0","","https://www.tiresplus.com/","35.5443758","-97.6094732","3.18807689415705","","false","false","","","false","false","false","false"
"Office Depot","Office Depot","5929 SW 3rd St","Oklahoma City","Oklahoma","OK","73128","4054402905","0","Monday: 8:00 AM - 9:00 PM Tuesday: 8:00 AM - 9:00 PM Wednesday: 8:00 AM - 9:00 PM Thursday: 8:00 AM - 9:00 PM Friday: 8:00 AM - 9:00 PM Saturday: 9:00 AM - 9:00 PM Sunday: 10:00 AM - 7:00 PM ","http://www.officedepot.com/","35.46165","-97.62078","3.21779934886829","Cell Phones; Computer Monitors; Electronics; Inkjet Printer Cartridges; Ni-Cd Batteries; Office Equipment; Batteries (Rechargeable); Laser Toner Cartridges; MP3 Players; Small Televisions; Computer (Recycling); Laptop Computers; Tablets; Video Game Consoles; PlayStation Consoles","false","true","Office Depot offers electronics recycling for a small fee. Visit their Web site for more details and store locations. Recycle cell phones, PDAs, rechargeable batteries and ink and toner cartridges for FREE!","","false","false","false","false"
"Call2Recycle at Hilti","Call2Recycle at Hilti","411 N Meridian Ave","Oklahoma City","Oklahoma","OK","73107","4059179330","0","","https://www.us.hilti.com/","35.47117","-97.60119","3.22522285946475","Cell Phones; Ni-Cd Batteries; Li-Ion Batteries; Ni-MH Batteries; Ni-Zn Batteries; Small Sealed Lead Acid Batteries; Computer (Recycling); Computer Monitors; Electronics; Laptop Computers; Tablets; Video Game Consoles; PlayStation Consoles","false","true","The U.S. EPA estimates that more than 350 million rechargeable batteries are purchased annually in the U.S. Thanks to the environmental commitment of this location, its easy and free to recycle your batteries. Bring your rechargeable batteries to this location and look for the recycling box or ask an associate how you can do your part for the environment.","","false","false","false","false"
"AT&T Wireless","AT&T Wireless","500 S MacArthur Blvd","Oklahoma City","Oklahoma","OK","73128","4059420539","0","","http://www.att.com/","35.46155","-97.61747","3.2915294496696","Cell Phones; Ni-Cd Batteries; Batteries (Rechargeable); Cell Phone Batteries; Tablets; Li-Ion Batteries; Computer (Recycling); Computer Monitors; Electronics; Laptop Computers; Video Game Consoles; PlayStation Consoles","false","true","Receive an AT&T Promotion Card worth the trade-in value of your smartphone, tablet, or netbook. You can also donate the trade-in value to Cell Phones for Soldiers.","","false","false","false","false"
"Verizon Wireless","Verizon Wireless","6120 SW 3rd St","Oklahoma City","Oklahoma","OK","73128","8666444532","0","","http://www.verizonwireless.com/","35.46155","-97.61747","3.2915294496696","Cell Phones; Cell Phone Batteries; Computer (Recycling); Computer Monitors; Electronics; Laptop Computers; Tablets; Video Game Consoles; PlayStation Consoles","false","true","<A Href="https://www.trade-in.vzw.com/home.aspx">
The Verizon Wireless Trade-In Program</A> allows you to trade in your used handset or tablet in a convenient and responsible way. 
<P>
<P>
Verizon Wireless works every day to protect our environment and give our customers opportunities to do the same. <A Href="http://aboutus.vzw.com/Green_Initiative/overview.html">Click here</A> for more examples of the earth-friendly initiatives and programs Verizon Wireless is proud to offer and support.","","false","false","false","false"
"Hibdon Tires Plus Store","Hibdon Tires Plus Store","6414 NW Expressway","Oklahoma City","Oklahoma","OK","73132","4057225527","0","","http://www.firestone.com","35.5515","-97.62366","3.30827909718492","Lead Acid (Pb) Batteries; Used Motor Oil; Computer (Recycling); Computer Monitors; Electronics; Laptop Computers; Tablets; Video Game Consoles; PlayStation Consoles","false","true","","","false","false","false","false"
"AutoZone","","6444 NW Expressway","Oklahoma City","","OK","73132","4057210007","0","","https://www.autozone.com/landing/page.jsp?name=in-our-stores","35.5528925","-97.6293843","3.32813415562449","","false","false","","","false","false","false","false"
