name,description,address,city,region,province,postal_code,phone,fax,hours,url,latitude,longitude,distance,materials,pickup,dropoff,notes,groups,curbside,municipal,national,event_only
"Walmart","Walmart","401 Linwood Plz","Lindsay","Garvin","OK","73052","4057569535","0","","http://www.walmart.com","34.83788","-97.60609","0.0452786002299077","Lead Acid (Pb) Batteries; Plastic Shopping Bags; Food Storage Bags; Computer (Recycling); Computer Monitors; Electronics; Laptop Computers; Tablets; Video Game Consoles; PlayStation Consoles","false","true","","","false","false","false","false"
"Walmart","","401 Linwood Plz","Lindsay","","OK","73052","4057569535","0","","https://www.walmart.com/","34.834988","-97.5974952","0.571864648928753","","false","false","","","false","false","false","false"
"Walmart","Walmart","2015 S Green Ave","Purcell","McClain","OK","73080","4055275621","0","","http://www.walmart.com","34.99044","-97.36787","17.1432296802716","Lead Acid (Pb) Batteries; Plastic Shopping Bags; Food Storage Bags; Computer (Recycling); Computer Monitors; Electronics; Laptop Computers; Tablets; Video Game Consoles; PlayStation Consoles","false","true","","","false","false","false","false"
"AutoZone","AutoZone","1717 N Green Ave ","Purcell","McClain County","OK","73080","4055274100","0","","http://www.autozone.com","35.0316294","-97.3667168","19.0667430693036","Lead Acid (Pb) Batteries; Used Motor Oil; Computer (Recycling); Computer Monitors; Electronics; Laptop Computers; Tablets; Video Game Consoles; PlayStation Consoles","false","true","Most AutoZone stores accept used motor oil, transmission fluid, gear oil and automotive batteries. Call to see what your local store is currently accepting.","","false","false","false","false"
"United Supermarkets","","1600 N Green Ave","Purcell","","OK","73080","4055279791","0","","","35.0304886","-97.3649078","19.0850670421847","","false","false","","","false","false","false","false"
"Tractor Supply","","1620 North Green Avenue","Purcell","","OK","73080","4055273525","0","","https://www.tractorsupply.com/","35.0313547","-97.364739","19.1335709292163","","false","false","","","false","false","false","false"
"Tractor Supply","Tractor Supply","1620 N Green Ave","Purcell","McClain","OK","73080","4055273252","0","","http://www.tractorsupply.com","35.03892","-97.36997","19.2941803167707","Transmission Fluid; Used Motor Oil; Computer (Recycling); Computer Monitors; Electronics; Laptop Computers; Tablets; Video Game Consoles; PlayStation Consoles","false","true","","","false","false","false","false"
"City of Pauls Valley Recycling Drop-off Location","","1802 Enterprise","Pauls Valley","","OK","73075","4052383773","0","","","34.744316","-97.2438823","21.5886575714784","","false","false","","","false","false","false","false"
"Walmart Supercenter","","2001 S 1st St","Chickasha","","OK","73018","4052241867","0","","https://www.walmart.com/","35.0307713","-97.9310267","22.6781944469286","","false","false","","","false","false","false","false"
"Walmart Tire and Lube Express","","2001 S 1st St","Chickasha","","OK","73018","4052241867","0","","https://www.walmart.com/cp/ideas/8932632","35.0307713","-97.9310267","22.6781944469286","","false","false","","","false","false","false","false"
"Staples","","2318 South 4th Street","Chickasha","","OK","73018","4052240376","0","","https://www.staples.com/sbd/cre/marketing/sustainability-center/recycling-services/","35.0265611","-97.9365586","22.7655116945578","","false","false","","","false","false","false","false"
"Walmart","Walmart","2001 S 1st St","Chickasha","Grady","OK","73018","4052241867","0","","http://www.walmart.com","35.03255","-97.93249","22.8173087614123","Lead Acid (Pb) Batteries; Plastic Shopping Bags; Food Storage Bags; Computer (Recycling); Computer Monitors; Electronics; Laptop Computers; Tablets; Video Game Consoles; PlayStation Consoles","false","true","","","false","false","false","false"
"Garvin County Household Hazardous Waste Event","","","Pauls Valley","","OK","73075","4052383308","0","","","34.7400809","-97.2222451","22.8482391311904","","false","false","","","false","false","false","false"
"Goodwill","Goodwill","1902 S 4th St","Chickasha","Grady","OK","73018","4052226496","0","Monday: 9:00 AM - 7:00 PM Tuesday: 9:00 AM - 7:00 PM Wednesday: 9:00 AM - 7:00 PM Thursday: 9:00 AM - 7:00 PM Friday: 9:00 AM - 7:00 PM Saturday: 9:00 AM - 7:00 PM Sunday: 9:00 AM - 6:00 PM ","http://www.goodwill.org","35.03092","-97.93503","22.8681659158198","Bikes; Books (Reuse); Cell Phones; Clothing; CD/DVD/Blu-ray/UHD discs; Computer (Reuse); Computer Monitors; Computer (Recycling); Electronics; Gift Bags; Eyeglasses; Furniture; Household Goods; Lawn Equipment; Bed Mattresses; Musical Instruments; Ornaments; Reusable Appliance Donation; Sporting Goods; Telephones; Televisions; Miscellaneous Tools; Children's Toys; Car Donation; VHS & Cassette Tapes; MP3 Players; Laptop Computers; Tablets; Video Game Consoles; PlayStation Consoles","false","true","This site accepts gently used items.  All electronics and appliances must be in working condition.  Please call ahead to verify that this site is currently accepting the items listed.","","false","false","false","false"
"Goodwill Industries of Southwest Oklahoma and North Texas - Dell Reconnect Donation Site","","1902 South 4th Street","Chickasha","","OK","73018","4052226496","0","","https://www.goodwillsont.org/","35.0309043","-97.936048","22.9144374680586","","false","false","","","false","false","false","false"
"AT&T Wireless","AT&T Wireless","1828 S 4th St","Chickasha","Grady","OK","73018","4052220300","0","","http://www.att.com/","35.03219","-97.93502","22.9187942744776","Cell Phones; Ni-Cd Batteries; Batteries (Rechargeable); Cell Phone Batteries; Tablets; Li-Ion Batteries; Computer (Recycling); Computer Monitors; Electronics; Laptop Computers; Video Game Consoles; PlayStation Consoles","false","true","Receive an AT&T Promotion Card worth the trade-in value of your smartphone, tablet, or netbook. You can also donate the trade-in value to Cell Phones for Soldiers.","","false","false","false","false"
"Verizon Wireless","Verizon Wireless","1625 S 4th St Ste B","Chickasha","Grady","OK","73018","4052223232","4052220212","","http://www.verizonwireless.com/","35.03325","-97.93484","22.9533515694609","Cell Phones; Cell Phone Batteries; Computer (Recycling); Computer Monitors; Electronics; Laptop Computers; Tablets; Video Game Consoles; PlayStation Consoles","false","true","<A Href="https://www.trade-in.vzw.com/home.aspx">
The Verizon Wireless Trade-In Program</A> allows you to trade in your used handset or tablet in a convenient and responsible way. 
<P>
<P>
Verizon Wireless works every day to protect our environment and give our customers opportunities to do the same. <A Href="http://aboutus.vzw.com/Green_Initiative/overview.html">Click here</A> for more examples of the earth-friendly initiatives and programs Verizon Wireless is proud to offer and support.","","false","false","false","false"
"Harry Thompson, Inc.","Harry Thompson, Inc.","101 E Paul Ave # 103","Pauls Valley","Garvin","OK","73075","4052383334","0","","http://www.radioshack.com/","34.74081","-97.21976","22.9680381623051","Cell Phones; Ni-Cd Batteries; Li-Ion Batteries; Ni-MH Batteries; Ni-Zn Batteries; Small Sealed Lead Acid Batteries; Computer (Recycling); Computer Monitors; Electronics; Laptop Computers; Tablets; Video Game Consoles; PlayStation Consoles","false","true","The U.S. EPA estimates that more than 350 million rechargeable batteries are purchased annually in the U.S. Thanks to the environmental commitment of this location, its easy and free to recycle your batteries. Bring your rechargeable batteries to this location and look for the recycling box or ask an associate how you can do your part for the environment.","","false","false","false","false"
"M.R. Metals","","200 S Walnut St","Pauls Valley","","OK","73075","4052383202","0","","","34.7388069","-97.2203521","22.977146025519","","false","false","","","false","false","false","false"
"O'Reilly Auto Parts","null","1520 South 4th Street","Chickasha","","OK","73018","4052241072","0","","http://oreillyauto.custhelp.com/app/error/error_id/6","35.0342613","-97.9358352","23.0399235001084","","false","false","","","false","false","false","false"
"O'Reilly Auto Parts","O'Reilly Auto Parts","1520 S 4th St","Chickasha","Grady","OK","73018","4052241072","0","Monday: 8:00 AM - 9:00 PM Tuesday: 8:00 AM - 9:00 PM Wednesday: 8:00 AM - 9:00 PM Thursday: 8:00 AM - 9:00 PM Friday: 8:00 AM - 9:00 PM Saturday: 8:00 AM - 8:00 PM Sunday: 9:00 AM - 6:00 PM ","http://www.oreillyauto.com/","35.03487","-97.93551","23.0497401299228","Lead Acid (Pb) Batteries; Used Motor Oil; Computer (Recycling); Computer Monitors; Electronics; Laptop Computers; Tablets; Video Game Consoles; PlayStation Consoles","false","true","Most stores offer Used Oil & Battery Recycling, Battery Testing, 
Electrical & Module Testing, Loaner Tool Program, Drum / Rotor Resurfacing. Call your location for more details.","","false","false","false","false"
"AutoZone","null","627 W Grand Ave","Chickasha","","OK","73018","4052222200","0","","https://www.autozone.com/landing/page.jsp?name=in-our-stores","35.0286094","-97.9418356","23.0915222070886","","false","false","","","false","false","false","false"
"City of Chickasha Recycling Drop-off Location","","1528 Country Club Dr","Chickasha","","OK","73018","4052220109","0","","http://www.chickasha.org","35.0223771","-97.9574873","23.5910323282446","","false","false","","","false","false","false","false"
"City of Chickasha Recycling Drop-off Location","","101 N 6th St","Chickasha","","OK","73018","4052220109","0","","http://www.chickasha.org","35.0515084","-97.9400907","23.9480721953418","","false","false","","","false","false","false","false"
"Washita Pipe & Steel Inc.","Washita Pipe & Steel Inc.","115 Frisco Avenue","Chickasha","Grady","OK","73018","4052247120","0","","null","35.0584191","-97.934339","23.9915099239344","Aerosol Spray Cans; Aluminum Cans; Aluminum; Car; Lead Acid (Pb) Batteries; Ferrous Metals (Steel or Iron); Large Household Appliances; Clothes Hangers (Metal); Non-ferrous (Copper/Brass/Tin); Propane Tanks; Tin or Steel Cans; Computer (Recycling); Computer Monitors; Electronics; Laptop Computers; Tablets; Video Game Consoles; PlayStation Consoles","false","true","This site only accepts aerosol cans and propane tanks that have been punctured, please call for details.  Appliances that contain freon are not accepted.","","false","false","false","false"
"Salvation Army","Salvation Army","802 W Chickasha Ave","Chickasha","Grady","OK","73018","4052245646","0","Monday: 9:00 AM - 3:00 PM Tuesday: 9:00 AM - 3:00 PM Wednesday: 9:00 AM - 3:00 PM Thursday: 9:00 AM - 3:00 PM Friday: 9:00 AM - 3:00 PM Saturday: 10:00 AM - 3:00 PM ","http://www.salvationarmy.org","35.05123","-97.94291","24.062373147334","Bikes; Books (Reuse); Cell Phones; Clothing; CD/DVD/Blu-ray/UHD discs; Computer (Reuse); Computer Monitors; Electronics; Gift Bags; Eyeglasses; Furniture; Household Goods; Lawn Equipment; Musical Instruments; Ornaments; Reusable Appliance Donation; Sporting Goods; Telephones; Televisions; Miscellaneous Tools; Children's Toys; Car Donation; VHS & Cassette Tapes; Small Appliances; MP3 Players; Computer (Recycling); Laptop Computers; Tablets; Video Game Consoles; PlayStation Consoles","false","true","All appliances and electronics must be in working condition.","Sony","false","false","false","false"
"Newcastle Fire Station 2","Newcastle Fire Station 2 Recycling Center","4305 SE 44th St ","Norman","McClain County","OK","73072","0","0","","http://www.cityofnewcastleok.com/sant.recycle.asp","35.182319","-97.524691","24.2260785572945","Aluminum Cans; Cardboard; Newspapers; Paper (Mixed); Phone books; Plastic #1 (PETE); Plastic #2 (HDPE); Tin or Steel Cans","false","true","","","false","false","false","false"
"O'Reilly Auto Parts","null","627 North Main Street","Noble","","OK","73068","4058728493","0","","http://oreillyauto.custhelp.com/app/error/error_id/6","35.1483993","-97.3954309","24.5456221362584","","false","false","","","false","false","false","false"
"City of Norman Compost Facility","","398 Bratcher Miner Rd","Norman","","OK","73072","4053291023","0","","http://www.normanok.gov/utilities/sa/sanitation-compost-facility","35.1736364","-97.4456686","24.9057291854148","","false","false","","","false","false","false","false"
"Four D Corp","Four D Corp","900 McCurdy Rd","Duncan","Stephens","OK","73533","5802558473","0","","","34.56517","-97.89428","24.9486299230984","Rubber; Computer (Recycling); Computer Monitors; Electronics; Laptop Computers; Tablets; Video Game Consoles; PlayStation Consoles","false","true","","","false","false","false","false"
"City of Norman Transfer Station","City of Norman Transfer Station","3901 Chautauqua Ave ","Norman","Cleveland County","OK","73069","4052929776","0","Monday: 7:15 AM - 4:30 PM Tuesday: 7:15 AM - 4:30 PM Wednesday: 7:15 AM - 4:30 PM Thursday: 7:15 AM - 4:30 PM Friday: 7:15 AM - 4:30 PM Saturday: 8:00 AM - 2:00 PM ","http://www.ci.norman.ok.us/utilities/sa/sanitation-transfer-station","35.1770474","-97.4502122","25.0329449357992","Antifreeze; Cooking Oil; Used Motor Oil; Used Oil Filters; Used Tires","false","true","","","false","false","false","false"
"Norman Transfer Station","","3901 S Chautauqua Ave","Norman","","OK","73072","4052929776","0","","http://www.normanok.gov","35.176024","-97.4469353","25.0332650461954","","false","false","","","false","false","false","false"
"Goodwill Industries of Central Oklahoma Inc. - Dell Reconnect Donation Site","","751 Canadian Trails","Norman","","OK","73072","4053103819","0","","https://www.okgoodwill.org/","35.1811279","-97.4517738","25.2659142659717","","false","false","","","false","false","false","false"
"City of Norman","null","2900 Jenkins Ave ","Norman","Cleveland County","OK","73072","4052929731","0","","http://www.normanok.gov/utilities/es/environmental-services-household-hazardous","35.1871701","-97.4414374","25.8635119621917","Computer (Recycling); Computer Monitors; Electronics; Laptop Computers; Tablets; Video Game Consoles; PlayStation Consoles","false","true","Municipal Residents Only","Sony, Vizio, OEM, OEM Indiv, OEM Municipal sites","false","false","false","false"
"Goodwill Industries of Central Oklahoma Inc. - Dell Reconnect Donation Site","","3048 Classen Dr","Norman","","OK","73071","0","0","","https://www.okgoodwill.org/","35.1813805","-97.4175346","26.0181050597071","","false","false","","","false","false","false","false"
"O'Reilly Auto Parts","O'Reilly Auto Parts","2113 W Lindsey St","Norman","Cleveland","OK","73069","4055730669","0","Monday: 8:00 AM - 6:00 PM Tuesday: 8:00 AM - 6:00 PM Wednesday: 8:00 AM - 6:00 PM Thursday: 8:00 AM - 6:00 PM Friday: 8:00 AM - 6:00 PM Saturday: 8:00 AM - 5:00 PM ","http://www.oreillyauto.com/","35.20399","-97.47473","26.3551280366931","Lead Acid (Pb) Batteries; Transmission Fluid; Used Motor Oil; Computer (Recycling); Computer Monitors; Electronics; Laptop Computers; Tablets; Video Game Consoles; PlayStation Consoles","false","true","Most stores offer Used Oil & Battery Recycling, Battery Testing, 
Electrical & Module Testing, Loaner Tool Program, Drum / Rotor Resurfacing. Call your location for more details.","","false","false","false","false"
"Four D Corp","","900 McCurdy Road","Duncan","","OK","73533","5802558473","0","","","34.5861854","-97.9565135","26.41224778068","","false","false","","","false","false","false","false"
"O'Reilly Auto Parts","null","2113 West Lindsey Street","Norman","","OK","73069","4055730669","0","","http://oreillyauto.custhelp.com/app/error/error_id/6","35.2044186","-97.4728871","26.4132421324926","","false","false","","","false","false","false","false"
"City of Norman Recycling Drop-Off Center - Hollywood Shopping Center","","W Lindsey St & McGee Dr","Norman","","OK","73069","4053291023","0","","http://www.normanok.gov","35.2039173","-97.467801","26.4641597125311","","false","false","","","false","false","false","false"
"Salvation Army","Salvation Army","1742 W Lindsey St","Norman","Cleveland","OK","73069","4053640126","0","Monday: 10:00 AM - 5:50 PM Tuesday: 10:00 AM - 5:50 PM Wednesday: 10:00 AM - 5:50 PM Thursday: 10:00 AM - 5:50 PM Friday: 10:00 AM - 5:50 PM ","http://www.salvationarmy.org","35.20381","-97.46708","26.4692379469413","Bikes; Books (Reuse); Cell Phones; Clothing; CD/DVD/Blu-ray/UHD discs; Computer (Reuse); Computer Monitors; Computer (Recycling); Electronics; Gift Bags; Eyeglasses; Furniture; Household Goods; Lawn Equipment; Musical Instruments; Office Furniture; Ornaments; Reusable Appliance Donation; Sporting Goods; Telephones; Televisions; Miscellaneous Tools; Children's Toys; Car Donation; VHS & Cassette Tapes; Small Appliances; MP3 Players; Laptop Computers; Tablets; Video Game Consoles; PlayStation Consoles","false","true","All appliances and electronics must be in working condition.","Sony","false","false","false","false"
"Home Depot","","850 Ed Noble Pkwy","Norman","","OK","73072","4055797700","0","","https://ecooptions.homedepot.com/","35.2080948","-97.4838991","26.4862575961645","Batteries (Rechargeable); Cell Phone Batteries; Li-Ion Batteries; Ni-Cd Batteries; Ni-MH Batteries; Small Sealed Lead Acid Batteries","false","true","","Call2Recycle","false","false","false","false"
"Call2Recycle at the Home Depot","Call2Recycle at the Home Depot","850 Ed Noble Pkwy","Norman","Cleveland","OK","73072","4055797700","0","","http://www.homedepot.com/","35.20821","-97.48234","26.5172247891265","Cell Phones; Compact Fluorescent Lights; Ni-Cd Batteries; Li-Ion Batteries; Ni-MH Batteries; Ni-Zn Batteries; Small Sealed Lead Acid Batteries; Computer (Recycling); Computer Monitors; Electronics; Laptop Computers; Tablets; Video Game Consoles; PlayStation Consoles","false","true","The Home Depot accepts used rechargeable batteries and compact fluorescent bulbs. Look for the orange drop boxes, usually located near the front entrance near the customer service desk, or ask a store associate for more details.","","false","false","false","false"
"Goodwill Industries of Central Oklahoma Inc. - Dell Reconnect Donation Site","","1404 W Lindsey Ave","Norman","","OK","73069","0","0","","https://www.okgoodwill.org/","35.2035337","-97.4623192","26.5327747113207","","false","false","","","false","false","false","false"
"OfficeMax","OfficeMax","620 Ed Noble Pkwy","Norman","Cleveland","OK","73072","4055732049","0","Monday: 8:00 AM - 9:00 PM Tuesday: 8:00 AM - 9:00 PM Wednesday: 8:00 AM - 9:00 PM Thursday: 8:00 AM - 9:00 PM Friday: 8:00 AM - 9:00 PM Saturday: 9:00 AM - 9:00 PM Sunday: 11:00 AM - 7:00 PM ","http://www.officedepot.com/index.do","35.2112","-97.48417","26.6893070267391","Inkjet Cartridge Refilling; Inkjet Printer Cartridges; Laser Toner Cartridges; Computer (Recycling); Computer Monitors; Electronics; Laptop Computers; Tablets; Video Game Consoles; PlayStation Consoles","false","true","This location features Phoenix Ink refill kiosks.","","false","false","false","false"
"Sams Club","","3400 W Main St","Norman","","OK","73072","4053078374","0","","https://www.samsclub.com/","35.2164146","-97.4931033","26.9120473979239","","false","false","","","false","false","false","false"
"Sprint Store","","133 Ed Noble Pkwy","Norman","","OK","73072","4055792807","0","","https://newsroom.sprint.com/csr/device-donations/","35.2174367","-97.48792","27.0520247943818","","false","false","","","false","false","false","false"
"Sooner Mall 1","Sooner Mall 1","3301 W Main St","Norman","Cleveland","OK","73072","8583244111","0","","http://www.ecoatm.com/","35.21808","-97.49058","27.0581081881908","Cell Phones; Tablets; MP3 Players; Computer (Recycling); Computer Monitors; Electronics; Laptop Computers; Video Game Consoles; PlayStation Consoles","false","true","ecoATM is an automated, consumer self-serve kiosk that quickly buys back and recycles old phones, mp3 players and tablets.
</br>
Call or email <a href="mailto:max@ecoATM.com">customer support</a> with questions.","","false","false","false","false"
"The UPS Store","The UPS Store","3334 W Main St","Norman","Cleveland","OK","73072","4053641109","0","Monday: 8:00 AM - 6:35 PM Tuesday: 8:00 AM - 6:35 PM Wednesday: 8:00 AM - 6:35 PM Thursday: 8:00 AM - 6:35 PM Friday: 8:00 AM - 6:35 PM Saturday: 9:00 AM - 2:00 PM ","http://www.upsstore.com","35.21823","-97.4913","27.0582938485791","Plastics (Other); Packing Peanut (Reuse); Computer (Recycling); Computer Monitors; Electronics; Laptop Computers; Tablets; Video Game Consoles; PlayStation Consoles","false","true","","","false","false","false","false"
"Shred Nations","Shred Nations (inside The UPS Store)","3334 W Main St","Norman","Cleveland","OK","73072","4058965772","0","Monday: 8:00 AM - 6:30 PM Tuesday: 8:00 AM - 6:30 PM Wednesday: 8:00 AM - 6:30 PM Thursday: 8:00 AM - 6:30 PM Friday: 8:00 AM - 6:30 PM Saturday: 9:00 AM - 4:00 PM ","http://www.shrednations.com/dropoff/location/norman/510d341f-8fe4-ed50-f75b-545007a0fb6f","35.21823","-97.4913","27.0582938485791","Cell Phones; Computer (Recycling); Laptop Computers; Small Televisions; Documents to Shred; Computer Monitors; Electronics; Tablets; Video Game Consoles; PlayStation Consoles","true","true","Shred Nations offers document shredding, hard drive destruction, electronics recycling and more. Visit website for quotes and full list of services offered in your area. ","","false","false","false","false"
"US Post Office","US Post Office","200 36th Ave NW","Norman","Cleveland","OK","73072","0","0","","https://www.usps.com/ship/recycle-through-usps.htm","35.21961","-97.49421","27.1116617880157","Inkjet Printer Cartridges; Computer (Recycling); Computer Monitors; Electronics; Laptop Computers; Tablets; Video Game Consoles; PlayStation Consoles","false","true","Free, postage-paid Mail Back envelopes can be found on display in the lobby. There is no limit to the number of envelopes customers may take. The contents of the envelope must weigh less than 13 ounces and the envelope must be able to seal completely. For more details visit<a href="http://www.maxback.com/mxb-postoffice-collaboration" target="_blank">MaxBack</a>.","","false","false","false","false"
"Goodwill Industries of Central Oklahoma Inc. - Dell Reconnect Donation Site","","2101 North Classen","Norman","","OK","73072","4057012459","0","","https://www.okgoodwill.org/","35.203535","-97.430549","27.1406184467611","","false","false","","","false","false","false","false"
"Goodwill","Goodwill","2101 Classen Blvd","Norman","Cleveland","OK","73071","4057930696","0","Monday: 10:00 AM - 7:00 PM Tuesday: 10:00 AM - 7:00 PM Wednesday: 10:00 AM - 7:00 PM Thursday: 10:00 AM - 7:00 PM Friday: 10:00 AM - 7:00 PM Saturday: 10:00 AM - 7:00 PM Sunday: 1:00 AM - 5:00 PM ","http://www.goodwill.org","35.20388","-97.43128","27.1476235636198","Bikes; Books (Reuse); Cell Phones; Clothing; CD/DVD/Blu-ray/UHD discs; Computer (Reuse); Computer Monitors; Electronics; Gift Bags; Eyeglasses; Furniture; Household Goods; Lawn Equipment; Bed Mattresses; Musical Instruments; Ornaments; Reusable Appliance Donation; Sporting Goods; Telephones; Televisions; Miscellaneous Tools; Children's Toys; Car Donation; VHS & Cassette Tapes; MP3 Players; Computer (Recycling); Laptop Computers; Tablets; Video Game Consoles; PlayStation Consoles","false","true","This site accepts gently used items.  All electronics and appliances must be in working condition.  Please call ahead to verify that this site is currently accepting the items listed.","","false","false","false","false"
"Goodwill Industries of Central Oklahoma Inc. - Dell Reconnect Donation Site","","2430 W Main Norman","Norman","","OK","73069","4057011680","0","","https://www.okgoodwill.org/","35.2174577","-97.478045","27.1977056216203","","false","false","","","false","false","false","false"
"Walmart Tire & Lube Express","Walmart Tire & Lube Express","3300 Tri City Dr","Newcastle","McClain","OK","73065","4053873400","0","","http://www.walmart.com/catalog/catalog.gsp?cat=495843","35.23261","-97.62231","27.2650864941468","Lead Acid (Pb) Batteries; Used Motor Oil; Oil Filters; Computer (Recycling); Computer Monitors; Electronics; Laptop Computers; Tablets; Video Game Consoles; PlayStation Consoles","false","true","","","false","false","false","false"
"Tires Plus","","221 N Interstate Dr","Norman","","OK","73069","4053603220","0","","https://www.tiresplus.com/","35.2196409","-97.4830013","27.2696762418219","","false","false","","","false","false","false","false"
"City of Norman Recycling Drop-Off Center - Hobby Lobby","","24th Ave NW & W Main St","Norman","","OK","73069","4053291023","0","","http://www.normanok.gov","35.2183478","-97.4766073","27.2788000914973","","false","false","","","false","false","false","false"
"Batteries Plus Bulbs","","2401 West Main St.","Norman","","OK","73069","4054557587","0","","https://www.batteriesplus.com/store-locator/ok/871?utm_source=local&utm_medium=earth911","35.21897","-97.4771462","27.3119821489425","","false","false","","","false","false","false","false"
"AT&T Wireless","AT&T Wireless","2351 W Main","Norman","Cleveland","OK","73069","4054471111","0","","http://www.att.com/","35.2186","-97.47535","27.3148552569361","Cell Phones; Ni-Cd Batteries; Batteries (Rechargeable); Cell Phone Batteries; Tablets; Li-Ion Batteries; Computer (Recycling); Computer Monitors; Electronics; Laptop Computers; Video Game Consoles; PlayStation Consoles","false","true","Receive an AT&T Promotion Card worth the trade-in value of your smartphone, tablet, or netbook. You can also donate the trade-in value to Cell Phones for Soldiers.","","false","false","false","false"
