name,description,address,city,region,province,postal_code,phone,fax,hours,url,latitude,longitude,distance,materials,pickup,dropoff,notes,groups,curbside,municipal,national,event_only
"Shred Nations","Shred Nations (inside PostNet Norman)","133 24th Ave NW","Norman","Cleveland","OK","73069","4055626415","0","Monday: 9:00 AM - 6:30 PM Tuesday: 9:00 AM - 6:30 PM Wednesday: 9:00 AM - 6:30 PM Thursday: 9:00 AM - 6:30 PM Friday: 9:00 AM - 6:30 PM Saturday: 9:00 AM - 2:00 PM ","http://www.shrednations.com/dropoff/location/norman/21e80fe3-199f-33ff-c4b8-54402c98383c","35.21888","-97.47655","27.3150737222801","Cell Phones; Computer (Recycling); Laptop Computers; Small Televisions; Documents to Shred; Computer Monitors; Electronics; Tablets; Video Game Consoles; PlayStation Consoles","true","true","Shred Nations offers document shredding, hard drive destruction, electronics recycling and more. Visit website for quotes and full list of services offered in your area. ","","false","false","false","false"
"Phat Tire Bike Shop - Norman","Phat Tire Bike Shop - Norman","2264 W. Main Street","Norman","Cleveland ","OK","73069","4058579055","0","","","35.2185970454545","-97.4749604545454","27.3206673668985","E-Bike Batteries","false","true","Call or Check Online for Hours","Call2Recycle","false","false","false","false"
"Goodwill Industries","Goodwill Industries","1317 E Lindsey St","Norman","Cleveland","OK","73071","4053210551","0","","http://www.okgoodwill.org","35.20392","-97.421","27.3683011562275","Books (Reuse); Clothing; Electronics; Video Game Systems; Furniture; Household Goods; Reusable Appliance Donation; Sporting Goods; Miscellaneous Tools; Children's Toys; MP3 Players; Computer (Recycling); Computer Monitors; Laptop Computers; Tablets; Video Game Consoles; PlayStation Consoles","false","true","","","false","false","false","false"
"AutoZone","AutoZone","2020 W Main St","Norman","Cleveland","OK","73069","4053602000","0","","http://www.autozone.com","35.21833","-97.47058","27.3716625560523","Lead Acid (Pb) Batteries; Used Motor Oil; Computer (Recycling); Computer Monitors; Electronics; Laptop Computers; Tablets; Video Game Consoles; PlayStation Consoles","false","true","Most AutoZone stores accept used motor oil, transmission fluid, gear oil and automotive batteries. Call to see what your local store is currently accepting.","","false","false","false","false"
"Walmart Supercenter","","333 N Interstate Dr","Norman","","OK","73069","4053294000","0","","https://www.walmart.com/","35.2213742","-97.4817545","27.4035354469252","","false","false","","","false","false","false","false"
"Walmart Tire and Lube Express","","333 N Interstate Dr","Norman","","OK","73069","4053294000","0","","https://www.walmart.com/cp/ideas/8932632","35.2213742","-97.4817545","27.4035354469252","","false","false","","","false","false","false","false"
"USPS Post Office Box Lobby Recycling Program","US Post Office","57 Church St","Ratliff City","Carter","OK","73481","8002758777","0","","https://www.usps.com/","34.44817","-97.5163","27.4325935275614","Catalogs; Greeting Cards; Magazines; Paper (Mixed)","false","true","","","false","false","false","false"
"Best Buy","Best Buy","400 26th Ave NW ","Norman","Cleveland County","OK","73069","4055739613","0","","https://www.bestbuy.com/recycle","35.2226166","-97.4828834","27.4700904389402","Large Household Appliances; Refrigerators; Televisions; AC Power Plugs; Batteries (Rechargeable); Cables & Connectors; Car Audio/Video Equipment; Cell Phone Batteries; Cell Phones; Computer (Recycling); Hard Drives; Computer Monitors; Cameras; DVD Players/Blu-Ray Players/DVRs; Electronics; E-Readers; GPS Units; Headphones; Inkjet Printer Cartridges; Laptop Computers; Laser Toner Cartridges; Li-Ion Batteries; MP3 Players; Network Equipment; Ni-Cd Batteries; Ni-MH Batteries; Ni-Zn Batteries; Computer Peripherals; Portable Media Players; Printers/Scanners/Fax Machines; Small Electronics; Small Sealed Lead Acid Batteries; Stereo Equipment; Tablets; Telephones; UPS Batteries/Backup Systems; VCRs; Video Game Systems; Blu-Ray Players; Digital Converter Boxes; Small Televisions; Video Game Consoles; PlayStation Consoles","true","true","2 TVs per visit, 3 e-waste items per day; $25 fee for TVs and Monitors; $19.99 pick-up fee with delivery; $99.99 standalone pickup fee; ","Sony, Vizio, OEM","false","false","false","false"
"Best Buy","","400 26Th Ave Nw","Norman","","OK","73069","4055739613","0","","https://www.bestbuy.com/site/services/recycling/pcmcat149900050025.c?id=pcmcat149900050025","35.2226166","-97.4828834","27.4700904389402","","false","false","","","false","false","false","false"
"Call2Recycle at Lowe's","Call2Recycle at Lowe's","2555 Hemphill Dr","Norman","Cleveland","OK","73069","4053292009","0","Monday: 6:00 AM - 10:00 PM Tuesday: 6:00 AM - 10:00 PM Wednesday: 6:00 AM - 10:00 PM Thursday: 6:00 AM - 10:00 PM Friday: 6:00 AM - 10:00 PM Saturday: 6:00 AM - 10:00 PM Sunday: 8:00 AM - 8:00 PM ","http://www.lowes.com/","35.22319","-97.47951","27.5576440106324","Cell Phones; Compact Fluorescent Lights; Ni-Cd Batteries; Plastic Shopping Bags; Li-Ion Batteries; Ni-MH Batteries; Ni-Zn Batteries; Small Sealed Lead Acid Batteries; Computer (Recycling); Computer Monitors; Electronics; Laptop Computers; Tablets; Video Game Consoles; PlayStation Consoles","false","true","As an environmentally-committed retailer, Lowes offers a recycling center near store entrances to give consumers a free and easy way to properly dispose of rechargeable batteries, cell phones, CFLs and plastic shopping bags; materials that otherwise could be potentially harmful to the environment.  Look for the recycling center or ask a store associate for more details.","","false","false","false","false"
"Post Net","","1108 W Main St","Norman","","OK","73069","4053645005","0","","https://www.postnet.com/","35.2181401","-97.4584826","27.5596897034549","","false","false","","","false","false","false","false"
"Lowe's","","2555 Hemphill Dr","Norman","","OK","73069","4053292009","0","","https://newsroom.lowes.com/responsibility/operational-excellence/","35.2238157","-97.4816156","27.5685258481212","Batteries (Rechargeable); Cell Phone Batteries; Li-Ion Batteries; Ni-Cd Batteries; Ni-MH Batteries; Small Sealed Lead Acid Batteries; Cell Phones","false","true","","Call2Recycle","false","false","false","false"
"Tires Plus","","501 Interstate Dr","Norman","","OK","73069","4052927718","0","","https://www.tiresplus.com/","35.224531","-97.484545","27.5742486437047","","false","false","","","false","false","false","false"
"Hibdon Tires Plus Store","Hibdon Tires Plus Store","221 N Interstate Dr","Norman","Cleveland","OK","73069","4053603220","0","","http://www.firestone.com","35.22449","-97.47963","27.6425675983571","Lead Acid (Pb) Batteries; Used Motor Oil; Computer (Recycling); Computer Monitors; Electronics; Laptop Computers; Tablets; Video Game Consoles; PlayStation Consoles","false","true","","","false","false","false","false"
"RadioShack","RadioShack","740 W Main St","Norman","Cleveland","OK","73069","4053215524","0","Monday: 9:00 AM - 9:00 PM Tuesday: 9:00 AM - 9:00 PM Wednesday: 9:00 AM - 9:00 PM Thursday: 9:00 AM - 9:00 PM Friday: 9:00 AM - 9:00 PM Saturday: 9:00 AM - 9:00 PM Sunday: 11:00 AM - 7:00 PM ","http://www.radioshack.com","35.2183","-97.454","27.6484505220301","Ni-Cd Batteries; Batteries (Rechargeable); Computer (Recycling); Computer Monitors; Electronics; Laptop Computers; Tablets; Video Game Consoles; PlayStation Consoles","false","true","","","false","false","false","false"
"Firestone Complete Auto Care","","566 W Main St","Norman","","OK","73069","4053216431","0","","https://www.firestonecompleteautocare.com/","35.2177494","-97.4512774","27.6609386048642","","false","false","","","false","false","false","false"
"Walgreens","Walgreens","615 W Main St","Norman","Cleveland","OK","73069","4055735019","0","","http://www.walgreens.com","35.21846","-97.45177","27.6986388537434","Cell Phones; Inkjet Cartridge Refilling; Inkjet Printer Cartridges; Computer (Recycling); Computer Monitors; Electronics; Laptop Computers; Tablets; Video Game Consoles; PlayStation Consoles","false","true","","","false","false","false","false"
"Walmart","Walmart","601 12th Ave NE","Norman","Cleveland","OK","73071","4055795203","0","","http://www.walmart.com","35.21056","-97.42351","27.7388597080069","Lead Acid (Pb) Batteries; Plastic Shopping Bags; Food Storage Bags; Computer (Recycling); Computer Monitors; Electronics; Laptop Computers; Tablets; Video Game Consoles; PlayStation Consoles","false","true","","","false","false","false","false"
"Walmart Tire & Lube Express","Walmart Tire & Lube Express","601 12th Ave NE","Norman","Cleveland","OK","73071","4055795203","0","","http://www.walmart.com/catalog/catalog.gsp?cat=495843","35.21056","-97.42351","27.7388597080069","Lead Acid (Pb) Batteries; Used Motor Oil; Oil Filters; Computer (Recycling); Computer Monitors; Electronics; Laptop Computers; Tablets; Video Game Consoles; PlayStation Consoles","false","true","","","false","false","false","false"
"Cartridge World","Cartridge World","621 12th Ave NE Ste 110","Norman","Cleveland","OK","73071","4053079130","0","","","35.21056","-97.42351","27.7388597080069","Inkjet Cartridge Refilling; Inkjet Printer Cartridges; Laser Toner Refilling; Laser Toner Cartridges; Computer (Recycling); Computer Monitors; Electronics; Laptop Computers; Tablets; Video Game Consoles; PlayStation Consoles","false","true","","","false","false","false","false"
"Verizon Wireless","Verizon Wireless","1644 24th Ave NW Ste 104","Norman","Cleveland","OK","73069","4053608912","4053601890","","http://www.verizonwireless.com/","35.22583","-97.47759","27.7621159140025","Cell Phones; Cell Phone Batteries; Computer (Recycling); Computer Monitors; Electronics; Laptop Computers; Tablets; Video Game Consoles; PlayStation Consoles","false","true","<A Href="https://www.trade-in.vzw.com/home.aspx">
The Verizon Wireless Trade-In Program</A> allows you to trade in your used handset or tablet in a convenient and responsible way. 
<P>
<P>
Verizon Wireless works every day to protect our environment and give our customers opportunities to do the same. <A Href="http://aboutus.vzw.com/Green_Initiative/overview.html">Click here</A> for more examples of the earth-friendly initiatives and programs Verizon Wireless is proud to offer and support.","","false","false","false","false"
"Copelin's Office Center","Copelin's Office Center","425 W Main St","Norman","Cleveland","OK","73069","4053647011","0","Sunday: 12:00 AM - 11:59 PM Monday: 12:00 AM - 11:59 PM Tuesday: 12:00 AM - 11:59 PM Wednesday: 12:00 AM - 11:59 PM Thursday: 12:00 AM - 11:59 PM Friday: 12:00 AM - 11:59 PM Saturday: 12:00 AM - 11:59 PM ","","35.21886","-97.44846","27.7846561160798","Newspapers; Computer (Recycling); Computer Monitors; Electronics; Laptop Computers; Tablets; Video Game Consoles; PlayStation Consoles","false","true","There is a drop-off bin located behind this building.","","false","false","false","false"
"Walgreens","Walgreens","700 24th Ave NW ","Norman","Cleveland County","OK","73069","4053662288","0","","http://www.walgreens.com","35.226794","-97.4784198","27.8140681202094","Cell Phones; Inkjet Printer Cartridges; Computer (Recycling); Computer Monitors; Electronics; Laptop Computers; Tablets; Video Game Consoles; PlayStation Consoles","false","true","","","false","false","false","false"
"Interstate All Battery Center","Interstate All Battery Center","1065 36th Ave NW","Norman","Cleveland","OK","73072","8663552288","0","Monday: 7:00 AM - 7:00 PM Tuesday: 7:00 AM - 7:00 PM Wednesday: 7:00 AM - 7:00 PM Thursday: 7:00 AM - 7:00 PM Friday: 7:00 AM - 7:00 PM Saturday: 8:00 AM - 3:00 PM ","http://www.interstatebatteries.com","35.23114","-97.49433","27.8849473164456","Lead Acid (Pb) Batteries; Ni-Cd Batteries; Batteries (Rechargeable); Alkaline/Single-Use Batteries; Computer (Recycling); Computer Monitors; Electronics; Laptop Computers; Tablets; Video Game Consoles; PlayStation Consoles","false","true","","","false","false","false","false"
"Call2Recycle at Interstate All Battery Center","Call2Recycle at Interstate All Battery Center","1065 36th Ave NW","Norman","Cleveland","OK","73072","4057011313","0","","http://www.interstatebatteries.com","35.23114","-97.49433","27.8849473164456","Cell Phones; Ni-Cd Batteries; Li-Ion Batteries; Ni-MH Batteries; Ni-Zn Batteries; Small Sealed Lead Acid Batteries; Computer (Recycling); Computer Monitors; Electronics; Laptop Computers; Tablets; Video Game Consoles; PlayStation Consoles","false","true","The U.S. EPA estimates that more than 350 million rechargeable batteries are purchased annually in the U.S. Thanks to the environmental commitment of this location, its easy and free to recycle your batteries. Bring your rechargeable batteries to this location and look for the recycling box or ask an associate how you can do your part for the environment.","","false","false","false","false"
"USPS Post Office Box Lobby Recycling Program","US Post Office","129 W Gray St","Norman","Cleveland","OK","73069","8002758777","0","","https://www.usps.com/","35.22151","-97.44502","28.020945556952","Catalogs; Greeting Cards; Magazines; Paper (Mixed)","false","true","","","false","false","false","false"
"US Post Office","US Post Office","129 W Gray St","Norman","Cleveland","OK","73069","0","0","","https://www.usps.com/ship/recycle-through-usps.htm","35.22151","-97.44502","28.020945556952","Inkjet Printer Cartridges; Computer (Recycling); Computer Monitors; Electronics; Laptop Computers; Tablets; Video Game Consoles; PlayStation Consoles","false","true","Free, postage-paid Mail Back envelopes can be found on display in the lobby. There is no limit to the number of envelopes customers may take. The contents of the envelope must weigh less than 13 ounces and the envelope must be able to seal completely. For more details visit<a href="http://www.maxback.com/mxb-postoffice-collaboration" target="_blank">MaxBack</a>.","","false","false","false","false"
"AT&T Wireless","AT&T Wireless","1444 - 24th Ave Nw, Space 105","Norman","Cleveland","OK","73069","4055737935","0","","http://www.att.com/","35.23143","-97.4818","28.074555979118","Cell Phones; Ni-Cd Batteries; Batteries (Rechargeable); Cell Phone Batteries; Tablets; Li-Ion Batteries; Computer (Recycling); Computer Monitors; Electronics; Laptop Computers; Video Game Consoles; PlayStation Consoles","false","true","Receive an AT&T Promotion Card worth the trade-in value of your smartphone, tablet, or netbook. You can also donate the trade-in value to Cell Phones for Soldiers.","","false","false","false","false"
"Target","Target","1400 24th Ave NW","Norman","Cleveland","OK","73069","4052533003","0","","http://www.target.com/","35.23143","-97.4818","28.074555979118","Aluminum Cans; Cell Phones; Inkjet Printer Cartridges; MP3 Players; Plastic #1 (PETE); Plastic #2 (HDPE); Plastic Shopping Bags; Computer (Recycling); Computer Monitors; Electronics; Laptop Computers; Tablets; Video Game Consoles; PlayStation Consoles","false","true","","","false","false","false","false"
"Firestone Complete Auto Care","","1250 NW 36th Ave","Norman","","OK","73069","4053603363","0","","https://www.firestonecompleteautocare.com/","35.2340975","-97.494815","28.0777006926058","","false","false","","","false","false","false","false"
"City of Norman Public Works Facility","","201 W Gray St","Norman","","OK","73069","4052929731","0","","http://www.normanok.gov","35.22299","-97.4461038","28.0976847969211","","false","false","","","false","false","false","false"
"Walmart","Walmart","333 N Interstate Dr","Norman","Cleveland","OK","73069","4053294000","0","","http://www.walmart.com","35.23254","-97.48306","28.1309467266209","Lead Acid (Pb) Batteries; Plastic Shopping Bags; Food Storage Bags; Computer (Recycling); Computer Monitors; Electronics; Laptop Computers; Tablets; Video Game Consoles; PlayStation Consoles","false","true","","","false","false","false","false"
"Hibdon Tires Plus Store","Hibdon Tires Plus Store","501 N Interstate Dr","Norman","Cleveland","OK","73069","4052927718","0","","http://www.firestone.com","35.23279","-97.48268","28.1530272153532","Lead Acid (Pb) Batteries; Used Motor Oil; Computer (Recycling); Computer Monitors; Electronics; Laptop Computers; Tablets; Video Game Consoles; PlayStation Consoles","false","true","","","false","false","false","false"
"Goodwill Industries of Central Oklahoma Inc. - Dell Reconnect Donation Site","","151 12th Avenue Southeast","Norman","","OK","73071","4053214800","0","","https://www.okgoodwill.org/","35.2172562","-97.4222732","28.1941626533295","","false","false","","","false","false","false","false"
"Goodwill Industries of Central Oklahoma Inc. - Dell Reconnect Donation Site","","1204 North Interstate Drive Suite 100","Norman","","OK","73072","4057011660","0","","https://www.okgoodwill.org/","35.2344971","-97.4864004","28.2157003609888","","false","false","","","false","false","false","false"
"Goodwill Industries of Central Oklahoma Inc. - Dell Reconnect Donation Site","","201 N Porter Ave","Norman","","OK","73071","0","0","","https://www.okgoodwill.org/","35.2239891","-97.43972","28.2816366566915","","false","false","","","false","false","false","false"
"Alameda Express Lube","Alameda Express Lube","1300 Alameda St","Norman","Cleveland","OK","73071","4053645050","0","Monday: 8:00 AM - 6:00 PM Tuesday: 8:00 AM - 6:00 PM Wednesday: 8:00 AM - 6:00 PM Thursday: 8:00 AM - 6:00 PM Friday: 8:00 AM - 6:00 PM Saturday: 8:00 AM - 5:00 PM ","","35.21828","-97.42098","28.2869664099694","Used Motor Oil; Computer (Recycling); Computer Monitors; Electronics; Laptop Computers; Tablets; Video Game Consoles; PlayStation Consoles","false","true","","","false","false","false","false"
"O'Reilly Auto Parts","null","131 12th Avenue Northeast","Norman","","OK","73071","4053217981","0","","http://oreillyauto.custhelp.com/app/error/error_id/6","35.2193184","-97.4229795","28.3118112235098","","false","false","","","false","false","false","false"
"Target Store","","1400 24th Ave NW","Norman","","OK","73069","4052533003","0","","https://corporate.target.com/corporate-responsibility/planet","35.2363971","-97.483164","28.3876382993979","","false","false","","","false","false","false","false"
"Battery Center","Battery Center","606 N Porter Ave","Norman","Cleveland","OK","73071","4053210309","0","","http://www.call2recycle.org/","35.22711","-97.44101","28.4607588402264","Cell Phones; Ni-Cd Batteries; Li-Ion Batteries; Ni-MH Batteries; Ni-Zn Batteries; Small Sealed Lead Acid Batteries; Computer (Recycling); Computer Monitors; Electronics; Laptop Computers; Tablets; Video Game Consoles; PlayStation Consoles","false","true","The U.S. EPA estimates that more than 350 million rechargeable batteries are purchased annually in the U.S. Thanks to the environmental commitment of this location, its easy and free to recycle your batteries. Bring your rechargeable batteries to this location and look for the recycling box or ask an associate how you can do your part for the environment.","","false","false","false","false"
"USPS Post Office Box Lobby Recycling Program","US Post Office","220 N Wright St","Newcastle","McClain","OK","73065","8002758777","0","","https://www.usps.com/","35.25481","-97.59732","28.789751306682","Catalogs; Greeting Cards; Magazines; Paper (Mixed)","false","true","","","false","false","false","false"
"Walmart Supercenter","","601 12th Ave NE","Norman","","OK","73071","4055795203","0","","https://www.walmart.com/","35.2260761","-97.4208152","28.7909372130243","","false","false","","","false","false","false","false"
