name,description,address,city,region,province,postal_code,phone,fax,hours,url,latitude,longitude,distance,materials,pickup,dropoff,notes,groups,curbside,municipal,national,event_only
"Walmart Supercenter","","4469 Washington Rd","Evans","","GA","30809","7068549892","0","","https://www.walmart.com/","33.5458447","-82.142294","0.0957327163814137","","false","false","","","false","false","false","false"
"Walmart","Walmart","4469 Washington Rd","Evans","Columbia","GA","30809","7068549892","0","","http://www.walmart.com","33.54563","-82.14486","0.166244722761668","Lead Acid (Pb) Batteries; Plastic Shopping Bags; Food Storage Bags; Video Game Consoles; PlayStation Consoles","false","true","","","false","false","false","false"
"Walmart Tire & Lube Express","Walmart Tire & Lube Express","4469 Washington Rd","Evans","Columbia","GA","30809","7068549892","0","","http://www.walmart.com/catalog/catalog.gsp?cat=495843","33.54563","-82.14486","0.166244722761668","Lead Acid (Pb) Batteries; Used Motor Oil; Oil Filters; Video Game Consoles; PlayStation Consoles","false","true","","","false","false","false","false"
"Batteries Plus","Batteries Plus","4431 Washington Rd Ste 2","Evans","Columbia","GA","30809","7063643215","7063643265","","http://www.batteriesplus.com/store_details/473.aspx","33.54421","-82.14123","0.222214500230731","Compact Fluorescent Lights; Batteries (Rechargeable); Alkaline/Single-Use Batteries; Video Game Consoles; PlayStation Consoles","false","true","Some fees for battery recycling may apply.  Please contact your Local store for details. 
<p>
Batteries Plus lead by example by recycling the majority of the batteries we sell. Not only do we recycle to protect our environment, we support retail and business customers alike by keeping them in full compliance with federal, state, municipal, EPA and DOT regulations governing the disposal and recycling of spent batteries and select electronics.","","false","false","false","false"
"Batteries Plus Bulbs","null","4431 Washington Rd Suite 2","Evans","","GA","30809","7063643215","0","","https://www.batteriesplus.com/store-locator/ga/473?utm_source=local&utm_medium=earth911","33.5439789","-82.139616","0.283263601234392","","false","false","","","false","false","false","false"
"USPS Post Office Box Lobby Recycling Program","US Post Office","607 Ronald Reagan Dr","Evans","Columbia","GA","30809","8002758777","0","","https://www.usps.com/","33.54238","-82.13569","0.521611473609681","Catalogs; Greeting Cards; Magazines; Paper (Mixed)","false","true","","","false","false","false","false"
"US Post Office","US Post Office","607 Ronald Reagan Dr","Evans","Columbia","GA","30809","0","0","","https://www.usps.com/ship/recycle-through-usps.htm","33.54238","-82.13569","0.521611473609681","Inkjet Printer Cartridges; Video Game Consoles; PlayStation Consoles","false","true","Free, postage-paid Mail Back envelopes can be found on display in the lobby. There is no limit to the number of envelopes customers may take. The contents of the envelope must weigh less than 13 ounces and the envelope must be able to seal completely. For more details visit<a href="http://www.maxback.com/mxb-postoffice-collaboration" target="_blank">MaxBack</a>.","","false","false","false","false"
"Tires Plus","","4359 Washington Rd","Augusta","","GA","30809","7062108010","0","","https://www.tiresplus.com/","33.5417647","-82.13236","0.702152445547803","","false","false","","","false","false","false","false"
"Cartridge World","Cartridge World","4357 Washington Rd","Evans","Columbia","GA","30809","7064341587","0","Monday: 9:00 AM - 6:00 PM Tuesday: 9:00 AM - 6:00 PM Wednesday: 9:00 AM - 6:00 PM Thursday: 9:00 AM - 6:00 PM Friday: 9:00 AM - 6:00 PM Saturday: 9:00 AM - 3:00 PM ","http://www.cartridgeworldusa.com","33.54017","-82.13236","0.766705038137662","Inkjet Cartridge Refilling; Inkjet Printer Cartridges; Laser Toner Refilling; Laser Toner Cartridges; Video Game Consoles; PlayStation Consoles","false","true","For more information, please call 1-888-99-REFILL.","","false","false","false","false"
"Tires Plus Store","Tires Plus Store","4359 Washington Rd","Evans","Columbia","GA","30809","7063030800","0","Monday: 7:00 AM - 7:00 PM Tuesday: 7:00 AM - 7:00 PM Wednesday: 7:00 AM - 7:00 PM Thursday: 7:00 AM - 7:00 PM Friday: 7:00 AM - 7:00 PM Saturday: 7:00 AM - 5:00 PM Sunday: 9:00 AM - 4:00 PM ","http://www.firestone.com","33.53903","-82.13077","0.887450851524584","Lead Acid (Pb) Batteries; Used Motor Oil; Video Game Consoles; PlayStation Consoles","false","true","","","false","false","false","false"
"Call2Recycle at Lowe's","Call2Recycle at Lowe's","4305 Washington Rd","Evans","Columbia","GA","30809","7068684112","0","Monday: 6:00 AM - 10:00 PM Tuesday: 6:00 AM - 10:00 PM Wednesday: 6:00 AM - 10:00 PM Thursday: 6:00 AM - 10:00 PM Friday: 6:00 AM - 10:00 PM Saturday: 6:00 AM - 10:00 PM Sunday: 8:00 AM - 8:00 PM ","http://www.lowes.com/","33.53903","-82.13077","0.887450851524584","Cell Phones; Compact Fluorescent Lights; Ni-Cd Batteries; Plastic Shopping Bags; Li-Ion Batteries; Ni-MH Batteries; Ni-Zn Batteries; Small Sealed Lead Acid Batteries; Video Game Consoles; PlayStation Consoles","false","true","As an environmentally-committed retailer, Lowes offers a recycling center near store entrances to give consumers a free and easy way to properly dispose of rechargeable batteries, cell phones, CFLs and plastic shopping bags; materials that otherwise could be potentially harmful to the environment.  Look for the recycling center or ask a store associate for more details.","","false","false","false","false"
"Home Depot","","520 N Belair Rd","Evans","","GA","30809","7068547832","0","","https://ecooptions.homedepot.com/","33.5365007","-82.1320914","0.957500720265062","Batteries (Rechargeable); Cell Phone Batteries; Li-Ion Batteries; Ni-Cd Batteries; Ni-MH Batteries; Small Sealed Lead Acid Batteries","false","true","","Call2Recycle","false","false","false","false"
"Verizon Wireless","Verizon Wireless","4312 Washington Rd","Evans","Columbia","GA","30809","8666444532","0","","http://www.verizonwireless.com/","33.53725","-82.12857","1.06352601304622","Cell Phones; Cell Phone Batteries; Video Game Consoles; PlayStation Consoles","false","true","<A Href="https://www.trade-in.vzw.com/home.aspx">
The Verizon Wireless Trade-In Program</A> allows you to trade in your used handset or tablet in a convenient and responsible way. 
<P>
<P>
Verizon Wireless works every day to protect our environment and give our customers opportunities to do the same. <A Href="http://aboutus.vzw.com/Green_Initiative/overview.html">Click here</A> for more examples of the earth-friendly initiatives and programs Verizon Wireless is proud to offer and support.","","false","false","false","false"
"Home Depot","Home Depot","520 N Belair Rd","Evans","Columbia","GA","30809","7068547832","0","","http://www.homedepot.com","33.53562","-82.1294","1.10599490265897","Compact Fluorescent Lights; Batteries (Rechargeable); Video Game Consoles; PlayStation Consoles","false","true","Home Depot accepts compact fluorescent bulbs and used power tool rechargeable batteries. Look for the orange drop boxes, usually located near the front entrance near the customer service desk.","","false","false","false","false"
"Call2Recycle at the Home Depot","Call2Recycle at the Home Depot","520 N Belair Rd","Evans","Columbia","GA","30809","7068547832","0","","http://www.homedepot.com/","33.53562","-82.1294","1.10599490265897","Cell Phones; Compact Fluorescent Lights; Ni-Cd Batteries; Li-Ion Batteries; Ni-MH Batteries; Ni-Zn Batteries; Small Sealed Lead Acid Batteries; Video Game Consoles; PlayStation Consoles","false","true","The Home Depot accepts used rechargeable batteries and compact fluorescent bulbs. Look for the orange drop boxes, usually located near the front entrance near the customer service desk, or ask a store associate for more details.","","false","false","false","false"
"Lowe's","","4305 Washington Rd","Evans","","GA","30809","7068684112","0","","https://newsroom.lowes.com/responsibility/operational-excellence/","33.5373392","-82.1261393","1.17025628695889","Batteries (Rechargeable); Cell Phone Batteries; Li-Ion Batteries; Ni-Cd Batteries; Ni-MH Batteries; Small Sealed Lead Acid Batteries; Cell Phones","false","true","","Call2Recycle","false","false","false","false"
"Publix","","4274 Washington Road","Evans","","GA","30809","7066505040","0","","https://sustainability.publix.com/storefront/customer-recycling/","33.5334367","-82.1276699","1.28429716472193","","false","false","","","false","false","false","false"
"Keep America Beautiful Cars to Donate","","","Evans","","GA","30809","8554262474","0","","https://www.kab.org/?pagename=car_donation","33.5593454","-82.1604849","1.32559813710194","","false","false","","","false","false","false","false"
"Target","Target","4223 Washington Rd","Evans","Columbia","GA","30809","7062108591","0","","http://www.target.com/","33.53165","-82.12441","1.50294769788359","Aluminum Cans; Cell Phones; Inkjet Printer Cartridges; MP3 Players; Plastic #1 (PETE); Plastic #2 (HDPE); Plastic Shopping Bags; Video Game Consoles; PlayStation Consoles","false","true","","","false","false","false","false"
"Kohl's","","4227 Washington Road","Evans","","GA","30809","7062101771","0","","https://corporate.kohls.com/","33.5283515","-82.1188259","1.89207840883485","","false","false","","","false","false","false","false"
"AT&T Wireless","AT&T Wireless","4239 Washington Rd","Evans","Columbia","GA","30809","7066503122","0","","http://www.att.com/","33.52638","-82.12099","1.90434571558889","Cell Phones; Ni-Cd Batteries; Batteries (Rechargeable); Cell Phone Batteries; Tablets; Li-Ion Batteries; Video Game Consoles; PlayStation Consoles","false","true","Receive an AT&T Promotion Card worth the trade-in value of your smartphone, tablet, or netbook. You can also donate the trade-in value to Cell Phones for Soldiers.","","false","false","false","false"
"Target Store","","4223 Washington Rd","Evans","","GA","30809","7062108591","0","","https://corporate.target.com/corporate-responsibility/planet","33.5258359","-82.1201965","1.96271687752837","","false","false","","","false","false","false","false"
"OfficeMax","","4221 Washington Rd","Evans","","GA","30809","7066510134","0","","","33.5264441","-82.1175503","2.03656996430983","","false","false","","","false","false","false","false"
"Advance Auto Parts","Advance Auto Parts","4483 Columbia Rd","Martinez","Columbia","GA","30907","7068639371","0","Monday: 7:30 AM - 10:00 PM Tuesday: 7:30 AM - 10:00 PM Wednesday: 7:30 AM - 10:00 PM Thursday: 7:30 AM - 10:00 PM Friday: 7:30 AM - 10:00 PM Saturday: 7:30 AM - 10:00 PM Sunday: 9:00 AM - 8:00 PM ","http://www.advanceautoparts.com","33.50761","-82.14194","2.73524815616902","Lead Acid (Pb) Batteries; Used Motor Oil; Video Game Consoles; PlayStation Consoles","false","true","","","false","false","false","false"
"AutoZone","AutoZone","4482 Columbia Rd","Augusta","Columbia","GA","30907","7068605949","0","Monday: 7:30 AM - 9:00 PM Tuesday: 7:30 AM - 9:00 PM Wednesday: 7:30 AM - 9:00 PM Thursday: 7:30 AM - 9:00 PM Friday: 7:30 AM - 9:00 PM Saturday: 7:30 AM - 9:00 PM Sunday: 9:00 AM - 9:00 PM ","http://www.autozone.com","33.50743","-82.14186","2.74775698297024","Lead Acid (Pb) Batteries; Used Motor Oil; Video Game Consoles; PlayStation Consoles","false","true","Most AutoZone stores accept used motor oil, transmission fluid, gear oil and automotive batteries. Call to see what your local store is currently accepting.","","false","false","false","false"
"Walgreens","Walgreens","4470 Columbia Rd","Augusta","Columbia","GA","30907","7062284627","0","","http://www.walgreens.com","33.50734","-82.14377","2.75431466467363","Cell Phones; Inkjet Cartridge Refilling; Inkjet Printer Cartridges; Video Game Consoles; PlayStation Consoles","false","true","","","false","false","false","false"
"Advance Auto Parts","Advance Auto Parts","4018 Washington Rd","Martinez","Columbia","GA","30907","7068685157","0","Monday: 7:30 AM - 9:00 PM Tuesday: 7:30 AM - 9:00 PM Wednesday: 7:30 AM - 9:00 PM Thursday: 7:30 AM - 9:00 PM Friday: 7:30 AM - 9:00 PM Saturday: 7:30 AM - 9:00 PM Sunday: 9:00 AM - 8:00 PM ","http://www.advanceautoparts.com","33.51463","-82.10988","2.93730377823873","Lead Acid (Pb) Batteries; Used Motor Oil; Video Game Consoles; PlayStation Consoles","false","true","","","false","false","false","false"
"Walgreens","Walgreens","672 Furys Ferry Rd","Augusta","Columbia","GA","30907","7062107505","0","","http://www.walgreens.com","33.54846","-82.08895","3.09433024427265","Cell Phones; Inkjet Printer Cartridges; Video Game Consoles; PlayStation Consoles","false","true","","","false","false","false","false"
"The UPS Store","The UPS Store","4115 Columbia Rd Ste 5","Martinez","Columbia","GA","30907","7066502535","0","Monday: 8:30 AM - 6:30 PM Tuesday: 8:30 AM - 6:30 PM Wednesday: 8:30 AM - 6:30 PM Thursday: 8:30 AM - 6:30 PM Friday: 8:30 AM - 6:30 PM Saturday: 9:00 AM - 5:00 PM ","null","33.50823","-82.10695","3.38807648595923","Packing Materials; Packing Peanut (Reuse); Video Game Consoles; PlayStation Consoles","false","true","This site is located in the Kroger Shopping Center.","","false","false","false","false"
"Publix","","5119 Washington Road","Evans","","GA","30809","7066501460","0","","https://sustainability.publix.com/storefront/customer-recycling/","33.5735106","-82.1933697","3.43901506629539","","false","false","","","false","false","false","false"
"USPS Post Office Box Lobby Recycling Program","US Post Office","125 Commercial Blvd","Augusta","Columbia","GA","30907","8002758777","0","","https://www.usps.com/","33.51512","-82.09319","3.60978973256645","Catalogs; Greeting Cards; Magazines; Paper (Mixed)","false","true","","","false","false","false","false"
"US Post Office","US Post Office","125 Commercial Blvd","Augusta","Columbia","GA","30907","0","0","","https://www.usps.com/ship/recycle-through-usps.htm","33.51512","-82.09319","3.60978973256645","Inkjet Printer Cartridges; Video Game Consoles; PlayStation Consoles","false","true","Free, postage-paid Mail Back envelopes can be found on display in the lobby. There is no limit to the number of envelopes customers may take. The contents of the envelope must weigh less than 13 ounces and the envelope must be able to seal completely. For more details visit<a href="http://www.maxback.com/mxb-postoffice-collaboration" target="_blank">MaxBack</a>.","","false","false","false","false"
"Walgreens","Walgreens","3900 Washington Rd","Augusta","Columbia","GA","30907","7068688084","0","","http://www.walgreens.com","33.51068","-82.09434","3.75654254457798","Cell Phones; Inkjet Cartridge Refilling; Inkjet Printer Cartridges; Video Game Consoles; PlayStation Consoles","false","true","","","false","false","false","false"
"Tires Plus Store","Tires Plus Store","3849 Washington Rd","Martinez","Columbia","GA","30907","7068606303","0","Monday: 7:00 AM - 7:00 PM Tuesday: 7:00 AM - 7:00 PM Wednesday: 7:00 AM - 7:00 PM Thursday: 7:00 AM - 7:00 PM Friday: 7:00 AM - 7:00 PM Saturday: 7:00 AM - 5:00 PM Sunday: 9:00 AM - 4:00 PM ","http://www.firestone.com","33.51114","-82.09363","3.76583655356487","Lead Acid (Pb) Batteries; Used Motor Oil; Video Game Consoles; PlayStation Consoles","false","true","","","false","false","false","false"
"O'Reilly Auto Parts","null","3874 Washington Road","Martinez","","GA","30907","7068699763","0","","http://oreillyauto.custhelp.com/app/error/error_id/6","33.5103704","-82.0939465","3.78770348207107","","false","false","","","false","false","false","false"
"Tires Plus","","3849 Washington Rd","Martinez","","GA","30907","7068606303","0","","https://www.tiresplus.com/","33.511866","-82.092171","3.7968102549845","","false","false","","","false","false","false","false"
"Call2Recycle at RadioShack","Call2Recycle at RadioShack","3830 Washington Rd Ste 9","Augusta","Columbia","GA","30907","7068637400","0","","http://www.radioshack.com/","33.51278","-82.08689","3.99661995881757","Cell Phones; Ni-Cd Batteries; Li-Ion Batteries; Ni-MH Batteries; Ni-Zn Batteries; Small Sealed Lead Acid Batteries; Video Game Consoles; PlayStation Consoles","false","true","As the first national retailer to partner with Call2Recycle, RadioShack is at the forefront of the rechargeable battery recycling cause and is pleased to offer battery recycling at thousands of convenient RadioShack locations for free.  Simply drop them off at your local RadioShack and theyll take care of the rest.  Ask a store associate for more details.","","false","false","false","false"
"Lowe's","","224 Bobby Jones Expy","Augusta","","GA","30907","7066518600","0","","https://newsroom.lowes.com/responsibility/operational-excellence/","33.5076468","-82.0913547","4.02490850498244","Batteries (Rechargeable); Cell Phone Batteries; Li-Ion Batteries; Ni-Cd Batteries; Ni-MH Batteries; Small Sealed Lead Acid Batteries; Cell Phones","false","true","","Call2Recycle","false","false","false","false"
"USPS Post Office Box Lobby Recycling Program","US Post Office","200 John Deere Pkwy","Grovetown","Columbia","GA","30813","8002758777","0","","https://www.usps.com/","33.49156","-82.16554","4.06334233761788","Catalogs; Greeting Cards; Magazines; Paper (Mixed)","false","true","","","false","false","false","false"
"US Post Office","USPS Discarded Lobby Mail Recycling Program","200 John Deere Pkwy","Grovetown","Columbia","GA","30813","0","0","","","33.49156","-82.16554","4.06334233761788","Video Game Consoles; PlayStation Consoles","false","true","","","false","false","false","false"
"Publix","","403 Furys Ferry Road","Martinez","","GA","30907","7066503360","0","","https://sustainability.publix.com/storefront/customer-recycling/","33.5303768","-82.072973","4.17831222899921","","false","false","","","false","false","false","false"
"Dancing Dog Yoga","Dancing Dog Yoga","412 Vaughn Rd Ste 2","Augusta","Columbia","GA","30907","0","0","","http://www.dancingdogsyoga.com/","33.52886","-82.07195","4.26491033150127","Yoga Mats; Video Game Consoles; PlayStation Consoles","false","true","","","false","false","false","false"
"Walmart","Walmart","260 Bobby Jones Expy ","Augusta","Columbia County","GA","30907","7068600170","0","","http://www.walmart.com","33.5049514","-82.0861959","4.37001531242626","Lead Acid (Pb) Batteries; Plastic Shopping Bags; Food Storage Bags; Video Game Consoles; PlayStation Consoles","false","true","","","false","false","false","false"
"Walmart Tire and Lube Express","","260 Bobby Jones Expy","Augusta","","GA","30907","7068600170","0","","https://www.walmart.com/cp/ideas/8932632","33.5048606","-82.0859917","4.38296103536336","","false","false","","","false","false","false","false"
"Walmart Supercenter","","260 Bobby Jones Expy","Augusta","","GA","30907","7068600170","0","","https://www.walmart.com/","33.5048606","-82.0859917","4.38296103536336","","false","false","","","false","false","false","false"
"Tractor Supply","null","270 Bobby Jones Expy STE 190","Augusta","","GA","30907","7068549088","0","","https://www.tractorsupply.com/","33.5048606","-82.0859917","4.38296103536336","","false","false","","","false","false","false","false"
"Home Depot","","499 Bobby Jones Expy","Augusta","","GA","30907","7066507662","0","","https://ecooptions.homedepot.com/","33.5009469","-82.0900756","4.40288038333678","Batteries (Rechargeable); Cell Phone Batteries; Li-Ion Batteries; Ni-Cd Batteries; Ni-MH Batteries; Small Sealed Lead Acid Batteries","false","true","","Call2Recycle","false","false","false","false"
"Sams Club","","596 Bobby Jones Expy","Augusta","","GA","30907","7068637846","0","","https://www.samsclub.com/","33.5038387","-82.0863321","4.41597743922771","","false","false","","","false","false","false","false"
"Tractor Supply","Tractor Supply","270 Bobby Jones Expy STE 190","Augusta","Richmond","GA","30907","7068549088","0","Monday: 8:00 AM - 8:00 PM Tuesday: 8:00 AM - 8:00 PM Wednesday: 8:00 AM - 8:00 PM Thursday: 8:00 AM - 8:00 PM Friday: 8:00 AM - 8:00 PM Saturday: 8:00 AM - 8:00 PM Sunday: 9:00 AM - 7:00 PM ","http://www.tractorsupply.com","33.50168","-82.08844","4.43212733790423","Transmission Fluid; Used Motor Oil; Video Game Consoles; PlayStation Consoles","false","true","","","false","false","false","false"
"Sam's Club","Sam's Club","596 Bobby Jones Expy","Augusta","Richmond","GA","30907","7068637846","0","Monday: 10:00 AM - 8:30 PM Tuesday: 10:00 AM - 8:30 PM Wednesday: 10:00 AM - 8:30 PM Thursday: 10:00 AM - 8:30 PM Friday: 10:00 AM - 8:30 PM Saturday: 9:00 AM - 8:30 PM Sunday: 10:00 AM - 6:00 PM ","http://www.samsclub.com","33.50168","-82.08844","4.43212733790423","Lead Acid (Pb) Batteries; Video Game Consoles; PlayStation Consoles","false","true","","","false","false","false","false"
"Cartridge World","Cartridge World","592 Bobby Jones Expy","Augusta","Richmond","GA","30907","7062286000","0","Monday: 9:00 AM - 6:00 PM Tuesday: 9:00 AM - 6:00 PM Wednesday: 9:00 AM - 6:00 PM Thursday: 9:00 AM - 6:00 PM Friday: 9:00 AM - 6:00 PM Saturday: 9:00 AM - 1:00 PM ","http://www.cartridgeworld.com","33.50168","-82.08844","4.43212733790423","Inkjet Cartridge Refilling; Inkjet Printer Cartridges; Laser Toner Refilling; Laser Toner Cartridges; Video Game Consoles; PlayStation Consoles","false","true","This site specializes in refilling and remanufacturing all kinds of inkjet, laser, fax and copier cartridges.  This site will also purchase empty used refillable cartridges.



For more information, please call 1-888-99-REFILL.","","false","false","false","false"
"HobbyTown USA","HobbyTown USA","592 Bobby Jones Expy Ste 5","Augusta","Richmond","GA","30907","7068555003","0","","http://www.hobbytown.com/","33.50168","-82.08844","4.43212733790423","Cell Phones; Ni-Cd Batteries; Li-Ion Batteries; Ni-MH Batteries; Ni-Zn Batteries; Small Sealed Lead Acid Batteries; Video Game Consoles; PlayStation Consoles","false","true","The U.S. EPA estimates that more than 350 million rechargeable batteries are purchased annually in the U.S. Thanks to the environmental commitment of this location, its easy and free to recycle your batteries. Bring your rechargeable batteries to this location and look for the recycling box or ask an associate how you can do your part for the environment.","","false","false","false","false"
"Cartridge World","","592 Bobby Jones Expressway","Augusta","","GA","30907","7062286000","0","","","33.5024199","-82.087268","4.44420962093255","","false","false","","","false","false","false","false"
"Home Depot","Home Depot","499 Bobby Jones Expy Ste B","Augusta","Richmond","GA","30907","7066507662","0","Monday: 6:00 AM - 10:00 PM Tuesday: 6:00 AM - 10:00 PM Wednesday: 6:00 AM - 10:00 PM Thursday: 6:00 AM - 10:00 PM Friday: 6:00 AM - 10:00 PM Saturday: 6:00 AM - 10:00 PM Sunday: 8:00 AM - 8:00 PM ","http://www.homedepot.com","33.49958","-82.08704","4.59214083451991","Compact Fluorescent Lights; Batteries (Rechargeable); Video Game Consoles; PlayStation Consoles","false","true","Home Depot accepts compact fluorescent bulbs and used power tool rechargeable batteries. Look for the orange drop boxes, usually located near the front entrance near the customer service desk.","","false","false","false","false"
"Call2Recycle at the Home Depot","Call2Recycle at the Home Depot","499 Bobby Jones Expy Ste B","Augusta","Richmond","GA","30907","7066507662","0","","http://www.homedepot.com/","33.49958","-82.08704","4.59214083451991","Cell Phones; Compact Fluorescent Lights; Ni-Cd Batteries; Li-Ion Batteries; Ni-MH Batteries; Ni-Zn Batteries; Small Sealed Lead Acid Batteries; Video Game Consoles; PlayStation Consoles","false","true","The Home Depot accepts used rechargeable batteries and compact fluorescent bulbs. Look for the orange drop boxes, usually located near the front entrance near the customer service desk, or ask a store associate for more details.","","false","false","false","false"
"Augusta Communications Inc.","Augusta Communications Inc.","113 Cherry St","Augusta","Columbia","GA","30907","7068550404","0","","http://www.augustacommunications.com/","33.51676","-82.06679","4.84949388460389","Cell Phones; Ni-Cd Batteries; Li-Ion Batteries; Ni-MH Batteries; Ni-Zn Batteries; Small Sealed Lead Acid Batteries; Video Game Consoles; PlayStation Consoles","false","true","The U.S. EPA estimates that more than 350 million rechargeable batteries are purchased annually in the U.S. Thanks to the environmental commitment of this location, its easy and free to recycle your batteries. Bring your rechargeable batteries to this location and look for the recycling box or ask an associate how you can do your part for the environment.","","false","false","false","false"
"Call2Recycle at Lowe's","Call2Recycle at Lowe's","224 Bobby Jones Expy","Augusta","Columbia","GA","30907","7066518600","0","Monday: 6:00 AM - 10:00 PM Tuesday: 6:00 AM - 10:00 PM Wednesday: 6:00 AM - 10:00 PM Thursday: 6:00 AM - 10:00 PM Friday: 6:00 AM - 10:00 PM Saturday: 6:00 AM - 10:00 PM Sunday: 8:00 AM - 8:00 PM ","http://www.lowes.com/","33.49327","-82.08445","5.01250191082966","Cell Phones; Compact Fluorescent Lights; Ni-Cd Batteries; Plastic Shopping Bags; Li-Ion Batteries; Ni-MH Batteries; Ni-Zn Batteries; Small Sealed Lead Acid Batteries; Video Game Consoles; PlayStation Consoles","false","true","As an environmentally-committed retailer, Lowes offers a recycling center near store entrances to give consumers a free and easy way to properly dispose of rechargeable batteries, cell phones, CFLs and plastic shopping bags; materials that otherwise could be potentially harmful to the environment.  Look for the recycling center or ask a store associate for more details.","","false","false","false","false"
