name,description,address,city,region,province,postal_code,phone,fax,hours,url,latitude,longitude,distance,materials,pickup,dropoff,notes,groups,curbside,municipal,national,event_only
"Keys for Kids","Keys for Kids","14702 Excelsior Blvd","Minnetonka","Hennepin","MN","55345","7622803108","0","","https://www.recyclingkeysforkids.org/","44.90462","-93.46648","3.41490161256852","Keys; Computer (Recycling); Computer Monitors; DVD Players/Blu-Ray Players/DVRs; Electronics; Laptop Computers; Computer Peripherals; Printers/Scanners/Fax Machines; Small Electronics; Small Televisions; Tablets; Televisions; VCRs; Video Game Consoles; PlayStation Consoles","false","true","Key donations accepted by mail or visit website for collection sites. ","","false","false","false","false"
"Keys for Kids","Keys for Kids Collection Site","14702 Excelsior Blvd Unit 1069","Minnetonka","Hennepin","MN","55345","7632803108","0","","http://www.recyclingkeysforkids.org/","44.90462","-93.46648","3.41490161256852","Keys; Computer (Recycling); Computer Monitors; DVD Players/Blu-Ray Players/DVRs; Electronics; Laptop Computers; Computer Peripherals; Printers/Scanners/Fax Machines; Small Electronics; Small Televisions; Tablets; Televisions; VCRs; Video Game Consoles; PlayStation Consoles","false","true","Keys for Kids is a 501c3 non profit organization dedicated to inspiring youth through recycling keys and community involvement.  Keys are collected at drop-offs and through Key Drives. Visit website for more info.","","false","false","false","false"
"Edina Car Care, Inc.","Edina Car Care, Inc.","5415 W 70th St","Edina","Hennepin","MN","55439","9529414433","0","","","44.87587","-93.36249","3.52359810293274","Used Motor Oil; Oil Filters; Computer (Recycling); Computer Monitors; DVD Players/Blu-Ray Players/DVRs; Electronics; Laptop Computers; Computer Peripherals; Printers/Scanners/Fax Machines; Small Electronics; Small Televisions; Tablets; Televisions; VCRs; Video Game Consoles; PlayStation Consoles","false","true","","","false","false","false","false"
"March of Dimes","March of Dimes","5233 Edina Industrial Blvd","Minneapolis","Hennepin","MN","55439","9528353033","0","","http://www.marchofdimes.com/giving/donate-your-cell-phone.aspx","44.86313","-93.35739","3.63801455570586","Computer (Recycling); Computer Monitors; DVD Players/Blu-Ray Players/DVRs; Electronics; Laptop Computers; Computer Peripherals; Printers/Scanners/Fax Machines; Small Electronics; Small Televisions; Tablets; Televisions; VCRs; Video Game Consoles; PlayStation Consoles","false","true","This is a mail-in program that benefits the March of Dimes. You will find complete instructions for mailing-in any quantity of cell phones by visiting the march of dimes web site or call to request a phone collection kit for your office, club or place of worship.","","false","false","false","false"
"Dooley's Garage","Dooley's Garage","1001 6th St S","Hopkins","Hennepin","MN","55343","9529303900","0","","","44.91555","-93.41314","3.82304612521653","Used Motor Oil; Oil Filters; Computer (Recycling); Computer Monitors; DVD Players/Blu-Ray Players/DVRs; Electronics; Laptop Computers; Computer Peripherals; Printers/Scanners/Fax Machines; Small Electronics; Small Televisions; Tablets; Televisions; VCRs; Video Game Consoles; PlayStation Consoles","false","true","","","false","false","false","false"
"Youngstedt's Goodyear","Keys for Kids Collection Site","4711 Shady Oak Rd S","Hopkins","Hennepin","MN","55343","7632803108","0","","http://www.recyclingkeysforkids.org/","44.91785","-93.42704","3.87956026572087","Keys; Computer (Recycling); Computer Monitors; DVD Players/Blu-Ray Players/DVRs; Electronics; Laptop Computers; Computer Peripherals; Printers/Scanners/Fax Machines; Small Electronics; Small Televisions; Tablets; Televisions; VCRs; Video Game Consoles; PlayStation Consoles","false","true","Keys for Kids is a 501c3 non profit organization dedicated to inspiring youth through recycling keys and community involvement.  Keys are collected at drop-offs and through Key Drives. Visit website for more info.","","false","false","false","false"
"Bauer's Texaco Xpress Lube","Bauer's Texaco Xpress Lube","13118 Excelsior Blvd","Hopkins","Hennepin","MN","55343","9529369142","0","","","44.91694","-93.44717","3.88505423419025","Used Motor Oil; Oil Filters; Computer (Recycling); Computer Monitors; DVD Players/Blu-Ray Players/DVRs; Electronics; Laptop Computers; Computer Peripherals; Printers/Scanners/Fax Machines; Small Electronics; Small Televisions; Tablets; Televisions; VCRs; Video Game Consoles; PlayStation Consoles","false","true","","","false","false","false","false"
"The Salvation Army","null","5101 Edina Industrial Blvd","Edina","Hennepin County","MN","55439","8007287825","0","","http://www.salvationarmyusa.org","44.8641663","-93.3519384","3.90721968551444","Bikes; Books (Reuse); CD/DVD/Blu-ray/UHD discs; Cell Phones; Children's Toys; Clothing; Computer (Reuse); Hard Drives; Computer Monitors; Cameras; DVD Players/Blu-Ray Players/DVRs; Electronics; E-Readers; Furniture; Gift Bags; Headphones; Household Goods; Laptop Computers; Lawn Equipment; Miscellaneous Tools; MP3 Players; Musical Instruments; Network Equipment; Ornaments; Computer Peripherals; Portable Media Players; Printers/Scanners/Fax Machines; Reusable Appliance Donation; Small Appliances; Small Electronics; Small Televisions; Sporting Goods; Stereo Equipment; Tablets; Telephones; Televisions; VCRs; VHS & Cassette Tapes; Video Game Systems; Blu-Ray Players; Digital Converter Boxes; Computer (Recycling); Video Game Consoles; PlayStation Consoles","false","true","Call for Details","Vizio, Salvation Army, OEM, Sony","false","false","false","false"
"Tonka Cycle and Ski","Tonka Cycle and Ski","416 11th avenue south","Hopkins","Hennepin ","MN","55343","9529388336","0","","","44.9179146","-93.4147711","3.96453506416456","E-Bike Batteries","false","true","Call or Check Online for Hours","Call2Recycle","false","false","false","false"
"Hopkins Auto Body","Keys for Kids Collection Site","10889 Excelsior Blvd","Hopkins","Hennepin","MN","55343","7632803108","0","","http://www.recyclingkeysforkids.org/","44.92083","-93.4168","4.14316632223894","Keys; Computer (Recycling); Computer Monitors; DVD Players/Blu-Ray Players/DVRs; Electronics; Laptop Computers; Computer Peripherals; Printers/Scanners/Fax Machines; Small Electronics; Small Televisions; Tablets; Televisions; VCRs; Video Game Consoles; PlayStation Consoles","false","true","Keys for Kids is a 501c3 non profit organization dedicated to inspiring youth through recycling keys and community involvement.  Keys are collected at drop-offs and through Key Drives. Visit website for more info.","","false","false","false","false"
"Jiffy Lube","Jiffy Lube","10410 Excelsior Blvd","Hopkins","Hennepin","MN","55343","6129386856","0","","null","44.92115","-93.41237","4.20820688116117","Used Motor Oil; Oil Filters; Computer (Recycling); Computer Monitors; DVD Players/Blu-Ray Players/DVRs; Electronics; Laptop Computers; Computer Peripherals; Printers/Scanners/Fax Machines; Small Electronics; Small Televisions; Tablets; Televisions; VCRs; Video Game Consoles; PlayStation Consoles","false","true","","","false","false","false","false"
"Tuttle's Bowling Bar & Grill","Keys for Kids Collection Site","107 Shady Oak Rd S","Hopkins","Hennepin","MN","55343","7632803108","0","","http://www.recyclingkeysforkids.org/","44.9228","-93.42652","4.22246050261405","Keys; Computer (Recycling); Computer Monitors; DVD Players/Blu-Ray Players/DVRs; Electronics; Laptop Computers; Computer Peripherals; Printers/Scanners/Fax Machines; Small Electronics; Small Televisions; Tablets; Televisions; VCRs; Video Game Consoles; PlayStation Consoles","false","true","Keys for Kids is a 501c3 non profit organization dedicated to inspiring youth through recycling keys and community involvement.  Keys are collected at drop-offs and through Key Drives. Visit website for more info.","","false","false","false","false"
"USPS Post Office Box Lobby Recycling Program","US Post Office","910 1st St S","Hopkins","Hennepin","MN","55343","8002758777","0","","https://www.usps.com/","44.92224","-93.41169","4.28908782164073","Catalogs; Greeting Cards; Magazines; Paper (Mixed)","false","true","","","false","false","false","false"
"US Post Office","US Post Office","910 1st St S","Hopkins","Hennepin","MN","55343","0","0","","https://www.usps.com/ship/recycle-through-usps.htm","44.92224","-93.41169","4.28908782164073","Inkjet Printer Cartridges; Computer (Recycling); Computer Monitors; DVD Players/Blu-Ray Players/DVRs; Electronics; Laptop Computers; Computer Peripherals; Printers/Scanners/Fax Machines; Small Electronics; Small Televisions; Tablets; Televisions; VCRs; Video Game Consoles; PlayStation Consoles","false","true","Free, postage-paid Mail Back envelopes can be found on display in the lobby. There is no limit to the number of envelopes customers may take. The contents of the envelope must weigh less than 13 ounces and the envelope must be able to seal completely. For more details visit<a href="http://www.maxback.com/mxb-postoffice-collaboration" target="_blank">MaxBack</a>.","","false","false","false","false"
"Goodwill Industries","Goodwill Industries","80 W 78th St","Chanhassen","Carver","MN","55317","9529341354","0","Sunday: 11:00 AM - 5:00 PM Monday: 9:00 AM - 9:00 PM Tuesday: 9:00 AM - 9:00 PM Wednesday: 9:00 AM - 9:00 PM Thursday: 9:00 AM - 9:00 PM Friday: 9:00 AM - 9:00 PM Saturday: 9:00 AM - 5:00 PM ","http://www.goodwilleasterseals.org","44.86191","-93.52231","4.43953292461805","Bikes; Books (Reuse); CD/DVD/Blu-ray/UHD discs; Children's Toys; Clothing; Furniture; Household Goods; Lawn Equipment; Medical Equipment; Ornaments; Reusable Appliance Donation; Shoes; Sporting Goods; Computer (Recycling); Computer Monitors; DVD Players/Blu-Ray Players/DVRs; Electronics; Laptop Computers; Computer Peripherals; Printers/Scanners/Fax Machines; Small Electronics; Small Televisions; Tablets; Televisions; VCRs; Video Game Consoles; PlayStation Consoles","false","true","This site accepts items in reusable condition.  Please call this site to make an appointment for deliveries of donations via moving vans and U-Hauls.","","false","false","false","false"
"Main Street Repair, Inc.","Main Street Repair, Inc.","501 Mainstreet","Hopkins","Hennepin","MN","55343","9529388303","0","","","44.9247","-93.40717","4.50844154862995","Used Motor Oil; Oil Filters; Computer (Recycling); Computer Monitors; DVD Players/Blu-Ray Players/DVRs; Electronics; Laptop Computers; Computer Peripherals; Printers/Scanners/Fax Machines; Small Electronics; Small Televisions; Tablets; Televisions; VCRs; Video Game Consoles; PlayStation Consoles","false","true","","","false","false","false","false"
"Hance Ace Hardware","Keys for Kids Collection Site","903 Hopkins Ctr","Hopkins","Hennepin","MN","55343","7632803108","0","","http://www.recyclingkeysforkids.org/","44.92571","-93.41175","4.52221470956546","Keys; Computer (Recycling); Computer Monitors; DVD Players/Blu-Ray Players/DVRs; Electronics; Laptop Computers; Computer Peripherals; Printers/Scanners/Fax Machines; Small Electronics; Small Televisions; Tablets; Televisions; VCRs; Video Game Consoles; PlayStation Consoles","false","true","Keys for Kids is a 501c3 non profit organization dedicated to inspiring youth through recycling keys and community involvement.  Keys are collected at drop-offs and through Key Drives. Visit website for more info.","","false","false","false","false"
"Youngstedt's Goodyear","Keys for Kids Collection Site","14950 Highway 7","Minnetonka","Hennepin","MN","55345","7632803108","0","","http://www.recyclingkeysforkids.org/","44.92187","-93.46891","4.53360633147751","Keys; Computer (Recycling); Computer Monitors; DVD Players/Blu-Ray Players/DVRs; Electronics; Laptop Computers; Computer Peripherals; Printers/Scanners/Fax Machines; Small Electronics; Small Televisions; Tablets; Televisions; VCRs; Video Game Consoles; PlayStation Consoles","false","true","Keys for Kids is a 501c3 non profit organization dedicated to inspiring youth through recycling keys and community involvement.  Keys are collected at drop-offs and through Key Drives. Visit website for more info.","","false","false","false","false"
"Rudy Luther's Hopkins Motors, Inc.","Rudy Luther's Hopkins Motors, Inc.","499 Mainstreet","Hopkins","Hennepin","MN","55343","6129381717","0","","","44.92505","-93.4056","4.55268092462807","Used Motor Oil; Oil Filters; Computer (Recycling); Computer Monitors; DVD Players/Blu-Ray Players/DVRs; Electronics; Laptop Computers; Computer Peripherals; Printers/Scanners/Fax Machines; Small Electronics; Small Televisions; Tablets; Televisions; VCRs; Video Game Consoles; PlayStation Consoles","false","true","","","false","false","false","false"
"Feldmann's Imports, Inc.","Feldmann's Imports, Inc.","4901 W 80th St Cir ","Bloomington","Hennepin County","MN","55437","9528376300","0","","","44.8573697","-93.337576","4.61751038166886","Used Motor Oil; Oil Filters; Computer (Recycling); Computer Monitors; DVD Players/Blu-Ray Players/DVRs; Electronics; Laptop Computers; Computer Peripherals; Printers/Scanners/Fax Machines; Small Electronics; Small Televisions; Tablets; Televisions; VCRs; Video Game Consoles; PlayStation Consoles","false","true","","","false","false","false","false"
"Anchor Glass Container","Anchor Glass Container","4108 Valley Industrial Blvd N","Shakopee","Scott","MN","55379","9524455005","0","Monday: 7:00 AM - 6:00 PM Tuesday: 7:00 AM - 6:00 PM Wednesday: 7:00 AM - 6:00 PM Thursday: 7:00 AM - 6:00 PM Friday: 7:00 AM - 6:00 PM ","null","44.79909","-93.4686","4.69515822198346","Glass (Blue); Glass (Clear); Glass (Green); Computer (Recycling); Computer Monitors; DVD Players/Blu-Ray Players/DVRs; Electronics; Laptop Computers; Computer Peripherals; Printers/Scanners/Fax Machines; Small Electronics; Small Televisions; Tablets; Televisions; VCRs; Video Game Consoles; PlayStation Consoles","false","true","","","false","false","false","false"
"O'Reilly Auto Parts","O'Reilly Auto Parts","8460 Excelsior Blvd East","Hopkins","Hennepin","MN","55343","9529355100","0","","http://www.oreillyauto.com/","44.92545","-93.38771","4.89583471182519","Lead Acid (Pb) Batteries; Used Motor Oil; Computer (Recycling); Computer Monitors; DVD Players/Blu-Ray Players/DVRs; Electronics; Laptop Computers; Computer Peripherals; Printers/Scanners/Fax Machines; Small Electronics; Small Televisions; Tablets; Televisions; VCRs; Video Game Consoles; PlayStation Consoles","false","true","Most stores offer Used Oil & Battery Recycling, Battery Testing, 
Electrical & Module Testing, Loaner Tool Program, Drum / Rotor Resurfacing. Call your location for more details.","","false","false","false","false"
"Staples, Inc.","Staples","4200 W 78th St ","Minneapolis","Hennepin County","MN","55435","9528351571","0","Monday: 9:00 AM - 8:00 PM Tuesday: 9:00 AM - 8:00 PM Wednesday: 9:00 AM - 8:00 PM Thursday: 9:00 AM - 8:00 PM Friday: 9:00 AM - 8:00 PM Saturday: 10:00 AM - 7:00 PM Sunday: 11:00 AM - 6:00 PM ","https://www.staples.com/recycle","44.8604651","-93.3314911","4.9061115403127","AC Power Plugs; Batteries (Rechargeable); Cables & Connectors; Cell Phone Batteries; Cell Phones; Computer (Recycling); Hard Drives; Computer Monitors; Cameras; DVD Players/Blu-Ray Players/DVRs; Electronics; E-Readers; GPS Units; Headphones; Inkjet Printer Cartridges; Laptop Computers; Laser Toner Cartridges; Li-Ion Batteries; MP3 Players; Network Equipment; Ni-Cd Batteries; Ni-MH Batteries; Ni-Zn Batteries; Computer Peripherals; Portable Media Players; Printers/Scanners/Fax Machines; Small Electronics; Small Sealed Lead Acid Batteries; Stereo Equipment; Tablets; Telephones; UPS Batteries/Backup Systems; VCRs; Video Game Systems; Blu-Ray Players; Digital Converter Boxes; Small Televisions; Televisions; Video Game Consoles; PlayStation Consoles","false","true","NO TVs; Limit 6 CEDs per day; ","Vizio, OEM, Sony","false","false","false","false"
"Homes Within Reach","Keys for Kids Collection Site","5101 Thimsen Ave Ste 202","Minnetonka","Hennepin","MN","55345","7632803108","0","","http://www.recyclingkeysforkids.org/","44.91132","-93.50469","4.94876377496052","Keys; Computer (Recycling); Computer Monitors; DVD Players/Blu-Ray Players/DVRs; Electronics; Laptop Computers; Computer Peripherals; Printers/Scanners/Fax Machines; Small Electronics; Small Televisions; Tablets; Televisions; VCRs; Video Game Consoles; PlayStation Consoles","false","true","Keys for Kids is a 501c3 non profit organization dedicated to inspiring youth through recycling keys and community involvement.  Keys are collected at drop-offs and through Key Drives. Visit website for more info.","","false","false","false","false"
"The Salvation Army","null","7700 France Ave S ","Bloomington","Hennepin County","MN","55435","8007287825","0","","http://www.salvationarmyusa.org","44.862749","-93.3305495","4.95170826145529","Bikes; Books (Reuse); CD/DVD/Blu-ray/UHD discs; Cell Phones; Children's Toys; Clothing; Computer (Reuse); Hard Drives; Computer Monitors; Cameras; DVD Players/Blu-Ray Players/DVRs; Electronics; E-Readers; Furniture; Gift Bags; Headphones; Household Goods; Laptop Computers; Lawn Equipment; Miscellaneous Tools; MP3 Players; Musical Instruments; Network Equipment; Ornaments; Computer Peripherals; Portable Media Players; Printers/Scanners/Fax Machines; Reusable Appliance Donation; Small Appliances; Small Electronics; Small Televisions; Sporting Goods; Stereo Equipment; Tablets; Telephones; Televisions; VCRs; VHS & Cassette Tapes; Video Game Systems; Blu-Ray Players; Digital Converter Boxes; Computer (Recycling); Video Game Consoles; PlayStation Consoles","false","true","Call for Details","Vizio, Salvation Army, OEM, Sony","false","false","false","false"
"Walgreens","Walgreens","1511 MN-7 ","Hopkins","Hennepin County","MN","55305","9529391917","0","","http://www.walgreens.com","44.9334805","-93.4197194","4.9872172299299","Cell Phones; Inkjet Printer Cartridges; Computer (Recycling); Computer Monitors; DVD Players/Blu-Ray Players/DVRs; Electronics; Laptop Computers; Computer Peripherals; Printers/Scanners/Fax Machines; Small Electronics; Small Televisions; Tablets; Televisions; VCRs; Video Game Consoles; PlayStation Consoles","false","true","","","false","false","false","false"
"Jerry's Do It Best Hardware","Keys for Kids Collection Site","5115 Vernon Ave S","Edina","Hennepin","MN","55436","7632803108","0","","http://www.recyclingkeysforkids.org/","44.91028","-93.35572","5.0039094395392","Keys; Computer (Recycling); Computer Monitors; DVD Players/Blu-Ray Players/DVRs; Electronics; Laptop Computers; Computer Peripherals; Printers/Scanners/Fax Machines; Small Electronics; Small Televisions; Tablets; Televisions; VCRs; Video Game Consoles; PlayStation Consoles","false","true","Keys for Kids is a 501c3 non profit organization dedicated to inspiring youth through recycling keys and community involvement.  Keys are collected at drop-offs and through Key Drives. Visit website for more info.","","false","false","false","false"
"Bob and Steve's Auto World","Bob and Steve's Auto World","7920 France Ave S","Minneapolis","Hennepin","MN","55435","9528318833","0","","","44.85979","-93.32949","5.00519486370302","Used Motor Oil; Oil Filters; Computer (Recycling); Computer Monitors; DVD Players/Blu-Ray Players/DVRs; Electronics; Laptop Computers; Computer Peripherals; Printers/Scanners/Fax Machines; Small Electronics; Small Televisions; Tablets; Televisions; VCRs; Video Game Consoles; PlayStation Consoles","false","true","","","false","false","false","false"
"Tires Plus Store","Tires Plus Store","580 W 79th St","Chanhassen","Carver","MN","55317","9529342198","0","","http://www.firestone.com","44.85917","-93.53401","5.01588800161747","Lead Acid (Pb) Batteries; Used Motor Oil; Computer (Recycling); Computer Monitors; DVD Players/Blu-Ray Players/DVRs; Electronics; Laptop Computers; Computer Peripherals; Printers/Scanners/Fax Machines; Small Electronics; Small Televisions; Tablets; Televisions; VCRs; Video Game Consoles; PlayStation Consoles","false","true","","","false","false","false","false"
"US Post Office","US Post Office","6101 W Old Shakopee Rd","Minneapolis","Hennepin","MN","55438","0","0","","https://www.usps.com/ship/recycle-through-usps.htm","44.80712","-93.36146","5.10847620377834","Inkjet Printer Cartridges; Computer (Recycling); Computer Monitors; DVD Players/Blu-Ray Players/DVRs; Electronics; Laptop Computers; Computer Peripherals; Printers/Scanners/Fax Machines; Small Electronics; Small Televisions; Tablets; Televisions; VCRs; Video Game Consoles; PlayStation Consoles","false","true","Free, postage-paid Mail Back envelopes can be found on display in the lobby. There is no limit to the number of envelopes customers may take. The contents of the envelope must weigh less than 13 ounces and the envelope must be able to seal completely. For more details visit<a href="http://www.maxback.com/mxb-postoffice-collaboration" target="_blank">MaxBack</a>.","","false","false","false","false"
"Target","Target","4848 County Road 101","Minnetonka","Hennepin","MN","55345","9524013830","0","","http://www.target.com/","44.91627","-93.50347","5.15006904372888","Aluminum Cans; Cell Phones; Inkjet Printer Cartridges; MP3 Players; Plastic #1 (PETE); Plastic #2 (HDPE); Plastic Shopping Bags; Computer (Recycling); Computer Monitors; DVD Players/Blu-Ray Players/DVRs; Electronics; Laptop Computers; Computer Peripherals; Printers/Scanners/Fax Machines; Small Electronics; Small Televisions; Tablets; Televisions; VCRs; Video Game Consoles; PlayStation Consoles","false","true","","","false","false","false","false"
"Cub Foods","Keys for Kids Collection Site","4801 County Road 101","Minnetonka","Hennepin","MN","55345","7632803108","0","","http://www.recyclingkeysforkids.org/","44.91711","-93.5033","5.18698728490283","Keys; Computer (Recycling); Computer Monitors; DVD Players/Blu-Ray Players/DVRs; Electronics; Laptop Computers; Computer Peripherals; Printers/Scanners/Fax Machines; Small Electronics; Small Televisions; Tablets; Televisions; VCRs; Video Game Consoles; PlayStation Consoles","false","true","Keys for Kids is a 501c3 non profit organization dedicated to inspiring youth through recycling keys and community involvement.  Keys are collected at drop-offs and through Key Drives. Visit website for more info.","","false","false","false","false"
"Merlin's Ace Hardware","Keys for Kids Collection Site","7844 Market Blvd","Chanhassen","Carver","MN","55317","7632803108","0","","http://www.recyclingkeysforkids.org/","44.86001","-93.53786","5.20257918146124","Keys; Computer (Recycling); Computer Monitors; DVD Players/Blu-Ray Players/DVRs; Electronics; Laptop Computers; Computer Peripherals; Printers/Scanners/Fax Machines; Small Electronics; Small Televisions; Tablets; Televisions; VCRs; Video Game Consoles; PlayStation Consoles; Batteries (Rechargeable); Cell Phone Batteries; Li-Ion Batteries; Ni-Cd Batteries; Ni-MH Batteries; Small Sealed Lead Acid Batteries; Cell Phones","false","true","Keys for Kids is a 501c3 non profit organization dedicated to inspiring youth through recycling keys and community involvement.  Keys are collected at drop-offs and through Key Drives. Visit website for more info.","Call2Recycle","false","false","false","false"
"O'Reilly Auto Parts","O'Reilly Auto Parts","4725 County Road 101 ","Minnetonka","Hennepin","MN","55345","9529358755","0","","http://www.oreillyauto.com/","44.91803","-93.50332","5.23463491873489","Lead Acid (Pb) Batteries; Used Motor Oil; Computer (Recycling); Computer Monitors; DVD Players/Blu-Ray Players/DVRs; Electronics; Laptop Computers; Computer Peripherals; Printers/Scanners/Fax Machines; Small Electronics; Small Televisions; Tablets; Televisions; VCRs; Video Game Consoles; PlayStation Consoles","false","true","Most stores offer Used Oil & Battery Recycling, Battery Testing, 
Electrical & Module Testing, Loaner Tool Program, Drum / Rotor Resurfacing. Call your location for more details.","","false","false","false","false"
"Southdale Center 1","Southdale Center 1","10 Southdale Ctr","Edina","Hennepin","MN","55435","8583244111","0","","http://www.ecoatm.com/","44.88144","-93.32645","5.32703613246187","Cell Phones; Tablets; MP3 Players; Computer (Recycling); Computer Monitors; DVD Players/Blu-Ray Players/DVRs; Electronics; Laptop Computers; Computer Peripherals; Printers/Scanners/Fax Machines; Small Electronics; Small Televisions; Televisions; VCRs; Video Game Consoles; PlayStation Consoles","false","true","ecoATM is an automated, consumer self-serve kiosk that quickly buys back and recycles old phones, mp3 players and tablets.
</br>
Call or email <a href="mailto:max@ecoATM.com">customer support</a> with questions.","","false","false","false","false"
"The Salvation Army","null","10 Southdale Center ","Edina","Hennepin County","MN","55435","8007287825","0","","http://www.salvationarmyusa.org","44.8805","-93.3252496","5.36792744936812","Bikes; Books (Reuse); CD/DVD/Blu-ray/UHD discs; Cell Phones; Children's Toys; Clothing; Computer (Reuse); Hard Drives; Computer Monitors; Cameras; DVD Players/Blu-Ray Players/DVRs; Electronics; E-Readers; Furniture; Gift Bags; Headphones; Household Goods; Laptop Computers; Lawn Equipment; Miscellaneous Tools; MP3 Players; Musical Instruments; Network Equipment; Ornaments; Computer Peripherals; Portable Media Players; Printers/Scanners/Fax Machines; Reusable Appliance Donation; Small Appliances; Small Electronics; Small Televisions; Sporting Goods; Stereo Equipment; Tablets; Telephones; Televisions; VCRs; VHS & Cassette Tapes; Video Game Systems; Blu-Ray Players; Digital Converter Boxes; Computer (Recycling); Video Game Consoles; PlayStation Consoles","false","true","Call for Details","Salvation Army, Vizio, OEM, Sony","false","false","false","false"
