name,description,address,city,region,province,postal_code,phone,fax,hours,url,latitude,longitude,distance,materials,pickup,dropoff,notes,groups,curbside,municipal,national,event_only
"Target","Target","7000 York Ave S","Minneapolis","Hennepin","MN","55435","9529254610","0","","http://www.target.com/","44.8753","-93.32339","5.38280950292577","Aluminum Cans; Cell Phones; Inkjet Printer Cartridges; MP3 Players; Plastic #1 (PETE); Plastic #2 (HDPE); Plastic Shopping Bags; Computer (Recycling); Computer Monitors; DVD Players/Blu-Ray Players/DVRs; Electronics; Laptop Computers; Computer Peripherals; Printers/Scanners/Fax Machines; Small Electronics; Small Televisions; Tablets; Televisions; VCRs; Video Game Consoles; PlayStation Consoles","false","true","","","false","false","false","false"
"FedEx Office","FedEx Office","880 W 78th St","Chanhassen","Carver","MN","55317","9524740123","0","Monday: 7:00 AM - 11:00 PM Tuesday: 7:00 AM - 11:00 PM Wednesday: 7:00 AM - 11:00 PM Thursday: 7:00 AM - 11:00 PM Friday: 7:00 AM - 11:00 PM Saturday: 8:00 AM - 9:00 PM Sunday: 9:00 AM - 9:00 PM ","null","44.86235","-93.54183","5.39556879815744","Inkjet Printer Cartridges; Laser Toner Cartridges; Computer (Recycling); Computer Monitors; DVD Players/Blu-Ray Players/DVRs; Electronics; Laptop Computers; Computer Peripherals; Printers/Scanners/Fax Machines; Small Electronics; Small Televisions; Tablets; Televisions; VCRs; Video Game Consoles; PlayStation Consoles","false","true","","","false","false","false","false"
"Call2Recycle at Apple Store Southdale","null","1560 Southdale Ctr","Minneapolis","Hennepin","MN","55435","9529208260","0","","http://www.apple.com/","44.88179","-93.324","5.44918744498543","Cell Phones; Ni-Cd Batteries; Li-Ion Batteries; Ni-MH Batteries; Ni-Zn Batteries; Small Sealed Lead Acid Batteries; Computer (Recycling); Computer Monitors; DVD Players/Blu-Ray Players/DVRs; Electronics; Laptop Computers; Computer Peripherals; Printers/Scanners/Fax Machines; Small Electronics; Small Televisions; Tablets; Televisions; VCRs; Video Game Consoles; PlayStation Consoles","false","true","The U.S. EPA estimates that more than 350 million rechargeable batteries are purchased annually in the U.S. Thanks to the environmental commitment of this location, its easy and free to recycle your batteries. Bring your rechargeable batteries to this location and look for the recycling box or ask an associate how you can do your part for the environment.","","false","false","false","false"
"Hunters Ridge Apartments","Keys for Kids Collection Site","19000 Stratford Rd","Minnetonka","Hennepin","MN","55345","7632803108","0","","http://www.recyclingkeysforkids.org/","44.90887","-93.52128","5.46144932886821","Keys; Computer (Recycling); Computer Monitors; DVD Players/Blu-Ray Players/DVRs; Electronics; Laptop Computers; Computer Peripherals; Printers/Scanners/Fax Machines; Small Electronics; Small Televisions; Tablets; Televisions; VCRs; Video Game Consoles; PlayStation Consoles","false","true","Keys for Kids is a 501c3 non profit organization dedicated to inspiring youth through recycling keys and community involvement.  Keys are collected at drop-offs and through Key Drives. Visit website for more info.","","false","false","false","false"
"AT&T Wireless","AT&T Wireless","1945 Southdale Ctr","Edina","Hennepin","MN","55435","9529208451","0","","http://www.att.com/","44.88124","-93.32339","5.46864886601718","Cell Phones; Ni-Cd Batteries; Batteries (Rechargeable); Cell Phone Batteries; Tablets; Li-Ion Batteries; Computer (Recycling); Computer Monitors; DVD Players/Blu-Ray Players/DVRs; Electronics; Laptop Computers; Computer Peripherals; Printers/Scanners/Fax Machines; Small Electronics; Small Televisions; Televisions; VCRs; Video Game Consoles; PlayStation Consoles","false","true","Receive an AT&T Promotion Card worth the trade-in value of your smartphone, tablet, or netbook. You can also donate the trade-in value to Cell Phones for Soldiers.","","false","false","false","false"
"Target","Target","8900 Highway 7","Minneapolis","Hennepin","MN","55426","9529356941","0","","http://www.target.com/","44.93514","-93.3896","5.46956673178786","Aluminum Cans; Cell Phones; Inkjet Printer Cartridges; MP3 Players; Plastic #1 (PETE); Plastic #2 (HDPE); Plastic Shopping Bags; Computer (Recycling); Computer Monitors; DVD Players/Blu-Ray Players/DVRs; Electronics; Laptop Computers; Computer Peripherals; Printers/Scanners/Fax Machines; Small Electronics; Small Televisions; Tablets; Televisions; VCRs; Video Game Consoles; PlayStation Consoles","false","true","","","false","false","false","false"
"Home Depot","Home Depot","300 Pioneer Trl","Chaska","Carver","MN","55318","9523680281","0","","http://www.homedepot.com","44.82635","-93.532","5.49174984856899","Compact Fluorescent Lights; Batteries (Rechargeable); Computer (Recycling); Computer Monitors; DVD Players/Blu-Ray Players/DVRs; Electronics; Laptop Computers; Computer Peripherals; Printers/Scanners/Fax Machines; Small Electronics; Small Televisions; Tablets; Televisions; VCRs; Video Game Consoles; PlayStation Consoles; Batteries (Rechargeable); Cell Phone Batteries; Li-Ion Batteries; Ni-Cd Batteries; Ni-MH Batteries; Small Sealed Lead Acid Batteries","false","true","Home Depot accepts compact fluorescent bulbs and used power tool rechargeable batteries. Look for the orange drop boxes, usually located near the front entrance near the customer service desk.","Call2Recycle","false","false","false","false"
"Call2Recycle at the Home Depot","Call2Recycle at the Home Depot","300 Pioneer Trail, East","Chaska","Carver","MN","55318","9523680281","0","","http://www.homedepot.com/","44.82635","-93.532","5.49174984856899","Cell Phones; Compact Fluorescent Lights; Ni-Cd Batteries; Li-Ion Batteries; Ni-MH Batteries; Ni-Zn Batteries; Small Sealed Lead Acid Batteries; Computer (Recycling); Computer Monitors; DVD Players/Blu-Ray Players/DVRs; Electronics; Laptop Computers; Computer Peripherals; Printers/Scanners/Fax Machines; Small Electronics; Small Televisions; Tablets; Televisions; VCRs; Video Game Consoles; PlayStation Consoles","false","true","The Home Depot accepts used rechargeable batteries and compact fluorescent bulbs. Look for the orange drop boxes, usually located near the front entrance near the customer service desk, or ask a store associate for more details.","","false","false","false","false"
"OfficeMax","OfficeMax","960 W 78th St","Chanhassen","Carver","MN","55317","9524709081","0","Monday: 8:00 AM - 9:00 PM Tuesday: 8:00 AM - 9:00 PM Wednesday: 8:00 AM - 9:00 PM Thursday: 8:00 AM - 9:00 PM Friday: 8:00 AM - 9:00 PM Saturday: 9:00 AM - 8:00 PM Sunday: 10:00 AM - 7:00 PM ","http://www.officemax.com","44.86254","-93.54389","5.49654600346498","Inkjet Cartridge Refilling; Inkjet Printer Cartridges; Laser Toner Cartridges; Computer (Recycling); Computer Monitors; DVD Players/Blu-Ray Players/DVRs; Electronics; Laptop Computers; Computer Peripherals; Printers/Scanners/Fax Machines; Small Electronics; Small Televisions; Tablets; Televisions; VCRs; Video Game Consoles; PlayStation Consoles","false","true","This location features Phoenix Ink refill kiosks.","","false","false","false","false"
"Walgreens","Walgreens","540 Blake Rd N","Hopkins","Hennepin","MN","55343","9529381168","0","","http://www.walgreens.com","44.9349","-93.38673","5.50874870579777","Cell Phones; Inkjet Cartridge Refilling; Inkjet Printer Cartridges; Computer (Recycling); Computer Monitors; DVD Players/Blu-Ray Players/DVRs; Electronics; Laptop Computers; Computer Peripherals; Printers/Scanners/Fax Machines; Small Electronics; Small Televisions; Tablets; Televisions; VCRs; Video Game Consoles; PlayStation Consoles","false","true","","","false","false","false","false"
"Walgreens","Walgreens","6975 York Ave S","Minneapolis","Hennepin","MN","55435","9529203561","0","","http://www.walgreens.com","44.87694","-93.32062","5.53665957814154","Cell Phones; Inkjet Cartridge Refilling; Inkjet Printer Cartridges; Computer (Recycling); Computer Monitors; DVD Players/Blu-Ray Players/DVRs; Electronics; Laptop Computers; Computer Peripherals; Printers/Scanners/Fax Machines; Small Electronics; Small Televisions; Tablets; Televisions; VCRs; Video Game Consoles; PlayStation Consoles","false","true","","","false","false","false","false"
"Sams Club","","8201 Old Carriage Ct","Shakopee","","MN","55379","9524961979","0","","https://www.samsclub.com/","44.7814622","-93.4163994","5.60018180656432","","false","false","","","false","false","false","false"
"Target","Target","851 W 78th St","Chanhassen","Carver","MN","55317","9524700206","0","","http://www.target.com/","44.86302","-93.54646","5.62277579913189","Aluminum Cans; Cell Phones; Inkjet Printer Cartridges; MP3 Players; Plastic #1 (PETE); Plastic #2 (HDPE); Plastic Shopping Bags; Computer (Recycling); Computer Monitors; DVD Players/Blu-Ray Players/DVRs; Electronics; Laptop Computers; Computer Peripherals; Printers/Scanners/Fax Machines; Small Electronics; Small Televisions; Tablets; Televisions; VCRs; Video Game Consoles; PlayStation Consoles","false","true","","","false","false","false","false"
"Peterson Pontiac-GMC, Inc.","Peterson Pontiac-GMC, Inc.","4601 W 80th St ","Minneapolis","Hennepin County","MN","55431","6128889800","0","","","44.8588331","-93.316875","5.62483548759209","Used Motor Oil; Oil Filters; Computer (Recycling); Computer Monitors; DVD Players/Blu-Ray Players/DVRs; Electronics; Laptop Computers; Computer Peripherals; Printers/Scanners/Fax Machines; Small Electronics; Small Televisions; Tablets; Televisions; VCRs; Video Game Consoles; PlayStation Consoles","false","true","","","false","false","false","false"
"American Ford","American Ford","4801 W 80th St ","Minneapolis","Hennepin County","MN","55431","6128317000","0","","null","44.8588331","-93.316875","5.62483548759209","Used Motor Oil; Oil Filters; Computer (Recycling); Computer Monitors; DVD Players/Blu-Ray Players/DVRs; Electronics; Laptop Computers; Computer Peripherals; Printers/Scanners/Fax Machines; Small Electronics; Small Televisions; Tablets; Televisions; VCRs; Video Game Consoles; PlayStation Consoles","false","true","","","false","false","false","false"
"Honest-1 Auto Care","Honest-1 Auto Care","3224 Southdale Cir","Edina","Hennepin","MN","55435","9524676881","0","","http://www.honest-1.com/","44.88217","-93.31978","5.65576398098976","Lead Acid (Pb) Batteries; Transmission Fluid; Used Motor Oil; Computer (Recycling); Computer Monitors; DVD Players/Blu-Ray Players/DVRs; Electronics; Laptop Computers; Computer Peripherals; Printers/Scanners/Fax Machines; Small Electronics; Small Televisions; Tablets; Televisions; VCRs; Video Game Consoles; PlayStation Consoles","false","true","Honest-1 is the nation's only Eco-Friendly Auto Care chain. We offer a full range of automotive service and repairs.","","false","false","false","false"
"Pomp's Tire Service","Pomp's Tire Service","2874 W 82nd St ","Minneapolis","Hennepin County","MN","55431","7637541294","0","Monday: 7:00 AM - 5:00 PM Tuesday: 7:00 AM - 5:00 PM Wednesday: 7:00 AM - 5:00 PM Thursday: 7:00 AM - 5:00 PM Friday: 7:00 AM - 5:00 PM ","","44.8552751","-93.3165264","5.65631742193805","Used Tires; Computer (Recycling); Computer Monitors; DVD Players/Blu-Ray Players/DVRs; Electronics; Laptop Computers; Computer Peripherals; Printers/Scanners/Fax Machines; Small Electronics; Small Televisions; Tablets; Televisions; VCRs; Video Game Consoles; PlayStation Consoles","false","true","This site is located in the City of Blaine.","","false","false","false","false"
"Minnetonka Community Center","Keys for Kids Collection Site","14600 Minnetonka Blvd","Minnetonka","Hennepin","MN","55345","7632803108","0","","http://www.recyclingkeysforkids.org/","44.94029","-93.46547","5.67021452015266","Keys; Computer (Recycling); Computer Monitors; DVD Players/Blu-Ray Players/DVRs; Electronics; Laptop Computers; Computer Peripherals; Printers/Scanners/Fax Machines; Small Electronics; Small Televisions; Tablets; Televisions; VCRs; Video Game Consoles; PlayStation Consoles","false","true","Keys for Kids is a 501c3 non profit organization dedicated to inspiring youth through recycling keys and community involvement.  Keys are collected at drop-offs and through Key Drives. Visit website for more info.","","false","false","false","false"
"Walmart Supercenter","","8101 Old Carriage Ct","Shakopee","","MN","55379","9524458013","0","","https://www.walmart.com/","44.7793751","-93.4180149","5.73335402142786","","false","false","","","false","false","false","false"
"Tires Plus Store","Tires Plus Store","3020 W 66th St","Minneapolis","Hennepin","MN","55423","6127985789","0","","http://www.firestone.com","44.88395","-93.31834","5.75547732436835","Lead Acid (Pb) Batteries; Used Motor Oil; Computer (Recycling); Computer Monitors; DVD Players/Blu-Ray Players/DVRs; Electronics; Laptop Computers; Computer Peripherals; Printers/Scanners/Fax Machines; Small Electronics; Small Televisions; Tablets; Televisions; VCRs; Video Game Consoles; PlayStation Consoles","false","true","","","false","false","false","false"
"City of Hopkins Curbside Recycling","City of Hopkins Curbside Recycling","11522 Minnetonka Blvd","Hopkins","Hennepin","MN","55305","9529391382","0","","http://www.hopkinsmn.com/","44.94624","-93.42667","5.83954080876191","Aluminum Cans; Book Recycling; Brown Paper Bags; Cardboard; Catalogs; Computer Paper; Dairy Tubs; Glass (Brown); Glass (Clear); Glass (Green); Magazines; Milk Cartons; Newspapers; Office Paper; Paper (Mixed); Paperboard; Phone books; Plastic #1 (PETE); Plastic #2 (HDPE); Plastic #3 (PVC); Plastic #4 (LDPE); Plastic #5 (Polypropylene); Plastic #6 (Polystyrene); Plastic #7; Plastic Bottle Caps; Tin or Steel Cans","false","false","","","true","false","false","false"
"Best Buy","Best Buy","8100 Old Carriage Ct ","Shakopee","Scott County","MN","55379","9522330387","0","","https://www.bestbuy.com/recycle","44.7782024","-93.4134216","5.84399355864472","Large Household Appliances; Refrigerators; Televisions; AC Power Plugs; Batteries (Rechargeable); Cables & Connectors; Car Audio/Video Equipment; Cell Phone Batteries; Cell Phones; Computer (Recycling); Hard Drives; Computer Monitors; Cameras; DVD Players/Blu-Ray Players/DVRs; Electronics; E-Readers; GPS Units; Headphones; Inkjet Printer Cartridges; Laptop Computers; Laser Toner Cartridges; Li-Ion Batteries; MP3 Players; Network Equipment; Ni-Cd Batteries; Ni-MH Batteries; Ni-Zn Batteries; Computer Peripherals; Portable Media Players; Printers/Scanners/Fax Machines; Small Electronics; Small Sealed Lead Acid Batteries; Stereo Equipment; Tablets; Telephones; UPS Batteries/Backup Systems; VCRs; Video Game Systems; Blu-Ray Players; Digital Converter Boxes; Small Televisions; Video Game Consoles; PlayStation Consoles","true","true","2 TVs per visit, 3 e-waste items per day; $25 fee for TVs and Monitors; $19.99 pick-up fee with delivery; $99.99 standalone pickup fee; ","Vizio, Sony, OEM","false","false","false","false"
"Best Buy","","8100 Old Carriage Ct","Shakopee","","MN","55379","9522330387","0","","https://www.bestbuy.com/site/services/recycling/pcmcat149900050025.c?id=pcmcat149900050025","44.7782024","-93.4134216","5.84399355864472","","false","false","","","false","false","false","false"
"The Salvation Army","null","5421 France Ave S ","Edina","Hennepin County","MN","55410","8007287825","0","","http://www.salvationarmyusa.org","44.904623","-93.3282675","5.86275902021271","Bikes; Books (Reuse); CD/DVD/Blu-ray/UHD discs; Cell Phones; Children's Toys; Clothing; Computer (Reuse); Hard Drives; Computer Monitors; Cameras; DVD Players/Blu-Ray Players/DVRs; Electronics; E-Readers; Furniture; Gift Bags; Headphones; Household Goods; Laptop Computers; Lawn Equipment; Miscellaneous Tools; MP3 Players; Musical Instruments; Network Equipment; Ornaments; Computer Peripherals; Portable Media Players; Printers/Scanners/Fax Machines; Reusable Appliance Donation; Small Appliances; Small Electronics; Small Televisions; Sporting Goods; Stereo Equipment; Tablets; Telephones; Televisions; VCRs; VHS & Cassette Tapes; Video Game Systems; Blu-Ray Players; Digital Converter Boxes; Computer (Recycling); Video Game Consoles; PlayStation Consoles","false","true","Call for Details","Vizio, Salvation Army, OEM, Sony","false","false","false","false"
"Target","Target","2555 W 79th St","Bloomington","Hennepin","MN","55431","9528887701","0","","http://www.target.com/","44.86132","-93.31192","5.86374223391826","Aluminum Cans; Cell Phones; Inkjet Printer Cartridges; MP3 Players; Plastic #1 (PETE); Plastic #2 (HDPE); Plastic Shopping Bags; Computer (Recycling); Computer Monitors; DVD Players/Blu-Ray Players/DVRs; Electronics; Laptop Computers; Computer Peripherals; Printers/Scanners/Fax Machines; Small Electronics; Small Televisions; Tablets; Televisions; VCRs; Video Game Consoles; PlayStation Consoles","false","true","","","false","false","false","false"
"The Salvation Army","null","3639 Quebec Ave S ","Minneapolis","Hennepin County","MN","55426","8007287825","0","","http://www.salvationarmyusa.org","44.9372944","-93.3765914","5.87133977105553","Bikes; Books (Reuse); CD/DVD/Blu-ray/UHD discs; Cell Phones; Children's Toys; Clothing; Computer (Reuse); Hard Drives; Computer Monitors; Cameras; DVD Players/Blu-Ray Players/DVRs; Electronics; E-Readers; Furniture; Gift Bags; Headphones; Household Goods; Laptop Computers; Lawn Equipment; Miscellaneous Tools; MP3 Players; Musical Instruments; Network Equipment; Ornaments; Computer Peripherals; Portable Media Players; Printers/Scanners/Fax Machines; Reusable Appliance Donation; Small Appliances; Small Electronics; Small Televisions; Sporting Goods; Stereo Equipment; Tablets; Telephones; Televisions; VCRs; VHS & Cassette Tapes; Video Game Systems; Blu-Ray Players; Digital Converter Boxes; Computer (Recycling); Video Game Consoles; PlayStation Consoles","false","true","Call for Details","Vizio, Salvation Army, OEM, Sony","false","false","false","false"
"Arrow Ace Hardware","","485 Marschall Rd","Shakopee","","MN","55379","9522335010","0","","https://www.arrowace.net/","44.7956127","-93.5068998","5.8737258892182","","false","false","","","false","false","false","false"
"Edina Service Center","Edina Service Center","5354 France Ave S","Edina","Hennepin","MN","55410","9529265110","0","","","44.90688","-93.32984","5.87748812946717","Used Motor Oil; Oil Filters; Computer (Recycling); Computer Monitors; DVD Players/Blu-Ray Players/DVRs; Electronics; Laptop Computers; Computer Peripherals; Printers/Scanners/Fax Machines; Small Electronics; Small Televisions; Tablets; Televisions; VCRs; Video Game Consoles; PlayStation Consoles","false","true","","","false","false","false","false"
"The Phoenix","The Phoenix","3715 Oregon Ave S Ste 1","Minneapolis","Hennepin","MN","55426","9529337284","0","","","44.93644","-93.37399","5.87900878559929","Used Motor Oil; Oil Filters; Computer (Recycling); Computer Monitors; DVD Players/Blu-Ray Players/DVRs; Electronics; Laptop Computers; Computer Peripherals; Printers/Scanners/Fax Machines; Small Electronics; Small Televisions; Tablets; Televisions; VCRs; Video Game Consoles; PlayStation Consoles","false","true","","","false","false","false","false"
"The Salvation Army","null","6855 Oxford St ","St Louis Park","Hennepin County","MN","55426","8007287825","0","","http://www.salvationarmyusa.org","44.9333694","-93.3664519","5.88543868650708","Bikes; Books (Reuse); CD/DVD/Blu-ray/UHD discs; Cell Phones; Children's Toys; Clothing; Computer (Reuse); Hard Drives; Computer Monitors; Cameras; DVD Players/Blu-Ray Players/DVRs; Electronics; E-Readers; Furniture; Gift Bags; Headphones; Household Goods; Laptop Computers; Lawn Equipment; Miscellaneous Tools; MP3 Players; Musical Instruments; Network Equipment; Ornaments; Computer Peripherals; Portable Media Players; Printers/Scanners/Fax Machines; Reusable Appliance Donation; Small Appliances; Small Electronics; Small Televisions; Sporting Goods; Stereo Equipment; Tablets; Telephones; Televisions; VCRs; VHS & Cassette Tapes; Video Game Systems; Blu-Ray Players; Digital Converter Boxes; Computer (Recycling); Video Game Consoles; PlayStation Consoles","false","true","Call for Details","Vizio, OEM, Salvation Army, Sony","false","false","false","false"
