name,description,address,city,region,province,postal_code,phone,fax,hours,url,latitude,longitude,distance,materials,pickup,dropoff,notes,groups,curbside,municipal,national,event_only
"Meadowlands Canister Site","","7722 Pine Road","Meadowlands","","MN","55765","2184272106","0","","https://www.stlouiscountymn.gov/departments-a-z/environmental-services/solid-waste-garbage/recycling","47.0736391","-92.6798916","10.3299177684516","","false","false","","","false","false","false","false"
"Fredenberg Community Center & Township Hall","Fredenberg Community Center & Township Hall","5104 Fish Lake Rd","Duluth","Saint Louis","MN","55803","2187213991","0","Wednesday: 5:00 PM - 8:00 PM Saturday: 9:00 AM - 1:00 PM ","null","46.97423","-92.2207","13.4147899773853","Newspapers; Tin or Steel Cans; Computer (Recycling); Computer Monitors; DVD Players/Blu-Ray Players/DVRs; Electronics; Laptop Computers; Computer Peripherals; Printers/Scanners/Fax Machines; Small Electronics; Small Televisions; Tablets; Televisions; VCRs; Video Game Consoles; PlayStation Consoles","false","true","","","false","false","false","false"
"WLSSD Rural Recycling Site - Art Welter Recycling Center","","6381 Lavaque Road","Duluth","","MN","55803","2187220761","0","","https://wlssd.com","46.9727165","-92.2192024","13.5308306131021","","false","false","","","false","false","false","false"
"WLSSD Rural Recycling Site - Grand Lake","","Canosia Road","Twig","","MN","55779","2187220761","0","","https://wlssd.com","46.8656507","-92.3647023","15.4181733472082","","false","false","","","false","false","false","false"
"Brookston Transfer Station","","8609 U.S. 2","Brookston","","MN","55711","2184535692","0","","https://www.stlouiscountymn.gov/departments-a-z/environmental-services/solid-waste-garbage/recycling","46.8511578","-92.5865321","16.8276581935992","","false","false","","","false","false","false","false"
"North Country Hardware","","6051 Rice Lake Rd","Duluth","","MN","55803","2187215400","0","","","46.9488411","-92.1562064","16.9221798031056","","false","false","","","false","false","false","false"
"WLSSD Rural Recycling Site - Canosia Town Hall","","4896 Midway Road","Duluth","","MN","55811","2187220761","0","","https://wlssd.com","46.8652022","-92.2799919","17.0485165729243","","false","false","","","false","false","false","false"
"Makinen Canister Site","","6327 Long Lake Rd","Makinen","","MN","55763","2187447577","0","","https://www.stlouiscountymn.gov/departments-a-z/environmental-services/solid-waste-garbage/recycling","47.3361807","-92.3477257","18.53847731518","","false","false","","","false","false","false","false"
"Comstock Lake Canister","","4649 Comstock Lake Road","Cotton","","MN","55724","8004509278","0","","https://www.stlouiscountymn.gov/departments-a-z/environmental-services/solid-waste-garbage/recycling","47.2609574","-92.1702619","18.5424645581776","","false","false","","","false","false","false","false"
"WLSSD Rural Recycling Site - Rice Lake Town Hall","","4107 West Beyer Road","Duluth","","MN","55803","2187220761","0","","https://wlssd.com","46.894607","-92.1538581","19.266554315213","","false","false","","","false","false","false","false"
"St. Louis County Environmental Services - Brookston Transfer Station","St. Louis County Environmental Services - Brookston Transfer Station","8609 Highway 2","Brookston","Saint Louis","MN","55711","2184535692","0","","http://www.co.st-louis.mn.us","46.85029","-92.69872","19.3885214557455","Electronics; MP3 Players; Computer (Recycling); Computer Monitors; DVD Players/Blu-Ray Players/DVRs; Laptop Computers; Computer Peripherals; Printers/Scanners/Fax Machines; Small Electronics; Small Televisions; Tablets; Televisions; VCRs; Video Game Consoles; PlayStation Consoles","false","true","","","false","false","false","false"
"Brookston Transfer Station","Brookston Transfer Station","8609 Highway 2","Brookston","Saint Louis","MN","55711","2184535692","0","Monday: 8:00 AM - 4:30 PM Tuesday: 8:00 AM - 4:30 PM Thursday: 8:00 AM - 4:30 PM Saturday: 8:00 AM - 4:30 PM ","http://www.stlouiscountymn.gov/","46.85029","-92.69872","19.3885214557455","Plastic #1 (PETE); Plastic #2 (HDPE); Plastic #2 (Color HDPE); Aluminum Cans; Antifreeze; Broken Asphalt/Aggregate; Glass (Blue); Brick(s); Glass (Brown); Brown Paper Bags; Brush; Lead Acid (Pb) Batteries; Cardboard; Carpet; Carpet Padding; Catalogs; Ceramic Tiles; Chipboard; Christmas Trees; Glass (Clear); Compact Fluorescent Lights; Computer Paper; Computer (Recycling); Concrete (Set); Ferrous Metals (Steel or Iron); Fluorescent Lamps/Tubes; Gift Boxes; Grass Clippings; Glass (Green); Greeting Cards; Drywall; Furniture; Inner Tubes; Large Household Appliances; Leaves; Linoleum; Magazines; Bed Mattresses; Needles / Medical Sharps; Clothes Hangers (Metal); Paper (Mixed); Newspapers; Non-ferrous (Copper/Brass/Tin); Wood Pallets; Paperboard; Phone books; Porcelain; Shingles; Stone; Televisions; Tin or Steel Cans; Tree Trimmings; Used Motor Oil; Oil Filters; Used Tires; Weeds; Office Paper; Wood","false","true","","","false","false","false","false"
"WLSSD Rural Recycling Site - Solway Town Hall","","4029 Munger Shaw Road","Cloquet","","MN","55720","2187220761","0","","https://wlssd.com","46.802499","-92.345752","19.857035684766","","false","false","","","false","false","false","false"
"Jackson County Rural Drop-off Site - Sioux Valley","","County Highway 4 & County Highway 9","Sioux Valley","","MN","56150","5078472240","0","","https://www.co.jackson.mn.us","46.8655635","-92.1530454","20.6780883647857","","false","false","","","false","false","false","false"
"Jackson County Rural Drop-off Site - Robertson County Park","","County Highway 4 & County Highway 9","Middletown","","MN","56143","5078472240","0","","https://www.co.jackson.mn.us","46.8655635","-92.1530454","20.6780883647857","","false","false","","","false","false","false","false"
"Western Lake Superior Sanitary District","null","4587 Ridgeview Rd ","Duluth","St Louis County","MN","55803","2187223336","0","","http://wlssd.com/","46.8514969","-92.1631317","21.0638951069302","Computer (Recycling); Computer Monitors; DVD Players/Blu-Ray Players/DVRs; Electronics; Laptop Computers; Computer Peripherals; Printers/Scanners/Fax Machines; Small Electronics; Small Televisions; Tablets; Televisions; VCRs; Video Game Consoles; PlayStation Consoles","false","true","","Sony, Vizio, OEM, OEM Indiv, OEM Municipal sites","false","false","false","false"
"St. Louis County Environmental Services - Lavell Canister Site","St. Louis County Environmental Services - Lavell Canister Site","3249 Highway 25","Iron","Saint Louis","MN","55751","2187499744","0","","http://www.co.st-louis.mn.us","47.33788","-92.69831","21.0817103053518","Electronics; MP3 Players; Computer (Recycling); Computer Monitors; DVD Players/Blu-Ray Players/DVRs; Laptop Computers; Computer Peripherals; Printers/Scanners/Fax Machines; Small Electronics; Small Televisions; Tablets; Televisions; VCRs; Video Game Consoles; PlayStation Consoles","false","true","","","false","false","false","false"
"Becker County Drop-Off Shed - Walworth","","County Highway 7 & County Highway 16","Walworth","","MN","56585","2188467310","0","","http://www.co.becker.mn.us/dept/environmental_services/","47.3718272","-92.60004","21.2629313693331","","false","false","","","false","false","false","false"
"WLSSD Materials Recovery Center","","4857 Ridgeview Road","Duluth","","MN","55811","2187220761","0","","https://wlssd.com","46.8516701","-92.1546472","21.3234248891939","","false","false","","","false","false","false","false"
"WLSSD Materials Recovery Center","WLSSD Materials Recovery Center","4587 Ridgeview Rd","Duluth","Saint Louis","MN","55803","2187220761","0","Tuesday: 10:00 AM - 3:00 PM Wednesday: 10:00 AM - 3:00 PM Thursday: 10:00 AM - 3:00 PM Friday: 10:00 AM - 3:00 PM Saturday: 10:00 AM - 3:00 PM ","http://www.wlssd.duluth.mn.us/garbage_mrc.php","46.85114","-92.15005","21.4974630444746","Plastic #1 (PETE); Plastic #2 (Color HDPE); Aluminum Cans; Broken Asphalt/Aggregate; Bikes; Brick(s); Glass (Brown); Brown Paper Bags; Brush; Cardboard; Carpet; Carpet Padding; Catalogs; Ceramic Tiles; Chipboard; Christmas Trees; Glass (Clear); Clothing; Computer Monitors; Computer Paper; Computer (Recycling); Concrete (Set); Construction Materials (Reuse); Electronics; Ferrous Metals (Steel or Iron); Gift Bags; Gift Boxes; Glass (Green); Greeting Cards; Drywall; Furniture; Household Goods; Inner Tubes; Large Household Appliances; Lawn Equipment; Linoleum; Magazines; Material Exchange; Bed Mattresses; Clothes Hangers (Metal); Paper (Mixed); Musical Instruments; Newspapers; Non-ferrous (Copper/Brass/Tin); Office Furniture; Office Equipment; Organic Waste; Ornaments; Wood Pallets; Paperboard; Phone books; Porcelain; Reusable Appliance Donation; Shingles; Sporting Goods; Stone; Telephones; Televisions; Tin or Steel Cans; Miscellaneous Tools; Children's Toys; Used Tires; Office Paper; Windows; Wood; Food Scraps; MP3 Players; Microwaves","false","true","Electronics, junk, appliances, brush, and construction materials are accepted for a fee.","","false","false","false","false"
"Goodwill Industries","Goodwill Industries","4883 Miller Trunk Hwy","Hermantown","Saint Louis","MN","55811","2187270001","0","Monday: 9:00 AM - 6:00 PM Tuesday: 9:00 AM - 6:00 PM Wednesday: 9:00 AM - 6:00 PM Thursday: 9:00 AM - 6:00 PM Friday: 9:00 AM - 6:00 PM Saturday: 9:00 AM - 6:00 PM ","","46.82552","-92.19233","21.603342044677","Bikes; Books (Reuse); CD/DVD/Blu-ray/UHD discs; Children's Toys; Clothing; Furniture; Household Goods; Lawn Equipment; Medical Equipment; Ornaments; Reusable Appliance Donation; Shoes; Sporting Goods; Computer (Recycling); Computer Monitors; DVD Players/Blu-Ray Players/DVRs; Electronics; Laptop Computers; Computer Peripherals; Printers/Scanners/Fax Machines; Small Electronics; Small Televisions; Tablets; Televisions; VCRs; Video Game Consoles; PlayStation Consoles","false","true","This site accepts items in reusable condition.","","false","false","false","false"
"HobbyTown","HobbyTown","4879 Miller Trunk Hwy","Hermantown","St. Louis ","MN","55811-3757","2187237114","0","","","46.8255232972647","-92.1920148077517","21.6118625476027","Batteries (Rechargeable); Cell Phone Batteries; Cell Phones; Li-Ion Batteries; Ni-Cd Batteries; Ni-MH Batteries; Small Sealed Lead Acid Batteries","false","true","Call or Check Online for Hours","Call2Recycle","false","false","false","false"
"L & M Supply","L & M Supply","620 Highway 33 S","Cloquet","Carlton","MN","55720","2188798723","0","Monday: 7:30 AM - 8:30 PM Tuesday: 7:30 AM - 8:30 PM Wednesday: 7:30 AM - 8:30 PM Thursday: 7:30 AM - 8:30 PM Friday: 7:30 AM - 8:30 PM Saturday: 7:30 AM - 7:00 PM Sunday: 9:00 AM - 5:00 PM ","http://www.landmsupply.com/","46.76554","-92.45126","21.6630583625951","Cell Phones; Ni-Cd Batteries; Li-Ion Batteries; Ni-MH Batteries; Ni-Zn Batteries; Small Sealed Lead Acid Batteries; Computer (Recycling); Computer Monitors; DVD Players/Blu-Ray Players/DVRs; Electronics; Laptop Computers; Computer Peripherals; Printers/Scanners/Fax Machines; Small Electronics; Small Televisions; Tablets; Televisions; VCRs; Video Game Consoles; PlayStation Consoles; Batteries (Rechargeable); Cell Phone Batteries; Li-Ion Batteries; Ni-Cd Batteries; Ni-MH Batteries; Small Sealed Lead Acid Batteries; Cell Phones","false","true","The U.S. EPA estimates that more than 350 million rechargeable batteries are purchased annually in the U.S. Thanks to the environmental commitment of this location, its easy and free to recycle your batteries. Bring your rechargeable batteries to this location and look for the recycling box or ask an associate how you can do your part for the environment.","Call2Recycle","false","false","false","false"
"Midway Lumber Specialties","","3850 Old Midway Rd","Hermantown","","MN","55810","2187298960","0","","","46.7901844","-92.2798461","21.6995427095344","","false","false","","","false","false","false","false"
"Essentia Health Pharmacy","","4855 W Arrowhead Rd Ste A","Hermantown","","MN","55811","2187864265","0","","https://www.essentiahealth.org","46.822908","-92.1915342","21.7719309708807","","false","false","","","false","false","false","false"
"Hermantown Police Department","","5111 Maple Grove Road","Hermantown","","MN","55811","2187291200","0","","https://www.pca.state.mn.us/living-green/managing-unwanted-medications","46.8090519","-92.2196624","21.8392244240197","","false","false","","","false","false","false","false"
"Hermantown Amoco","Hermantown Amoco","4803 Miller Trunk Hwy","Hermantown","Saint Louis","MN","55811","2187223330","0","","","46.82273","-92.18774","21.886630085397","Used Motor Oil; Oil Filters; Computer (Recycling); Computer Monitors; DVD Players/Blu-Ray Players/DVRs; Electronics; Laptop Computers; Computer Peripherals; Printers/Scanners/Fax Machines; Small Electronics; Small Televisions; Tablets; Televisions; VCRs; Video Game Consoles; PlayStation Consoles","false","true","","","false","false","false","false"
"Batteries Plus Bulbs","","4769 Miller Trunk Hwy","Hermantown","","MN","55811","2187231363","0","","https://www.batteriesplus.com/store-locator/mn/034?utm_source=local&utm_medium=earth911","46.820492","-92.1833347","22.1341347615749","","false","false","","","false","false","false","false"
"Batteries Plus","Batteries Plus","4769 Miller Trunk Hwy","Hermantown","Saint Louis","MN","55811","2187231363","2187238139","","http://www.batteriesplus.com/store_details/034.aspx","46.81964","-92.18272","22.1988234811859","Compact Fluorescent Lights; Batteries (Rechargeable); Alkaline/Single-Use Batteries; Computer (Recycling); Computer Monitors; DVD Players/Blu-Ray Players/DVRs; Electronics; Laptop Computers; Computer Peripherals; Printers/Scanners/Fax Machines; Small Electronics; Small Televisions; Tablets; Televisions; VCRs; Video Game Consoles; PlayStation Consoles","false","true","Some fees for battery recycling may apply.  Please contact your Local store for details. 
<p>
Batteries Plus lead by example by recycling the majority of the batteries we sell. Not only do we recycle to protect our environment, we support retail and business customers alike by keeping them in full compliance with federal, state, municipal, EPA and DOT regulations governing the disposal and recycling of spent batteries and select electronics.","","false","false","false","false"
"Walmart Supercenter","","4740 Mall Dr","Hermantown","","MN","55811","2187271310","0","","https://www.walmart.com/","46.8173756","-92.1839959","22.2902151425641","","false","false","","","false","false","false","false"
"WLSSD Rural Recycling Site - North Star Fire Hall","","7700 Pequaywan Lake Rd","Duluth","","MN","55803","2187220761","0","","https://wlssd.com","47.0710486","-91.9831294","22.4680444111085","","false","false","","","false","false","false","false"
"Sams Club","","4743 Maple Grove Rd","Hermantown","","MN","55811","2187229740","0","","https://www.samsclub.com/","46.8097497","-92.1790001","22.8562089569606","","false","false","","","false","false","false","false"
"Sam's Club","Sam's Club","4743 Maple Grove Rd","Hermantown","Saint Louis","MN","55811","2187229740","0","","http://www.samsclub.com","46.80771","-92.17912","22.9679387992272","Lead Acid (Pb) Batteries; Computer (Recycling); Computer Monitors; DVD Players/Blu-Ray Players/DVRs; Electronics; Laptop Computers; Computer Peripherals; Printers/Scanners/Fax Machines; Small Electronics; Small Televisions; Tablets; Televisions; VCRs; Video Game Consoles; PlayStation Consoles","false","true","","","false","false","false","false"
"Kohl's","","2115 Miller Trunk Highway","Duluth","","MN","55811","2187229699","0","","https://corporate.kohls.com/","46.8124808","-92.1678964","23.0128955608637","","false","false","","","false","false","false","false"
"Best Buy","Best Buy","5105 Burning Tree Rd ","Duluth","St Louis County","MN","55811","2187228767","0","","https://www.bestbuy.com/recycle","46.8087094","-92.1699273","23.1654175166232","Large Household Appliances; Refrigerators; Televisions; AC Power Plugs; Batteries (Rechargeable); Cables & Connectors; Car Audio/Video Equipment; Cell Phone Batteries; Cell Phones; Computer (Recycling); Hard Drives; Computer Monitors; Cameras; DVD Players/Blu-Ray Players/DVRs; Electronics; E-Readers; GPS Units; Headphones; Inkjet Printer Cartridges; Laptop Computers; Laser Toner Cartridges; Li-Ion Batteries; MP3 Players; Network Equipment; Ni-Cd Batteries; Ni-MH Batteries; Ni-Zn Batteries; Computer Peripherals; Portable Media Players; Printers/Scanners/Fax Machines; Small Electronics; Small Sealed Lead Acid Batteries; Stereo Equipment; Tablets; Telephones; UPS Batteries/Backup Systems; VCRs; Video Game Systems; Blu-Ray Players; Digital Converter Boxes; Small Televisions; Video Game Consoles; PlayStation Consoles","true","true","2 TVs per visit, 3 e-waste items per day; $25 fee for TVs and Monitors; $19.99 pick-up fee with delivery; $99.99 standalone pickup fee; ","Sony, Vizio, OEM","false","false","false","false"
"Best Buy","","5105 Burning Tree Rd","Duluth","","MN","55811","2187228767","0","","https://www.bestbuy.com/site/services/recycling/pcmcat149900050025.c?id=pcmcat149900050025","46.8087094","-92.1699273","23.1654175166232","","false","false","","","false","false","false","false"
"Target","Target","1902 Miller Trunk Hwy","Duluth","Saint Louis","MN","55811","2187278851","0","","http://www.target.com/","46.8102","-92.16697","23.165451875128","Aluminum Cans; Cell Phones; Inkjet Printer Cartridges; MP3 Players; Plastic #1 (PETE); Plastic #2 (HDPE); Plastic Shopping Bags; Computer (Recycling); Computer Monitors; DVD Players/Blu-Ray Players/DVRs; Electronics; Laptop Computers; Computer Peripherals; Printers/Scanners/Fax Machines; Small Electronics; Small Televisions; Tablets; Televisions; VCRs; Video Game Consoles; PlayStation Consoles","false","true","","","false","false","false","false"
"AT&T Wireless","AT&T Wireless","2520 Maple Grove Rd","Duluth","Saint Louis","MN","55811","2183363639","0","","http://www.att.com/","46.80748","-92.17091","23.2067297871909","Cell Phones; Ni-Cd Batteries; Batteries (Rechargeable); Cell Phone Batteries; Tablets; Li-Ion Batteries; Computer (Recycling); Computer Monitors; DVD Players/Blu-Ray Players/DVRs; Electronics; Laptop Computers; Computer Peripherals; Printers/Scanners/Fax Machines; Small Electronics; Small Televisions; Televisions; VCRs; Video Game Consoles; PlayStation Consoles","false","true","Receive an AT&T Promotion Card worth the trade-in value of your smartphone, tablet, or netbook. You can also donate the trade-in value to Cell Phones for Soldiers.","","false","false","false","false"
"Holmes Recycling Svcs Inc","Holmes Recycling Svcs Inc","8688 Highway 37","Iron","Saint Louis","MN","55751","2187442400","0","Monday: 8:30 AM - 4:30 PM Tuesday: 8:30 AM - 4:30 PM Wednesday: 8:30 AM - 4:30 PM Thursday: 8:30 AM - 4:30 PM Friday: 8:30 AM - 4:30 PM ","http://www.holmesrecycling.com","47.40161","-92.59945","23.2209754864743","Aluminum; Car; Ferrous Metals (Steel or Iron); Large Household Appliances; Non-ferrous (Copper/Brass/Tin); Scrap Metal; Computer (Recycling); Computer Monitors; DVD Players/Blu-Ray Players/DVRs; Electronics; Laptop Computers; Computer Peripherals; Printers/Scanners/Fax Machines; Small Electronics; Small Televisions; Tablets; Televisions; VCRs; Video Game Consoles; PlayStation Consoles","false","true","","","false","false","false","false"
"Target Store","","1902 Miller Trunk Hwy","Duluth","","MN","55811","2187278851","0","","https://corporate.target.com/corporate-responsibility/planet","46.8087506","-92.1678121","23.2222925201392","","false","false","","","false","false","false","false"
"Holmes Recycling Svcs Inc","","8688 Minnesota 37","Iron Junction","","MN","55751","2187442400","0","","http://holmesrecycling.com/","47.4015372","-92.6000297","23.2237982120235","","false","false","","","false","false","false","false"
"Savers","","1740 Mall Dr","Duluth","","MN","55811","2187221894","0","","https://www.savers.com/donate/what-we-take","46.8070046","-92.1680881","23.3118313638241","","false","false","","","false","false","false","false"
"Verizon Wireless","Verizon Wireless","2116 Maple Grove Rd","Duluth","Saint Louis","MN","55811","8666444532","0","","http://www.verizonwireless.com/","46.80747","-92.16529","23.3642976729027","Cell Phones; Cell Phone Batteries; Computer (Recycling); Computer Monitors; DVD Players/Blu-Ray Players/DVRs; Electronics; Laptop Computers; Computer Peripherals; Printers/Scanners/Fax Machines; Small Electronics; Small Televisions; Tablets; Televisions; VCRs; Video Game Consoles; PlayStation Consoles","false","true","<A Href="https://www.trade-in.vzw.com/home.aspx">
The Verizon Wireless Trade-In Program</A> allows you to trade in your used handset or tablet in a convenient and responsible way. 
<P>
<P>
Verizon Wireless works every day to protect our environment and give our customers opportunities to do the same. <A Href="http://aboutus.vzw.com/Green_Initiative/overview.html">Click here</A> for more examples of the earth-friendly initiatives and programs Verizon Wireless is proud to offer and support.","","false","false","false","false"
"Cartridge World","","2216 Mountain Shadow Drive","Duluth","","MN","55811","2187204465","0","","","46.8047319","-92.1680878","23.4387849807758","","false","false","","","false","false","false","false"
"Computer Renaissance","Computer Renaissance","2208 Mountain Shadow Dr ","Duluth","St Louis County","MN","55811","2187270040","0","Monday: 9:00 AM - 7:00 PM Tuesday: 9:00 AM - 7:00 PM Wednesday: 9:00 AM - 7:00 PM Thursday: 9:00 AM - 7:00 PM Friday: 9:00 AM - 7:00 PM Saturday: 10:00 AM - 5:00 PM Sunday: 12:00 PM - 5:00 PM ","http://www.compren.com","46.8049322","-92.1644118","23.5300853844736","Computer (Reuse); Computer Monitors; Computer (Recycling); Electronics; MP3 Players; DVD Players/Blu-Ray Players/DVRs; Laptop Computers; Computer Peripherals; Printers/Scanners/Fax Machines; Small Electronics; Small Televisions; Tablets; Televisions; VCRs; Video Game Consoles; PlayStation Consoles","true","true","This site will make pick-up arrangements under the proper circumstances.  Please contact the site for additional information.","","false","false","false","false"
"Computer Renaissance","","2208 Moutain Shadow Drive","Duluth","","MN","55811","2187270040","0","","http://compren.com/","46.8048976","-92.1644364","23.5313233247101","","false","false","","","false","false","false","false"
"AT&T Wireless","AT&T Wireless","1600 Miller Trunk Hwy","Duluth","Saint Louis","MN","55811","2187339059","0","","http://www.att.com/","46.80676","-92.16044","23.5405906931062","Cell Phones; Ni-Cd Batteries; Batteries (Rechargeable); Cell Phone Batteries; Tablets; Li-Ion Batteries; Computer (Recycling); Computer Monitors; DVD Players/Blu-Ray Players/DVRs; Electronics; Laptop Computers; Computer Peripherals; Printers/Scanners/Fax Machines; Small Electronics; Small Televisions; Televisions; VCRs; Video Game Consoles; PlayStation Consoles","false","true","Receive an AT&T Promotion Card worth the trade-in value of your smartphone, tablet, or netbook. You can also donate the trade-in value to Cell Phones for Soldiers.","","false","false","false","false"
"Miller Hill Mall 1","Miller Hill Mall 1","1600 Miller Trunk Hwy","Duluth","Saint Louis","MN","55811","8583244111","0","","http://www.ecoatm.com/","46.80676","-92.16044","23.5405906931062","Cell Phones; Tablets; MP3 Players; Computer (Recycling); Computer Monitors; DVD Players/Blu-Ray Players/DVRs; Electronics; Laptop Computers; Computer Peripherals; Printers/Scanners/Fax Machines; Small Electronics; Small Televisions; Televisions; VCRs; Video Game Consoles; PlayStation Consoles","false","true","ecoATM is an automated, consumer self-serve kiosk that quickly buys back and recycles old phones, mp3 players and tablets.
</br>
Call or email <a href="mailto:max@ecoATM.com">customer support</a> with questions.","","false","false","false","false"
"JCPenney","","1600 Miller Trunk Hwy","Duluth","","MN","55811","2187278111","0","","https://www.jcpenney.com/","46.8045472","-92.1599383","23.6772710870972","","false","false","","","false","false","false","false"
"Best Buy Mobile","null","5105 Burning Tree Rd","Duluth","","MN","55811","2187228767","0","","https://www.bestbuy.com/site/services/recycling/pcmcat149900050025.c?id=pcmcat149900050025","46.8045472","-92.1599383","23.6772710870972","","false","false","","","false","false","false","false"
"Verizon Wireless","Verizon Wireless","1600 Miller Trunk Hwy ","Duluth","St Louis County","MN","55811","2182791900","2187271006","","http://www.verizonwireless.com/","46.804569","-92.159865","23.6781336160639","Cell Phones; Cell Phone Batteries; Computer (Recycling); Computer Monitors; DVD Players/Blu-Ray Players/DVRs; Electronics; Laptop Computers; Computer Peripherals; Printers/Scanners/Fax Machines; Small Electronics; Small Televisions; Tablets; Televisions; VCRs; Video Game Consoles; PlayStation Consoles","false","true","<A Href="https://www.trade-in.vzw.com/home.aspx">
The Verizon Wireless Trade-In Program</A> allows you to trade in your used handset or tablet in a convenient and responsible way. 
<P>
<P>
Verizon Wireless works every day to protect our environment and give our customers opportunities to do the same. <A Href="http://aboutus.vzw.com/Green_Initiative/overview.html">Click here</A> for more examples of the earth-friendly initiatives and programs Verizon Wireless is proud to offer and support.","","false","false","false","false"
"Firestone Complete Auto Care","","Miller Hill Mall","Duluth","","MN","55811","2187272963","0","","https://www.firestonecompleteautocare.com/","46.8042878","-92.1597824","23.69604942716","","false","false","","","false","false","false","false"
