name,description,address,city,region,province,postal_code,phone,fax,hours,url,latitude,longitude,distance,materials,pickup,dropoff,notes,groups,curbside,municipal,national,event_only
"Target","Target","150 W 100th Ave","Anchorage","Anchorage","AK","99515","9072677500","0","","http://www.target.com/","61.12847","-149.8822","1.11582851020324","Aluminum Cans; Cell Phones; Inkjet Printer Cartridges; MP3 Players; Plastic #1 (PETE); Plastic #2 (HDPE); Plastic Shopping Bags; Video Game Consoles; PlayStation Consoles","false","true","","","false","false","false","false"
"Target Store","","150 W 100th Ave","Anchorage","","AK","99515","9072677500","0","","https://corporate.target.com/corporate-responsibility/planet","61.1294994","-149.8804308","1.20822954192583","","false","false","","","false","false","false","false"
"City of Anchorage Recycling Drop-Off Location - Mears Middle School","","2700 W 100th Ave","Anchorage","","AK","99515","9073436262","0","","http://www.muni.org/departments/sws/pages/default.aspx","61.1289452","-149.9312726","1.26104606575034","","false","false","","","false","false","false","false"
"Lowe's","","10900 Old Seward Hwy","Anchorage","","AK","99515","9073498889","0","","https://newsroom.lowes.com/responsibility/operational-excellence/","61.1215548","-149.8658012","1.3291254710675","","false","false","","","false","false","false","false"
"Total Reclaim","Total Reclaim","12101 Industry Way Ste C4","Anchorage","Anchorage","AK","99515","9075610544","0","Monday: 8:00 AM - 4:30 PM Tuesday: 8:00 AM - 4:30 PM Wednesday: 8:00 AM - 4:30 PM Thursday: 8:00 AM - 4:30 PM Friday: 8:00 AM - 4:30 PM ","http://www.totalreclaim.com/alaska.html","61.11129","-149.86073","1.48750061760295","Lead Acid (Pb) Batteries; Computer (Reuse); Electronics; Fluorescent Lamps/Tubes; Large Household Appliances; Ni-Cd Batteries; Batteries (Rechargeable); Alkaline/Single-Use Batteries; Video Game Consoles; PlayStation Consoles","true","true","Total Reclaim offers recycling kits for fluorescent lamps and other materials, but does not accept PCB ballasts at the Anchorage location. Contact Total Reclaim in Anchorage for more information.","","false","false","false","false"
"Total Reclaim","","12101 Industry Way, Unit C4","Anchorage","","AK","99515","9075610544","0","","https://www.totalreclaim.com/","61.1113221","-149.86063","1.49023794250097","","false","false","","","false","false","false","false"
"Schnitzer Steel","","9705 King St","Anchorage","","AK","99515","9073494833","0","","http://www.schnitzersteel.com","61.1327371","-149.8752544","1.49046635805593","","false","false","","","false","false","false","false"
"Schnitzer Alaska","","9705 King Street","Anchorage","","AK","99515","9073494833","0","","http://www.schnitzersteel.com/","61.1327371","-149.8752544","1.49046635805593","","false","false","","","false","false","false","false"
"USPS Post Office Box Lobby Recycling Program","US Post Office","1221 Huffman Park Dr","Anchorage","Anchorage","AK","99511","8002758777","0","","https://www.usps.com/","61.11024","-149.86107","1.49502897554668","Catalogs; Greeting Cards; Magazines; Paper (Mixed)","false","true","","","false","false","false","false"
"US Post Office","USPS Discarded Lobby Mail Recycling Program","1221 Huffman Park Dr","Anchorage","Anchorage","AK","99511","0","0","","","61.11024","-149.86107","1.49502897554668","Video Game Consoles; PlayStation Consoles","false","true","","","false","false","false","false"
"Alaska Metal Recycling","Alaska Metal Recycling","9705 King St","Anchorage","Anchorage","AK","99515","9073494833","0","Monday: 8:00 AM - 4:00 PM Tuesday: 8:00 AM - 4:00 PM Wednesday: 8:00 AM - 4:00 PM Thursday: 8:00 AM - 4:00 PM Friday: 8:00 AM - 4:00 PM ","http://www.schnitzersteel.com/","61.13294","-149.87522","1.50193333765311","Aerosol Spray Cans; Aluminum Cans; Car; Automobile Parts; Bikes; Ferrous Metals (Steel or Iron); Large Household Appliances; Lawn Equipment; Clothes Hangers (Metal); Non-ferrous (Copper/Brass/Tin); Propane Tanks; Tin or Steel Cans; Car Donation; Video Game Consoles; PlayStation Consoles","true","true","This site requires special preparation of white goods and auto bodies before drop-off.  Please call ahead for further information.","","false","false","false","false"
"Schnitzer Alaska","Schnitzer Alaska","9705 King St","Anchorage","Anchorage","AK","99515","9073494833","9073449907","Monday: 8:00 AM - 4:00 PM Tuesday: 8:00 AM - 4:00 PM Wednesday: 8:00 AM - 4:00 PM Thursday: 8:00 AM - 4:00 PM Friday: 8:00 AM - 4:00 PM ","http://www.schn.com","61.13294","-149.87522","1.50193333765311","Car; Ferrous Metals (Steel or Iron); Non-ferrous (Copper/Brass/Tin); Video Game Consoles; PlayStation Consoles","false","true","","","false","false","false","false"
"The UPS Store","The UPS Store","1120 Huffman Rd Ste 24","Anchorage","Anchorage","AK","99515","9073457311","0","Monday: 9:00 AM - 7:00 PM Tuesday: 9:00 AM - 7:00 PM Wednesday: 9:00 AM - 7:00 PM Thursday: 9:00 AM - 7:00 PM Friday: 9:00 AM - 7:00 PM Saturday: 9:00 AM - 5:00 PM ","http://www.upsstore.com","61.10813","-149.86164","1.52431265495693","Packing Materials; Packing Peanut (Reuse); Video Game Consoles; PlayStation Consoles","false","true","","","false","false","false","false"
"US Post Office","US Post Office","1221 Huffman Park Dr","Anchorage","Anchorage","AK","99515","0","0","","https://www.usps.com/ship/recycle-through-usps.htm","61.11024","-149.85942","1.54799969518022","Inkjet Printer Cartridges; Video Game Consoles; PlayStation Consoles","false","true","Free, postage-paid Mail Back envelopes can be found on display in the lobby. There is no limit to the number of envelopes customers may take. The contents of the envelope must weigh less than 13 ounces and the envelope must be able to seal completely. For more details visit<a href="http://www.maxback.com/mxb-postoffice-collaboration" target="_blank">MaxBack</a>.","","false","false","false","false"
"City of Anchorage Christmas Tree Drop-Off Event","","1501 Huffman Rd","Anchorage","","AK","99515","9078688899","0","","http://www.muni.org/departments/sws/pages/default.aspx","61.1096597","-149.8538031","1.73940164768481","","false","false","","","false","false","false","false"
"City of Anchorage Recycling Drop-Off Location - Carrs Huffman Road","","1501 Huffman Rd","Anchorage","","AK","99515","9073436262","0","","http://www.muni.org/departments/sws/pages/default.aspx","61.1096597","-149.8538031","1.73940164768481","","false","false","","","false","false","false","false"
"Safeway","","1501 Huffman Rd","Anchorage","","AK","99515","9073391300","0","","https://shop.safeway.com/home.html","61.1096597","-149.8538031","1.73940164768481","","false","false","","","false","false","false","false"
"Walmart Supercenter","","8900 Old Seward Hwy","Anchorage","","AK","99515","9073445300","0","","https://www.walmart.com/","61.1402087","-149.8698771","2.01004370415497","","false","false","","","false","false","false","false"
"Walmart","Walmart","8900 Old Seward Hwy","Anchorage","Anchorage","AK","99515","9073445300","0","","http://www.walmart.com","61.14026","-149.86876","2.03432572137227","Lead Acid (Pb) Batteries; Plastic Shopping Bags; Food Storage Bags; Video Game Consoles; PlayStation Consoles","false","true","","","false","false","false","false"
"O'Reilly Auto Parts","","8920 Old Seward Hwy","Anchorage","","AK","99515","9075229712","0","","http://oreillyauto.custhelp.com/app/error/error_id/6","61.1400638","-149.8650927","2.0969292033824","","false","false","","","false","false","false","false"
"The UPS Store","The UPS Store","205 E Dimond Blvd","Anchorage","Anchorage","AK","99515","9073441211","0","Monday: 9:00 AM - 7:00 PM Tuesday: 9:00 AM - 7:00 PM Wednesday: 9:00 AM - 7:00 PM Thursday: 9:00 AM - 7:00 PM Friday: 9:00 AM - 7:00 PM Saturday: 9:00 AM - 5:00 PM ","http://www.theupsstore.com","61.14481","-149.87863","2.14751128629601","Packing Materials; Packing Peanut (Reuse); Video Game Consoles; PlayStation Consoles","false","true","","","false","false","false","false"
"City of Anchorage Christmas Tree Drop-Off Event","","4000 W Dimond Blvd","Anchorage","","AK","99502","9078688899","0","","http://www.muni.org/departments/sws/pages/default.aspx","61.1363191","-149.953594","2.15580840784495","","false","false","","","false","false","false","false"
"City of Anchorage Recycling Drop-Off Location - Carrs Jewel Lake","","4000 W Dimond Blvd","Anchorage","","AK","99502","9073436262","0","","http://www.muni.org/departments/sws/pages/default.aspx","61.1363191","-149.953594","2.15580840784495","","false","false","","","false","false","false","false"
"Safeway","","4000 West Dimond Boulevard","Anchorage","","AK","99502","9073391200","0","","https://shop.safeway.com/home.html","61.1363191","-149.953594","2.15580840784495","","false","false","","","false","false","false","false"
"Sam's Club","Sam's Club","8801 Old Seward Hwy","Anchorage","Anchorage","AK","99515","9075222333","0","Monday: 10:00 AM - 8:30 PM Tuesday: 10:00 AM - 8:30 PM Wednesday: 10:00 AM - 8:30 PM Thursday: 10:00 AM - 8:30 PM Friday: 10:00 AM - 8:30 PM Saturday: 9:00 AM - 8:30 PM Sunday: 10:00 AM - 6:00 PM ","http://www.samsclub.com","61.1406","-149.8632","2.16531431333084","Lead Acid (Pb) Batteries; Video Game Consoles; PlayStation Consoles","false","true","","","false","false","false","false"
"AT&T Wireless","AT&T Wireless","800 E Dimond Blvd","Anchorage","Anchorage","AK","99515","9073363040","0","Monday: 10:00 AM - 9:00 PM Tuesday: 10:00 AM - 9:00 PM Wednesday: 10:00 AM - 9:00 PM Thursday: 10:00 AM - 9:00 PM Friday: 10:00 AM - 9:00 PM Saturday: 10:00 AM - 9:00 PM Sunday: 12:00 PM - 7:00 PM ","http://www.att.com/","61.14181","-149.86513","2.19206080320124","Cell Phones; Ni-Cd Batteries; Batteries (Rechargeable); Cell Phone Batteries; Tablets; Li-Ion Batteries; Video Game Consoles; PlayStation Consoles","false","true","Receive an AT&T Promotion Card worth the trade-in value of your smartphone, tablet, or netbook. You can also donate the trade-in value to Cell Phones for Soldiers.","","false","false","false","false"
"Best Buy","Best Buy","800 E Dimond Blvd ","Anchorage","Anchorage","AK","99515","9073444409","0","","https://www.bestbuy.com/recycle","61.1433707","-149.8685129","2.21736600663202","Large Household Appliances; Refrigerators; Televisions; AC Power Plugs; Batteries (Rechargeable); Cables & Connectors; Car Audio/Video Equipment; Cell Phone Batteries; Cell Phones; Computer (Recycling); Hard Drives; Computer Monitors; Cameras; DVD Players/Blu-Ray Players/DVRs; Electronics; E-Readers; GPS Units; Headphones; Inkjet Printer Cartridges; Laptop Computers; Laser Toner Cartridges; Li-Ion Batteries; MP3 Players; Network Equipment; Ni-Cd Batteries; Ni-MH Batteries; Ni-Zn Batteries; Computer Peripherals; Portable Media Players; Printers/Scanners/Fax Machines; Small Electronics; Small Sealed Lead Acid Batteries; Stereo Equipment; Tablets; Telephones; UPS Batteries/Backup Systems; VCRs; Video Game Systems; Blu-Ray Players; Digital Converter Boxes; Small Televisions; Video Game Consoles; PlayStation Consoles","true","true","2 TVs per visit, 3 e-waste items per day; $25 fee for TVs and Monitors; $19.99 pick-up fee with delivery; $99.99 standalone pickup fee; ","Sony, Vizio, OEM","false","false","false","false"
"Best Buy","null","800 E Dimond Blvd","Anchorage","","AK","99515","9073444409","0","","https://www.bestbuy.com/site/services/recycling/pcmcat149900050025.c?id=pcmcat149900050025","61.1433707","-149.8685129","2.21736600663202","","false","false","","","false","false","false","false"
"OfficeMax","OfficeMax","8701 Old Seward Hwy","Anchorage","Anchorage","AK","99515","9075223080","0","Monday: 8:00 AM - 9:00 PM Tuesday: 8:00 AM - 9:00 PM Wednesday: 8:00 AM - 9:00 PM Thursday: 8:00 AM - 9:00 PM Friday: 8:00 AM - 9:00 PM Saturday: 9:00 AM - 9:00 PM Sunday: 10:00 AM - 7:00 PM ","http://www.officemax.com","61.1417","-149.86321","2.22462885706504","Inkjet Printer Cartridges; Laser Toner Cartridges; Video Game Consoles; PlayStation Consoles","false","true","","","false","false","false","false"
"Value Village","","501 W Dimond Blvd","Anchorage","","AK","99515","9075229090","0","","https://www.valuevillage.com/donate/what-we-take","61.1449153","-149.8723565","2.24496391387313","","false","false","","","false","false","false","false"
"Sams Club","","8801 Old Seward Hwy","Anchorage","","AK","99515","9075222333","0","","https://www.samsclub.com/","61.1409415","-149.8586138","2.28239194578524","","false","false","","","false","false","false","false"
"Salvation Army","Salvation Army","501 E Dimond Blvd","Anchorage","Anchorage","AK","99515","9073441053","0","Monday: 9:00 AM - 8:00 PM Tuesday: 9:00 AM - 8:00 PM Wednesday: 9:00 AM - 8:00 PM Thursday: 9:00 AM - 8:00 PM Friday: 9:00 AM - 8:00 PM Saturday: 9:00 AM - 8:00 PM ","http://www.salvationarmy.org","61.1455","-149.87216","2.283711860404","Bikes; Books (Reuse); Cell Phones; Clothing; CD/DVD/Blu-ray/UHD discs; Computer (Reuse); Computer Monitors; Electronics; Gift Bags; Eyeglasses; Furniture; Household Goods; Bed Mattresses; Musical Instruments; Office Furniture; Office Equipment; Ornaments; Reusable Appliance Donation; Sporting Goods; Telephones; Televisions; Miscellaneous Tools; Children's Toys; Car Donation; VHS & Cassette Tapes; Small Appliances; MP3 Players; Video Game Consoles; PlayStation Consoles","false","true","This site only accepts new or gently used items that are in good working condition.","Sony","false","false","false","false"
"Value Village","Value Village","501 E Dimond Blvd","Anchorage","Anchorage","AK","99515","9075229090","0","","http://www.valuevillage.com","61.1455","-149.87216","2.283711860404","Bikes; Book Recycling; Clothing; CD/DVD/Blu-ray/UHD discs; Furniture; Household Goods; Magazines; Office Furniture; Sporting Goods; Children's Toys; VHS & Cassette Tapes; Small Appliances; Textiles; Shoes; Arts & Crafts Supplies (Reuse); Bags & Belts; VCRs; DVD Players/Blu-Ray Players/DVRs; Exercise Equipment; Small Electronics; Video Game Consoles; PlayStation Consoles","false","true","","","false","false","false","false"
"OfficeMax","","8701 Old Seward Hwy","Anchorage","","AK","99515","9075223080","0","","","61.1416598","-149.8594884","2.30071358672997","","false","false","","","false","false","false","false"
"USPS Post Office Box Lobby Recycling Program","US Post Office","2200 Strawberry Rd","Anchorage","Anchorage","AK","99522","8002758777","0","","https://www.usps.com/","61.15183","-149.91946","2.51027002873751","Catalogs; Greeting Cards; Magazines; Paper (Mixed)","false","true","","","false","false","false","false"
"US Post Office","USPS Discarded Lobby Mail Recycling Program","2200 Strawberry Rd","Anchorage","Anchorage","AK","99522","0","0","","","61.15183","-149.91946","2.51027002873751","Video Game Consoles; PlayStation Consoles","false","true","","","false","false","false","false"
"Home Depot","Home Depot","1715 Abbott Rd","Anchorage","Anchorage","AK","99507","9076445646","0","Monday: 6:00 AM - 10:00 PM Tuesday: 6:00 AM - 10:00 PM Wednesday: 6:00 AM - 10:00 PM Thursday: 6:00 AM - 10:00 PM Friday: 6:00 AM - 10:00 PM Saturday: 6:00 AM - 10:00 PM Sunday: 7:00 AM - 8:00 PM ","http://www.homedepot.com","61.14475","-149.85161","2.63421234327447","Compact Fluorescent Lights; Batteries (Rechargeable); Video Game Consoles; PlayStation Consoles","false","true","Home Depot accepts compact fluorescent bulbs and used power tool rechargeable batteries. Look for the orange drop boxes, usually located near the front entrance near the customer service desk.","","false","false","false","false"
"City of Anchorage Christmas Tree Drop-Off Event","","1725 Abbott Rd","Anchorage","","AK","99507","9078688899","0","","http://www.muni.org/departments/sws/pages/default.aspx","61.1421295","-149.8453989","2.65101288267103","","false","false","","","false","false","false","false"
"City of Anchorage Recycling Drop-Off Location - Carrs Abbott","","1725 Abbott Rd","Anchorage","","AK","99507","9073436262","0","","http://www.muni.org/departments/sws/pages/default.aspx","61.1421295","-149.8453989","2.65101288267103","","false","false","","","false","false","false","false"
"Safeway","","1725 Abbott Rd","Anchorage","","AK","99507","9073392800","0","","https://shop.safeway.com/home.html","61.1421295","-149.8453989","2.65101288267103","","false","false","","","false","false","false","false"
"RadioShack","RadioShack","9220 Lake Otis Pkwy Ste A2","Anchorage","Anchorage","AK","99507","9076448313","0","Monday: 10:00 AM - 8:00 PM Tuesday: 10:00 AM - 8:00 PM Wednesday: 10:00 AM - 8:00 PM Thursday: 10:00 AM - 8:00 PM Friday: 10:00 AM - 8:00 PM Saturday: 11:00 AM - 7:00 PM Sunday: 12:00 PM - 6:00 PM ","http://www.radioshack.com","61.13684","-149.83479","2.71426023554101","Ni-Cd Batteries; Batteries (Rechargeable); Video Game Consoles; PlayStation Consoles","false","true","","","false","false","false","false"
"Home Depot","","1715 Abbott Rd","Anchorage","","AK","99507","9076445646","0","","https://ecooptions.homedepot.com/","61.1435487","-149.8438692","2.75503461123955","","false","false","","","false","false","false","false"
"Municipality of Anchorage Curbside Recycling Program","","","Anchorage","","AK","99518","9073436250","0","","http://www.muni.org/departments/sws/Pages/default.aspx","61.1609702","-149.8770255","3.21809397854831","","false","false","","","false","false","false","false"
"Autocat Recycling of Alaska","","6820 Rosewood Street #111","Anchorage","","AK","99518","9078549611","0","","https://iscrapapp.com","61.1589685","-149.8617559","3.2710394725735","","false","false","","","false","false","false","false"
"Safeway","","6401 A St","Anchorage","","AK","99518","9073397756","0","","https://shop.safeway.com/home.html","61.162644","-149.8798473","3.30497200259321","","false","false","","","false","false","false","false"
"Anchorage Recycling Center","","6161 Rosewood St","Anchorage","","AK","99518","9075622267","0","","http://www.muni.org/departments/sws/pages/default.aspx","61.1649114","-149.8606448","3.660178305976","","false","false","","","false","false","false","false"
"Alaska Archives","Alaska Archives","1300 W 56th Ave Ste 14","Anchorage","Anchorage","AK","99518","9075637014","9075637012","","http://www.alaskaarchives.com/","61.16933","-149.90681","3.66758645273381","Books (Reuse); Book Recycling; Brown Paper Bags; Cardboard; Magazines; Paper (Mixed); Newspapers; Phone books; Office Paper; Unused Paper; Documents to Shred; Video Game Consoles; PlayStation Consoles","false","true","","","false","false","false","false"
"Napa Auto Parts","Napa Auto Parts","1130 E Dowling Rd","Anchorage","Anchorage","AK","99518","9075633637","0","Monday: 8:00 AM - 8:00 PM Tuesday: 8:00 AM - 8:00 PM Wednesday: 8:00 AM - 8:00 PM Thursday: 8:00 AM - 8:00 PM Friday: 8:00 AM - 8:00 PM Saturday: 9:00 AM - 8:00 PM Sunday: 10:00 AM - 6:00 PM ","http://www.napaonline.com/","61.166","-149.86084","3.72683091575281","Lead Acid (Pb) Batteries; Video Game Consoles; PlayStation Consoles","false","true","","","false","false","false","false"
"NTR Metals","","5610 Silverado Way","Anchorage","","AK","99518","9078689017","0","","https://elemetal.com/","61.1697998","-149.8898322","3.7293710843326","","false","false","","","false","false","false","false"
"Batteries Plus Bulbs","null","940 W International Airport Rd. Unit A","Anchorage","","AK","99518","9077706110","0","","https://www.batteriesplus.com/store-locator/ak/429?utm_source=local&utm_medium=earth911","61.1732566","-149.9007589","3.9393267485824","","false","false","","","false","false","false","false"
"Batteries Plus","Batteries Plus","910 W Intl Airport Rd","Anchorage","Anchorage","AK","99518","9077706110","0","Monday: 8:00 AM - 8:00 PM Tuesday: 8:00 AM - 8:00 PM Wednesday: 8:00 AM - 8:00 PM Thursday: 8:00 AM - 8:00 PM Friday: 8:00 AM - 8:00 PM Saturday: 8:00 AM - 8:00 PM Sunday: 10:00 AM - 5:00 PM ","http://www.batteriesplus.com/store_details/429.aspx","61.1733","-149.90078","3.94230427701357","Compact Fluorescent Lights; Batteries (Rechargeable); Alkaline/Single-Use Batteries; Video Game Consoles; PlayStation Consoles","false","true","Some fees for battery recycling may apply.  Please contact your Local store for details. 
<p>
Batteries Plus lead by example by recycling the majority of the batteries we sell. Not only do we recycle to protect our environment, we support retail and business customers alike by keeping them in full compliance with federal, state, municipal, EPA and DOT regulations governing the disposal and recycling of spent batteries and select electronics.","","false","false","false","false"
"Anchorage Solid Waste","Anchorage Solid Waste","1111 E 56th Ave","Anchorage","Anchorage","AK","99518","9073436264","0","Monday: 8:00 AM - 8:00 PM Tuesday: 8:00 AM - 8:00 PM Wednesday: 8:00 AM - 8:00 PM Thursday: 8:00 AM - 8:00 PM Friday: 8:00 AM - 8:00 PM Saturday: 9:00 AM - 8:00 PM Sunday: 10:00 AM - 6:00 PM ","http://www.muni.org/departments/sws/recycle/Pages/default.aspx","61.17012","-149.85951","4.0070264674796","Electronics; MP3 Players; Video Game Consoles; PlayStation Consoles","false","true","","","false","false","false","false"
"Central Transfer Station","Central Transfer Station","1111 E 56th Ave","Anchorage","Anchorage","AK","99518","9074281742","0","Monday: 8:00 AM - 5:00 PM Tuesday: 8:00 AM - 5:00 PM Wednesday: 8:00 AM - 5:00 PM Thursday: 8:00 AM - 5:00 PM Friday: 8:00 AM - 5:00 PM Saturday: 8:00 AM - 5:00 PM ","http://www.muni.org/","61.17012","-149.85951","4.0070264674796","Glue & Adhesives; Antifreeze; Lead Acid (Pb) Batteries; Compact Fluorescent Lights; Gasoline and Unwanted Fuels; Herbicides; Household Cleaners; Unused Paint; Pesticides; Photography Chemicals; Batteries (Rechargeable); Alkaline/Single-Use Batteries; Used Motor Oil; Refrigerators; Oil-Based Paint; PCB Ballasts; Non PCB Ballasts","false","true","The CTS receives commercial refuse collection vehicles, residential refuse collection vehicles, and household vehicles (cars and pick-ups) from throughout the metropolitan Anchorage area.  HHW accepted Tue, Thu, Sat. Drop-off services are free for households only (40 pounds or less limit).  Businesses must use the Hazardous Waste Collection Center at the Anchorage Regional Landfill.","","false","false","false","false"
"Anchorage Curbside Recycling","Anchorage Curbside Recycling","1111 E 56th Ave","Anchorage","Anchorage","AK","99518","9073436262","0","","http://www.muni.org/","61.17012","-149.85951","4.0070264674796","Aluminum Cans; Cardboard; Catalogs; Computer Paper; Magazines; Newspapers; Office Paper; Paper (Mixed); Paper Egg Cartons; Paperboard; Phone books; Plastic #1 (PETE); Plastic #2 (HDPE); Plastic Bottle Caps; Tin or Steel Cans","false","false","Place cart curbside by 7 am on collection day.","","true","false","false","false"
"Packaging Store Moving Center","Packaging Store Moving Center","549 W Intl Airport Rd Ste A10","Anchorage","Anchorage","AK","99518","9075639876","0","Monday: 9:00 AM - 5:30 PM Tuesday: 9:00 AM - 5:30 PM Wednesday: 9:00 AM - 5:30 PM Thursday: 9:00 AM - 5:30 PM Friday: 9:00 AM - 5:30 PM ","http://www.gopackagingstore.com/","61.17466","-149.89405","4.04859197273216","Packing Peanut (Reuse); Video Game Consoles; PlayStation Consoles","false","true","","","false","false","false","false"
"The Packaging Store","","549 W International Airport Rd","Anchorage","","AK","99518","9075639876","0","","https://www.gopackagingstore.com/","61.1746931","-149.8939771","4.05107266948436","","false","false","","","false","false","false","false"
"Handle With Care Packaging Store","","549 W Intl Airport Rd Ste A10","Anchorage","","AK","99518","9075639876","0","","https://www.gopackagingstore.com/","61.1746931","-149.8939771","4.05107266948436","","false","false","","","false","false","false","false"
"Central Transfer Station","","Juneau St & E 54th Ave","Anchorage","","AK","99518","9074281742","0","","http://www.muni.org/Departments/SWS/Pages/HazardousWaste.aspx","61.1720064","-149.8636203","4.08097559653257","","false","false","","","false","false","false","false"
"Weston Technology Solutions - Computer Services","","139 East 51st Avenue","Anchorage","","AK","99503","9073758324","0","","https://www.weston-tech.com/","61.1749518","-149.8813612","4.12510970443352","","false","false","","","false","false","false","false"
"US Post Office","US Post Office","5855 Lake Otis Pkwy","Anchorage","Anchorage","AK","99507","0","0","","https://www.usps.com/ship/recycle-through-usps.htm","61.16729","-149.83809","4.15614574096775","Inkjet Printer Cartridges; Video Game Consoles; PlayStation Consoles","false","true","Free, postage-paid Mail Back envelopes can be found on display in the lobby. There is no limit to the number of envelopes customers may take. The contents of the envelope must weigh less than 13 ounces and the envelope must be able to seal completely. For more details visit<a href="http://www.maxback.com/mxb-postoffice-collaboration" target="_blank">MaxBack</a>.","","false","false","false","false"
"Habitat For Humanity","Habitat For Humanity","5023 Cordova St","Anchorage","Anchorage","AK","99503","9077438060","0","Monday: 10:00 AM - 6:00 PM Tuesday: 10:00 AM - 6:00 PM Wednesday: 10:00 AM - 6:00 PM Thursday: 10:00 AM - 6:00 PM Friday: 10:00 AM - 6:00 PM Saturday: 10:00 AM - 6:00 PM ","http://www.hfhanchorage.org","61.17532","-149.87887","4.16608742937633","Brick(s); Carpet; Carpet Padding; Ceiling Tiles; Ceramic Tiles; Construction Materials (Reuse); Furniture; Linoleum; Office Furniture; Paint Donation; Porcelain; Reusable Appliance Donation; Roofing Materials; Stone; Televisions; Miscellaneous Tools; Windows; Wood; Microwaves; Video Game Consoles; PlayStation Consoles","false","true","Location accepts donations of new and used building materials and fixtures in 100% working condition.","","false","false","false","false"
