name,description,address,city,region,province,postal_code,phone,fax,hours,url,latitude,longitude,distance,materials,pickup,dropoff,notes,groups,curbside,municipal,national,event_only
"rrhamco, Inc.","","Simpson Rd","Grafton","","WV","26354","3042650026","0","","https://commerce.wv.gov","39.2685645","-80.0868844","13.9214239677896","","false","false","","","false","false","false","false"
"USPS Post Office Box Lobby Recycling Program","US Post Office","1791 W Veterans Memorial Hwy","Rosemont","Taylor","WV","26424","8002758777","0","","https://www.usps.com/","39.26588","-80.16","14.1904354305289","Catalogs; Greeting Cards; Magazines; Paper (Mixed)","false","true","","","false","false","false","false"
"AutoZone","AutoZone","1404 Harrison Ave","Elkins","Randolph","WV","26241","3046368230","0","","http://www.autozone.com","38.93167","-79.86564","15.3906758506242","Lead Acid (Pb) Batteries; Used Motor Oil; Video Game Consoles; PlayStation Consoles","false","true","Most AutoZone stores accept used motor oil, transmission fluid, gear oil and automotive batteries. Call to see what your local store is currently accepting.","","false","false","false","false"
"Walmart Supercenter","","Pike St","Elkins","","WV","26241","3046362138","0","","https://www.walmart.com/","38.9408768","-79.8536722","15.5391634920039","","false","false","","","false","false","false","false"
"Health Center Pharmacy","","909 Gorman Ave","Elkins","","WV","26241","3036366767","0","","https://wvrivers.org","38.9282582","-79.8522512","16.1069139776256","","false","false","","","false","false","false","false"
"Walgreens","Walgreens","615 Randolph Ave","Elkins","Randolph","WV","26241","3046368180","0","","http://www.walgreens.com","38.92921","-79.85003","16.1639446179344","Cell Phones; Inkjet Printer Cartridges; Video Game Consoles; PlayStation Consoles","false","true","","","false","false","false","false"
"West Virginia Consumer Drug Return Partnership","","329 Davis Ave","Elkins","","WV","26241","3046377201","0","","https://wvrivers.org","38.9260301","-79.8496504","16.3109964752481","","false","false","","","false","false","false","false"
"West Virginia Consumer Drug Return Partnership","","","Elkins","","WV","26241","3046377201","0","","https://wvrivers.org","38.9259397","-79.8467349","16.4404882465864","","false","false","","","false","false","false","false"
"Salvation Army","Salvation Army","203 Randolph Ave","Elkins","Randolph","WV","26241","3046371173","0","Tuesday: 10:00 AM - 12:00 PM Thursday: 9:00 AM - 1:00 PM ","http://www.salvationarmy.org","38.92499","-79.84535","16.5393526622741","Clothing; Small Appliances; Video Game Consoles; PlayStation Consoles","false","true","This site accepts clean items in good condition.","Sony","false","false","false","false"
"Elkins Metal Recycling","","1404 15th Street","Elkins","","WV","26241","3046363456","0","","https://elkinsmetalrecycling.com/","38.9161377","-79.853994","16.5474594288688","","false","false","","","false","false","false","false"
"Elkins Metal Recycling","Elkins Metal Recycling","101 15th St ","Elkins","Randolph County","WV","26241","3046363456","0","Monday: 7:00 AM - 4:00 PM Tuesday: 7:00 AM - 4:00 PM Wednesday: 7:00 AM - 4:00 PM Thursday: 7:00 AM - 4:00 PM Friday: 7:00 AM - 4:00 PM ","","38.9157061","-79.8533364","16.5937001226015","Aluminum Cans; Car; Ferrous Metals (Steel or Iron); Large Household Appliances; Non-ferrous (Copper/Brass/Tin); Tin or Steel Cans; Video Game Consoles; PlayStation Consoles","false","true","","","false","false","false","false"
"Advance Auto Parts","Advance Auto Parts","1772 Beverly Pike","Elkins","Randolph","WV","26241","3046368438","0","Monday: 7:00 AM - 9:00 PM Tuesday: 7:00 AM - 9:00 PM Wednesday: 7:00 AM - 9:00 PM Thursday: 7:00 AM - 9:00 PM Friday: 7:00 AM - 9:00 PM Saturday: 7:00 AM - 9:00 PM Sunday: 10:00 AM - 8:00 PM ","http://www.advanceautoparts.com","38.90717","-79.86201","16.6215341857108","Lead Acid (Pb) Batteries; Used Motor Oil; Video Game Consoles; PlayStation Consoles","false","true","","","false","false","false","false"
"Tractor Supply","Tractor Supply","800 Beverly Pike","Elkins","Randolph","WV","26241","3046372346","0","","http://www.tractorsupply.com","38.90717","-79.86201","16.6215341857108","Transmission Fluid; Used Motor Oil; Video Game Consoles; PlayStation Consoles","false","true","","","false","false","false","false"
"Call2Recycle at US Cellular","Call2Recycle at US Cellular","766 Beverly Pike","Elkins","Randolph","WV","26241","3046369311","0","","http://www.uscellular.com/","38.90717","-79.86201","16.6215341857108","Cell Phones; Ni-Cd Batteries; Li-Ion Batteries; Ni-MH Batteries; Ni-Zn Batteries; Small Sealed Lead Acid Batteries; Video Game Consoles; PlayStation Consoles","false","true","The U.S. EPA estimates that more than 350 million rechargeable batteries are purchased annually in the U.S. Thanks to the environmental commitment of this location, its easy and free to recycle your batteries. Bring your rechargeable batteries to this location and look for the recycling box or ask an associate how you can do your part for the environment.","","false","false","false","false"
"Colonial Court Service Station","Colonial Court Service Station","43 S Randolph Ave","Elkins","Randolph","WV","26241","3046369749","0","Monday: 8:00 AM - 9:00 PM Tuesday: 8:00 AM - 9:00 PM Wednesday: 8:00 AM - 9:00 PM Thursday: 8:00 AM - 9:00 PM Friday: 8:00 AM - 9:00 PM Saturday: 8:00 AM - 9:00 PM ","","38.92305","-79.8436","16.6947753358945","Used Motor Oil; Video Game Consoles; PlayStation Consoles","false","true","","","false","false","false","false"
"Walmart Supercenter","","550 Emily Dr","Clarksburg","","WV","26301","3046221954","0","","https://www.walmart.com/","39.2634006","-80.2857582","17.0378159859964","","false","false","","","false","false","false","false"
"Walmart Tire and Lube Express","","550 Emily Dr","Clarksburg","","WV","26301","3046221954","0","","https://www.walmart.com/cp/ideas/8932632","39.2634006","-80.2857582","17.0378159859964","","false","false","","","false","false","false","false"
"The Delivery Room","The Delivery Room","600 S Randolph Ave","Elkins","Randolph","WV","26241","3046364044","0","Monday: 9:15 AM - 5:30 PM Tuesday: 9:15 AM - 5:30 PM Wednesday: 9:15 AM - 5:30 PM Thursday: 9:15 AM - 5:30 PM Friday: 9:15 AM - 5:30 PM ","","38.92057","-79.83587","17.1307080873455","Packing Peanut (Reuse); Video Game Consoles; PlayStation Consoles","false","true","This site is located on the 4 lane in Elkins.","","false","false","false","false"
"Staples","Staples","504 Emily Drive","Clarksburg","Harrison County","WV","26301","3046230261","0","Monday: 9:00 AM - 9:00 PM Tuesday: 9:00 AM - 9:00 PM Wednesday: 9:00 AM - 9:00 PM Thursday: 9:00 AM - 9:00 PM Friday: 9:00 AM - 9:00 PM Saturday: 9:00 AM - 8:00 PM Sunday: 10:00 AM - 6:00 PM ","https://www.staples.com/recycle","39.2659571","-80.28518","17.1600371205937","AC Power Plugs; Batteries (Rechargeable); Cables & Connectors; Cell Phone Batteries; Cell Phones; Computer (Recycling); Hard Drives; Computer Monitors; Cameras; DVD Players/Blu-Ray Players/DVRs; Electronics; E-Readers; GPS Units; Headphones; Inkjet Printer Cartridges; Laptop Computers; Laser Toner Cartridges; Li-Ion Batteries; MP3 Players; Network Equipment; Ni-Cd Batteries; Ni-MH Batteries; Ni-Zn Batteries; Computer Peripherals; Portable Media Players; Printers/Scanners/Fax Machines; Small Electronics; Small Sealed Lead Acid Batteries; Stereo Equipment; Tablets; Telephones; UPS Batteries/Backup Systems; VCRs; Video Game Systems; Blu-Ray Players; Digital Converter Boxes; Video Game Consoles; PlayStation Consoles; Alkaline/Single-Use Batteries","false","true","NO TVs; Limit 6 CEDs per day; ","Sony, Vizio, OEM","false","false","false","false"
"Staples","","504 Emily Drive","Clarksburg","","WV","26301","3046230261","0","","https://www.staples.com/sbd/cre/marketing/sustainability-center/recycling-services/","39.2659571","-80.28518","17.1600371205937","Alkaline/Single-Use Batteries; Batteries (Rechargeable); Cell Phone Batteries; Li-Ion Batteries; Ni-Cd Batteries; Ni-MH Batteries; Small Sealed Lead Acid Batteries; Alkaline/Single-Use Batteries; Button Batteries; Non-rechargeable lithium batteries; Cell Phones","false","true","","Call2Recycle","false","false","false","false"
"Lowe's","","494 Emily Drive","Clarksburg","","WV","26431","3046247071","0","","https://newsroom.lowes.com/responsibility/operational-excellence/","39.2677257","-80.2842221","17.227408702069","","false","false","","","false","false","false","false"
"Call2Recycle at RadioShack","Call2Recycle at RadioShack","2399 Meadowbrook Mall Ste 850","Bridgeport","Harrison","WV","26330","3048424425","0","Monday: 10:00 AM - 9:00 PM Tuesday: 10:00 AM - 9:00 PM Wednesday: 10:00 AM - 9:00 PM Thursday: 10:00 AM - 9:00 PM Friday: 10:00 AM - 9:00 PM Saturday: 10:00 AM - 9:00 PM Sunday: 11:00 AM - 6:00 PM ","http://www.radioshack.com/","39.29505","-80.22438","17.243330127114","Cell Phones; Ni-Cd Batteries; Li-Ion Batteries; Ni-MH Batteries; Ni-Zn Batteries; Small Sealed Lead Acid Batteries; Video Game Consoles; PlayStation Consoles","false","true","As the first national retailer to partner with Call2Recycle, RadioShack is at the forefront of the rechargeable battery recycling cause and is pleased to offer battery recycling at thousands of convenient RadioShack locations for free.  Simply drop them off at your local RadioShack and theyll take care of the rest.  Ask a store associate for more details.","","false","false","false","false"
"AT&T Wireless","AT&T Wireless","2399 Meadowbrook Mall Road","Bridgeport","Harrison","WV","26330","3049827290","0","","http://www.att.com/","39.29505","-80.22438","17.243330127114","Cell Phones; Ni-Cd Batteries; Batteries (Rechargeable); Cell Phone Batteries; Tablets; Li-Ion Batteries; Video Game Consoles; PlayStation Consoles","false","true","Receive an AT&T Promotion Card worth the trade-in value of your smartphone, tablet, or netbook. You can also donate the trade-in value to Cell Phones for Soldiers.","","false","false","false","false"
"Meadowbrook Mall 1","Meadowbrook Mall 1","2399 Meadowbrook Mall","Bridgeport","Harrison","WV","26330","8583244111","0","","http://www.ecoatm.com/","39.29505","-80.22438","17.243330127114","Cell Phones; Tablets; MP3 Players; Video Game Consoles; PlayStation Consoles","false","true","ecoATM is an automated, consumer self-serve kiosk that quickly buys back and recycles old phones, mp3 players and tablets.
</br>
Call or email <a href="mailto:max@ecoATM.com">customer support</a> with questions.","","false","false","false","false"
"Target","Target","2800 Meadowbrook Mall","Bridgeport","Harrison","WV","26330","3048427770","0","","http://www.target.com/","39.29505","-80.22438","17.243330127114","Aluminum Cans; Cell Phones; Inkjet Printer Cartridges; MP3 Players; Plastic #1 (PETE); Plastic #2 (HDPE); Plastic Shopping Bags; Video Game Consoles; PlayStation Consoles","false","true","","","false","false","false","false"
"Simpson Elementary School","","250 Worthington Dr","Bridgeport","","WV","26330","3048423421","0","","","39.2860172","-80.2522571","17.357506201165","","false","false","","","false","false","false","false"
"Kohl's","","330 Emily Drive","Clarksburg","","WV","26431","3046226072","0","","https://corporate.kohls.com/","39.2715258","-80.2835254","17.4172931635085","","false","false","","","false","false","false","false"
"USPS Post Office Box Lobby Recycling Program","US Post Office","63 Georgetown Rd","Horner","Lewis","WV","26372","8002758777","0","","https://www.usps.com/","38.96888","-80.39236","17.4345186578215","Catalogs; Greeting Cards; Magazines; Paper (Mixed)","false","true","","","false","false","false","false"
"Walmart","Walmart","110 Berlin Rd","Weston","Lewis","WV","26452","3042691549","0","","http://www.walmart.com","39.02458","-80.41378","17.4512561386215","Lead Acid (Pb) Batteries; Plastic Shopping Bags; Food Storage Bags; Video Game Consoles; PlayStation Consoles","false","true","","","false","false","false","false"
"Tractor Supply","","210 Emily Road","Clarksburg","","WV","26301","3046226902","0","","https://www.tractorsupply.com/","39.274215","-80.2810871","17.4926962026603","","false","false","","","false","false","false","false"
"Sams Club","","200 Emily Dr","Clarksburg","","WV","26301","3046236410","0","","https://www.samsclub.com/","39.2753549","-80.2793454","17.5038161739294","","false","false","","","false","false","false","false"
"Quick Lube Inc.","Quick Lube Inc.","1009 W Main St","Bridgeport","Harrison","WV","26330","3048423940","0","Monday: 9:00 AM - 6:00 PM Tuesday: 9:00 AM - 6:00 PM Wednesday: 9:00 AM - 6:00 PM Thursday: 9:00 AM - 6:00 PM Friday: 9:00 AM - 6:00 PM Saturday: 9:00 AM - 4:00 PM ","","39.2813","-80.273","17.655049767251","Used Motor Oil; Video Game Consoles; PlayStation Consoles","false","true","This site accepts up to five gallons of used oil.  Please do not mix oil with any other liquids.","","false","false","false","false"
"Goodwill Industries","Goodwill Industries","1172 W Main St ","Bridgeport","Harrison County","WV","26330","3048423288","0","Monday: 9:00 AM - 9:00 PM Tuesday: 9:00 AM - 9:00 PM Wednesday: 9:00 AM - 9:00 PM Thursday: 9:00 AM - 9:00 PM Friday: 9:00 AM - 9:00 PM Saturday: 9:00 AM - 9:00 PM Sunday: 10:00 AM - 5:00 PM ","http://www.goodwill.org","39.2813782","-80.2734735","17.6734182252224","Bikes; Books (Reuse); Clothing; CD/DVD/Blu-ray/UHD discs; Computer (Reuse); Electronics; Hard Drives; Gift Bags; Eyeglasses; Household Goods; Musical Instruments; Ornaments; Sporting Goods; Miscellaneous Tools; Children's Toys; MP3 Players; Video Game Consoles; PlayStation Consoles","false","true","This site is located in Hill's Plaza and accepts clean items in good condition.  It does not accept broken items.","","false","false","false","false"
"USPS Post Office Box Lobby Recycling Program","US Post Office","205 S Virginia Ave","Bridgeport","Harrison","WV","26330","8002758777","0","","https://www.usps.com/","39.2919","-80.25188","17.7028758852716","Catalogs; Greeting Cards; Magazines; Paper (Mixed)","false","true","","","false","false","false","false"
"Home Depot","","1180 W Main St","Bridgeport","","WV","26330","3048480610","0","","https://ecooptions.homedepot.com/","39.2830701","-80.2716814","17.7194081788242","Batteries (Rechargeable); Cell Phone Batteries; Li-Ion Batteries; Ni-Cd Batteries; Ni-MH Batteries; Small Sealed Lead Acid Batteries","false","true","","Call2Recycle","false","false","false","false"
"Home Depot","Home Depot","1180 W Main St","Bridgeport","Harrison","WV","26330","3048480610","0","","http://www.homedepot.com","39.28128","-80.27531","17.7216885122723","Compact Fluorescent Lights; Batteries (Rechargeable); Video Game Consoles; PlayStation Consoles","false","true","Home Depot accepts compact fluorescent bulbs and used power tool rechargeable batteries. Look for the orange drop boxes, usually located near the front entrance near the customer service desk.","","false","false","false","false"
"Call2Recycle at the Home Depot","Call2Recycle at the Home Depot","1180 W Main St","Bridgeport","Harrison","WV","26330","3048480610","0","","http://www.homedepot.com/","39.28128","-80.27531","17.7216885122723","Cell Phones; Compact Fluorescent Lights; Ni-Cd Batteries; Li-Ion Batteries; Ni-MH Batteries; Ni-Zn Batteries; Small Sealed Lead Acid Batteries; Video Game Consoles; PlayStation Consoles","false","true","The Home Depot accepts used rechargeable batteries and compact fluorescent bulbs. Look for the orange drop boxes, usually located near the front entrance near the customer service desk, or ask a store associate for more details.","","false","false","false","false"
"Advance Auto Parts","Advance Auto Parts","1025 W Main St","Bridgeport","Harrison","WV","26330","3048421901","0","Monday: 7:00 AM - 9:00 PM Tuesday: 7:00 AM - 9:00 PM Wednesday: 7:00 AM - 9:00 PM Thursday: 7:00 AM - 9:00 PM Friday: 7:00 AM - 9:00 PM Saturday: 7:00 AM - 9:00 PM Sunday: 10:00 AM - 8:00 PM ","http://www.advanceautoparts.com","39.28091","-80.27745","17.7637860709049","Lead Acid (Pb) Batteries; Used Motor Oil; Video Game Consoles; PlayStation Consoles","false","true","","","false","false","false","false"
"Call2Recycle at US Cellular","Call2Recycle at US Cellular","150 Emily Dr","Clarksburg","Harrison","WV","26301","3046222331","0","","http://www.uscellular.com/","39.28084","-80.27776","17.768999433163","Cell Phones; Ni-Cd Batteries; Li-Ion Batteries; Ni-MH Batteries; Ni-Zn Batteries; Small Sealed Lead Acid Batteries; Video Game Consoles; PlayStation Consoles","false","true","The U.S. EPA estimates that more than 350 million rechargeable batteries are purchased annually in the U.S. Thanks to the environmental commitment of this location, its easy and free to recycle your batteries. Bring your rechargeable batteries to this location and look for the recycling box or ask an associate how you can do your part for the environment.","","false","false","false","false"
"Call2Recycle at RadioShack","Call2Recycle at RadioShack","156 Emily Dr","Clarksburg","Harrison","WV","26301","3046236056","0","Monday: 9:00 AM - 9:00 PM Tuesday: 9:00 AM - 9:00 PM Wednesday: 9:00 AM - 9:00 PM Thursday: 9:00 AM - 9:00 PM Friday: 9:00 AM - 9:00 PM Saturday: 9:00 AM - 9:00 PM ","http://www.radioshack.com/","39.28084","-80.27776","17.768999433163","Cell Phones; Ni-Cd Batteries; Li-Ion Batteries; Ni-MH Batteries; Ni-Zn Batteries; Small Sealed Lead Acid Batteries; Video Game Consoles; PlayStation Consoles","false","true","As the first national retailer to partner with Call2Recycle, RadioShack is at the forefront of the rechargeable battery recycling cause and is pleased to offer battery recycling at thousands of convenient RadioShack locations for free.  Simply drop them off at your local RadioShack and theyll take care of the rest.  Ask a store associate for more details.","","false","false","false","false"
"Goodwill of Southwestern Pennsylvania - Dell Reconnect Donation Site","","1210 West Main Street","Bridgeport","","WV","26330","3048423288","0","","https://www.goodwillswpa.org/","39.2821577","-80.2752281","17.7699078132088","","false","false","","","false","false","false","false"
"North Marion Tire Recycling Incorporated","North Marion Tire Recycling Incorporated","1488 Dawson Dr # 104","Bridgeport","Harrison","WV","26330","3048480587","0","Monday: 7:00 AM - 4:00 PM Tuesday: 7:00 AM - 4:00 PM Wednesday: 7:00 AM - 4:00 PM Thursday: 7:00 AM - 4:00 PM Friday: 7:00 AM - 4:00 PM ","","39.30558","-80.21805","17.7797436752142","Used Tires; Video Game Consoles; PlayStation Consoles","false","true","","","false","false","false","false"
"Call2Recycle at Lowe's","Call2Recycle at Lowe's","494 Emily Dr","Clarksburg","Harrison","WV","26301","3046247071","0","Monday: 6:00 AM - 10:00 PM Tuesday: 6:00 AM - 10:00 PM Wednesday: 6:00 AM - 10:00 PM Thursday: 6:00 AM - 10:00 PM Friday: 6:00 AM - 10:00 PM Saturday: 6:00 AM - 10:00 PM Sunday: 8:00 AM - 8:00 PM ","http://www.lowes.com/","39.27984","-80.28005","17.7804173424885","Cell Phones; Compact Fluorescent Lights; Ni-Cd Batteries; Plastic Shopping Bags; Li-Ion Batteries; Ni-MH Batteries; Ni-Zn Batteries; Small Sealed Lead Acid Batteries; Video Game Consoles; PlayStation Consoles; Batteries (Rechargeable); Cell Phone Batteries; Li-Ion Batteries; Ni-Cd Batteries; Ni-MH Batteries; Small Sealed Lead Acid Batteries; Cell Phones","false","true","As an environmentally-committed retailer, Lowes offers a recycling center near store entrances to give consumers a free and easy way to properly dispose of rechargeable batteries, cell phones, CFLs and plastic shopping bags; materials that otherwise could be potentially harmful to the environment.  Look for the recycling center or ask a store associate for more details.","Call2Recycle","false","false","false","false"
"USPS Post Office Box Lobby Recycling Program","US Post Office","200 Cava Dr","Clarksburg","Harrison","WV","26301","8002758777","0","","https://www.usps.com/","39.27984","-80.28005","17.7804173424885","Catalogs; Greeting Cards; Magazines; Paper (Mixed)","false","true","","","false","false","false","false"
"AT&T Wireless","AT&T Wireless","542 Emily Drive","Clarksburg","Harrison","WV","26301","3046227990","0","","http://www.att.com/","39.27934","-80.28115","17.7851777169681","Cell Phones; Ni-Cd Batteries; Batteries (Rechargeable); Cell Phone Batteries; Tablets; Li-Ion Batteries; Video Game Consoles; PlayStation Consoles","false","true","Receive an AT&T Promotion Card worth the trade-in value of your smartphone, tablet, or netbook. You can also donate the trade-in value to Cell Phones for Soldiers.","","false","false","false","false"
"Walmart Tire & Lube Express","Walmart Tire & Lube Express","550 Emily Dr","Clarksburg","Harrison","WV","26301","3046221954","0","","http://www.walmart.com/catalog/catalog.gsp?cat=495843","39.2795","-80.28105","17.7912557503134","Lead Acid (Pb) Batteries; Used Motor Oil; Oil Filters; Video Game Consoles; PlayStation Consoles","false","true","","","false","false","false","false"
"Walmart","Walmart","550 Emily Dr","Clarksburg","Harrison","WV","26301","3046221954","0","","http://www.walmart.com","39.2795","-80.28105","17.7912557503134","Lead Acid (Pb) Batteries; Plastic Shopping Bags; Food Storage Bags; Video Game Consoles; PlayStation Consoles","false","true","","","false","false","false","false"
"USPS Post Office Box Lobby Recycling Program","US Post Office","107 E Main St","Lost Creek","Harrison","WV","26385","8002758777","0","","https://www.usps.com/","39.17628","-80.39394","17.7967949190847","Catalogs; Greeting Cards; Magazines; Paper (Mixed)","false","true","","","false","false","false","false"
"Monro","Monro","108 Tolley Dr","Bridgeport","Harrison","WV","26330","3048424172","0","Monday: 7:30 AM - 7:00 PM Tuesday: 7:30 AM - 7:00 PM Wednesday: 7:30 AM - 7:00 PM Thursday: 7:30 AM - 7:00 PM Friday: 7:30 AM - 7:00 PM Saturday: 7:30 AM - 4:00 PM ","http://monro.com","39.28164","-80.27796","17.820870041733","Used Motor Oil; Video Game Consoles; PlayStation Consoles","false","true","","","false","false","false","false"
"Goodwill of Southwestern Pennsylvania - Dell Reconnect Donation Site","","70 Stone Mountain Lane","Elkins","","WV","26241","3046367529","0","","https://www.goodwillswpa.org/","38.8961594","-79.8436639","17.8642351938551","","false","false","","","false","false","false","false"
"Tractor Supply","","800 Beverly Pike","Elkins","","WV","26241","3046372346","0","","https://www.tractorsupply.com/","38.8903277","-79.8481434","17.9564904217535","","false","false","","","false","false","false","false"
"USPS Post Office Box Lobby Recycling Program","US Post Office","141 Industrial Park Rd","Jane Lew","Lewis","WV","26378","8002758777","0","","https://www.usps.com/","39.10876","-80.42401","17.9719184147342","Catalogs; Greeting Cards; Magazines; Paper (Mixed)","false","true","","","false","false","false","false"
"Clarksburg Iron & Steel","Clarksburg Iron & Steel","213 Ohio Ave","Clarksburg","Harrison","WV","26301","3046221651","0","","","39.2615","-80.32141","18.1601987345487","Aluminum Cans; Ferrous Metals (Steel or Iron); Tin or Steel Cans; Video Game Consoles; PlayStation Consoles","false","true","","","false","false","false","false"
"Advance Auto Parts","Advance Auto Parts","417 Buckhannon Pike","Nutter Fort","Harrison","WV","26301","3046226171","0","Monday: 7:00 AM - 9:00 PM Tuesday: 7:00 AM - 9:00 PM Wednesday: 7:00 AM - 9:00 PM Thursday: 7:00 AM - 9:00 PM Friday: 7:00 AM - 9:00 PM Saturday: 7:00 AM - 9:00 PM Sunday: 10:00 AM - 8:00 PM ","http://www.advanceautoparts.com","39.26181","-80.32513","18.3106456909435","Lead Acid (Pb) Batteries; Used Motor Oil; Video Game Consoles; PlayStation Consoles","false","true","","","false","false","false","false"
"State Auto Wrecking, Inc.","State Auto Wrecking, Inc.","94 Cimarron Rd","Clarksburg","Harrison","WV","26301","3046225161","0","Monday: 8:00 AM - 5:00 PM Tuesday: 8:00 AM - 5:00 PM Wednesday: 8:00 AM - 5:00 PM Thursday: 8:00 AM - 5:00 PM Friday: 8:00 AM - 5:00 PM Saturday: 8:00 AM - 12:00 PM ","null","39.26607","-80.32586","18.5539170328816","Antifreeze; Used Motor Oil; Video Game Consoles; PlayStation Consoles","false","true","This site will accept up to two gallons of used motor oil and up to two gallons of antifreeze.  Please do not mix automotive fluids together or with other liquids.","","false","false","false","false"
"USPS Post Office Box Lobby Recycling Program","US Post Office","260 W Main St","Grafton","Taylor","WV","26354","8002758777","0","","https://www.usps.com/","39.34114","-80.02442","19.2863207774952","Catalogs; Greeting Cards; Magazines; Paper (Mixed)","false","true","","","false","false","false","false"
"Target Store","","2800 Meadowbrook Mall","Bridgeport","","WV","26330","3048427770","0","","https://corporate.target.com/corporate-responsibility/planet","39.3112286","-80.2737673","19.4402713139314","","false","false","","","false","false","false","false"
"AutoZone","AutoZone","106 W Main St","Clarksburg","Harrison","WV","26301","3046240011","0","","http://www.autozone.com","39.27855","-80.33283","19.445066645364","Lead Acid (Pb) Batteries; Used Motor Oil; Video Game Consoles; PlayStation Consoles","false","true","Most AutoZone stores accept used motor oil, transmission fluid, gear oil and automotive batteries. Call to see what your local store is currently accepting.","","false","false","false","false"
"JCPenney","null","2500 Meadowbrook Mall","Bridgeport","","WV","26330","3048425451","0","","https://www.jcpenney.com/","39.3129082","-80.272316","19.5026324422452","","false","false","","","false","false","false","false"
