name,description,address,city,region,province,postal_code,phone,fax,hours,url,latitude,longitude,distance,materials,pickup,dropoff,notes,groups,curbside,municipal,national,event_only
"Bandland","Bandland","154 E Pike St","Clarksburg","Harrison","WV","26301","3046221171","0","Monday: 9:30 AM - 6:30 PM Tuesday: 9:30 AM - 6:30 PM Wednesday: 9:30 AM - 6:30 PM Thursday: 9:30 AM - 6:30 PM Friday: 9:30 AM - 5:30 PM Saturday: 9:30 AM - 2:00 PM ","http://bandlandmusic.com/CHIRP.html","39.27982","-80.33279","19.5095807697416","Musical Instruments; Video Game Consoles; PlayStation Consoles","false","true","Location accepts musical instruments in any condition as part of the CHIRP program. Unable to accept pianos or home organs. Your instrument will be processed by a Bandland Repair Technician and distributed to a needy child.","","false","false","false","false"
"Mobile Now","","Meadowbrook Mall","Bridgeport","","WV","26330","3048486300","0","","","39.313517","-80.273407","19.56799060245","","false","false","","","false","false","false","false"
"Walmart","Walmart","721 Beverly Pike","Elkins","Randolph","WV","26241","3046362138","0","","http://www.walmart.com","38.87184","-79.82915","19.57595093565","Lead Acid (Pb) Batteries; Plastic Shopping Bags; Food Storage Bags; Video Game Consoles; PlayStation Consoles","false","true","","","false","false","false","false"
"Call2Recycle at RadioShack","Call2Recycle at RadioShack","759 Beverly Pike","Elkins","Randolph","WV","26241","3046365711","0","Monday: 9:00 AM - 9:00 PM Tuesday: 9:00 AM - 9:00 PM Wednesday: 9:00 AM - 9:00 PM Thursday: 9:00 AM - 9:00 PM Friday: 9:00 AM - 9:00 PM Saturday: 9:00 AM - 9:00 PM Sunday: 10:00 AM - 7:00 PM ","http://www.radioshack.com/","38.87184","-79.82915","19.57595093565","Cell Phones; Ni-Cd Batteries; Li-Ion Batteries; Ni-MH Batteries; Ni-Zn Batteries; Small Sealed Lead Acid Batteries; Video Game Consoles; PlayStation Consoles","false","true","As the first national retailer to partner with Call2Recycle, RadioShack is at the forefront of the rechargeable battery recycling cause and is pleased to offer battery recycling at thousands of convenient RadioShack locations for free.  Simply drop them off at your local RadioShack and theyll take care of the rest.  Ask a store associate for more details.","","false","false","false","false"
"AT&T Wireless","AT&T Wireless","751 Beverly Pike","Elkins","Randolph","WV","26241","3049320493","0","","http://www.att.com/","38.87184","-79.82915","19.57595093565","Cell Phones; Ni-Cd Batteries; Batteries (Rechargeable); Cell Phone Batteries; Tablets; Li-Ion Batteries; Video Game Consoles; PlayStation Consoles","false","true","Receive an AT&T Promotion Card worth the trade-in value of your smartphone, tablet, or netbook. You can also donate the trade-in value to Cell Phones for Soldiers.","","false","false","false","false"
"Harrison Recycling Inc.","","P K Rd","Clarksburg","","WV","26301","3046241611","0","","https://commerce.wv.gov","39.2351749","-80.3894303","19.664937769247","","false","false","","","false","false","false","false"
"Salvation Army","Salvation Army","1010 S Chestnut St","Clarksburg","Harrison","WV","26301","3046222360","0","Monday: 9:00 AM - 4:30 PM Tuesday: 9:00 AM - 4:30 PM Wednesday: 9:00 AM - 4:30 PM Thursday: 9:00 AM - 4:30 PM Friday: 9:00 AM - 4:30 PM Saturday: 9:00 AM - 2:30 PM ","http://www.salvationarmy.org","39.26957","-80.35243","19.7090223436417","Bikes; Books (Reuse); Clothing; Computer (Reuse); Hard Drives; Gift Bags; Household Goods; Lawn Equipment; Musical Instruments; Ornaments; Reusable Appliance Donation; Sporting Goods; Telephones; Miscellaneous Tools; Children's Toys; Small Appliances; Video Game Consoles; PlayStation Consoles","false","true","This site accepts clean items in good condition.  It does not accept broken items.","Sony","false","false","false","false"
"OfficeMax","OfficeMax","2900 Meadowbrook Mall","Bridgeport","Harrison","WV","26330","3048422450","0","Monday: 8:00 AM - 9:00 PM Tuesday: 8:00 AM - 9:00 PM Wednesday: 8:00 AM - 9:00 PM Thursday: 8:00 AM - 9:00 PM Friday: 8:00 AM - 9:00 PM Saturday: 9:00 AM - 9:00 PM Sunday: 10:00 AM - 6:00 PM ","http://www.officemax.com","39.32828","-80.24412","19.7699603931449","Inkjet Printer Cartridges; Laser Toner Cartridges; Video Game Consoles; PlayStation Consoles","false","true","","","false","false","false","false"
"Harrison Recycling Incorporated","Harrison Recycling Incorporated","366 Traders Ave ","Clarksburg","Harrison County","WV","26301","3046232406","0","Monday: 8:00 AM - 3:00 PM Tuesday: 8:00 AM - 3:00 PM Wednesday: 8:00 AM - 3:00 PM Thursday: 8:00 AM - 3:00 PM Friday: 8:00 AM - 3:00 PM ","null","39.2800644","-80.3400224","19.7790792626848","Aerosol Spray Cans; Aluminum Cans; Aluminum; Car; Ferrous Metals (Steel or Iron); Large Household Appliances; Clothes Hangers (Metal); Non-ferrous (Copper/Brass/Tin); Tin or Steel Cans; Video Game Consoles; PlayStation Consoles","false","true","","","false","false","false","false"
"Expert Tire","","425 W Main","Clarksburg","","WV","26301","3046245621","0","","https://www.firestonecompleteautocare.com/","39.2795437","-80.3416545","19.8109827458523","","false","false","","","false","false","false","false"
"Advance Auto Parts","Advance Auto Parts","502 Blueville Dr ","Grafton","Taylor County","WV","26354","3042652030","0","","http://www.advanceautoparts.com","39.3443986","-79.9979419","19.8238491815167","Lead Acid (Pb) Batteries; Used Motor Oil; Video Game Consoles; PlayStation Consoles","false","true","","","false","false","false","false"
"Salvation Army","Salvation Army","501 Blueville Dr","Grafton","Taylor","WV","26354","3042655975","0","Monday: 9:00 AM - 4:00 PM Tuesday: 9:00 AM - 4:00 PM Wednesday: 9:00 AM - 4:00 PM Thursday: 9:00 AM - 4:00 PM Friday: 9:00 AM - 4:00 PM Saturday: 9:00 AM - 4:00 PM ","http://www.salvationarmy.org","39.34404","-79.99616","19.8246961740424","Bikes; Books (Reuse); Clothing; CD/DVD/Blu-ray/UHD discs; Computer (Reuse); Electronics; Hard Drives; Gift Bags; Eyeglasses; Household Goods; Musical Instruments; Ornaments; Reusable Appliance Donation; Sporting Goods; Miscellaneous Tools; Children's Toys; Small Appliances; MP3 Players; Video Game Consoles; PlayStation Consoles","false","true","Please call before dropping off any large items.  This site accepts clean items in good condition.  It does not accept broken items.","Sony","false","false","false","false"
"ExpertTire Store","ExpertTire Store","425 W Main St","Clarksburg","Harrison","WV","26301","3046245621","0","","http://www.firestone.com","39.27976","-80.34173","19.8247571669959","Lead Acid (Pb) Batteries; Used Motor Oil; Video Game Consoles; PlayStation Consoles","false","true","","","false","false","false","false"
"Advance Auto Parts","null","245 Greenes Plz Ste G9","Grafton","","WV","26354","3042652030","0","","http://shop.advanceautoparts.com/webapp/wcs/stores/servlet/home___","39.3444234","-79.9979848","19.8249140757132","","false","false","","","false","false","false","false"
"Habitat for Humanity","Habitat for Humanity","114 N 6th St","Clarksburg","Harrison","WV","26301","3046225046","0","Monday: 9:00 AM - 4:00 PM Wednesday: 9:00 AM - 4:00 PM Friday: 9:00 AM - 4:00 PM ","http://www.habitat.org","39.282","-80.34242","19.9642604354002","Aluminum Cans; Carpet; Ceiling Tiles; Ceramic Tiles; Construction Materials (Reuse); Gift Bags; Household Goods; Linoleum; Ornaments; Porcelain; Roofing Materials; Windows; Video Game Consoles; PlayStation Consoles","false","true","","","false","false","false","false"
"Humane Society Thrift Shop","Humane Society Thrift Shop","220 Milford St","Clarksburg","Harrison","WV","26301","3046245040","0","Monday: 11:00 AM - 4:00 PM Tuesday: 11:00 AM - 4:00 PM Wednesday: 11:00 AM - 4:00 PM Thursday: 11:00 AM - 4:00 PM Friday: 11:00 AM - 4:00 PM Saturday: 10:00 AM - 2:00 PM ","","39.27931","-80.35272","20.2021698058711","Bikes; Books (Reuse); Clothing; CD/DVD/Blu-ray/UHD discs; Computer (Reuse); Hard Drives; Gift Bags; Eyeglasses; Household Goods; Musical Instruments; Ornaments; Reusable Appliance Donation; Sporting Goods; Miscellaneous Tools; Children's Toys; Video Game Consoles; PlayStation Consoles","false","true","This site accepts clean items in good condition.  Broken items and large items are not accepted.","","false","false","false","false"
"Rokisky's Exxon","Rokisky's Exxon","768 W Pike St ","Clarksburg","Harrison County","WV","26301","3046232836","0","Sunday: 12:00 AM - 11:59 PM Monday: 12:00 AM - 11:59 PM Tuesday: 12:00 AM - 11:59 PM Wednesday: 12:00 AM - 11:59 PM Thursday: 12:00 AM - 11:59 PM Friday: 12:00 AM - 11:59 PM Saturday: 12:00 AM - 11:59 PM ","","39.2823201","-80.3494573","20.2344405003667","Used Motor Oil; Video Game Consoles; PlayStation Consoles","false","true","Please call before dropping any used motor oil off at this site.","","false","false","false","false"
"Taylor County Workshop, Inc.","","119 Liberty Ave","Grafton","","WV","26354","3042651951","0","","","39.3508634","-79.9963172","20.2778081374232","","false","false","","","false","false","false","false"
"Tractor Supply","null","Unit # 1 Market Place","Weston","","WV","26452","7246510153","0","","https://www.tractorsupply.com/","39.0404793","-80.4696648","20.282031009191","","false","false","","","false","false","false","false"
"Refuse Control Systems","Refuse Control Systems","584 Turner Rd","Grafton","Taylor","WV","26354","3042653013","0","Monday: 9:00 AM - 2:00 PM Tuesday: 9:00 AM - 2:00 PM Wednesday: 9:00 AM - 2:00 PM Thursday: 9:00 AM - 2:00 PM Friday: 9:00 AM - 2:00 PM Saturday: 9:00 AM - 12:00 PM ","null","39.35273","-79.99492","20.4216324672808","Plastic #1 (PETE); Plastic #2 (HDPE); Plastic #2 (Color HDPE); Aluminum Cans; Cardboard; Catalogs; Glass (Clear); Computer Paper; Ferrous Metals (Steel or Iron); Large Household Appliances; Magazines; Newspapers; Non-ferrous (Copper/Brass/Tin); Tin or Steel Cans; Office Paper; Video Game Consoles; PlayStation Consoles","false","true","This site is closed on Saturdays from November through March.","","false","false","false","false"
"City of Clarksburg Yard Waste Compost Facility","","N 12th St & Pearlman Ave","Clarksburg","","WV","26301","3046241611","0","","https://commerce.wv.gov","39.2941292","-80.3413759","20.5580873358783","","false","false","","","false","false","false","false"
"Napa Auto & Truck Parts","Napa Auto & Truck Parts","125 Saltwell Rd ","Bridgeport","Harrison County","WV","26330","3045922001","0","Monday: 8:00 AM - 7:00 PM Tuesday: 8:00 AM - 7:00 PM Wednesday: 8:00 AM - 7:00 PM Thursday: 8:00 AM - 7:00 PM Friday: 8:00 AM - 7:00 PM Saturday: 8:00 AM - 5:00 PM ","http://www.napaonline.com/","39.3484424","-80.2212815","20.6101775868281","Lead Acid (Pb) Batteries; Video Game Consoles; PlayStation Consoles","false","true","","","false","false","false","false"
"Advance Auto Parts","Advance Auto Parts","46 Daycon Dr","Philippi","Barbour","WV","26416","3044572040","0","Monday: 7:00 AM - 9:00 PM Tuesday: 7:00 AM - 9:00 PM Wednesday: 7:00 AM - 9:00 PM Thursday: 7:00 AM - 9:00 PM Friday: 7:00 AM - 9:00 PM Saturday: 7:00 AM - 9:00 PM Sunday: 10:00 AM - 8:00 PM ","http://www.advanceautoparts.com","39.13585","-80.04629","5.37300830809911","Lead Acid (Pb) Batteries; Used Motor Oil; Video Game Consoles; PlayStation Consoles","false","true","","","false","false","false","false"
"Barbour County Recycling Center","","Rte 250 & Midway Rd","Philippi","","WV","26416","3044575074","0","","https://commerce.wv.gov","39.0881661","-79.9835549","6.0575390309071","","false","false","","","false","false","false","false"
"Barbour County Schools","Barbour County Schools","105 S Railroad St","Philippi","Barbour","WV","26416","3044573030","0","Monday: 8:00 AM - 4:30 PM Tuesday: 8:00 AM - 4:30 PM Wednesday: 8:00 AM - 4:30 PM Thursday: 8:00 AM - 4:30 PM Friday: 8:00 AM - 4:30 PM ","","39.15202","-80.03939","6.53621026114548","Computer (Reuse); Video Game Consoles; PlayStation Consoles","false","true","","","false","false","false","false"
"USPS Post Office Box Lobby Recycling Program","US Post Office","105 S Railroad St","Philippi","Barbour","WV","26416","8002758777","0","","https://www.usps.com/","39.15202","-80.03939","6.53621026114548","Catalogs; Greeting Cards; Magazines; Paper (Mixed)","false","true","","","false","false","false","false"
"City of Philippi Recycling Drop-Off Site","","108 Main St","Philippi","","WV","26416","3044573700","0","","http://www.philippi.org/","39.1527141","-80.040424","6.55515678702593","","false","false","","","false","false","false","false"
"USPS Post Office Box Lobby Recycling Program","US Post Office","204 Beech St","Junior","Barbour","WV","26275","8002758777","0","","https://www.usps.com/","39.03486","-79.95456","7.76535442994522","Catalogs; Greeting Cards; Magazines; Paper (Mixed)","false","true","","","false","false","false","false"
"Call2Recycle at Lowe's","Call2Recycle at Lowe's","40 Clarksburg Rd","Buckhannon","Upshur","WV","26201","3048781000","0","Monday: 6:00 AM - 10:00 PM Tuesday: 6:00 AM - 10:00 PM Wednesday: 6:00 AM - 10:00 PM Thursday: 6:00 AM - 10:00 PM Friday: 6:00 AM - 10:00 PM Saturday: 6:00 AM - 10:00 PM Sunday: 8:00 AM - 8:00 PM ","http://www.lowes.com/","39.03433","-80.23172","7.77012172614913","Cell Phones; Compact Fluorescent Lights; Ni-Cd Batteries; Plastic Shopping Bags; Li-Ion Batteries; Ni-MH Batteries; Ni-Zn Batteries; Small Sealed Lead Acid Batteries; Video Game Consoles; PlayStation Consoles","false","true","As an environmentally-committed retailer, Lowes offers a recycling center near store entrances to give consumers a free and easy way to properly dispose of rechargeable batteries, cell phones, CFLs and plastic shopping bags; materials that otherwise could be potentially harmful to the environment.  Look for the recycling center or ask a store associate for more details.","","false","false","false","false"
"Walmart Tire & Lube Express","Walmart Tire & Lube Express","100 Buckhannon Xrds","Buckhannon","Upshur","WV","26201","3044722589","0","","http://www.walmart.com/catalog/catalog.gsp?cat=495843","39.0305","-80.23935","8.24016604200018","Lead Acid (Pb) Batteries; Used Motor Oil; Oil Filters; Video Game Consoles; PlayStation Consoles","false","true","","","false","false","false","false"
"Walmart","Walmart","100 Buckhannon Xrds","Buckhannon","Upshur","WV","26201","3044722589","0","","http://www.walmart.com","39.0305","-80.23935","8.24016604200018","Lead Acid (Pb) Batteries; Plastic Shopping Bags; Food Storage Bags; Video Game Consoles; PlayStation Consoles","false","true","","","false","false","false","false"
"Lowe's","","40 Clarksburg Rd","Buckhannon","","WV","26201","3048781000","0","","https://newsroom.lowes.com/responsibility/operational-excellence/","39.0054503","-80.2343968","8.69353064652918","Batteries (Rechargeable); Cell Phone Batteries; Li-Ion Batteries; Ni-Cd Batteries; Ni-MH Batteries; Small Sealed Lead Acid Batteries; Cell Phones","false","true","","Call2Recycle","false","false","false","false"
"City of Buckhannon/Crossroads Recycling Center","","70 E Main St","Buckhannon","","WV","26201","3044728949","0","","https://commerce.wv.gov","38.9944285","-80.2276438","8.79172289106408","","false","false","","","false","false","false","false"
"Salvation Army","Salvation Army","36 N Kanawha St","Buckhannon","Upshur","WV","26201","3044726165","0","Monday: 10:00 AM - 4:00 PM Tuesday: 10:00 AM - 4:00 PM Wednesday: 10:00 AM - 4:00 PM Thursday: 10:00 AM - 4:00 PM Friday: 10:00 AM - 4:00 PM ","http://www.salvationarmy.org","38.99585","-80.23108","8.88885833227384","Bikes; Books (Reuse); Clothing; Computer (Reuse); Hard Drives; Gift Bags; Household Goods; Lawn Equipment; Musical Instruments; Ornaments; Reusable Appliance Donation; Sporting Goods; Telephones; Miscellaneous Tools; Children's Toys; Small Appliances; Video Game Consoles; PlayStation Consoles","false","true","This site accepts clean items in good condition.  It does not accept broken items.","Sony","false","false","false","false"
"Goodwill of Southwestern Pennsylvania - Dell Reconnect Donation Site","","15 South Spring Street","Buckhannon","","WV","26201","3044720587","0","","https://www.goodwillswpa.org/","38.9925204","-80.2294301","8.94596259707525","","false","false","","","false","false","false","false"
"Walmart Supercenter","","100 Buckhannon Crossroads","Buckhannon","","WV","26201","3044722589","0","","https://www.walmart.com/","38.9980829","-80.2350939","8.98604630802913","","false","false","","","false","false","false","false"
"Walmart Tire and Lube Express","","100 Buckhannon Crossroads","Buckhannon","","WV","26201","3044722589","0","","https://www.walmart.com/cp/ideas/8932632","38.9980829","-80.2350939","8.98604630802913","","false","false","","","false","false","false","false"
"USPS Post Office Box Lobby Recycling Program","US Post Office","801 Crim Ave","Belington","Barbour","WV","26250","8002758777","0","","https://www.usps.com/","39.01706","-79.93725","9.05503544954316","Catalogs; Greeting Cards; Magazines; Paper (Mixed)","false","true","","","false","false","false","false"
"AT&T Wireless","AT&T Wireless","115 S Kanawha St","Buckhannon","Upshur","WV","26201","3044728000","0","","http://www.att.com/","38.98399","-80.22376","9.06100723145594","Cell Phones; Ni-Cd Batteries; Batteries (Rechargeable); Cell Phone Batteries; Tablets; Li-Ion Batteries; Video Game Consoles; PlayStation Consoles","false","true","Receive an AT&T Promotion Card worth the trade-in value of your smartphone, tablet, or netbook. You can also donate the trade-in value to Cell Phones for Soldiers.","","false","false","false","false"
"Advance Auto Parts","Advance Auto Parts","181 S Kanawha St","Buckhannon","Upshur","WV","26201","3044722199","0","Monday: 7:00 AM - 9:00 PM Tuesday: 7:00 AM - 9:00 PM Wednesday: 7:00 AM - 9:00 PM Thursday: 7:00 AM - 9:00 PM Friday: 7:00 AM - 9:00 PM Saturday: 7:00 AM - 9:00 PM Sunday: 10:00 AM - 8:00 PM ","http://www.advanceautoparts.com","38.98078","-80.22428","9.22458716192486","Lead Acid (Pb) Batteries; Used Motor Oil; Video Game Consoles; PlayStation Consoles","false","true","","","false","false","false","false"
"Upshur County Solid Waste Authority Recycling Center","","Mud Lick Rd","Buckhannon","","WV","26201","3044728949","0","","https://commerce.wv.gov","39.0072184","-80.2522327","9.48534100104403","","false","false","","","false","false","false","false"
