name,description,address,city,region,province,postal_code,phone,fax,hours,url,latitude,longitude,distance,materials,pickup,dropoff,notes,groups,curbside,municipal,national,event_only
"Metalsco Inc","Metalsco Inc","1828 Craig Rd","Saint Louis","Saint Louis","MO","63146","3149975200","3149975921","","http://www.metalsco.com","38.69296","-90.44404","0.23618884088793","Computer (Recycling); Computer Monitors; Electronics; Laptop Computers; Computer Peripherals; Tablets; Video Game Consoles; PlayStation Consoles","false","true","","","false","false","false","false"
"Craig Elementary School","Craig Elementary School","1492 Craig Rd","Saint Louis","Saint Louis","MO","63146","3143813700","0","Sunday: 12:00 AM - 11:59 PM Monday: 12:00 AM - 11:59 PM Tuesday: 12:00 AM - 11:59 PM Wednesday: 12:00 AM - 11:59 PM Thursday: 12:00 AM - 11:59 PM Friday: 12:00 AM - 11:59 PM Saturday: 12:00 AM - 11:59 PM ","http://paperretriever.com","38.68251","-90.44105","0.574964298291422","Catalogs; Greeting Cards; Magazines; Paper (Mixed); Newspapers; Office Paper; Computer (Recycling); Computer Monitors; Electronics; Laptop Computers; Computer Peripherals; Tablets; Video Game Consoles; PlayStation Consoles","false","true","This site only accepts clean and dry paper.","","false","false","false","false"
"USPS Post Office Box Lobby Recycling Program","US Post Office","2002 Congressional Dr","Saint Louis","Saint Louis","MO","63146","8002758777","0","","https://www.usps.com/","38.69576","-90.43809","0.587387528528576","Catalogs; Greeting Cards; Magazines; Paper (Mixed)","false","true","","","false","false","false","false"
"US Post Office","USPS Discarded Lobby Mail Recycling Program","2002 Congressional Dr","Saint Louis","Saint Louis","MO","63146","0","0","","","38.69576","-90.43809","0.587387528528576","Computer (Recycling); Computer Monitors; Electronics; Laptop Computers; Computer Peripherals; Tablets; Video Game Consoles; PlayStation Consoles","false","true","","","false","false","false","false"
"Metal Exchange Corp","Metal Exchange Corp","111 West Port Plz Ste 700","Saint Louis","Saint Louis","MO","63146","3145427344","3148514972","","http://www.metalexchangecorp.com","38.69603","-90.45694","0.727773772870781","Aluminum Cans; Aluminum; Non-ferrous (Copper/Brass/Tin); Computer (Recycling); Computer Monitors; Electronics; Laptop Computers; Computer Peripherals; Tablets; Video Game Consoles; PlayStation Consoles","false","true","","","false","false","false","false"
"Metal Exchange Corp","","111 West Port Plaza Drive Suite 350","Saint Louis","","MO","63146","3145427344","0","","http://metalexchangecorp.com/","38.7012862","-90.446331","0.787463259147109","","false","false","","","false","false","false","false"
"Pak Mail Center US168","","12545 Olive Blvd","St. Louis","","MO","63141","3144696116","0","","https://www.pakmail.com/","38.6776277","-90.4626211","1.23460529579555","","false","false","","","false","false","false","false"
"Sprint Store","null","11637 Olive Blvd,","St Louis","","MO","63141","3149935357","0","","https://newsroom.sprint.com/csr/device-donations/","38.6733335","-90.4552458","1.24858660349734","","false","false","","","false","false","false","false"
"Parkway North High School","Parkway North High School","12860 Fee Fee Rd","Saint Louis","Saint Louis","MO","63146","3143813700","0","Sunday: 12:00 AM - 11:59 PM Monday: 12:00 AM - 11:59 PM Tuesday: 12:00 AM - 11:59 PM Wednesday: 12:00 AM - 11:59 PM Thursday: 12:00 AM - 11:59 PM Friday: 12:00 AM - 11:59 PM Saturday: 12:00 AM - 11:59 PM ","http://paperretriever.com","38.68974","-90.46914","1.24943909541909","Catalogs; Greeting Cards; Magazines; Paper (Mixed); Newspapers; Office Paper; Computer (Recycling); Computer Monitors; Electronics; Laptop Computers; Computer Peripherals; Tablets; Video Game Consoles; PlayStation Consoles","false","true","This site only accepts clean and dry paper.","","false","false","false","false"
"BSI Batteries","BSI Batteries","2326 Centerline Industrial Dr","Saint Louis","Saint Louis","MO","63146","3145671756","0","","http://www.bsi-intr.com/","38.70596","-90.43447","1.27163713528225","Cell Phones; Ni-Cd Batteries; Li-Ion Batteries; Ni-MH Batteries; Ni-Zn Batteries; Small Sealed Lead Acid Batteries; Computer (Recycling); Computer Monitors; Electronics; Laptop Computers; Computer Peripherals; Tablets; Video Game Consoles; PlayStation Consoles","false","true","The U.S. EPA estimates that more than 350 million rechargeable batteries are purchased annually in the U.S. Thanks to the environmental commitment of this location, its easy and free to recycle your batteries. Bring your rechargeable batteries to this location and look for the recycling box or ask an associate how you can do your part for the environment.","","false","false","false","false"
"WestPort Digital","","84 Weldon Parkway","Maryland Heights","","MO","63043","3144400799","0","","","38.708477","-90.4414069","1.30741877066591","","false","false","","","false","false","false","false"
"Cartridge World","","12505 Olive Boulevard","Creve Coeur","","MO","63141","3145420465","0","","","38.6762207","-90.4630386","1.31886291307723","","false","false","","","false","false","false","false"
"Sprint Store","","12503 Olive Blvd","Creve Coeur","","MO","63141","3144344373","0","","https://newsroom.sprint.com/csr/device-donations/","38.6760901","-90.4631556","1.32973084122935","","false","false","","","false","false","false","false"
"Cartridge World","Cartridge World","12505 Olive Blvd","Saint Louis","Saint Louis","MO","63141","3145420465","0","Monday: 9:00 AM - 6:00 PM Tuesday: 9:00 AM - 6:00 PM Wednesday: 9:00 AM - 6:00 PM Thursday: 9:00 AM - 6:00 PM Friday: 9:00 AM - 6:00 PM Saturday: 10:00 AM - 4:00 PM ","http://www.cartridgeworld.com","38.67611","-90.46378","1.35244816036863","Inkjet Cartridge Refilling; Inkjet Printer Cartridges; Laser Toner Refilling; Laser Toner Cartridges; Computer (Recycling); Computer Monitors; Electronics; Laptop Computers; Computer Peripherals; Tablets; Video Game Consoles; PlayStation Consoles","false","true","This site specializes in refilling and remanufacturing all kinds of inkjet, laser, fax and copier cartridges.  This site will also purchase empty used refillable cartridges.","","false","false","false","false"
"Sprint","Sprint","12503 Olive Blvd","Saint Louis","Saint Louis","MO","63141","3144344373","0","Monday: 9:00 AM - 9:00 PM Tuesday: 9:00 AM - 9:00 PM Wednesday: 9:00 AM - 9:00 PM Thursday: 9:00 AM - 9:00 PM Friday: 9:00 AM - 9:00 PM Saturday: 9:00 AM - 9:00 PM Sunday: 11:00 AM - 6:00 PM ","http://green.sprint.com/","38.67611","-90.46378","1.35244816036863","Cell Phones; Cell Phone Batteries; Computer (Recycling); Computer Monitors; Electronics; Laptop Computers; Computer Peripherals; Tablets; Video Game Consoles; PlayStation Consoles","false","true","Sprint Buyback: You could earn up to $300 in credit towards a new device when you recycle your old eligible model from any carrier. Or donate the proceeds from your recycled phones with Sprint Project Connect.","","false","false","false","false"
"Office Depot","Office Depot","12581 Olive Blvd","Saint Louis","Saint Louis","MO","63141","3145769656","0","Monday: 8:00 AM - 9:00 PM Tuesday: 8:00 AM - 9:00 PM Wednesday: 8:00 AM - 9:00 PM Thursday: 8:00 AM - 9:00 PM Friday: 8:00 AM - 9:00 PM Saturday: 9:00 AM - 9:00 PM Sunday: 10:00 AM - 6:00 PM ","http://www.officedepot.com/","38.67611","-90.46378","1.35244816036863","Cell Phones; Computer Monitors; Electronics; Inkjet Printer Cartridges; Ni-Cd Batteries; Office Equipment; Batteries (Rechargeable); Laser Toner Cartridges; MP3 Players; Small Televisions; Computer (Recycling); Laptop Computers; Computer Peripherals; Tablets; Video Game Consoles; PlayStation Consoles","false","true","Office Depot offers electronics recycling for a small fee. Visit their Web site for more details and store locations. Recycle cell phones, PDAs, rechargeable batteries and ink and toner cartridges for FREE!","","false","false","false","false"
"Batteries Plus","Batteries Plus","12520 Olive Blvd Ste B","Creve Coeur","Saint Louis","MO","63141","3143929939","3143929937","","http://www.batteriesplus.com/store_details/379.aspx","38.67518","-90.46357","1.39068097070975","Compact Fluorescent Lights; Batteries (Rechargeable); Alkaline/Single-Use Batteries; Computer (Recycling); Computer Monitors; Electronics; Laptop Computers; Computer Peripherals; Tablets; Video Game Consoles; PlayStation Consoles","false","true","Some fees for battery recycling may apply.  Please contact your Local store for details. 
<p>
Batteries Plus lead by example by recycling the majority of the batteries we sell. Not only do we recycle to protect our environment, we support retail and business customers alike by keeping them in full compliance with federal, state, municipal, EPA and DOT regulations governing the disposal and recycling of spent batteries and select electronics.","","false","false","false","false"
"Batteries Plus Bulbs","null","12520 Olive Blvd. Suite B","Creve Coeur","","MO","63141","3143929939","0","","https://www.batteriesplus.com/store-locator/mo/379?utm_source=local&utm_medium=earth911","38.6750352","-90.4636226","1.39993793489866","","false","false","","","false","false","false","false"
"Verizon Wireless","Verizon Wireless","11493 Olive Blvd","Creve Coeur","Saint Louis","MO","63141","8666444532","0","","http://www.verizonwireless.com/","38.67132","-90.43478","1.41803483337637","Cell Phones; Cell Phone Batteries; Computer (Recycling); Computer Monitors; Electronics; Laptop Computers; Computer Peripherals; Tablets; Video Game Consoles; PlayStation Consoles","false","true","<A Href="https://www.trade-in.vzw.com/home.aspx">
The Verizon Wireless Trade-In Program</A> allows you to trade in your used handset or tablet in a convenient and responsible way. 
<P>
<P>
Verizon Wireless works every day to protect our environment and give our customers opportunities to do the same. <A Href="http://aboutus.vzw.com/Green_Initiative/overview.html">Click here</A> for more examples of the earth-friendly initiatives and programs Verizon Wireless is proud to offer and support.","","false","false","false","false"
"Shred Nations","Shred Nations (inside the UPS store)","11469 Olive Blvd","Creve Coeur","Saint Louis","MO","63141","3144007653","0","Monday: 8:00 AM - 7:00 PM Tuesday: 8:00 AM - 7:00 PM Wednesday: 8:00 AM - 7:00 PM Thursday: 8:00 AM - 7:00 PM Friday: 8:00 AM - 7:00 PM Saturday: 9:00 AM - 4:00 PM ","http://www.shrednations.com/dropoff/location/creve-coeur/15df21b4-931b-82b2-c94b-53359ff9e41d","38.67132","-90.43478","1.41803483337637","Cell Phones; Computer (Recycling); Laptop Computers; Small Televisions; Documents to Shred; Computer Monitors; Electronics; Computer Peripherals; Tablets; Video Game Consoles; PlayStation Consoles","true","true","Shred Nations offers document shredding, hard drive destruction, electronics recycling and more. Visit website for quotes and full list of services offered in your area. ","","false","false","false","false"
"Walgreens","Walgreens","12661 Olive Blvd","Saint Louis","Saint Louis","MO","63141","3148784413","0","","http://www.walgreens.com","38.67917","-90.46899","1.44562346131669","Cell Phones; Inkjet Cartridge Refilling; Inkjet Printer Cartridges; Computer (Recycling); Computer Monitors; Electronics; Laptop Computers; Computer Peripherals; Tablets; Video Game Consoles; PlayStation Consoles","false","true","","","false","false","false","false"
"Walgreens","Walgreens","11697 Lakeside Crossing Ct","Saint Louis","Saint Louis","MO","63146","3145670102","0","","http://www.walgreens.com","38.70436","-90.42644","1.45204420439208","Cell Phones; Inkjet Printer Cartridges; Computer (Recycling); Computer Monitors; Electronics; Laptop Computers; Computer Peripherals; Tablets; Video Game Consoles; PlayStation Consoles","false","true","","","false","false","false","false"
"AT&T Wireless","AT&T Wireless","11420 Olive Blvd","Creve Coeur","Saint Louis","MO","63141","3146922265","0","","http://www.att.com/","38.67111","-90.43348","1.46213280351863","Cell Phones; Ni-Cd Batteries; Batteries (Rechargeable); Cell Phone Batteries; Tablets; Li-Ion Batteries; Computer (Recycling); Computer Monitors; Electronics; Laptop Computers; Computer Peripherals; Video Game Consoles; PlayStation Consoles","false","true","Receive an AT&T Promotion Card worth the trade-in value of your smartphone, tablet, or netbook. You can also donate the trade-in value to Cell Phones for Soldiers.","","false","false","false","false"
"Call2Recycle at Dewalt Factory Service Center","Call2Recycle at Dewalt Factory Service Center","11477 Page Service Dr","Saint Louis","Saint Louis","MO","63146","3149979100","0","","http://www.dewalt.com/","38.6985","-90.41986","1.52851745484721","Cell Phones; Ni-Cd Batteries; Li-Ion Batteries; Ni-MH Batteries; Ni-Zn Batteries; Small Sealed Lead Acid Batteries; Computer (Recycling); Computer Monitors; Electronics; Laptop Computers; Computer Peripherals; Tablets; Video Game Consoles; PlayStation Consoles","false","true","The U.S. EPA estimates that more than 350 million rechargeable batteries are purchased annually in the U.S. Thanks to the environmental commitment of this location, its easy and free to recycle your batteries. Bring your rechargeable batteries to this location and look for the recycling box or ask an associate how you can do your part for the environment.","","false","false","false","false"
"USPS Post Office Box Lobby Recycling Program","US Post Office","641 N New Ballas Rd","Saint Louis","Saint Louis","MO","63141","8002758777","0","","https://www.usps.com/","38.66772","-90.44341","1.53808338186068","Catalogs; Greeting Cards; Magazines; Paper (Mixed)","false","true","","","false","false","false","false"
"Alter Trading Corporation","Alter Trading Corporation","700 Office Pkwy","Saint Louis","Saint Louis","MO","63141","3148722400","0","","http://www.altertrading.com/","38.67003","-90.43291","1.54254088412734","Aluminum; Ferrous Metals (Steel or Iron); Non-ferrous (Copper/Brass/Tin); High-Temp Alloys; Special Metals; Computer (Recycling); Computer Monitors; Electronics; Laptop Computers; Computer Peripherals; Tablets; Video Game Consoles; PlayStation Consoles","true","true","","","false","false","false","false"
"Firestone Complete Auto Care Store","Firestone Complete Auto Care Store","12740 Olive Blvd","Saint Louis","Saint Louis","MO","63141","3148789800","0","","http://www.firestonecompleteautocare.com/","38.67975","-90.47242","1.58919704288472","Lead Acid (Pb) Batteries; Used Motor Oil; Computer (Recycling); Computer Monitors; Electronics; Laptop Computers; Computer Peripherals; Tablets; Video Game Consoles; PlayStation Consoles","false","true","","","false","false","false","false"
"RadioShack","RadioShack","12772 Olive Blvd","Creve Coeur","Saint Louis","MO","63141","3142757765","0","Monday: 10:00 AM - 9:00 PM Tuesday: 10:00 AM - 9:00 PM Wednesday: 10:00 AM - 9:00 PM Thursday: 10:00 AM - 9:00 PM Friday: 10:00 AM - 9:00 PM Saturday: 10:00 AM - 9:00 PM Sunday: 11:00 AM - 6:00 PM ","http://www.radioshack.com","38.67975","-90.47242","1.58919704288472","Cell Phones; Ni-Cd Batteries; Batteries (Rechargeable); Cell Phone Batteries; Computer (Recycling); Computer Monitors; Electronics; Laptop Computers; Computer Peripherals; Tablets; Video Game Consoles; PlayStation Consoles","false","true","This site is located in the Bellerive Shopping Center.","","false","false","false","false"
"Schnucks","Schnucks","12756 Olive Blvd","Saint Louis","Saint Louis","MO","63141","3144347323","0","","http://www.schnucks.com/","38.67975","-90.47242","1.58919704288472","Plastic Shopping Bags; Food Storage Bags; Computer (Recycling); Computer Monitors; Electronics; Laptop Computers; Computer Peripherals; Tablets; Video Game Consoles; PlayStation Consoles","false","true","","","false","false","false","false"
"Alter Trading Corporation","","700 Office Parkway","Saint Louis","","MO","63141","3148722400","0","","https://www.altertrading.com/","38.6686017","-90.4325895","1.63849612198356","","false","false","","","false","false","false","false"
"Firestone Complete Auto Care","","12740 Olive Blvd","Saint Louis","","MO","63141","3148789800","0","","https://www.firestonecompleteautocare.com/","38.6773228","-90.4723359","1.66608246298234","","false","false","","","false","false","false","false"
"O'Reilly Auto Parts","null","11992 Dorsett Road","Maryland Heights","","MO","63043","3149936390","0","","http://oreillyauto.custhelp.com/app/error/error_id/6","38.7138624","-90.4390721","1.69738763638796","","false","false","","","false","false","false","false"
"RadioShack","RadioShack","12300 Dorsett Rd","Maryland Hts","Saint Louis","MO","63043","3144346043","0","Monday: 10:00 AM - 9:00 PM Tuesday: 10:00 AM - 9:00 PM Wednesday: 10:00 AM - 9:00 PM Thursday: 10:00 AM - 9:00 PM Friday: 10:00 AM - 9:00 PM Saturday: 10:00 AM - 9:00 PM Sunday: 11:00 AM - 6:00 PM ","http://www.radioshack.com","38.71443","-90.44829","1.69993114323639","Cell Phones; Ni-Cd Batteries; Batteries (Rechargeable); Cell Phone Batteries; Computer (Recycling); Computer Monitors; Electronics; Laptop Computers; Computer Peripherals; Tablets; Video Game Consoles; PlayStation Consoles","false","true","","","false","false","false","false"
"Jiffy Lube","Jiffy Lube","11944 Dorsett Rd","Maryland Heights","Saint Louis","MO","63043","3142917785","0","Monday: 8:00 AM - 7:00 PM Tuesday: 8:00 AM - 7:00 PM Wednesday: 8:00 AM - 7:00 PM Thursday: 8:00 AM - 7:00 PM Friday: 8:00 AM - 7:00 PM Saturday: 7:30 AM - 5:00 PM Sunday: 10:00 AM - 4:00 PM ","http://jiffylube.com","38.71445","-90.44157","1.71323279227638","Used Motor Oil; Computer (Recycling); Computer Monitors; Electronics; Laptop Computers; Computer Peripherals; Tablets; Video Game Consoles; PlayStation Consoles","false","true","","","false","false","false","false"
"Ace Hardware","Ace Hardware","12634 Dorsett Rd","Maryland Heights","Saint Louis","MO","63043","3144539393","0","","http://www.acehardware.com/","38.71445","-90.45518","1.76785871788976","Cell Phones; Ni-Cd Batteries; Li-Ion Batteries; Ni-MH Batteries; Ni-Zn Batteries; Small Sealed Lead Acid Batteries; Computer (Recycling); Computer Monitors; Electronics; Laptop Computers; Computer Peripherals; Tablets; Video Game Consoles; PlayStation Consoles","false","true","The U.S. EPA estimates that more than 350 million rechargeable batteries are purchased annually in the U.S. Thanks to the environmental commitment of this location, its easy and free to recycle your batteries. Bring your rechargeable batteries to this location and look for the recycling box or ask an associate how you can do your part for the environment.","","false","false","false","false"
"Shred Nations","Shred Nations (inside Brandt & Sons Ace Hardware)","12634 Dorsett Rd","Maryland Heights","Saint Louis","MO","63043","8007473365","0","Monday: 8:30 AM - 6:00 PM Tuesday: 8:30 AM - 6:00 PM Wednesday: 8:30 AM - 6:00 PM Thursday: 8:30 AM - 6:00 PM Friday: 8:30 AM - 6:00 PM Saturday: 8:30 AM - 6:00 PM Sunday: 9:00 AM - 5:00 PM ","http://www.shrednations.com/dropoff/location/maryland-heights/93ad01bf-229b-3d6a-22f9-54219a85775e","38.71445","-90.45518","1.76785871788976","Cell Phones; Computer (Recycling); Laptop Computers; Small Televisions; Documents to Shred; Computer Monitors; Electronics; Computer Peripherals; Tablets; Video Game Consoles; PlayStation Consoles","true","true","Shred Nations offers document shredding, hard drive destruction, electronics recycling and more. Visit website for quotes and full list of services offered in your area. ","","false","false","false","false"
"Schnucks","Schnucks","2030 Dorsett Rd ","Maryland Heights","St Louis County","MO","63043","3144343147","0","","http://www.schnucks.com/","38.7160336","-90.4564082","1.89174720915888","Plastic Shopping Bags; Food Storage Bags; Computer (Recycling); Computer Monitors; Electronics; Laptop Computers; Computer Peripherals; Tablets; Video Game Consoles; PlayStation Consoles","false","true","","","false","false","false","false"
"Valvoline Instant Oil Change","","11815 Dorsett Rd","Maryland Heights","","MO","63043","3147702644","0","","https://www.vioc.com/","38.7148732","-90.4315555","1.89291293734801","","false","false","","","false","false","false","false"
"Saint Louis Christmas Tree Recycling Drop-off Event - Maryland Heights","","11294 Schaefer Dr","Maryland Heights","","MO","63043","3146155184","0","","https://www.stlouisco.com/","38.7037926","-90.4156542","1.89603385627725","","false","false","","","false","false","false","false"
"USPS Post Office Box Lobby Recycling Program","US Post Office","331 N New Ballas Rd","Saint Louis","Saint Louis","MO","63141","8002758777","0","","https://www.usps.com/","38.66242","-90.4445","1.89970036686802","Catalogs; Greeting Cards; Magazines; Paper (Mixed)","false","true","","","false","false","false","false"
"US Post Office","US Post Office","331 N New Ballas Rd","Saint Louis","Saint Louis","MO","63141","0","0","","https://www.usps.com/ship/recycle-through-usps.htm","38.66242","-90.4445","1.89970036686802","Inkjet Printer Cartridges; Computer (Recycling); Computer Monitors; Electronics; Laptop Computers; Computer Peripherals; Tablets; Video Game Consoles; PlayStation Consoles","false","true","Free, postage-paid Mail Back envelopes can be found on display in the lobby. There is no limit to the number of envelopes customers may take. The contents of the envelope must weigh less than 13 ounces and the envelope must be able to seal completely. For more details visit<a href="http://www.maxback.com/mxb-postoffice-collaboration" target="_blank">MaxBack</a>.","","false","false","false","false"
"Willow Brook Elementary School","Willow Brook Elementary School","11022 Schuetz Rd","Saint Louis","Saint Louis","MO","63146","3143813700","0","Sunday: 12:00 AM - 11:59 PM Monday: 12:00 AM - 11:59 PM Tuesday: 12:00 AM - 11:59 PM Wednesday: 12:00 AM - 11:59 PM Thursday: 12:00 AM - 11:59 PM Friday: 12:00 AM - 11:59 PM Saturday: 12:00 AM - 11:59 PM ","http://paperretriever.com","38.68425","-90.41124","1.91321686121404","Catalogs; Greeting Cards; Magazines; Paper (Mixed); Newspapers; Office Paper; Computer (Recycling); Computer Monitors; Electronics; Laptop Computers; Computer Peripherals; Tablets; Video Game Consoles; PlayStation Consoles","false","true","This site only accepts clean and dry paper.","","false","false","false","false"
"Pattonville Heights Middle School","Pattonville Heights Middle School","195 Fee Fee Rd","Maryland Heights","Saint Louis","MO","63043","3143813700","0","Sunday: 12:00 AM - 11:59 PM Monday: 12:00 AM - 11:59 PM Tuesday: 12:00 AM - 11:59 PM Wednesday: 12:00 AM - 11:59 PM Thursday: 12:00 AM - 11:59 PM Friday: 12:00 AM - 11:59 PM Saturday: 12:00 AM - 11:59 PM ","http://paperretriever.com","38.71473","-90.4251","2.05215360086269","Catalogs; Greeting Cards; Magazines; Paper (Mixed); Newspapers; Office Paper; Computer (Recycling); Computer Monitors; Electronics; Laptop Computers; Computer Peripherals; Tablets; Video Game Consoles; PlayStation Consoles","false","true","This site only accepts clean and dry paper.","","false","false","false","false"
"Hamilton Preschool","Hamilton Preschool","10545 Old Olive Street Rd","Saint Louis","Saint Louis","MO","63141","3143813700","0","Sunday: 12:00 AM - 11:59 PM Monday: 12:00 AM - 11:59 PM Tuesday: 12:00 AM - 11:59 PM Wednesday: 12:00 AM - 11:59 PM Thursday: 12:00 AM - 11:59 PM Friday: 12:00 AM - 11:59 PM Saturday: 12:00 AM - 11:59 PM ","http://paperretriever.com","38.67553","-90.4124","2.06470567215574","Catalogs; Greeting Cards; Magazines; Paper (Mixed); Newspapers; Office Paper; Computer (Recycling); Computer Monitors; Electronics; Laptop Computers; Computer Peripherals; Tablets; Video Game Consoles; PlayStation Consoles","false","true","This site only accepts clean and dry paper.","","false","false","false","false"
"Foam Products Corp","","2525 Adie Rd.","St. Louis","","MO","63043","3147398100","0","","http://www.fpcfoam.com/","38.7084344","-90.4159071","2.06620943844026","","false","false","","","false","false","false","false"
"Always Green Recycling Inc","","11440 Dorsett Rd","Maryland Heights","","MO","63043","3145212211","0","","http://www.alwaysgreenrecycling.com/","38.712466","-90.4198509","2.10145903635411","","false","false","","","false","false","false","false"
"Schnucks","Schnucks","10650 Olive Blvd","Creve Coeur","Saint Louis","MO","63141","3145673838","0","","http://www.schnucks.com/","38.67248","-90.41398","2.10342824933654","Plastic Shopping Bags; Food Storage Bags; Computer (Recycling); Computer Monitors; Electronics; Laptop Computers; Computer Peripherals; Tablets; Video Game Consoles; PlayStation Consoles","false","true","","","false","false","false","false"
"Bellerive Elementary School","Bellerive Elementary School","666 Rue De Fleur Dr ","Creve Coeur","St Louis County","MO","63141","3143813700","0","Sunday: 12:00 AM - 11:59 PM Monday: 12:00 AM - 11:59 PM Tuesday: 12:00 AM - 11:59 PM Wednesday: 12:00 AM - 11:59 PM Thursday: 12:00 AM - 11:59 PM Friday: 12:00 AM - 11:59 PM Saturday: 12:00 AM - 11:59 PM ","http://paperretriever.com","38.6704013","-90.4772087","2.15678975164103","Catalogs; Greeting Cards; Magazines; Paper (Mixed); Newspapers; Office Paper; Computer (Recycling); Computer Monitors; Electronics; Laptop Computers; Computer Peripherals; Tablets; Video Game Consoles; PlayStation Consoles","false","true","This site only accepts clean and dry paper.","","false","false","false","false"
