name,description,address,city,region,province,postal_code,phone,fax,hours,url,latitude,longitude,distance,materials,pickup,dropoff,notes,groups,curbside,municipal,national,event_only
"Parkway Northeast Middle School","Parkway Northeast Middle School","181 Coeur de Ville Dr","Creve Coeur","Saint Louis","MO","63141","3143813700","0","Sunday: 12:00 AM - 11:59 PM Monday: 12:00 AM - 11:59 PM Tuesday: 12:00 AM - 11:59 PM Wednesday: 12:00 AM - 11:59 PM Thursday: 12:00 AM - 11:59 PM Friday: 12:00 AM - 11:59 PM Saturday: 12:00 AM - 11:59 PM ","http://paperretriever.com","38.65757","-90.45112","2.25032514651032","Catalogs; Greeting Cards; Magazines; Paper (Mixed); Newspapers; Office Paper; Computer (Recycling); Computer Monitors; Electronics; Laptop Computers; Computer Peripherals; Tablets; Video Game Consoles; PlayStation Consoles","false","true","This site only accepts clean and dry paper.","","false","false","false","false"
"NTR Metals","","10862 Galt Industrial Boulevard","St. Louis","","MO","63132","3144237999","0","","https://elemetal.com/","38.6904992","-90.4026891","2.33450809382051","","false","false","","","false","false","false","false"
"Len Masters","Len Masters","11309 Midland Blvd","Saint Louis","Saint Louis","MO","63114","3144271660","0","Monday: 8:00 AM - 4:00 PM Tuesday: 8:00 AM - 4:00 PM Wednesday: 8:00 AM - 4:00 PM Thursday: 8:00 AM - 4:00 PM Friday: 8:00 AM - 4:00 PM ","","38.70699","-90.40701","2.41021671247178","Compact Fluorescent Lights; Computer (Recycling); Computer Monitors; Electronics; Laptop Computers; Computer Peripherals; Tablets; Video Game Consoles; PlayStation Consoles","false","true","This site may have some disposal fees. Please call for the fee schedule.","","false","false","false","false"
"USPS Post Office Box Lobby Recycling Program","US Post Office","177 Weldon Pkwy","Maryland Heights","Saint Louis","MO","63043","8002758777","0","","https://www.usps.com/","38.71381","-90.4115","2.48705236213201","Catalogs; Greeting Cards; Magazines; Paper (Mixed)","false","true","","","false","false","false","false"
"US Post Office","USPS Discarded Lobby Mail Recycling Program","177 Weldon Pkwy","Maryland Heights","Saint Louis","MO","63043","0","0","","","38.71381","-90.4115","2.48705236213201","Computer (Recycling); Computer Monitors; Electronics; Laptop Computers; Computer Peripherals; Tablets; Video Game Consoles; PlayStation Consoles","false","true","","","false","false","false","false"
"The Salvation Army","null","10740 Page Ave ","St. Louis","St Louis County","MO","63132","3144237770","0","","http://www.salvationarmyusa.org","38.6920369","-90.3989296","2.54116829323051","Bikes; Books (Reuse); CD/DVD/Blu-ray/UHD discs; Cell Phones; Children's Toys; Clothing; Computer (Reuse); Hard Drives; Computer Monitors; Cameras; DVD Players/Blu-Ray Players/DVRs; Electronics; E-Readers; Furniture; Gift Bags; Headphones; Household Goods; Laptop Computers; Lawn Equipment; Miscellaneous Tools; MP3 Players; Musical Instruments; Network Equipment; Ornaments; Computer Peripherals; Portable Media Players; Printers/Scanners/Fax Machines; Reusable Appliance Donation; Small Appliances; Small Electronics; Small Televisions; Sporting Goods; Stereo Equipment; Tablets; Telephones; Televisions; VCRs; VHS & Cassette Tapes; Video Game Systems; Blu-Ray Players; Digital Converter Boxes; Computer (Recycling); Video Game Consoles; PlayStation Consoles","false","true","Call for Details","Sony, Vizio, OEM, Salvation Army","false","false","false","false"
"Wheels For Wishes","Wheels For Wishes","1033 Corporate Square Dr","Saint Louis","Saint Louis","MO","63132","8553669474","0","Monday: 7:00 AM - 10:00 PM Tuesday: 7:00 AM - 10:00 PM Wednesday: 7:00 AM - 10:00 PM Thursday: 7:00 AM - 10:00 PM Friday: 7:00 AM - 10:00 PM ","http://www.wheelsforwishes.org/","38.67705","-90.40156","2.55429453291598","Car Donation; Computer (Recycling); Computer Monitors; Electronics; Laptop Computers; Computer Peripherals; Tablets; Video Game Consoles; PlayStation Consoles","true","true","Cars, trucks, SUVs, RVs, motorcycles and boats are accepted. Wheels for Wishes will pick-up or tow away all vehicles, at no charge, whether the vehicles are running or not. Services are completely free of charge.","","false","false","false","false"
"Make-A-Wish Car Donation","","1033 Corporate Square Dr","St Louis","","MO","63132","8553669474","0","","https://www.wheelsforwishes.org/missouri/","38.6759674","-90.4019898","2.55975015124021","","false","false","","","false","false","false","false"
"College Hunks Hauling Junk of Saint Louis","","1033 Corporate Square Dr","St Louis","","MO","63132","3142880400","0","","https://www.collegehunkshaulingjunk.com/st-louis/","38.6759674","-90.4019898","2.55975015124021","","false","false","","","false","false","false","false"
"CLEAR Carpet Recycling","","10665 Kahlmeyer Drive","St Louis","","MO","63132","8554068600","0","","","38.6876103","-90.3981867","2.58180280417602","","false","false","","","false","false","false","false"
"O'Reilly Auto Parts","null","10611 Page Avenue","St Louis","","MO","63132","3144294857","0","","http://oreillyauto.custhelp.com/app/error/error_id/6","38.6925983","-90.3950182","2.754116292265","","false","false","","","false","false","false","false"
"Briar Crest Elementary School","Briar Crest Elementary School","2900 Adie Rd","Saint Ann","Saint Louis","MO","63074","3143813700","0","Sunday: 12:00 AM - 11:59 PM Monday: 12:00 AM - 11:59 PM Tuesday: 12:00 AM - 11:59 PM Wednesday: 12:00 AM - 11:59 PM Thursday: 12:00 AM - 11:59 PM Friday: 12:00 AM - 11:59 PM Saturday: 12:00 AM - 11:59 PM ","http://paperretriever.com","38.71307","-90.40416","2.76531025024615","Catalogs; Greeting Cards; Magazines; Paper (Mixed); Newspapers; Office Paper; Computer (Recycling); Computer Monitors; Electronics; Laptop Computers; Computer Peripherals; Tablets; Video Game Consoles; PlayStation Consoles","false","true","This site only accepts clean and dry paper.","","false","false","false","false"
"USAgain","","1113 N. Warson","Saint Louis","","MO","63132","3142910046","0","","http://www.usagain.com/","38.679414","-90.3958368","2.79910039298153","","false","false","","","false","false","false","false"
"USAgain","USAgain","1113 N Warson Rd","Saint Louis","Saint Louis","MO","63132","3142910046","0","","http://www.usagain.com/","38.68123","-90.39472","2.82810758382336","Clothing; Textiles; Shoes; Computer (Recycling); Computer Monitors; Electronics; Laptop Computers; Computer Peripherals; Tablets; Video Game Consoles; PlayStation Consoles","false","true","This business accepts gently used clothes, shoes, boots, linens, towels. Please visit www.usagain.com for a drop-box near you.","","false","false","false","false"
"US Post Office","US Post Office","9621 Old Olive Street Rd ","St Louis","St Louis County","MO","63141","8002758777","0","","","38.6731026","-90.3978323","2.84370232716902","Catalogs; Greeting Cards; Magazines; Paper (Mixed)","false","true","","","false","false","false","false"
"Abitibi Recycling Drop-off Site - River Bend Elementary School","Abitibi Recycling Drop-off Site - River Bend Elementary School","224 River Valley Dr","Chesterfield","Saint Louis","MO","63017","3143813700","0","Sunday: 12:00 AM - 11:59 PM Monday: 12:00 AM - 11:59 PM Tuesday: 12:00 AM - 11:59 PM Wednesday: 12:00 AM - 11:59 PM Thursday: 12:00 AM - 11:59 PM Friday: 12:00 AM - 11:59 PM Saturday: 12:00 AM - 11:59 PM ","http://paperretriever.com","38.68564","-90.50322","3.1012816165431","Catalogs; Computer Paper; Greeting Cards; Magazines; Paper (Mixed); Newspapers; Office Paper; Computer (Recycling); Computer Monitors; Electronics; Laptop Computers; Computer Peripherals; Tablets; Video Game Consoles; PlayStation Consoles","false","true","This site only accepts clean and dry paper.","","false","false","false","false"
"St. Blaise Parish","St. Blaise Parish","3130 Parkwood Ln","Maryland Heights","Saint Louis","MO","63043","3143813700","0","Sunday: 12:00 AM - 11:59 PM Monday: 12:00 AM - 11:59 PM Tuesday: 12:00 AM - 11:59 PM Wednesday: 12:00 AM - 11:59 PM Thursday: 12:00 AM - 11:59 PM Friday: 12:00 AM - 11:59 PM Saturday: 12:00 AM - 11:59 PM ","http://paperretriever.com","38.73427","-90.43428","3.13019683128618","Catalogs; Greeting Cards; Magazines; Paper (Mixed); Newspapers; Office Paper; Computer (Recycling); Computer Monitors; Electronics; Laptop Computers; Computer Peripherals; Tablets; Video Game Consoles; PlayStation Consoles","false","true","This site only accepts clean and dry paper.","","false","false","false","false"
"Solomon Schechter Day School","Solomon Schechter Day School","324 S Mason Rd","Saint Louis","Saint Louis","MO","63141","3143813700","0","Sunday: 12:00 AM - 11:59 PM Monday: 12:00 AM - 11:59 PM Tuesday: 12:00 AM - 11:59 PM Wednesday: 12:00 AM - 11:59 PM Thursday: 12:00 AM - 11:59 PM Friday: 12:00 AM - 11:59 PM Saturday: 12:00 AM - 11:59 PM ","http://paperretriever.com","38.65283","-90.47969","3.14082407852705","Catalogs; Greeting Cards; Magazines; Paper (Mixed); Newspapers; Office Paper; Computer (Recycling); Computer Monitors; Electronics; Laptop Computers; Computer Peripherals; Tablets; Video Game Consoles; PlayStation Consoles","false","true","This site only accepts clean and dry paper.","","false","false","false","false"
"Saint Louis County Electronic Drop-off Program","","1521 Page Industrial Blvd","St Louis","","MO","63132","3144280777","0","","https://dnr.mo.gov/env/hwp/","38.6873233","-90.3862618","3.22496982537118","","false","false","","","false","false","false","false"
"Saint Louis County Electronic Drop-off Program","","1521 Page Industrial Boulevard","Saint Louis","","MO","63132","3144280777","0","","http://www.stlouisco.com/HealthandWellness/RecyclingandSolidWaste/RecyclingInformation/PlacestoRecycle#Electronics","38.6873233","-90.3862618","3.22496982537118","","false","false","","","false","false","false","false"
"Spectrum Ecycle Solutions, Inc.","","1521 Page Industrial Blvd","St Louis","","MO","63132","3144280777","0","","https://spectrumecycle.com/","38.6873233","-90.3862618","3.22496982537118","","false","false","","","false","false","false","false"
"Spectrum Ecycle Solutions, Inc.","","1521 Page Industrial Blvd","St Louis","","MO","63132","3144280777","0","","https://spectrumecycle.com/","38.6873233","-90.3862618","3.22496982537118","","false","false","","","false","false","false","false"
"Spectrum Ecycle Solutions, Inc.","Spectrum Ecycle Solutions, Inc.","1521 Page Industrial Blvd","Saint Louis","Saint Louis","MO","63132","3144280777","0","Monday: 7:00 AM - 5:30 PM Tuesday: 7:00 AM - 5:30 PM Wednesday: 7:00 AM - 5:30 PM Thursday: 7:00 AM - 5:30 PM Friday: 7:00 AM - 5:30 PM ","http://spectrumecycle.com","38.68773","-90.38576","3.2505689146636","Cell Phones; CD/DVD/Blu-ray/UHD discs; Computer Monitors; Computer (Recycling); Electronics; Video Game Systems; Medical Equipment; Office Equipment; Batteries (Rechargeable); Telephones; Televisions; VHS & Cassette Tapes; Stereo Equipment; Printers/Scanners/Fax Machines; Small Appliances; Memory (RAM), Flash Card/Drive; Laptop Computers; MP3 Players; Cables & Connectors; Servers; Wire; Microwaves; Power Supplies; Computer Peripherals; DVD Players/Blu-Ray Players/DVRs; Projectors; Tablets; Video Game Consoles; PlayStation Consoles","true","true","Fees apply. Visit <a href="http://spectrumecycle.com/fees/" target="_blank">website</a> or call for details.","","false","false","false","false"
"The UPS Store","The UPS Store","9648 Olive Blvd","Saint Louis","Saint Louis","MO","63132","3145690692","0","Monday: 8:30 AM - 7:00 PM Tuesday: 8:30 AM - 7:00 PM Wednesday: 8:30 AM - 7:00 PM Thursday: 8:30 AM - 7:00 PM Friday: 8:30 AM - 7:00 PM Saturday: 9:00 AM - 4:00 PM ","http://www.upsstore.com","38.67306","-90.38925","3.27281689907221","Packing Materials; Packing Peanut (Reuse); Computer (Recycling); Computer Monitors; Electronics; Laptop Computers; Computer Peripherals; Tablets; Video Game Consoles; PlayStation Consoles","false","true","","","false","false","false","false"
"Abitibi Recycling Drop-off Site - Parkway Administrative Center","Abitibi Recycling Drop-off Site - Parkway Administrative Center","455 N Woods Mill Rd","Chesterfield","Saint Louis","MO","63017","3143813700","0","Sunday: 12:00 AM - 11:59 PM Monday: 12:00 AM - 11:59 PM Tuesday: 12:00 AM - 11:59 PM Wednesday: 12:00 AM - 11:59 PM Thursday: 12:00 AM - 11:59 PM Friday: 12:00 AM - 11:59 PM Saturday: 12:00 AM - 11:59 PM ","http://paperretriever.com","38.66973","-90.50098","3.27760823515029","Catalogs; Computer Paper; Greeting Cards; Magazines; Paper (Mixed); Newspapers; Office Paper; Computer (Recycling); Computer Monitors; Electronics; Laptop Computers; Computer Peripherals; Tablets; Video Game Consoles; PlayStation Consoles","false","true","This site only accepts clean and dry paper.","","false","false","false","false"
"Shapiro Metals","","9666 Olive Boulevard #410","Saint Louis","","MO","63132","3143819300","0","","https://shapirometals.com/","38.6728173","-90.3887448","3.30425469522037","","false","false","","","false","false","false","false"
"US Post Office","USPS Discarded Lobby Mail Recycling Program","9621 Olive Blvd","Saint Louis","Saint Louis","MO","63132","0","0","","","38.67346","-90.38835","3.30864221814002","Computer (Recycling); Computer Monitors; Electronics; Laptop Computers; Computer Peripherals; Tablets; Video Game Consoles; PlayStation Consoles","false","true","","","false","false","false","false"
"Parkwood Elementary School","Parkwood Elementary School","3199 Parkwood Ln","Maryland Heights","Saint Louis","MO","63043","3143813700","0","Sunday: 12:00 AM - 11:59 PM Monday: 12:00 AM - 11:59 PM Tuesday: 12:00 AM - 11:59 PM Wednesday: 12:00 AM - 11:59 PM Thursday: 12:00 AM - 11:59 PM Friday: 12:00 AM - 11:59 PM Saturday: 12:00 AM - 11:59 PM ","http://paperretriever.com","38.73708","-90.43429","3.32048829432931","Catalogs; Greeting Cards; Magazines; Paper (Mixed); Newspapers; Office Paper; Computer (Recycling); Computer Monitors; Electronics; Laptop Computers; Computer Peripherals; Tablets; Video Game Consoles; PlayStation Consoles","false","true","This site only accepts clean and dry paper.","","false","false","false","false"
"Rose Acres Elementary School","Rose Acres Elementary School","2905 Rose Acres Ln ","Maryland Heights","St Louis County","MO","63043","3143813700","0","Sunday: 12:00 AM - 11:59 PM Monday: 12:00 AM - 11:59 PM Tuesday: 12:00 AM - 11:59 PM Wednesday: 12:00 AM - 11:59 PM Thursday: 12:00 AM - 11:59 PM Friday: 12:00 AM - 11:59 PM Saturday: 12:00 AM - 11:59 PM ","http://paperretriever.com","38.737521","-90.455577","3.33117749810728","Catalogs; Greeting Cards; Magazines; Paper (Mixed); Newspapers; Office Paper; Computer (Recycling); Computer Monitors; Electronics; Laptop Computers; Computer Peripherals; Tablets; Video Game Consoles; PlayStation Consoles","false","true","This site only accepts clean and dry paper.","","false","false","false","false"
"St. Louis Priory School","St. Louis Priory School","500 S Mason Rd","Saint Louis","Saint Louis","MO","63141","3143813700","0","Sunday: 12:00 AM - 11:59 PM Monday: 12:00 AM - 11:59 PM Tuesday: 12:00 AM - 11:59 PM Wednesday: 12:00 AM - 11:59 PM Thursday: 12:00 AM - 11:59 PM Friday: 12:00 AM - 11:59 PM Saturday: 12:00 AM - 11:59 PM ","http://paperretriever.com","38.64769","-90.48238","3.51549550029957","Catalogs; Greeting Cards; Magazines; Paper (Mixed); Newspapers; Office Paper; Computer (Recycling); Computer Monitors; Electronics; Laptop Computers; Computer Peripherals; Tablets; Video Game Consoles; PlayStation Consoles","false","true","This site only accepts clean and dry paper.","","false","false","false","false"
"St. Kevin School","St. Kevin School","10901 Saint Henry Ln","Saint Ann","Saint Louis","MO","63074","3143813700","0","Sunday: 12:00 AM - 11:59 PM Monday: 12:00 AM - 11:59 PM Tuesday: 12:00 AM - 11:59 PM Wednesday: 12:00 AM - 11:59 PM Thursday: 12:00 AM - 11:59 PM Friday: 12:00 AM - 11:59 PM Saturday: 12:00 AM - 11:59 PM ","http://paperretriever.com","38.72434","-90.39785","3.5207625326661","Catalogs; Greeting Cards; Magazines; Paper (Mixed); Newspapers; Office Paper; Computer (Recycling); Computer Monitors; Electronics; Laptop Computers; Computer Peripherals; Tablets; Video Game Consoles; PlayStation Consoles","false","true","This site only accepts clean and dry paper.","","false","false","false","false"
"Oak Hill School","Oak Hill School","801 S Spoede Rd","Saint Louis","Saint Louis","MO","63131","3143813700","0","Sunday: 12:00 AM - 11:59 PM Monday: 12:00 AM - 11:59 PM Tuesday: 12:00 AM - 11:59 PM Wednesday: 12:00 AM - 11:59 PM Thursday: 12:00 AM - 11:59 PM Friday: 12:00 AM - 11:59 PM Saturday: 12:00 AM - 11:59 PM ","http://paperretriever.com","38.64341","-90.41544","3.60917330972434","Catalogs; Greeting Cards; Magazines; Paper (Mixed); Newspapers; Office Paper; Computer (Recycling); Computer Monitors; Electronics; Laptop Computers; Computer Peripherals; Tablets; Video Game Consoles; PlayStation Consoles","false","true","This site only accepts clean and dry paper.","","false","false","false","false"
"Visitation Academy","Visitation Academy","3020 N Ballas Rd","Saint Louis","Saint Louis","MO","63131","3143813700","0","Sunday: 12:00 AM - 11:59 PM Monday: 12:00 AM - 11:59 PM Tuesday: 12:00 AM - 11:59 PM Wednesday: 12:00 AM - 11:59 PM Thursday: 12:00 AM - 11:59 PM Friday: 12:00 AM - 11:59 PM Saturday: 12:00 AM - 11:59 PM ","http://paperretriever.com","38.63703","-90.44352","3.65463028440009","Catalogs; Greeting Cards; Magazines; Paper (Mixed); Newspapers; Office Paper; Computer (Recycling); Computer Monitors; Electronics; Laptop Computers; Computer Peripherals; Tablets; Video Game Consoles; PlayStation Consoles","false","true","This site only accepts clean and dry paper.","","false","false","false","false"
"The Breast Cancer Research Foundation Car Donation Program","","","St Louis","","MO","63132","8554502873","0","","https://cardonationfoundation.org/","38.6785807","-90.3795438","3.6668400135226","","false","false","","","false","false","false","false"
"Walgreens","Walgreens","12345 Old Saint Charles Rd ","Bridgeton","St Louis County","MO","63044","3147702479","0","","http://www.walgreens.com","38.743677","-90.4371304","3.74644776566434","Cell Phones; Inkjet Cartridge Refilling; Inkjet Printer Cartridges; Computer (Recycling); Computer Monitors; Electronics; Laptop Computers; Computer Peripherals; Tablets; Video Game Consoles; PlayStation Consoles","false","true","","","false","false","false","false"
"City of Town and Country","City of Town and Country","1011 Municipal Center Dr","Saint Louis","Saint Louis","MO","63131","3144324696","0","","http://www.call2recycle.org/","38.63483","-90.4507","3.81277491978529","Cell Phones; Ni-Cd Batteries; Li-Ion Batteries; Ni-MH Batteries; Ni-Zn Batteries; Small Sealed Lead Acid Batteries; Computer (Recycling); Computer Monitors; Electronics; Laptop Computers; Computer Peripherals; Tablets; Video Game Consoles; PlayStation Consoles","false","true","The U.S. EPA estimates that more than 350 million rechargeable batteries are purchased annually in the U.S. Thanks to the environmental commitment of this location, its easy and free to recycle your rechargeable batteries. Look for the recycling box or ask a staff member how you can do your part for the environment.","","false","false","false","false"
"Hunter Douglas Metals Inc","Hunter Douglas Metals Inc","3731 Saint Kevin Park Dr","Saint Ann","Saint Louis","MO","63074","3142097504","0","","","38.72811","-90.39226","3.91889038368209","Aluminum; Computer (Recycling); Computer Monitors; Electronics; Laptop Computers; Computer Peripherals; Tablets; Video Game Consoles; PlayStation Consoles","false","true","","","false","false","false","false"
"Walgreens","Walgreens","9395 Olive Blvd","Saint Louis","Saint Louis","MO","63132","3144328660","0","","http://www.walgreens.com","38.67419","-90.37566","3.94429433673327","Cell Phones; Inkjet Cartridge Refilling; Inkjet Printer Cartridges; Computer (Recycling); Computer Monitors; Electronics; Laptop Computers; Computer Peripherals; Tablets; Video Game Consoles; PlayStation Consoles","false","true","","","false","false","false","false"
"City of St. Ann Reclamation Center","","Ashby Road ","St Ann","","MO","63074","3144278009","0","","http://stannmo.org/291/Yard-Waste-Branch-Leaf-Collection","38.7255194","-90.3869837","4.02160311650375","","false","false","","","false","false","false","false"
"Lowe's","","11974 Paul Mayer Ave","Bridgeton","","MO","63044","3142920042","0","","https://newsroom.lowes.com/responsibility/operational-excellence/","38.7465906","-90.4256631","4.06740961614422","","false","false","","","false","false","false","false"
"Shop N Save","","10634 St Charles Rock Road","St Ann","","MO","63074","3144296300","0","","","38.7307601","-90.3903289","4.11966273101706","","false","false","","","false","false","false","false"
"Call2Recycle at Lowe's","Call2Recycle at Lowe's","11974 Paul Mayer Ave","Bridgeton","Saint Louis","MO","63044","3142920042","0","Monday: 6:00 AM - 10:00 PM Tuesday: 6:00 AM - 10:00 PM Wednesday: 6:00 AM - 10:00 PM Thursday: 6:00 AM - 10:00 PM Friday: 6:00 AM - 10:00 PM Saturday: 6:00 AM - 10:00 PM Sunday: 8:00 AM - 8:00 PM ","http://www.lowes.com/","38.74677","-90.42259","4.12689234450802","Cell Phones; Compact Fluorescent Lights; Ni-Cd Batteries; Plastic Shopping Bags; Li-Ion Batteries; Ni-MH Batteries; Ni-Zn Batteries; Small Sealed Lead Acid Batteries; Computer (Recycling); Computer Monitors; Electronics; Laptop Computers; Computer Peripherals; Tablets; Video Game Consoles; PlayStation Consoles","false","true","As an environmentally-committed retailer, Lowes offers a recycling center near store entrances to give consumers a free and easy way to properly dispose of rechargeable batteries, cell phones, CFLs and plastic shopping bags; materials that otherwise could be potentially harmful to the environment.  Look for the recycling center or ask a store associate for more details.","","false","false","false","false"
"Call2Recycle at the Home Depot","Call2Recycle at the Home Depot","11215 Saint Charles Rock Rd","Bridgeton","Saint Louis","MO","63044","3142915288","0","","http://www.homedepot.com/","38.73885","-90.40084","4.16665019045728","Cell Phones; Compact Fluorescent Lights; Ni-Cd Batteries; Li-Ion Batteries; Ni-MH Batteries; Ni-Zn Batteries; Small Sealed Lead Acid Batteries; Computer (Recycling); Computer Monitors; Electronics; Laptop Computers; Computer Peripherals; Tablets; Video Game Consoles; PlayStation Consoles","false","true","The Home Depot accepts used rechargeable batteries and compact fluorescent bulbs. Look for the orange drop boxes, usually located near the front entrance near the customer service desk, or ask a store associate for more details.","","false","false","false","false"
"Schnucks","Schnucks","11253 Saint Charles Rock Rd","Bridgeton","Saint Louis","MO","63044","3147380677","0","","http://www.schnucks.com/","38.73885","-90.40084","4.16665019045728","Plastic Shopping Bags; Food Storage Bags; Computer (Recycling); Computer Monitors; Electronics; Laptop Computers; Computer Peripherals; Tablets; Video Game Consoles; PlayStation Consoles","false","true","","","false","false","false","false"
"Home Depot","Home Depot","11215 Saint Charles Rock Rd","Bridgeton","Saint Louis","MO","63044","3142915288","0","","http://www.homedepot.com","38.73885","-90.40084","4.16665019045728","Compact Fluorescent Lights; Batteries (Rechargeable); Computer (Recycling); Computer Monitors; Electronics; Laptop Computers; Computer Peripherals; Tablets; Video Game Consoles; PlayStation Consoles; Batteries (Rechargeable); Cell Phone Batteries; Li-Ion Batteries; Ni-Cd Batteries; Ni-MH Batteries; Small Sealed Lead Acid Batteries","false","true","Home Depot accepts compact fluorescent bulbs and used power tool rechargeable batteries. Look for the orange drop boxes, usually located near the front entrance near the customer service desk.","Call2Recycle","false","false","false","false"
"Pattonville Learning Center","Pattonville Learning Center","11097 Saint Charles Rock Rd","Saint Ann","Saint Louis","MO","63074","3143813700","0","Sunday: 12:00 AM - 11:59 PM Monday: 12:00 AM - 11:59 PM Tuesday: 12:00 AM - 11:59 PM Wednesday: 12:00 AM - 11:59 PM Thursday: 12:00 AM - 11:59 PM Friday: 12:00 AM - 11:59 PM Saturday: 12:00 AM - 11:59 PM ","http://paperretriever.com","38.7358","-90.39548","4.17967612967496","Catalogs; Greeting Cards; Magazines; Paper (Mixed); Newspapers; Office Paper; Computer (Recycling); Computer Monitors; Electronics; Laptop Computers; Computer Peripherals; Tablets; Video Game Consoles; PlayStation Consoles","false","true","This site only accepts clean and dry paper.","","false","false","false","false"
"Holman Middle School","Holman Middle School","11055 Saint Charles Rock Rd","Saint Ann","Saint Louis","MO","63074","3143813700","0","Sunday: 12:00 AM - 11:59 PM Monday: 12:00 AM - 11:59 PM Tuesday: 12:00 AM - 11:59 PM Wednesday: 12:00 AM - 11:59 PM Thursday: 12:00 AM - 11:59 PM Friday: 12:00 AM - 11:59 PM Saturday: 12:00 AM - 11:59 PM ","http://paperretriever.com","38.7358","-90.39548","4.17967612967496","Catalogs; Greeting Cards; Magazines; Paper (Mixed); Newspapers; Office Paper; Computer (Recycling); Computer Monitors; Electronics; Laptop Computers; Computer Peripherals; Tablets; Video Game Consoles; PlayStation Consoles","false","true","This site only accepts clean and dry paper.","","false","false","false","false"
"Firestone Complete Auto Care","","10750 St Charles Rock Rd","Saint Ann","","MO","63074","3142916000","0","","https://www.firestonecompleteautocare.com/","38.7326909","-90.3910339","4.18520158363721","","false","false","","","false","false","false","false"
