name,description,address,city,region,province,postal_code,phone,fax,hours,url,latitude,longitude,distance,materials,pickup,dropoff,notes,groups,curbside,municipal,national,event_only
"O'Neal Convenience Center","O'Neal Convenience Center","3769 Camp Rd","Greer","Greenville","SC","29651","8642439672","0","Tuesday: 7:00 AM - 6:00 PM Wednesday: 7:00 AM - 6:00 PM Thursday: 7:00 AM - 6:00 PM Friday: 7:00 AM - 6:00 PM Saturday: 7:00 AM - 6:00 PM ","http://www.greenvillecounty.org/solid_waste/","35.00984","-82.27307","5.81246947390244","Plastic #1 (PETE); Plastic #2 (HDPE); Aerosol Spray Cans; Aluminum Cans; Antifreeze; Glass (Blue); Glass (Brown); Lead Acid (Pb) Batteries; Cardboard; Cell Phones; Glass (Clear); Clothing; CD/DVD/Blu-ray/UHD discs; Compact Fluorescent Lights; Computer Monitors; Computer (Recycling); Cooking Oil; Eyeglasses; Glass (Green); Inkjet Printer Cartridges; Large Household Appliances; Magazines; Paper (Mixed); Newspapers; Latex Paint; Alkaline/Single-Use Batteries; Televisions; Tin or Steel Cans; Tree Trimmings; Used Motor Oil; Used Oil Filters; Office Paper; Stereo Equipment; Printers/Scanners/Fax Machines; Textiles; Refrigerators; VCRs","false","true","Greenville County Residential Waste and Recycling Centers  are located throughout the county to provide convenient self-disposal drop off stations for the County's residents. Disposal at these facilities is limited to three cubic yards per day. These locations are for residential waste only, no construction debris or businesses.","","false","false","false","false"
"PCS Store LLC","","3701 Pelham Rd","Greenville","","SC","29615","8642869757","0","","","34.8591502","-82.2671113","5.83956492129375","","false","false","","","false","false","false","false"
"Earth Fare","","3620 Pelham Road","Greenville","","SC","29615","8642439672","0","","https://www.greenvillecounty.org/solidWaste/Default.aspx","34.8585646","-82.2683442","5.90571424781476","","false","false","","","false","false","false","false"
"O'Neal Convenience Center","","3769 Camp Road","Greenville","","SC","29651","8642439672","0","","https://www.greenvillecounty.org/solidWaste/Default.aspx","35.013239","-82.2747015","6.06295400684655","","false","false","","","false","false","false","false"
"Greenville County Christmas Tree Collection Event - O'Neal","","3769 Camp Rd","Greer","","SC","29651","8642439672","0","","https://www.greenvillecounty.org/solidWaste/Default.aspx","35.013239","-82.2747015","6.06295400684655","","false","false","","","false","false","false","false"
"Firestone Complete Auto Care","","3045 Wade Hampton Blvd","Taylors","","SC","29687","8642448473","0","","https://www.firestonecompleteautocare.com/","34.9084241","-82.3286355","6.22322415276857","","false","false","","","false","false","false","false"
"O'Reilly Auto Parts","null","313 Spartanburg Highway","Wellford","","SC","29385","8644399726","0","","http://oreillyauto.custhelp.com/app/error/error_id/6","34.955351","-82.1147012","6.33515226848556","","false","false","","","false","false","false","false"
"Advance Auto Parts","Advance Auto Parts","3033 Wade Hampton Blvd","Taylors","Greenville","SC","29687","8643220975","0","Monday: 7:00 AM - 9:00 PM Tuesday: 7:00 AM - 9:00 PM Wednesday: 7:00 AM - 9:00 PM Thursday: 7:00 AM - 9:00 PM Friday: 7:00 AM - 9:00 PM Saturday: 7:00 AM - 9:00 PM Sunday: 10:00 AM - 8:00 PM ","http://www.advanceautoparts.com","34.90638","-82.33044","6.36459970420146","Lead Acid (Pb) Batteries; Used Motor Oil; Computer (Recycling); Computer Monitors; Electronics; Laptop Computers; Printers/Scanners/Fax Machines; Small Televisions; Televisions; Video Game Consoles; PlayStation Consoles","false","true","","","false","false","false","false"
"Walmart Supercenter","","3027 Wade Hampton Blvd","Taylors","","SC","29687","8642928155","0","","https://www.walmart.com/","34.9081018","-82.3316823","6.39446682596953","","false","false","","","false","false","false","false"
"Walmart Tire and Lube Express","","3027 Wade Hampton Blvd","Taylors","","SC","29687","8642928155","0","","https://www.walmart.com/cp/ideas/8932632","34.9081018","-82.3316823","6.39446682596953","","false","false","","","false","false","false","false"
"Leigh Fibers, Inc.","","","Wellford","","SC","29385","8649495621","0","","https://leighfibers.com/","34.9509521","-82.1059416","6.76774030609609","","false","false","","","false","false","false","false"
"Spartanburg County Household Hazardous Waste Program","","","Wellford","","SC","29385","8649491658","0","","https://www.spartanburgcounty.org","34.9509521","-82.1059416","6.76774030609609","","false","false","","","false","false","false","false"
"Office Depot","Office Depot","2801 Wade Hampton Blvd","Taylors","Greenville","SC","29687","8642921664","0","Monday: 8:00 AM - 9:00 PM Tuesday: 8:00 AM - 9:00 PM Wednesday: 8:00 AM - 9:00 PM Thursday: 8:00 AM - 9:00 PM Friday: 8:00 AM - 9:00 PM Saturday: 9:00 AM - 9:00 PM Sunday: 10:00 AM - 7:00 PM ","http://www.officedepot.com/","34.90058","-82.33685","6.84234671487593","Cell Phones; Computer Monitors; Electronics; Inkjet Printer Cartridges; Ni-Cd Batteries; Office Equipment; Batteries (Rechargeable); Laser Toner Cartridges; MP3 Players; Small Televisions; Computer (Recycling); Laptop Computers; Printers/Scanners/Fax Machines; Televisions; Video Game Consoles; PlayStation Consoles","false","true","Office Depot offers electronics recycling for a small fee. Visit their Web site for more details and store locations. Recycle cell phones, PDAs, rechargeable batteries and ink and toner cartridges for FREE!","","false","false","false","false"
"Publix","","2801 Wade Hampton Boulevard","Taylors","","SC","29687","8646097300","0","","https://sustainability.publix.com/storefront/customer-recycling/","34.9013846","-82.3382375","6.89636463498844","","false","false","","","false","false","false","false"
"Dependable Drum","Dependable Drum","103 Adelaide Dr","Greenville","Greenville","SC","29615","8007323786","0","Monday: 8:00 AM - 5:00 PM Tuesday: 8:00 AM - 5:00 PM Wednesday: 8:00 AM - 5:00 PM Thursday: 8:00 AM - 5:00 PM Friday: 8:00 AM - 5:00 PM ","http://www.dependabledrum.com/container_recycling.htm","34.88387","-82.32897","6.94908119146668","Ferrous Metals (Steel or Iron); Computer (Recycling); Computer Monitors; Electronics; Laptop Computers; Printers/Scanners/Fax Machines; Small Televisions; Televisions; Video Game Consoles; PlayStation Consoles","false","true","Dependable's recycling program includes fiber, polyethylene, and steel containers.  These containers are processed for a reuse program or are reduced to component parts for use in fuel blending, paper products, packaging and building materials.  Dependable Drum offers tracking documentation for its empty container disposal programs and a coordination service for the disposal of both hazardous and non-hazardous waste.","","false","false","false","false"
"Spartanburg County Recycling Drop-off Program - Wellford Landfill","","595 Little Mountain Rd","Wellford","","SC","29385","8649491658","0","","https://www.spartanburgcounty.org","35.0021324","-82.1316238","6.94909796482526","","false","false","","","false","false","false","false"
"Spartanburg County Recycling Drop-off Program - Wellford","","591 Little Mountain Road","Wellford","","SC","29385","8649491658","0","","https://www.spartanburgcounty.org/166/Recycling","35.0012174","-82.1299063","6.981608127704","","false","false","","","false","false","false","false"
"Advance Auto Parts","Advance Auto Parts","317 Spartanburg Hwy","Wellford","Spartanburg","SC","29385","8649499100","0","Monday: 7:00 AM - 9:00 PM Tuesday: 7:00 AM - 9:00 PM Wednesday: 7:00 AM - 9:00 PM Thursday: 7:00 AM - 9:00 PM Friday: 7:00 AM - 9:00 PM Saturday: 7:00 AM - 9:00 PM Sunday: 10:00 AM - 8:00 PM ","http://www.advanceautoparts.com","34.94848","-82.10119","7.01071907406571","Lead Acid (Pb) Batteries; Used Motor Oil; Computer (Recycling); Computer Monitors; Electronics; Laptop Computers; Printers/Scanners/Fax Machines; Small Televisions; Televisions; Video Game Consoles; PlayStation Consoles","false","true","","","false","false","false","false"
"OmniSource Southeast","","557 Old Spartanburg Highway","Wellford","","SC","29385","8643984022","0","","https://www.omnisource.com/","34.9431569","-82.1002841","7.02618961298316","","false","false","","","false","false","false","false"
"AER Worldwide","","140 Congress Boulevard, Suite E","Duncan","","SC","29334","8644869950","0","","https://www.aerworldwide.com/","34.9062118","-82.1022406","7.19821398504578","","false","false","","","false","false","false","false"
"USPS Post Office Box Lobby Recycling Program","US Post Office","1003 Main St","Wellford","Spartanburg","SC","29385","8002758777","0","","https://www.usps.com/","34.95673","-82.09948","7.19829142161718","Catalogs; Greeting Cards; Magazines; Paper (Mixed)","false","true","","","false","false","false","false"
"Goodwill Industries of Upstate/Midlands South Carolina Inc. - Dell Reconnect Donation Site","","3715 E N St","Greenville","","SC","29615","8643510100","0","","https://www.dellreconnect.com/","34.8743292","-82.327724","7.25504022061461","","false","false","","","false","false","false","false"
"Bi-Lo","","3715 East North Street","Greenville","","SC","29615","8642439672","0","","https://www.greenvillecounty.org/solidWaste/Default.aspx","34.8743292","-82.327724","7.25504022061461","","false","false","","","false","false","false","false"
"Bi-Lo","","3715 East North Street","Greenville","","SC","29615","8642439672","0","","https://www.greenvillecounty.org/solidWaste/Default.aspx","34.8743292","-82.327724","7.25504022061461","","false","false","","","false","false","false","false"
"Goodwill Industries of Upstate/Midlands South Carolina Inc. - Dell Reconnect Donation Site","","3715 East North Street","Greenville","","SC","29615","0","0","","https://www.goodwillsc.org/","34.8743292","-82.327724","7.25504022061461","","false","false","","","false","false","false","false"
"Earth Fare","Earth Fare","3620 Pelham Rd","Greenville","Greenville","SC","29615","8642439672","0","Sunday: 12:00 AM - 11:59 PM Monday: 12:00 AM - 11:59 PM Tuesday: 12:00 AM - 11:59 PM Wednesday: 12:00 AM - 11:59 PM Thursday: 12:00 AM - 11:59 PM Friday: 12:00 AM - 11:59 PM Saturday: 12:00 AM - 11:59 PM ","http://www.greenvillecounty.org/solid_waste/","34.85081","-82.30131","7.33251839647617","Plastic #1 (PETE); Plastic #2 (HDPE); Aluminum Cans; Glass (Blue); Glass (Brown); Brown Paper Bags; Cardboard; Glass (Clear); Computer Paper; Glass (Green); Paper (Mixed); Newspapers; Phone books; Tin or Steel Cans; Office Paper","false","true","","","false","false","false","false"
"Bi-Lo","Bi-Lo","3715 E North St","Greenville","Greenville","SC","29615","8642439672","0","Sunday: 12:00 AM - 11:59 PM Monday: 12:00 AM - 11:59 PM Tuesday: 12:00 AM - 11:59 PM Wednesday: 12:00 AM - 11:59 PM Thursday: 12:00 AM - 11:59 PM Friday: 12:00 AM - 11:59 PM Saturday: 12:00 AM - 11:59 PM ","http://www.greenvillecounty.org/solid_waste/","34.87281","-82.32926","7.38721857120412","Plastic #1 (PETE); Plastic #2 (HDPE); Aluminum Cans; Glass (Blue); Glass (Brown); Brown Paper Bags; Cardboard; Glass (Clear); Computer Paper; Glass (Green); Paper (Mixed); Newspapers; Phone books; Tin or Steel Cans; Office Paper","false","true","","","false","false","false","false"
"OmniSource Southeast","OmniSource Southeast","557 Old Spartanburg Hwy","Wellford","Spartanburg","SC","29385","8644865920","8644399846","","http://www.omnisource.com","34.94069","-82.09213","7.47759729549804","Aluminum Cans; Car; Automobile Parts; Ferrous Metals (Steel or Iron); Large Household Appliances; Lawn Equipment; Non-ferrous (Copper/Brass/Tin); Holiday Lights; Wire; Air Conditioners; Refrigerators; Scrap Metal; Radiators; Computer (Recycling); Computer Monitors; Electronics; Laptop Computers; Printers/Scanners/Fax Machines; Small Televisions; Televisions; Video Game Consoles; PlayStation Consoles","false","true","","","false","false","false","false"
"Spartanburg County Recycling Drop-off Program - Berrys Pond","","355 Tucapau Road","Duncan","","SC","29334","8649491658","0","","https://www.spartanburgcounty.org/166/Recycling","34.8915676","-82.1011611","7.60584902724723","","false","false","","","false","false","false","false"
"Walgreens","Walgreens","902 Pelham Rd","Greenville","Greenville","SC","29615","8642346462","0","","http://www.walgreens.com","34.85499","-82.32012","7.80537161045523","Cell Phones; Inkjet Printer Cartridges; Computer (Recycling); Computer Monitors; Electronics; Laptop Computers; Printers/Scanners/Fax Machines; Small Televisions; Televisions; Video Game Consoles; PlayStation Consoles","false","true","","","false","false","false","false"
"Blue Ridge High School","","2151 Fews Chapel Road","Greer","","SC","29651","8642439672","0","","https://www.greenvillecounty.org/solidWaste/Default.aspx","35.0400296","-82.2865029","8.01462056851848","","false","false","","","false","false","false","false"
"Blue Ridge High School","Blue Ridge High School","2151 Fews Chapel Rd","Greer","Greenville","SC","29651","8642439672","0","Sunday: 12:00 AM - 11:59 PM Monday: 12:00 AM - 11:59 PM Tuesday: 12:00 AM - 11:59 PM Wednesday: 12:00 AM - 11:59 PM Thursday: 12:00 AM - 11:59 PM Friday: 12:00 AM - 11:59 PM Saturday: 12:00 AM - 11:59 PM ","http://www.greenvillecounty.org/solid_waste/","35.04122","-82.28837","8.13525699017842","Plastic #1 (PETE); Plastic #2 (HDPE); Aluminum Cans; Glass (Blue); Glass (Brown); Brown Paper Bags; Cardboard; Glass (Clear); Computer Paper; Glass (Green); Paper (Mixed); Newspapers; Phone books; Tin or Steel Cans; Office Paper","false","true","","","false","false","false","false"
"AER Worldwide","AER Worldwide","140 Congress Blvd Ste E","Duncan","Spartanburg","SC","29334","8644869950","8644869949","","http://www.aerworldwide.com","34.89545","-82.08751","8.22430051743382","Computer (Recycling); Electronics; Office Equipment; Computer Monitors; Laptop Computers; Printers/Scanners/Fax Machines; Small Televisions; Televisions; Video Game Consoles; PlayStation Consoles","true","true","","","false","false","false","false"
"US Post Office","US Post Office","100 Orchard Park Dr","Greenville","Greenville","SC","29616","0","0","","https://www.usps.com/ship/recycle-through-usps.htm","34.85598","-82.33167","8.22918511231655","Inkjet Printer Cartridges; Computer (Recycling); Computer Monitors; Electronics; Laptop Computers; Printers/Scanners/Fax Machines; Small Televisions; Televisions; Video Game Consoles; PlayStation Consoles","false","true","Free, postage-paid Mail Back envelopes can be found on display in the lobby. There is no limit to the number of envelopes customers may take. The contents of the envelope must weigh less than 13 ounces and the envelope must be able to seal completely. For more details visit<a href="http://www.maxback.com/mxb-postoffice-collaboration" target="_blank">MaxBack</a>.","","false","false","false","false"
"Firestone Complete Auto Care","","923 Haywood Rd","Greenville","","SC","29615","8642718473","0","","https://www.firestonecompleteautocare.com/","34.8574686","-82.3355669","8.32681774535161","","false","false","","","false","false","false","false"
"Goodwill Industries of Upstate/Midlands South Carolina Inc. - Dell Reconnect Donation Site","","1902 Woodruff Road","Greenville","","SC","29607","8644588168","0","","https://www.goodwillsc.org/","34.8195936","-82.263507","8.34336143084386","","false","false","","","false","false","false","false"
"Batteries Plus Bulbs","null","1791 Woodruff Rd Suite A","Greenville","","SC","29607","8642540307","0","","https://www.batteriesplus.com/store-locator/sc/227?utm_source=local&utm_medium=earth911","34.8206793","-82.2697871","8.37443335309429","","false","false","","","false","false","false","false"
"Verizon Wireless","Verizon Wireless","469 Congaree Rd","Greenville","Greenville","SC","29607","8666444532","0","","http://www.verizonwireless.com/","34.8502","-82.32946","8.41314744610043","Cell Phones; Cell Phone Batteries; Computer (Recycling); Computer Monitors; Electronics; Laptop Computers; Printers/Scanners/Fax Machines; Small Televisions; Televisions; Video Game Consoles; PlayStation Consoles","false","true","<A Href="https://www.trade-in.vzw.com/home.aspx">
The Verizon Wireless Trade-In Program</A> allows you to trade in your used handset or tablet in a convenient and responsible way. 
<P>
<P>
Verizon Wireless works every day to protect our environment and give our customers opportunities to do the same. <A Href="http://aboutus.vzw.com/Green_Initiative/overview.html">Click here</A> for more examples of the earth-friendly initiatives and programs Verizon Wireless is proud to offer and support.","","false","false","false","false"
"Publix","","215 Pelham Road","Greenville","","SC","29615","8643708210","0","","https://sustainability.publix.com/storefront/customer-recycling/","34.8678679","-82.3475626","8.43274465279875","","false","false","","","false","false","false","false"
"Call2Recycle at Grainger","Call2Recycle at Grainger","730 Congaree Rd","Greenville","Greenville","SC","29607","8642880110","0","","http://www.grainger.com/","34.84203","-82.31949","8.4473159904534","Cell Phones; Ni-Cd Batteries; Li-Ion Batteries; Ni-MH Batteries; Ni-Zn Batteries; Small Sealed Lead Acid Batteries; Computer (Recycling); Computer Monitors; Electronics; Laptop Computers; Printers/Scanners/Fax Machines; Small Televisions; Televisions; Video Game Consoles; PlayStation Consoles","false","true","The U.S. EPA estimates that more than 350 million rechargeable batteries are purchased annually in the U.S. Thanks to the environmental commitment of this location, its easy and free to recycle your batteries. Bring your rechargeable batteries to this location and look for the recycling box or ask an associate how you can do your part for the environment.","","false","false","false","false"
"Kohl's","","1219 Woodruff Road","Greenville","","SC","29607","8642881317","0","","https://corporate.kohls.com/","34.8247967","-82.2873513","8.47562782107974","","false","false","","","false","false","false","false"
"Batteries Plus","Batteries Plus","1791 Woodruff Rd","Greenville","Greenville","SC","29607","8642540307","8642540315","","http://www.batteriesplus.com/store_details/227.aspx","34.81966","-82.27266","8.49287268424793","Compact Fluorescent Lights; Batteries (Rechargeable); Alkaline/Single-Use Batteries; Computer (Recycling); Computer Monitors; Electronics; Laptop Computers; Printers/Scanners/Fax Machines; Small Televisions; Televisions; Video Game Consoles; PlayStation Consoles","false","true","Some fees for battery recycling may apply.  Please contact your Local store for details. 
<p>
Batteries Plus lead by example by recycling the majority of the batteries we sell. Not only do we recycle to protect our environment, we support retail and business customers alike by keeping them in full compliance with federal, state, municipal, EPA and DOT regulations governing the disposal and recycling of spent batteries and select electronics.","","false","false","false","false"
"Best Buy","Best Buy","1125 Woodruff Rd ","Greenville","Greenville County","SC","29607","8643291291","0","","https://www.bestbuy.com/recycle","34.8287274","-82.2974545","8.49571288733172","Large Household Appliances; Refrigerators; Televisions; AC Power Plugs; Batteries (Rechargeable); Cables & Connectors; Car Audio/Video Equipment; Cell Phone Batteries; Cell Phones; Computer (Recycling); Hard Drives; Computer Monitors; Cameras; DVD Players/Blu-Ray Players/DVRs; Electronics; E-Readers; GPS Units; Headphones; Inkjet Printer Cartridges; Laptop Computers; Laser Toner Cartridges; Li-Ion Batteries; MP3 Players; Network Equipment; Ni-Cd Batteries; Ni-MH Batteries; Ni-Zn Batteries; Computer Peripherals; Portable Media Players; Printers/Scanners/Fax Machines; Small Electronics; Small Sealed Lead Acid Batteries; Stereo Equipment; Tablets; Telephones; UPS Batteries/Backup Systems; VCRs; Video Game Systems; Blu-Ray Players; Digital Converter Boxes; Small Televisions; Video Game Consoles; PlayStation Consoles","true","true","2 TVs per visit, 3 e-waste items per day; $25 fee for TVs and Monitors; $19.99 pick-up fee with delivery; $99.99 standalone pickup fee; TVs and monitors collected at Best Buy stores are not manufacturer supported in this state, listing provided as an additional option for consumers.","Sony, Vizio, OEM","false","false","false","false"
"Staples","Staples","1451 Woodruff Road","Greenville","Greenville County","SC","29607","8642890044","0","Monday: 8:00 AM - 9:00 PM Tuesday: 8:00 AM - 9:00 PM Wednesday: 8:00 AM - 9:00 PM Thursday: 8:00 AM - 9:00 PM Friday: 8:00 AM - 9:00 PM Saturday: 9:00 AM - 9:00 PM Sunday: 10:00 AM - 6:00 PM ","https://www.staples.com/recycle","34.8228296","-82.2831241","8.50174359001568","AC Power Plugs; Batteries (Rechargeable); Cables & Connectors; Cell Phone Batteries; Cell Phones; Computer (Recycling); Hard Drives; Computer Monitors; Cameras; DVD Players/Blu-Ray Players/DVRs; Electronics; E-Readers; GPS Units; Headphones; Inkjet Printer Cartridges; Laptop Computers; Laser Toner Cartridges; Li-Ion Batteries; MP3 Players; Network Equipment; Ni-Cd Batteries; Ni-MH Batteries; Ni-Zn Batteries; Computer Peripherals; Portable Media Players; Printers/Scanners/Fax Machines; Small Electronics; Small Sealed Lead Acid Batteries; Stereo Equipment; Tablets; Telephones; UPS Batteries/Backup Systems; VCRs; Video Game Systems; Blu-Ray Players; Digital Converter Boxes; Small Televisions; Televisions; Video Game Consoles; PlayStation Consoles; Alkaline/Single-Use Batteries","false","true","NO TVs; Limit 6 CEDs per day; ","Sony, Vizio, OEM","false","false","false","false"
"Sams Club","","1211 Woodruff Rd","Greenville","","SC","29615","8649877220","0","","https://www.samsclub.com/","34.8250867","-82.2892178","8.50291134019468","","false","false","","","false","false","false","false"
"Walmart Supercenter","","1451 Woodruff Rd","Greenville","","SC","29615","8642973031","0","","https://www.walmart.com/","34.822641","-82.2831092","8.51339088204427","","false","false","","","false","false","false","false"
"Staples","","1451 Woodruff Road","Greenville","","SC","29607","8642890044","0","","https://www.staples.com/sbd/cre/marketing/sustainability-center/recycling-services/","34.822641","-82.2831092","8.51339088204427","Alkaline/Single-Use Batteries; Batteries (Rechargeable); Cell Phone Batteries; Li-Ion Batteries; Ni-Cd Batteries; Ni-MH Batteries; Small Sealed Lead Acid Batteries; Alkaline/Single-Use Batteries; Button Batteries; Non-rechargeable lithium batteries; Cell Phones","false","true","","Call2Recycle","false","false","false","false"
"Walmart","","1451 Woodruff Road","Greenville","","SC","29615","8642439672","0","","https://www.greenvillecounty.org/solidWaste/Default.aspx","34.822641","-82.2831092","8.51339088204427","","false","false","","","false","false","false","false"
