name,description,address,city,region,province,postal_code,phone,fax,hours,url,latitude,longitude,distance,materials,pickup,dropoff,notes,groups,curbside,municipal,national,event_only
"Sullivan County Recycling Drop-Off Site - Colonial Heights","","101 Lakecrest Dr","Kingsport","","TN","37663","4232792865","0","","http://www.sullivancountytn.gov/node/34","36.4803536","-82.4929981","0.908767381869925","","false","false","","","false","false","false","false"
"Colonial Heights Hardware","Colonial Heights Hardware","4225 Fort Henry Dr","Kingsport","Sullivan","TN","37663","4232399117","0","","http://www.doitbest.com/","36.48259","-82.49993","1.14624045777704","Cell Phones; Ni-Cd Batteries; Li-Ion Batteries; Ni-MH Batteries; Ni-Zn Batteries; Small Sealed Lead Acid Batteries; Video Game Consoles; PlayStation Consoles","false","true","The U.S. EPA estimates that more than 350 million rechargeable batteries are purchased annually in the U.S. Thanks to the environmental commitment of this location, its easy and free to recycle your batteries. Bring your rechargeable batteries to this location and look for the recycling box or ask an associate how you can do your part for the environment.","","false","false","false","false"
"O'Reilly Auto Parts","null","4219 Fort Henry Dr Ste 2","Kingsport","","TN","37663","4232390182","0","","http://oreillyauto.custhelp.com/app/error/error_id/6","36.4833911","-82.4995552","1.19037203634383","","false","false","","","false","false","false","false"
"The UPS Store","The UPS Store","4128 Fort Henry Dr","Kingsport","Sullivan","TN","37663","4232397500","0","Monday: 8:00 AM - 7:00 PM Tuesday: 8:00 AM - 7:00 PM Wednesday: 8:00 AM - 7:00 PM Thursday: 8:00 AM - 7:00 PM Friday: 8:00 AM - 7:00 PM Saturday: 9:00 AM - 5:00 PM ","http://www.upsstore.com","36.48436","-82.50254","1.31704442897563","Packing Peanut (Reuse); Video Game Consoles; PlayStation Consoles","false","true","","","false","false","false","false"
"Advance Auto Parts","Advance Auto Parts","4118 Fort Henry Dr","Kingsport","Sullivan","TN","37663","4232393656","0","Monday: 7:00 AM - 9:00 PM Tuesday: 7:00 AM - 9:00 PM Wednesday: 7:00 AM - 9:00 PM Thursday: 7:00 AM - 9:00 PM Friday: 7:00 AM - 9:00 PM Saturday: 7:00 AM - 9:00 PM Sunday: 10:00 AM - 8:00 PM ","http://www.advanceautoparts.com","36.48442","-82.50263","1.32296172156442","Lead Acid (Pb) Batteries; Used Motor Oil; Video Game Consoles; PlayStation Consoles","false","true","","","false","false","false","false"
"Walgreens","Walgreens","3904 Fort Henry Dr","Kingsport","Sullivan","TN","37663","4232396845","0","","http://www.walgreens.com","36.48971","-82.50602","1.73403672319231","Cell Phones; Inkjet Printer Cartridges; Video Game Consoles; PlayStation Consoles","false","true","","","false","false","false","false"
"Lee County Recycling Drop-off Location","","Warriors Path Rd","Ewing","","VA","24248","2763467702","0","","http://www.leecova.org/SolidWaste.html","36.4974603","-82.4793568","2.20745337175614","","false","false","","","false","false","false","false"
"Walmart","Walmart","3200 Fort Henry Dr","Kingsport","Sullivan","TN","37664","4233920600","0","","http://www.walmart.com","36.50962","-82.51612","3.21748586885589","Lead Acid (Pb) Batteries; Plastic Shopping Bags; Food Storage Bags; Video Game Consoles; PlayStation Consoles","false","true","","","false","false","false","false"
"Walmart Tire & Lube Express","Walmart Tire & Lube Express","3200 Fort Henry Dr","Kingsport","Sullivan","TN","37664","4233920600","0","","http://www.walmart.com/catalog/catalog.gsp?cat=495843","36.50962","-82.51612","3.21748586885589","Lead Acid (Pb) Batteries; Used Motor Oil; Oil Filters; Video Game Consoles; PlayStation Consoles","false","true","","","false","false","false","false"
"Walmart Supercenter","","3200 Fort Henry Dr","Kingsport","","TN","37664","4233920600","0","","https://www.walmart.com/","36.5085853","-82.5191548","3.22728900940794","","false","false","","","false","false","false","false"
"Walmart Tire and Lube Express","","3200 Fort Henry Dr","Kingsport","","TN","37664","4233920600","0","","https://www.walmart.com/cp/ideas/8932632","36.5085853","-82.5191548","3.22728900940794","","false","false","","","false","false","false","false"
"Washington County Household Hazardous Waste Collection Event","","","Gray","","TN","37615","4237531652","0","","http://www.washingtoncountytn.org/departments/solid_waste/household hazardous waste collection date","36.4198258","-82.4765352","3.38763342014631","","false","false","","","false","false","false","false"
"O'Reilly Auto Parts","","18 Great Oak Way","Johnson City","","TN","37615","4234772791","0","","http://oreillyauto.custhelp.com/app/error/error_id/6","36.4218063","-82.464656","3.49029623662007","","false","false","","","false","false","false","false"
"Advance Auto Parts","Advance Auto Parts","101 Centre Park Dr","Gray","Washington","TN","37615","4234672010","0","Monday: 7:00 AM - 9:00 PM Tuesday: 7:00 AM - 9:00 PM Wednesday: 7:00 AM - 9:00 PM Thursday: 7:00 AM - 9:00 PM Friday: 7:00 AM - 9:00 PM Saturday: 7:00 AM - 9:00 PM Sunday: 10:00 AM - 8:00 PM ","http://www.advanceautoparts.com","36.41662","-82.4679","3.74701940562717","Lead Acid (Pb) Batteries; Used Motor Oil; Video Game Consoles; PlayStation Consoles","false","true","","","false","false","false","false"
"Walgreens","Walgreens","5104 Bobby Hicks Hwy","Johnson City","Washington","TN","37615","4234773372","0","","http://www.walgreens.com","36.4117","-82.47274","3.98483434355655","Cell Phones; Inkjet Printer Cartridges; Video Game Consoles; PlayStation Consoles","false","true","","","false","false","false","false"
"RadioShack","RadioShack","2101 Fort Henry Dr","Kingsport","Sullivan","TN","37664","4232463383","0","Monday: 10:00 AM - 8:00 PM Tuesday: 10:00 AM - 8:00 PM Wednesday: 10:00 AM - 8:00 PM Thursday: 10:00 AM - 8:00 PM Friday: 10:00 AM - 8:00 PM Saturday: 10:00 AM - 8:00 PM Sunday: 11:00 AM - 7:00 PM ","http://www.radioshack.com","36.52828","-82.52315","4.55618529160334","Ni-Cd Batteries; Batteries (Rechargeable); Video Game Consoles; PlayStation Consoles","false","true","","","false","false","false","false"
"Kingsport Town Center 1","null","2101 Fort Henry Dr","Kingsport","Sullivan","TN","37664","8583244111","0","","http://www.ecoatm.com/","36.52828","-82.52315","4.55618529160334","Cell Phones; Tablets; MP3 Players; Video Game Consoles; PlayStation Consoles","false","true","ecoATM is an automated, consumer self-serve kiosk that quickly buys back and recycles old phones, mp3 players and tablets.
</br>
Call or email <a href="mailto:max@ecoATM.com">customer support</a> with questions.","","false","false","false","false"
"Wireless Experts","","2101 Fort Henry Dr","Kingsport","","TN","37664","4232456726","0","","","36.529139","-82.520444","4.55724808357546","","false","false","","","false","false","false","false"
"JCPenney","","2101 Fort Henry Dr","Kingsport","","TN","37664","4232450241","0","","https://www.jcpenney.com/","36.529139","-82.520444","4.55724808357546","","false","false","","","false","false","false","false"
"Walgreens","Walgreens","2200 Memorial Ct","Kingsport","Sullivan","TN","37664","4232460234","0","","http://www.walgreens.com","36.531","-82.52189","4.70571845953841","Cell Phones; Inkjet Printer Cartridges; Video Game Consoles; PlayStation Consoles","false","true","","","false","false","false","false"
"Washington County Convenience Center - Gray","","160 Mosley Rd","Johnson City","","TN","37615","4234771552","0","","http://www.washingtoncountytn.org/departments/solid_waste/locations","36.3988107","-82.4840231","4.74784840059342","","false","false","","","false","false","false","false"
"Gray Convenience Center","","160 Mosley Rd","Johnson City","","TN","37615","4234771552","0","","https://www.hugedomains.com/domain_profile.cfm?d=washingtoncountytn&e=com","36.3988107","-82.4840231","4.74784840059342","","false","false","","","false","false","false","false"
"US Post Office","US Post Office","1001 N Eastman Rd","Kingsport","Sullivan","TN","37664","0","0","","https://www.usps.com/ship/recycle-through-usps.htm","36.52921","-82.53385","4.8685877060704","Inkjet Printer Cartridges; Video Game Consoles; PlayStation Consoles","false","true","Free, postage-paid Mail Back envelopes can be found on display in the lobby. There is no limit to the number of envelopes customers may take. The contents of the envelope must weigh less than 13 ounces and the envelope must be able to seal completely. For more details visit<a href="http://www.maxback.com/mxb-postoffice-collaboration" target="_blank">MaxBack</a>.","","false","false","false","false"
"Sullivan County Recycling Drop-Off Site - Sullivan Middle School","","4154 S Wilcox Dr","Kingsport","","TN","37660","4232792865","0","","http://www.sullivancountytn.gov/node/34","36.4766123","-82.5890364","5.42065736623562","","false","false","","","false","false","false","false"
"Batteries Plus Bulbs","null","2003 N. Eastman Rd Suite 140","Kingsport","","TN","37660","4232471175","0","","https://www.batteriesplus.com/store-locator/tn/550?utm_source=local&utm_medium=earth911","36.5440873","-82.5167974","5.48421407106257","","false","false","","","false","false","false","false"
"Call2Recycle at Lowe's","Call2Recycle at Lowe's","2526 E Stone Dr","Kingsport","Sullivan","TN","37660","4232465660","0","","http://www.lowes.com/","36.54663","-82.50217","5.51466569945869","Cell Phones; Compact Fluorescent Lights; Ni-Cd Batteries; Plastic Shopping Bags; Li-Ion Batteries; Ni-MH Batteries; Ni-Zn Batteries; Small Sealed Lead Acid Batteries; Video Game Consoles; PlayStation Consoles","false","true","As an environmentally-committed retailer, Lowes offers a recycling center near store entrances to give consumers a free and easy way to properly dispose of rechargeable batteries, cell phones, CFLs and plastic shopping bags; materials that otherwise could be potentially harmful to the environment.  Look for the recycling center or ask a store associate for more details.","","false","false","false","false"
"Walmart","Walmart","2500 W Stone Dr","Kingsport","Sullivan","TN","37660","4232464676","0","","http://www.walmart.com","36.54712","-82.50093","5.54188126574908","Lead Acid (Pb) Batteries; Plastic Shopping Bags; Food Storage Bags; Video Game Consoles; PlayStation Consoles","false","true","","","false","false","false","false"
"Walmart Tire & Lube Express","Walmart Tire & Lube Express","2500 W Stone Dr","Kingsport","Sullivan","TN","37660","4232464676","0","","http://www.walmart.com/catalog/catalog.gsp?cat=495843","36.54712","-82.50093","5.54188126574908","Lead Acid (Pb) Batteries; Used Motor Oil; Oil Filters; Video Game Consoles; PlayStation Consoles","false","true","","","false","false","false","false"
"Office Depot","Office Depot","2003 N Eastman Rd","Kingsport","Sullivan","TN","37660","4233783594","0","Monday: 8:00 AM - 9:00 PM Tuesday: 8:00 AM - 9:00 PM Wednesday: 8:00 AM - 9:00 PM Thursday: 8:00 AM - 9:00 PM Friday: 8:00 AM - 9:00 PM Saturday: 9:00 AM - 9:00 PM Sunday: 10:00 AM - 7:00 PM ","http://www.officedepot.com/","36.5452","-82.51827","5.57937505838224","Cell Phones; Computer Monitors; Electronics; Inkjet Printer Cartridges; Ni-Cd Batteries; Office Equipment; Batteries (Rechargeable); Laser Toner Cartridges; MP3 Players; Small Televisions; Video Game Consoles; PlayStation Consoles","false","true","Office Depot offers electronics recycling for a small fee. Visit their Web site for more details and store locations. Recycle cell phones, PDAs, rechargeable batteries and ink and toner cartridges for FREE!","","false","false","false","false"
"AT&T Wireless","AT&T Wireless","2003 N Eastman Rd","Kingsport","Sullivan","TN","37660","4232300888","0","","http://www.att.com/","36.5452","-82.51827","5.57937505838224","Cell Phones; Ni-Cd Batteries; Batteries (Rechargeable); Cell Phone Batteries; Tablets; Li-Ion Batteries; Video Game Consoles; PlayStation Consoles","false","true","Receive an AT&T Promotion Card worth the trade-in value of your smartphone, tablet, or netbook. You can also donate the trade-in value to Cell Phones for Soldiers.","","false","false","false","false"
"Batteries Plus","Batteries Plus","2003 N Eastman Rd","Kingsport","Sullivan","TN","37660","4232471175","4232477611","","http://www.batteriesplus.com/store_details/550.aspx","36.5452","-82.51827","5.57937505838224","Compact Fluorescent Lights; Batteries (Rechargeable); Alkaline/Single-Use Batteries; Video Game Consoles; PlayStation Consoles","false","true","Some fees for battery recycling may apply.  Please contact your Local store for details. 
<p>
Batteries Plus lead by example by recycling the majority of the batteries we sell. Not only do we recycle to protect our environment, we support retail and business customers alike by keeping them in full compliance with federal, state, municipal, EPA and DOT regulations governing the disposal and recycling of spent batteries and select electronics.","","false","false","false","false"
"Tom Brooks Exxon","Tom Brooks Exxon","1800 E Stone Dr","Kingsport","Sullivan","TN","37660","4232475211","0","Monday: 8:00 AM - 6:00 PM Tuesday: 8:00 AM - 6:00 PM Wednesday: 8:00 AM - 6:00 PM Thursday: 8:00 AM - 6:00 PM Friday: 8:00 AM - 6:00 PM Saturday: 8:00 AM - 6:00 PM ","","36.54629","-82.51392","5.59505987623581","Antifreeze; Transmission Fluid; Used Motor Oil; Video Game Consoles; PlayStation Consoles","false","true","","","false","false","false","false"
"Lowe's","","2526 E Stone Dr","Kingsport","","TN","37660","4232465660","0","","https://newsroom.lowes.com/responsibility/operational-excellence/","36.5481919","-82.5003165","5.61280851805935","Batteries (Rechargeable); Cell Phone Batteries; Li-Ion Batteries; Ni-Cd Batteries; Ni-MH Batteries; Small Sealed Lead Acid Batteries; Cell Phones","false","true","","Call2Recycle","false","false","false","false"
"Verizon Wireless","Verizon Wireless","2608 E Stone Dr","Kingsport","Sullivan","TN","37660","8008801077","0","","http://www.verizonwireless.com/","36.54897","-82.4962","5.65274225066752","Cell Phones; Cell Phone Batteries; Video Game Consoles; PlayStation Consoles","false","true","<A Href="https://www.trade-in.vzw.com/home.aspx">
The Verizon Wireless Trade-In Program</A> allows you to trade in your used handset or tablet in a convenient and responsible way. 
<P>
<P>
Verizon Wireless works every day to protect our environment and give our customers opportunities to do the same. <A Href="http://aboutus.vzw.com/Green_Initiative/overview.html">Click here</A> for more examples of the earth-friendly initiatives and programs Verizon Wireless is proud to offer and support.","","false","false","false","false"
"Call2Recycle at RadioShack","Call2Recycle at RadioShack","2633 E Stone Dr Ste B","Kingsport","Sullivan","TN","37660","4232463383","0","","http://www.radioshack.com/","36.54924","-82.49461","5.66858610668738","Cell Phones; Ni-Cd Batteries; Li-Ion Batteries; Ni-MH Batteries; Ni-Zn Batteries; Small Sealed Lead Acid Batteries; Video Game Consoles; PlayStation Consoles","false","true","As the first national retailer to partner with Call2Recycle, RadioShack is at the forefront of the rechargeable battery recycling cause and is pleased to offer battery recycling at thousands of convenient RadioShack locations for free.  Simply drop them off at your local RadioShack and theyll take care of the rest.  Ask a store associate for more details.","","false","false","false","false"
"Sprint Store","null","2600 E Stone Dr Ste A","Kingsport","","TN","37660","4237651406","0","","https://newsroom.sprint.com/csr/device-donations/","36.5493919","-82.496045","5.68153623096241","","false","false","","","false","false","false","false"
"Target","Target","2626 E Stone Dr","Kingsport","Sullivan","TN","37660","4235781726","0","","http://www.target.com/","36.55003","-82.49349","5.72201829305221","Aluminum Cans; Cell Phones; Inkjet Printer Cartridges; MP3 Players; Plastic #1 (PETE); Plastic #2 (HDPE); Plastic Shopping Bags; Video Game Consoles; PlayStation Consoles","false","true","","","false","false","false","false"
"RadioShack","RadioShack","2637 E Stone Dr","Kingsport","Sullivan","TN","37660","4232463383","0","","http://www.radioshack.com","36.55022","-82.49281","5.73478671289824","Ni-Cd Batteries; Batteries (Rechargeable); Video Game Consoles; PlayStation Consoles","false","true","","","false","false","false","false"
"AutoZone","AutoZone","1649 E Stone Dr","Kingsport","Sullivan","TN","37660","4233921100","0","","http://www.autozone.com","36.54794","-82.51934","5.77761756150442","Lead Acid (Pb) Batteries; Used Motor Oil; Video Game Consoles; PlayStation Consoles","false","true","Most AutoZone stores accept used motor oil, transmission fluid, gear oil and automotive batteries. Call to see what your local store is currently accepting.","","false","false","false","false"
"Target Store","","2626 E Stone Dr","Kingsport","","TN","37660","4235781726","0","","https://corporate.target.com/corporate-responsibility/planet","36.5513851","-82.4932057","5.81545734348626","","false","false","","","false","false","false","false"
"Kohl's","","2626 E Stone Dr","Kingsport","","TN","37660","4232471466","0","","https://corporate.kohls.com/","36.5513851","-82.4932057","5.81545734348626","","false","false","","","false","false","false","false"
"Thompson Metal Services Inc","Thompson Metal Services Inc","424 Riverport Rd","Kingsport","Sullivan","TN","37660","4232455124","4232452880","","http://www.tmsitn.com","36.53031","-82.56216","5.84047644467936","Aluminum Cans; Lead Acid (Pb) Batteries; Ferrous Metals (Steel or Iron); Large Household Appliances; Lawn Equipment; Non-ferrous (Copper/Brass/Tin); Batteries (Rechargeable); Tin or Steel Cans; Wire; Radiators; Video Game Consoles; PlayStation Consoles","false","true","","","false","false","false","false"
"Best Buy","Best Buy","2716 E Stone Dr ","Kingsport","Sullivan County","TN","37660","4233437639","0","","https://www.bestbuy.com/recycle","36.5518602","-82.4905889","5.84865943548028","Large Household Appliances; Refrigerators; Televisions; AC Power Plugs; Batteries (Rechargeable); Cables & Connectors; Car Audio/Video Equipment; Cell Phone Batteries; Cell Phones; Computer (Recycling); Hard Drives; Computer Monitors; Cameras; DVD Players/Blu-Ray Players/DVRs; Electronics; E-Readers; GPS Units; Headphones; Inkjet Printer Cartridges; Laptop Computers; Laser Toner Cartridges; Li-Ion Batteries; MP3 Players; Network Equipment; Ni-Cd Batteries; Ni-MH Batteries; Ni-Zn Batteries; Computer Peripherals; Portable Media Players; Printers/Scanners/Fax Machines; Small Electronics; Small Sealed Lead Acid Batteries; Stereo Equipment; Tablets; Telephones; UPS Batteries/Backup Systems; VCRs; Video Game Systems; Blu-Ray Players; Digital Converter Boxes; Small Televisions; Video Game Consoles; PlayStation Consoles","true","true","2 TVs per visit, 3 e-waste items per day; $25 fee for TVs and Monitors; $19.99 pick-up fee with delivery; $99.99 standalone pickup fee; ","Sony, Vizio, OEM","false","false","false","false"
"Best Buy","","2716 E Stone Dr","Kingsport","","TN","37660","4233437639","0","","https://www.bestbuy.com/site/services/recycling/pcmcat149900050025.c?id=pcmcat149900050025","36.5518602","-82.4905889","5.84865943548028","","false","false","","","false","false","false","false"
"O'Reilly Auto Parts","null","1532 East Stone Drive","Kingsport","","TN","37660","4232300222","0","","http://oreillyauto.custhelp.com/app/error/error_id/6","36.5493877","-82.5213318","5.90359951472643","","false","false","","","false","false","false","false"
"Tractor Supply","Tractor Supply","2606 Minnich TRL","Kingsport","Sullivan","TN","37660","4232456660","0","","http://www.tractorsupply.com","36.54972","-82.52422","5.97150285970045","Transmission Fluid; Used Motor Oil; Video Game Consoles; PlayStation Consoles","false","true","","","false","false","false","false"
"Habitat for Humanity Restore","Habitat for Humanity Restore","750 E Main St","Kingsport","Sullivan","TN","37660","4233784760","0","Tuesday: 9:30 AM - 3:30 PM Thursday: 9:30 AM - 3:30 PM Saturday: 9:30 AM - 3:30 PM ","http://www.habitat.org","36.54136","-82.55545","6.212068194849","Bikes; Books (Reuse); Brick(s); Carpet; Ceiling Tiles; Cell Phones; Ceramic Tiles; Clothing; CD/DVD/Blu-ray/UHD discs; Computer (Reuse); Computer Monitors; Computer (Recycling); Construction Materials (Reuse); Electronics; Gift Bags; Furniture; Household Goods; Lawn Equipment; Linoleum; Musical Instruments; Ornaments; Porcelain; Reusable Appliance Donation; Roofing Materials; Sporting Goods; Stone; Telephones; Miscellaneous Tools; Children's Toys; VHS & Cassette Tapes; Windows; MP3 Players; Video Game Consoles; PlayStation Consoles","true","true","The ReStore raises funds by selling merchandise and, after expenses, uses all profits to build more homes.  Habitat also provides families an opportunity to buy building materials that they may not otherwise be able to afford. This will help raise the standards of housing. By recycling goods that would have been sent to a landfill, the ReStore also helps reduce waste disposal costs. If you have materials to donate, please call for more information. The Habitat ReStore takes most materials and the staff will be glad to talk with you.","","false","false","false","false"
"Advance Auto Parts","Advance Auto Parts","1121 E Stone Dr","Kingsport","Sullivan","TN","37660","4232464290","0","Monday: 7:00 AM - 9:00 PM Tuesday: 7:00 AM - 9:00 PM Wednesday: 7:00 AM - 9:00 PM Thursday: 7:00 AM - 9:00 PM Friday: 7:00 AM - 9:00 PM Saturday: 7:00 AM - 9:00 PM Sunday: 10:00 AM - 8:00 PM ","http://www.advanceautoparts.com","36.55185","-82.53004","6.21392907250542","Lead Acid (Pb) Batteries; Used Motor Oil; Video Game Consoles; PlayStation Consoles","false","true","","","false","false","false","false"
"Cartridge World","","1101 East Stone Drive","Kingsport","","TN","37660","4232477465","0","","","36.5517344","-82.5306324","6.21763789304216","","false","false","","","false","false","false","false"
"Cartridge World","Cartridge World","1101 E Stone Dr","Kingsport","Sullivan","TN","37660","4232477465","0","Monday: 9:00 AM - 6:00 PM Tuesday: 9:00 AM - 6:00 PM Wednesday: 9:00 AM - 6:00 PM Thursday: 9:00 AM - 6:00 PM Friday: 9:00 AM - 6:00 PM Saturday: 10:00 AM - 3:00 PM ","http://www.cartridgeworldusa.com","36.55203","-82.53049","6.23411722643696","Inkjet Cartridge Refilling; Inkjet Printer Cartridges; Laser Toner Refilling; Laser Toner Cartridges; Video Game Consoles; PlayStation Consoles","false","true","For more information, please call 1-888-99-REFILL.","","false","false","false","false"
"White's Food Center","White's Food Center","5215 Memorial Blvd","Kingsport","Sullivan","TN","37664","4232792879","0","","","36.54991","-82.44368","6.31608245136478","Aluminum Cans; Computer Paper; Greeting Cards; Paper (Mixed); Tin or Steel Cans; Newspapers; Video Game Consoles; PlayStation Consoles","false","true","","","false","false","false","false"
"Kingsport Transfer Station","","1921 Brookside Ln","Kingsport","","TN","37660","4233236439","0","","","36.5564266","-82.5175878","6.32301364793536","","false","false","","","false","false","false","false"
"Sullivan County Recycling Drop-Off Site - Kingsport Convenience Center/Transfer Station","","1921 Brookside Ln","Kingsport","","TN","37660","4232242475","0","","http://www.sullivancountytn.gov/node/34","36.5564266","-82.5175878","6.32301364793536","","false","false","","","false","false","false","false"
"Goodwill Industries of Tenneva Area - Main Office","Goodwill Industries of Tenneva Area - Main Office","2017 Brookside Ln","Kingsport","Sullivan","TN","37660","4232450600","0","Monday: 8:00 AM - 5:00 PM Tuesday: 8:00 AM - 5:00 PM Wednesday: 8:00 AM - 5:00 PM Thursday: 8:00 AM - 5:00 PM Friday: 8:00 AM - 5:00 PM ","http://www.goodwilltnva.org/","36.55758","-82.51701","6.39371599987549","Bikes; Books (Reuse); Cell Phones; Clothing; CD/DVD/Blu-ray/UHD discs; Computer (Reuse); Computer Monitors; Computer (Recycling); Electronics; Gift Bags; Eyeglasses; Furniture; Household Goods; Lawn Equipment; Musical Instruments; Office Furniture; Office Equipment; Ornaments; Reusable Appliance Donation; Sporting Goods; Telephones; Miscellaneous Tools; Children's Toys; Car Donation; VHS & Cassette Tapes; MP3 Players; Video Game Consoles; PlayStation Consoles","false","true","This site will accept household items that are in good clean condition.  All tools, equipment, electronics, and machines must be in good, working condition.","","false","false","false","false"
"Home Depot","Home Depot","2000 Harrell Rd ","Kingsport","Sullivan County","TN","37660","4233785000","0","","http://www.homedepot.com","36.5548163","-82.5309535","6.42396831086897","Compact Fluorescent Lights; Batteries (Rechargeable); Video Game Consoles; PlayStation Consoles","false","true","Home Depot accepts compact fluorescent bulbs and used power tool rechargeable batteries. Look for the orange drop boxes, usually located near the front entrance near the customer service desk.","","false","false","false","false"
"ExpertTire Store","ExpertTire Store","401 W Center St","Kingsport","Sullivan","TN","37660","4232456186","0","","http://www.firestone.com","36.54534","-82.55652","6.47326005116769","Lead Acid (Pb) Batteries; Used Motor Oil; Video Game Consoles; PlayStation Consoles","false","true","","","false","false","false","false"
"Home Depot","","2000 Harrell Rd","Kingsport","","TN","37660","4233785000","0","","https://ecooptions.homedepot.com/","36.5552482","-82.5324501","6.48029990153449","Batteries (Rechargeable); Cell Phone Batteries; Li-Ion Batteries; Ni-Cd Batteries; Ni-MH Batteries; Small Sealed Lead Acid Batteries","false","true","","Call2Recycle","false","false","false","false"
"Thompson Metal Services Inc","","424 Riverport Rd","Kingsport","","TN","37660","4232455124","0","","","36.5389625","-82.5714131","6.62853307732171","","false","false","","","false","false","false","false"
