name,description,address,city,region,province,postal_code,phone,fax,hours,url,latitude,longitude,distance,materials,pickup,dropoff,notes,groups,curbside,municipal,national,event_only
"Keep America Beautiful Cars to Donate","","","Kingsport","","TN","37660","8554262474","0","","https://www.kab.org/?pagename=car_donation","36.5298904","-82.5834947","6.66897046801813","","false","false","","","false","false","false","false"
"Wise Recycling","","3232 East Stone Drive","Kingsport","","TN","37660","4233430004","0","","http://wiserecycling.com/","36.5616131","-82.4622865","6.72964437003825","","false","false","","","false","false","false","false"
"Expert Tire","","401 W Center St","Kingsport","","TN","37660","4232456186","0","","https://www.firestonecompleteautocare.com/","36.5491013","-82.5636814","6.91199537787177","","false","false","","","false","false","false","false"
"Call2Recycle at the Home Depot","Call2Recycle at the Home Depot","2000 Harrell Rd","Kingsport","Sullivan","TN","37660","4233785000","0","","http://www.homedepot.com/","36.56092","-82.54752","7.16642100960969","Cell Phones; Compact Fluorescent Lights; Ni-Cd Batteries; Li-Ion Batteries; Ni-MH Batteries; Ni-Zn Batteries; Small Sealed Lead Acid Batteries; Video Game Consoles; PlayStation Consoles","false","true","The Home Depot accepts used rechargeable batteries and compact fluorescent bulbs. Look for the orange drop boxes, usually located near the front entrance near the customer service desk, or ask a store associate for more details.","","false","false","false","false"
"Johnson City Recycling Drop‐Off","Johnson City Recycling Drop‐Off","2544 Boones Creek Rd","Johnson City","Washington","TN","37615","4239752763","0","Sunday: 12:00 AM - 12:00 AM Monday: 12:00 AM - 12:00 AM Tuesday: 12:00 AM - 12:00 AM Wednesday: 12:00 AM - 12:00 AM Thursday: 12:00 AM - 12:00 AM Friday: 12:00 AM - 12:00 AM Saturday: 12:00 AM - 12:00 AM ","http://www.johnsoncitytn.com/","36.37059","-82.42966","7.52643367567217","Brown Paper Bags; Cardboard; Computer Paper; Glass (Brown); Glass (Clear); Glass (Green); Newspapers; Office Paper; Paper (Mixed); Paperboard; Plastic #1 (PETE); Plastic #2 (HDPE); Compostable Plastic","false","true","","","false","false","false","false"
"Walgreens","Walgreens","1420 W Stone Dr","Kingsport","Sullivan","TN","37660","4232463551","0","","http://www.walgreens.com","36.55838","-82.57559","7.81838998199323","Cell Phones; Inkjet Cartridge Refilling; Inkjet Printer Cartridges; Video Game Consoles; PlayStation Consoles","false","true","","","false","false","false","false"
"Lynn Garden Exxon","Lynn Garden Exxon","817 Lynn Garden Dr","Kingsport","Sullivan","TN","37660","4232455621","0","Monday: 6:00 AM - 9:00 PM Tuesday: 6:00 AM - 9:00 PM Wednesday: 6:00 AM - 9:00 PM Thursday: 6:00 AM - 9:00 PM Friday: 6:00 AM - 9:00 PM Saturday: 6:00 AM - 9:00 PM Sunday: 8:00 AM - 9:00 PM ","","36.56469","-82.56504","7.85643281378446","Transmission Fluid; Used Motor Oil; Video Game Consoles; PlayStation Consoles","false","true","","","false","false","false","false"
"Call2Recycle at Lowe's","Call2Recycle at Lowe's","2324 W Stone Dr","Kingsport","Sullivan","TN","37660","4235783220","0","Monday: 6:00 AM - 10:00 PM Tuesday: 6:00 AM - 10:00 PM Wednesday: 6:00 AM - 10:00 PM Thursday: 6:00 AM - 10:00 PM Friday: 6:00 AM - 10:00 PM Saturday: 6:00 AM - 10:00 PM Sunday: 8:00 AM - 8:00 PM ","http://www.lowes.com/","36.55567","-82.59652","8.42157135815916","Cell Phones; Compact Fluorescent Lights; Ni-Cd Batteries; Plastic Shopping Bags; Li-Ion Batteries; Ni-MH Batteries; Ni-Zn Batteries; Small Sealed Lead Acid Batteries; Video Game Consoles; PlayStation Consoles","false","true","As an environmentally-committed retailer, Lowes offers a recycling center near store entrances to give consumers a free and easy way to properly dispose of rechargeable batteries, cell phones, CFLs and plastic shopping bags; materials that otherwise could be potentially harmful to the environment.  Look for the recycling center or ask a store associate for more details.","","false","false","false","false"
"Lowe's","","2324 W Stone Dr","Kingsport","","TN","37660","4235783220","0","","https://newsroom.lowes.com/responsibility/operational-excellence/","36.5580831","-82.599375","8.6515734585433","Batteries (Rechargeable); Cell Phone Batteries; Li-Ion Batteries; Ni-Cd Batteries; Ni-MH Batteries; Small Sealed Lead Acid Batteries; Cell Phones","false","true","","Call2Recycle","false","false","false","false"
"Johnson City Recycling Drop‐Off","Johnson City Recycling Drop‐Off","120 Carroll Creek Rd ","Johnson City","Washington County","TN","37601","4239752763","0","Sunday: 12:00 AM - 12:00 AM Monday: 12:00 AM - 12:00 AM Tuesday: 12:00 AM - 12:00 AM Wednesday: 12:00 AM - 12:00 AM Thursday: 12:00 AM - 12:00 AM Friday: 12:00 AM - 12:00 AM Saturday: 12:00 AM - 12:00 AM ","http://www.johnsoncitytn.com/","36.3934327","-82.3652233","8.70554992193591","Brown Paper Bags; Cardboard; Computer Paper; Glass (Brown); Glass (Clear); Glass (Green); Newspapers; Office Paper; Paper (Mixed); Paperboard; Plastic #1 (PETE); Plastic #2 (HDPE); Compostable Plastic","false","true","","","false","false","false","false"
"Walmart Supercenter","","2500 W Stone Dr","Kingsport","","TN","37660","4232464676","0","","https://www.walmart.com/","36.5574849","-82.60326","8.77198952919954","","false","false","","","false","false","false","false"
"Walmart Tire and Lube Express","","2500 W Stone Dr","Kingsport","","TN","37660","4232464676","0","","https://www.walmart.com/cp/ideas/8932632","36.5574849","-82.60326","8.77198952919954","","false","false","","","false","false","false","false"
"OfficeMax","OfficeMax","3110 Browns Mill Rd","Johnson City","Washington","TN","37604","4232825600","0","Monday: 8:00 AM - 9:00 PM Tuesday: 8:00 AM - 9:00 PM Wednesday: 8:00 AM - 9:00 PM Thursday: 8:00 AM - 9:00 PM Friday: 8:00 AM - 9:00 PM Saturday: 9:00 AM - 9:00 PM Sunday: 11:00 AM - 6:00 PM ","http://www.officemax.com","36.36191","-82.40065","8.87857045121441","Cell Phones; Inkjet Cartridge Refilling; Inkjet Printer Cartridges; Laser Toner Cartridges; Video Game Consoles; PlayStation Consoles","false","true","This location features Phoenix Ink refill kiosks.","","false","false","false","false"
"Tractor Supply","","2606 Minnich Trail","Kingsport","","TN","37660","4232456660","0","","https://www.tractorsupply.com/","36.5571018","-82.6065537","8.88304448143353","","false","false","","","false","false","false","false"
"Call2Recycle at Grainger","Call2Recycle at Grainger","3105 Hanover Rd","Johnson City","Washington","TN","37604","4232824044","0","","http://www.grainger.com/","36.3568","-82.40414","9.06396255095286","Cell Phones; Ni-Cd Batteries; Li-Ion Batteries; Ni-MH Batteries; Ni-Zn Batteries; Small Sealed Lead Acid Batteries; Video Game Consoles; PlayStation Consoles","false","true","The U.S. EPA estimates that more than 350 million rechargeable batteries are purchased annually in the U.S. Thanks to the environmental commitment of this location, its easy and free to recycle your batteries. Bring your rechargeable batteries to this location and look for the recycling box or ask an associate how you can do your part for the environment.","","false","false","false","false"
"Walmart Supercenter","","3111 Browns Mill Rd","Johnson City","","TN","37604","4232825376","0","","https://www.walmart.com/","36.3592271","-82.3990826","9.08053175232809","","false","false","","","false","false","false","false"
"Walmart Tire and Lube Express","","3111 Browns Mill Rd","Johnson City","","TN","37604","4232825376","0","","https://www.walmart.com/cp/ideas/8932632","36.3592271","-82.3990826","9.08053175232809","","false","false","","","false","false","false","false"
"Call2Recycle at Tri-Cities Communications","Call2Recycle at Tri-Cities Communications","3217 Hanover Rd","Johnson City","Washington","TN","37604","4232830618","0","","http://www.tri-citiescomm.com/","36.35438","-82.40755","9.10576367099494","Cell Phones; Ni-Cd Batteries; Li-Ion Batteries; Ni-MH Batteries; Ni-Zn Batteries; Small Sealed Lead Acid Batteries; Video Game Consoles; PlayStation Consoles","false","true","The U.S. EPA estimates that more than 350 million rechargeable batteries are purchased annually in the U.S. Thanks to the environmental commitment of this location, its easy and free to recycle your batteries. Bring your rechargeable batteries to this location and look for the recycling box or ask an associate how you can do your part for the environment.","","false","false","false","false"
"Walmart","Walmart","3111 Browns Mill Rd","Johnson City","Washington","TN","37604","4232825376","0","","http://www.walmart.com","36.35907","-82.39611","9.18457507218542","Lead Acid (Pb) Batteries; Plastic Shopping Bags; Food Storage Bags; Video Game Consoles; PlayStation Consoles","false","true","","","false","false","false","false"
"Walmart Tire & Lube Express","Walmart Tire & Lube Express","3111 Browns Mill Rd","Johnson City","Washington","TN","37604","4232825376","0","","http://www.walmart.com/catalog/catalog.gsp?cat=495843","36.35907","-82.39611","9.18457507218542","Lead Acid (Pb) Batteries; Used Motor Oil; Oil Filters; Video Game Consoles; PlayStation Consoles","false","true","","","false","false","false","false"
"OfficeMax","","3110 Browns Mill Rd","Johnson City","","TN","37604","4232825600","0","","","36.3593726","-82.3947624","9.21142360961224","","false","false","","","false","false","false","false"
"Call2Recycle at Lowe's","Call2Recycle at Lowe's","180 Marketplace Dr","Johnson City","Washington","TN","37604","4232834477","0","Monday: 6:00 AM - 10:00 PM Tuesday: 6:00 AM - 10:00 PM Wednesday: 6:00 AM - 10:00 PM Thursday: 6:00 AM - 10:00 PM Friday: 6:00 AM - 10:00 PM Saturday: 6:00 AM - 10:00 PM Sunday: 8:00 AM - 8:00 PM ","http://www.lowes.com/","36.34959","-82.41303","9.24181341752691","Cell Phones; Compact Fluorescent Lights; Ni-Cd Batteries; Plastic Shopping Bags; Li-Ion Batteries; Ni-MH Batteries; Ni-Zn Batteries; Small Sealed Lead Acid Batteries; Video Game Consoles; PlayStation Consoles; Batteries (Rechargeable); Cell Phone Batteries; Li-Ion Batteries; Ni-Cd Batteries; Ni-MH Batteries; Small Sealed Lead Acid Batteries; Cell Phones","false","true","As an environmentally-committed retailer, Lowes offers a recycling center near store entrances to give consumers a free and easy way to properly dispose of rechargeable batteries, cell phones, CFLs and plastic shopping bags; materials that otherwise could be potentially harmful to the environment.  Look for the recycling center or ask a store associate for more details.","Call2Recycle","false","false","false","false"
"HobbyTown USA","HobbyTown USA","3515 Bristol Hwy","Johnson City","Washington","TN","37601","4236101010","0","","http://www.hobbytown.com/","36.3731","-82.37381","9.25121185825702","Cell Phones; Ni-Cd Batteries; Li-Ion Batteries; Ni-MH Batteries; Ni-Zn Batteries; Small Sealed Lead Acid Batteries; Video Game Consoles; PlayStation Consoles","false","true","The U.S. EPA estimates that more than 350 million rechargeable batteries are purchased annually in the U.S. Thanks to the environmental commitment of this location, its easy and free to recycle your batteries. Bring your rechargeable batteries to this location and look for the recycling box or ask an associate how you can do your part for the environment.","","false","false","false","false"
"Call2Recycle at The Tool Doctor","Call2Recycle at The Tool Doctor","3511 Bristol Hwy","Johnson City","Washington","TN","37601","4232823511","0","","http://www.call2recycle.org/","36.37276","-82.37411","9.25591330482631","Cell Phones; Ni-Cd Batteries; Li-Ion Batteries; Ni-MH Batteries; Ni-Zn Batteries; Small Sealed Lead Acid Batteries; Video Game Consoles; PlayStation Consoles","false","true","The U.S. EPA estimates that more than 350 million rechargeable batteries are purchased annually in the U.S. Thanks to the environmental commitment of this location, its easy and free to recycle your batteries. Bring your rechargeable batteries to this location and look for the recycling box or ask an associate how you can do your part for the environment.","","false","false","false","false"
"Southeast Recycling Technologies, Inc.","","906 Chase Dr","Johnson City","","TN","37604","8005923970","0","","","36.3531679","-82.4036989","9.28918396111637","","false","false","","","false","false","false","false"
"Sams Club","","3060 Franklin Terrace Dr","Johnson City","","TN","37604","4232822303","0","","https://www.samsclub.com/","36.3548041","-82.4000677","9.30305873884555","","false","false","","","false","false","false","false"
"Scott County Recycling Drop-off Location","","5018 East Carters Valley Road","Gate City","","VA","24251","2762254131","0","","http://www.scottcountyva.com/pubsafety.htm","36.6020775","-82.4875167","9.32109522114819","","false","false","","","false","false","false","false"
"Walgreens","Walgreens","2340 Highway 394","Blountville","Sullivan","TN","37617","4233231656","0","","http://www.walgreens.com","36.52522","-82.34027","9.34019909737919","Cell Phones; Inkjet Printer Cartridges; Video Game Consoles; PlayStation Consoles","false","true","","","false","false","false","false"
"Sam's Club","Sam's Club","3060 Franklin Ter","Johnson City","Washington","TN","37604","4232822303","0","","http://www.samsclub.com","36.35254","-82.40258","9.35898820535451","Lead Acid (Pb) Batteries; Video Game Consoles; PlayStation Consoles","false","true","","","false","false","false","false"
"Call2Recycle at RadioShack","Call2Recycle at RadioShack","525 W Oakland Ave Ste 1","Johnson City","Washington","TN","37604","4232825003","0","","http://www.radioshack.com/","36.35802","-82.39119","9.40442485673406","Cell Phones; Ni-Cd Batteries; Li-Ion Batteries; Ni-MH Batteries; Ni-Zn Batteries; Small Sealed Lead Acid Batteries; Video Game Consoles; PlayStation Consoles","false","true","As the first national retailer to partner with Call2Recycle, RadioShack is at the forefront of the rechargeable battery recycling cause and is pleased to offer battery recycling at thousands of convenient RadioShack locations for free.  Simply drop them off at your local RadioShack and theyll take care of the rest.  Ask a store associate for more details.","","false","false","false","false"
"RadioShack","RadioShack","525 W Oakland Ave Ste 1","Johnson City","Washington","TN","37604","4232825003","0","Monday: 10:00 AM - 8:00 PM Tuesday: 10:00 AM - 8:00 PM Wednesday: 10:00 AM - 8:00 PM Thursday: 10:00 AM - 8:00 PM Friday: 10:00 AM - 8:00 PM Saturday: 10:00 AM - 8:00 PM Sunday: 10:00 AM - 7:00 PM ","http://www.radioshack.com","36.35802","-82.39119","9.40442485673406","Cell Phones; Ni-Cd Batteries; Batteries (Rechargeable); Video Game Consoles; PlayStation Consoles","false","true","","","false","false","false","false"
"The Bike Shop - Johnson City","The Bike Shop - Johnson City","3208 Bristol HWY","Johnson City","Washington ","TN","37601","4239262453","0","","","36.3659132","-82.3791449101299","9.40622722381195","E-Bike Batteries","false","true","Call or Check Online for Hours","Call2Recycle","false","false","false","false"
"O'Reilly Auto Parts","null","3122 East Oakland Avenue","Johnson City","","TN","37601","4232826380","0","","http://oreillyauto.custhelp.com/app/error/error_id/6","36.3603792","-82.3867992","9.42392528751476","","false","false","","","false","false","false","false"
"Batteries Plus Bulbs","null","3018 Peoples St Suite 103","Johnson City","","TN","37604","4232823007","0","","https://www.batteriesplus.com/store-locator/tn/551?utm_source=local&utm_medium=earth911","36.3536055","-82.3972386","9.45919827927664","","false","false","","","false","false","false","false"
"Locust Mount Convenience Center","Locust Mount Convenience Center","224 Harmony Rd ","Jonesborough","Washington County","TN","37659","4237531804","0","Tuesday: 10:00 AM - 6:00 PM Wednesday: 10:00 AM - 6:00 PM Thursday: 10:00 AM - 6:00 PM Friday: 10:00 AM - 6:00 PM Saturday: 8:00 AM - 4:00 PM ","http://www.washingtoncountytn.org/departments/solid_waste","36.34458","-82.568939","9.48753518495657","Plastic #1 (PETE); Plastic #2 (HDPE); Aluminum Cans; Aluminum; Antifreeze; Glass (Brown); Lead Acid (Pb) Batteries; Cardboard; Catalogs; Glass (Clear); Ferrous Metals (Steel or Iron); Magazines; Paper (Mixed); Newspapers; Non-ferrous (Copper/Brass/Tin); Unused Paint; Used Motor Oil; Radiators","false","true","","","false","false","false","false"
"Washington County Convenience Center - Locust Mount","","224 Harmony Road","Jonesborough","","TN","37659","4237531804","0","","http://www.washingtoncountytn.org/departments/solid_waste/locations","36.34458","-82.568939","9.48753518495657","","false","false","","","false","false","false","false"
"Goodwill Industries - North","Goodwill Industries - North","3010 Bristol Hwy","Johnson City","Washington","TN","37601","4232824399","0","Monday: 9:00 AM - 7:30 PM Tuesday: 9:00 AM - 7:30 PM Wednesday: 9:00 AM - 7:30 PM Thursday: 9:00 AM - 7:30 PM Friday: 9:00 AM - 7:30 PM Saturday: 9:00 AM - 7:30 PM ","http://www.goodwill.org","36.36045","-82.38407","9.5152106114457","Bikes; Books (Reuse); Cell Phones; Clothing; CD/DVD/Blu-ray/UHD discs; Computer (Reuse); Electronics; Furniture; Household Goods; Large Household Appliances; Lawn Equipment; Musical Instruments; Sporting Goods; Miscellaneous Tools; Children's Toys; Small Appliances; Textiles; MP3 Players; DVD Players/Blu-Ray Players/DVRs; Video Game Consoles; PlayStation Consoles","false","true","","","false","false","false","false"
"Batteries Plus","Batteries Plus","3018 Peoples St","Johnson City","Washington","TN","37604","4232823007","4232823006","","http://www.batteriesplus.com/store_details/551.aspx","36.35169","-82.3978","9.55215524264371","Compact Fluorescent Lights; Batteries (Rechargeable); Alkaline/Single-Use Batteries; Video Game Consoles; PlayStation Consoles","false","true","Some fees for battery recycling may apply.  Please contact your Local store for details. 
<p>
Batteries Plus lead by example by recycling the majority of the batteries we sell. Not only do we recycle to protect our environment, we support retail and business customers alike by keeping them in full compliance with federal, state, municipal, EPA and DOT regulations governing the disposal and recycling of spent batteries and select electronics.","","false","false","false","false"
"Walgreens","Walgreens","4500 W Stone Dr","Kingsport","Sullivan","TN","37660","4232456839","0","","http://www.walgreens.com","36.55128","-82.63075","9.64118196926067","Cell Phones; Inkjet Printer Cartridges; Video Game Consoles; PlayStation Consoles","false","true","","","false","false","false","false"
"Advance Auto Parts","Advance Auto Parts","2918 Bristol Hwy","Johnson City","Washington","TN","37601","4232824119","0","Monday: 7:00 AM - 9:00 PM Tuesday: 7:00 AM - 9:00 PM Wednesday: 7:00 AM - 9:00 PM Thursday: 7:00 AM - 9:00 PM Friday: 7:00 AM - 9:00 PM Saturday: 7:00 AM - 9:00 PM Sunday: 10:00 AM - 8:00 PM ","http://www.advanceautoparts.com","36.35815","-82.384","9.64140655860244","Lead Acid (Pb) Batteries; Used Motor Oil; Video Game Consoles; PlayStation Consoles","false","true","","","false","false","false","false"
"AutoZone","AutoZone","2904 N Roan St","Johnson City","Washington","TN","37601","4239151058","0","","http://www.autozone.com","36.35762","-82.38441","9.65590336220156","Lead Acid (Pb) Batteries; Used Motor Oil; Video Game Consoles; PlayStation Consoles","false","true","Most AutoZone stores accept used motor oil, transmission fluid, gear oil and automotive batteries. Call to see what your local store is currently accepting.","","false","false","false","false"
"Best Buy","Best Buy","3222 Peoples St ","Johnson City","Washington County","TN","37604","4232620329","0","","https://www.bestbuy.com/recycle","36.3479019","-82.4007698","9.68429916237398","Large Household Appliances; Refrigerators; Televisions; AC Power Plugs; Batteries (Rechargeable); Cables & Connectors; Car Audio/Video Equipment; Cell Phone Batteries; Cell Phones; Computer (Recycling); Hard Drives; Computer Monitors; Cameras; DVD Players/Blu-Ray Players/DVRs; Electronics; E-Readers; GPS Units; Headphones; Inkjet Printer Cartridges; Laptop Computers; Laser Toner Cartridges; Li-Ion Batteries; MP3 Players; Network Equipment; Ni-Cd Batteries; Ni-MH Batteries; Ni-Zn Batteries; Computer Peripherals; Portable Media Players; Printers/Scanners/Fax Machines; Small Electronics; Small Sealed Lead Acid Batteries; Stereo Equipment; Tablets; Telephones; UPS Batteries/Backup Systems; VCRs; Video Game Systems; Blu-Ray Players; Digital Converter Boxes; Small Televisions; Video Game Consoles; PlayStation Consoles","true","true","2 TVs per visit, 3 e-waste items per day; $25 fee for TVs and Monitors; $19.99 pick-up fee with delivery; $99.99 standalone pickup fee; ","Sony, Vizio, OEM","false","false","false","false"
