name,description,address,city,region,province,postal_code,phone,fax,hours,url,latitude,longitude,distance,materials,pickup,dropoff,notes,groups,curbside,municipal,national,event_only
"Call2Recycle at Moores Electronics Inc","Call2Recycle at Moores Electronics Inc","1357 Tusculum Blvd","Greeneville","Greene","TN","37745","4236385462","0","","http://www.radioshack.com/","36.17083","-82.81513","15.9659421668584","Cell Phones; Ni-Cd Batteries; Li-Ion Batteries; Ni-MH Batteries; Ni-Zn Batteries; Small Sealed Lead Acid Batteries; Video Game Consoles; PlayStation Consoles","false","true","The U.S. EPA estimates that more than 350 million rechargeable batteries are purchased annually in the U.S. Thanks to the environmental commitment of this location, its easy and free to recycle your batteries. Bring your rechargeable batteries to this location and look for the recycling box or ask an associate how you can do your part for the environment.","","false","false","false","false"
"Random Acts of Flowers","Random Acts of Flowers","PO Box 2492","Greeneville","Greene","TN","37744","4237877234","0","","http://www.rafgreeneville.org/","36.16334","-82.81242","16.1443314636492","Cut Flowers; Vases; Video Game Consoles; PlayStation Consoles","false","true","Random Acts of Flowers receives floral donations in an effort to recycle lightly used flowers into smiles for the healthcare patients of our community.  Donations are accepted in the form of memorial sprays/baskets, wedding/special event arrangements, retail/wholesale overstock, church service arrangements, and even potted plants. Vases and other flower-holding containers also accepted. Please contact for drop-off arrangements.","","false","false","false","false"
"Pinecrest Cleaners, Inc.","Pinecrest Cleaners, Inc.","1018 Tusculum Blvd","Greeneville","Greene","TN","37745","4236391407","0","Monday: 7:30 AM - 6:00 PM Tuesday: 7:30 AM - 6:00 PM Wednesday: 7:30 AM - 6:00 PM Thursday: 7:30 AM - 6:00 PM Friday: 7:30 AM - 6:00 PM Saturday: 9:00 AM - 2:00 PM ","","36.16796","-82.8103","16.2436096065292","Video Game Consoles; PlayStation Consoles","false","true","","","false","false","false","false"
"Cocke County Recycling Drop-Off Site","","1460 Highway 2570","Newport","","TN","37821","8655236397","0","","","35.9723919","-83.247941","16.4631031799451","","false","false","","","false","false","false","false"
"Greene County Convenience Center - Sunnyside","","550 Sunnyside Rd","Greeneville","","TN","37743","4237981797","0","","https://www.greenecountytngov.com","36.1186853","-82.8147796","16.5163358940305","","false","false","","","false","false","false","false"
"Greene County Convenience Center - West Green","","715 Midway Rd","Mosheim","","TN","37809","4234226583","0","","https://www.greenecountytngov.com","36.1816776","-82.9756094","7.00754846507779","","false","false","","","false","false","false","false"
"West Greene Convenience Center","","715 Midway Rd","Mosheim","","TN","37818","4234226583","0","","","36.1816776","-82.9756094","7.00754846507779","","false","false","","","false","false","false","false"
"Cocke County Convenience Center - Centerview","","2513 Highway 160","Bibee","","TN","37713","4236236498","0","","","36.0903383","-83.1625014","7.01984409395842","","false","false","","","false","false","false","false"
"Mountain Valley Recycling Inc","","5501 Jeffrey Ln","Morristown","","TN","37813","4235817558","0","","https://www.buydomains.com/lander/mvrecycling.com?domain=mvrecycling.com&utm_source=mvrecycling.com&utm_medium=click&utm_campaign=TDFS-OO-BDLander_Invisible&traffic_id=TDFS-OO-BDLander_Invisible&traff","36.2431449","-83.2062606","7.34008606297568","","false","false","","","false","false","false","false"
"Centerview Elementary","","2400 Hwy 160","Newport","","TN","37821","8655236397","0","","","36.0846634","-83.1648582","7.42677648063125","","false","false","","","false","false","false","false"
"Goodwill Materials Recovery Facility","","5888 Old Russellville Highway","Russellville","","TN","37860","4235866514","0","","https://www.mymorristown.com","36.2600332","-83.1922861","7.55294817876221","","false","false","","","false","false","false","false"
"Union Heights School","","3366 Old Enka Hwy","Morristown","","TN","37813","8655236397","0","","","36.1816113","-83.2436585","7.94494709949264","","false","false","","","false","false","false","false"
"Greene County Convenience Center - Orebank","","125 Orebank Rd","Greeneville","","TN","37743","4237981798","0","","https://www.greenecountytngov.com","36.1155505","-82.9817358","7.9814816060556","","false","false","","","false","false","false","false"
"Walmart Supercenter","","475 S Davy Crockett Pkwy","Morristown","","TN","37813","4235870495","0","","https://www.walmart.com/","36.2141251","-83.2558091","8.95254433021862","","false","false","","","false","false","false","false"
"Walmart Tire and Lube Express","null","475 Crockett Trace Dr","Morristown","","TN","37813","4235870495","0","","https://www.walmart.com/cp/ideas/8932632","36.2141251","-83.2558091","8.95254433021862","","false","false","","","false","false","false","false"
"Walmart","Walmart","475 Crockett Trace Dr","Morristown","Hamblen","TN","37813","4235870495","0","","http://www.walmart.com","36.2206","-83.2563","9.10939593277496","Lead Acid (Pb) Batteries; Plastic Shopping Bags; Food Storage Bags; Video Game Consoles; PlayStation Consoles","false","true","","","false","false","false","false"
"Walmart Tire & Lube Express","Walmart Tire & Lube Express","475 S Davy Crockett Pkwy","Morristown","Hamblen","TN","37813","4235870495","0","","http://www.walmart.com/catalog/catalog.gsp?cat=495843","36.2206","-83.2563","9.10939593277496","Lead Acid (Pb) Batteries; Used Motor Oil; Oil Filters; Video Game Consoles; PlayStation Consoles","false","true","","","false","false","false","false"
"Kohl's","","2550 East Morris Boulevard","Morristown","","TN","37813","4235876509","0","","https://corporate.kohls.com/","36.2203151","-83.2608036","9.34203550257381","","false","false","","","false","false","false","false"
"JCPenney","","2550 E Morris Blvd","Morristown","","TN","37813","4235869210","0","","https://www.jcpenney.com/","36.2203151","-83.2608036","9.34203550257381","","false","false","","","false","false","false","false"
"Keep Morristown Hamblem Beautiful Christmas Tree Drop-Off","","2550 East Morris Boulevard","Morristown","","TN","37813","4235866422","0","","https://www.kmhb.org","36.2203151","-83.2608036","9.34203550257381","","false","false","","","false","false","false","false"
"OfficeMax","OfficeMax","2583 E Morris Blvd","Morristown","Hamblen","TN","37813","4235812355","0","Monday: 8:00 AM - 9:00 PM Tuesday: 8:00 AM - 9:00 PM Wednesday: 8:00 AM - 9:00 PM Thursday: 8:00 AM - 9:00 PM Friday: 8:00 AM - 9:00 PM Saturday: 9:00 AM - 9:00 PM Sunday: 11:00 AM - 6:00 PM ","http://www.officemax.com","36.22246","-83.26203","9.45299861201438","Cell Phones; Inkjet Cartridge Refilling; Inkjet Printer Cartridges; Laser Toner Cartridges; Video Game Consoles; PlayStation Consoles","false","true","This location features Phoenix Ink refill kiosks.","","false","false","false","false"
"OfficeMax","","2583 E Morris Blvd","Morristown","","TN","37813","4235812355","0","","","36.2241556","-83.2615562","9.46575504037484","","false","false","","","false","false","false","false"
"Call2Recycle at RadioShack","Call2Recycle at RadioShack","2550 E Morris Blvd","Morristown","Hamblen","TN","37813","4235875928","0","","http://www.radioshack.com/","36.22145","-83.26453","9.56375341048211","Cell Phones; Ni-Cd Batteries; Li-Ion Batteries; Ni-MH Batteries; Ni-Zn Batteries; Small Sealed Lead Acid Batteries; Video Game Consoles; PlayStation Consoles","false","true","As the first national retailer to partner with Call2Recycle, RadioShack is at the forefront of the rechargeable battery recycling cause and is pleased to offer battery recycling at thousands of convenient RadioShack locations for free.  Simply drop them off at your local RadioShack and theyll take care of the rest.  Ask a store associate for more details.","","false","false","false","false"
"RadioShack","RadioShack","2550 E Morris Blvd Ste 44","Morristown","Hamblen","TN","37813","4235875928","0","Monday: 10:00 AM - 9:00 PM Tuesday: 10:00 AM - 9:00 PM Wednesday: 10:00 AM - 9:00 PM Thursday: 10:00 AM - 9:00 PM Friday: 10:00 AM - 9:00 PM Saturday: 10:00 AM - 9:00 PM Sunday: 12:00 PM - 6:00 PM ","http://www.radioshack.com","36.22145","-83.26453","9.56375341048211","Ni-Cd Batteries; Batteries (Rechargeable); Video Game Consoles; PlayStation Consoles","false","true","","","false","false","false","false"
"College Square 1","College Square 1","2550 E Morris Blvd","Morristown","Hamblen","TN","37813","8583244111","0","","http://www.ecoatm.com/","36.22145","-83.26453","9.56375341048211","Cell Phones; Tablets; MP3 Players; Video Game Consoles; PlayStation Consoles","false","true","ecoATM is an automated, consumer self-serve kiosk that quickly buys back and recycles old phones, mp3 players and tablets.
</br>
Call or email <a href="mailto:max@ecoATM.com">customer support</a> with questions.","","false","false","false","false"
"AT&T Wireless","AT&T Wireless","2550 E Morris Blvd","Morristown","Hamblen","TN","37813","4235816077","0","","http://www.att.com/","36.22145","-83.26453","9.56375341048211","Cell Phones; Ni-Cd Batteries; Batteries (Rechargeable); Cell Phone Batteries; Tablets; Li-Ion Batteries; Video Game Consoles; PlayStation Consoles","false","true","Receive an AT&T Promotion Card worth the trade-in value of your smartphone, tablet, or netbook. You can also donate the trade-in value to Cell Phones for Soldiers.","","false","false","false","false"
"Verizon Wireless","Verizon Wireless","176 Terrace Ln","Morristown","Hamblen","TN","37813","8666444532","0","","http://www.verizonwireless.com/","36.19722","-83.27129","9.56548969330817","Cell Phones; Cell Phone Batteries; Video Game Consoles; PlayStation Consoles","false","true","<A Href="https://www.trade-in.vzw.com/home.aspx">
The Verizon Wireless Trade-In Program</A> allows you to trade in your used handset or tablet in a convenient and responsible way. 
<P>
<P>
Verizon Wireless works every day to protect our environment and give our customers opportunities to do the same. <A Href="http://aboutus.vzw.com/Green_Initiative/overview.html">Click here</A> for more examples of the earth-friendly initiatives and programs Verizon Wireless is proud to offer and support.","","false","false","false","false"
