name,description,address,city,region,province,postal_code,phone,fax,hours,url,latitude,longitude,distance,materials,pickup,dropoff,notes,groups,curbside,municipal,national,event_only
"Greene County Convenience Center - McDonald","","8190 McDonald Rd","Mohawk","","TN","37810","4232350452","0","","https://www.greenecountytngov.com","36.1636401","-83.1247473","1.69065878984901","","false","false","","","false","false","false","false"
"Hillcrest Park","","S Liberty Hill Rd","Morristown","","TN","37813","8655236397","0","","","36.2139309","-83.2779014","10.140681692313","","false","false","","","false","false","false","false"
"East Tennessee Iron & Metal Inc","East Tennessee Iron & Metal Inc","1925 Highway 66","Bulls Gap","Hawkins","TN","37711","4232354119","4232354149","","http://www.easttniron.com","36.31057","-83.0199","10.1523794320888","Ferrous Metals (Steel or Iron); Non-ferrous (Copper/Brass/Tin); Scrap Metal; Video Game Consoles; PlayStation Consoles","false","true","","","false","false","false","false"
"Meadow View Middle School","","1623 Meadowview Ln","Morristown","","TN","37814","8655236397","0","","","36.227931","-83.273259","10.1675333919541","","false","false","","","false","false","false","false"
"Morristown Shredder Inc","Morristown Shredder Inc","2540 Newport Hwy ","Morristown","Hamblen County","TN","37813","4235810442","0","","","36.1878071","-83.283355","10.1742621064802","Aluminum Cans; Aluminum; Ferrous Metals (Steel or Iron); Non-ferrous (Copper/Brass/Tin); Tin or Steel Cans; High-Temp Alloys; Special Metals; Video Game Consoles; PlayStation Consoles","false","true","","","false","false","false","false"
"Morristown Shredder Inc","","2540 Newport Hwy","Morristown","","TN","37813","4235816880","0","","https://morristownscrap.com/","36.1872357","-83.2841831","10.2181430064532","","false","false","","","false","false","false","false"
"Advance Auto Parts","Advance Auto Parts","702 E Morris Blvd","Morristown","Hamblen","TN","37813","4233170338","0","Monday: 7:00 AM - 9:00 PM Tuesday: 7:00 AM - 9:00 PM Wednesday: 7:00 AM - 9:00 PM Thursday: 7:00 AM - 9:00 PM Friday: 7:00 AM - 9:00 PM Saturday: 7:00 AM - 9:00 PM Sunday: 10:00 AM - 8:00 PM ","http://www.advanceautoparts.com","36.21517","-83.28522","10.5573201313046","Lead Acid (Pb) Batteries; Used Motor Oil; Video Game Consoles; PlayStation Consoles","false","true","","","false","false","false","false"
"AutoZone","AutoZone","625 S Cumberland St","Morristown","Hamblen","TN","37813","4235867313","0","","http://www.autozone.com","36.20753","-83.28827","10.6128004221736","Lead Acid (Pb) Batteries; Used Motor Oil; Video Game Consoles; PlayStation Consoles","false","true","Most AutoZone stores accept used motor oil, transmission fluid, gear oil and automotive batteries. Call to see what your local store is currently accepting.","","false","false","false","false"
"Greene County Convenience Center - St James","","15 St James Road","Greeneville","","TN","37743","4237981790","0","","https://www.greenecountytngov.com","36.067376","-82.9682033","10.7083287587598","","false","false","","","false","false","false","false"
"Hamblen County-Morristown Solid Waste Landfill","","3849 Sublett Rd","Morristown","","TN","37813","4235818784","0","","https://www.mymorristown.com","36.1550129","-83.297905","11.095297544215","","false","false","","","false","false","false","false"
"Alpha Elementary School","","Walter Hyde Avenue","Morristown","","TN","37815","8655236397","0","","","36.2030804","-83.3","11.206879514814","","false","false","","","false","false","false","false"
"Fairview Marguerite Elementary","","2125 Fairview Rd","Morristown","","TN","37814","8655236397","0","","","36.237198","-83.2922614","11.3815994132924","","false","false","","","false","false","false","false"
"Parrotsville Elementary","","2061 Canary Drive","Parrotsville","","TN","37843","8655236397","0","","","36.0094608","-83.0930666","11.7275642500637","","false","false","","","false","false","false","false"
"Cocke County Convenience Center - Parrotsville","","2061 Canary Dr","Parrottsville","","TN","37843","4236239272","0","","","36.0094608","-83.0930666","11.7275642500637","","false","false","","","false","false","false","false"
"West Elementary","","235 W Converse St","Morristown","","TN","37814","8655236397","0","","","36.2232106","-83.3048582","11.7552819499868","","false","false","","","false","false","false","false"
"Greene County Convenience Center - Romeo","","11065 Lonesome Pine Trail","Greeneville","","TN","37745","4234227067","0","","https://www.greenecountytngov.com","36.283618","-82.9310636","11.9206033740172","","false","false","","","false","false","false","false"
"Hawkins County Convenience Center - Highway 113","","309 Highway 113","Rogersville","","TN","37857","4232355415","0","","https://hawkinscountytn.gov","36.3435471","-83.0230634","12.1690313511752","","false","false","","","false","false","false","false"
"Walgreens","Walgreens","1959 W Andrew Johnson Hwy","Morristown","Hamblen","TN","37814","4233177303","0","","http://www.walgreens.com","36.20682","-83.31817","12.247273908","Cell Phones; Inkjet Cartridge Refilling; Inkjet Printer Cartridges; Video Game Consoles; PlayStation Consoles","false","true","","","false","false","false","false"
"Home Depot","","1930 W Andrew Johnson Hwy","Morristown","","TN","37814","4235812085","0","","https://ecooptions.homedepot.com/","36.2096267","-83.3178515","12.2614100177873","Batteries (Rechargeable); Cell Phone Batteries; Li-Ion Batteries; Ni-Cd Batteries; Ni-MH Batteries; Small Sealed Lead Acid Batteries","false","true","","Call2Recycle","false","false","false","false"
"Home Depot","Home Depot","1930 W Andrew Johnson Hwy","Morristown","Hamblen","TN","37814","4235812085","0","","http://www.homedepot.com","36.20698","-83.31841","12.262211970405","Compact Fluorescent Lights; Batteries (Rechargeable); Video Game Consoles; PlayStation Consoles","false","true","Home Depot accepts compact fluorescent bulbs and used power tool rechargeable batteries. Look for the orange drop boxes, usually located near the front entrance near the customer service desk.","","false","false","false","false"
"Call2Recycle at the Home Depot","Call2Recycle at the Home Depot","1930 W Andrew Johnson Hwy","Morristown","Hamblen","TN","37814","4235812085","0","","http://www.homedepot.com/","36.20698","-83.31841","12.262211970405","Cell Phones; Compact Fluorescent Lights; Ni-Cd Batteries; Li-Ion Batteries; Ni-MH Batteries; Ni-Zn Batteries; Small Sealed Lead Acid Batteries; Video Game Consoles; PlayStation Consoles","false","true","The Home Depot accepts used rechargeable batteries and compact fluorescent bulbs. Look for the orange drop boxes, usually located near the front entrance near the customer service desk, or ask a store associate for more details.","","false","false","false","false"
"KARM Thrift Store","","2161 West Andrew Johnson Highway","Morristown","","TN","37813","4235862060","0","","https://karm.org/","36.2045003","-83.3220331","12.4365967582815","","false","false","","","false","false","false","false"
"Greene County Convenience Center - Hal Henard","","815 Hal Henard Rd","Greeneville","","TN","37743","4237981796","0","","https://www.greenecountytngov.com","36.1579247","-82.8777747","12.5484449263829","","false","false","","","false","false","false","false"
"Hal Henard Road Convenience Center","","815 Hal Henard Rd","Greeneville","","TN","37743","4237981796","0","","","36.1579247","-82.8777747","12.5484449263829","","false","false","","","false","false","false","false"
"Advance Auto Parts","Advance Auto Parts","2305 W Andrew Johnson Hwy","Morristown","Hamblen","TN","37814","4235818566","0","Monday: 7:00 AM - 9:00 PM Tuesday: 7:00 AM - 9:00 PM Wednesday: 7:00 AM - 9:00 PM Thursday: 7:00 AM - 9:00 PM Friday: 7:00 AM - 9:00 PM Saturday: 7:00 AM - 9:00 PM Sunday: 10:00 AM - 8:00 PM ","http://www.advanceautoparts.com","36.20513","-83.32476","12.5932346461196","Lead Acid (Pb) Batteries; Used Motor Oil; Video Game Consoles; PlayStation Consoles","false","true","","","false","false","false","false"
"Sonoco Paper","","766 Industrial Road","Newport","","TN","37821","4236238611","0","","https://www.sonocorecycling.com/","36.0166858","-83.2056548","12.6437524013294","","false","false","","","false","false","false","false"
"O'Reilly Auto Parts","","2320 W Andrew Johnson Hwy","Morristown","","TN","37814","4235879537","0","","http://oreillyauto.custhelp.com/app/error/error_id/6","36.2049547","-83.326373","12.680556565179","","false","false","","","false","false","false","false"
"Call2Recycle at RadioShack","Call2Recycle at RadioShack","2636 W Andrew Johnson Hwy","Morristown","Hamblen","TN","37814","4235812584","0","","http://www.radioshack.com/","36.20378","-83.32793","12.7554917469955","Cell Phones; Ni-Cd Batteries; Li-Ion Batteries; Ni-MH Batteries; Ni-Zn Batteries; Small Sealed Lead Acid Batteries; Video Game Consoles; PlayStation Consoles","false","true","As the first national retailer to partner with Call2Recycle, RadioShack is at the forefront of the rechargeable battery recycling cause and is pleased to offer battery recycling at thousands of convenient RadioShack locations for free.  Simply drop them off at your local RadioShack and theyll take care of the rest.  Ask a store associate for more details.","","false","false","false","false"
"Sonoco Recycling","Sonoco Recycling","766 Industrial Rd","Newport","Cocke","TN","37821","9192704712","0","","http://www.sonocorecycling.com/","36.01227","-83.20388","12.8708926512358","Brown Paper Bags; Cardboard; Catalogs; Chipboard; Computer Paper; Gift Boxes; Greeting Cards; Magazines; Paper (Mixed); Newspapers; Paperboard; Phone books; Office Paper; Video Game Consoles; PlayStation Consoles","false","true","Location accepts full load quantities of fiber materials, call to see if they are currently accepting public drop-off.","","false","false","false","false"
"St. James Convenience Center","","St James Rd","Greeneville","","TN","37743","4237981790","0","","","36.0333161","-82.9573432","12.8810179986148","","false","false","","","false","false","false","false"
"Romeo Convenience Center","","Lonesome Pine Trail","Greeneville","","TN","37743","4234227067","0","","","36.1892175","-82.8705108","12.8847056477445","","false","false","","","false","false","false","false"
"Hawkins County Convenience Center - Lakemont","","106 Lakemont Drive","Rogersville","","TN","37857","4232723491","0","","https://hawkinscountytn.gov","36.3554208","-83.1774723","12.9027562007002","","false","false","","","false","false","false","false"
"Call2Recycle at Lowe's","Call2Recycle at Lowe's","2744 West Andrew Johnson Highway","Morristown","Hamblen","TN","37814","4233177727","0","","http://www.lowes.com/","36.20237","-83.33146","12.9382137663039","Cell Phones; Compact Fluorescent Lights; Ni-Cd Batteries; Plastic Shopping Bags; Li-Ion Batteries; Ni-MH Batteries; Ni-Zn Batteries; Small Sealed Lead Acid Batteries; Video Game Consoles; PlayStation Consoles","false","true","As an environmentally-committed retailer, Lowes offers a recycling center near store entrances to give consumers a free and easy way to properly dispose of rechargeable batteries, cell phones, CFLs and plastic shopping bags; materials that otherwise could be potentially harmful to the environment.  Look for the recycling center or ask a store associate for more details.","","false","false","false","false"
"AutoZone","AutoZone","2765 W Andrew Johnson Hwy","Morristown","Hamblen","TN","37814","4235814410","0","","http://www.autozone.com","36.20214","-83.33195","12.9633799791036","Lead Acid (Pb) Batteries; Used Motor Oil; Video Game Consoles; PlayStation Consoles","false","true","Most AutoZone stores accept used motor oil, transmission fluid, gear oil and automotive batteries. Call to see what your local store is currently accepting.","","false","false","false","false"
"Lowe's","","2744 W Andrew Johnson Hwy","Morristown","","TN","37814","4233177727","0","","https://newsroom.lowes.com/responsibility/operational-excellence/","36.2031912","-83.3318445","12.9665882584386","Batteries (Rechargeable); Cell Phone Batteries; Li-Ion Batteries; Ni-Cd Batteries; Ni-MH Batteries; Small Sealed Lead Acid Batteries; Cell Phones","false","true","","Call2Recycle","false","false","false","false"
"Goodwill Industries Knoxville Inc. - Dell Reconnect Donation Site","","2812 West Andrew Johnson Highway","Morristown","","TN","37814","4235879763","0","","https://www.gwiktn.org/","36.20246","-83.3344056","13.1019570037679","","false","false","","","false","false","false","false"
"Goodwill Store & ETR Center","Goodwill Store & ETR Center","2812 W Andrew Johnson Hwy","Morristown","Hamblen","TN","37814","4235879763","0","Monday: 9:00 AM - 7:00 PM Tuesday: 9:00 AM - 7:00 PM Wednesday: 9:00 AM - 7:00 PM Thursday: 9:00 AM - 7:00 PM Friday: 9:00 AM - 7:00 PM Saturday: 9:00 AM - 7:00 PM Sunday: 12:00 PM - 6:00 PM ","http://www.gwiktn.org","36.20109","-83.33501","13.1242089394524","Bikes; Books (Reuse); Cell Phones; Clothing; CD/DVD/Blu-ray/UHD discs; Computer (Reuse); Computer Monitors; Computer (Recycling); Electronics; Gift Bags; Eyeglasses; Furniture; Household Goods; Lawn Equipment; Musical Instruments; Office Furniture; Office Equipment; Ornaments; Reusable Appliance Donation; Sporting Goods; Telephones; Televisions; Miscellaneous Tools; Children's Toys; Car Donation; VHS & Cassette Tapes; MP3 Players; Video Game Consoles; PlayStation Consoles","false","true","This site accepts gently used items that are in good, clean, reusable condition for Goodwill Store.","","false","false","false","false"
"Keep America Beautiful Cars to Donate","","","Morristown","","TN","37814","8554262474","0","","https://www.kab.org/?pagename=car_donation","36.2396396","-83.3254958","13.1838327867024","","false","false","","","false","false","false","false"
"Jefferson County Convenience Center - White Pine","","1376 Leadmine Rd","White Pine","","TN","37890","8653973544","0","","http://www.jeffersoncountytn.gov/services/garbage-disposal/","36.0669232","-83.2940972","13.2626670056298","","false","false","","","false","false","false","false"
"Tractor Supply","Tractor Supply","3480 W Andrew Johnson Hwy","Morristown","Hamblen","TN","37814","4235816000","0","","http://www.tractorsupply.com","36.19815","-83.34293","13.5419262501783","Transmission Fluid; Used Motor Oil; Video Game Consoles; PlayStation Consoles","false","true","","","false","false","false","false"
"Tractor Supply","","3480 West Andrew Johnson Highway","Morristown","","TN","37814","4235816000","0","","https://www.tractorsupply.com/","36.1989743","-83.343684","13.5893435487161","","false","false","","","false","false","false","false"
"Strange Auto Parts & Salvage","Strange Auto Parts & Salvage","3513 Roy Messer Hwy ","White Pine","Jefferson County","TN","37890","8656740427","0","Monday: 8:00 AM - 5:00 PM Tuesday: 8:00 AM - 5:00 PM Wednesday: 8:00 AM - 5:00 PM Thursday: 8:00 AM - 5:00 PM Friday: 8:00 AM - 5:00 PM ","","36.1044432","-83.3269176","13.6071480184474","Used Motor Oil; Oil Filters; Video Game Consoles; PlayStation Consoles","false","true","","","false","false","false","false"
"Northwest Elementary","","344 Woodson Rd","Newport","","TN","37821","8655236397","0","","","35.990191","-83.177085","13.7202151261777","","false","false","","","false","false","false","false"
"Greene County Convenience Center - Debusk","","10 Amity Road","Greeneville","","TN","37743","4232576960","0","","https://www.greenecountytngov.com","36.1190338","-82.863179","13.9132476669343","","false","false","","","false","false","false","false"
"Advance Auto Parts","Advance Auto Parts","105 Asheville Hwy","Greeneville","Greene","TN","37743","4237981199","0","Monday: 7:00 AM - 9:00 PM Tuesday: 7:00 AM - 9:00 PM Wednesday: 7:00 AM - 9:00 PM Thursday: 7:00 AM - 9:00 PM Friday: 7:00 AM - 9:00 PM Saturday: 7:00 AM - 9:00 PM Sunday: 10:00 AM - 8:00 PM ","http://www.advanceautoparts.com","36.15397","-82.84884","14.1837219054945","Lead Acid (Pb) Batteries; Used Motor Oil; Video Game Consoles; PlayStation Consoles","false","true","","","false","false","false","false"
"Advance Auto Parts","","105 Asheville Hwy","Greeneville","","TN","37743","4237981199","0","","http://shop.advanceautoparts.com/webapp/wcs/stores/servlet/home___","36.1542828","-82.848202","14.2163928592594","","false","false","","","false","false","false","false"
"Rankin Convenience Center","Rankin Convenience Center","269 Clayhill Rd ","Newport","Cocke County","TN","37821","4236238791","0","","","35.995171","-83.2165629","14.2446836657592","Plastic #1 (PETE); Plastic #2 (HDPE); Plastic #2 (Color HDPE); Aluminum Cans; Computer Paper; Greeting Cards; Magazines; Paper (Mixed); Newspapers; Tin or Steel Cans; Used Motor Oil; Used Tires; Office Paper; Video Game Consoles; PlayStation Consoles","false","true","","","false","false","false","false"
"Hawkins County Convenience Center - Rock Hill","","1629 Highway 70 North","Rogersville","","TN","37857","4232725079","0","","https://hawkinscountytn.gov","36.3343455","-82.9298528","14.3609790782601","","false","false","","","false","false","false","false"
"Greene County Convenience Center - Cross Anchor","","421 Old Baileyton Road","Greeneville","","TN","37743","4232340644","0","","https://www.greenecountytngov.com","36.1772988","-82.8335699","14.9272576615699","","false","false","","","false","false","false","false"
"US Post Office","US Post Office","220 W Summer St","Greeneville","Greene","TN","37743","0","0","","https://www.usps.com/ship/recycle-through-usps.htm","36.16324","-82.83387","14.9514399083983","Inkjet Printer Cartridges; Video Game Consoles; PlayStation Consoles","false","true","Free, postage-paid Mail Back envelopes can be found on display in the lobby. There is no limit to the number of envelopes customers may take. The contents of the envelope must weigh less than 13 ounces and the envelope must be able to seal completely. For more details visit<a href="http://www.maxback.com/mxb-postoffice-collaboration" target="_blank">MaxBack</a>.","","false","false","false","false"
"Computer Pros","Computer Pros","560 W Andrew Johnson Hwy","Greeneville","Greene","TN","37745","4236391740","0","","http://www.computerpros.net/","36.1761","-82.83052","15.0983561749454","Cell Phones; Ni-Cd Batteries; Li-Ion Batteries; Ni-MH Batteries; Ni-Zn Batteries; Small Sealed Lead Acid Batteries; Video Game Consoles; PlayStation Consoles","false","true","The U.S. EPA estimates that more than 350 million rechargeable batteries are purchased annually in the U.S. Thanks to the environmental commitment of this location, its easy and free to recycle your batteries. Bring your rechargeable batteries to this location and look for the recycling box or ask an associate how you can do your part for the environment.","","false","false","false","false"
"Keep America Beautiful Cars to Donate","","","Greeneville","","TN","37743","8554262474","0","","https://www.kab.org/?pagename=car_donation","36.1631574","-82.8309861","15.1122802428122","","false","false","","","false","false","false","false"
"Goodwill Industries Knoxville Inc. - Dell Reconnect Donation Site","","452 Eastern Plaza Shopping Center","Newport","","TN","37821","4236130815","0","","https://www.gwiktn.org/","35.9668633","-83.1800808","15.3087708461524","","false","false","","","false","false","false","false"
"Goodwill Store","Goodwill Store","452 Eastern Plaza Shopping Ctr","Newport","Cocke","TN","37821","4236130815","0","Monday: 9:00 AM - 6:00 PM Tuesday: 9:00 AM - 6:00 PM Wednesday: 9:00 AM - 6:00 PM Thursday: 9:00 AM - 6:00 PM Friday: 9:00 AM - 6:00 PM Saturday: 9:00 AM - 6:00 PM Sunday: 1:00 AM - 5:00 PM ","http://www.gwiktn.org","35.96681","-83.18497","15.3930367629455","Bikes; Books (Reuse); Cell Phones; Clothing; CD/DVD/Blu-ray/UHD discs; Computer (Reuse); Computer Monitors; Computer (Recycling); Electronics; Gift Bags; Eyeglasses; Furniture; Household Goods; Lawn Equipment; Musical Instruments; Office Furniture; Office Equipment; Ornaments; Reusable Appliance Donation; Sporting Goods; Telephones; Televisions; Miscellaneous Tools; Children's Toys; Car Donation; VHS & Cassette Tapes; MP3 Players; Video Game Consoles; PlayStation Consoles","false","true","This site accepts gently used items that are in good, clean, reusable condition for Goodwill Store.","","false","false","false","false"
"Keep America Beautiful Cars to Donate","","","Newport","","TN","37821","8554262474","0","","https://www.kab.org/?pagename=car_donation","35.9670412","-83.1876578","15.4241247707062","","false","false","","","false","false","false","false"
"Walgreens","Walgreens","102 E Broadway","Newport","Cocke","TN","37821","4236230364","0","","http://www.walgreens.com","35.96724","-83.19255","15.4988121967457","Cell Phones; Inkjet Printer Cartridges; Video Game Consoles; PlayStation Consoles","false","true","","","false","false","false","false"
"Greene County Convenience Center - South Greene","","6825 Asheville Highway","Greeneville","","TN","37745","4237981799","0","","https://www.greenecountytngov.com","36.060894","-82.864837","15.5151810710532","","false","false","","","false","false","false","false"
"South Greene Convenience Center","","6825 Asheville Hwy","Greeneville","","TN","37743","4237981799","0","","","36.060894","-82.864837","15.5151810710532","","false","false","","","false","false","false","false"
"AutoZone","","312 W Broadway","Newport","","TN","37821","4236237675","0","","https://www.autozone.com/landing/page.jsp?name=in-our-stores","35.9684969","-83.2005393","15.5700958105575","","false","false","","","false","false","false","false"
"Advance Auto Parts","Advance Auto Parts","199 W Broadway","Newport","Cocke","TN","37821","4236237577","0","Monday: 7:00 AM - 9:00 PM Tuesday: 7:00 AM - 9:00 PM Wednesday: 7:00 AM - 9:00 PM Thursday: 7:00 AM - 9:00 PM Friday: 7:00 AM - 9:00 PM Saturday: 7:00 AM - 9:00 PM Sunday: 10:00 AM - 8:00 PM ","http://www.advanceautoparts.com","35.96717","-83.19646","15.5765694098122","Lead Acid (Pb) Batteries; Used Motor Oil; Video Game Consoles; PlayStation Consoles","false","true","","","false","false","false","false"
"AutoZone","AutoZone","312 W Broadway","Newport","Cocke","TN","37821","4236237675","0","","http://www.autozone.com","35.96822","-83.20091","15.5953540451081","Lead Acid (Pb) Batteries; Used Motor Oil; Video Game Consoles; PlayStation Consoles","false","true","Most AutoZone stores accept used motor oil, transmission fluid, gear oil and automotive batteries. Call to see what your local store is currently accepting.","","false","false","false","false"
"Advance Auto Parts","","199 W Broadway St","Newport","","TN","37821","4236237577","0","","http://shop.advanceautoparts.com/webapp/wcs/stores/servlet/home___","35.9669315","-83.1970279","15.602906284101","","false","false","","","false","false","false","false"
"Cocke County Convenience Center - Irish Cut","","1160 Old Asheville Hwy","Newport","","TN","37821","4236236498","0","","","35.956511","-83.1487542","15.6044197071812","","false","false","","","false","false","false","false"
"Walmart Supercenter","","4331 Hwy 66 S","Rogersville","","TN","37857","4232727707","0","","https://www.walmart.com/","36.3964688","-83.0196888","15.6910654274274","","false","false","","","false","false","false","false"
"Walmart Tire and Lube Express","","4331 Hwy 66 S","Rogersville","","TN","37857","4232727707","0","","https://www.walmart.com/cp/ideas/8932632","36.3964688","-83.0196888","15.6910654274274","","false","false","","","false","false","false","false"
"Newport Grammar School","","301 College St","Newport","","TN","37821","8655236397","0","","","35.9627932","-83.1872568","15.6963188194383","","false","false","","","false","false","false","false"
"AutoZone","AutoZone","535 Tusculum Blvd","Greeneville","Greene","TN","37745","4236381351","0","","http://www.autozone.com","36.1704","-82.81855","15.7764735143187","Lead Acid (Pb) Batteries; Used Motor Oil; Video Game Consoles; PlayStation Consoles","false","true","Most AutoZone stores accept used motor oil, transmission fluid, gear oil and automotive batteries. Call to see what your local store is currently accepting.","","false","false","false","false"
"O'Reilly Auto Parts","null","338 Cosby Highway","Newport","","TN","37821","4236233579","0","","http://oreillyauto.custhelp.com/app/error/error_id/6","35.9628041","-83.1941632","15.8179202635818","","false","false","","","false","false","false","false"
"Walgreens","Walgreens","4325 Highway 66 S","Rogersville","Hawkins","TN","37857","4232729986","0","","http://www.walgreens.com","36.39803","-83.0181","15.819995579285","Cell Phones; Inkjet Printer Cartridges; Video Game Consoles; PlayStation Consoles","false","true","","","false","false","false","false"
"Walmart Tire & Lube Express","Walmart Tire & Lube Express","4331 Highway 66 S","Rogersville","Hawkins","TN","37857","4232727707","0","","http://www.walmart.com/catalog/catalog.gsp?cat=495843","36.3981","-83.01828","15.8216901342548","Lead Acid (Pb) Batteries; Used Motor Oil; Oil Filters; Video Game Consoles; PlayStation Consoles","false","true","","","false","false","false","false"
"Walmart","Walmart","4331 Highway 66 S","Rogersville","Hawkins","TN","37857","4232727707","0","","http://www.walmart.com","36.3981","-83.01828","15.8216901342548","Lead Acid (Pb) Batteries; Plastic Shopping Bags; Food Storage Bags; Video Game Consoles; PlayStation Consoles","false","true","","","false","false","false","false"
"AutoZone","","535 Tusculum Blvd","Greeneville","","TN","37745","4236381351","0","","https://www.autozone.com/landing/page.jsp?name=in-our-stores","36.1714105","-82.8170593","15.8569639662226","","false","false","","","false","false","false","false"
"Bridgeport School","","1935 Edwina Bridgeport Rd","Newport","","TN","37821","8655236397","0","","","35.949495","-83.128061","15.9323978905505","","false","false","","","false","false","false","false"
