name,description,address,city,region,province,postal_code,phone,fax,hours,url,latitude,longitude,distance,materials,pickup,dropoff,notes,groups,curbside,municipal,national,event_only
"E-opala Computer Recycling","null","1708 Mary St ","Honolulu","Honolulu County","HI","96819","8082322000","0","","null","21.3217007","-157.8857844","4.49245278513143","Computer (Recycling); Computer Monitors; Electronics; Laptop Computers; Printers/Scanners/Fax Machines; Tablets; Video Game Consoles; PlayStation Consoles","false","true","","OEM, Sony, Vizio","false","false","false","false"
"Walmart","","1131 Kuala St","Pearl City","","HI","96782","8084548785","0","","https://www.walmart.com/","21.3971335","-157.9745329","4.5000122927201","","false","false","","","false","false","false","false"
"Reynolds Recycling Certified Redemption Center - Ewa Town Center","","91-1401 Fort Weaver Rd","Ewa Beach","","HI","96706","8084872802","0","","http://www.reynoldsrecycling.com/","21.3339342","-158.0242762","4.5133630294111","","false","false","","","false","false","false","false"
"Okuda Metal","Okuda Metal","1804 Kahai St","Honolulu","Honolulu","HI","96819","8088456856","0","Monday: 7:30 AM - 5:00 PM Tuesday: 7:30 AM - 5:00 PM Wednesday: 7:30 AM - 5:00 PM Thursday: 7:30 AM - 5:00 PM Friday: 7:30 AM - 5:00 PM Saturday: 7:30 AM - 4:30 PM ","","21.32362","-157.88492","4.52234062185496","Aluminum Cans; Ferrous Metals (Steel or Iron); Non-ferrous (Copper/Brass/Tin); Tin or Steel Cans; Computer (Recycling); Computer Monitors; Electronics; Laptop Computers; Printers/Scanners/Fax Machines; Tablets; Video Game Consoles; PlayStation Consoles","false","true","","","false","false","false","false"
"Walmart","Walmart","1131 Kuala St","Pearl City","Honolulu","HI","96782","8084548785","0","","http://www.walmart.com","21.39766","-157.97423","4.5292234616273","Lead Acid (Pb) Batteries; Plastic Shopping Bags; Food Storage Bags; Computer (Recycling); Computer Monitors; Electronics; Laptop Computers; Printers/Scanners/Fax Machines; Tablets; Video Game Consoles; PlayStation Consoles","false","true","","","false","false","false","false"
"Okuda Metal","","1804 Kahai St","Honolulu","","HI","96819","8088456856","0","","","21.3232527","-157.884655","4.54354797373626","","false","false","","","false","false","false","false"
"Home Depot","Home Depot","1021 Kamehameha Hwy","Pearl City","Honolulu","HI","96782","8084551200","0","","http://www.homedepot.com","21.39794","-157.97422","4.54758525097995","Compact Fluorescent Lights; Batteries (Rechargeable); Computer (Recycling); Computer Monitors; Electronics; Laptop Computers; Printers/Scanners/Fax Machines; Tablets; Video Game Consoles; PlayStation Consoles","false","true","Home Depot accepts compact fluorescent bulbs and used power tool rechargeable batteries. Look for the orange drop boxes, usually located near the front entrance near the customer service desk.","","false","false","false","false"
"Sams Club","","1000 Kamehameha Hwy","Pearl City","","HI","96782","8084567788","0","","https://www.samsclub.com/","21.3988692","-157.9733685","4.59412874737497","","false","false","","","false","false","false","false"
"Impact Wireless, Inc","","1160 Kuala St","Pearl City","","HI","96782","8084557087","0","","","21.3988735","-157.9753247","4.62987542644544","","false","false","","","false","false","false","false"
"Batteries Plus Bulbs","","1160 Kuala Street","Pearl City","","HI","96782","8082004621","0","","https://www.batteriesplus.com/store-locator/hi/624?utm_source=local&utm_medium=earth911","21.3988735","-157.9753247","4.62987542644544","","false","false","","","false","false","false","false"
"Tomra Recycling Drop-Off Site - Kalihi Shopping Center","Tomra Recycling Drop-Off Site - Kalihi Shopping Center","2295 N King St ","Honolulu","Honolulu County","HI","96819","8084872802","0","Tuesday: 9:00 AM - 5:00 PM Wednesday: 9:00 AM - 5:00 PM Thursday: 9:00 AM - 5:00 PM Friday: 9:00 AM - 5:00 PM Saturday: 9:00 AM - 5:00 PM ","http://www.reynoldsrecycling.com","21.3353021","-157.8822042","4.63026475929163","Plastic #1 (PETE); Plastic #2 (HDPE); Plastic #2 (Color HDPE); Aluminum Cans; Glass (Brown); Glass (Clear); Glass (Green); Tin or Steel Cans; Computer (Recycling); Computer Monitors; Electronics; Laptop Computers; Printers/Scanners/Fax Machines; Tablets; Video Game Consoles; PlayStation Consoles","false","true","","","false","false","false","false"
"Island Recycling & Redemption Center - Waipahu","","94-819 Farrington Hwy","Waipahu","","HI","96797","8086829200","0","","http://www.islandrecycling.com","21.3837392","-158.0036662","4.64438408481581","","false","false","","","false","false","false","false"
"Island Recycling & Redemption Center - Dillingham","","1803 Dillingham Blvd","Honolulu","","HI","96819","8086829200","0","","","21.3274791","-157.8806263","4.75898372324279","","false","false","","","false","false","false","false"
"Reynolds Recycling Certified Redemption Center - Waipahu","","94-766 Farrington Hwy","Waipahu","","HI","96797","8084872802","0","","http://www.reynoldsrecycling.com/","21.3843983","-158.0057388","4.76945070065377","","false","false","","","false","false","false","false"
"O'Reilly Auto Parts","null","1555 Dillingham Road","Honolulu","","HI","96817","8088481034","0","","http://oreillyauto.custhelp.com/app/error/error_id/6","21.3257434","-157.8788216","4.88845607198647","","false","false","","","false","false","false","false"
"Aiea Recycling","Aiea Recycling","833 Puuhale Rd ","Honolulu","Honolulu County","HI","96819","8088343568","0","Monday: 7:00 AM - 4:00 PM Tuesday: 7:00 AM - 4:00 PM Wednesday: 7:00 AM - 4:00 PM Thursday: 7:00 AM - 4:00 PM Friday: 7:00 AM - 4:00 PM ","null","21.3316513","-157.8782586","4.88905830544103","Aluminum Cans; Non-ferrous (Copper/Brass/Tin); Computer (Recycling); Computer Monitors; Electronics; Laptop Computers; Printers/Scanners/Fax Machines; Tablets; Video Game Consoles; PlayStation Consoles","false","true","","","false","false","false","false"
"Savers","","1505 Dillingham Blvd","Honolulu","","HI","96817","8088420061","0","","https://www.savers.com/donate/what-we-take","21.3238406","-157.878123","4.9515227680039","","false","false","","","false","false","false","false"
"US Post Office","US Post Office","3600 Aolele St Rm 209","Honolulu","Honolulu","HI","96820","0","0","","https://www.usps.com/ship/recycle-through-usps.htm","21.3519","-157.87805","5.03725673996539","Inkjet Printer Cartridges; Computer (Recycling); Computer Monitors; Electronics; Laptop Computers; Printers/Scanners/Fax Machines; Tablets; Video Game Consoles; PlayStation Consoles","false","true","Free, postage-paid Mail Back envelopes can be found on display in the lobby. There is no limit to the number of envelopes customers may take. The contents of the envelope must weigh less than 13 ounces and the envelope must be able to seal completely. For more details visit<a href="http://www.maxback.com/mxb-postoffice-collaboration" target="_blank">MaxBack</a>.","","false","false","false","false"
"Interstate Battery of Hawaii","Interstate Battery of Hawaii","94-110 Leokane St","Waipahu","Honolulu","HI","96797","8086766000","0","Monday: 8:00 AM - 5:00 PM Tuesday: 8:00 AM - 5:00 PM Wednesday: 8:00 AM - 5:00 PM Thursday: 8:00 AM - 5:00 PM Friday: 8:00 AM - 5:00 PM Saturday: 8:00 AM - 11:00 AM ","","21.37577","-158.01922","5.05291868079868","Lead Acid (Pb) Batteries; Computer (Recycling); Computer Monitors; Electronics; Laptop Computers; Printers/Scanners/Fax Machines; Tablets; Video Game Consoles; PlayStation Consoles","false","true","A small disposal fee may be charged, please call for more information.","","false","false","false","false"
"Firestone Complete Auto Care","","1414 Dillingham Blvd","Honolulu","","HI","96817","8088474251","0","","https://www.firestonecompleteautocare.com/","21.3246656","-157.8757943","5.09148577261253","","false","false","","","false","false","false","false"
"Han's Metals Inc.","","94-170 Leokane St","Waipahu","","HI","96797","8086764797","0","","","21.3780158","-158.0188501","5.12199769082047","","false","false","","","false","false","false","false"
"Goodwill Industries of Hawaii Inc - Dell Reconnect Donation Site","","1297 Kaumualii Street","Honolulu","","HI","96817","8088457071","0","","https://www.higoodwill.org/","21.3238306","-157.8742108","5.20057071932044","","false","false","","","false","false","false","false"
"Goodwill Industries of Hawaii Inc - Dell Reconnect Donation Site","","1297 Kaumualii St","Honolulu","","HI","96817","8088457071","0","","https://www.dellreconnect.com/","21.3238306","-157.8742108","5.20057071932044","","false","false","","","false","false","false","false"
"Goodwill Industries of Hawaii Inc - Dell Reconnect Donation Site","","1297 Kaumualii St","Honolulu","","HI","96817","8088457071","0","","https://www.dellreconnect.com/","21.3238306","-157.8742108","5.20057071932044","","false","false","","","false","false","false","false"
"Firestone Complete Auto Care","","94 267 Farrington Highway","Waipahu","","HI","96797","8086779141","0","","https://www.firestonecompleteautocare.com/","21.379717","-158.0190364","5.20094663041434","","false","false","","","false","false","false","false"
"Napa Auto Parts","Napa Auto Parts","94-199 Leonui St","Waipahu","Honolulu","HI","96797","8086714067","0","Monday: 7:30 AM - 5:00 PM Tuesday: 7:30 AM - 5:00 PM Wednesday: 7:30 AM - 5:00 PM Thursday: 7:30 AM - 5:00 PM Friday: 7:30 AM - 5:00 PM Saturday: 7:30 AM - 5:00 PM ","http://www.napaonline.com","21.37772","-158.02088","5.21708252722461","Lead Acid (Pb) Batteries; Computer (Recycling); Computer Monitors; Electronics; Laptop Computers; Printers/Scanners/Fax Machines; Tablets; Video Game Consoles; PlayStation Consoles","false","true","Please place batteries on the pallet in front of the store.","","false","false","false","false"
"O'Reilly Auto Parts","null"," 94-193 Farrington Highway","Waipahu","","HI","96797","8086788669","0","","http://oreillyauto.custhelp.com/app/error/error_id/6","21.3785046","-158.0209693","5.25275621828647","","false","false","","","false","false","false","false"
"Best Buy","Best Buy","478 Alakawa St ","Honolulu","Honolulu County","HI","96817","8085257182","0","","https://www.bestbuy.com/recycle","21.318153","-157.8744411","5.25781638918414","Large Household Appliances; Refrigerators; Televisions; AC Power Plugs; Batteries (Rechargeable); Cables & Connectors; Car Audio/Video Equipment; Cell Phone Batteries; Cell Phones; Computer (Recycling); Hard Drives; Computer Monitors; Cameras; DVD Players/Blu-Ray Players/DVRs; Electronics; E-Readers; GPS Units; Headphones; Inkjet Printer Cartridges; Laptop Computers; Laser Toner Cartridges; Li-Ion Batteries; MP3 Players; Network Equipment; Ni-Cd Batteries; Ni-MH Batteries; Ni-Zn Batteries; Computer Peripherals; Portable Media Players; Printers/Scanners/Fax Machines; Small Electronics; Small Sealed Lead Acid Batteries; Stereo Equipment; Tablets; Telephones; UPS Batteries/Backup Systems; VCRs; Video Game Systems; Blu-Ray Players; Digital Converter Boxes; Small Televisions; Video Game Consoles; PlayStation Consoles","true","true","2 TVs per visit, 3 e-waste items per day; $25 fee for TVs and Monitors; $19.99 pick-up fee with delivery; $99.99 standalone pickup fee; TVs and monitors collected at Best Buy stores are not manufacturer supported in this state, listing provided as an additional option for consumers.","Sony, Vizio, OEM","false","false","false","false"
"Best Buy","","478 Alakawa St","Honolulu","","HI","96817","8085257182","0","","https://www.bestbuy.com/site/services/recycling/pcmcat149900050025.c?id=pcmcat149900050025","21.318153","-157.8744411","5.25781638918414","","false","false","","","false","false","false","false"
"Savers","","94-300 Farrington Highway","Waipahu","","HI","96797","8086710071","0","","https://www.savers.com/donate/what-we-take","21.3811974","-158.0190597","5.26375111296856","","false","false","","","false","false","false","false"
"Home Depot","","421 Alakawa St","Honolulu","","HI","96817","8085217355","0","","https://ecooptions.homedepot.com/","21.3172564","-157.8731862","5.35037741082074","","false","false","","","false","false","false","false"
"Firestone Complete Auto Care Store","Firestone Complete Auto Care Store","1414 Dillingham Blvd","Honolulu","Honolulu County","HI","96817","8084265797","0","","http://www.firestonecompleteautocare.com/","21.3319801","-157.8709972","5.35505395393963","Lead Acid (Pb) Batteries; Used Motor Oil; Computer (Recycling); Computer Monitors; Electronics; Laptop Computers; Printers/Scanners/Fax Machines; Tablets; Video Game Consoles; PlayStation Consoles","false","true","","","false","false","false","false"
"Call2Recycle at the Home Depot","Call2Recycle at the Home Depot","421 Alakawa St","Honolulu","Honolulu","HI","96817","8085217355","0","","http://www.homedepot.com/","21.3174","-157.87301","5.35918199867166","Cell Phones; Compact Fluorescent Lights; Ni-Cd Batteries; Li-Ion Batteries; Ni-MH Batteries; Ni-Zn Batteries; Small Sealed Lead Acid Batteries; Computer (Recycling); Computer Monitors; Electronics; Laptop Computers; Printers/Scanners/Fax Machines; Tablets; Video Game Consoles; PlayStation Consoles","false","true","The Home Depot accepts used rechargeable batteries and compact fluorescent bulbs. Look for the orange drop boxes, usually located near the front entrance near the customer service desk, or ask a store associate for more details.","","false","false","false","false"
"Goodwill Industries of Hawaii Inc - Dell Reconnect Donation Site","","94-144 Farrington Highway","Waipahu","","HI","96797","8086779521","0","","https://www.higoodwill.org/","21.3796911","-158.0222269","5.36610999808849","","false","false","","","false","false","false","false"
"AT&T Wireless","AT&T Wireless","94-050 Farrington Hwy","Waipahu","Honolulu","HI","96797","8086715991","0","Monday: 9:00 AM - 8:00 PM Tuesday: 9:00 AM - 8:00 PM Wednesday: 9:00 AM - 8:00 PM Thursday: 9:00 AM - 8:00 PM Friday: 9:00 AM - 8:00 PM Saturday: 9:00 AM - 6:00 PM Sunday: 10:00 AM - 5:00 PM ","http://www.att.com/","21.37759","-158.02391","5.37374263095413","Cell Phones; Ni-Cd Batteries; Batteries (Rechargeable); Cell Phone Batteries; Tablets; Li-Ion Batteries; Computer (Recycling); Computer Monitors; Electronics; Laptop Computers; Printers/Scanners/Fax Machines; Video Game Consoles; PlayStation Consoles","false","true","Receive an AT&T Promotion Card worth the trade-in value of your smartphone, tablet, or netbook. You can also donate the trade-in value to Cell Phones for Soldiers.","","false","false","false","false"
"US Post Office","US Post Office","1271 N King St","Honolulu","Honolulu","HI","96817","0","0","","https://www.usps.com/ship/recycle-through-usps.htm","21.32694","-157.87073","5.39631582131723","Inkjet Printer Cartridges; Computer (Recycling); Computer Monitors; Electronics; Laptop Computers; Printers/Scanners/Fax Machines; Tablets; Video Game Consoles; PlayStation Consoles","false","true","Free, postage-paid Mail Back envelopes can be found on display in the lobby. There is no limit to the number of envelopes customers may take. The contents of the envelope must weigh less than 13 ounces and the envelope must be able to seal completely. For more details visit<a href="http://www.maxback.com/mxb-postoffice-collaboration" target="_blank">MaxBack</a>.","","false","false","false","false"
"Ewa Convenience Center","","91-1000 Geiger Rd","Ewa Beach","","HI","96706","8082262996","0","","http://www.opala.org/solid_waste/Drop_off_Centers_for_Refuse.html","21.330141","-158.03806","5.40977398949053","","false","false","","","false","false","false","false"
"USPS Post Office Box Lobby Recycling Program","US Post Office","94-245 Leoku St","Waipahu","Honolulu","HI","96797","8002758777","0","","https://www.usps.com/","21.37985","-158.02437","5.48547203843494","Catalogs; Greeting Cards; Magazines; Paper (Mixed)","false","true","","","false","false","false","false"
"US Post Office","US Post Office","94-245 Leoku St","Waipahu","Honolulu","HI","96797","0","0","","https://www.usps.com/ship/recycle-through-usps.htm","21.37985","-158.02437","5.48547203843494","Inkjet Printer Cartridges; Computer (Recycling); Computer Monitors; Electronics; Laptop Computers; Printers/Scanners/Fax Machines; Tablets; Video Game Consoles; PlayStation Consoles","false","true","Free, postage-paid Mail Back envelopes can be found on display in the lobby. There is no limit to the number of envelopes customers may take. The contents of the envelope must weigh less than 13 ounces and the envelope must be able to seal completely. For more details visit<a href="http://www.maxback.com/mxb-postoffice-collaboration" target="_blank">MaxBack</a>.","","false","false","false","false"
"Lowe's","","94 Lumiaina St","Waipahu","","HI","96797","8086768381","0","","https://newsroom.lowes.com/responsibility/operational-excellence/","21.4007488","-158.001703","5.48670456601867","","false","false","","","false","false","false","false"
"OfficeMax","","94-861 Lumiaina St","Waipahu","","HI","96797","8086717337","0","","","21.3998146","-158.0036895","5.50623867062323","","false","false","","","false","false","false","false"
"Levi’s® ","Levi’s® Store","94-792 Lumiaina St","Waipahu","Honolulu","HI","96797","8086767660","8086757226","","http://www.levistrauss.com/","21.40084","-158.00815","5.73337935492634","Clothing; Denim; Shoes; Computer (Recycling); Computer Monitors; Electronics; Laptop Computers; Printers/Scanners/Fax Machines; Tablets; Video Game Consoles; PlayStation Consoles","false","true","Customers may drop off no-longer-wanted clothing and shoes for recycling in the collection boxes at local Levi’s® stores and Levi’s® Outlet  stores and receive a voucher for 20% off a single regular-priced Levi’s®  item in-store.","","false","false","false","false"
"T & N Computer Recycling Services LLC- KING STREET","null","693 N King St ","Honolulu","Honolulu County","HI","96817","8086825600","0","Sunday:  -  Monday: 9:15 AM - 4:45 PM Tuesday: 9:15 AM - 4:45 PM Wednesday: 9:15 AM - 4:45 PM Thursday: 9:15 AM - 4:45 PM Friday: 9:15 AM - 4:45 PM Saturday: 8:00 AM - 3:30 PM ","http://tncomputerrecycling.com/","21.3199799","-157.8663282","5.74448793456502","Computer (Recycling); Computer Monitors; Electronics; Laptop Computers; Printers/Scanners/Fax Machines; Tablets; Video Game Consoles; PlayStation Consoles","false","true","","OEM, Vizio, Sony","false","false","false","false"
"Napa Auto Parts","Napa Auto Parts","640 N King St","Honolulu","Honolulu","HI","96817","8088326272","0","Monday: 8:00 AM - 5:00 PM Tuesday: 8:00 AM - 5:00 PM Wednesday: 8:00 AM - 5:00 PM Thursday: 8:00 AM - 5:00 PM Friday: 8:00 AM - 5:00 PM Saturday: 8:00 AM - 4:30 PM ","http://www.napaonline.com","21.32033","-157.86599","5.76164437878688","Lead Acid (Pb) Batteries; Computer (Recycling); Computer Monitors; Electronics; Laptop Computers; Printers/Scanners/Fax Machines; Tablets; Video Game Consoles; PlayStation Consoles","false","true","","","false","false","false","false"
"Salvation Army","Salvation Army","806 Iwilei Rd","Honolulu","Honolulu","HI","96817","8085228460","0","Monday: 9:00 AM - 9:00 PM Tuesday: 9:00 AM - 9:00 PM Wednesday: 9:00 AM - 9:00 PM Thursday: 9:00 AM - 9:00 PM Friday: 9:00 AM - 9:00 PM Saturday: 9:00 AM - 9:00 PM ","http://www.salvationarmy.org","21.31601","-157.86681","5.76961077761433","Bikes; Books (Reuse); Cell Phones; Clothing; CD/DVD/Blu-ray/UHD discs; Computer (Reuse); Electronics; Gift Bags; Eyeglasses; Furniture; Household Goods; Lawn Equipment; Bed Mattresses; Musical Instruments; Ornaments; Reusable Appliance Donation; Sporting Goods; Telephones; Televisions; Miscellaneous Tools; Children's Toys; VHS & Cassette Tapes; Small Appliances; MP3 Players; Computer (Recycling); Computer Monitors; Laptop Computers; Printers/Scanners/Fax Machines; Tablets; Video Game Consoles; PlayStation Consoles","false","true","This site accepts clean, gently used items.  All appliances and electronics must be in working condition.  Please call for more information.","Sony","false","false","false","false"
"Waipio Auto Parts","Waipio Auto Parts","94-1040 Waipio Uka St Ste 10","Waipahu","Honolulu","HI","96797","8086769089","0","Monday: 8:00 AM - 6:00 PM Tuesday: 8:00 AM - 6:00 PM Wednesday: 8:00 AM - 6:00 PM Thursday: 8:00 AM - 6:00 PM Friday: 8:00 AM - 6:00 PM Saturday: 8:00 AM - 4:00 PM Sunday: 9:00 AM - 1:00 PM ","","21.41148","-157.99758","5.98779707982933","Lead Acid (Pb) Batteries; Computer (Recycling); Computer Monitors; Electronics; Laptop Computers; Printers/Scanners/Fax Machines; Tablets; Video Game Consoles; PlayStation Consoles","false","true","","","false","false","false","false"
"Goodwill Industries of Hawaii","Goodwill Industries of Hawaii","94-1040 Waipio Uka St","Waipahu","Honolulu","HI","96797","8086779521","0","","http://www.higoodwill.org","21.41148","-157.99758","5.98779707982933","Bikes; Books (Reuse); Clothing; CD/DVD/Blu-ray/UHD discs; Gift Bags; Eyeglasses; Furniture; Household Goods; Lawn Equipment; Ornaments; Reusable Appliance Donation; Sporting Goods; Telephones; Children's Toys; Computer (Recycling); Computer Monitors; Electronics; Laptop Computers; Printers/Scanners/Fax Machines; Tablets; Video Game Consoles; PlayStation Consoles","false","true","","","false","false","false","false"
"Goodwill Industries of Hawaii Inc - Dell Reconnect Donation Site","","94-1040 Waipio Uka","Waipahu","","HI","96797","8088360313","0","","https://www.higoodwill.org/","21.4123024","-157.9989387","6.07905165281913","","false","false","","","false","false","false","false"
