name,description,address,city,region,province,postal_code,phone,fax,hours,url,latitude,longitude,distance,materials,pickup,dropoff,notes,groups,curbside,municipal,national,event_only
"Verizon Wireless","Verizon Wireless","930 Valkenburgh St","Honolulu","Honolulu","HI","96818","8666444532","0","","http://www.verizonwireless.com/","21.34106","-157.92965","1.63446733299636","Cell Phones; Cell Phone Batteries; Computer (Recycling); Computer Monitors; Electronics; Laptop Computers; Printers/Scanners/Fax Machines; Tablets; Video Game Consoles; PlayStation Consoles","false","true","<A Href="https://www.trade-in.vzw.com/home.aspx">
The Verizon Wireless Trade-In Program</A> allows you to trade in your used handset or tablet in a convenient and responsible way. 
<P>
<P>
Verizon Wireless works every day to protect our environment and give our customers opportunities to do the same. <A Href="http://aboutus.vzw.com/Green_Initiative/overview.html">Click here</A> for more examples of the earth-friendly initiatives and programs Verizon Wireless is proud to offer and support.","","false","false","false","false"
"Target Store","","4380 Lawehana St","Honolulu","","HI","96818","8084413118","0","","https://corporate.target.com/corporate-responsibility/planet","21.3553179","-157.929448","2.12863045622385","","false","false","","","false","false","false","false"
"Target","Target","4380 Lawehana St","Honolulu","Honolulu","HI","96818","8084413118","0","","http://www.target.com/","21.35549","-157.92837","2.18866002475704","Aluminum Cans; Cell Phones; Inkjet Printer Cartridges; MP3 Players; Plastic #1 (PETE); Plastic #2 (HDPE); Plastic Shopping Bags; Computer (Recycling); Computer Monitors; Electronics; Laptop Computers; Printers/Scanners/Fax Machines; Tablets; Video Game Consoles; PlayStation Consoles","false","true","","","false","false","false","false"
"O'Reilly Auto Parts","O'Reilly Auto Parts","4561 Salt Lake Blvd ","Honolulu","Honolulu County","HI","96818","8084850414","0","","http://www.oreillyauto.com/","21.3652172","-157.9305013","2.59311198317824","Lead Acid (Pb) Batteries; Computer (Recycling); Computer Monitors; Electronics; Laptop Computers; Printers/Scanners/Fax Machines; Tablets; Video Game Consoles; PlayStation Consoles","false","true","Most stores offer Used Oil & Battery Recycling, Battery Testing, 
Electrical & Module Testing, Loaner Tool Program, Drum / Rotor Resurfacing. Call your location for more details.","","false","false","false","false"
"OfficeMax","","4561 Salt Lake Blvd","Honolulu","","HI","96818","8084851083","0","","","21.3661618","-157.9302282","2.65637328257037","","false","false","","","false","false","false","false"
"O'Reilly Auto Parts","null","4561 Salt Lake Blvd Ste A ","Honolulu","","HI","96818","8084850414","0","","http://oreillyauto.custhelp.com/app/error/error_id/6","21.3661618","-157.9302282","2.65637328257037","","false","false","","","false","false","false","false"
"O'Reilly Auto Parts","","4561 Salt Lake Blvd","Honolulu","","HI","96818","8084850414","0","","http://oreillyauto.custhelp.com/app/error/error_id/6","21.3661618","-157.9302282","2.65637328257037","","false","false","","","false","false","false","false"
"Safeway","","848 Ala Lilikoi St","Honolulu","","HI","96818","8088316100","0","","https://shop.safeway.com/home.html","21.3450046","-157.9134263","2.71343447308135","","false","false","","","false","false","false","false"
"Safeway","Safeway","848 Ala Lilikoi St","Honolulu","Honolulu","HI","96818","8088316100","0","Sunday: 12:00 AM - 11:59 PM Monday: 12:00 AM - 11:59 PM Tuesday: 12:00 AM - 11:59 PM Wednesday: 12:00 AM - 11:59 PM Thursday: 12:00 AM - 11:59 PM Friday: 12:00 AM - 11:59 PM Saturday: 12:00 AM - 11:59 PM ","http://www.safeway.com","21.34492","-157.91309","2.73284658813909","Plastic Shopping Bags; Food Storage Bags; Computer (Recycling); Computer Monitors; Electronics; Laptop Computers; Printers/Scanners/Fax Machines; Tablets; Video Game Consoles; PlayStation Consoles","false","true","","","false","false","false","false"
"Reynolds Recycling Certified Redemption Center - Stadium Mall","","4510 Salt Lake Blvd","Honolulu","","HI","96818","8084872802","0","","http://www.reynoldsrecycling.com/","21.3657905","-157.9273987","2.74583897779785","","false","false","","","false","false","false","false"
"Waipahu Convenience Center","","Waipahu Depot Rd","Waipahu","","HI","96797","8086768878","0","","http://www.opala.org/solid_waste/Drop_off_Centers_for_Refuse.html","21.3617852","-157.9906021","2.9951074585272","","false","false","","","false","false","false","false"
"Sprint Store","null","98-199 Kamehameha Hwy Ste B-4","Aiea","","HI","96701","8084852885","0","","https://newsroom.sprint.com/csr/device-donations/","21.3811411","-157.9428616","3.28119247401402","","false","false","","","false","false","false","false"
"Sprint","Sprint","98-199 Kamehameha Hwy ","Aiea","Honolulu County","HI","96701","8084852885","0","Monday: 9:00 AM - 8:00 PM Tuesday: 9:00 AM - 8:00 PM Wednesday: 9:00 AM - 8:00 PM Thursday: 9:00 AM - 8:00 PM Friday: 9:00 AM - 8:00 PM Saturday: 9:00 AM - 6:00 PM Sunday: 10:00 AM - 6:00 PM ","http://green.sprint.com/","21.3810703","-157.9421973","3.28616374925009","Cell Phones; Computer (Recycling); Computer Monitors; Electronics; Laptop Computers; Printers/Scanners/Fax Machines; Tablets; Video Game Consoles; PlayStation Consoles","false","true","","","false","false","false","false"
"USPS Post Office Box Lobby Recycling Program","US Post Office","99-040 Kauhale St","Aiea","Honolulu","HI","96701","8002758777","0","","https://www.usps.com/","21.37849","-157.93304","3.30834961857963","Catalogs; Greeting Cards; Magazines; Paper (Mixed)","false","true","","","false","false","false","false"
"US Post Office","US Post Office","99-040 Kauhale St","Aiea","Honolulu","HI","96701","0","0","","https://www.usps.com/ship/recycle-through-usps.htm","21.37849","-157.93304","3.30834961857963","Inkjet Printer Cartridges; Computer (Recycling); Computer Monitors; Electronics; Laptop Computers; Printers/Scanners/Fax Machines; Tablets; Video Game Consoles; PlayStation Consoles","false","true","Free, postage-paid Mail Back envelopes can be found on display in the lobby. There is no limit to the number of envelopes customers may take. The contents of the envelope must weigh less than 13 ounces and the envelope must be able to seal completely. For more details visit<a href="http://www.maxback.com/mxb-postoffice-collaboration" target="_blank">MaxBack</a>.","","false","false","false","false"
"Firestone Complete Auto Care","","98 141 Kamehameha Highway","Aiea","","HI","96701","8084861582","0","","https://www.firestonecompleteautocare.com/","21.3819877","-157.9440493","3.3224649361192","","false","false","","","false","false","false","false"
"Firestone Complete Auto Care Store","Firestone Complete Auto Care Store","98-141 Kamehameha Hwy","Aiea","Honolulu","HI","96701","8084265992","0","","http://www.firestonecompleteautocare.com/","21.38231","-157.94395","3.34555276462947","Lead Acid (Pb) Batteries; Used Motor Oil; Computer (Recycling); Computer Monitors; Electronics; Laptop Computers; Printers/Scanners/Fax Machines; Tablets; Video Game Consoles; PlayStation Consoles","false","true","","","false","false","false","false"
"Best Buy","null","98-051 Kamehameha Hwy","Aiea","","HI","96701","8084856940","0","","https://www.bestbuy.com/site/services/recycling/pcmcat149900050025.c?id=pcmcat149900050025","21.3824773","-157.9419313","3.38468386722351","","false","false","","","false","false","false","false"
"Best Buy","Best Buy","98-051 Kamehameha Hwy ","Aiea","Honolulu County","HI","96701","8084856940","0","","https://www.bestbuy.com/recycle","21.384606","-157.949839","3.45033556083269","Large Household Appliances; Refrigerators; Televisions; AC Power Plugs; Batteries (Rechargeable); Cables & Connectors; Car Audio/Video Equipment; Cell Phone Batteries; Cell Phones; Computer (Recycling); Hard Drives; Computer Monitors; Cameras; DVD Players/Blu-Ray Players/DVRs; Electronics; E-Readers; GPS Units; Headphones; Inkjet Printer Cartridges; Laptop Computers; Laser Toner Cartridges; Li-Ion Batteries; MP3 Players; Network Equipment; Ni-Cd Batteries; Ni-MH Batteries; Ni-Zn Batteries; Computer Peripherals; Portable Media Players; Printers/Scanners/Fax Machines; Small Electronics; Small Sealed Lead Acid Batteries; Stereo Equipment; Tablets; Telephones; UPS Batteries/Backup Systems; VCRs; Video Game Systems; Blu-Ray Players; Digital Converter Boxes; Small Televisions; Video Game Consoles; PlayStation Consoles","true","true","2 TVs per visit, 3 e-waste items per day; $25 fee for TVs and Monitors; $19.99 pick-up fee with delivery; $99.99 standalone pickup fee; TVs and monitors collected at Best Buy stores are not manufacturer supported in this state, listing provided as an additional option for consumers.","Sony, Vizio, OEM","false","false","false","false"
"Environmental Manufacturing","Environmental Manufacturing","98736 Moanalua Loop ","Aiea","Honolulu County","HI","96701","8084871100","0","Monday: 8:00 AM - 4:00 PM Tuesday: 8:00 AM - 4:00 PM Wednesday: 8:00 AM - 4:00 PM Thursday: 8:00 AM - 4:00 PM Friday: 8:00 AM - 4:00 PM ","","21.3842721","-157.9463895","3.45240497201659","Brown Paper Bags; Cardboard; Drink Boxes; Newspapers; Paperboard; Phone books; Computer (Recycling); Computer Monitors; Electronics; Laptop Computers; Printers/Scanners/Fax Machines; Tablets; Video Game Consoles; PlayStation Consoles","false","true","Facility is behind a security gate. Please call or email for access instructions or biweekly community related recycling drives. All papers collected will be recycled on site. Meaning we process the raw materials and MANUFACTURE products to reduce environmental pollution. None of the materials are shipped abroad. Keep it local.","","false","false","false","false"
"Goodwill Industries of Hawaii Inc - Dell Reconnect Donation Site","","98-019 Kamehameha Highway","Aiea","","HI","96701","8084881230","0","","https://www.higoodwill.org/","21.3849374","-157.9505931","3.46961926711068","","false","false","","","false","false","false","false"
"Yellowbook Recycle - Island Shell, LLC","Yellowbook Recycle - Island Shell, LLC","98-736 Moanalua Loop","Aiea","Honolulu","HI","96701","80092935569","0","","http://recycleyellowbook.com/","21.38668","-157.9473","3.60947417642622","Phone books; Computer (Recycling); Computer Monitors; Electronics; Laptop Computers; Printers/Scanners/Fax Machines; Tablets; Video Game Consoles; PlayStation Consoles","false","true","","","false","false","false","false"
"RadioShack","RadioShack","98-1005 Moanalua Rd","Aiea","Honolulu","HI","96701","8084878827","0","Monday: 10:00 AM - 9:00 PM Tuesday: 10:00 AM - 9:00 PM Wednesday: 10:00 AM - 9:00 PM Thursday: 10:00 AM - 9:00 PM Friday: 10:00 AM - 9:00 PM Saturday: 10:00 AM - 9:00 PM Sunday: 10:00 AM - 6:00 PM ","http://www.radioshack.com","21.38631","-157.94189","3.64333273610753","Cell Phones; Ni-Cd Batteries; Batteries (Rechargeable); Computer (Recycling); Computer Monitors; Electronics; Laptop Computers; Printers/Scanners/Fax Machines; Tablets; Video Game Consoles; PlayStation Consoles","false","true","This site is located in the Pearl Ridge Center.","","false","false","false","false"
"Verizon Wireless","Verizon Wireless","98-1005 Moanalua Rd Spc 2306a","Aiea","Honolulu","HI","96701","8666444532","0","","http://www.verizonwireless.com/","21.38631","-157.94189","3.64333273610753","Cell Phones; Cell Phone Batteries; Computer (Recycling); Computer Monitors; Electronics; Laptop Computers; Printers/Scanners/Fax Machines; Tablets; Video Game Consoles; PlayStation Consoles","false","true","<A Href="https://www.trade-in.vzw.com/home.aspx">
The Verizon Wireless Trade-In Program</A> allows you to trade in your used handset or tablet in a convenient and responsible way. 
<P>
<P>
Verizon Wireless works every day to protect our environment and give our customers opportunities to do the same. <A Href="http://aboutus.vzw.com/Green_Initiative/overview.html">Click here</A> for more examples of the earth-friendly initiatives and programs Verizon Wireless is proud to offer and support.","","false","false","false","false"
"LensCrafters","LensCrafters","98-1005 Moanalua Rd Spc 202","Aiea","Honolulu","HI","96701","8084869120","0","Monday: 10:00 AM - 9:00 PM Tuesday: 10:00 AM - 9:00 PM Wednesday: 10:00 AM - 9:00 PM Thursday: 10:00 AM - 9:00 PM Friday: 10:00 AM - 9:00 PM Saturday: 10:00 AM - 9:00 PM Sunday: 10:00 AM - 6:00 PM ","http://www.lenscrafters.com","21.38631","-157.94189","3.64333273610753","Eyeglasses; Computer (Recycling); Computer Monitors; Electronics; Laptop Computers; Printers/Scanners/Fax Machines; Tablets; Video Game Consoles; PlayStation Consoles","false","true","This site is located at the Pearlridge Mall.","","false","false","false","false"
"Cartridge World","","99 Moanalua Road","Aiea","","HI","96701","8084888855","0","","","21.3875871","-157.9450879","3.69147842859439","","false","false","","","false","false","false","false"
"Yellowbook/Paradise Pages","Yellowbook/Paradise Pages","99-807 Iwaena St","Aiea","Honolulu","HI","96701","80092935569","0","","http://recycleyellowbook.com/","21.3733","-157.914","3.70675897827892","Phone books; Computer (Recycling); Computer Monitors; Electronics; Laptop Computers; Printers/Scanners/Fax Machines; Tablets; Video Game Consoles; PlayStation Consoles","false","true","","","false","false","false","false"
"Safeway","","98 1277 Kaahumanu St","Honolulu","","HI","96814","8084835900","0","","https://shop.safeway.com/home.html","21.3897262","-157.9519446","3.79557258178568","","false","false","","","false","false","false","false"
"Goodwill Industries of Hawaii Inc - Dell Reconnect Donation Site","","2610 Kilihau Street","Honolulu","","HI","96819","0","0","","https://www.higoodwill.org/","21.3362215","-157.895076","3.80298892797476","","false","false","","","false","false","false","false"
"Safeway","Safeway","98-1277 Kaahumanu St ","Aiea","Honolulu County","HI","96701","8084835900","0","Sunday: 12:00 AM - 11:59 PM Monday: 12:00 AM - 11:59 PM Tuesday: 12:00 AM - 11:59 PM Wednesday: 12:00 AM - 11:59 PM Thursday: 12:00 AM - 11:59 PM Friday: 12:00 AM - 11:59 PM Saturday: 12:00 AM - 11:59 PM ","http://www.safeway.com","21.3902503","-157.951905","3.83185279144498","Plastic Shopping Bags; Food Storage Bags; Computer (Recycling); Computer Monitors; Electronics; Laptop Computers; Printers/Scanners/Fax Machines; Tablets; Video Game Consoles; PlayStation Consoles","false","true","","","false","false","false","false"
"One Stop GPS","One Stop GPS","98 Moanalua Rd ","Pearl City","Honolulu County","HI","96782","8084840555","0","Monday: 9:00 AM - 6:00 PM Tuesday: 9:00 AM - 6:00 PM Wednesday: 9:00 AM - 6:00 PM Thursday: 9:00 AM - 6:00 PM Friday: 9:00 AM - 6:00 PM Saturday: 10:00 AM - 4:00 PM ","","21.3910629","-157.9551759","3.88582884694664","Packing Materials; Packing Peanut (Reuse); Computer (Recycling); Computer Monitors; Electronics; Laptop Computers; Printers/Scanners/Fax Machines; Tablets; Video Game Consoles; PlayStation Consoles","false","true","","","false","false","false","false"
"Honolulu Recovery Systems","Honolulu Recovery Systems","50 Sand Island Access Rd Ste D","Honolulu","Honolulu","HI","96819","8088413179","0","Monday: 7:00 AM - 2:00 PM Tuesday: 7:00 AM - 2:00 PM Wednesday: 7:00 AM - 2:00 PM Thursday: 7:00 AM - 2:00 PM Friday: 7:00 AM - 2:00 PM Saturday: 7:00 AM - 11:00 AM ","","21.32512","-157.89374","3.9453267968191","Aluminum Cans; Glass (Brown); Cardboard; Glass (Clear); Computer Paper; Glass (Green); Newspapers; Office Paper; Computer (Recycling); Computer Monitors; Electronics; Laptop Computers; Printers/Scanners/Fax Machines; Tablets; Video Game Consoles; PlayStation Consoles","false","true","","","false","false","false","false"
"Goodwill Industries of Hawaii Inc - Dell Reconnect Donation Site","","91-919 Fort Weaver Road","Ewa Beach","","HI","96706","8088360313","0","","https://www.higoodwill.org/","21.3169861","-158.0138431","4.03465880917704","","false","false","","","false","false","false","false"
"Reynolds Recycling Certified Redemption Center - Ewa Beach Shopping Center","","91-919 Fort Weaver Road","Ewa Beach","","HI","96706","8084872802","0","","http://www.reynoldsrecycling.com/","21.3169861","-158.0138431","4.03465880917704","","false","false","","","false","false","false","false"
"Tomra Recycling Drop-Off Site - Ewa Beach Shopping Center","Tomra Recycling Drop-Off Site - Ewa Beach Shopping Center","105 Fort Weaver Rd ","Ewa Beach","Honolulu County","HI","96706","8084872802","0","Tuesday: 9:00 AM - 5:00 PM Wednesday: 9:00 AM - 5:00 PM Thursday: 9:00 AM - 5:00 PM Friday: 9:00 AM - 5:00 PM Saturday: 9:00 AM - 5:00 PM ","null","21.3167555","-158.0140124","4.04992170175001","Plastic #1 (PETE); Plastic #2 (HDPE); Plastic #2 (Color HDPE); Aluminum Cans; Glass (Brown); Glass (Clear); Glass (Green); Tin or Steel Cans; Computer (Recycling); Computer Monitors; Electronics; Laptop Computers; Printers/Scanners/Fax Machines; Tablets; Video Game Consoles; PlayStation Consoles","false","true","","","false","false","false","false"
"US Post Office","US Post Office","91-760 Papipi Rd","Ewa Beach","Honolulu","HI","96706","0","0","","https://www.usps.com/ship/recycle-through-usps.htm","21.31521","-158.01435","4.10462774286202","Inkjet Printer Cartridges; Computer (Recycling); Computer Monitors; Electronics; Laptop Computers; Printers/Scanners/Fax Machines; Tablets; Video Game Consoles; PlayStation Consoles","false","true","Free, postage-paid Mail Back envelopes can be found on display in the lobby. There is no limit to the number of envelopes customers may take. The contents of the envelope must weigh less than 13 ounces and the envelope must be able to seal completely. For more details visit<a href="http://www.maxback.com/mxb-postoffice-collaboration" target="_blank">MaxBack</a>.","","false","false","false","false"
"The Packaging Store","The Packaging Store","2282 Hoonee Pl","Honolulu","Honolulu","HI","96819","8088438098","0","Monday: 8:30 AM - 5:00 PM Tuesday: 8:30 AM - 5:00 PM Wednesday: 8:30 AM - 5:00 PM Thursday: 8:30 AM - 5:00 PM Friday: 8:30 AM - 5:00 PM ","","21.32826","-157.89042","4.12654453673804","Packing Materials; Packing Peanut (Reuse); Computer (Recycling); Computer Monitors; Electronics; Laptop Computers; Printers/Scanners/Fax Machines; Tablets; Video Game Consoles; PlayStation Consoles","false","true","","","false","false","false","false"
"Handle With Care Packaging Store","","2282 Hoonee Pl #24","Honolulu","","HI","96819","8088438098","0","","https://www.gopackagingstore.com/","21.3284288","-157.8903254","4.13132912797906","","false","false","","","false","false","false","false"
"Goodwill Industries of Hawaii","Goodwill Industries of Hawaii","890 Kamehameha Hwy","Pearl City","Honolulu","HI","96782","8084881230","0","Sunday: 9:00 AM - 5:00 PM Monday: 9:00 AM - 5:00 PM Wednesday: 9:00 AM - 5:00 PM Thursday: 9:00 AM - 5:00 PM Saturday: 9:00 AM - 5:00 PM ","http://www.higoodwill.org","21.39383","-157.96907","4.18794486544407","Bikes; Books (Reuse); Clothing; CD/DVD/Blu-ray/UHD discs; Gift Bags; Eyeglasses; Furniture; Household Goods; Lawn Equipment; Office Equipment; Ornaments; Reusable Appliance Donation; Sporting Goods; Telephones; Children's Toys; Computer (Recycling); Computer Monitors; Electronics; Laptop Computers; Printers/Scanners/Fax Machines; Tablets; Video Game Consoles; PlayStation Consoles","false","true","","","false","false","false","false"
"CM Recycling LLC","CM Recycling LLC","204 Sand Island Access Rd ","Honolulu","Honolulu County","HI","96819","8088426640","0","Monday: 8:00 AM - 4:30 PM Tuesday: 8:00 AM - 4:30 PM Wednesday: 8:00 AM - 4:30 PM Thursday: 8:00 AM - 4:30 PM Friday: 8:00 AM - 4:30 PM Saturday: 8:00 AM - 4:30 PM ","","21.3259656","-157.8896672","4.19492561890078","Plastic #1 (PETE); Plastic #2 (HDPE); Plastic #2 (Color HDPE); Plastic #3 (PVC); Plastic #4 (LDPE); Plastic #5 (Polypropylene); Plastic #6 (Polystyrene); Plastic #7; Aluminum Cans; Glass (Clear); Ferrous Metals (Steel or Iron); Non-ferrous (Copper/Brass/Tin); Windows; Computer (Recycling); Computer Monitors; Electronics; Laptop Computers; Printers/Scanners/Fax Machines; Tablets; Video Game Consoles; PlayStation Consoles","false","true","We accept copper, aluminum/can/scrap/wheels, yellow/red brass, radiators, electric motors. Call for a compelete list.","","false","false","false","false"
"C M Recycling Company","","204 Sand Island Access Rd","Honolulu","","HI","96819","8088426640","0","","","21.325909","-157.8896268","4.19807083308658","","false","false","","","false","false","false","false"
"Reynolds Recycling Certified Redemption Center - Pearl City Shopping Center","","850 Kamehameha Highway","Pearl City","","HI","96782","8084872802","0","","http://www.reynoldsrecycling.com/","21.3943355","-157.968869","4.21902559504219","","false","false","","","false","false","false","false"
"Goodwill Industries of Hawaii Inc - Dell Reconnect Donation Site","","890 Kamehameha Highway","Pearl City","","HI","96782","8088360313","0","","https://www.higoodwill.org/","21.394138","-157.9698987","4.22114136481329","","false","false","","","false","false","false","false"
"Reynolds Recycling Plant - Hlawa Industrial Area","","99-1160 Iwaena St","Halawa","","HI","96701","8084872802","0","","http://www.reynoldsrecycling.com/","21.379936","-157.9088154","4.26876204402407","","false","false","","","false","false","false","false"
"Honolulu Recovery Systems - HI-5 Redemption Center","","207 Puuhale Rd","Honolulu","","HI","96819","8088423181","0","","http://honoluludisposal.com/recycling/","21.3244428","-157.8872981","4.36190780843752","","false","false","","","false","false","false","false"
"Honolulu Recovery","Honolulu Recovery","207 Puuhale Rd","Honolulu","Honolulu","HI","96819","8088423181","0","Monday: 7:00 AM - 3:30 PM Tuesday: 7:00 AM - 3:30 PM Wednesday: 7:00 AM - 3:30 PM Thursday: 7:00 AM - 3:30 PM Friday: 7:00 AM - 3:30 PM Saturday: 7:00 AM - 3:30 PM ","","21.32409","-157.88736","4.36206292199461","Plastic #1 (PETE); Plastic #2 (HDPE); Plastic #2 (Color HDPE); Plastic #3 (PVC); Plastic #4 (LDPE); Plastic #5 (Polypropylene); Plastic #6 (Polystyrene); Plastic #7; Aluminum Cans; Aluminum; Books (Reuse); Book Recycling; Glass (Brown); Brown Paper Bags; Cardboard; Glass (Clear); Computer Paper; Glass (Green); Greeting Cards; Magazines; Paper (Mixed); Newspapers; Phone books; Office Paper; Windows; Unused Paper; Computer (Recycling); Computer Monitors; Electronics; Laptop Computers; Printers/Scanners/Fax Machines; Tablets; Video Game Consoles; PlayStation Consoles","false","true","","","false","false","false","false"
"Safeway","","91 Keaunui Drive","Ewa Beach","","HI","96706","8086833200","0","","https://shop.safeway.com/home.html","21.3269173","-158.0215245","4.37026803963345","","false","false","","","false","false","false","false"
"Hagadone Printing Company","Hagadone Printing Company","274 Puuhale Rd","Honolulu","Honolulu","HI","96819","8088526348","0","Monday: 8:00 AM - 5:00 PM Tuesday: 8:00 AM - 5:00 PM Wednesday: 8:00 AM - 5:00 PM Thursday: 8:00 AM - 5:00 PM Friday: 8:00 AM - 5:00 PM ","http://www.hagadoneprinting.com","21.32627","-157.88676","4.37721136780268","Catalogs; Computer Paper; Magazines; Phone books; Office Paper; Computer (Recycling); Computer Monitors; Electronics; Laptop Computers; Printers/Scanners/Fax Machines; Tablets; Video Game Consoles; PlayStation Consoles","false","true","","","false","false","false","false"
"Hagadone Printing Company","","274 Pu'uhale Road","Honolulu","","HI","96819","8088526348","0","","http://www.hagadoneprinting.com","21.3262543","-157.8866926","4.38165606448116","","false","false","","","false","false","false","false"
"Home Depot","","1021 Kamehameha Hwy","Pearl City","","HI","96782","8084551200","0","","https://ecooptions.homedepot.com/","21.3950201","-157.9758371","4.3865129366999","","false","false","","","false","false","false","false"
"US Post Office","US Post Office","950 Kamehameha Hwy","Pearl City","Honolulu","HI","96782","0","0","","https://www.usps.com/ship/recycle-through-usps.htm","21.39568","-157.9737","4.38838843185667","Inkjet Printer Cartridges; Computer (Recycling); Computer Monitors; Electronics; Laptop Computers; Printers/Scanners/Fax Machines; Tablets; Video Game Consoles; PlayStation Consoles","false","true","Free, postage-paid Mail Back envelopes can be found on display in the lobby. There is no limit to the number of envelopes customers may take. The contents of the envelope must weigh less than 13 ounces and the envelope must be able to seal completely. For more details visit<a href="http://www.maxback.com/mxb-postoffice-collaboration" target="_blank">MaxBack</a>.","","false","false","false","false"
"Verizon Wireless","Verizon Wireless","1000 Kamehameha Hwy Ste 225","Pearl City","Honolulu","HI","96782","8666444532","0","","http://www.verizonwireless.com/","21.39647","-157.97556","4.47607559020098","Cell Phones; Cell Phone Batteries; Computer (Recycling); Computer Monitors; Electronics; Laptop Computers; Printers/Scanners/Fax Machines; Tablets; Video Game Consoles; PlayStation Consoles","false","true","<A Href="https://www.trade-in.vzw.com/home.aspx">
The Verizon Wireless Trade-In Program</A> allows you to trade in your used handset or tablet in a convenient and responsible way. 
<P>
<P>
Verizon Wireless works every day to protect our environment and give our customers opportunities to do the same. <A Href="http://aboutus.vzw.com/Green_Initiative/overview.html">Click here</A> for more examples of the earth-friendly initiatives and programs Verizon Wireless is proud to offer and support.","","false","false","false","false"
