name,description,address,city,region,province,postal_code,phone,fax,hours,url,latitude,longitude,distance,materials,pickup,dropoff,notes,groups,curbside,municipal,national,event_only
"Salvation Army","Salvation Army","806 Iwilei Rd","Honolulu","Honolulu","HI","96817","8085228460","0","Monday: 9:00 AM - 9:00 PM Tuesday: 9:00 AM - 9:00 PM Wednesday: 9:00 AM - 9:00 PM Thursday: 9:00 AM - 9:00 PM Friday: 9:00 AM - 9:00 PM Saturday: 9:00 AM - 9:00 PM ","http://www.salvationarmy.org","21.31601","-157.86681","3.51786372453304","Bikes; Books (Reuse); Cell Phones; Clothing; CD/DVD/Blu-ray/UHD discs; Computer (Reuse); Electronics; Gift Bags; Eyeglasses; Furniture; Household Goods; Lawn Equipment; Bed Mattresses; Musical Instruments; Ornaments; Reusable Appliance Donation; Sporting Goods; Telephones; Televisions; Miscellaneous Tools; Children's Toys; VHS & Cassette Tapes; Small Appliances; MP3 Players; Computer (Recycling); Computer Monitors; Laptop Computers; Printers/Scanners/Fax Machines; Tablets; Video Game Consoles; PlayStation Consoles","false","true","This site accepts clean, gently used items.  All appliances and electronics must be in working condition.  Please call for more information.","Sony","false","false","false","false"
"Environmental Manufacturing","Environmental Manufacturing","98736 Moanalua Loop ","Aiea","Honolulu County","HI","96701","8084871100","0","Monday: 8:00 AM - 4:00 PM Tuesday: 8:00 AM - 4:00 PM Wednesday: 8:00 AM - 4:00 PM Thursday: 8:00 AM - 4:00 PM Friday: 8:00 AM - 4:00 PM ","","21.3842721","-157.9463895","3.66986637236554","Brown Paper Bags; Cardboard; Drink Boxes; Newspapers; Paperboard; Phone books; Computer (Recycling); Computer Monitors; Electronics; Laptop Computers; Printers/Scanners/Fax Machines; Tablets; Video Game Consoles; PlayStation Consoles","false","true","Facility is behind a security gate. Please call or email for access instructions or biweekly community related recycling drives. All papers collected will be recycled on site. Meaning we process the raw materials and MANUFACTURE products to reduce environmental pollution. None of the materials are shipped abroad. Keep it local.","","false","false","false","false"
"Cartridge World","","99 Moanalua Road","Aiea","","HI","96701","8084888855","0","","","21.3875871","-157.9450879","3.71354272625265","","false","false","","","false","false","false","false"
"Reynolds Recycling - Downtown Honolulu","","254 N Beretania St","Honolulu","","HI","96817","8084872802","0","","http://health.hawaii.gov","21.3153302","-157.8619694","3.73290769900886","","false","false","","","false","false","false","false"
"Yellowbook Recycle - Island Shell, LLC","Yellowbook Recycle - Island Shell, LLC","98-736 Moanalua Loop","Aiea","Honolulu","HI","96701","80092935569","0","","http://recycleyellowbook.com/","21.38668","-157.9473","3.80262745695717","Phone books; Computer (Recycling); Computer Monitors; Electronics; Laptop Computers; Printers/Scanners/Fax Machines; Tablets; Video Game Consoles; PlayStation Consoles","false","true","","","false","false","false","false"
"Best Buy","Best Buy","98-051 Kamehameha Hwy ","Aiea","Honolulu County","HI","96701","8084856940","0","","https://www.bestbuy.com/recycle","21.384606","-157.949839","3.87680032179306","Large Household Appliances; Refrigerators; Televisions; AC Power Plugs; Batteries (Rechargeable); Cables & Connectors; Car Audio/Video Equipment; Cell Phone Batteries; Cell Phones; Computer (Recycling); Hard Drives; Computer Monitors; Cameras; DVD Players/Blu-Ray Players/DVRs; Electronics; E-Readers; GPS Units; Headphones; Inkjet Printer Cartridges; Laptop Computers; Laser Toner Cartridges; Li-Ion Batteries; MP3 Players; Network Equipment; Ni-Cd Batteries; Ni-MH Batteries; Ni-Zn Batteries; Computer Peripherals; Portable Media Players; Printers/Scanners/Fax Machines; Small Electronics; Small Sealed Lead Acid Batteries; Stereo Equipment; Tablets; Telephones; UPS Batteries/Backup Systems; VCRs; Video Game Systems; Blu-Ray Players; Digital Converter Boxes; Small Televisions; Video Game Consoles; PlayStation Consoles","true","true","2 TVs per visit, 3 e-waste items per day; $25 fee for TVs and Monitors; $19.99 pick-up fee with delivery; $99.99 standalone pickup fee; TVs and monitors collected at Best Buy stores are not manufacturer supported in this state, listing provided as an additional option for consumers.","Sony, Vizio, OEM","false","false","false","false"
"Goodwill Industries of Hawaii Inc - Dell Reconnect Donation Site","","98-019 Kamehameha Highway","Aiea","","HI","96701","8084881230","0","","https://www.higoodwill.org/","21.3849374","-157.9505931","3.93041357175545","","false","false","","","false","false","false","false"
"Island Recycling & Redemption Center - Vineyard","","33 S Vineyard Blvd","Honolulu","","HI","96813","8086829200","0","","http://www.islandrecycling.com","21.313577","-157.8575646","4.00133979325455","","false","false","","","false","false","false","false"
"Safeway","","1360 Pali Highway","Honolulu","","HI","96813","8085666811","0","","https://shop.safeway.com/home.html","21.3132888","-157.8578169","4.00688941813476","","false","false","","","false","false","false","false"
"Honolulu County Household Hazardous Waste Collection Program","","","Honolulu","","HI","96801","8087683201","0","","http://www.opala.org/solid_waste/Household_Hazardous_Waste.html","21.31","-157.86","4.10645416813424","","false","false","","","false","false","false","false"
"Safeway","","98 1277 Kaahumanu St","Honolulu","","HI","96814","8084835900","0","","https://shop.safeway.com/home.html","21.3897262","-157.9519446","4.16691113192524","","false","false","","","false","false","false","false"
"Honolulu Document Shredding","Honolulu Document Shredding","999 Bishop St","Honolulu","Honolulu","HI","96813","8084267417","0","Monday: 9:00 AM - 6:00 PM Tuesday: 9:00 AM - 6:00 PM Wednesday: 9:00 AM - 6:00 PM Thursday: 9:00 AM - 6:00 PM Friday: 9:00 AM - 6:00 PM ","http://www.honolulushredding.com/","21.30791","-157.8616","4.17003553037401","Hard Drives; Documents to Shred; Computer (Recycling); Computer Monitors; Electronics; Laptop Computers; Printers/Scanners/Fax Machines; Tablets; Video Game Consoles; PlayStation Consoles","true","true","","","false","false","false","false"
"Safeway","Safeway","98-1277 Kaahumanu St ","Aiea","Honolulu County","HI","96701","8084835900","0","Sunday: 12:00 AM - 11:59 PM Monday: 12:00 AM - 11:59 PM Tuesday: 12:00 AM - 11:59 PM Wednesday: 12:00 AM - 11:59 PM Thursday: 12:00 AM - 11:59 PM Friday: 12:00 AM - 11:59 PM Saturday: 12:00 AM - 11:59 PM ","http://www.safeway.com","21.3902503","-157.951905","4.18335343850189","Plastic Shopping Bags; Food Storage Bags; Computer (Recycling); Computer Monitors; Electronics; Laptop Computers; Printers/Scanners/Fax Machines; Tablets; Video Game Consoles; PlayStation Consoles","false","true","","","false","false","false","false"
"US Post Office","US Post Office","335 Merchant St Fl Ground","Honolulu","Honolulu","HI","96813","0","0","","https://www.usps.com/ship/recycle-through-usps.htm","21.30611","-157.8607","4.30612886921657","Inkjet Printer Cartridges; Computer (Recycling); Computer Monitors; Electronics; Laptop Computers; Printers/Scanners/Fax Machines; Tablets; Video Game Consoles; PlayStation Consoles","false","true","Free, postage-paid Mail Back envelopes can be found on display in the lobby. There is no limit to the number of envelopes customers may take. The contents of the envelope must weigh less than 13 ounces and the envelope must be able to seal completely. For more details visit<a href="http://www.maxback.com/mxb-postoffice-collaboration" target="_blank">MaxBack</a>.","","false","false","false","false"
"One Stop GPS","One Stop GPS","98 Moanalua Rd ","Pearl City","Honolulu County","HI","96782","8084840555","0","Monday: 9:00 AM - 6:00 PM Tuesday: 9:00 AM - 6:00 PM Wednesday: 9:00 AM - 6:00 PM Thursday: 9:00 AM - 6:00 PM Friday: 9:00 AM - 6:00 PM Saturday: 10:00 AM - 4:00 PM ","","21.3910629","-157.9551759","4.39286620025475","Packing Materials; Packing Peanut (Reuse); Computer (Recycling); Computer Monitors; Electronics; Laptop Computers; Printers/Scanners/Fax Machines; Tablets; Video Game Consoles; PlayStation Consoles","false","true","","","false","false","false","false"
"Hawaii Department of Health","","","Honolulu","","HI","96813","8085864226","0","","http://health.hawaii.gov","21.3136151","-157.8480364","4.40748344989987","","false","false","","","false","false","false","false"
"FedEx Office","FedEx Office","590 Queen St","Honolulu","Honolulu","HI","96813","8085287171","0","Monday: 7:00 AM - 11:00 PM Tuesday: 7:00 AM - 11:00 PM Wednesday: 7:00 AM - 11:00 PM Thursday: 7:00 AM - 11:00 PM Friday: 7:00 AM - 11:00 PM Saturday: 8:00 AM - 9:00 PM Sunday: 9:00 AM - 9:00 PM ","http://www.fedex.com/us/office/","21.30273","-157.85822","4.58879867624037","Inkjet Printer Cartridges; Laser Toner Cartridges; Computer (Recycling); Computer Monitors; Electronics; Laptop Computers; Printers/Scanners/Fax Machines; Tablets; Video Game Consoles; PlayStation Consoles","false","true","","","false","false","false","false"
"Reynolds Recycling Certified Redemption Center - Kakaako","","555 South St","Honolulu","","HI","96813","8084872802","0","","http://www.reynoldsrecycling.com/","21.3010089","-157.8601455","4.62626807207957","","false","false","","","false","false","false","false"
"Reynolds Recycling Certified Redemption Center - Honolulu Municipal Building","","650 S King St","Honolulu","","HI","96813","8084872802","0","","http://www.reynoldsrecycling.com/","21.3041923","-157.8547896","4.62746932087125","","false","false","","","false","false","false","false"
"Reuse Hawaii","Reuse Hawaii","30 Forrest Ave ","Honolulu","Honolulu County","HI","96813","8089535538","0","Monday: 8:00 AM - 6:00 PM Tuesday: 8:00 AM - 6:00 PM Wednesday: 8:00 AM - 6:00 PM Thursday: 8:00 AM - 6:00 PM Friday: 8:00 AM - 6:00 PM Saturday: 9:00 AM - 4:00 PM ","","21.2983182","-157.8645646","4.65638783043863","Construction Materials; Computer (Recycling); Computer Monitors; Electronics; Laptop Computers; Printers/Scanners/Fax Machines; Tablets; Video Game Consoles; PlayStation Consoles","true","true","Please call for pick-up details.","","false","false","false","false"
"Sprint Store","null","660 Ala Moana Blvd #100,","Honolulu","","HI","96813","8085244545","0","","https://newsroom.sprint.com/csr/device-donations/","21.298251","-157.861893","4.73839031666919","","false","false","","","false","false","false","false"
"Sprint","Sprint","660 Ala Moana Blvd","Honolulu","Honolulu","HI","96813","8085244545","0","Monday: 9:00 AM - 7:00 PM Tuesday: 9:00 AM - 7:00 PM Wednesday: 9:00 AM - 7:00 PM Thursday: 9:00 AM - 7:00 PM Friday: 9:00 AM - 7:00 PM Saturday: 9:00 AM - 6:00 PM Sunday: 11:00 AM - 6:00 PM ","http://green.sprint.com/","21.29799","-157.86206","4.74934957401145","Cell Phones; Computer (Recycling); Computer Monitors; Electronics; Laptop Computers; Printers/Scanners/Fax Machines; Tablets; Video Game Consoles; PlayStation Consoles","false","true","","","false","false","false","false"
"Re-Use Hawaii","","200 Keawe Street","Honolulu","","HI","96813","8085372228","0","","http://www.reusehawaii.org/home.php","21.2957118","-157.8661535","4.77647390811629","","false","false","","","false","false","false","false"
"Hawaii Mail Box Services","Hawaii Mail Box Services","575 Cooke St Ste A","Honolulu","Honolulu","HI","96813","8085960655","0","Monday: 9:00 AM - 6:00 PM Tuesday: 9:00 AM - 6:00 PM Wednesday: 9:00 AM - 6:00 PM Thursday: 9:00 AM - 6:00 PM Friday: 9:00 AM - 6:00 PM Saturday: 9:00 AM - 2:00 PM ","","21.29949","-157.85725","4.81188906314756","Packing Materials; Packing Peanut (Reuse); Computer (Recycling); Computer Monitors; Electronics; Laptop Computers; Printers/Scanners/Fax Machines; Tablets; Video Game Consoles; PlayStation Consoles","false","true","","","false","false","false","false"
"OfficeMax","","770 Ala Moana Blvd","Honolulu","","HI","96813","8085455177","0","","","21.2966022","-157.8598195","4.90188080077398","","false","false","","","false","false","false","false"
"OfficeMax","OfficeMax","770 Ala Moana Blvd","Honolulu","Honolulu","HI","96813","8085455177","0","Monday: 7:00 AM - 9:00 PM Tuesday: 7:00 AM - 9:00 PM Wednesday: 7:00 AM - 9:00 PM Thursday: 7:00 AM - 9:00 PM Friday: 7:00 AM - 9:00 PM Saturday: 9:00 AM - 7:00 PM Sunday: 10:00 AM - 6:00 PM ","http://www.officemax.com","21.29653","-157.85992","4.90317083283601","Inkjet Cartridge Refilling; Inkjet Printer Cartridges; Laser Toner Cartridges; Computer (Recycling); Computer Monitors; Electronics; Laptop Computers; Printers/Scanners/Fax Machines; Tablets; Video Game Consoles; PlayStation Consoles","false","true","This site can accept H.P., Lexmark, and Brother catridges only.

This location features Phoenix Ink refill kiosks.","","false","false","false","false"
"Goodwill Industries of Hawaii Inc - Dell Reconnect Donation Site","","1075 South Beretania Street","Honolulu","","HI","96814","8085211798","0","","https://www.higoodwill.org/","21.3023563","-157.8459406","5.07486554372112","","false","false","","","false","false","false","false"
"Goodwill Industries of Hawaii - Beretania","","1075 South Beretania Street","Honolulu","","HI","96814","8085211798","0","","https://www.higoodwill.org/","21.3023563","-157.8459406","5.07486554372112","","false","false","","","false","false","false","false"
"USPS Post Office Box Lobby Recycling Program","US Post Office","1111 Lunalilo St","Honolulu","Honolulu","HI","96822","8002758777","0","","https://www.usps.com/","21.30393","-157.8431","5.11219520713639","Catalogs; Greeting Cards; Magazines; Paper (Mixed)","false","true","","","false","false","false","false"
"US Post Office","USPS Discarded Lobby Mail Recycling Program","1111 Lunalilo St","Honolulu","Honolulu","HI","96822","0","0","","","21.30393","-157.8431","5.11219520713639","Computer (Recycling); Computer Monitors; Electronics; Laptop Computers; Printers/Scanners/Fax Machines; Tablets; Video Game Consoles; PlayStation Consoles","false","true","","","false","false","false","false"
"Safeway","Safeway","1234 S Beretania St","Honolulu","Honolulu","HI","96814","8085351780","0","Sunday: 12:00 AM - 11:59 PM Monday: 12:00 AM - 11:59 PM Tuesday: 12:00 AM - 11:59 PM Wednesday: 12:00 AM - 11:59 PM Thursday: 12:00 AM - 11:59 PM Friday: 12:00 AM - 11:59 PM Saturday: 12:00 AM - 11:59 PM ","http://www.safeway.com","21.30144","-157.8445","5.18288059975024","Plastic Shopping Bags; Food Storage Bags; Computer (Recycling); Computer Monitors; Electronics; Laptop Computers; Printers/Scanners/Fax Machines; Tablets; Video Game Consoles; PlayStation Consoles","false","true","","","false","false","false","false"
"AT&T Wireless","AT&T Wireless","1067 Kapiolani Blvd","Honolulu","Honolulu","HI","96814","8085919642","0","Monday: 9:00 AM - 9:00 PM Tuesday: 9:00 AM - 9:00 PM Wednesday: 9:00 AM - 9:00 PM Thursday: 9:00 AM - 9:00 PM Friday: 9:00 AM - 9:00 PM Saturday: 9:00 AM - 7:00 PM Sunday: 10:00 AM - 5:00 PM ","http://www.att.com/","21.29667","-157.85094","5.19584578554692","Cell Phones; Ni-Cd Batteries; Batteries (Rechargeable); Cell Phone Batteries; Tablets; Li-Ion Batteries; Computer (Recycling); Computer Monitors; Electronics; Laptop Computers; Printers/Scanners/Fax Machines; Video Game Consoles; PlayStation Consoles","false","true","Receive an AT&T Promotion Card worth the trade-in value of your smartphone, tablet, or netbook. You can also donate the trade-in value to Cell Phones for Soldiers.","","false","false","false","false"
"Goodwill Industries of Hawaii","Goodwill Industries of Hawaii","890 Kamehameha Hwy","Pearl City","Honolulu","HI","96782","8084881230","0","Sunday: 9:00 AM - 5:00 PM Monday: 9:00 AM - 5:00 PM Wednesday: 9:00 AM - 5:00 PM Thursday: 9:00 AM - 5:00 PM Saturday: 9:00 AM - 5:00 PM ","http://www.higoodwill.org","21.39383","-157.96907","5.26845075518764","Bikes; Books (Reuse); Clothing; CD/DVD/Blu-ray/UHD discs; Gift Bags; Eyeglasses; Furniture; Household Goods; Lawn Equipment; Office Equipment; Ornaments; Reusable Appliance Donation; Sporting Goods; Telephones; Children's Toys; Computer (Recycling); Computer Monitors; Electronics; Laptop Computers; Printers/Scanners/Fax Machines; Tablets; Video Game Consoles; PlayStation Consoles","false","true","","","false","false","false","false"
"Safeway","","1234 South Beretania Street","Honolulu","","HI","96814","8085351780","0","","https://shop.safeway.com/home.html","21.3016161","-157.8421682","5.27148331597396","","false","false","","","false","false","false","false"
"Reynolds Recycling Certified Redemption Center - Pearl City Shopping Center","","850 Kamehameha Highway","Pearl City","","HI","96782","8084872802","0","","http://www.reynoldsrecycling.com/","21.3943355","-157.968869","5.2730798327015","","false","false","","","false","false","false","false"
"Cartridge World","","1253 South Beretania Street","Honolulu","","HI","96814","8085386637","0","","","21.3010627","-157.8423079","5.29434690692985","","false","false","","","false","false","false","false"
"Goodwill Industries of Hawaii Inc - Dell Reconnect Donation Site","","890 Kamehameha Highway","Pearl City","","HI","96782","8088360313","0","","https://www.higoodwill.org/","21.394138","-157.9698987","5.32558975790829","","false","false","","","false","false","false","false"
"T & N Computer Recycling Services LLC- BERETANIA","null","1436 S Beretania St ","Honolulu","Honolulu County","HI","96814","8082806460","0","Monday: 9:15 AM - 4:45 PM Tuesday: 9:15 AM - 4:45 PM Wednesday:  -  Thursday: 9:15 AM - 4:45 PM Friday: 9:15 AM - 4:45 PM Saturday: 9:15 AM - 4:45 PM Sunday:  -  ","http://tncomputerrecycling.com/","21.300083","-157.838371","5.51362752612284","Computer (Recycling); Computer Monitors; Electronics; Laptop Computers; Printers/Scanners/Fax Machines; Tablets; Video Game Consoles; PlayStation Consoles","false","true","","Sony, Vizio, OEM, OEM Indiv, OEM Private Sites","false","false","false","false"
"US Post Office","US Post Office","950 Kamehameha Hwy","Pearl City","Honolulu","HI","96782","0","0","","https://www.usps.com/ship/recycle-through-usps.htm","21.39568","-157.9737","5.5918067944608","Inkjet Printer Cartridges; Computer (Recycling); Computer Monitors; Electronics; Laptop Computers; Printers/Scanners/Fax Machines; Tablets; Video Game Consoles; PlayStation Consoles","false","true","Free, postage-paid Mail Back envelopes can be found on display in the lobby. There is no limit to the number of envelopes customers may take. The contents of the envelope must weigh less than 13 ounces and the envelope must be able to seal completely. For more details visit<a href="http://www.maxback.com/mxb-postoffice-collaboration" target="_blank">MaxBack</a>.","","false","false","false","false"
"Sams Club","","750 Keeaumoku St","Honolulu","","HI","96814","8089459841","0","","https://www.samsclub.com/","21.294915","-157.8429453","5.59659152998195","","false","false","","","false","false","false","false"
"Walmart","","700 Keeaumoku St","Honolulu","","HI","96814","8089558441","0","","https://www.walmart.com/","21.2946946","-157.8429982","5.60654457160769","","false","false","","","false","false","false","false"
"Reynolds Recycling Certified Redemption Center - Ala Moana","","1391 Kapiolani Blvd","Honolulu","","HI","96814","8084872802","0","","http://health.hawaii.gov","21.2930371","-157.8441709","5.65247814056478","","false","false","","","false","false","false","false"
"Sams Club","","1000 Kamehameha Hwy","Pearl City","","HI","96782","8084567788","0","","https://www.samsclub.com/","21.3988692","-157.9733685","5.67665065066721","","false","false","","","false","false","false","false"
"Verizon Wireless","Verizon Wireless","1440 Kapiolani Blvd Ste 100","Honolulu","Honolulu","HI","96814","8666444532","0","","http://www.verizonwireless.com/","21.29359","-157.84263","5.68149150688809","Cell Phones; Cell Phone Batteries; Computer (Recycling); Computer Monitors; Electronics; Laptop Computers; Printers/Scanners/Fax Machines; Tablets; Video Game Consoles; PlayStation Consoles","false","true","<A Href="https://www.trade-in.vzw.com/home.aspx">
The Verizon Wireless Trade-In Program</A> allows you to trade in your used handset or tablet in a convenient and responsible way. 
<P>
<P>
Verizon Wireless works every day to protect our environment and give our customers opportunities to do the same. <A Href="http://aboutus.vzw.com/Green_Initiative/overview.html">Click here</A> for more examples of the earth-friendly initiatives and programs Verizon Wireless is proud to offer and support.","","false","false","false","false"
"Walmart","Walmart","1131 Kuala St","Pearl City","Honolulu","HI","96782","8084548785","0","","http://www.walmart.com","21.39766","-157.97423","5.685322454239","Lead Acid (Pb) Batteries; Plastic Shopping Bags; Food Storage Bags; Computer (Recycling); Computer Monitors; Electronics; Laptop Computers; Printers/Scanners/Fax Machines; Tablets; Video Game Consoles; PlayStation Consoles","false","true","","","false","false","false","false"
"Walmart","","1131 Kuala St","Pearl City","","HI","96782","8084548785","0","","https://www.walmart.com/","21.3971335","-157.9745329","5.68553256679318","","false","false","","","false","false","false","false"
"Home Depot","Home Depot","1021 Kamehameha Hwy","Pearl City","Honolulu","HI","96782","8084551200","0","","http://www.homedepot.com","21.39794","-157.97422","5.6938909377649","Compact Fluorescent Lights; Batteries (Rechargeable); Computer (Recycling); Computer Monitors; Electronics; Laptop Computers; Printers/Scanners/Fax Machines; Tablets; Video Game Consoles; PlayStation Consoles","false","true","Home Depot accepts compact fluorescent bulbs and used power tool rechargeable batteries. Look for the orange drop boxes, usually located near the front entrance near the customer service desk.","","false","false","false","false"
