name,description,address,city,region,province,postal_code,phone,fax,hours,url,latitude,longitude,distance,materials,pickup,dropoff,notes,groups,curbside,municipal,national,event_only
"US Post Office","US Post Office","3600 Aolele St Rm 209","Honolulu","Honolulu","HI","96820","0","0","","https://www.usps.com/ship/recycle-through-usps.htm","21.3519","-157.87805","1.26875404181401","Inkjet Printer Cartridges; Computer (Recycling); Computer Monitors; Electronics; Laptop Computers; Printers/Scanners/Fax Machines; Tablets; Video Game Consoles; PlayStation Consoles","false","true","Free, postage-paid Mail Back envelopes can be found on display in the lobby. There is no limit to the number of envelopes customers may take. The contents of the envelope must weigh less than 13 ounces and the envelope must be able to seal completely. For more details visit<a href="http://www.maxback.com/mxb-postoffice-collaboration" target="_blank">MaxBack</a>.","","false","false","false","false"
"Safeway","Safeway","848 Ala Lilikoi St","Honolulu","Honolulu","HI","96818","8088316100","0","Sunday: 12:00 AM - 11:59 PM Monday: 12:00 AM - 11:59 PM Tuesday: 12:00 AM - 11:59 PM Wednesday: 12:00 AM - 11:59 PM Thursday: 12:00 AM - 11:59 PM Friday: 12:00 AM - 11:59 PM Saturday: 12:00 AM - 11:59 PM ","http://www.safeway.com","21.34492","-157.91309","1.44974253210815","Plastic Shopping Bags; Food Storage Bags; Computer (Recycling); Computer Monitors; Electronics; Laptop Computers; Printers/Scanners/Fax Machines; Tablets; Video Game Consoles; PlayStation Consoles","false","true","","","false","false","false","false"
"Safeway","","848 Ala Lilikoi St","Honolulu","","HI","96818","8088316100","0","","https://shop.safeway.com/home.html","21.3450046","-157.9134263","1.46211485066828","","false","false","","","false","false","false","false"
"Yellowbook/Paradise Pages","Yellowbook/Paradise Pages","99-807 Iwaena St","Aiea","Honolulu","HI","96701","80092935569","0","","http://recycleyellowbook.com/","21.3733","-157.914","1.51340306939023","Phone books; Computer (Recycling); Computer Monitors; Electronics; Laptop Computers; Printers/Scanners/Fax Machines; Tablets; Video Game Consoles; PlayStation Consoles","false","true","","","false","false","false","false"
"Goodwill Industries of Hawaii Inc - Dell Reconnect Donation Site","","2610 Kilihau Street","Honolulu","","HI","96819","0","0","","https://www.higoodwill.org/","21.3362215","-157.895076","1.56829523874423","","false","false","","","false","false","false","false"
"Reynolds Recycling Plant - Hlawa Industrial Area","","99-1160 Iwaena St","Halawa","","HI","96701","8084872802","0","","http://www.reynoldsrecycling.com/","21.379936","-157.9088154","1.66252597000847","","false","false","","","false","false","false","false"
"Tomra Recycling Drop-Off Site - Kalihi Shopping Center","Tomra Recycling Drop-Off Site - Kalihi Shopping Center","2295 N King St ","Honolulu","Honolulu County","HI","96819","8084872802","0","Tuesday: 9:00 AM - 5:00 PM Wednesday: 9:00 AM - 5:00 PM Thursday: 9:00 AM - 5:00 PM Friday: 9:00 AM - 5:00 PM Saturday: 9:00 AM - 5:00 PM ","http://www.reynoldsrecycling.com","21.3353021","-157.8822042","1.86473118552063","Plastic #1 (PETE); Plastic #2 (HDPE); Plastic #2 (Color HDPE); Aluminum Cans; Glass (Brown); Glass (Clear); Glass (Green); Tin or Steel Cans; Computer (Recycling); Computer Monitors; Electronics; Laptop Computers; Printers/Scanners/Fax Machines; Tablets; Video Game Consoles; PlayStation Consoles","false","true","","","false","false","false","false"
"Reynolds Recycling Certified Redemption Center - Stadium Mall","","4510 Salt Lake Blvd","Honolulu","","HI","96818","8084872802","0","","http://www.reynoldsrecycling.com/","21.3657905","-157.9273987","2.05808047621482","","false","false","","","false","false","false","false"
"Target","Target","4380 Lawehana St","Honolulu","Honolulu","HI","96818","8084413118","0","","http://www.target.com/","21.35549","-157.92837","2.07806051034789","Aluminum Cans; Cell Phones; Inkjet Printer Cartridges; MP3 Players; Plastic #1 (PETE); Plastic #2 (HDPE); Plastic Shopping Bags; Computer (Recycling); Computer Monitors; Electronics; Laptop Computers; Printers/Scanners/Fax Machines; Tablets; Video Game Consoles; PlayStation Consoles","false","true","","","false","false","false","false"
"Handle With Care Packaging Store","","2282 Hoonee Pl #24","Honolulu","","HI","96819","8088438098","0","","https://www.gopackagingstore.com/","21.3284288","-157.8903254","2.13939108608719","","false","false","","","false","false","false","false"
"Target Store","","4380 Lawehana St","Honolulu","","HI","96818","8084413118","0","","https://corporate.target.com/corporate-responsibility/planet","21.3553179","-157.929448","2.14832972220283","","false","false","","","false","false","false","false"
"The Packaging Store","The Packaging Store","2282 Hoonee Pl","Honolulu","Honolulu","HI","96819","8088438098","0","Monday: 8:30 AM - 5:00 PM Tuesday: 8:30 AM - 5:00 PM Wednesday: 8:30 AM - 5:00 PM Thursday: 8:30 AM - 5:00 PM Friday: 8:30 AM - 5:00 PM ","","21.32826","-157.89042","2.14978924954289","Packing Materials; Packing Peanut (Reuse); Computer (Recycling); Computer Monitors; Electronics; Laptop Computers; Printers/Scanners/Fax Machines; Tablets; Video Game Consoles; PlayStation Consoles","false","true","","","false","false","false","false"
"Aiea Recycling","Aiea Recycling","833 Puuhale Rd ","Honolulu","Honolulu County","HI","96819","8088343568","0","Monday: 7:00 AM - 4:00 PM Tuesday: 7:00 AM - 4:00 PM Wednesday: 7:00 AM - 4:00 PM Thursday: 7:00 AM - 4:00 PM Friday: 7:00 AM - 4:00 PM ","null","21.3316513","-157.8782586","2.21078907215072","Aluminum Cans; Non-ferrous (Copper/Brass/Tin); Computer (Recycling); Computer Monitors; Electronics; Laptop Computers; Printers/Scanners/Fax Machines; Tablets; Video Game Consoles; PlayStation Consoles","false","true","","","false","false","false","false"
"OfficeMax","","4561 Salt Lake Blvd","Honolulu","","HI","96818","8084851083","0","","","21.3661618","-157.9302282","2.24119502876079","","false","false","","","false","false","false","false"
"O'Reilly Auto Parts","null","4561 Salt Lake Blvd Ste A ","Honolulu","","HI","96818","8084850414","0","","http://oreillyauto.custhelp.com/app/error/error_id/6","21.3661618","-157.9302282","2.24119502876079","","false","false","","","false","false","false","false"
"O'Reilly Auto Parts","","4561 Salt Lake Blvd","Honolulu","","HI","96818","8084850414","0","","http://oreillyauto.custhelp.com/app/error/error_id/6","21.3661618","-157.9302282","2.24119502876079","","false","false","","","false","false","false","false"
"O'Reilly Auto Parts","O'Reilly Auto Parts","4561 Salt Lake Blvd ","Honolulu","Honolulu County","HI","96818","8084850414","0","","http://www.oreillyauto.com/","21.3652172","-157.9305013","2.24471975331744","Lead Acid (Pb) Batteries; Computer (Recycling); Computer Monitors; Electronics; Laptop Computers; Printers/Scanners/Fax Machines; Tablets; Video Game Consoles; PlayStation Consoles","false","true","Most stores offer Used Oil & Battery Recycling, Battery Testing, 
Electrical & Module Testing, Loaner Tool Program, Drum / Rotor Resurfacing. Call your location for more details.","","false","false","false","false"
"CM Recycling LLC","CM Recycling LLC","204 Sand Island Access Rd ","Honolulu","Honolulu County","HI","96819","8088426640","0","Monday: 8:00 AM - 4:30 PM Tuesday: 8:00 AM - 4:30 PM Wednesday: 8:00 AM - 4:30 PM Thursday: 8:00 AM - 4:30 PM Friday: 8:00 AM - 4:30 PM Saturday: 8:00 AM - 4:30 PM ","","21.3259656","-157.8896672","2.3144363037923","Plastic #1 (PETE); Plastic #2 (HDPE); Plastic #2 (Color HDPE); Plastic #3 (PVC); Plastic #4 (LDPE); Plastic #5 (Polypropylene); Plastic #6 (Polystyrene); Plastic #7; Aluminum Cans; Glass (Clear); Ferrous Metals (Steel or Iron); Non-ferrous (Copper/Brass/Tin); Windows; Computer (Recycling); Computer Monitors; Electronics; Laptop Computers; Printers/Scanners/Fax Machines; Tablets; Video Game Consoles; PlayStation Consoles","false","true","We accept copper, aluminum/can/scrap/wheels, yellow/red brass, radiators, electric motors. Call for a compelete list.","","false","false","false","false"
"C M Recycling Company","","204 Sand Island Access Rd","Honolulu","","HI","96819","8088426640","0","","","21.325909","-157.8896268","2.31875899479822","","false","false","","","false","false","false","false"
"Hagadone Printing Company","Hagadone Printing Company","274 Puuhale Rd","Honolulu","Honolulu","HI","96819","8088526348","0","Monday: 8:00 AM - 5:00 PM Tuesday: 8:00 AM - 5:00 PM Wednesday: 8:00 AM - 5:00 PM Thursday: 8:00 AM - 5:00 PM Friday: 8:00 AM - 5:00 PM ","http://www.hagadoneprinting.com","21.32627","-157.88676","2.335731633655","Catalogs; Computer Paper; Magazines; Phone books; Office Paper; Computer (Recycling); Computer Monitors; Electronics; Laptop Computers; Printers/Scanners/Fax Machines; Tablets; Video Game Consoles; PlayStation Consoles","false","true","","","false","false","false","false"
"Hagadone Printing Company","","274 Pu'uhale Road","Honolulu","","HI","96819","8088526348","0","","http://www.hagadoneprinting.com","21.3262543","-157.8866926","2.33791947388562","","false","false","","","false","false","false","false"
"Honolulu Recovery Systems","Honolulu Recovery Systems","50 Sand Island Access Rd Ste D","Honolulu","Honolulu","HI","96819","8088413179","0","Monday: 7:00 AM - 2:00 PM Tuesday: 7:00 AM - 2:00 PM Wednesday: 7:00 AM - 2:00 PM Thursday: 7:00 AM - 2:00 PM Friday: 7:00 AM - 2:00 PM Saturday: 7:00 AM - 11:00 AM ","","21.32512","-157.89374","2.3391035995175","Aluminum Cans; Glass (Brown); Cardboard; Glass (Clear); Computer Paper; Glass (Green); Newspapers; Office Paper; Computer (Recycling); Computer Monitors; Electronics; Laptop Computers; Printers/Scanners/Fax Machines; Tablets; Video Game Consoles; PlayStation Consoles","false","true","","","false","false","false","false"
"Island Recycling & Redemption Center - Dillingham","","1803 Dillingham Blvd","Honolulu","","HI","96819","8086829200","0","","","21.3274791","-157.8806263","2.39281669428126","","false","false","","","false","false","false","false"
"Honolulu Recovery Systems - HI-5 Redemption Center","","207 Puuhale Rd","Honolulu","","HI","96819","8088423181","0","","http://honoluludisposal.com/recycling/","21.3244428","-157.8872981","2.44937167190321","","false","false","","","false","false","false","false"
"Firestone Complete Auto Care Store","Firestone Complete Auto Care Store","1414 Dillingham Blvd","Honolulu","Honolulu County","HI","96817","8084265797","0","","http://www.firestonecompleteautocare.com/","21.3319801","-157.8709972","2.47079833721988","Lead Acid (Pb) Batteries; Used Motor Oil; Computer (Recycling); Computer Monitors; Electronics; Laptop Computers; Printers/Scanners/Fax Machines; Tablets; Video Game Consoles; PlayStation Consoles","false","true","","","false","false","false","false"
"Honolulu Recovery","Honolulu Recovery","207 Puuhale Rd","Honolulu","Honolulu","HI","96819","8088423181","0","Monday: 7:00 AM - 3:30 PM Tuesday: 7:00 AM - 3:30 PM Wednesday: 7:00 AM - 3:30 PM Thursday: 7:00 AM - 3:30 PM Friday: 7:00 AM - 3:30 PM Saturday: 7:00 AM - 3:30 PM ","","21.32409","-157.88736","2.47213658187173","Plastic #1 (PETE); Plastic #2 (HDPE); Plastic #2 (Color HDPE); Plastic #3 (PVC); Plastic #4 (LDPE); Plastic #5 (Polypropylene); Plastic #6 (Polystyrene); Plastic #7; Aluminum Cans; Aluminum; Books (Reuse); Book Recycling; Glass (Brown); Brown Paper Bags; Cardboard; Glass (Clear); Computer Paper; Glass (Green); Greeting Cards; Magazines; Paper (Mixed); Newspapers; Phone books; Office Paper; Windows; Unused Paper; Computer (Recycling); Computer Monitors; Electronics; Laptop Computers; Printers/Scanners/Fax Machines; Tablets; Video Game Consoles; PlayStation Consoles","false","true","","","false","false","false","false"
"Verizon Wireless","Verizon Wireless","930 Valkenburgh St","Honolulu","Honolulu","HI","96818","8666444532","0","","http://www.verizonwireless.com/","21.34106","-157.92965","2.47556658344573","Cell Phones; Cell Phone Batteries; Computer (Recycling); Computer Monitors; Electronics; Laptop Computers; Printers/Scanners/Fax Machines; Tablets; Video Game Consoles; PlayStation Consoles","false","true","<A Href="https://www.trade-in.vzw.com/home.aspx">
The Verizon Wireless Trade-In Program</A> allows you to trade in your used handset or tablet in a convenient and responsible way. 
<P>
<P>
Verizon Wireless works every day to protect our environment and give our customers opportunities to do the same. <A Href="http://aboutus.vzw.com/Green_Initiative/overview.html">Click here</A> for more examples of the earth-friendly initiatives and programs Verizon Wireless is proud to offer and support.","","false","false","false","false"
"Okuda Metal","Okuda Metal","1804 Kahai St","Honolulu","Honolulu","HI","96819","8088456856","0","Monday: 7:30 AM - 5:00 PM Tuesday: 7:30 AM - 5:00 PM Wednesday: 7:30 AM - 5:00 PM Thursday: 7:30 AM - 5:00 PM Friday: 7:30 AM - 5:00 PM Saturday: 7:30 AM - 4:30 PM ","","21.32362","-157.88492","2.54433464668591","Aluminum Cans; Ferrous Metals (Steel or Iron); Non-ferrous (Copper/Brass/Tin); Tin or Steel Cans; Computer (Recycling); Computer Monitors; Electronics; Laptop Computers; Printers/Scanners/Fax Machines; Tablets; Video Game Consoles; PlayStation Consoles","false","true","","","false","false","false","false"
"O'Reilly Auto Parts","null","1555 Dillingham Road","Honolulu","","HI","96817","8088481034","0","","http://oreillyauto.custhelp.com/app/error/error_id/6","21.3257434","-157.8788216","2.5510789448521","","false","false","","","false","false","false","false"
"Okuda Metal","","1804 Kahai St","Honolulu","","HI","96819","8088456856","0","","","21.3232527","-157.884655","2.57355782000085","","false","false","","","false","false","false","false"
"E-opala Computer Recycling","null","1708 Mary St ","Honolulu","Honolulu County","HI","96819","8082322000","0","","null","21.3217007","-157.8857844","2.65693343412235","Computer (Recycling); Computer Monitors; Electronics; Laptop Computers; Printers/Scanners/Fax Machines; Tablets; Video Game Consoles; PlayStation Consoles","false","true","","OEM, Sony, Vizio","false","false","false","false"
"Savers","","1505 Dillingham Blvd","Honolulu","","HI","96817","8088420061","0","","https://www.savers.com/donate/what-we-take","21.3238406","-157.878123","2.68896632760148","","false","false","","","false","false","false","false"
"Firestone Complete Auto Care","","1414 Dillingham Blvd","Honolulu","","HI","96817","8088474251","0","","https://www.firestonecompleteautocare.com/","21.3246656","-157.8757943","2.70747070019299","","false","false","","","false","false","false","false"
"USPS Post Office Box Lobby Recycling Program","US Post Office","99-040 Kauhale St","Aiea","Honolulu","HI","96701","8002758777","0","","https://www.usps.com/","21.37849","-157.93304","2.72516812934338","Catalogs; Greeting Cards; Magazines; Paper (Mixed)","false","true","","","false","false","false","false"
"US Post Office","US Post Office","99-040 Kauhale St","Aiea","Honolulu","HI","96701","0","0","","https://www.usps.com/ship/recycle-through-usps.htm","21.37849","-157.93304","2.72516812934338","Inkjet Printer Cartridges; Computer (Recycling); Computer Monitors; Electronics; Laptop Computers; Printers/Scanners/Fax Machines; Tablets; Video Game Consoles; PlayStation Consoles","false","true","Free, postage-paid Mail Back envelopes can be found on display in the lobby. There is no limit to the number of envelopes customers may take. The contents of the envelope must weigh less than 13 ounces and the envelope must be able to seal completely. For more details visit<a href="http://www.maxback.com/mxb-postoffice-collaboration" target="_blank">MaxBack</a>.","","false","false","false","false"
"US Post Office","US Post Office","1271 N King St","Honolulu","Honolulu","HI","96817","0","0","","https://www.usps.com/ship/recycle-through-usps.htm","21.32694","-157.87073","2.75271057604663","Inkjet Printer Cartridges; Computer (Recycling); Computer Monitors; Electronics; Laptop Computers; Printers/Scanners/Fax Machines; Tablets; Video Game Consoles; PlayStation Consoles","false","true","Free, postage-paid Mail Back envelopes can be found on display in the lobby. There is no limit to the number of envelopes customers may take. The contents of the envelope must weigh less than 13 ounces and the envelope must be able to seal completely. For more details visit<a href="http://www.maxback.com/mxb-postoffice-collaboration" target="_blank">MaxBack</a>.","","false","false","false","false"
"Goodwill Industries of Hawaii Inc - Dell Reconnect Donation Site","","1297 Kaumualii Street","Honolulu","","HI","96817","8088457071","0","","https://www.higoodwill.org/","21.3238306","-157.8742108","2.80814345652709","","false","false","","","false","false","false","false"
"Goodwill Industries of Hawaii Inc - Dell Reconnect Donation Site","","1297 Kaumualii St","Honolulu","","HI","96817","8088457071","0","","https://www.dellreconnect.com/","21.3238306","-157.8742108","2.80814345652709","","false","false","","","false","false","false","false"
"Goodwill Industries of Hawaii Inc - Dell Reconnect Donation Site","","1297 Kaumualii St","Honolulu","","HI","96817","8088457071","0","","https://www.dellreconnect.com/","21.3238306","-157.8742108","2.80814345652709","","false","false","","","false","false","false","false"
"Best Buy","Best Buy","478 Alakawa St ","Honolulu","Honolulu County","HI","96817","8085257182","0","","https://www.bestbuy.com/recycle","21.318153","-157.8744411","3.14614581725429","Large Household Appliances; Refrigerators; Televisions; AC Power Plugs; Batteries (Rechargeable); Cables & Connectors; Car Audio/Video Equipment; Cell Phone Batteries; Cell Phones; Computer (Recycling); Hard Drives; Computer Monitors; Cameras; DVD Players/Blu-Ray Players/DVRs; Electronics; E-Readers; GPS Units; Headphones; Inkjet Printer Cartridges; Laptop Computers; Laser Toner Cartridges; Li-Ion Batteries; MP3 Players; Network Equipment; Ni-Cd Batteries; Ni-MH Batteries; Ni-Zn Batteries; Computer Peripherals; Portable Media Players; Printers/Scanners/Fax Machines; Small Electronics; Small Sealed Lead Acid Batteries; Stereo Equipment; Tablets; Telephones; UPS Batteries/Backup Systems; VCRs; Video Game Systems; Blu-Ray Players; Digital Converter Boxes; Small Televisions; Video Game Consoles; PlayStation Consoles","true","true","2 TVs per visit, 3 e-waste items per day; $25 fee for TVs and Monitors; $19.99 pick-up fee with delivery; $99.99 standalone pickup fee; TVs and monitors collected at Best Buy stores are not manufacturer supported in this state, listing provided as an additional option for consumers.","Sony, Vizio, OEM","false","false","false","false"
"Best Buy","","478 Alakawa St","Honolulu","","HI","96817","8085257182","0","","https://www.bestbuy.com/site/services/recycling/pcmcat149900050025.c?id=pcmcat149900050025","21.318153","-157.8744411","3.14614581725429","","false","false","","","false","false","false","false"
"Call2Recycle at the Home Depot","Call2Recycle at the Home Depot","421 Alakawa St","Honolulu","Honolulu","HI","96817","8085217355","0","","http://www.homedepot.com/","21.3174","-157.87301","3.23437712262133","Cell Phones; Compact Fluorescent Lights; Ni-Cd Batteries; Li-Ion Batteries; Ni-MH Batteries; Ni-Zn Batteries; Small Sealed Lead Acid Batteries; Computer (Recycling); Computer Monitors; Electronics; Laptop Computers; Printers/Scanners/Fax Machines; Tablets; Video Game Consoles; PlayStation Consoles","false","true","The Home Depot accepts used rechargeable batteries and compact fluorescent bulbs. Look for the orange drop boxes, usually located near the front entrance near the customer service desk, or ask a store associate for more details.","","false","false","false","false"
"Home Depot","","421 Alakawa St","Honolulu","","HI","96817","8085217355","0","","https://ecooptions.homedepot.com/","21.3172564","-157.8731862","3.23795375553076","","false","false","","","false","false","false","false"
"Napa Auto Parts","Napa Auto Parts","640 N King St","Honolulu","Honolulu","HI","96817","8088326272","0","Monday: 8:00 AM - 5:00 PM Tuesday: 8:00 AM - 5:00 PM Wednesday: 8:00 AM - 5:00 PM Thursday: 8:00 AM - 5:00 PM Friday: 8:00 AM - 5:00 PM Saturday: 8:00 AM - 4:30 PM ","http://www.napaonline.com","21.32033","-157.86599","3.30131736488826","Lead Acid (Pb) Batteries; Computer (Recycling); Computer Monitors; Electronics; Laptop Computers; Printers/Scanners/Fax Machines; Tablets; Video Game Consoles; PlayStation Consoles","false","true","","","false","false","false","false"
"T & N Computer Recycling Services LLC- KING STREET","null","693 N King St ","Honolulu","Honolulu County","HI","96817","8086825600","0","Sunday:  -  Monday: 9:15 AM - 4:45 PM Tuesday: 9:15 AM - 4:45 PM Wednesday: 9:15 AM - 4:45 PM Thursday: 9:15 AM - 4:45 PM Friday: 9:15 AM - 4:45 PM Saturday: 8:00 AM - 3:30 PM ","http://tncomputerrecycling.com/","21.3199799","-157.8663282","3.30814167332727","Computer (Recycling); Computer Monitors; Electronics; Laptop Computers; Printers/Scanners/Fax Machines; Tablets; Video Game Consoles; PlayStation Consoles","false","true","","OEM, Vizio, Sony","false","false","false","false"
"Sprint","Sprint","98-199 Kamehameha Hwy ","Aiea","Honolulu County","HI","96701","8084852885","0","Monday: 9:00 AM - 8:00 PM Tuesday: 9:00 AM - 8:00 PM Wednesday: 9:00 AM - 8:00 PM Thursday: 9:00 AM - 8:00 PM Friday: 9:00 AM - 8:00 PM Saturday: 9:00 AM - 6:00 PM Sunday: 10:00 AM - 6:00 PM ","http://green.sprint.com/","21.3810703","-157.9421973","3.32790120336355","Cell Phones; Computer (Recycling); Computer Monitors; Electronics; Laptop Computers; Printers/Scanners/Fax Machines; Tablets; Video Game Consoles; PlayStation Consoles","false","true","","","false","false","false","false"
"Best Buy","null","98-051 Kamehameha Hwy","Aiea","","HI","96701","8084856940","0","","https://www.bestbuy.com/site/services/recycling/pcmcat149900050025.c?id=pcmcat149900050025","21.3824773","-157.9419313","3.35877402367056","","false","false","","","false","false","false","false"
"Sprint Store","null","98-199 Kamehameha Hwy Ste B-4","Aiea","","HI","96701","8084852885","0","","https://newsroom.sprint.com/csr/device-donations/","21.3811411","-157.9428616","3.36812886661187","","false","false","","","false","false","false","false"
"Firestone Complete Auto Care","","98 141 Kamehameha Highway","Aiea","","HI","96701","8084861582","0","","https://www.firestonecompleteautocare.com/","21.3819877","-157.9440493","3.46285197629917","","false","false","","","false","false","false","false"
"Firestone Complete Auto Care Store","Firestone Complete Auto Care Store","98-141 Kamehameha Hwy","Aiea","Honolulu","HI","96701","8084265992","0","","http://www.firestonecompleteautocare.com/","21.38231","-157.94395","3.4675135868642","Lead Acid (Pb) Batteries; Used Motor Oil; Computer (Recycling); Computer Monitors; Electronics; Laptop Computers; Printers/Scanners/Fax Machines; Tablets; Video Game Consoles; PlayStation Consoles","false","true","","","false","false","false","false"
"RadioShack","RadioShack","98-1005 Moanalua Rd","Aiea","Honolulu","HI","96701","8084878827","0","Monday: 10:00 AM - 9:00 PM Tuesday: 10:00 AM - 9:00 PM Wednesday: 10:00 AM - 9:00 PM Thursday: 10:00 AM - 9:00 PM Friday: 10:00 AM - 9:00 PM Saturday: 10:00 AM - 9:00 PM Sunday: 10:00 AM - 6:00 PM ","http://www.radioshack.com","21.38631","-157.94189","3.49265093025233","Cell Phones; Ni-Cd Batteries; Batteries (Rechargeable); Computer (Recycling); Computer Monitors; Electronics; Laptop Computers; Printers/Scanners/Fax Machines; Tablets; Video Game Consoles; PlayStation Consoles","false","true","This site is located in the Pearl Ridge Center.","","false","false","false","false"
"Verizon Wireless","Verizon Wireless","98-1005 Moanalua Rd Spc 2306a","Aiea","Honolulu","HI","96701","8666444532","0","","http://www.verizonwireless.com/","21.38631","-157.94189","3.49265093025233","Cell Phones; Cell Phone Batteries; Computer (Recycling); Computer Monitors; Electronics; Laptop Computers; Printers/Scanners/Fax Machines; Tablets; Video Game Consoles; PlayStation Consoles","false","true","<A Href="https://www.trade-in.vzw.com/home.aspx">
The Verizon Wireless Trade-In Program</A> allows you to trade in your used handset or tablet in a convenient and responsible way. 
<P>
<P>
Verizon Wireless works every day to protect our environment and give our customers opportunities to do the same. <A Href="http://aboutus.vzw.com/Green_Initiative/overview.html">Click here</A> for more examples of the earth-friendly initiatives and programs Verizon Wireless is proud to offer and support.","","false","false","false","false"
"LensCrafters","LensCrafters","98-1005 Moanalua Rd Spc 202","Aiea","Honolulu","HI","96701","8084869120","0","Monday: 10:00 AM - 9:00 PM Tuesday: 10:00 AM - 9:00 PM Wednesday: 10:00 AM - 9:00 PM Thursday: 10:00 AM - 9:00 PM Friday: 10:00 AM - 9:00 PM Saturday: 10:00 AM - 9:00 PM Sunday: 10:00 AM - 6:00 PM ","http://www.lenscrafters.com","21.38631","-157.94189","3.49265093025233","Eyeglasses; Computer (Recycling); Computer Monitors; Electronics; Laptop Computers; Printers/Scanners/Fax Machines; Tablets; Video Game Consoles; PlayStation Consoles","false","true","This site is located at the Pearlridge Mall.","","false","false","false","false"
