name,description,address,city,region,province,postal_code,phone,fax,hours,url,latitude,longitude,distance,materials,pickup,dropoff,notes,groups,curbside,municipal,national,event_only
"Call2Recycle at RadioShack","Call2Recycle at RadioShack","771 S 30th St # 337","Heath","Licking","OH","43056","7405224020","0","","http://www.radioshack.com/","40.03128","-82.44333","5.69447325032239","Cell Phones; Ni-Cd Batteries; Li-Ion Batteries; Ni-MH Batteries; Ni-Zn Batteries; Small Sealed Lead Acid Batteries; Video Game Consoles; PlayStation Consoles","false","true","As the first national retailer to partner with Call2Recycle, RadioShack is at the forefront of the rechargeable battery recycling cause and is pleased to offer battery recycling at thousands of convenient RadioShack locations for free.  Simply drop them off at your local RadioShack and theyll take care of the rest.  Ask a store associate for more details.","","false","false","false","false"
"LensCrafters","LensCrafters","771 S 30th St","Heath","Licking","OH","43056","7405223867","0","Monday: 10:00 AM - 9:00 PM Tuesday: 10:00 AM - 9:00 PM Wednesday: 10:00 AM - 9:00 PM Thursday: 10:00 AM - 9:00 PM Friday: 10:00 AM - 9:00 PM Saturday: 10:00 AM - 9:00 PM Sunday: 12:00 PM - 6:00 PM ","http://www.lenscrafters.com","40.03128","-82.44333","5.69447325032239","Eyeglasses; Video Game Consoles; PlayStation Consoles","false","true","","","false","false","false","false"
"Indian Mound Mall 1","Indian Mound Mall 1","771 S 30th St","Heath","Licking","OH","43056","8583244111","0","","http://www.ecoatm.com/","40.03128","-82.44333","5.69447325032239","Cell Phones; Tablets; MP3 Players; Video Game Consoles; PlayStation Consoles","false","true","ecoATM is an automated, consumer self-serve kiosk that quickly buys back and recycles old phones, mp3 players and tablets.
</br>
Call or email <a href="mailto:max@ecoATM.com">customer support</a> with questions.","","false","false","false","false"
"Indian Mound Mall 2","Indian Mound Mall 2","771 S 30th St","Heath","Licking","OH","43056","8583244111","0","","http://www.ecoatm.com/","40.03128","-82.44333","5.69447325032239","Cell Phones; Tablets; MP3 Players; Video Game Consoles; PlayStation Consoles","false","true","ecoATM is an automated, consumer self-serve kiosk that quickly buys back and recycles old phones, mp3 players and tablets.
</br>
Call or email <a href="mailto:max@ecoATM.com">customer support</a> with questions.","","false","false","false","false"
"USPS Post Office Box Lobby Recycling Program","US Post Office","789 Hebron Rd","Heath","Licking","OH","43056","8002758777","0","","https://www.usps.com/","40.03071","-82.44155","5.7281014482478","Catalogs; Greeting Cards; Magazines; Paper (Mixed)","false","true","","","false","false","false","false"
"US Post Office","USPS Discarded Lobby Mail Recycling Program","789 Hebron Rd","Heath","Licking","OH","43056","0","0","","","40.03071","-82.44155","5.7281014482478","Video Game Consoles; PlayStation Consoles","false","true","","","false","false","false","false"
"Walgreens","Walgreens","764 Hebron Rd","Heath","Licking","OH","43056","7405226523","0","","http://www.walgreens.com","40.03068","-82.43781","5.86188131159402","Cell Phones; Inkjet Printer Cartridges; Video Game Consoles; PlayStation Consoles","false","true","","","false","false","false","false"
"Advance Auto Parts","Advance Auto Parts","744 Hebron Rd","Heath","Licking","OH","43056","7405221881","0","Monday: 7:00 AM - 9:00 PM Tuesday: 7:00 AM - 9:00 PM Wednesday: 7:00 AM - 9:00 PM Thursday: 7:00 AM - 9:00 PM Friday: 7:00 AM - 9:00 PM Saturday: 7:00 AM - 9:00 PM Sunday: 10:00 AM - 8:00 PM ","http://www.advanceautoparts.com","40.03139","-82.43768","5.9020880497457","Lead Acid (Pb) Batteries; Used Motor Oil; Video Game Consoles; PlayStation Consoles","false","true","","","false","false","false","false"
"Verizon Wireless","Verizon Wireless","721 Hebron Rd","Heath","Licking","OH","43056","8666444532","0","","http://www.verizonwireless.com/","40.03256","-82.43769","5.96054828683058","Cell Phones; Cell Phone Batteries; Video Game Consoles; PlayStation Consoles","false","true","<A Href="https://www.trade-in.vzw.com/home.aspx">
The Verizon Wireless Trade-In Program</A> allows you to trade in your used handset or tablet in a convenient and responsible way. 
<P>
<P>
Verizon Wireless works every day to protect our environment and give our customers opportunities to do the same. <A Href="http://aboutus.vzw.com/Green_Initiative/overview.html">Click here</A> for more examples of the earth-friendly initiatives and programs Verizon Wireless is proud to offer and support.","","false","false","false","false"
"AT&T Wireless","AT&T Wireless","81 Central Pkwy","Heath","Licking","OH","43056","7405226062","0","","http://www.att.com/","40.03711","-82.44459","5.96069073364196","Cell Phones; Ni-Cd Batteries; Batteries (Rechargeable); Cell Phone Batteries; Tablets; Li-Ion Batteries; Video Game Consoles; PlayStation Consoles","false","true","Receive an AT&T Promotion Card worth the trade-in value of your smartphone, tablet, or netbook. You can also donate the trade-in value to Cell Phones for Soldiers.","","false","false","false","false"
"Best Buy","Best Buy","701 Hebron Rd ","Heath","Licking County","OH","43056","7405226606","0","","https://www.bestbuy.com/recycle","40.0342712","-82.43631","6.09684425879841","Large Household Appliances; Refrigerators; Televisions; AC Power Plugs; Batteries (Rechargeable); Cables & Connectors; Car Audio/Video Equipment; Cell Phone Batteries; Cell Phones; Computer (Recycling); Hard Drives; Computer Monitors; Cameras; DVD Players/Blu-Ray Players/DVRs; Electronics; E-Readers; GPS Units; Headphones; Inkjet Printer Cartridges; Laptop Computers; Laser Toner Cartridges; Li-Ion Batteries; MP3 Players; Network Equipment; Ni-Cd Batteries; Ni-MH Batteries; Ni-Zn Batteries; Computer Peripherals; Portable Media Players; Printers/Scanners/Fax Machines; Small Electronics; Small Sealed Lead Acid Batteries; Stereo Equipment; Tablets; Telephones; UPS Batteries/Backup Systems; VCRs; Video Game Systems; Blu-Ray Players; Digital Converter Boxes; Small Televisions; Video Game Consoles; PlayStation Consoles","true","true","2 TVs per visit, 3 e-waste items per day; $25 fee for TVs and Monitors; $19.99 pick-up fee with delivery; $99.99 standalone pickup fee; ","Sony, Vizio, OEM","false","false","false","false"
"Best Buy","","701 Hebron Rd","Heath","","OH","43056","7405226606","0","","https://www.bestbuy.com/site/services/recycling/pcmcat149900050025.c?id=pcmcat149900050025","40.0342712","-82.43631","6.09684425879841","","false","false","","","false","false","false","false"
"Call2Recycle at Verizon Wireless","Call2Recycle at Verizon Wireless","668 Hebron Rd","Heath","Licking","OH","43056","7405226446","0","","http://www.verizon.com/","40.03324","-82.43402","6.12837381159884","Cell Phones; Ni-Cd Batteries; Li-Ion Batteries; Ni-MH Batteries; Ni-Zn Batteries; Small Sealed Lead Acid Batteries; Video Game Consoles; PlayStation Consoles","false","true","The U.S. EPA estimates that more than 350 million rechargeable batteries are purchased annually in the U.S. Thanks to the environmental commitment of this location, its easy and free to recycle your batteries. Bring your rechargeable batteries to this location and look for the recycling box or ask an associate how you can do your part for the environment.","","false","false","false","false"
"AutoZone","AutoZone","627 Hebron Rd","Heath","Licking","OH","43056","7407889097","0","","http://www.autozone.com","40.03583","-82.43198","6.33217681743843","Lead Acid (Pb) Batteries; Used Motor Oil; Video Game Consoles; PlayStation Consoles","false","true","Most AutoZone stores accept used motor oil, transmission fluid, gear oil and automotive batteries. Call to see what your local store is currently accepting.","","false","false","false","false"
"Pak Mail Center US641","","573 Hebron Rd","Heath","","OH","43056","7405222564","0","","https://www.pakmail.com/","40.0370491","-82.4322071","6.38518620351374","","false","false","","","false","false","false","false"
"GiantEagle6523 1","GiantEagle6523 1","553 Hebron Rd","Heath","Licking","OH","43056","8583244111","0","","http://www.ecoatm.com/","40.03686","-82.43089","6.42347193192436","Cell Phones; Tablets; MP3 Players; Video Game Consoles; PlayStation Consoles","false","true","ecoATM is an automated, consumer self-serve kiosk that quickly buys back and recycles old phones, mp3 players and tablets.
</br>
Call or email <a href="mailto:max@ecoATM.com">customer support</a> with questions.","","false","false","false","false"
"Shred Nations","Shred Nations (inside Pak Mail)","573 Hebron Rd","Heath","Licking","OH","43056","7403040181","0","","http://www.shrednations.com/dropoff/location/heath/b2461867-3319-ea1f-f164-51acd5589895","40.03686","-82.43089","6.42347193192436","Cell Phones; Computer (Recycling); Laptop Computers; Small Televisions; Documents to Shred; Video Game Consoles; PlayStation Consoles","true","true","Shred Nations offers document shredding, hard drive destruction, electronics recycling and more. Visit website for quotes and full list of services offered in your area. ","","false","false","false","false"
"Licking/Knox Goodwill Industries Inc. - Dell Reconnect Donation Site","","550 Hopewell Drive","Heath","","OH","43056","7405221212","0","","http://www.goodwillnewark.com/","40.036513","-82.4236428","6.67687124462575","","false","false","","","false","false","false","false"
"USPS Post Office Box Lobby Recycling Program","US Post Office","11 N Main St","Thornville","Perry","OH","43076","8002758777","0","","https://www.usps.com/","39.89671","-82.42114","7.0532324064859","Catalogs; Greeting Cards; Magazines; Paper (Mixed)","false","true","","","false","false","false","false"
"US Post Office","USPS Discarded Lobby Mail Recycling Program","11 N Main St","Thornville","Perry","OH","43076","0","0","","","39.89671","-82.42114","7.0532324064859","Video Game Consoles; PlayStation Consoles","false","true","","","false","false","false","false"
"Licking County Recycling","Licking County Recycling","777 E Main St","Newark","Licking","OH","43055","7406705125","0","","http://www.lcounty.com/rlc","40.05083","-82.43166","7.12855486749817","Computer (Recycling); Electronics; Laptop Computers; Aluminum Cans; Glass (Brown); Glass (Clear); Glass (Green)","false","true","","","false","false","false","false"
"The Shelley Company - Southern Division","","80 Park Drive","Thornville","","OH","43076","8887435590","0","","https://www.shellyco.com/sustainability/greenleed/","39.8938675","-82.4177459","7.31941302853812","","false","false","","","false","false","false","false"
"Licking/Knox Goodwill Industries Inc. - Dell Reconnect Donation Site","","101 Union Street","Newark","","OH","43055","7403458191","0","","http://www.goodwillnewark.com","40.0513309","-82.4198786","7.55395418638911","","false","false","","","false","false","false","false"
"Famous Supply Company of Newark","Famous Supply Company of Newark","25 S 11th St","Newark","Licking","OH","43055","7403459617","0","Monday: 6:30 AM - 4:30 PM Tuesday: 6:30 AM - 4:30 PM Wednesday: 6:30 AM - 4:30 PM Thursday: 6:30 AM - 4:30 PM Friday: 6:30 AM - 4:30 PM Saturday: 8:00 AM - 11:00 AM ","http://www.famous-supply.com/","40.05337","-82.41767","7.7368602711924","Batteries (Rechargeable); Video Game Consoles; PlayStation Consoles","false","true","","","false","false","false","false"
"Keep America Beautiful Cars to Donate","","","Newark","","OH","43055","8554262474","0","","https://www.kab.org/?pagename=car_donation","40.0581205","-82.4012642","8.5685990756699","","false","false","","","false","false","false","false"
"USPS Post Office Box Lobby Recycling Program","US Post Office","175 E Broad St","Pataskala","Licking","OH","43062","8002758777","0","","https://www.usps.com/","40.00339","-82.67263","8.69169938438755","Catalogs; Greeting Cards; Magazines; Paper (Mixed)","false","true","","","false","false","false","false"
"US Post Office","USPS Discarded Lobby Mail Recycling Program","175 E Broad St","Pataskala","Licking","OH","43062","0","0","","","40.00339","-82.67263","8.69169938438755","Video Game Consoles; PlayStation Consoles","false","true","","","false","false","false","false"
"US Post Office","US Post Office","70 E Church St","Newark","Licking","OH","43055","0","0","","https://www.usps.com/ship/recycle-through-usps.htm","40.06054","-82.40055","8.71489827912019","Inkjet Printer Cartridges; Video Game Consoles; PlayStation Consoles","false","true","Free, postage-paid Mail Back envelopes can be found on display in the lobby. There is no limit to the number of envelopes customers may take. The contents of the envelope must weigh less than 13 ounces and the envelope must be able to seal completely. For more details visit<a href="http://www.maxback.com/mxb-postoffice-collaboration" target="_blank">MaxBack</a>.","","false","false","false","false"
"Monro","Monro","1051 N 21st St","Newark","Licking","OH","43055","7403667168","0","Monday: 7:30 AM - 7:00 PM Tuesday: 7:30 AM - 7:00 PM Wednesday: 7:30 AM - 7:00 PM Thursday: 7:30 AM - 7:00 PM Friday: 7:30 AM - 7:00 PM Saturday: 7:30 AM - 4:00 PM ","http://monro.com","40.07722","-82.42886","8.71492759840119","Used Motor Oil; Video Game Consoles; PlayStation Consoles","false","true","","","false","false","false","false"
"Micro Materials","","8675 Lancaster-Newark Rd.  ","Baltimore","","OH","43105","7408620751","0","","http://www.microrolloff.com/","39.8510581","-82.5718295","8.72721557998444","","false","false","","","false","false","false","false"
"Call2Recycle at Pataskala TrueValue","Call2Recycle at Pataskala TrueValue","37 S Main St","Pataskala","Licking","OH","43062","7409276999","0","","http://www.truevalue.com/","40.00174","-82.67505","8.78561807662764","Cell Phones; Ni-Cd Batteries; Li-Ion Batteries; Ni-MH Batteries; Ni-Zn Batteries; Small Sealed Lead Acid Batteries; Video Game Consoles; PlayStation Consoles","false","true","The U.S. EPA estimates that more than 350 million rechargeable batteries are purchased annually in the U.S. Thanks to the environmental commitment of this location, its easy and free to recycle your batteries. Bring your rechargeable batteries to this location and look for the recycling box or ask an associate how you can do your part for the environment.","","false","false","false","false"
"911 Cell Phone Bank - Ligonier Police Department","911 Cell Phone Bank - Ligonier Police Department","155 E Main St","Newark","Licking","OH","43055","8662907864","0","","http://www.911cellphonebank.org/","40.05934","-82.39502","8.86164018088256","Cell Phones; Cameras; Laptop Computers; MP3 Players; Video Games; Video Game Consoles; Smart watches & Apple Watch®
","false","true","Please call to verify drop-off procedures and directions to the location.  For prepaid shipping labels, visit http://www.911cellphonebank.org/drop-off-locations.asp - click on "print shipping label."","","false","false","false","false"
"Licking/Knox Goodwill Industries Inc. - Dell Reconnect Donation Site","","78 Oak Meadow Drive","Pataskala","","OH","43062","7409272500","0","","http://www.goodwillnewark.com","40.0043292","-82.6772968","8.94703417990119","","false","false","","","false","false","false","false"
"Licking/Knox Goodwill Industries Inc. - Dell Reconnect Donation Site","","78 Oak Meadow Drive","Pataskala","","OH","43062","7409272500","0","","http://www.goodwillnewark.com","40.0043292","-82.6772968","8.94703417990119","","false","false","","","false","false","false","false"
"Strategic Materials, Inc.","","101 S Arch St","Newark","","OH","43055","7403499523","0","","https://www.strategicmaterials.com/","40.0579262","-82.3900895","8.98296481441045","","false","false","","","false","false","false","false"
"AutoZone","AutoZone","1275 N 21st St","Newark","Licking","OH","43055","7403667770","0","","http://www.autozone.com","40.08163","-82.42799","8.99982679011741","Lead Acid (Pb) Batteries; Used Motor Oil; Video Game Consoles; PlayStation Consoles","false","true","Most AutoZone stores accept used motor oil, transmission fluid, gear oil and automotive batteries. Call to see what your local store is currently accepting.","","false","false","false","false"
"Home Depot","Home Depot","1330 N 21st St","Newark","Licking","OH","43055","7403641241","0","","http://www.homedepot.com","40.08504","-82.42746","9.21737069496378","Compact Fluorescent Lights; Batteries (Rechargeable); Video Game Consoles; PlayStation Consoles","false","true","Home Depot accepts compact fluorescent bulbs and used power tool rechargeable batteries. Look for the orange drop boxes, usually located near the front entrance near the customer service desk.","","false","false","false","false"
"Call2Recycle at the Home Depot","Call2Recycle at the Home Depot","1330 N 21st St","Newark","Licking","OH","43055","7403641241","0","","http://www.homedepot.com/","40.08504","-82.42746","9.21737069496378","Cell Phones; Compact Fluorescent Lights; Ni-Cd Batteries; Li-Ion Batteries; Ni-MH Batteries; Ni-Zn Batteries; Small Sealed Lead Acid Batteries; Video Game Consoles; PlayStation Consoles; Batteries (Rechargeable); Cell Phone Batteries; Li-Ion Batteries; Ni-Cd Batteries; Ni-MH Batteries; Small Sealed Lead Acid Batteries","false","true","The Home Depot accepts used rechargeable batteries and compact fluorescent bulbs. Look for the orange drop boxes, usually located near the front entrance near the customer service desk, or ask a store associate for more details.","Call2Recycle","false","false","false","false"
"Walmart Tire & Lube Express","Walmart Tire & Lube Express","1315 N 21st St","Newark","Licking","OH","43055","7403649090","0","","http://www.walmart.com/catalog/catalog.gsp?cat=495843","40.0857","-82.42757","9.25399220656334","Lead Acid (Pb) Batteries; Used Motor Oil; Oil Filters; Video Game Consoles; PlayStation Consoles","false","true","","","false","false","false","false"
"Walmart","Walmart","1315 N 21st St","Newark","Licking","OH","43055","7403649090","0","","http://www.walmart.com","40.0857","-82.42757","9.25399220656334","Lead Acid (Pb) Batteries; Plastic Shopping Bags; Food Storage Bags; Video Game Consoles; PlayStation Consoles","false","true","","","false","false","false","false"
"Express Pack N' Ship","","299 Deo Dr","Newark","","OH","43055","7403661325","0","","","40.0851695","-82.4255642","9.2756010358115","","false","false","","","false","false","false","false"
"Tractor Supply","Tractor Supply","315 Deo Dr","Newark","Licking","OH","43055","7403662316","0","","http://www.tractorsupply.com","40.08617","-82.42285","9.40842101695398","Transmission Fluid; Used Motor Oil; Video Game Consoles; PlayStation Consoles","false","true","","","false","false","false","false"
"Licking County Recycling-Alexandria","","1691 Johnstown-Alexandria Road","Alexandria","","OH","43001","7406705125","0","","https://www.lcounty.com/depts/recycling/default.htm","40.0861196","-82.608141","9.45923789730725","","false","false","","","false","false","false","false"
"Advance Auto Parts","Advance Auto Parts","1127 Mount Vernon Rd","Newark","Licking","OH","43055","7403660040","0","Monday: 7:00 AM - 9:00 PM Tuesday: 7:00 AM - 9:00 PM Wednesday: 7:00 AM - 9:00 PM Thursday: 7:00 AM - 9:00 PM Friday: 7:00 AM - 9:00 PM Saturday: 7:00 AM - 9:00 PM Sunday: 10:00 AM - 8:00 PM ","http://www.advanceautoparts.com","40.08812","-82.41935","9.61968975889143","Lead Acid (Pb) Batteries; Used Motor Oil; Video Game Consoles; PlayStation Consoles","false","true","","","false","false","false","false"
"Licking/Knox Goodwill Industries Inc. - Dell Reconnect Donation Site","","1199 Mt Vernon Road","Newark","","OH","43055","7403640804","0","","http://www.goodwillnewark.com","40.0896588","-82.4197053","9.70067951033858","","false","false","","","false","false","false","false"
"Ohio Drop Off - Licking County Recycling","","777 E Main St","Newark","","OH","43055","7406705125","0","","http://www.ohiodropoff.com/newark.htm","40.0600627","-82.370764","9.85035555854287","","false","false","","","false","false","false","false"
