name,description,address,city,region,province,postal_code,phone,fax,hours,url,latitude,longitude,distance,materials,pickup,dropoff,notes,groups,curbside,municipal,national,event_only
"Verizon Wireless","Verizon Wireless","4816 Milan Rd","Sandusky","Erie","OH","44870","8666444532","0","","http://www.verizonwireless.com/","41.40459","-82.66025","20.9744297107608","Cell Phones; Cell Phone Batteries; Video Game Consoles; PlayStation Consoles","false","true","<A Href="https://www.trade-in.vzw.com/home.aspx">
The Verizon Wireless Trade-In Program</A> allows you to trade in your used handset or tablet in a convenient and responsible way. 
<P>
<P>
Verizon Wireless works every day to protect our environment and give our customers opportunities to do the same. <A Href="http://aboutus.vzw.com/Green_Initiative/overview.html">Click here</A> for more examples of the earth-friendly initiatives and programs Verizon Wireless is proud to offer and support.","","false","false","false","false"
"Townsend Township Recycling Drop-Off Site","","1751 County Road 294","Vickery","","OH","43464","4193347222","0","","https://www.recycleoss.net/?page=sandusky-county-map","41.3830604","-82.8921192","21.0842591914919","","false","false","","","false","false","false","false"
"Sams Club","","614 Crossings Rd","Sandusky","","OH","44870","4196266563","0","","https://www.samsclub.com/","41.4009185","-82.6655595","21.1020394024454","","false","false","","","false","false","false","false"
"AT&T Wireless","AT&T Wireless","4912 Milan Rd","Sandusky","Erie","OH","44870","4196264838","0","","http://www.att.com/","41.40019","-82.65592","21.3424356956667","Cell Phones; Ni-Cd Batteries; Batteries (Rechargeable); Cell Phone Batteries; Tablets; Li-Ion Batteries; Video Game Consoles; PlayStation Consoles","false","true","Receive an AT&T Promotion Card worth the trade-in value of your smartphone, tablet, or netbook. You can also donate the trade-in value to Cell Phones for Soldiers.","","false","false","false","false"
"Barnes Nursery Garden Center","","3511 Cleveland Road","Huron","","OH","44839","4194335525","0","","https://www.barnesnursery.com/","41.413285","-82.6155894","21.4644606269426","","false","false","","","false","false","false","false"
"Salem Township Recycling Drop-Off Site","","11650 West Portage River South Road","Oak Harbor","","OH","43449","4193347222","0","","https://www.recycleoss.net/?page=ottawa-county-map","41.4973816","-83.1552373","21.553280715764","","false","false","","","false","false","false","false"
"Barnes Nursery Compost Center","Barnes Nursery Compost Center","1630 Camp Rd ","Huron","Erie County","OH","44839","4194331050","0","","null","41.4093052","-82.6158583","21.697399971446","Brush; Christmas Trees; Grass Clippings; Leaves; Tree Trimmings; Weeds; Video Game Consoles; PlayStation Consoles","false","true","This site charges a fee of $1.00 per tree after January 13, 2008.","","false","false","false","false"
"Walmart","Walmart","5500 Milan Rd Ste 200","Sandusky","Erie","OH","44870","4196278778","0","","http://www.walmart.com","41.39572","-82.65151","21.7168755417627","Lead Acid (Pb) Batteries; Plastic Shopping Bags; Food Storage Bags; Video Game Consoles; PlayStation Consoles","false","true","","","false","false","false","false"
"Walmart Tire & Lube Express","Walmart Tire & Lube Express","5500 Milan Rd","Sandusky","Erie","OH","44870","4196278778","0","","http://www.walmart.com/catalog/catalog.gsp?cat=495843","41.39572","-82.65151","21.7168755417627","Lead Acid (Pb) Batteries; Used Motor Oil; Oil Filters; Video Game Consoles; PlayStation Consoles","false","true","","","false","false","false","false"
"Call2Recycle at Lowe's","Call2Recycle at Lowe's","5500 Milan Rd Ste 304","Sandusky","Erie","OH","44870","4196246000","0","Monday: 6:00 AM - 10:00 PM Tuesday: 6:00 AM - 10:00 PM Wednesday: 6:00 AM - 10:00 PM Thursday: 6:00 AM - 10:00 PM Friday: 6:00 AM - 10:00 PM Saturday: 6:00 AM - 10:00 PM Sunday: 8:00 AM - 8:00 PM ","http://www.lowes.com/","41.39572","-82.65151","21.7168755417627","Cell Phones; Compact Fluorescent Lights; Ni-Cd Batteries; Plastic Shopping Bags; Li-Ion Batteries; Ni-MH Batteries; Ni-Zn Batteries; Small Sealed Lead Acid Batteries; Video Game Consoles; PlayStation Consoles; Batteries (Rechargeable); Cell Phone Batteries; Li-Ion Batteries; Ni-Cd Batteries; Ni-MH Batteries; Small Sealed Lead Acid Batteries; Cell Phones","false","true","As an environmentally-committed retailer, Lowes offers a recycling center near store entrances to give consumers a free and easy way to properly dispose of rechargeable batteries, cell phones, CFLs and plastic shopping bags; materials that otherwise could be potentially harmful to the environment.  Look for the recycling center or ask a store associate for more details.","Call2Recycle","false","false","false","false"
"Call2Recycle at Rays Electronics","Call2Recycle at Rays Electronics","14250 W State Route 105","Oak Harbor","Ottawa","OH","43449","4198980789","0","","http://www.call2recycle.org/","41.49731","-83.20388","23.6209025659966","Cell Phones; Ni-Cd Batteries; Li-Ion Batteries; Ni-MH Batteries; Ni-Zn Batteries; Small Sealed Lead Acid Batteries; Video Game Consoles; PlayStation Consoles","false","true","The U.S. EPA estimates that more than 350 million rechargeable batteries are purchased annually in the U.S. Thanks to the environmental commitment of this location, its easy and free to recycle your batteries. Bring your rechargeable batteries to this location and look for the recycling box or ask an associate how you can do your part for the environment.","","false","false","false","false"
"Groton Township Recycling Drop-Off Site","","9414 Portland Rd","Castalia","","OH","44824","4194337303","0","","http://www.eriecountyrecycles.org/","41.3422411","-82.7901976","23.6283150524013","","false","false","","","false","false","false","false"
"Oxford Township Recycling Drop-Off Site","","4320 Mason Rd W","Sandusky","","OH","44870","4194337303","0","","http://www.eriecountyrecycles.org/","41.3502468","-82.6989143","23.8666074218884","","false","false","","","false","false","false","false"
"Riley Township Recycling Drop-Off Site","","3109 Rte 412","Fremont","","OH","43420","4193347222","0","","https://www.recycleoss.net/?page=sandusky-county-map","41.3655471","-83.0116809","24.0899577899897","","false","false","","","false","false","false","false"
"Keep America Beautiful Cars to Donate","","","Huron","","OH","44839","8554262474","0","","https://www.kab.org/?pagename=car_donation","41.3950489","-82.5551733","24.1940456979127","","false","false","","","false","false","false","false"
"Rice Township Recycling Drop-Off Site","","142 County Road 119","Fremont","","OH","43420","4193347222","0","","https://www.recycleoss.net/?page=sandusky-county-map","41.4222048","-83.1328589","24.2223065778727","","false","false","","","false","false","false","false"
"USPS Post Office Box Lobby Recycling Program","US Post Office","378 Main St","Huron","Erie","OH","44839","8002758777","0","","https://www.usps.com/","41.39151","-82.55757","24.3265485729646","Catalogs; Greeting Cards; Magazines; Paper (Mixed)","false","true","","","false","false","false","false"
"Benton Township Recycling Drop-Off Site","","1670 North Walker Street","Graytown","","OH","43432","4193347222","0","","https://www.recycleoss.net/?page=ottawa-county-map","41.5403397","-83.2613263","24.8272116917341","","false","false","","","false","false","false","false"
"Huron Ace Hardware","","402 Cleveland Rd E","Huron","","OH","44839","4194334797","0","","http://www.eriecountyrecycles.org/","41.3882222","-82.5445386","24.8955230862141","","false","false","","","false","false","false","false"
"Goodwill Industries of Erie Huron Ottawa and Sandusky Counties Inc. - Dell Reconnect Donation Site","","422 E Cleveland Road","Huron","","OH","44839","4194337542","0","","https://www.goodwillsandusky.org/","41.3879819","-82.5426367","24.9656248314772","","false","false","","","false","false","false","false"
"Erie County Landfill Recycling Drop-Off Site","","10102 Hoover Rd","Milan","","OH","44839","4194335023","0","","http://www.eriecountyrecycles.org/","41.346929","-82.5998001","25.9037870395983","","false","false","","","false","false","false","false"
"Jerusalem Township Recycling Drop-Off","","9501 Jerusalem Rd","Jerusalem","","OH","43412","4192132230","0","","http://www.co.lucas.oh.us","41.6389131","-83.3200237","25.9680035013092","","false","false","","","false","false","false","false"
"Walmart Tire & Lube Express","Walmart Tire & Lube Express","2052 N State Route 53","Fremont","Sandusky","OH","43420","4193343190","0","","http://www.walmart.com/catalog/catalog.gsp?cat=495843","41.37882","-83.11719","26.0493326705361","Lead Acid (Pb) Batteries; Used Motor Oil; Oil Filters; Video Game Consoles; PlayStation Consoles","false","true","","","false","false","false","false"
"Walmart","Walmart","2052 N State Route 53","Fremont","Sandusky","OH","43420","4193343190","0","","http://www.walmart.com","41.37882","-83.11719","26.0493326705361","Lead Acid (Pb) Batteries; Plastic Shopping Bags; Food Storage Bags; Video Game Consoles; PlayStation Consoles","false","true","","","false","false","false","false"
"Firelands Habitat for Humanity ReStore","Firelands Habitat for Humanity ReStore","11001 US-250 ","Milan","Erie County","OH","44846","4194332609","0","Friday: 12:00 PM - 6:00 PM Saturday: 9:00 AM - 4:00 PM ","http://www.firelandshabitat.org","41.3347517","-82.6277563","26.0754429861269","Carpet; Ceramic Tiles; Construction Materials (Reuse); Paint Donation; Video Game Consoles; PlayStation Consoles","false","true","This site is located at the North Coast Marketplace at Mason Road and US Route 250 (just north of the turnpike).
ReStore accepts donations of new and used building materials and fixtures.  This site does not accept the following; broken appliances, rotten or mangled lumber, mattresses, chemicals, and spoiled or used paint.
Items may be brought to the ReStore during open hours or call 419/433-2609 to arrange for a pick-up or for an appointment during non-business hours to drop items at the ReStore.","","false","false","false","false"
"Verizon Wireless","Verizon Wireless","2140 Enterprise St","Fremont","Sandusky","OH","43420","8666444532","0","","http://www.verizonwireless.com/","41.37667","-83.11473","26.0952495429377","Cell Phones; Cell Phone Batteries; Video Game Consoles; PlayStation Consoles","false","true","<A Href="https://www.trade-in.vzw.com/home.aspx">
The Verizon Wireless Trade-In Program</A> allows you to trade in your used handset or tablet in a convenient and responsible way. 
<P>
<P>
Verizon Wireless works every day to protect our environment and give our customers opportunities to do the same. <A Href="http://aboutus.vzw.com/Green_Initiative/overview.html">Click here</A> for more examples of the earth-friendly initiatives and programs Verizon Wireless is proud to offer and support.","","false","false","false","false"
"Staples, Inc.","Staples","2136 Enterprise Dr ","Fremont","Sandusky County","OH","43420","4193550101","0","Monday: 9:00 AM - 8:00 PM Tuesday: 9:00 AM - 8:00 PM Wednesday: 9:00 AM - 8:00 PM Thursday: 9:00 AM - 8:00 PM Friday: 9:00 AM - 8:00 PM Saturday: 10:00 AM - 7:00 PM Sunday: 11:00 AM - 6:00 PM ","https://www.staples.com/recycle","41.3755556","-83.1157915","26.1898891208871","AC Power Plugs; Batteries (Rechargeable); Cables & Connectors; Cell Phone Batteries; Cell Phones; Computer (Recycling); Hard Drives; Computer Monitors; Cameras; DVD Players/Blu-Ray Players/DVRs; Electronics; E-Readers; GPS Units; Headphones; Inkjet Printer Cartridges; Laptop Computers; Laser Toner Cartridges; Li-Ion Batteries; MP3 Players; Network Equipment; Ni-Cd Batteries; Ni-MH Batteries; Ni-Zn Batteries; Computer Peripherals; Portable Media Players; Printers/Scanners/Fax Machines; Small Electronics; Small Sealed Lead Acid Batteries; Stereo Equipment; Tablets; Telephones; UPS Batteries/Backup Systems; VCRs; Video Game Systems; Blu-Ray Players; Digital Converter Boxes; Video Game Consoles; PlayStation Consoles","false","true","NO TVs; Limit 6 CEDs per day; ","Sony, Vizio, OEM","false","false","false","false"
"Staples","","2136 Enterprise Drive","Fremont","","OH","43420","4193550101","0","","https://www.staples.com/sbd/cre/marketing/sustainability-center/recycling-services/","41.3754488","-83.1157372","26.1942533200772","","false","false","","","false","false","false","false"
"Call2Recycle at Lowe's","Call2Recycle at Lowe's","1952 N State Route 53","Fremont","Sandusky","OH","43420","4193550221","0","Monday: 6:00 AM - 10:00 PM Tuesday: 6:00 AM - 10:00 PM Wednesday: 6:00 AM - 10:00 PM Thursday: 6:00 AM - 10:00 PM Friday: 6:00 AM - 10:00 PM Saturday: 6:00 AM - 10:00 PM Sunday: 8:00 AM - 8:00 PM ","http://www.lowes.com/","41.37503","-83.1172","26.2619379238905","Cell Phones; Compact Fluorescent Lights; Ni-Cd Batteries; Plastic Shopping Bags; Li-Ion Batteries; Ni-MH Batteries; Ni-Zn Batteries; Small Sealed Lead Acid Batteries; Video Game Consoles; PlayStation Consoles; Batteries (Rechargeable); Cell Phone Batteries; Li-Ion Batteries; Ni-Cd Batteries; Ni-MH Batteries; Small Sealed Lead Acid Batteries; Cell Phones","false","true","As an environmentally-committed retailer, Lowes offers a recycling center near store entrances to give consumers a free and easy way to properly dispose of rechargeable batteries, cell phones, CFLs and plastic shopping bags; materials that otherwise could be potentially harmful to the environment.  Look for the recycling center or ask a store associate for more details.","Call2Recycle","false","false","false","false"
"Walmart Supercenter","","2052 State Route 53","Fremont","","OH","43420","4193343190","0","","https://www.walmart.com/","41.3746432","-83.1198285","26.3632684083134","","false","false","","","false","false","false","false"
"Walmart Tire and Lube Express","","2052 State Route 53","Fremont","","OH","43420","4193343190","0","","https://www.walmart.com/cp/ideas/8932632","41.3746432","-83.1198285","26.3632684083134","","false","false","","","false","false","false","false"
"Lowe's","","1952 Highway 53","Fremont","","OH","43420","4193550221","0","","https://newsroom.lowes.com/responsibility/operational-excellence/","41.3722949","-83.1196609","26.4898540933983","","false","false","","","false","false","false","false"
"Sandusky Township Recycling Drop-Off Site","","2207 Oak Harbor Road","Fremont","","OH","43420","4193347222","0","","https://www.recycleoss.net/?page=sandusky-county-map","41.3770402","-83.1343588","26.6797510477574","","false","false","","","false","false","false","false"
"Sandusky Township Christmas Tree Drop-off","","2207 Oak Harbor Rd","Fremont","","OH","43420","4193323810","0","","https://www.recycleoss.net/","41.3770402","-83.1343588","26.6797510477574","","false","false","","","false","false","false","false"
"Value Village","","16 Seacliff Dr E","Leamington","","ON","","5193220226","0","","https://www.valuevillage.com/donate/what-we-take","42.0329696","-82.5978547","26.7257370018638","","false","false","","","false","false","false","false"
"US Post Office","US Post Office","429 W Lakeshore Dr ","Kelleys Island","Erie County","OH","43438","8002758777","0","","","41.5963098","-82.726005","7.75027417530628","Catalogs; Greeting Cards; Magazines; Paper (Mixed)","false","true","","","false","false","false","false"
"Kelleys Island Household Battery Drop-Off Site","","109 Division St","Kelleys Island","","OH","43438","4197462292","0","","http://www.eriecountyrecycles.org/","41.5942895","-82.7111282","8.35777232180498","","false","false","","","false","false","false","false"
