name,description,address,city,region,province,postal_code,phone,fax,hours,url,latitude,longitude,distance,materials,pickup,dropoff,notes,groups,curbside,municipal,national,event_only
"Middle Bass Island Township Recycling Drop-Off Site","","Fox Rd","Middle Bass","","OH","43446","4193347222","0","","https://www.recycleoss.net/?page=ottawa-county-map","41.6816054","-82.8122879","0.441945937422779","","false","false","","","false","false","false","false"
"Middle Bass Island Recycling Drop-Off Site","","Fox Rd","Middle Bass","","OH","43446","4192852810","0","","https://www.recycleoss.net/?page=ottawa-county-map","41.6816054","-82.8122879","0.441945937422779","","false","false","","","false","false","false","false"
"B.F.I. Landfill","","Hartshorn Rd & Rte 163","Port Clinton","","OH","43452","8007976028","0","","https://recycleoss.org/","41.5318269","-82.7709778","10.7853510111805","","false","false","","","false","false","false","false"
"Bassett's Do It Best Hardware","Bassett's Do It Best Hardware","3994 East Harbor Rd","Port Clinton","Ottawa","OH","43452","4197340656","0","","http://www.doitbest.com/","41.52506","-82.85494","11.0892447220776","Cell Phones; Ni-Cd Batteries; Li-Ion Batteries; Ni-MH Batteries; Ni-Zn Batteries; Small Sealed Lead Acid Batteries; Video Game Consoles; PlayStation Consoles","false","true","The U.S. EPA estimates that more than 350 million rechargeable batteries are purchased annually in the U.S. Thanks to the environmental commitment of this location, its easy and free to recycle your batteries. Bring your rechargeable batteries to this location and look for the recycling box or ask an associate how you can do your part for the environment.","","false","false","false","false"
"Walmart Tire & Lube Express","Walmart Tire & Lube Express","2826 East Harbor Rd, ","Port Clinton","Ottawa","OH","43452","4197323369","0","","http://www.walmart.com/catalog/catalog.gsp?cat=495843","41.52468","-82.85574","11.1218551507069","Lead Acid (Pb) Batteries; Used Motor Oil; Oil Filters; Video Game Consoles; PlayStation Consoles","false","true","","","false","false","false","false"
"Goodwill Industries","Goodwill Industries","205 SE Catawba Rd","Port Clinton","Ottawa","OH","43452","4197346042","0","Sunday: 12:00 PM - 5:00 PM Monday: 9:00 AM - 8:00 PM Tuesday: 9:00 AM - 8:00 PM Wednesday: 9:00 AM - 8:00 PM Thursday: 9:00 AM - 8:00 PM Friday: 9:00 AM - 8:00 PM Saturday: 9:00 AM - 8:00 PM ","http://locator.goodwill.org/","41.52411","-82.86714","11.2718311697885","Bikes; Books (Reuse); Cell Phones; Clothing; CD/DVD/Blu-ray/UHD discs; Computer (Reuse); Computer Monitors; Electronics; Gift Bags; Eyeglasses; Household Goods; Lawn Equipment; Bed Mattresses; Musical Instruments; Ornaments; Reusable Appliance Donation; Sporting Goods; Telephones; Televisions; Miscellaneous Tools; Children's Toys; Car Donation; VHS & Cassette Tapes; MP3 Players; Video Game Consoles; PlayStation Consoles","false","true","This site accepts clean, gently used items.  All electronics and appliances must be in working condition.  This site does not accept outdated computers.","","false","false","false","false"
"Goodwill Industries of Erie Huron Ottawa and Sandusky Counties Inc. - Dell Reconnect Donation Site","","205 SE Catawba Rd","Port Clinton","","OH","43452","4197346042","0","","https://www.goodwillsandusky.org/","41.5207757","-82.8580888","11.4080963251943","","false","false","","","false","false","false","false"
"Walmart Supercenter","","2826 E Harbor Rd","Port Clinton","","OH","43452","4197323369","0","","https://www.walmart.com/","41.5199291","-82.863221","11.5136432321908","","false","false","","","false","false","false","false"
"Walmart Tire and Lube Express","","2826 E Harbor Rd","Port Clinton","","OH","43452","4197323369","0","","https://www.walmart.com/cp/ideas/8932632","41.5199291","-82.863221","11.5136432321908","","false","false","","","false","false","false","false"
"Lakeshore One, Llc","Lakeshore One, Llc","3976 E Harbor Light Landing Dr","Port Clinton","Ottawa","OH","43452","4197347439","0","","http://www.radioshack.com/","41.50672","-82.839","12.249935039664","Cell Phones; Ni-Cd Batteries; Li-Ion Batteries; Ni-MH Batteries; Ni-Zn Batteries; Small Sealed Lead Acid Batteries; Video Game Consoles; PlayStation Consoles","false","true","The U.S. EPA estimates that more than 350 million rechargeable batteries are purchased annually in the U.S. Thanks to the environmental commitment of this location, its easy and free to recycle your batteries. Bring your rechargeable batteries to this location and look for the recycling box or ask an associate how you can do your part for the environment.","","false","false","false","false"
"Advance Auto Parts","Advance Auto Parts","2040 East Harbor Rd","Port Clinton","Ottawa","OH","43452","4197349303","0","Monday: 7:00 AM - 9:00 PM Tuesday: 7:00 AM - 9:00 PM Wednesday: 7:00 AM - 9:00 PM Thursday: 7:00 AM - 9:00 PM Friday: 7:00 AM - 9:00 PM Saturday: 7:00 AM - 9:00 PM Sunday: 10:00 AM - 8:00 PM ","http://www.advanceautoparts.com","41.51605","-82.90233","12.3166735582196","Lead Acid (Pb) Batteries; Used Motor Oil; Video Game Consoles; PlayStation Consoles","false","true","","","false","false","false","false"
"Portage Township Recycling Drop-Off Site","","2501 East State Road","Port Clinton","","OH","43452","4193347222","0","","https://www.recycleoss.net/?page=ottawa-county-map","41.508991","-82.884814","12.5055040366627","","false","false","","","false","false","false","false"
"Vita-Plate Battery, Inc. Drop-Off","Vita-Plate Battery, Inc. Drop-Off","304 Buckeye Blvd","Port Clinton","Ottawa","OH","43452","4197323181","0","","http://www.ohiodnr.com/recycling/locations/","41.51199","-82.9132","12.7802875907715","Lead Acid (Pb) Batteries; Video Game Consoles; PlayStation Consoles","false","true","","","false","false","false","false"
"Catawba Island Township Recycling Drop-Off Site","","1868 East Perry Street","Port Clinton","","OH","43452","4193347222","0","","https://www.recycleoss.net/?page=ottawa-county-map","41.5145288","-82.9250427","12.8625801382932","","false","false","","","false","false","false","false"
"Danbury Township Recycling Drop-Off Site","","5972 South Danbury Road","Port Clinton","","OH","43452","4193347222","0","","https://www.recycleoss.net/?page=ottawa-county-map","41.49461","-82.8247636","13.0510472239555","","false","false","","","false","false","false","false"
"R & R Auto Repair","R & R Auto Repair","1340 W Lakeshore Dr","Port Clinton","Ottawa","OH","43452","4197345618","0","Monday: 7:30 AM - 5:00 PM Tuesday: 7:30 AM - 5:00 PM Wednesday: 7:30 AM - 5:00 PM Thursday: 7:30 AM - 5:00 PM Friday: 7:30 AM - 5:00 PM ","","41.52123","-82.96394","13.4387230020662","Used Motor Oil; Video Game Consoles; PlayStation Consoles","false","true","","","false","false","false","false"
"Snyder's Towing","Snyder's Towing","1401 E Bayview Dr","Sandusky","Erie","OH","44870","4196845745","0","","","41.46896","-82.8199","14.8213548782394","Used Motor Oil; Video Game Consoles; PlayStation Consoles","false","true","","","false","false","false","false"
"Ottawa County Landfill","Ottawa County Landfill","530 N Camp Rd","Port Clinton","Ottawa","OH","43452","4196352367","0","","","41.52501","-83.02044","15.0531242899364","Plastic #1 (PETE); Plastic #2 (HDPE); Plastic #2 (Color HDPE); Aluminum Cans; Aluminum; Glass (Brown); Cardboard; Glass (Clear); Glass (Green); Large Household Appliances; Newspapers; Tin or Steel Cans","false","true","","","false","false","false","false"
"Erie Township Recycling Drop-Off Site","","5525 West Harbor Road","Port Clinton","","OH","43452","4193347222","0","","https://www.recycleoss.net/?page=ottawa-county-map","41.5165968","-83.0403317","16.1854205576677","","false","false","","","false","false","false","false"
"USPS Post Office Box Lobby Recycling Program","US Post Office","89 N Monroe St","Lacarne","Ottawa","OH","43439","8002758777","0","","https://www.usps.com/","41.51825","-83.04269","16.1903186884648","Catalogs; Greeting Cards; Magazines; Paper (Mixed)","false","true","","","false","false","false","false"
"Sandusky Central Feed","","301 E Market St","Sandusky","","OH","44870","4196262058","0","","http://www.eriecountyrecycles.org/","41.4575258","-82.7082835","16.6536095546925","","false","false","","","false","false","false","false"
"Sandusky Services Center","Sandusky Services Center","1024 Cement Ave","Sandusky","Erie","OH","44870","4196275844","0","","http://eriecountyrecycles.org","41.44581","-82.74924","16.8285970922897","Plastic #1 (PETE); Plastic #2 (HDPE); Plastic #2 (Color HDPE); Aluminum Cans; Glass (Brown); Brown Paper Bags; Cardboard; Catalogs; Glass (Clear); Computer Paper; Gift Boxes; Glass (Green); Greeting Cards; Magazines; Paper (Mixed); Newspapers; Paperboard; Tin or Steel Cans; Office Paper","false","true","","","false","false","false","false"
"Sandusky City Services Complex Recycling Drop-Off Site","","Marquette St","Sandusky","","OH","44870","4194337303","0","","http://www.eriecountyrecycles.org/","41.4459119","-82.7472236","16.8448519181131","","false","false","","","false","false","false","false"
"USPS Post Office Box Lobby Recycling Program","US Post Office","2220 Caldwell St","Sandusky","Erie","OH","44871","8002758777","0","","https://www.usps.com/","41.44977","-82.70586","17.1998026873835","Catalogs; Greeting Cards; Magazines; Paper (Mixed)","false","true","","","false","false","false","false"
"US Post Office","USPS Discarded Lobby Mail Recycling Program","2220 Caldwell St","Sandusky","Erie","OH","44871","0","0","","","41.44977","-82.70586","17.1998026873835","Video Game Consoles; PlayStation Consoles","false","true","","","false","false","false","false"
"Bay Township Recycling Drop-Off Site","","4431 West Fremont Road","Port Clinton","","OH","43452","4193347222","0","","https://www.recycleoss.net/?page=ottawa-county-map","41.4799463","-83.0172793","17.3548967285914","","false","false","","","false","false","false","false"
"Sandusky Recycling Drop-Off Site - Kiwanis Park","","1st St","Sandusky","","OH","44870","4194337303","0","","http://www.eriecountyrecycles.org/","41.4514692","-82.6845304","17.5024257659071","","false","false","","","false","false","false","false"
"Carroll Township Recycling Drop-Off Site","","11080 West Toussaint East Road","Oak Harbor","","OH","43449","4193347222","0","","https://www.recycleoss.net/?page=ottawa-county-map","41.5672096","-83.1253369","17.6755199152608","","false","false","","","false","false","false","false"
"Sandusky Steel & Supply","Sandusky Steel & Supply","1943 Milan Rd","Sandusky","Erie","OH","44870","4196264245","0","Monday: 8:00 AM - 4:15 PM Tuesday: 8:00 AM - 4:15 PM Wednesday: 8:00 AM - 4:15 PM Thursday: 8:00 AM - 4:15 PM Friday: 8:00 AM - 4:15 PM Saturday: 8:00 AM - 11:30 AM ","","41.44148","-82.69692","17.8984008558408","Aluminum Cans; Aluminum; Brown Paper Bags; Lead Acid (Pb) Batteries; Cardboard; Computer Paper; Ferrous Metals (Steel or Iron); Greeting Cards; Large Household Appliances; Magazines; Paper (Mixed); Newspapers; Non-ferrous (Copper/Brass/Tin); Tin or Steel Cans; Office Paper; Video Game Consoles; PlayStation Consoles","false","true","","","false","false","false","false"
"Sandusky Steel & Supply Co","Sandusky Steel & Supply Co","1943 Milan Rd","Sandusky","Erie","OH","44870","4196264245","4196264247","Monday: 8:00 AM - 4:30 PM Tuesday: 8:00 AM - 4:30 PM Wednesday: 8:00 AM - 4:30 PM Thursday: 8:00 AM - 4:30 PM Friday: 8:00 AM - 4:30 PM Saturday: 8:00 AM - 12:00 PM ","http://www.sanduskysteel.com","41.44148","-82.69692","17.8984008558408","Aluminum; Ferrous Metals (Steel or Iron); Paper (Mixed); Non-ferrous (Copper/Brass/Tin); High-Temp Alloys; Special Metals; Video Game Consoles; PlayStation Consoles","false","true","","","false","false","false","false"
"Sandusky Steel & Supply Co","","1943 Milan Rd","Sandusky","","OH","44870","4196264245","0","","","41.4395277","-82.6968143","18.0264395577736","","false","false","","","false","false","false","false"
"Tractor Supply","","709 West Perkins Avenue","Sandusky","","OH","44870","4196240170","0","","https://www.tractorsupply.com/","41.4341156","-82.7102429","18.1467869432233","","false","false","","","false","false","false","false"
"Tractor Supply","Tractor Supply","709 W Perkins Ave","Sandusky","Erie","OH","44870","4196240170","0","","http://www.tractorsupply.com","41.43315","-82.71055","18.2051881268705","Transmission Fluid; Used Motor Oil; Video Game Consoles; PlayStation Consoles","false","true","","","false","false","false","false"
"AutoZone","AutoZone","800 W Perkins","Sandusky","Erie","OH","44870","4196240603","0","","http://www.autozone.com","41.43296","-82.70983","18.2293083847613","Lead Acid (Pb) Batteries; Used Motor Oil; Video Game Consoles; PlayStation Consoles","false","true","Most AutoZone stores accept used motor oil, transmission fluid, gear oil and automotive batteries. Call to see what your local store is currently accepting.","","false","false","false","false"
"Advance Auto Parts","Advance Auto Parts","2238 Campbell St","Sandusky","Erie","OH","44870","4196248950","0","Monday: 7:00 AM - 9:00 PM Tuesday: 7:00 AM - 9:00 PM Wednesday: 7:00 AM - 9:00 PM Thursday: 7:00 AM - 9:00 PM Friday: 7:00 AM - 9:00 PM Saturday: 7:00 AM - 9:00 PM Sunday: 10:00 AM - 8:00 PM ","http://www.advanceautoparts.com","41.43311","-82.70529","18.294514644424","Lead Acid (Pb) Batteries; Used Motor Oil; Video Game Consoles; PlayStation Consoles","false","true","","","false","false","false","false"
"Goodwill Industries of Erie Huron Ottawa and Sandusky Counties Inc. - Dell Reconnect Donation Site","","924 E Perkins Avenue","Sandusky","","OH","44870","4196252910","0","","https://www.goodwillsandusky.org/","41.4322682","-82.685379","18.7089477080168","","false","false","","","false","false","false","false"
"Goodwill Retail Store","","924 E Perkins Ave","Sandusky","","OH","44870","4196252910","0","","http://www.eriecountyrecycles.org/","41.4322682","-82.685379","18.7089477080168","","false","false","","","false","false","false","false"
"Erie County Household Battery Drop-Off","","2900 Columbus Ave","Sandusky","","OH","44870","4196277638","0","","http://www.eriecountyrecycles.org/","41.4272469","-82.6934895","18.8814638322772","","false","false","","","false","false","false","false"
"Monro","Monro","3411 Milan Rd","Sandusky","Erie","OH","44870","4196217722","0","Monday: 7:30 AM - 7:00 PM Tuesday: 7:30 AM - 7:00 PM Wednesday: 7:30 AM - 7:00 PM Thursday: 7:30 AM - 7:00 PM Friday: 7:30 AM - 7:00 PM Saturday: 7:30 AM - 4:00 PM ","http://monro.com","41.42693","-82.68285","19.1000260585932","Used Motor Oil; Video Game Consoles; PlayStation Consoles","false","true","","","false","false","false","false"
"Target","Target","4020 Milan Rd","Sandusky","Erie","OH","44870","4196093340","0","","http://www.target.com/","41.41993","-82.67571","19.687186461371","Aluminum Cans; Cell Phones; Inkjet Printer Cartridges; MP3 Players; Plastic #1 (PETE); Plastic #2 (HDPE); Plastic Shopping Bags; Video Game Consoles; PlayStation Consoles","false","true","","","false","false","false","false"
"Bauman Automotive","Bauman Automotive","508 Lucas St E","Castalia","Erie","OH","44824","4196845038","0","","","41.39845","-82.79838","19.7259826293923","Used Motor Oil; Video Game Consoles; PlayStation Consoles","false","true","","","false","false","false","false"
"Best Buy","Best Buy","4210 Milan Rd ","Sandusky","Erie County","OH","44870","4196211877","0","","https://www.bestbuy.com/recycle","41.4179671","-82.6729","19.8680738849456","Large Household Appliances; Refrigerators; Televisions; AC Power Plugs; Batteries (Rechargeable); Cables & Connectors; Car Audio/Video Equipment; Cell Phone Batteries; Cell Phones; Computer (Recycling); Hard Drives; Computer Monitors; Cameras; DVD Players/Blu-Ray Players/DVRs; Electronics; E-Readers; GPS Units; Headphones; Inkjet Printer Cartridges; Laptop Computers; Laser Toner Cartridges; Li-Ion Batteries; MP3 Players; Network Equipment; Ni-Cd Batteries; Ni-MH Batteries; Ni-Zn Batteries; Computer Peripherals; Portable Media Players; Printers/Scanners/Fax Machines; Small Electronics; Small Sealed Lead Acid Batteries; Stereo Equipment; Tablets; Telephones; UPS Batteries/Backup Systems; VCRs; Video Game Systems; Blu-Ray Players; Digital Converter Boxes; Small Televisions; Video Game Consoles; PlayStation Consoles","true","true","2 TVs per visit, 3 e-waste items per day; $25 fee for TVs and Monitors; $19.99 pick-up fee with delivery; $99.99 standalone pickup fee; ","Sony, Vizio, OEM","false","false","false","false"
"Best Buy","","4210 Milan Rd","Sandusky","","OH","44870","4196211877","0","","https://www.bestbuy.com/site/services/recycling/pcmcat149900050025.c?id=pcmcat149900050025","41.4179671","-82.6729","19.8680738849456","","false","false","","","false","false","false","false"
"Ottawa County Household Hazardous Waste Collection","","Route 163 Scenic","Oak Harbor","","OH","43449","4193347222","0","","https://www.recycleoss.net/?page=household-hazardous-waste","41.5086216","-83.1259928","19.8780655049066","","false","false","","","false","false","false","false"
"Margaretta Township Christmas Tree Drop-off","","316 E Lucas St","Castalia","","OH","44824","4196845549","0","","http://www.erie-county-ohio.net/","41.3960229","-82.8034325","19.8800966064814","","false","false","","","false","false","false","false"
"Margaretta Township Recycling Drop-Off Site","","316 E Lucas St","Castalia","","OH","44824","4194337303","0","","http://www.eriecountyrecycles.org/","41.3960229","-82.8034325","19.8800966064814","","false","false","","","false","false","false","false"
"Put-In-Bay Township Recycling Drop-Off Site","","624 Trenton Ave","Put-in-bay","","OH","43456","4192852292","0","","https://www.recycleoss.net/?page=ottawa-county-map","41.6471258","-82.8332793","2.59731964233216","","false","false","","","false","false","false","false"
"Firestone Complete Auto Care","","4320 Milan Rd","Sandusky","","OH","44870","4196256571","0","","https://www.firestonecompleteautocare.com/","41.4160169","-82.6710016","20.0302598393517","","false","false","","","false","false","false","false"
"Sears","Sears","4314 Milan Rd Ste 600","Sandusky","Erie","OH","44870","4196274751","0","","http://www.sears.com/","41.41469","-82.67048","20.1252756837446","Cell Phones; Ni-Cd Batteries; Li-Ion Batteries; Ni-MH Batteries; Ni-Zn Batteries; Small Sealed Lead Acid Batteries; Video Game Consoles; PlayStation Consoles","false","true","The U.S. EPA estimates that more than 350 million rechargeable batteries are purchased annually in the U.S. Thanks to the environmental commitment of this location, its easy and free to recycle your batteries. Bring your rechargeable batteries to this location and look for the recycling box or ask an associate how you can do your part for the environment.","","false","false","false","false"
"Firestone Complete Auto Care Store","Firestone Complete Auto Care Store","4320 Milan Rd","Sandusky","Erie","OH","44870","4198710995","0","","http://www.firestonecompleteautocare.com/","41.41413","-82.66986","20.1733501108421","Lead Acid (Pb) Batteries; Used Motor Oil; Video Game Consoles; PlayStation Consoles","false","true","","","false","false","false","false"
"OfficeMax","OfficeMax","4314 Milan Rd","Sandusky","Erie","OH","44870","4196249714","0","Monday: 8:00 AM - 9:00 PM Tuesday: 8:00 AM - 9:00 PM Wednesday: 8:00 AM - 9:00 PM Thursday: 8:00 AM - 9:00 PM Friday: 8:00 AM - 9:00 PM Saturday: 9:00 AM - 9:00 PM Sunday: 11:00 AM - 6:00 PM ","http://www.officemax.com","41.41411","-82.66984","20.1750244787571","Inkjet Printer Cartridges; Laser Toner Cartridges; Video Game Consoles; PlayStation Consoles","false","true","","","false","false","false","false"
"Call2Recycle at RadioShack","Call2Recycle at RadioShack","4314 Milan Rd Ste 590","Sandusky","Erie","OH","44870","4196266805","0","","http://www.radioshack.com/","41.41411","-82.66984","20.1750244787571","Cell Phones; Ni-Cd Batteries; Li-Ion Batteries; Ni-MH Batteries; Ni-Zn Batteries; Small Sealed Lead Acid Batteries; Video Game Consoles; PlayStation Consoles","false","true","As the first national retailer to partner with Call2Recycle, RadioShack is at the forefront of the rechargeable battery recycling cause and is pleased to offer battery recycling at thousands of convenient RadioShack locations for free.  Simply drop them off at your local RadioShack and theyll take care of the rest.  Ask a store associate for more details.","","false","false","false","false"
"RadioShack","RadioShack","4314 Milan Rd Ste 590","Sandusky","Erie","OH","44870","4196266805","0","Monday: 10:00 AM - 9:00 PM Tuesday: 10:00 AM - 9:00 PM Wednesday: 10:00 AM - 9:00 PM Thursday: 10:00 AM - 9:00 PM Friday: 10:00 AM - 9:00 PM Saturday: 10:00 AM - 9:00 PM Sunday: 11:00 AM - 6:00 PM ","http://www.radioshack.com","41.41411","-82.66984","20.1750244787571","Ni-Cd Batteries; Batteries (Rechargeable); Video Game Consoles; PlayStation Consoles","false","true","This site is located in Sandusky Mall.","","false","false","false","false"
"Sandusky Mall 1","Sandusky Mall 1","4314 Milan Rd","Sandusky","Erie","OH","44870","8583244111","0","","http://www.ecoatm.com/","41.41411","-82.66984","20.1750244787571","Cell Phones; Tablets; MP3 Players; Video Game Consoles; PlayStation Consoles","false","true","ecoATM is an automated, consumer self-serve kiosk that quickly buys back and recycles old phones, mp3 players and tablets.
</br>
Call or email <a href="mailto:max@ecoATM.com">customer support</a> with questions.","","false","false","false","false"
"Huron Township Recycling Drop-Off Site","","3910 E Perkins Ave","Huron","","OH","44839","4194337303","0","","http://www.eriecountyrecycles.org/","41.417656","-82.6473605","20.4309932878917","","false","false","","","false","false","false","false"
"Sam's Club","Sam's Club","614 Crossings Rd","Sandusky","Erie","OH","44870","4196266563","0","","http://www.samsclub.com","41.40875","-82.66444","20.6248792995139","Lead Acid (Pb) Batteries; Video Game Consoles; PlayStation Consoles","false","true","","","false","false","false","false"
"Home Depot","Home Depot","715 Crossings Rd","Sandusky","Erie","OH","44870","4196266493","0","","http://www.homedepot.com","41.40875","-82.66444","20.6248792995139","Compact Fluorescent Lights; Batteries (Rechargeable); Video Game Consoles; PlayStation Consoles","false","true","Home Depot accepts compact fluorescent bulbs and used power tool rechargeable batteries. Look for the orange drop boxes, usually located near the front entrance near the customer service desk.","","false","false","false","false"
"Call2Recycle at the Home Depot","Call2Recycle at the Home Depot","715 Crossings Rd","Sandusky","Erie","OH","44870","4196266493","0","","http://www.homedepot.com/","41.40875","-82.66444","20.6248792995139","Cell Phones; Compact Fluorescent Lights; Ni-Cd Batteries; Li-Ion Batteries; Ni-MH Batteries; Ni-Zn Batteries; Small Sealed Lead Acid Batteries; Video Game Consoles; PlayStation Consoles","false","true","The Home Depot accepts used rechargeable batteries and compact fluorescent bulbs. Look for the orange drop boxes, usually located near the front entrance near the customer service desk, or ask a store associate for more details.","","false","false","false","false"
"Staples","Staples","5500 Milan Road","Sandusky","Erie County","OH","44870","4196268077","0","Monday: 8:00 AM - 9:00 PM Tuesday: 8:00 AM - 9:00 PM Wednesday: 8:00 AM - 9:00 PM Thursday: 8:00 AM - 9:00 PM Friday: 8:00 AM - 9:00 PM Saturday: 9:00 AM - 9:00 PM Sunday: 10:00 AM - 6:00 PM ","https://www.staples.com/recycle","41.4069668","-82.6590602","20.8481669733479","AC Power Plugs; Batteries (Rechargeable); Cables & Connectors; Cell Phone Batteries; Cell Phones; Computer (Recycling); Hard Drives; Computer Monitors; Cameras; DVD Players/Blu-Ray Players/DVRs; Electronics; E-Readers; GPS Units; Headphones; Inkjet Printer Cartridges; Laptop Computers; Laser Toner Cartridges; Li-Ion Batteries; MP3 Players; Network Equipment; Ni-Cd Batteries; Ni-MH Batteries; Ni-Zn Batteries; Computer Peripherals; Portable Media Players; Printers/Scanners/Fax Machines; Small Electronics; Small Sealed Lead Acid Batteries; Stereo Equipment; Tablets; Telephones; UPS Batteries/Backup Systems; VCRs; Video Game Systems; Blu-Ray Players; Digital Converter Boxes; Video Game Consoles; PlayStation Consoles; Alkaline/Single-Use Batteries","false","true","NO TVs; Limit 6 CEDs per day; ","Sony, Vizio, OEM","false","false","false","false"
"Walmart Supercenter","","5500 Milan Rd","Sandusky","","OH","44870","4196278778","0","","https://www.walmart.com/","41.4069668","-82.6590602","20.8481669734313","","false","false","","","false","false","false","false"
"Staples","","5500 Milan Road","Sandusky","","OH","44870","4196268077","0","","https://www.staples.com/sbd/cre/marketing/sustainability-center/recycling-services/","41.4069668","-82.6590602","20.8481669734313","Alkaline/Single-Use Batteries; Batteries (Rechargeable); Cell Phone Batteries; Li-Ion Batteries; Ni-Cd Batteries; Ni-MH Batteries; Small Sealed Lead Acid Batteries; Alkaline/Single-Use Batteries; Button Batteries; Non-rechargeable lithium batteries; Cell Phones","false","true","","Call2Recycle","false","false","false","false"
"Lowe's","","5500 Milan Rd","Sandusky","","OH","44870","4196246000","0","","https://newsroom.lowes.com/responsibility/operational-excellence/","41.4069668","-82.6590602","20.8481669734313","","false","false","","","false","false","false","false"
"Home Depot","","715 Crossings Rd","Sandusky","","OH","44870","4196266493","0","","https://ecooptions.homedepot.com/","41.4033509","-82.665375","20.9502559341036","Batteries (Rechargeable); Cell Phone Batteries; Li-Ion Batteries; Ni-Cd Batteries; Ni-MH Batteries; Small Sealed Lead Acid Batteries","false","true","","Call2Recycle","false","false","false","false"
