name,description,address,city,region,province,postal_code,phone,fax,hours,url,latitude,longitude,distance,materials,pickup,dropoff,notes,groups,curbside,municipal,national,event_only
"USPS Post Office Box Lobby Recycling Program","US Post Office","51666 Main St","Jerusalem","Monroe","OH","43747","8002758777","0","","https://www.usps.com/","39.85081","-81.10052","10.6739076692629","Catalogs; Greeting Cards; Magazines; Paper (Mixed)","false","true","","","false","false","false","false"
"JB Green Team Household Hazardous Waste Collection","","","St Clairsville","","OH","43950","7402965376","0","","https://www.jbgreenteam.org/","40.0803199","-80.90176","10.7779120232986","","false","false","","","false","false","false","false"
"USPS Post Office Box Lobby Recycling Program","US Post Office","52731 Ohio Ave","Beallsville","Monroe","OH","43716","8002758777","0","","https://www.usps.com/","39.8487","-81.03749","10.9945555104664","Catalogs; Greeting Cards; Magazines; Paper (Mixed)","false","true","","","false","false","false","false"
"US Post Office","USPS Discarded Lobby Mail Recycling Program","52731 Ohio Ave","Beallsville","Monroe","OH","43716","0","0","","","39.8487","-81.03749","10.9945555104664","Video Game Consoles; PlayStation Consoles","false","true","","","false","false","false","false"
"JB Green Team Recycling Drop-Off - St. Clairsville","","St Clair St & Neff","St Clairsville","","OH","43950","7402965376","0","","https://www.jbgreenteam.org/recycling/acceptable-materials","40.0737033","-80.8905723","11.0945534608189","","false","false","","","false","false","false","false"
"JB Green Team Recycling Drop-Off - Fairpoint","","Township garage 71240 Main St","Fairpoint","","OH","43927","7402965376","0","","https://www.jbgreenteam.org/recycling/acceptable-materials","40.1219274","-80.9361139","11.1169744544284","","false","false","","","false","false","false","false"
"Quaker City Recycling Drop-Off Site","","E Main St","Quaker City","","OH","43773","7407325493","0","","https://wasteabate.org/","39.9721551","-81.2945065","11.5813153677961","","false","false","","","false","false","false","false"
"Lowe's","","50421 Valley Plaza Dr","St Clairsville","","OH","43950","7406993000","0","","https://newsroom.lowes.com/responsibility/operational-excellence/","40.0725206","-80.8791142","11.6111376644452","","false","false","","","false","false","false","false"
"Staples","Staples","50585 Valley Plaza Drive","St. Clairsville","Belmont County","OH","43950","7406959647","0","Monday: 9:00 AM - 9:00 PM Tuesday: 9:00 AM - 9:00 PM Wednesday: 9:00 AM - 9:00 PM Thursday: 9:00 AM - 9:00 PM Friday: 9:00 AM - 9:00 PM Saturday: 10:00 AM - 7:00 PM Sunday: 11:00 AM - 6:00 PM ","https://www.staples.com/recycle","40.0749297","-80.8776792","11.748382825016","AC Power Plugs; Batteries (Rechargeable); Cables & Connectors; Cell Phone Batteries; Cell Phones; Computer (Recycling); Hard Drives; Computer Monitors; Cameras; DVD Players/Blu-Ray Players/DVRs; Electronics; E-Readers; GPS Units; Headphones; Inkjet Printer Cartridges; Laptop Computers; Laser Toner Cartridges; Li-Ion Batteries; MP3 Players; Network Equipment; Ni-Cd Batteries; Ni-MH Batteries; Ni-Zn Batteries; Computer Peripherals; Portable Media Players; Printers/Scanners/Fax Machines; Small Electronics; Small Sealed Lead Acid Batteries; Stereo Equipment; Tablets; Telephones; UPS Batteries/Backup Systems; VCRs; Video Game Systems; Blu-Ray Players; Digital Converter Boxes; Video Game Consoles; PlayStation Consoles; Alkaline/Single-Use Batteries","false","true","NO TVs; Limit 6 CEDs per day; ","Sony, Vizio, OEM","false","false","false","false"
"Staples","","50585 Valley Plaza Drive","Saint Clairsville","","OH","43950","7406959647","0","","https://www.staples.com/sbd/cre/marketing/sustainability-center/recycling-services/","40.0750256","-80.8776445","11.7527925298043","","false","false","","","false","false","false","false"
"Staples","","50585 Valley Plaza Drive","St. Clairsville","","OH","43950","7406959647","0","","https://www.staples.com/sbd/cre/marketing/sustainability-center/recycling-services/","40.0750256","-80.8776445","11.7527925298043","Alkaline/Single-Use Batteries","false","true","","","false","false","false","false"
"Zanesville Welfare Organization and Goodwill Industries Inc. - Dell Reconnect Donation Site","","50613 Valley Plaza Drive","St. Clairsville","","OH","43950","7406952335","0","","https://www.ohwvagoodwill.org/","40.074616","-80.8736252","11.9350920318366","","false","false","","","false","false","false","false"
"Walmart","Walmart","50739 Valley Plaza Dr","Saint Clairsville","Belmont","OH","43950","7406958410","0","","http://www.walmart.com","40.07674","-80.87165","12.0903400446001","Lead Acid (Pb) Batteries; Plastic Shopping Bags; Food Storage Bags; Video Game Consoles; PlayStation Consoles","false","true","","","false","false","false","false"
"Walmart Tire & Lube Express","Walmart Tire & Lube Express","50739 Valley Plaza Dr","Saint Clairsville","Belmont","OH","43950","7406958410","0","","http://www.walmart.com/catalog/catalog.gsp?cat=495843","40.07674","-80.87165","12.0903400446001","Lead Acid (Pb) Batteries; Used Motor Oil; Oil Filters; Video Game Consoles; PlayStation Consoles","false","true","","","false","false","false","false"
"The UPS Store","The UPS Store","50815 Valley Plaza Dr","Saint Clairsville","Belmont","OH","43950","7406954333","0","Monday: 9:00 AM - 6:30 PM Tuesday: 9:00 AM - 6:30 PM Wednesday: 9:00 AM - 6:30 PM Thursday: 9:00 AM - 6:30 PM Friday: 9:00 AM - 6:30 PM Saturday: 10:00 AM - 2:00 PM ","http://www.upsstore.com","40.07674","-80.87165","12.0903400446001","Cardboard; Plastics (Other); Packing Peanut (Reuse); Video Game Consoles; PlayStation Consoles","false","true","","","false","false","false","false"
"Call2Recycle at RadioShack","Call2Recycle at RadioShack","67800 Mall Ring Rd","Saint Clairsville","Belmont","OH","43950","6146954322","0","","http://www.radioshack.com/","40.07674","-80.87165","12.0903400446001","Cell Phones; Ni-Cd Batteries; Li-Ion Batteries; Ni-MH Batteries; Ni-Zn Batteries; Small Sealed Lead Acid Batteries; Video Game Consoles; PlayStation Consoles","false","true","As the first national retailer to partner with Call2Recycle, RadioShack is at the forefront of the rechargeable battery recycling cause and is pleased to offer battery recycling at thousands of convenient RadioShack locations for free.  Simply drop them off at your local RadioShack and theyll take care of the rest.  Ask a store associate for more details.","","false","false","false","false"
"Sam's Club","Sam's Club","50555 Valley Plaza Dr","Saint Clairsville","Belmont","OH","43950","7406950198","0","","http://www.samsclub.com","40.07674","-80.87165","12.0903400446001","Lead Acid (Pb) Batteries; Video Game Consoles; PlayStation Consoles","false","true","","","false","false","false","false"
"RadioShack","RadioShack","67800 Mall Ring Rd","Saint Clairsville","Belmont","OH","43950","7406954322","0","Monday: 10:00 AM - 9:00 PM Tuesday: 10:00 AM - 9:00 PM Wednesday: 10:00 AM - 9:00 PM Thursday: 10:00 AM - 9:00 PM Friday: 10:00 AM - 9:00 PM Saturday: 10:00 AM - 9:00 PM Sunday: 11:00 AM - 6:00 PM ","http://www.radioshack.com","40.07674","-80.87165","12.0903400446001","Cell Phones; Ni-Cd Batteries; Batteries (Rechargeable); Cell Phone Batteries; Video Game Consoles; PlayStation Consoles","false","true","This site is located in Ohio Valley Mall.","","false","false","false","false"
"Monro","Monro","50530 Valley Centre Blvd","Saint Clairsville","Belmont","OH","43950","7406990238","0","Monday: 7:30 AM - 7:00 PM Tuesday: 7:30 AM - 7:00 PM Wednesday: 7:30 AM - 7:00 PM Thursday: 7:30 AM - 7:00 PM Friday: 7:30 AM - 7:00 PM Saturday: 7:30 AM - 4:00 PM ","http://monro.com","40.07674","-80.87165","12.0903400446001","Used Motor Oil; Video Game Consoles; PlayStation Consoles","false","true","","","false","false","false","false"
"AT&T Wireless","AT&T Wireless","67800 Mall Ring Rd","St.Clairsville,","Belmont","OH","43950","7406955300","0","","http://www.att.com/","40.07674","-80.87165","12.0903400446001","Cell Phones; Ni-Cd Batteries; Batteries (Rechargeable); Cell Phone Batteries; Tablets; Li-Ion Batteries; Video Game Consoles; PlayStation Consoles","false","true","Receive an AT&T Promotion Card worth the trade-in value of your smartphone, tablet, or netbook. You can also donate the trade-in value to Cell Phones for Soldiers.","","false","false","false","false"
"Call2Recycle at Lowe's","Call2Recycle at Lowe's","50421 Valley Plaza Dr","Saint Clairsville","Belmont","OH","43950","7406993000","0","Monday: 6:00 AM - 10:00 PM Tuesday: 6:00 AM - 10:00 PM Wednesday: 6:00 AM - 10:00 PM Thursday: 6:00 AM - 10:00 PM Friday: 6:00 AM - 10:00 PM Saturday: 6:00 AM - 10:00 PM Sunday: 8:00 AM - 8:00 PM ","http://www.lowes.com/","40.07674","-80.87165","12.0903400446001","Cell Phones; Compact Fluorescent Lights; Ni-Cd Batteries; Plastic Shopping Bags; Li-Ion Batteries; Ni-MH Batteries; Ni-Zn Batteries; Small Sealed Lead Acid Batteries; Video Game Consoles; PlayStation Consoles; Batteries (Rechargeable); Cell Phone Batteries; Li-Ion Batteries; Ni-Cd Batteries; Ni-MH Batteries; Small Sealed Lead Acid Batteries; Cell Phones","false","true","As an environmentally-committed retailer, Lowes offers a recycling center near store entrances to give consumers a free and easy way to properly dispose of rechargeable batteries, cell phones, CFLs and plastic shopping bags; materials that otherwise could be potentially harmful to the environment.  Look for the recycling center or ask a store associate for more details.","Call2Recycle","false","false","false","false"
"OH Valley Mall 1","OH Valley Mall 1","67800 Mall Ring Rd Ofc 295","Saint Clairsville","Belmont","OH","43950","8583244111","0","","http://www.ecoatm.com/","40.07674","-80.87165","12.0903400446001","Cell Phones; Tablets; MP3 Players; Video Game Consoles; PlayStation Consoles","false","true","ecoATM is an automated, consumer self-serve kiosk that quickly buys back and recycles old phones, mp3 players and tablets.
</br>
Call or email <a href="mailto:max@ecoATM.com">customer support</a> with questions.","","false","false","false","false"
"OH Valley Mall 2","OH Valley Mall 2","67800 Mall Ring Rd Ofc 295","Saint Clairsville","Belmont","OH","43950","8583244111","0","","http://www.ecoatm.com/","40.07674","-80.87165","12.0903400446001","Cell Phones; Tablets; MP3 Players; Video Game Consoles; PlayStation Consoles","false","true","ecoATM is an automated, consumer self-serve kiosk that quickly buys back and recycles old phones, mp3 players and tablets.
</br>
Call or email <a href="mailto:max@ecoATM.com">customer support</a> with questions.","","false","false","false","false"
"Verizon Wireless","Verizon Wireless","50641 Valley Plaza Dr","Saint Clairsville","Belmont","OH","43950","8666444532","0","","http://www.verizonwireless.com/","40.07674","-80.87165","12.0903400446001","Cell Phones; Cell Phone Batteries; Video Game Consoles; PlayStation Consoles","false","true","<A Href="https://www.trade-in.vzw.com/home.aspx">
The Verizon Wireless Trade-In Program</A> allows you to trade in your used handset or tablet in a convenient and responsible way. 
<P>
<P>
Verizon Wireless works every day to protect our environment and give our customers opportunities to do the same. <A Href="http://aboutus.vzw.com/Green_Initiative/overview.html">Click here</A> for more examples of the earth-friendly initiatives and programs Verizon Wireless is proud to offer and support.","","false","false","false","false"
"AutoZone","AutoZone","50879 National Rd E","Saint Clairsville","Belmont","OH","43950","7406953022","0","","http://www.autozone.com","40.07735","-80.87169","12.1058332468166","Lead Acid (Pb) Batteries; Used Motor Oil; Video Game Consoles; PlayStation Consoles","false","true","Most AutoZone stores accept used motor oil, transmission fluid, gear oil and automotive batteries. Call to see what your local store is currently accepting.","","false","false","false","false"
"New Athens Recycling Drop-Off","","Ohio 519","New Athens","","OH","43981","0","0","","http://www.recyclingmakessense.org/","40.1849189","-80.9958244","13.2331811178723","","false","false","","","false","false","false","false"
"JB Green Team Recycling Drop-Off - Neffs","","Neffs VFD 54044 Pike St","Neffs","","OH","43906","7402965376","0","","https://www.jbgreenteam.org/recycling/acceptable-materials","40.0270219","-80.8142432","14.1392433603546","","false","false","","","false","false","false","false"
"Call2Recycle at Modern Hardware","Call2Recycle at Modern Hardware","104 S Sycamore St","Woodsfield","Monroe","OH","43793","6144721629","0","","http://www.radioshack.com/","39.76246","-81.11729","16.8390924192924","Cell Phones; Ni-Cd Batteries; Li-Ion Batteries; Ni-MH Batteries; Ni-Zn Batteries; Small Sealed Lead Acid Batteries; Video Game Consoles; PlayStation Consoles","false","true","The U.S. EPA estimates that more than 350 million rechargeable batteries are purchased annually in the U.S. Thanks to the environmental commitment of this location, its easy and free to recycle your batteries. Bring your rechargeable batteries to this location and look for the recycling box or ask an associate how you can do your part for the environment.","","false","false","false","false"
"Nile Township Recycling Drop-Off Site","","12215 West 52nd Street","Shadyside","","OH","43947","7405321231","0","","http://www.lsswmd.org","39.965517","-80.7613902","17.071142417366","","false","false","","","false","false","false","false"
"Freeport Recycling Drop-Off Site","","Rte 800","Freeport","","OH","43973","3306277311","0","","http://www.recyclingmakessense.org/","40.2102756","-81.2661378","17.2937658440269","","false","false","","","false","false","false","false"
"Kroger","Kroger","400 28th St","Bellaire","Belmont","OH","43906","7406761181","0","Sunday: 12:00 AM - 11:59 PM Monday: 12:00 AM - 11:59 PM Tuesday: 12:00 AM - 11:59 PM Wednesday: 12:00 AM - 11:59 PM Thursday: 12:00 AM - 11:59 PM Friday: 12:00 AM - 11:59 PM Saturday: 12:00 AM - 11:59 PM ","http://www.kroger.com","40.01055","-80.74772","17.5803575625445","Plastic Shopping Bags; Food Storage Bags; Video Game Consoles; PlayStation Consoles","false","true","","","false","false","false","false"
"Winterset Recycling Drop-Off Site","","Madison Township Building","Winterset","","OH","43755","7407325493","0","","https://wasteabate.org/","40.1061363","-81.3846282","17.5821616175117","","false","false","","","false","false","false","false"
"Advance Auto Parts","Advance Auto Parts","916 National Rd","Bridgeport","Belmont","OH","43912","7406332181","0","Monday: 7:00 AM - 9:00 PM Tuesday: 7:00 AM - 9:00 PM Wednesday: 7:00 AM - 9:00 PM Thursday: 7:00 AM - 9:00 PM Friday: 7:00 AM - 9:00 PM Saturday: 7:00 AM - 9:00 PM Sunday: 10:00 AM - 8:00 PM ","http://www.advanceautoparts.com","40.07076","-80.75802","17.6278422017719","Lead Acid (Pb) Batteries; Used Motor Oil; Video Game Consoles; PlayStation Consoles","false","true","","","false","false","false","false"
"JB Green Team Recycling Drop-Off - Bellaire","","400 28th St","Bellaire","","OH","43906","7402965376","0","","https://www.jbgreenteam.org/recycling/acceptable-materials","40.0112766","-80.7467316","17.6338193971283","","false","false","","","false","false","false","false"
"Advance Auto Parts","Advance Auto Parts","210 28th St ","Bellaire","Belmont County","OH","43906","7406719588","0","Monday: 7:00 AM - 9:00 PM Tuesday: 7:00 AM - 9:00 PM Wednesday: 7:00 AM - 9:00 PM Thursday: 7:00 AM - 9:00 PM Friday: 7:00 AM - 9:00 PM Saturday: 7:00 AM - 9:00 PM Sunday: 10:00 AM - 8:00 PM ","http://www.advanceautoparts.com","40.0115751","-80.7466572","17.6382773278661","Lead Acid (Pb) Batteries; Used Motor Oil; Video Game Consoles; PlayStation Consoles","false","true","","","false","false","false","false"
"Marshall County Household Hazardous Waste Event","","","Glen Dale","","WV","26038","0","0","","","39.9478531","-80.7542054","17.6785067119547","","false","false","","","false","false","false","false"
"JB Green Team Recycling Drop-Off - Shadyside","","Municipal Garage East 40th St.","Shadyside","","OH","43947","7402965376","0","","https://www.jbgreenteam.org/recycling/acceptable-materials","39.9696137","-80.7483155","17.7137259885352","","false","false","","","false","false","false","false"
"Electronic Recycling Services","","1731 Belmont St","Bellaire","","OH","43906","3047806678","0","","","40.003777","-80.744745","17.7337492827685","","false","false","","","false","false","false","false"
"Tricor Industrial Inc.","","3737 Noble Street","Bellaire","","OH","43906","7406765010","0","","https://www.truevalue.com/","40.0203278","-80.7436353","17.8238899322481","","false","false","","","false","false","false","false"
"AutoZone","AutoZone","825 Main St","Bridgeport","Belmont","OH","43912","7406338892","0","","http://www.autozone.com","40.07072","-80.75403","17.8310354178421","Lead Acid (Pb) Batteries; Used Motor Oil; Video Game Consoles; PlayStation Consoles","false","true","Most AutoZone stores accept used motor oil, transmission fluid, gear oil and automotive batteries. Call to see what your local store is currently accepting.","","false","false","false","false"
"Tricor Industrial Inc.","Tricor Industrial Inc.","3737 Noble St ","Bellaire","Belmont County","OH","43906","7406765010","0","","http://www.truevalue.com","40.0204162","-80.7432116","17.8466324103808","Transmission Fluid; Used Motor Oil; Video Game Consoles; PlayStation Consoles","false","true","","","false","false","false","false"
"JB Green Team Recycling Drop-Off - Adena","","570 W Main St","Adena","","OH","43901","7402838614","0","","https://www.jbgreenteam.org/recycling/acceptable-materials","40.2148515","-80.8811508","17.9292622452062","","false","false","","","false","false","false","false"
"AutoZone","AutoZone","106 Lafayette Ave","Moundsville","Marshall","WV","26041","3048450225","0","","http://www.autozone.com","39.93025","-80.75163","18.1197106754902","Lead Acid (Pb) Batteries; Used Motor Oil; Video Game Consoles; PlayStation Consoles","false","true","Most AutoZone stores accept used motor oil, transmission fluid, gear oil and automotive batteries. Call to see what your local store is currently accepting.","","false","false","false","false"
"Ked's Ace Hardware","Ked's Ace Hardware","134 Lafayette Ave","Moundsville","Marshall","WV","26041","3048451400","0","Monday: 7:30 AM - 8:00 PM Tuesday: 7:30 AM - 8:00 PM Wednesday: 7:30 AM - 8:00 PM Thursday: 7:30 AM - 8:00 PM Friday: 7:30 AM - 8:00 PM Saturday: 7:30 AM - 5:00 PM Sunday: 10:00 AM - 3:00 PM ","http://www.acehardware.com/","39.93025","-80.75163","18.1197106754902","Cell Phones; Ni-Cd Batteries; Li-Ion Batteries; Ni-MH Batteries; Ni-Zn Batteries; Small Sealed Lead Acid Batteries; Video Game Consoles; PlayStation Consoles","false","true","The U.S. EPA estimates that more than 350 million rechargeable batteries are purchased annually in the U.S. Thanks to the environmental commitment of this location, its easy and free to recycle your batteries. Bring your rechargeable batteries to this location and look for the recycling box or ask an associate how you can do your part for the environment.","","false","false","false","false"
"Goodwill Industries","Goodwill Industries","319 Lafayette Ave ","Moundsville","Marshall County","WV","26041","3048435347","0","Monday: 10:00 AM - 6:30 PM Tuesday: 10:00 AM - 6:30 PM Wednesday: 10:00 AM - 6:30 PM Thursday: 10:00 AM - 6:30 PM Friday: 10:00 AM - 6:30 PM Saturday: 10:00 AM - 6:30 PM Sunday: 12:00 PM - 6:30 PM ","http://www.goodwill.org","39.925908","-80.7504742","18.2658534329229","Bikes; Books (Reuse); Clothing; CD/DVD/Blu-ray/UHD discs; Computer (Reuse); Electronics; Hard Drives; Gift Bags; Eyeglasses; Household Goods; Musical Instruments; Ornaments; Reusable Appliance Donation; Sporting Goods; Miscellaneous Tools; Children's Toys; MP3 Players; Video Game Consoles; PlayStation Consoles","false","true","This site accepts clean items that are in good condition. It does not accept broken items.","","false","false","false","false"
"Automatic Recycling","Automatic Recycling","Benwood Industrial Pk ","Benwood","","WV","26031","3042325175","0","","http://www.strauss-ind.com","40.0181288","-80.7342493","18.3114956278918","Car; Large Household Appliances; Scrap Metal; Video Game Consoles; PlayStation Consoles","false","true","","","false","false","false","false"
"Walmart Supercenter","","10 Walmart Dr","Moundsville","","WV","26041","3048431580","0","","https://www.walmart.com/","39.9268005","-80.7488099","18.3317610082659","","false","false","","","false","false","false","false"
"Walmart Tire and Lube Express","","10 Walmart Dr","Moundsville","","WV","26041","3048431580","0","","https://www.walmart.com/cp/ideas/8932632","39.9268005","-80.7488099","18.3317610082659","","false","false","","","false","false","false","false"
"Zanesville Welfare Organization and Goodwill Industries Inc. - Dell Reconnect Donation Site","","319 Lafayette Drive","Moundsville","","WV","26041","3048435347","0","","https://www.ohwvagoodwill.org/","39.9220762","-80.7504551","18.3477059957555","","false","false","","","false","false","false","false"
"JB Green Team Recycling Drop-Off - Bridgeport","","201 Main Street","Bridgeport","","OH","43912","7402965376","0","","https://www.jbgreenteam.org/recycling/acceptable-materials","40.0719628","-80.740989","18.5198749222994","","false","false","","","false","false","false","false"
"RadioShack","RadioShack","217 Marshall St N","Benwood","Marshall","WV","26031","3042324191","0","Monday: 9:00 AM - 9:00 PM Tuesday: 9:00 AM - 9:00 PM Wednesday: 9:00 AM - 9:00 PM Thursday: 9:00 AM - 9:00 PM Friday: 9:00 AM - 9:00 PM Saturday: 9:00 AM - 9:00 PM Sunday: 10:00 AM - 7:00 PM ","","40.02855","-80.72872","18.6526398701798","Ni-Cd Batteries; Batteries (Rechargeable); Video Game Consoles; PlayStation Consoles","false","true","","","false","false","false","false"
"Call2Recycle at RadioShack","Call2Recycle at RadioShack","1212 Lafayette Ave","Moundsville","Marshall","WV","26041","3048450955","0","","http://www.radioshack.com/","39.90965","-80.74978","18.6669647101058","Cell Phones; Ni-Cd Batteries; Li-Ion Batteries; Ni-MH Batteries; Ni-Zn Batteries; Small Sealed Lead Acid Batteries; Video Game Consoles; PlayStation Consoles","false","true","As the first national retailer to partner with Call2Recycle, RadioShack is at the forefront of the rechargeable battery recycling cause and is pleased to offer battery recycling at thousands of convenient RadioShack locations for free.  Simply drop them off at your local RadioShack and theyll take care of the rest.  Ask a store associate for more details.","","false","false","false","false"
"RadioShack","RadioShack","1200 Lafayette Ave","Moundsville","Marshall","WV","26041","3048450955","0","Monday: 10:00 AM - 9:00 PM Tuesday: 10:00 AM - 9:00 PM Wednesday: 10:00 AM - 9:00 PM Thursday: 10:00 AM - 9:00 PM Friday: 10:00 AM - 9:00 PM Saturday: 10:00 AM - 9:00 PM Sunday: 11:00 AM - 7:00 PM ","http://www.radioshack.com","39.90965","-80.74978","18.6669647101058","Cell Phones; Ni-Cd Batteries; Batteries (Rechargeable); Video Game Consoles; PlayStation Consoles","false","true","","","false","false","false","false"
"Advance Auto Parts","Advance Auto Parts","1001 Lafayette Ave","Moundsville","Marshall","WV","26041","3048454140","0","Monday: 7:00 AM - 9:00 PM Tuesday: 7:00 AM - 9:00 PM Wednesday: 7:00 AM - 9:00 PM Thursday: 7:00 AM - 9:00 PM Friday: 7:00 AM - 9:00 PM Saturday: 7:00 AM - 9:00 PM Sunday: 10:00 AM - 8:00 PM ","http://www.advanceautoparts.com","39.90965","-80.74978","18.6669647101058","Lead Acid (Pb) Batteries; Used Motor Oil; Video Game Consoles; PlayStation Consoles","false","true","","","false","false","false","false"
"Monro","Monro","200 Marshall St N","Benwood","Marshall","WV","26031","3042321095","0","Monday: 7:30 AM - 7:00 PM Tuesday: 7:30 AM - 7:00 PM Wednesday: 7:30 AM - 7:00 PM Thursday: 7:30 AM - 7:00 PM Friday: 7:30 AM - 7:00 PM Saturday: 7:30 AM - 4:00 PM ","http://monro.com","40.03028","-80.72795","18.7039956863325","Used Motor Oil; Video Game Consoles; PlayStation Consoles","false","true","","","false","false","false","false"
"JB Green Team Recycling Drop-Off - Mt Pleasant","","156 Concord St","Mt Pleasant","","OH","43939","7402838614","0","","https://www.jbgreenteam.org/recycling/acceptable-materials","40.1746835","-80.8002964","18.8833081145375","","false","false","","","false","false","false","false"
"Walmart","Walmart","10 Walmart Dr","Moundsville","Marshall","WV","26041","3048431580","0","","http://www.walmart.com","39.9312","-80.73577","18.9088602412305","Lead Acid (Pb) Batteries; Plastic Shopping Bags; Food Storage Bags; Video Game Consoles; PlayStation Consoles","false","true","","","false","false","false","false"
"Walmart Tire & Lube Express","Walmart Tire & Lube Express","10 Walmart Dr","Moundsville","Marshall","WV","26041","3048431580","0","","http://www.walmart.com/catalog/catalog.gsp?cat=495843","39.9312","-80.73577","18.9088602412305","Lead Acid (Pb) Batteries; Used Motor Oil; Oil Filters; Video Game Consoles; PlayStation Consoles","false","true","","","false","false","false","false"
"Lowe's","","2801 Chapline St","Wheeling","","WV","26003","3042382000","0","","https://newsroom.lowes.com/responsibility/operational-excellence/","40.0528926","-80.7266389","18.9821228355261","Batteries (Rechargeable); Cell Phone Batteries; Li-Ion Batteries; Ni-Cd Batteries; Ni-MH Batteries; Small Sealed Lead Acid Batteries; Cell Phones","false","true","","Call2Recycle","false","false","false","false"
