name,description,address,city,region,province,postal_code,phone,fax,hours,url,latitude,longitude,distance,materials,pickup,dropoff,notes,groups,curbside,municipal,national,event_only
"Mechanicstown Recycling Drop-Off Site","","Rte 39","Mechanicstown","","OH","44651","3306277311","0","","http://www.recyclingmakessense.org/","40.6172492","-80.9403062","1.26803513843512","","false","false","","","false","false","false","false"
"Paulette Recycling","Paulette Recycling","6210 Canton Rd NW","Malvern","Carroll","OH","44644","3308630692","0","Tuesday: 9:00 AM - 5:00 PM Wednesday: 9:00 AM - 5:00 PM Thursday: 9:00 AM - 5:00 PM ","","40.67091","-81.14202","10.063554225023","Aluminum Cans; Aluminum; Lead Acid (Pb) Batteries; Non-ferrous (Copper/Brass/Tin); Video Game Consoles; PlayStation Consoles","false","true","","","false","false","false","false"
"AutoZone","AutoZone","1049 Alliance Rd NW","Minerva","Carroll","OH","44657","3308683753","0","","http://www.autozone.com","40.71955","-81.11103","10.139839693068","Lead Acid (Pb) Batteries; Used Motor Oil; Video Game Consoles; PlayStation Consoles","false","true","Most AutoZone stores accept used motor oil, transmission fluid, gear oil and automotive batteries. Call to see what your local store is currently accepting.","","false","false","false","false"
"Minerva Recycling Drop-Off Site","","505 E. Lincoln Way","Beach City","","OH","44657","8006789839","0","","https://www.timetorecycle.org/404-2/","40.7314331","-81.0983587","10.1698645351548","","false","false","","","false","false","false","false"
"AutoZone","","1049 Alliance Rd NW","Minerva","","OH","44657","3308683753","0","","https://www.autozone.com/landing/page.jsp?name=in-our-stores","40.718009","-81.1137895","10.1908651422337","","false","false","","","false","false","false","false"
"Imperial Aluminum","Imperial Aluminum","217 Roosevelt St","Minerva","Carroll","OH","44657","3128025006","0","","http://www.imperialzinc.com","40.72138","-81.11093","10.213335618263","Aluminum; Video Game Consoles; PlayStation Consoles","false","true","","","false","false","false","false"
"Central Core, Inc.","","9450 Newton St NW","Minerva","","OH","44657","3308687811","0","","","40.7195026","-81.1189833","10.4710163234587","","false","false","","","false","false","false","false"
"Minerva True Value","","16400 Bayard Road","Minerva","","OH","44657","3308687709","0","","https://www.truevalue.com/","40.7487282","-81.0898662","10.7352366146766","","false","false","","","false","false","false","false"
"West Township Recycling Drop-Off Site","","8610 Knox-School Road","Minerva","","OH","44657","3306277311","0","","http://www.recyclingmakessense.org/","40.7768392","-81.031588","10.8612147725275","","false","false","","","false","false","false","false"
"Guilford Lake Recycling Drop-Off Site","","Rte 172","Hanoverton","","OH","44423","3306277311","0","","http://www.recyclingmakessense.org/","40.7955955","-80.9365607","11.4999084809821","","false","false","","","false","false","false","false"
"USPS Post Office Box Lobby Recycling Program","US Post Office","116 E Porter St","Malvern","Carroll","OH","44644","8002758777","0","","https://www.usps.com/","40.68962","-81.18006","12.3578550652917","Catalogs; Greeting Cards; Magazines; Paper (Mixed)","false","true","","","false","false","false","false"
"US Post Office","USPS Discarded Lobby Mail Recycling Program","116 E Porter St","Malvern","Carroll","OH","44644","0","0","","","40.68962","-81.18006","12.3578550652917","Video Game Consoles; PlayStation Consoles","false","true","","","false","false","false","false"
"Malvern Recycling Drop-Off Site","","North Reed Street","Malvern","","OH","44644","3306277311","0","","http://www.recyclingmakessense.org/","40.6916264","-81.180897","12.4458461029605","","false","false","","","false","false","false","false"
"Lake Mohawk Recycling Drop-Off Site","","Mohawk Dr SW","Carrollton","","OH","44615","3306277311","0","","http://www.recyclingmakessense.org/","40.5042568","-81.1489937","13.2698515357857","","false","false","","","false","false","false","false"
"Dellroy Recycling Drop-Off Site","","5072 Roswell Rd SW","Dellroy","","OH","44620","3306277311","0","","http://www.recyclingmakessense.org/","40.5543619","-81.1933719","13.4169829843755","","false","false","","","false","false","false","false"
"Perrysville Recycling Drop-Off Site","","Rte 164 & Rte 332","Perry","","OH","43988","3306277311","0","","http://www.recyclingmakessense.org/","40.4648058","-81.0944511","13.4767139796058","","false","false","","","false","false","false","false"
"Paris Township Drop-Off","Paris Township Drop-Off","14220 Freed St SE","Paris","Stark","OH","44669","3304517808","0","Sunday: 12:00 AM - 11:59 PM Monday: 12:00 AM - 11:59 PM Tuesday: 12:00 AM - 11:59 PM Wednesday: 12:00 AM - 11:59 PM Thursday: 12:00 AM - 11:59 PM Friday: 12:00 AM - 11:59 PM Saturday: 12:00 AM - 11:59 PM ","http://www.timetorecycle.org","40.77102","-81.1359","13.492940664148","Gift Boxes; Greeting Cards; Plastic #1 (PETE); Plastic #2 (HDPE); Plastic #2 (Color HDPE); Aluminum Cans; Glass (Brown); Cardboard; Catalogs; Christmas Trees; Glass (Clear); Glass (Green); Magazines; Paper (Mixed); Newspapers; Paperboard; Phone books; Tin or Steel Cans; Office Paper; Video Game Consoles; PlayStation Consoles","false","true","Please call for more information (800) 678-9839.","","false","false","false","false"
"Stark County Christmas Tree Drop-off - Paris Township - Township Office","","14220 Freed St SE","Paris","","OH","44669","8006789839","0","","https://www.timetorecycle.org/404-2/","40.771129","-81.1362836","13.5122715578862","","false","false","","","false","false","false","false"
"Paris Recycling Drop-Off Site","","14220 Freed St SE","Paris","","OH","44669","8006789839","0","","https://www.timetorecycle.org/404-2/","40.771129","-81.1362836","13.5122715578862","","false","false","","","false","false","false","false"
"CCH Solid Waste District Household Hazardous Waste Collection","","","Lisbon","","OH","44432","3306277311","0","","http://www.recyclingmakessense.org/","40.7720044","-80.7681336","13.9657020341387","","false","false","","","false","false","false","false"
"JWB Supply Co. Inc.","JWB Supply Co. Inc.","126 N Market St","Lisbon","Columbiana","OH","44432","3304249211","0","","http://www.call2recycle.org/","40.7725","-80.76792","13.9977107767153","Cell Phones; Ni-Cd Batteries; Li-Ion Batteries; Ni-MH Batteries; Ni-Zn Batteries; Small Sealed Lead Acid Batteries; Video Game Consoles; PlayStation Consoles","false","true","The U.S. EPA estimates that more than 350 million rechargeable batteries are purchased annually in the U.S. Thanks to the environmental commitment of this location, its easy and free to recycle your batteries. Bring your rechargeable batteries to this location and look for the recycling box or ask an associate how you can do your part for the environment.","","false","false","false","false"
"A & S Salvage","","502 County Road 50A","Hammondsville","","OH","43930","3305324654","0","","","40.5598923","-80.7072659","14.0054573409269","","false","false","","","false","false","false","false"
"JB Green Team Recycling Drop-Off - Saline","","14890 Rte 213","Hammondsville","","OH","43930","7402838614","0","","https://www.jbgreenteam.org/recycling/acceptable-materials","40.5517558","-80.709212","14.1158206795919","","false","false","","","false","false","false","false"
"A & S Salvage","A & S Salvage","State Rte. 213","Hammondsville","Jefferson","OH","43930","3305324654","0","Monday: 6:30 AM - 12:15 PM Tuesday: 6:30 AM - 12:15 PM Wednesday: 6:30 AM - 12:15 PM Thursday: 6:30 AM - 12:15 PM Friday: 6:30 AM - 12:15 PM ","http://www.salvagecompany.net/","40.5461251","-80.7099049","14.2364742550656","Plastic #2 (HDPE); Aluminum Cans; Aluminum; Automobile Parts; Ferrous Metals (Steel or Iron); Non-ferrous (Copper/Brass/Tin); Tin or Steel Cans; Office Paper; Video Game Consoles; PlayStation Consoles","false","true","","","false","false","false","false"
"Robertsville Recycling Drop-Off Site - Little Sandy Creek Ruritan","","Robertsville Avenue Southeast","Robertsville","","OH","44670","8006789839","0","","https://www.timetorecycle.org/404-2/","40.7626971","-81.1895904","15.2177020553253","","false","false","","","false","false","false","false"
"Annapolis Recycling Drop-Off Site","","Ohio 646","Hopedale","","OH","43976","0","0","","http://www.recyclingmakessense.org/","40.4077919","-80.9012566","15.6319111270579","","false","false","","","false","false","false","false"
"USPS Post Office Box Lobby Recycling Program","US Post Office","157 E Lisbon St","Waynesburg","Stark","OH","44688","8002758777","0","","https://www.usps.com/","40.66801","-81.25563","15.8327542088224","Catalogs; Greeting Cards; Magazines; Paper (Mixed)","false","true","","","false","false","false","false"
"US Post Office","USPS Discarded Lobby Mail Recycling Program","157 E Lisbon St","Waynesburg","Stark","OH","44688","0","0","","","40.66801","-81.25563","15.8327542088224","Video Game Consoles; PlayStation Consoles","false","true","","","false","false","false","false"
"Butler Township Recycling Drop-Off Site","","2974 Slater Road","Salem","","OH","44460","3306277311","0","","http://www.recyclingmakessense.org/","40.8578321","-80.9144225","15.9087648834285","","false","false","","","false","false","false","false"
"Wellsville Recycling Drop-Off Site","","1200 Main Street","Wellsville","","OH","43968","3306277311","0","","http://www.recyclingmakessense.org/","40.6007416","-80.6517238","16.1781511808958","","false","false","","","false","false","false","false"
"Sandy Township Drop-Off Site","Sandy Township Drop-Off Site","8170 Waynesburg Dr SE ","Waynesburg","Stark County","OH","44688","3304517808","0","","","40.683707","-81.261405","16.3414769191478","Gift Boxes; Greeting Cards; Plastic #1 (PETE); Plastic #2 (HDPE); Plastic #2 (Color HDPE); Aluminum Cans; Glass (Brown); Cardboard; Catalogs; Glass (Clear); Glass (Green); Magazines; Paper (Mixed); Newspapers; Paperboard; Phone books; Tin or Steel Cans; Office Paper; Video Game Consoles; PlayStation Consoles","false","true","","","false","false","false","false"
"Knox Recycling Drop-Off Site","","2895 Knox-School Road","Knox","","OH","44609","3306277311","0","","http://www.recyclingmakessense.org/","40.8608313","-81.0317351","16.4159895703482","","false","false","","","false","false","false","false"
"Sandy Township Recycling Drop-Off Site - American Landfill","","7916 Chapel St SE","Waynesburg","","OH","44688","8006789839","0","","https://www.timetorecycle.org/404-2/","40.7077279","-81.2594118","16.6951219509608","","false","false","","","false","false","false","false"
"JB Green Team Recycling Drop-Off - Richmond","","210 S Park St","Richmond","","OH","43944","7402838614","0","","https://www.jbgreenteam.org/recycling/acceptable-materials","40.429818","-80.7697753","16.9890127017847","","false","false","","","false","false","false","false"
"Salem Township Recycling Drop-Off Site","","2491 State Route 45","Salem","","OH","44460","3306277311","0","","http://www.recyclingmakessense.org/","40.8643439","-80.8370869","17.3845401685184","","false","false","","","false","false","false","false"
"Scio Recycling Drop-Off Site","","Eastport St","Scio","","OH","43988","3306277311","0","","http://www.recyclingmakessense.org/","40.39709","-81.0842242","17.4035928622277","","false","false","","","false","false","false","false"
"JB Green Team Recycling Drop-Off - Knox","","8898 Rte 213","Toronto","","OH","43964","7402838614","0","","https://www.jbgreenteam.org/recycling/acceptable-materials","40.4881571","-80.6820564","17.4761935689396","","false","false","","","false","false","false","false"
"Sherrodsville Recycling Drop-Off Site","","142 S Church St","Sherrodsville","","OH","44675","3306277311","0","","http://www.recyclingmakessense.org/","40.4934828","-81.2470513","17.8712477158625","","false","false","","","false","false","false","false"
"Magnolia Park Recycling Drop-Off Site","","155 W. Carrollton St.","Magnolia","","OH","44643","8006789839","0","","https://www.timetorecycle.org/404-2/","40.651471","-81.299936","17.9989699087238","","false","false","","","false","false","false","false"
"Leesville Recycling Drop-Off Site","","Rte 212","Leesville","","OH","44639","3306277311","0","","http://www.recyclingmakessense.org/","40.4531344","-81.2116032","18.0771047955509","","false","false","","","false","false","false","false"
"GO Surplus Electronics Recycling","","721 East Pidgeon Road","Salem","","OH","44460","3303378355","0","","","40.8784155","-80.849352","18.0818189637532","","false","false","","","false","false","false","false"
"Washington Township Recycling Drop-Off Site","","5843 Beechwood Ave","Alliance","","OH","44601","8006789839","0","","https://www.timetorecycle.org/404-2/","40.855751","-81.134169","18.1292422451659","","false","false","","","false","false","false","false"
"Jewett Recycling Drop-Off Site","","Rte 9","Jewett","","OH","43986","3306277311","0","","http://www.recyclingmakessense.org/","40.3676349","-81.0034554","18.2798748448579","","false","false","","","false","false","false","false"
"Jewett Recycling Drop-Off Site","","Rte 9","Jewett","","OH","43986","3306277311","0","","http://www.recyclingmakessense.org/","40.3676349","-81.0034554","18.2798748448579","","false","false","","","false","false","false","false"
"Bowerston Recycling Drop-Off Site","","Main St","Bowerston","","OH","44695","3306277311","0","","http://www.recyclingmakessense.org/","40.4249811","-81.1866406","18.5722848690406","","false","false","","","false","false","false","false"
"St. Clair Township Recycling Drop-Off Site","","15470 East Liverpool Road","Calcutta","","OH","43920","3306277311","0","","http://www.recyclingmakessense.org/","40.6775864","-80.6046919","18.7986052882179","","false","false","","","false","false","false","false"
"Liverpool Recycling Drop-Off Site","","Ada St","La Croft","","OH","43920","3306277311","0","","http://www.recyclingmakessense.org/","40.6463541","-80.5970815","18.9453308376088","","false","false","","","false","false","false","false"
"JB Green Team Recycling Drop-Off - Stratton","","84 Ave","Stratton","","OH","43961","7402838614","0","","https://www.jbgreenteam.org/recycling/acceptable-materials","40.5210208","-80.6257539","18.9795921719764","","false","false","","","false","false","false","false"
"Beaver Creek Recycling Drop-Off Site","","12021 Echo Dell Rd","East Liverpool","","OH","43920","3306277311","0","","http://www.recyclingmakessense.org/","40.726653","-80.613689","19.2284044461044","","false","false","","","false","false","false","false"
"Salem Recycling Drop-Off Site","","Filbert Street","Salem","","OH","44460","3306277311","0","","http://www.recyclingmakessense.org/","40.8978556","-80.85603","19.2618870670007","","false","false","","","false","false","false","false"
"B H Tire & Service","B H Tire & Service","909 W State St","Salem","Columbiana","OH","44460","3303328473","0","Monday: 8:00 AM - 5:30 PM Tuesday: 8:00 AM - 5:30 PM Wednesday: 8:00 AM - 5:30 PM Thursday: 8:00 AM - 5:30 PM Friday: 8:00 AM - 5:30 PM Saturday: 8:00 AM - 5:00 PM Sunday: 8:00 AM - 2:00 PM ","","40.90095","-80.8691","19.2915476236448","Lead Acid (Pb) Batteries; Video Game Consoles; PlayStation Consoles","false","true","","","false","false","false","false"
"Elkrun Recycling Drop-Off Site","","State Route 154 ","Elkrun Township","","OH","44441","3306277311","0","","http://www.recyclingmakessense.org/","40.7975912","-80.6618664","19.348101399369","","false","false","","","false","false","false","false"
"AutoZone","AutoZone","180 W State St","Salem","Columbiana","OH","44460","3303376608","0","","http://www.autozone.com","40.90103","-80.86197","19.3900258773146","Lead Acid (Pb) Batteries; Used Motor Oil; Video Game Consoles; PlayStation Consoles","false","true","Most AutoZone stores accept used motor oil, transmission fluid, gear oil and automotive batteries. Call to see what your local store is currently accepting.","","false","false","false","false"
"Metzger True Value","","239 West State Street","Salem","","OH","44460","3303321400","0","","https://www.truevalue.com/","40.9006229","-80.8587951","19.4065466782345","","false","false","","","false","false","false","false"
"Youngstown Area Goodwill Industries","","187 South Broadway Avenue","Salem","","OH","44460","8778607866","0","","https://sunnking.com/","40.8999339","-80.8555522","19.4067760127486","","false","false","","","false","false","false","false"
"ExpertTire Store","ExpertTire Store","462 E Pershing St","Salem","Columbiana","OH","44460","3303379534","0","","http://www.firestone.com","40.89986","-80.85411","19.4228143747816","Lead Acid (Pb) Batteries; Used Motor Oil; Video Game Consoles; PlayStation Consoles","false","true","","","false","false","false","false"
"Expert Tire","","462 E Pershing St","Salem","","OH","44460","3303379534","0","","https://www.firestonecompleteautocare.com/","40.9000655","-80.854255","19.4343286472426","","false","false","","","false","false","false","false"
"Metzger True Value","Metzger True Value","239 W State St","Salem","Columbiana","OH","44460","3303321400","0","","http://www.truevalue.com","40.90086","-80.85576","19.4652933066453","Transmission Fluid; Used Motor Oil; Video Game Consoles; PlayStation Consoles","false","true","","","false","false","false","false"
"Walmart","Walmart","16280 Dresden Ave","East Liverpool","Columbiana","OH","43920","3303864002","0","","http://www.walmart.com","40.65642","-80.58715","19.5165517822737","Lead Acid (Pb) Batteries; Plastic Shopping Bags; Food Storage Bags; Video Game Consoles; PlayStation Consoles","false","true","","","false","false","false","false"
"Walmart Tire & Lube Express","Walmart Tire & Lube Express","16280 Dresden Ave","East Liverpool","Columbiana","OH","43920","3303864002","0","","http://www.walmart.com/catalog/catalog.gsp?cat=495843","40.65642","-80.58715","19.5165517822737","Lead Acid (Pb) Batteries; Used Motor Oil; Oil Filters; Video Game Consoles; PlayStation Consoles","false","true","","","false","false","false","false"
"Walmart Tire and Lube Express","","16280 Dresden Ave","East Liverpool","","OH","43920","3303864002","0","","https://www.walmart.com/cp/ideas/8932632","40.66334","-80.5875862","19.5434752566024","","false","false","","","false","false","false","false"
"Walmart Supercenter","","16280 Dresden Ave","East Liverpool","","OH","43920","3303864002","0","","https://www.walmart.com/","40.66334","-80.5875862","19.5434752566024","","false","false","","","false","false","false","false"
"JCPenney","","16280 Dresden Ave","East Liverpool","","OH","43920","3303854600","0","","https://www.jcpenney.com/","40.66334","-80.5875862","19.5434752566024","","false","false","","","false","false","false","false"
"Tractor Supply","","15981 State Route 170","East Liverpool","","OH","43920","3303857487","0","","https://www.tractorsupply.com/","40.669599","-80.5881935","19.5668375420328","","false","false","","","false","false","false","false"
"Monro","Monro","16032 OH-170 ","East Liverpool","Columbiana County","OH","43920","3303854144","0","Monday: 7:30 AM - 7:00 PM Tuesday: 7:30 AM - 7:00 PM Wednesday: 7:30 AM - 7:00 PM Thursday: 7:30 AM - 7:00 PM Friday: 7:30 AM - 7:00 PM Saturday: 7:30 AM - 4:00 PM ","http://monro.com","40.6682061","-80.5875592","19.5867340215218","Used Motor Oil; Video Game Consoles; PlayStation Consoles","false","true","","","false","false","false","false"
"AT&T Wireless","AT&T Wireless","1098 East State Street","Salem","Columbiana","OH","44460","2342181736","0","","http://www.att.com/","40.90103","-80.84593","19.6238286036208","Cell Phones; Ni-Cd Batteries; Batteries (Rechargeable); Cell Phone Batteries; Tablets; Li-Ion Batteries; Video Game Consoles; PlayStation Consoles","false","true","Receive an AT&T Promotion Card worth the trade-in value of your smartphone, tablet, or netbook. You can also donate the trade-in value to Cell Phones for Soldiers.","","false","false","false","false"
"East Liverpool Recycling Drop-Off Site #1","","2nd St","East Liverpool","","OH","43920","3306277311","0","","http://www.recyclingmakessense.org/","40.6169904","-80.5821986","19.7161850830447","","false","false","","","false","false","false","false"
"Calcutta Recycling Drop-Off Site","","15937 SR 170","Calcutta ","","OH","44441","3306277311","0","","http://www.recyclingmakessense.org/","40.6718864","-80.585417","19.7332195799557","","false","false","","","false","false","false","false"
"Tractor Supply","Tractor Supply","15981 State Route 170","East Liverpool","Columbiana","OH","43920","3303857487","0","","http://www.tractorsupply.com","40.67033","-80.58509","19.7349029986376","Transmission Fluid; Used Motor Oil; Video Game Consoles; PlayStation Consoles","false","true","","","false","false","false","false"
"AutoZone","AutoZone","15880 Sr 170","Calcutta","Columbiana","OH","43920","3303850281","0","","http://www.autozone.com","40.67048","-80.58446","19.7690395689991","Lead Acid (Pb) Batteries; Used Motor Oil; Video Game Consoles; PlayStation Consoles","false","true","Most AutoZone stores accept used motor oil, transmission fluid, gear oil and automotive batteries. Call to see what your local store is currently accepting.","","false","false","false","false"
"AutoZone","AutoZone","125 W 3rd St","East Liverpool","Columbiana","OH","43920","3303864111","0","","http://www.autozone.com","40.61754","-80.58104","19.7751183407483","Lead Acid (Pb) Batteries; Used Motor Oil; Video Game Consoles; PlayStation Consoles","false","true","Most AutoZone stores accept used motor oil, transmission fluid, gear oil and automotive batteries. Call to see what your local store is currently accepting.","","false","false","false","false"
"Walgreens","Walgreens","2124 E State St","Salem","Columbiana","OH","44460","3303378001","0","","http://www.walgreens.com","40.901","-80.83134","19.8629724094945","Cell Phones; Inkjet Printer Cartridges; Video Game Consoles; PlayStation Consoles","false","true","","","false","false","false","false"
"Youngstown Area Goodwill Industries","","15765 Ohio 170","Calcutta","","OH","43920","8778607866","0","","https://sunnking.com/","40.672945","-80.582033","19.9193212874408","","false","false","","","false","false","false","false"
"Call2Recycle at RadioShack","Call2Recycle at RadioShack","2362 E State St","Salem","Columbiana","OH","44460","3303321003","0","","http://www.radioshack.com/","40.90101","-80.82618","19.9551931502609","Cell Phones; Ni-Cd Batteries; Li-Ion Batteries; Ni-MH Batteries; Ni-Zn Batteries; Small Sealed Lead Acid Batteries; Video Game Consoles; PlayStation Consoles","false","true","As the first national retailer to partner with Call2Recycle, RadioShack is at the forefront of the rechargeable battery recycling cause and is pleased to offer battery recycling at thousands of convenient RadioShack locations for free.  Simply drop them off at your local RadioShack and theyll take care of the rest.  Ask a store associate for more details.","","false","false","false","false"
"Tractor Supply","Tractor Supply","2366 E State St","Salem","Columbiana","OH","44460","3303320635","0","","http://www.tractorsupply.com","40.90101","-80.82618","19.9551931502609","Transmission Fluid; Used Motor Oil; Video Game Consoles; PlayStation Consoles","false","true","","","false","false","false","false"
"RadioShack","RadioShack","2362 E State St","Salem","Columbiana","OH","44460","3303321003","0","Monday: 10:00 AM - 8:00 PM Tuesday: 10:00 AM - 8:00 PM Wednesday: 10:00 AM - 8:00 PM Thursday: 10:00 AM - 8:00 PM Friday: 10:00 AM - 8:00 PM Saturday: 10:00 AM - 8:00 PM Sunday: 11:00 AM - 7:00 PM ","http://www.radioshack.com","40.90101","-80.82618","19.9551931502609","Ni-Cd Batteries; Batteries (Rechargeable); Video Game Consoles; PlayStation Consoles","false","true","","","false","false","false","false"
"Summitville Recycling Drop-Off Site","","Ohio 644","Summitville","","OH","44427","3306277311","0","","http://www.recyclingmakessense.org/","40.6781118","-80.8862493","5.01443940301908","","false","false","","","false","false","false","false"
"Augusta Recycling Drop-Off Site","","3041 Aurora Rd NE","Augusta","","OH","44625","3306277311","0","","http://www.recyclingmakessense.org/","40.6891719","-81.0283461","5.51623748599502","","false","false","","","false","false","false","false"
"Augusta Recycling Drop-Off Site","","3041 Aurora Rd NE","Augusta","","OH","44625","3306277311","0","","http://www.recyclingmakessense.org/","40.6891719","-81.0283461","5.51623748599502","","false","false","","","false","false","false","false"
"J & J Refuse Drop-off Site","J & J Refuse Drop-off Site","2403 Chase Rd SE","Carrollton","Carroll","OH","44615","3306272424","0","Monday: 8:00 AM - 4:00 PM Tuesday: 8:00 AM - 4:00 PM Wednesday: 8:00 AM - 4:00 PM Thursday: 8:00 AM - 4:00 PM Friday: 8:00 AM - 4:00 PM Saturday: 8:00 AM - 12:00 PM ","","40.5724","-81.04343","5.99820115041","Cardboard; Ferrous Metals (Steel or Iron); Non-ferrous (Copper/Brass/Tin); Tin or Steel Cans; Video Game Consoles; PlayStation Consoles","false","true","","","false","false","false","false"
"Salineville Recycling Drop-Off Site","","34 Washington Street","Salineville","","OH","43945","3306277311","0","","http://www.recyclingmakessense.org/","40.6250748","-80.8395532","6.2090288249612","","false","false","","","false","false","false","false"
"New Harrisburg Recycling Drop-Off Site","","Rte 171","Carrollton","","OH","44615","3306277311","0","","http://www.recyclingmakessense.org/","40.6174209","-81.0939048","7.18984273810905","","false","false","","","false","false","false","false"
"Harlem Springs Recycling Drop-Off Site","","Apollo Rd SE","Harlem Springs","","OH","44657","3306277311","0","","http://www.recyclingmakessense.org/","40.5265144","-80.9967402","7.43136671933078","","false","false","","","false","false","false","false"
