name,description,address,city,region,province,postal_code,phone,fax,hours,url,latitude,longitude,distance,materials,pickup,dropoff,notes,groups,curbside,municipal,national,event_only
"Carrollton Ace Hardware","Carrollton Ace Hardware","1285 Canton Rd NW","Carrollton","Carroll","OH","44615","3306274344","0","","http://www.acehardware.com/","40.59144","-81.09257","7.55268127177805","Cell Phones; Ni-Cd Batteries; Li-Ion Batteries; Ni-MH Batteries; Ni-Zn Batteries; Small Sealed Lead Acid Batteries; Video Game Consoles; PlayStation Consoles; Batteries (Rechargeable); Cell Phone Batteries; Li-Ion Batteries; Ni-Cd Batteries; Ni-MH Batteries; Small Sealed Lead Acid Batteries; Cell Phones","false","true","The U.S. EPA estimates that more than 350 million rechargeable batteries are purchased annually in the U.S. Thanks to the environmental commitment of this location, its easy and free to recycle your batteries. Bring your rechargeable batteries to this location and look for the recycling box or ask an associate how you can do your part for the environment.","Call2Recycle","false","false","false","false"
"Tractor Supply","Tractor Supply","1335 Canton RD Northwest","Carrollton","Carroll","OH","44615","3306273738","0","","http://www.tractorsupply.com","40.59388","-81.09397","7.56416403032405","Transmission Fluid; Used Motor Oil; Video Game Consoles; PlayStation Consoles","false","true","","","false","false","false","false"
"RadioShack","RadioShack","1115 Canton Rd NW Ste F","Carrollton","Carroll","OH","44615","3306271342","0","Monday: 9:00 AM - 6:00 PM Saturday: 9:00 AM - 5:00 PM Sunday: 11:00 AM - 4:00 PM ","http://www.radioshack.com","40.58892","-81.09208","7.59199606802345","Ni-Cd Batteries; Batteries (Rechargeable); Video Game Consoles; PlayStation Consoles","false","true","","","false","false","false","false"
"ELEM Electronics","ELEM Electronics","1115 Canton Rd NW Ste F","Carrollton","Carroll","OH","44615","3306271342","0","","http://www.radioshack.com/","40.58892","-81.09208","7.59199606802345","Cell Phones; Ni-Cd Batteries; Li-Ion Batteries; Ni-MH Batteries; Ni-Zn Batteries; Small Sealed Lead Acid Batteries; Video Game Consoles; PlayStation Consoles","false","true","The U.S. EPA estimates that more than 350 million rechargeable batteries are purchased annually in the U.S. Thanks to the environmental commitment of this location, its easy and free to recycle your batteries. Bring your rechargeable batteries to this location and look for the recycling box or ask an associate how you can do your part for the environment.","","false","false","false","false"
"Tractor Supply","","1335 Canton Road Northwest","Carrollton","","OH","44615","3306273738","0","","https://www.tractorsupply.com/","40.5939029","-81.0957292","7.65083153421969","","false","false","","","false","false","false","false"
"AutoZone","AutoZone","809 Canton Rd NW","Carrollton","Carroll","OH","44615","3306272301","0","","http://www.autozone.com","40.58368","-81.09233","7.7465903407416","Lead Acid (Pb) Batteries; Used Motor Oil; Video Game Consoles; PlayStation Consoles","false","true","Most AutoZone stores accept used motor oil, transmission fluid, gear oil and automotive batteries. Call to see what your local store is currently accepting.","","false","false","false","false"
"CCH Solid Waste District Household Hazardous Waste Collection","","","Carrollton","","OH","44615","3306277311","0","","http://www.recyclingmakessense.org/","40.5728403","-81.0856532","7.78096693074619","","false","false","","","false","false","false","false"
"AutoZone","","809 Canton Rd NW","Carrollton","","OH","44615","3306272301","0","","https://www.autozone.com/landing/page.jsp?name=in-our-stores","40.5829265","-81.0928409","7.79259653078655","","false","false","","","false","false","false","false"
"Kilgore Recycling Drop-Off Site","","Rte 9","Carrollton","","OH","44615","3306277311","0","","http://www.recyclingmakessense.org/","40.57266","-81.0858396","7.79571990880333","","false","false","","","false","false","false","false"
"911 Cell Phone Bank - Carroll County Sheriffs Office","911 Cell Phone Bank - Carroll County Sheriffs Office","43 2nd St SE","Carrollton","Carroll","OH","44615","8662907864","0","","http://www.911cellphonebank.org/","40.57141","-81.08541","7.82065904784229","Cell Phones; Cameras; Laptop Computers; MP3 Players; Video Games; Video Game Consoles; Smart watches & Apple Watch®
","false","true","Please call to verify drop-off procedures and directions to the location.  For prepaid shipping labels, visit http://www.911cellphonebank.org/drop-off-locations.asp - click on "print shipping label."","","false","false","false","false"
"Advance Auto Parts","Advance Auto Parts","427 Canton Rd NW","Carrollton","Carroll","OH","44615","3306279842","0","Monday: 7:00 AM - 9:00 PM Tuesday: 7:00 AM - 9:00 PM Wednesday: 7:00 AM - 9:00 PM Thursday: 7:00 AM - 9:00 PM Friday: 7:00 AM - 9:00 PM Saturday: 7:00 AM - 9:00 PM Sunday: 10:00 AM - 8:00 PM ","http://www.advanceautoparts.com","40.57942","-81.09267","7.8887481803087","Lead Acid (Pb) Batteries; Used Motor Oil; Video Game Consoles; PlayStation Consoles","false","true","","","false","false","false","false"
"Advance Auto Parts","","427 Canton Rd NW","Carrollton","","OH","44615","3306279842","0","","http://shop.advanceautoparts.com/webapp/wcs/stores/servlet/home___","40.5796376","-81.0930995","7.90232761204765","","false","false","","","false","false","false","false"
"JB Green Team Recycling Drop-Off - Bergholz","","Monroe St & 3rd St","Bergholz","","OH","43908","7402838614","0","","https://www.jbgreenteam.org/recycling/acceptable-materials","40.5200265","-80.8836605","8.53156813340193","","false","false","","","false","false","false","false"
"JB Green Team Recycling Drop-Off - Amsterdam","","4569 Country Road 75","Bergholz","","OH","43908","7402838614","0","","https://www.jbgreenteam.org/recycling/acceptable-materials","40.5195084","-80.8839755","8.55595142210225","","false","false","","","false","false","false","false"
"Hanoverton Recycling Drop-Off Site","","Ohio 9 & Howard St","Hanoverton","","OH","44423","3306277311","0","","http://www.recyclingmakessense.org/","40.7532116","-80.9366561","8.58938950240403","","false","false","","","false","false","false","false"
"Paulette Recycling","","6210 Canton Road Northwest","Malvern","","OH","44644","3308630692","0","","","40.669617","-81.140091","9.94164285444802","","false","false","","","false","false","false","false"
"Wayne Township Recycling Drop-Off Site","","State Route 164 & State Route 518","Wayne Township","","OH","44432","3306277311","0","","http://www.recyclingmakessense.org/","40.7085715","-80.7982484","9.97112506130618","","false","false","","","false","false","false","false"
