name,description,address,city,region,province,postal_code,phone,fax,hours,url,latitude,longitude,distance,materials,pickup,dropoff,notes,groups,curbside,municipal,national,event_only
"Call2Recycle at Sears Hardware","Call2Recycle at Sears Hardware","4655 Dixie Hwy","Fairfield","Butler","OH","45014","5138293870","0","","http://www.sears.com/","39.35082","-84.54253","6.88193571939571","Cell Phones; Ni-Cd Batteries; Li-Ion Batteries; Ni-MH Batteries; Ni-Zn Batteries; Small Sealed Lead Acid Batteries; Video Game Consoles; PlayStation Consoles","false","true","The U.S. EPA estimates that more than 350 million rechargeable batteries are purchased annually in the U.S. Thanks to the environmental commitment of this location, its easy and free to recycle your batteries. Bring your rechargeable batteries to this location and look for the recycling box or ask an associate how you can do your part for the environment.","","false","false","false","false"
"US Post Office","US Post Office","700 Wessel Dr","Fairfield","Butler","OH","45014","0","0","","https://www.usps.com/ship/recycle-through-usps.htm","39.33562","-84.55798","6.92561020362668","Inkjet Printer Cartridges; Video Game Consoles; PlayStation Consoles","false","true","Free, postage-paid Mail Back envelopes can be found on display in the lobby. There is no limit to the number of envelopes customers may take. The contents of the envelope must weigh less than 13 ounces and the envelope must be able to seal completely. For more details visit<a href="http://www.maxback.com/mxb-postoffice-collaboration" target="_blank">MaxBack</a>.","","false","false","false","false"
"Community Arts Center","Community Arts Center","411 Wessel Dr","Fairfield","Butler","OH","45014","5138873653","0","","http://www.butlercountyrecycles.org/","39.33248","-84.55851","7.06282626731258","Aerosol Spray Cans; Aluminum Cans; Glass (Blue); Glass (Brown); Brown Paper Bags; Cardboard; Glass (Clear); Glass (Green); Magazines; Paper (Mixed); Newspapers; Paperboard; Phone books; Tin or Steel Cans; Office Paper; Plastic Bottle Caps","false","true","Butler County recycling drop-box","","false","false","false","false"
"Home Depot","Home Depot","6562 Winford Ave","Hamilton","Butler","OH","45011","5138871450","0","","http://www.homedepot.com","39.39438","-84.51097","7.41054723810389","Compact Fluorescent Lights; Batteries (Rechargeable); Video Game Consoles; PlayStation Consoles","false","true","Home Depot accepts compact fluorescent bulbs and used power tool rechargeable batteries. Look for the orange drop boxes, usually located near the front entrance near the customer service desk.","","false","false","false","false"
"Call2Recycle at the Home Depot","Call2Recycle at the Home Depot","6562 Winford Ave","Hamilton","Butler","OH","45011","5138871450","0","","http://www.homedepot.com/","39.39438","-84.51097","7.41054723810389","Cell Phones; Compact Fluorescent Lights; Ni-Cd Batteries; Li-Ion Batteries; Ni-MH Batteries; Ni-Zn Batteries; Small Sealed Lead Acid Batteries; Video Game Consoles; PlayStation Consoles; Batteries (Rechargeable); Cell Phone Batteries; Li-Ion Batteries; Ni-Cd Batteries; Ni-MH Batteries; Small Sealed Lead Acid Batteries","false","true","The Home Depot accepts used rechargeable batteries and compact fluorescent bulbs. Look for the orange drop boxes, usually located near the front entrance near the customer service desk, or ask a store associate for more details.","Call2Recycle","false","false","false","false"
"Fox Services, Inc","Fox Services, Inc","4660 Industry Dr","Fairfield","Butler","OH","45014","5138582022","0","","http://foxservicesinc.com/","39.34873","-84.53115","7.4682076459816","Broken Asphalt/Aggregate; Brick(s); Concrete (Set); Video Game Consoles; PlayStation Consoles","true","true","Accepts asphalt, concrete, brick, and rock; material is made into recycled gravel.","","false","false","false","false"
"Household Battery Recycling Drop Off","","","Hamilton","","OH","45011","5138873653","0","","http://www.butlercountyrecycles.org","39.4296413","-84.5117321","7.47789557360841","","false","false","","","false","false","false","false"
"Call2Recycle at Office Depot","Call2Recycle at Office Depot","3177 Princeton Rd","Hamilton","Butler","OH","45011","5138944100","0","","http://www.officedepot.com/","39.39093","-84.50996","7.49624163985347","Cell Phones; Ni-Cd Batteries; Li-Ion Batteries; Ni-MH Batteries; Ni-Zn Batteries; Small Sealed Lead Acid Batteries; Video Game Consoles; PlayStation Consoles","false","true","The U.S. EPA estimates that more than 350 million rechargeable batteries are purchased annually in the U.S. Thanks to the environmental commitment of this location, its easy and free to recycle your batteries. Bring your rechargeable batteries to this location and look for the recycling box or ask an associate how you can do your part for the environment.","","false","false","false","false"
"Call2Recycle at RadioShack","Call2Recycle at RadioShack","3195 Princeton Rd","Hamilton","Butler","OH","45011","5138681766","0","","http://www.radioshack.com/","39.39093","-84.50996","7.49624163985347","Cell Phones; Ni-Cd Batteries; Li-Ion Batteries; Ni-MH Batteries; Ni-Zn Batteries; Small Sealed Lead Acid Batteries; Video Game Consoles; PlayStation Consoles","false","true","As the first national retailer to partner with Call2Recycle, RadioShack is at the forefront of the rechargeable battery recycling cause and is pleased to offer battery recycling at thousands of convenient RadioShack locations for free.  Simply drop them off at your local RadioShack and theyll take care of the rest.  Ask a store associate for more details.","","false","false","false","false"
"Office Depot","Office Depot","3177 Princeton Rd","Hamilton","Butler","OH","45011","5138944100","0","Monday: 8:00 AM - 9:00 PM Tuesday: 8:00 AM - 9:00 PM Wednesday: 8:00 AM - 9:00 PM Thursday: 8:00 AM - 9:00 PM Friday: 8:00 AM - 9:00 PM Saturday: 9:00 AM - 9:00 PM Sunday: 10:00 AM - 6:00 PM ","http://www.officedepot.com/","39.39093","-84.50996","7.49624163985347","Cell Phones; Computer Monitors; Electronics; Inkjet Printer Cartridges; Ni-Cd Batteries; Office Equipment; Batteries (Rechargeable); Laser Toner Cartridges; MP3 Players; Small Televisions; Video Game Consoles; PlayStation Consoles","false","true","Office Depot offers electronics recycling for a small fee. Visit their Web site for more details and store locations. Recycle cell phones, PDAs, rechargeable batteries and ink and toner cartridges for FREE!","","false","false","false","false"
"Shred Nations","Shred Nations (inside The UPS Store)","3189 Princeton Rd","Hamilton","Butler","OH","45011","5137182351","0","Monday: 8:30 AM - 7:00 PM Tuesday: 8:30 AM - 7:00 PM Wednesday: 8:30 AM - 7:00 PM Thursday: 8:30 AM - 7:00 PM Friday: 8:30 AM - 7:00 PM Saturday: 9:00 AM - 5:00 PM ","http://www.shrednations.com/dropoff/location/hamilton/ad0634fb-2181-9f2b-f113-545250681acd","39.39093","-84.50996","7.49624163985347","Cell Phones; Computer (Recycling); Laptop Computers; Small Televisions; Documents to Shred; Video Game Consoles; PlayStation Consoles","true","true","Shred Nations offers document shredding, hard drive destruction, electronics recycling and more. Visit website for quotes and full list of services offered in your area. ","","false","false","false","false"
"Milford Township Maintenance Building","Milford Township Maintenance Building","1414 Oxford-Trenton Rd ","Hamilton","Butler County","OH","45013","5138873653","0","","http://www.butlercountyrecycles.org/","39.5120268","-84.6090584","7.54759829006881","Aerosol Spray Cans; Aluminum Cans; Glass (Blue); Glass (Brown); Brown Paper Bags; Cardboard; Glass (Clear); Glass (Green); Magazines; Paper (Mixed); Newspapers; Paperboard; Phone books; Tin or Steel Cans; Office Paper; Plastic Bottle Caps","false","true","Butler County recycling drop-box","","false","false","false","false"
"Walmart","Walmart","3201 Princeton Rd","Hamilton","Butler","OH","45011","5138698400","0","","http://www.walmart.com","39.39086","-84.50861","7.56823421605364","Lead Acid (Pb) Batteries; Plastic Shopping Bags; Food Storage Bags; Video Game Consoles; PlayStation Consoles","false","true","","","false","false","false","false"
"Call2Recycle at Verizon Wireless","Call2Recycle at Verizon Wireless","3324 Princeton Rd","Hamilton","Butler","OH","45011","8666444532","0","","http://www.verizon.com/","39.39084","-84.50511","7.75326252467514","Cell Phones; Ni-Cd Batteries; Li-Ion Batteries; Ni-MH Batteries; Ni-Zn Batteries; Small Sealed Lead Acid Batteries; Video Game Consoles; PlayStation Consoles","false","true","The U.S. EPA estimates that more than 350 million rechargeable batteries are purchased annually in the U.S. Thanks to the environmental commitment of this location, its easy and free to recycle your batteries. Bring your rechargeable batteries to this location and look for the recycling box or ask an associate how you can do your part for the environment.","","false","false","false","false"
"Verizon Wireless","Verizon Wireless","3324 Princeton Rd","Hamilton","Butler","OH","45011","8666444532","0","","http://www.verizonwireless.com/","39.39084","-84.50511","7.75326252467514","Cell Phones; Cell Phone Batteries; Video Game Consoles; PlayStation Consoles","false","true","<A Href="https://www.trade-in.vzw.com/home.aspx">
The Verizon Wireless Trade-In Program</A> allows you to trade in your used handset or tablet in a convenient and responsible way. 
<P>
<P>
Verizon Wireless works every day to protect our environment and give our customers opportunities to do the same. <A Href="http://aboutus.vzw.com/Green_Initiative/overview.html">Click here</A> for more examples of the earth-friendly initiatives and programs Verizon Wireless is proud to offer and support.","","false","false","false","false"
"St. Clair Township Administration","St. Clair Township Administration","2449 Jackson Rd","Hamilton","Butler","OH","45011","5138873653","0","","http://www.butlercountyrecycles.org/","39.45214","-84.51475","7.79826636061026","Aerosol Spray Cans; Aluminum Cans; Glass (Blue); Glass (Brown); Brown Paper Bags; Cardboard; Glass (Clear); Glass (Green); Magazines; Paper (Mixed); Newspapers; Paperboard; Phone books; Tin or Steel Cans; Office Paper; Plastic Bottle Caps","false","true","Butler County recycling drop-box","","false","false","false","false"
"Target","Target","3369 Princeton Rd","Hamilton","Butler","OH","45011","5137140016","0","","http://www.target.com/","39.39063","-84.50427","7.79975912021129","Aluminum Cans; Cell Phones; Inkjet Printer Cartridges; MP3 Players; Plastic #1 (PETE); Plastic #2 (HDPE); Plastic Shopping Bags; Video Game Consoles; PlayStation Consoles","false","true","","","false","false","false","false"
"Staples","Staples","3339 Princeton Road","Hamilton","Butler County","OH","45011","5137370495","0","Monday: 9:00 AM - 8:00 PM Tuesday: 9:00 AM - 8:00 PM Wednesday: 9:00 AM - 8:00 PM Thursday: 9:00 AM - 8:00 PM Friday: 9:00 AM - 8:00 PM Saturday: 10:00 AM - 7:00 PM Sunday: 11:00 AM - 6:00 PM ","https://www.staples.com/recycle","39.3895046","-84.5044435","7.8024474747288","AC Power Plugs; Batteries (Rechargeable); Cables & Connectors; Cell Phone Batteries; Cell Phones; Computer (Recycling); Hard Drives; Computer Monitors; Cameras; DVD Players/Blu-Ray Players/DVRs; Electronics; E-Readers; GPS Units; Headphones; Inkjet Printer Cartridges; Laptop Computers; Laser Toner Cartridges; Li-Ion Batteries; MP3 Players; Network Equipment; Ni-Cd Batteries; Ni-MH Batteries; Ni-Zn Batteries; Computer Peripherals; Portable Media Players; Printers/Scanners/Fax Machines; Small Electronics; Small Sealed Lead Acid Batteries; Stereo Equipment; Tablets; Telephones; UPS Batteries/Backup Systems; VCRs; Video Game Systems; Blu-Ray Players; Digital Converter Boxes; Video Game Consoles; PlayStation Consoles; Alkaline/Single-Use Batteries; Batteries (Rechargeable); Cell Phone Batteries; Li-Ion Batteries; Ni-Cd Batteries; Ni-MH Batteries; Small Sealed Lead Acid Batteries; Alkaline/Single-Use Batteries; Button Batteries; Non-rechargeable lithium batteries; Cell Phones","false","true","NO TVs; Limit 6 CEDs per day; ","Sony, Vizio, OEM, Call2Recycle","false","false","false","false"
"Miami University Police Station","Miami University Police Station","4935 Oxford Trenton Rd","Oxford","Butler","OH","45056","5138873653","0","","http://www.butlercountyrecycles.org/","39.50631","-84.7194","7.81658546723019","Aerosol Spray Cans; Aluminum Cans; Glass (Blue); Glass (Brown); Brown Paper Bags; Cardboard; Glass (Clear); Glass (Green); Magazines; Paper (Mixed); Newspapers; Paperboard; Phone books; Tin or Steel Cans; Office Paper; Plastic Bottle Caps","false","true","Butler County recycling drop-box","","false","false","false","false"
"AT&T Wireless","AT&T Wireless","3373 Princeton Rd","Hamilton","Butler","OH","45011","5138687000","0","","http://www.att.com/","39.39059","-84.50348","7.84188889401084","Cell Phones; Ni-Cd Batteries; Batteries (Rechargeable); Cell Phone Batteries; Tablets; Li-Ion Batteries; Video Game Consoles; PlayStation Consoles","false","true","Receive an AT&T Promotion Card worth the trade-in value of your smartphone, tablet, or netbook. You can also donate the trade-in value to Cell Phones for Soldiers.","","false","false","false","false"
"City of Fairfield Recycling Drop-Off Site - Point Pleasant Park","","2001 Resor Rd","Fairfield","","OH","45014","5138674200","0","","http://www.butlercountyrecycles.org/","39.321815","-84.5518","7.84988069367491","","false","false","","","false","false","false","false"
"Point Pleasant Park","Point Pleasant Park","2001 Resor Rd ","Fairfield","Butler County","OH","45014","5138873653","0","","http://www.butlercountyrecycles.org/","39.3218012","-84.5511214","7.87456372293426","Aerosol Spray Cans; Aluminum Cans; Glass (Blue); Glass (Brown); Brown Paper Bags; Cardboard; Glass (Clear); Glass (Green); Magazines; Paper (Mixed); Newspapers; Paperboard; Phone books; Tin or Steel Cans; Office Paper; Plastic Bottle Caps","false","true","Butler County recycling drop-box","","false","false","false","false"
"Best Buy","Best Buy","3435 Princeton Rd ","Hamilton","Butler County","OH","45011","5137373060","0","","https://www.bestbuy.com/recycle","39.3864397","-84.499802","8.08230751758384","Large Household Appliances; Refrigerators; Televisions; AC Power Plugs; Batteries (Rechargeable); Cables & Connectors; Car Audio/Video Equipment; Cell Phone Batteries; Cell Phones; Computer (Recycling); Hard Drives; Computer Monitors; Cameras; DVD Players/Blu-Ray Players/DVRs; Electronics; E-Readers; GPS Units; Headphones; Inkjet Printer Cartridges; Laptop Computers; Laser Toner Cartridges; Li-Ion Batteries; MP3 Players; Network Equipment; Ni-Cd Batteries; Ni-MH Batteries; Ni-Zn Batteries; Computer Peripherals; Portable Media Players; Printers/Scanners/Fax Machines; Small Electronics; Small Sealed Lead Acid Batteries; Stereo Equipment; Tablets; Telephones; UPS Batteries/Backup Systems; VCRs; Video Game Systems; Blu-Ray Players; Digital Converter Boxes; Small Televisions; Video Game Consoles; PlayStation Consoles","true","true","2 TVs per visit, 3 e-waste items per day; $25 fee for TVs and Monitors; $19.99 pick-up fee with delivery; $99.99 standalone pickup fee; ","Sony, Vizio, OEM","false","false","false","false"
"Walgreens","Walgreens","2335 John Gray Rd","Cincinnati","Hamilton","OH","45231","5138253862","0","","http://www.walgreens.com","39.30799","-84.56541","8.17311572636872","Cell Phones; Inkjet Printer Cartridges; Video Game Consoles; PlayStation Consoles","false","true","","","false","false","false","false"
"Butler Tech","Butler Tech","3603 Hamilton Middletown Rd","Hamilton","Butler","OH","45011","5138873653","0","","http://www.butlercountyrecycles.org/","39.39019","-84.4958","8.25164033230814","Aerosol Spray Cans; Aluminum Cans; Glass (Blue); Glass (Brown); Brown Paper Bags; Cardboard; Glass (Clear); Glass (Green); Magazines; Paper (Mixed); Newspapers; Paperboard; Phone books; Tin or Steel Cans; Office Paper; Plastic Bottle Caps","false","true","Butler County recycling drop-box","","false","false","false","false"
"City of Fairfield Recycling Drop-Off Site - Fairfield Aquatic Center","","2605 Augusta Blvd","Fairfield","","OH","45014","5138674200","0","","http://www.butlercountyrecycles.org/","39.318802","-84.544227","8.27499446792574","","false","false","","","false","false","false","false"
"Fairfield Aquatic Center","Fairfield Aquatic Center","2605 Augusta Blvd","Fairfield","Butler","OH","45014","5138873653","0","","http://www.butlercountyrecycles.org/","39.31635","-84.54759","8.28249334657203","Aerosol Spray Cans; Aluminum Cans; Glass (Blue); Glass (Brown); Brown Paper Bags; Cardboard; Glass (Clear); Glass (Green); Magazines; Paper (Mixed); Newspapers; Paperboard; Phone books; Tin or Steel Cans; Office Paper; Plastic Bottle Caps","false","true","Butler County recycling drop-box","","false","false","false","false"
"Oxford West Apartments","Oxford West Apartments","615 Ogden Ct","Oxford","Butler","OH","45056","5138873653","0","","http://www.butlercountyrecycles.org/","39.50387","-84.75097","8.6222472007204","Aerosol Spray Cans; Aluminum Cans; Glass (Blue); Glass (Brown); Brown Paper Bags; Cardboard; Glass (Clear); Glass (Green); Magazines; Paper (Mixed); Newspapers; Paperboard; Phone books; Tin or Steel Cans; Office Paper; Plastic Bottle Caps","false","true","Butler County recycling drop-box","","false","false","false","false"
"Ace Hardware & Building Supply","Ace Hardware & Building Supply","300 S College Ave","Oxford","Butler","OH","45056","5135236361","0","","http://www.acehardware.com/","39.50707","-84.74575","8.62475443033893","Cell Phones; Ni-Cd Batteries; Li-Ion Batteries; Ni-MH Batteries; Ni-Zn Batteries; Small Sealed Lead Acid Batteries; Video Game Consoles; PlayStation Consoles","false","true","The U.S. EPA estimates that more than 350 million rechargeable batteries are purchased annually in the U.S. Thanks to the environmental commitment of this location, its easy and free to recycle your batteries. Bring your rechargeable batteries to this location and look for the recycling box or ask an associate how you can do your part for the environment.","","false","false","false","false"
"Miami University Culinary Support Center","Miami University Culinary Support Center","426 Wells Mills Dr","Oxford","Butler","OH","45056","5138873653","0","","http://www.butlercountyrecycles.org/","39.50493","-84.74996","8.64534888232835","Aerosol Spray Cans; Aluminum Cans; Glass (Blue); Glass (Brown); Brown Paper Bags; Cardboard; Glass (Clear); Glass (Green); Magazines; Paper (Mixed); Newspapers; Paperboard; Phone books; Tin or Steel Cans; Office Paper; Plastic Bottle Caps","false","true","Butler County recycling drop-box","","false","false","false","false"
"Call2Recycle at RadioShack","Call2Recycle at RadioShack","270 S Locust St","Oxford","Butler","OH","45056","5135234033","0","","http://www.radioshack.com/","39.50525","-84.74951","8.64768743168374","Cell Phones; Ni-Cd Batteries; Li-Ion Batteries; Ni-MH Batteries; Ni-Zn Batteries; Small Sealed Lead Acid Batteries; Video Game Consoles; PlayStation Consoles","false","true","As the first national retailer to partner with Call2Recycle, RadioShack is at the forefront of the rechargeable battery recycling cause and is pleased to offer battery recycling at thousands of convenient RadioShack locations for free.  Simply drop them off at your local RadioShack and theyll take care of the rest.  Ask a store associate for more details.","","false","false","false","false"
"RadioShack","RadioShack","270 S Locust St","Oxford","Butler","OH","45056","5135234033","0","Monday: 10:00 AM - 9:00 PM Tuesday: 10:00 AM - 9:00 PM Wednesday: 10:00 AM - 9:00 PM Thursday: 10:00 AM - 9:00 PM Friday: 10:00 AM - 9:00 PM Saturday: 10:00 AM - 9:00 PM Sunday: 12:00 PM - 6:00 PM ","http://www.radioshack.com","39.50525","-84.74951","8.64768743168374","Cell Phones; Ni-Cd Batteries; Batteries (Rechargeable); Video Game Consoles; PlayStation Consoles","false","true","","","false","false","false","false"
"Walgreens","Walgreens","200 S Locust St","Oxford","Butler","OH","45056","5135234683","0","","http://www.walgreens.com","39.50525","-84.74951","8.64768743168374","Cell Phones; Inkjet Printer Cartridges; Video Game Consoles; PlayStation Consoles","false","true","","","false","false","false","false"
"Colerain Township Recycling Drop-Off Site - Pleasant Run Middle School","","11770 Pippin Rd","Cincinnati","","OH","45231","5139467766","0","","","39.2974632","-84.569877","8.67357446069376","","false","false","","","false","false","false","false"
"BikeWise Oxford","BikeWise Oxford","9 N Beech St","Oxford","Butler ","OH","45056","5135234880","0","","","39.5107813","-84.7438152","8.77114548412213","E-Bike Batteries","false","true","Call or Check Online for Hours","Call2Recycle","false","false","false","false"
"Monro","Monro","20 Lynn Ave","Oxford","Butler","OH","45056","5135237882","0","Monday: 7:30 AM - 7:00 PM Tuesday: 7:30 AM - 7:00 PM Wednesday: 7:30 AM - 7:00 PM Thursday: 7:30 AM - 7:00 PM Friday: 7:30 AM - 7:00 PM Saturday: 7:30 AM - 4:00 PM ","http://monro.com","39.50914","-84.75099","8.90785384913747","Used Motor Oil; Video Game Consoles; PlayStation Consoles","false","true","","","false","false","false","false"
"Vilppu's Bike Repairs (Julie's Mountain Bike Rentals)","Vilppu's Bike Repairs (Julie's Mountain Bike Rentals)","10 Harvest Court","Oxford","Butler ","OH","45056","5135930671","0","","","39.50035625","-84.7694625833333","9.10433077065676","E-Bike Batteries","false","true","Call or Check Online for Hours","Call2Recycle","false","false","false","false"
"Springfield Township at Clifford George Park","","1615 Forester Drive at Mill Road","Cincinnati","","OH","45240","5139467766","0","","","39.3035071","-84.5431071","9.12005870009455","","false","false","","","false","false","false","false"
"USPS Post Office Box Lobby Recycling Program","US Post Office","5145 Brown Rd","Oxford","Butler","OH","45056","8002758777","0","","https://www.usps.com/","39.5167","-84.74599","9.17287521883917","Catalogs; Greeting Cards; Magazines; Paper (Mixed)","false","true","","","false","false","false","false"
"AutoZone","AutoZone","5075 College Corner Pike","Oxford","Butler","OH","45056","5135236919","0","","http://www.autozone.com","39.51385","-84.7523","9.20898117670471","Lead Acid (Pb) Batteries; Used Motor Oil; Video Game Consoles; PlayStation Consoles","false","true","Most AutoZone stores accept used motor oil, transmission fluid, gear oil and automotive batteries. Call to see what your local store is currently accepting.","","false","false","false","false"
"Garden Street Iron & Metal Inc","Garden Street Iron & Metal Inc","7500 New Haven Rd","Harrison","Hamilton","OH","45030","5137382678","0","Monday: 8:00 AM - 5:00 PM Tuesday: 8:00 AM - 5:00 PM Wednesday: 8:00 AM - 5:00 PM Thursday: 8:00 AM - 5:00 PM Friday: 8:00 AM - 5:00 PM Saturday: 8:00 AM - 11:59 PM ","http://www.gardenst.com","39.27512","-84.68386","9.31438788617322","Cardboard; Ferrous Metals (Steel or Iron); Non-ferrous (Copper/Brass/Tin); Scrap Metal; Video Game Consoles; PlayStation Consoles","false","true","","","false","false","false","false"
"Walgreens","Walgreens","6355 Dixie Hwy","Fairfield","Butler","OH","45014","5138743528","0","","http://www.walgreens.com","39.32338","-84.50545","9.5987950921111","Cell Phones; Inkjet Cartridge Refilling; Inkjet Printer Cartridges; Video Game Consoles; PlayStation Consoles","false","true","","","false","false","false","false"
"Call2Recycle at the Home Depot","Call2Recycle at the Home Depot","1266 Omniplex Dr ","Cincinnati","Hamilton County","OH","45240","5136716012","0","","http://www.homedepot.com/","39.3027675","-84.5274718","9.69739046830884","Cell Phones; Compact Fluorescent Lights; Ni-Cd Batteries; Li-Ion Batteries; Ni-MH Batteries; Ni-Zn Batteries; Small Sealed Lead Acid Batteries; Video Game Consoles; PlayStation Consoles; Batteries (Rechargeable); Cell Phone Batteries; Li-Ion Batteries; Ni-Cd Batteries; Ni-MH Batteries; Small Sealed Lead Acid Batteries","false","true","The Home Depot accepts used rechargeable batteries and compact fluorescent bulbs. Look for the orange drop boxes, usually located near the front entrance near the customer service desk, or ask a store associate for more details.","Call2Recycle","false","false","false","false"
"Crosby Township Recycling Drop-Off Site","","8382 New Haven Road","Harrison","","OH","45030","5139467766","0","","","39.2766386","-84.716958","9.72680450693093","","false","false","","","false","false","false","false"
"Call2Recycle at Grainger","Call2Recycle at Grainger","8700 Le Saint Dr","West Chester","Butler","OH","45014","5133412060","0","","http://www.grainger.com/","39.32775","-84.49838","9.72898619141673","Cell Phones; Ni-Cd Batteries; Li-Ion Batteries; Ni-MH Batteries; Ni-Zn Batteries; Small Sealed Lead Acid Batteries; Video Game Consoles; PlayStation Consoles","false","true","The U.S. EPA estimates that more than 350 million rechargeable batteries are purchased annually in the U.S. Thanks to the environmental commitment of this location, its easy and free to recycle your batteries. Bring your rechargeable batteries to this location and look for the recycling box or ask an associate how you can do your part for the environment.","","false","false","false","false"
"Home Depot","Home Depot","1266 Omniplex Dr","Cincinnati","Hamilton","OH","45240","5136716012","0","","http://www.homedepot.com","39.30187","-84.52743","9.74511859595127","Compact Fluorescent Lights; Batteries (Rechargeable); Video Game Consoles; PlayStation Consoles","false","true","Home Depot accepts compact fluorescent bulbs and used power tool rechargeable batteries. Look for the orange drop boxes, usually located near the front entrance near the customer service desk.","","false","false","false","false"
