name,description,address,city,region,province,postal_code,phone,fax,hours,url,latitude,longitude,distance,materials,pickup,dropoff,notes,groups,curbside,municipal,national,event_only
"Whole Foods Market","Whole Foods Market","2693 Edmondson Rd","Cincinnati","Hamilton","OH","45209","5135318015","0","","http://www.wholefoodsmarket.com/","39.14856","-84.44353","3.02441016981002","Plastic #5 (Polypropylene); Plastic Shopping Bags; Batteries (Rechargeable); Alkaline/Single-Use Batteries; Gift Cards; Cork; Shoes; Water Filters; Bubble Wrap (Reuse); Food Storage Bags; Video Game Consoles; PlayStation Consoles","false","true","Most Whole Foods stores participate in a variety of recycling programs. Items accepted may vary slightly by location - check with your local store to see what they are currently accepting.","","false","false","false","false"
"REI - Cincinnati","REI - Cincinnati","2643 Edmondson Rd","Cincinnati","Hamilton ","OH","45209","5139241938","0","","","39.14784775","-84.445981769636","3.04875652200648","E-Bike Batteries","false","true","Call or Check Online for Hours","Call2Recycle","false","false","false","false"
"City of Cincinnati - North Avondale Drop-Off","City of Cincinnati - North Avondale Drop-Off","617 Clinton Springs Ave","Cincinnati","Hamilton","OH","45229","5133523200","0","","http://www.cincinnati-oh.gov/","39.15673","-84.49207","3.10709037165154","Plastic #1 (PETE); Plastic #2 (HDPE); Plastic #2 (Color HDPE); Aerosol Spray Cans; Aluminum Cans; Glass (Blue); Glass (Brown); Brown Paper Bags; Cardboard; Catalogs; Glass (Clear); Computer Paper; Drink Boxes; Gift Boxes; Glass (Green); Greeting Cards; Magazines; Milk Cartons; Paper (Mixed); Newspapers; Paperboard; Phone books; Tin or Steel Cans; Office Paper","false","true","","","false","false","false","false"
"North Avondale Recycling Drop-Off Site","","617 Clinton Springs Ave","Cincinnati","","OH","45229","5139467766","0","","","39.1564846","-84.4917853","3.11053455356403","","false","false","","","false","false","false","false"
"Walgreens","Walgreens","4090 E Galbraith Rd","Cincinnati","Hamilton","OH","45236","5138912808","0","","http://www.walgreens.com","39.20862","-84.40007","3.17868387955254","Cell Phones; Inkjet Cartridge Refilling; Inkjet Printer Cartridges; Video Game Consoles; PlayStation Consoles","false","true","","","false","false","false","false"
"Whole Foods Market","","2693 Edmondson Rd","Cincinnati","","OH","45208","5135318015","0","","https://www.preserve.eco/","39.1455459","-84.4470495","3.19759120312657","","false","false","","","false","false","false","false"
"Sprint","Sprint","2733 Madison Rd","Cincinnati","Hamilton","OH","45209","5133216766","0","Monday: 9:00 AM - 9:00 PM Tuesday: 9:00 AM - 9:00 PM Wednesday: 9:00 AM - 9:00 PM Thursday: 9:00 AM - 9:00 PM Friday: 9:00 AM - 9:00 PM Saturday: 9:00 AM - 9:00 PM Sunday: 11:00 AM - 6:00 PM ","http://green.sprint.com/","39.14595","-84.44182","3.22013385215651","Cell Phones; Batteries (Rechargeable); Cell Phone Batteries; Video Game Consoles; PlayStation Consoles","false","true","Sprint Buyback: You could earn up to $300 in credit towards a new device when you recycle your old eligible model from any carrier. Or donate the proceeds from your recycled phones with Sprint Project Connect.","","false","false","false","false"
"AT&T Wireless","AT&T Wireless","2692 Madison Rd Ste J","Cincinnati","Hamilton","OH","45208","5133515851","0","Monday: 9:00 AM - 8:00 PM Tuesday: 9:00 AM - 8:00 PM Wednesday: 9:00 AM - 8:00 PM Thursday: 9:00 AM - 8:00 PM Friday: 9:00 AM - 8:00 PM Saturday: 9:00 AM - 7:00 PM Sunday: 11:00 AM - 5:00 PM ","http://www.att.com/","39.14528","-84.44324","3.24953956408756","Cell Phones; Ni-Cd Batteries; Batteries (Rechargeable); Cell Phone Batteries; Tablets; Li-Ion Batteries; Video Game Consoles; PlayStation Consoles","false","true","Receive an AT&T Promotion Card worth the trade-in value of your smartphone, tablet, or netbook. You can also donate the trade-in value to Cell Phones for Soldiers.","","false","false","false","false"
"Village of Lincoln Heights Recycling Drop-Off Site","","Corner of Magee & Simmons","Cincinnati","","OH","45215","5139467766","0","","","39.238668","-84.4552394","3.26561368209269","","false","false","","","false","false","false","false"
"RadioShack","RadioShack","3866 Paxton Ave","Cincinnati","Hamilton","OH","45209","5138718100","0","Monday: 10:00 AM - 9:00 PM Tuesday: 10:00 AM - 9:00 PM Wednesday: 10:00 AM - 9:00 PM Thursday: 10:00 AM - 9:00 PM Friday: 10:00 AM - 9:00 PM Saturday: 10:00 AM - 9:00 PM Sunday: 12:00 PM - 6:00 PM ","http://www.radioshack.com","39.14591","-84.43008","3.41737004132912","Ni-Cd Batteries; Batteries (Rechargeable); Video Game Consoles; PlayStation Consoles","false","true","","","false","false","false","false"
"Call2Recycle at RadioShack","Call2Recycle at RadioShack","3866 Paxton Ave Ste D","Cincinnati","Hamilton","OH","45209","5138718100","0","","http://www.radioshack.com/","39.14591","-84.43008","3.41737004132912","Cell Phones; Ni-Cd Batteries; Li-Ion Batteries; Ni-MH Batteries; Ni-Zn Batteries; Small Sealed Lead Acid Batteries; Video Game Consoles; PlayStation Consoles","false","true","As the first national retailer to partner with Call2Recycle, RadioShack is at the forefront of the rechargeable battery recycling cause and is pleased to offer battery recycling at thousands of convenient RadioShack locations for free.  Simply drop them off at your local RadioShack and theyll take care of the rest.  Ask a store associate for more details.","","false","false","false","false"
"Walgreens","Walgreens","3822 Paxton Ave","Cincinnati","Hamilton","OH","45209","5138714615","0","","http://www.walgreens.com","39.14585","-84.4302","3.41866790526144","Cell Phones; Inkjet Printer Cartridges; Video Game Consoles; PlayStation Consoles","false","true","","","false","false","false","false"
"ACE Hardware","ACE Hardware","3812 Paxton Ave","Cincinnati","Hamilton","OH","45209","5138717500","0","","http://www.acehardware.com/","39.14585","-84.4302","3.41866790526144","Cell Phones; Ni-Cd Batteries; Li-Ion Batteries; Ni-MH Batteries; Ni-Zn Batteries; Small Sealed Lead Acid Batteries; Video Game Consoles; PlayStation Consoles","false","true","The U.S. EPA estimates that more than 350 million rechargeable batteries are purchased annually in the U.S. Thanks to the environmental commitment of this location, its easy and free to recycle your batteries. Bring your rechargeable batteries to this location and look for the recycling box or ask an associate how you can do your part for the environment.","","false","false","false","false"
"Remke Market","Remke Market","3872 Paxton Ave","Cincinnati","Hamilton","OH","45209","5136195454","0","","http://www.remkes.com/","39.14585","-84.4302","3.41866790526144","Plastic Shopping Bags; Food Storage Bags; Video Game Consoles; PlayStation Consoles","false","true","","","false","false","false","false"
"Kroger0355 1","Kroger0355 1","3760 Paxton Ave","Cincinnati","Hamilton","OH","45209","8583244111","0","","http://www.ecoatm.com/","39.14521","-84.43142","3.43472812557001","Cell Phones; Tablets; MP3 Players; Video Game Consoles; PlayStation Consoles","false","true","ecoATM is an automated, consumer self-serve kiosk that quickly buys back and recycles old phones, mp3 players and tablets.
</br>
Call or email <a href="mailto:max@ecoATM.com">customer support</a> with questions.","","false","false","false","false"
"Walgreens","Walgreens","9 W Mitchell Ave","Cincinnati","Hamilton","OH","45217","5136412426","0","","http://www.walgreens.com","39.16061","-84.50548","3.43505128154923","Cell Phones; Inkjet Printer Cartridges; Video Game Consoles; PlayStation Consoles","false","true","","","false","false","false","false"
"Staples","Staples","3808 Paxton Ave No 14A","Cincinnati","Hamilton County","OH","45209","5133215777","0","Monday: 8:00 AM - 9:00 PM Tuesday: 8:00 AM - 9:00 PM Wednesday: 8:00 AM - 9:00 PM Thursday: 8:00 AM - 9:00 PM Friday: 8:00 AM - 9:00 PM Saturday: 9:00 AM - 9:00 PM Sunday: 11:00 AM - 6:00 PM ","https://www.staples.com/recycle","39.1460991","-84.4283558","3.44278717230034","AC Power Plugs; Batteries (Rechargeable); Cables & Connectors; Cell Phone Batteries; Cell Phones; Computer (Recycling); Hard Drives; Computer Monitors; Cameras; DVD Players/Blu-Ray Players/DVRs; Electronics; E-Readers; GPS Units; Headphones; Inkjet Printer Cartridges; Laptop Computers; Laser Toner Cartridges; Li-Ion Batteries; MP3 Players; Network Equipment; Ni-Cd Batteries; Ni-MH Batteries; Ni-Zn Batteries; Computer Peripherals; Portable Media Players; Printers/Scanners/Fax Machines; Small Electronics; Small Sealed Lead Acid Batteries; Stereo Equipment; Tablets; Telephones; UPS Batteries/Backup Systems; VCRs; Video Game Systems; Blu-Ray Players; Digital Converter Boxes; Video Game Consoles; PlayStation Consoles; Alkaline/Single-Use Batteries","false","true","NO TVs; Limit 6 CEDs per day; ","Sony, Vizio, OEM","false","false","false","false"
"Staples","null","3808 Paxton Ave No 14A","Cincinnati","","OH","45209","5133215777","0","","https://www.staples.com/sbd/cre/marketing/sustainability-center/recycling-services/","39.1460991","-84.4283558","3.44278717230034","Alkaline/Single-Use Batteries; Batteries (Rechargeable); Cell Phone Batteries; Li-Ion Batteries; Ni-Cd Batteries; Ni-MH Batteries; Small Sealed Lead Acid Batteries; Alkaline/Single-Use Batteries; Button Batteries; Non-rechargeable lithium batteries; Cell Phones","false","true","","Call2Recycle","false","false","false","false"
"uBreakiFix","uBreakiFix","3760 Paxton Ave ","Cincinnati","Hamilton County","OH","45209","5134077410","0","","null","39.1447001","-84.4318518","3.45908471187361","Batteries (Rechargeable); Cell Phone Batteries; Cell Phones; Li-Ion Batteries; Ni-Cd Batteries; Ni-MH Batteries; Small Sealed Lead Acid Batteries","false","true","Call or Check Online for Hours","Call2Recycle","false","false","false","false"
"Better World Books - Hyde Park Plaza","","3760 Paxton Ave.","Cincinnati","","OH","45255","8885107107","0","","https://www.betterworldbooks.com/","39.1447033","-84.4295386","3.50544250437061","","false","false","","","false","false","false","false"
"Advance Auto Parts","Advance Auto Parts","4424 W Mitchell Ave","Cincinnati","Hamilton","OH","45232","5136812198","0","","http://www.advanceautoparts.com","39.16808","-84.51399","3.54050766426257","Lead Acid (Pb) Batteries; Used Motor Oil; Video Game Consoles; PlayStation Consoles","false","true","","","false","false","false","false"
"Tires Plus","","272 W Mitchell Ave","Cincinnati","","OH","45232","5136817682","0","","https://www.tiresplus.com/","39.1657839","-84.5125105","3.54662884357847","","false","false","","","false","false","false","false"
"Call2Recycle at RadioShack","Call2Recycle at RadioShack","9866 Reading Rd","Cincinnati","Hamilton","OH","45241","5135639559","0","","http://www.radioshack.com/","39.23909","-84.4303","3.55265399193263","Cell Phones; Ni-Cd Batteries; Li-Ion Batteries; Ni-MH Batteries; Ni-Zn Batteries; Small Sealed Lead Acid Batteries; Video Game Consoles; PlayStation Consoles","false","true","As the first national retailer to partner with Call2Recycle, RadioShack is at the forefront of the rechargeable battery recycling cause and is pleased to offer battery recycling at thousands of convenient RadioShack locations for free.  Simply drop them off at your local RadioShack and theyll take care of the rest.  Ask a store associate for more details.","","false","false","false","false"
"Michel Tires Plus Store","Michel Tires Plus Store","272 W Mitchell Ave","Cincinnati","Hamilton","OH","45232","5136817682","0","","http://www.firestone.com","39.1654","-84.51247","3.55807452291118","Lead Acid (Pb) Batteries; Used Motor Oil; Video Game Consoles; PlayStation Consoles","false","true","","","false","false","false","false"
"MIMCO Inc","MIMCO Inc","2645 Erie Ave Ste 56","Cincinnati","Hamilton","OH","45208","5133219994","0","","","39.1397","-84.44434","3.61850767907443","Aluminum; Ferrous Metals (Steel or Iron); Non-ferrous (Copper/Brass/Tin); High-Temp Alloys; Special Metals; Video Game Consoles; PlayStation Consoles","false","true","","","false","false","false","false"
"Hyde Park Shell Service","Hyde Park Shell Service","2740 Erie Ave ","Cin","Hamilton County","OH","45208","5133213261","0","Monday: 8:00 AM - 5:00 PM Tuesday: 8:00 AM - 5:00 PM Wednesday: 8:00 AM - 5:00 PM Thursday: 8:00 AM - 5:00 PM Friday: 8:00 AM - 5:00 PM ","","39.1397261","-84.4427047","3.63174980113895","Lead Acid (Pb) Batteries; Video Game Consoles; PlayStation Consoles","false","true","This site is located at Erie and Michigan.","","false","false","false","false"
"Monro","Monro","880 W Galbraith Rd","Cincinnati","Hamilton","OH","45231","5135223100","0","Monday: 7:30 AM - 7:00 PM Tuesday: 7:30 AM - 7:00 PM Wednesday: 7:30 AM - 7:00 PM Thursday: 7:30 AM - 7:00 PM Friday: 7:30 AM - 7:00 PM Saturday: 7:30 AM - 4:00 PM ","http://monro.com","39.21594","-84.51527","3.63907496696904","Used Motor Oil; Video Game Consoles; PlayStation Consoles","false","true","","","false","false","false","false"
"Cincinnati Computer Cooperative (C3)","Cincinnati Computer Cooperative (C3)","49 Novner Dr","Cincinnati","Hamilton","OH","45215","5137713262","0","Wednesday: 6:00 AM - 9:00 PM Saturday: 9:00 AM - 1:00 PM ","http://www.cincinnaticomputercooperative.org","39.24525","-84.47197","3.8280620571999","Computer (Reuse); Computer Monitors; Computer (Recycling); Office Equipment; Laser Toner Cartridges; Printers/Scanners/Fax Machines; Memory (RAM), Flash Card/Drive; Laptop Computers; Cables & Connectors; Servers; Power Supplies; Computer Peripherals; Network Equipment; Video Game Consoles; PlayStation Consoles","false","true","","","false","false","false","false"
"Walgreens","Walgreens","8210 Winton Rd","Cincinnati","Hamilton","OH","45231","5139315411","0","","http://www.walgreens.com","39.21761","-84.51819","3.8312337651995","Cell Phones; Inkjet Printer Cartridges; Video Game Consoles; PlayStation Consoles","false","true","","","false","false","false","false"
"Environmental Enterprises Inc","Environmental Enterprises Inc","4650 Spring Grove Ave","Cincinnati","Hamilton","OH","45232","5137722818","0","","http://www.eeienv.com/","39.16464","-84.51807","3.8449515185301","Glue & Adhesives; Aerosol Spray Cans; Antifreeze; Brake Fluid; Lead Acid (Pb) Batteries; Compact Fluorescent Lights; Fertilizer; Fire Extinguishers; Fungicides; Gasoline and Unwanted Fuels; Herbicides; Household Cleaners; Insecticides; Mercury Containing Items; Ni-Cd Batteries; Latex Paint; Pesticides; Pool Chemicals; Propane Tanks; Transmission Fluid; Used Motor Oil; Cell Phone Batteries; Oil-Based Paint; Button Batteries; Video Game Consoles; PlayStation Consoles","true","true","","","false","false","false","false"
"Household Hazardous Waste Collection Program- Environmental Enterprises","Household Hazardous Waste Collection Program- Environmental Enterprises","4650 Spring Grove Ave","Cincinnati","Hamilton","OH","45232","5139467700","0","","http://www.hamiltoncountyrecycles.org","39.16464","-84.51807","3.8449515185301","Plastic #1 (PETE); Plastic #2 (HDPE); Plastic #2 (Color HDPE); Plastic #3 (PVC); Plastic #4 (LDPE); Plastic #5 (Polypropylene); Plastic #6 (Polystyrene); Plastic #7; Glue & Adhesives; Aluminum Cans; Aluminum; Antifreeze; Brake Fluid; Glass (Clear); Compact Fluorescent Lights; Degreasers; Ferrous Metals (Steel or Iron); Fertilizer; Fire Extinguishers; Fluorescent Lamps/Tubes; Fungicides; Gasoline and Unwanted Fuels; Herbicides; Household Cleaners; Insecticides; Mercury Containing Items; Non-ferrous (Copper/Brass/Tin); Unused Paint; Paint Donation; Latex Paint; Paint Thinner; Pesticides; Photography Chemicals; Pool Chemicals; Propane Tanks; Smoke Detector; Solvents; Transmission Fluid; Outdated Medications; Used Motor Oil; Oil Filters; Windows","false","true","This FREE program runs from 3/1/08 to 11/22/08 for Hamilton County residents only! Bring proof of residency. This program does not accept materials from businesses, schools, churches, or non-profits. Please remain in your car so staff can remove your materials. The entrance is directly across from Winton Road.","","false","false","false","false"
"Tires Plus","","8398 Winton Rd","Cincinnati","","OH","45231","5135222525","0","","https://www.tiresplus.com/","39.2198012","-84.5175083","3.87350652365188","","false","false","","","false","false","false","false"
"Michel Tires Plus Store","Michel Tires Plus Store","8398 Winton Rd","Cincinnati","Hamilton","OH","45231","5135222525","0","","http://www.firestone.com","39.21992","-84.5178","3.89112670995962","Lead Acid (Pb) Batteries; Used Motor Oil; Video Game Consoles; PlayStation Consoles","false","true","","","false","false","false","false"
"Pep Boys Auto","Pep Boys Auto","7789 Montgomery Rd","Cincinnati","Hamilton","OH","45236","8007372697","0","","http://www.pepboys.com","39.19838","-84.38222","3.93334207498343","Used Motor Oil; Video Game Consoles; PlayStation Consoles","false","true","","","false","false","false","false"
"Adams-Clermont Joint Solid Waste District Household Hazardous Waste Drop-Off","","4650 Spring Grove Ave","Cincinnati","","OH","45232","5137327745","0","","http://www.eeienv.com/household-hazardous-waste/","39.1645091","-84.5200695","3.94343750984175","","false","false","","","false","false","false","false"
"Environmental Enterprises Inc.","","4650 Spring Grove Ave","Cincinnati","","OH","45232","5135411823","0","","http://www.eeienv.com/","39.1645091","-84.5200695","3.94343750984175","","false","false","","","false","false","false","false"
"Walmart 22501","Walmart 22501","4000 Red Bank Rd","Cincinnati","Hamilton","OH","45227","8583244111","0","","http://www.ecoatm.com/","39.14972","-84.4046","3.95187239403218","Cell Phones; Tablets; MP3 Players; Video Game Consoles; PlayStation Consoles","false","true","ecoATM is an automated, consumer self-serve kiosk that quickly buys back and recycles old phones, mp3 players and tablets.
</br>
Call or email <a href="mailto:max@ecoATM.com">customer support</a> with questions.","","false","false","false","false"
"Verizon Wireless","Verizon Wireless","7790 Montgomery Rd","Cincinnati","Hamilton","OH","45236","8666444532","0","","http://www.verizonwireless.com/","39.19838","-84.3817","3.96097690032975","Cell Phones; Cell Phone Batteries; Video Game Consoles; PlayStation Consoles","false","true","<A Href="https://www.trade-in.vzw.com/home.aspx">
The Verizon Wireless Trade-In Program</A> allows you to trade in your used handset or tablet in a convenient and responsible way. 
<P>
<P>
Verizon Wireless works every day to protect our environment and give our customers opportunities to do the same. <A Href="http://aboutus.vzw.com/Green_Initiative/overview.html">Click here</A> for more examples of the earth-friendly initiatives and programs Verizon Wireless is proud to offer and support.","","false","false","false","false"
"Call2Recycle at RadioShack","Call2Recycle at RadioShack","8541 Winton Rd","Cincinnati","Hamilton","OH","45231","5135213894","0","","http://www.radioshack.com/","39.22257","-84.5176","3.97790243637319","Cell Phones; Ni-Cd Batteries; Li-Ion Batteries; Ni-MH Batteries; Ni-Zn Batteries; Small Sealed Lead Acid Batteries; Video Game Consoles; PlayStation Consoles","false","true","As the first national retailer to partner with Call2Recycle, RadioShack is at the forefront of the rechargeable battery recycling cause and is pleased to offer battery recycling at thousands of convenient RadioShack locations for free.  Simply drop them off at your local RadioShack and theyll take care of the rest.  Ask a store associate for more details.","","false","false","false","false"
"RadioShack","RadioShack","8541 Winton Rd","Cincinnati","Hamilton","OH","45231","5135213894","0","Monday: 10:00 AM - 9:00 PM Tuesday: 10:00 AM - 9:00 PM Wednesday: 10:00 AM - 9:00 PM Thursday: 10:00 AM - 9:00 PM Friday: 10:00 AM - 9:00 PM Saturday: 10:00 AM - 9:00 PM Sunday: 12:00 PM - 6:00 PM ","http://www.radioshack.com","39.22257","-84.5176","3.97790243637319","Ni-Cd Batteries; Batteries (Rechargeable); Video Game Consoles; PlayStation Consoles","false","true","","","false","false","false","false"
"uBreakiFix","uBreakiFix","7338 Kenwood Road","Cincinnati","Hamilton ","OH","45236","5137939111","0","","","39.1965507190401","-84.3805799206995","4.00737347291508","Batteries (Rechargeable); Cell Phone Batteries; Cell Phones; Li-Ion Batteries; Ni-Cd Batteries; Ni-MH Batteries; Small Sealed Lead Acid Batteries","false","true","Call or Check Online for Hours","Call2Recycle","false","false","false","false"
"Target","Target","9099 Plainfield Rd","Blue Ash","Hamilton","OH","45236","5138982021","0","","http://www.target.com/","39.22543","-84.39403","4.02797576890319","Aluminum Cans; Cell Phones; Inkjet Printer Cartridges; MP3 Players; Plastic #1 (PETE); Plastic #2 (HDPE); Plastic Shopping Bags; Video Game Consoles; PlayStation Consoles","false","true","","","false","false","false","false"
"LensCrafters","LensCrafters","7800 Montgomery Rd # 12","Cincinnati","Hamilton","OH","45236","5137935860","0","Monday: 9:00 AM - 9:00 PM Tuesday: 9:00 AM - 9:00 PM Wednesday: 9:00 AM - 9:00 PM Thursday: 9:00 AM - 9:00 PM Friday: 9:00 AM - 9:00 PM Saturday: 9:00 AM - 9:00 PM Sunday: 12:00 PM - 5:00 PM ","http://www.lenscrafters.com","39.19885","-84.38036","4.03620096566184","Eyeglasses; Video Game Consoles; PlayStation Consoles","false","true","","","false","false","false","false"
