name,description,address,city,region,province,postal_code,phone,fax,hours,url,latitude,longitude,distance,materials,pickup,dropoff,notes,groups,curbside,municipal,national,event_only
"Dixie Pulp & Paper Inc","Dixie Pulp & Paper Inc","101 Marina Dr","Tuscaloosa","Tuscaloosa","AL","35406","2057592600","2057592606","","http://www.dixiepaper.com","33.22104","-87.56297","7.59573234687283","Paper (Mixed); Video Game Consoles; PlayStation Consoles","true","true","","","false","false","false","false"
"Dixie Pulp & Paper Inc","","101 Marina Dr","Tuscaloosa","","AL","35406","2057592600","0","","","33.2191384","-87.5640995","7.60497594912561","","false","false","","","false","false","false","false"
"City of Tuscaloosa Curbside Recycling Program","","","Tuscaloosa","","AL","35401","2052484900","0","","https://www.tuscaloosa.com/recycle","33.1690726","-87.6383797","7.6652217644148","","false","false","","","false","false","false","false"
"City of Tuscaloosa Household Hazardous Waste Collection Program","","","Tuscaloosa","","AL","35401","2052484900","0","","https://www.tuscaloosa.com/Government/Departments/Environmental-services/Tier-II/environmental-events","33.1690726","-87.6383797","7.6652217644148","","false","false","","","false","false","false","false"
"Home Depot","Home Depot","1601 13th Ave E","Tuscaloosa","Tuscaloosa","AL","35404","2056332038","0","","http://www.homedepot.com","33.23441","-87.55369","7.68252524588875","Compact Fluorescent Lights; Batteries (Rechargeable); Video Game Consoles; PlayStation Consoles","false","true","Home Depot accepts compact fluorescent bulbs and used power tool rechargeable batteries. Look for the orange drop boxes, usually located near the front entrance near the customer service desk.","","false","false","false","false"
"Call2Recycle at the Home Depot","Call2Recycle at the Home Depot","1601 13th Ave East","Tuscaloosa","Tuscaloosa","AL","35404","2056332038","0","","http://www.homedepot.com/","33.23441","-87.55369","7.68252524588875","Cell Phones; Compact Fluorescent Lights; Ni-Cd Batteries; Li-Ion Batteries; Ni-MH Batteries; Ni-Zn Batteries; Small Sealed Lead Acid Batteries; Video Game Consoles; PlayStation Consoles","false","true","The Home Depot accepts used rechargeable batteries and compact fluorescent bulbs. Look for the orange drop boxes, usually located near the front entrance near the customer service desk, or ask a store associate for more details.","","false","false","false","false"
"Advance Auto Parts","","1401 Ml King Jr Blvd","Tuscaloosa","","AL","35401","2057582884","0","","http://shop.advanceautoparts.com/webapp/wcs/stores/servlet/home___","33.201691","-87.5770443","7.70578509300559","","false","false","","","false","false","false","false"
"Shred Nations","Shred Nations (inside Pak Mail)","1655 McFarland Blvd N","Tuscaloosa","Tuscaloosa","AL","35406","8007473365","0","","http://www.shrednations.com/dropoff/location/tuscaloosa/429f8590-93db-49c7-6942-51a69acd556f","33.2361","-87.55173","7.74657778343548","Cell Phones; Computer (Recycling); Laptop Computers; Small Televisions; Documents to Shred; Video Game Consoles; PlayStation Consoles","true","true","Shred Nations offers document shredding, hard drive destruction, electronics recycling and more. Visit website for quotes and full list of services offered in your area. ","","false","false","false","false"
"Tuscaloosa Curbside Recycling","Tuscaloosa Curbside Recycling","1120 28th Ave","Tuscaloosa","Tuscaloosa","AL","35401","2052484900","0","","http://www.tuscaloosa.com/recycle","33.20388","-87.57201","7.83116640909242","Aluminum Cans; Book Recycling; Brown Paper Bags; Cardboard; Catalogs; Magazines; Newspapers; Paper (Mixed); Phone books; Plastic #1 (PETE); Plastic #2 (HDPE); Shredded Paper; Tin or Steel Cans","false","false","Bins must be at the curb before 7 AM for pick-up.","","true","false","false","false"
"USPS Post Office Box Lobby Recycling Program","US Post Office","842 Industrial Park Blvd","Gordo","Pickens","AL","35466","8002758777","0","","https://www.usps.com/","33.30092","-87.81126","7.93187554639368","Catalogs; Greeting Cards; Magazines; Paper (Mixed)","false","true","","","false","false","false","false"
"US Post Office","USPS Discarded Lobby Mail Recycling Program","842 Industrial Park Blvd","Gordo","Pickens","AL","35466","0","0","","","33.30092","-87.81126","7.93187554639368","Video Game Consoles; PlayStation Consoles","false","true","","","false","false","false","false"
"USPS Post Office Box Lobby Recycling Program","US Post Office","2029 University Blvd ","Tuscaloosa","Tuscaloosa County","AL","35401","8002758777","0","","https://www.usps.com/","33.2111793","-87.5632847","7.93806292212487","Catalogs; Greeting Cards; Magazines; Paper (Mixed)","false","true","","","false","false","false","false"
"USPS Post Office Box Lobby Recycling Program","US Post Office","1313 22nd Ave","Tuscaloosa","Tuscaloosa","AL","35401","8002758777","0","","https://www.usps.com/","33.20251","-87.56236","8.32909769257427","Catalogs; Greeting Cards; Magazines; Paper (Mixed)","false","true","","","false","false","false","false"
"Publix","","1190 University Boulevard","Tuscaloosa","","AL","35401","2052475044","0","","https://sustainability.publix.com/storefront/customer-recycling/","33.2121147","-87.5535685","8.37661571533426","","false","false","","","false","false","false","false"
"UPS Store","UPS Store","1130 University Blvd","Tuscaloosa","Tuscaloosa","AL","35401","2052480290","0","Monday: 8:30 AM - 7:00 PM Tuesday: 8:30 AM - 7:00 PM Wednesday: 8:30 AM - 7:00 PM Thursday: 8:30 AM - 7:00 PM Friday: 8:30 AM - 6:00 PM Saturday: 10:00 AM - 4:00 PM ","http://www.upsstore.com","33.21082","-87.55275","8.46370090965785","Packing Materials; Packing Peanut (Reuse); Video Game Consoles; PlayStation Consoles","false","true","","","false","false","false","false"
"O'Reilly Auto Parts","O'Reilly Auto Parts","1715 15th St","Tuscaloosa","Tuscaloosa","AL","35401","2057521581","0","Monday: 8:00 AM - 9:00 PM Tuesday: 8:00 AM - 9:00 PM Wednesday: 8:00 AM - 9:00 PM Thursday: 8:00 AM - 9:00 PM Friday: 8:00 AM - 9:00 PM Saturday: 8:00 AM - 9:00 PM Sunday: 8:00 AM - 6:00 PM ","http://www.oreillyauto.com/","33.19953","-87.56022","8.55236329410122","Lead Acid (Pb) Batteries; Transmission Fluid; Used Motor Oil; Video Game Consoles; PlayStation Consoles","false","true","Most stores offer Used Oil & Battery Recycling, Battery Testing, 
Electrical & Module Testing, Loaner Tool Program, Drum / Rotor Resurfacing. Call your location for more details.","","false","false","false","false"
"Liberty Recycling","Liberty Recycling","2664 24th St","Tuscaloosa","Tuscaloosa","AL","35401","2053450094","2053450095","","http://www.libertyrecyclingcenter.com","33.19092","-87.56889","8.55427091253479","Aluminum Cans; Aluminum; Car; Lead Acid (Pb) Batteries; Construction Materials; Ferrous Metals (Steel or Iron); Large Household Appliances; Non-ferrous (Copper/Brass/Tin); Tin or Steel Cans; Scrap Metal; High-Temp Alloys; Special Metals; Video Game Consoles; PlayStation Consoles","false","true","","","false","false","false","false"
"O'Reilly Auto Parts","null","1715 15th Street","Tuscaloosa","","AL","35401","2057521581","0","","http://oreillyauto.custhelp.com/app/error/error_id/6","33.1992067","-87.5598634","8.58233220909368","","false","false","","","false","false","false","false"
"AT&T Wireless","AT&T Wireless","1351 Mcfarland Blvd Ne","Tuscaloosa","Tuscaloosa","AL","35406","2057591086","0","Monday: 9:00 AM - 7:00 PM Tuesday: 9:00 AM - 7:00 PM Wednesday: 9:00 AM - 7:00 PM Thursday: 9:00 AM - 7:00 PM Friday: 9:00 AM - 7:00 PM Saturday: 9:00 AM - 6:00 PM Sunday: 12:00 PM - 6:00 PM ","http://www.att.com/","33.2297","-87.53893","8.59543523025796","Cell Phones; Ni-Cd Batteries; Batteries (Rechargeable); Cell Phone Batteries; Tablets; Li-Ion Batteries; Video Game Consoles; PlayStation Consoles","false","true","Receive an AT&T Promotion Card worth the trade-in value of your smartphone, tablet, or netbook. You can also donate the trade-in value to Cell Phones for Soldiers.","","false","false","false","false"
"Liberty Recycling Center","","2664 24th Street","Tuscaloosa","","AL","35401","2057525242","0","","","33.1910671","-87.565501","8.69211862189601","","false","false","","","false","false","false","false"
"Tuscaloosa Recycling Drop-Off Site - Fire Station #3","","202 Rice Valley Rd NE","Tuscaloosa","","AL","35406","2053490260","0","","","33.2419289","-87.5322064","8.69793750977427","","false","false","","","false","false","false","false"
"Tuscaloosa Fire Station #3 Recycling Drop-Off","Tuscaloosa Fire Station #3 Recycling Drop-Off","202 Rice Valley Rd NE","Tuscaloosa","Tuscaloosa","AL","35406","2053490260","0","Sunday: 12:00 AM - 11:59 PM Monday: 12:00 AM - 11:59 PM Tuesday: 12:00 AM - 11:59 PM Wednesday: 12:00 AM - 11:59 PM Thursday: 12:00 AM - 11:59 PM Friday: 12:00 AM - 11:59 PM Saturday: 12:00 AM - 11:59 PM ","http://www.tuscaloosa.com/Government/Departments/Environmental-services/Tier-IV/recycling-drop-off","33.24168","-87.53193","8.71789286849685","Plastic #1 (PETE); Plastic #2 (HDPE); Plastic #2 (Color HDPE); Aluminum Cans; Cardboard; Catalogs; Magazines; Paper (Mixed); Newspapers; Plastic Shopping Bags; Tin or Steel Cans; Office Paper","false","true","","","false","false","false","false"
"RadioShack","RadioShack","1701 McFarland Blvd E Ste 162","Tuscaloosa","Tuscaloosa","AL","35404","2055534275","0","Monday: 10:00 AM - 9:00 PM Tuesday: 10:00 AM - 9:00 PM Wednesday: 10:00 AM - 9:00 PM Thursday: 10:00 AM - 9:00 PM Friday: 10:00 AM - 9:00 PM Saturday: 10:00 AM - 9:00 PM Sunday: 1:00 AM - 5:30 PM ","http://www.radioshack.com","33.23054","-87.53458","8.80942807615582","Ni-Cd Batteries; Batteries (Rechargeable); Video Game Consoles; PlayStation Consoles","false","true","","","false","false","false","false"
"USPS Post Office Box Lobby Recycling Program","US Post Office","104 Ferguson Ctr","Tuscaloosa","Tuscaloosa","AL","35486","8002758777","0","","https://www.usps.com/","33.20673","-87.53918","9.28121848338154","Catalogs; Greeting Cards; Magazines; Paper (Mixed)","false","true","","","false","false","false","false"
"US Post Office","USPS Discarded Lobby Mail Recycling Program","104 Ferguson Ctr","Tuscaloosa","Tuscaloosa","AL","35486","0","0","","","33.20673","-87.53918","9.28121848338154","Video Game Consoles; PlayStation Consoles","false","true","","","false","false","false","false"
"Richard Curry Environmental Services Complex","Richard Curry Environmental Services Complex","3440 Kauloosa Ave","Tuscaloosa","Tuscaloosa","AL","35401","2052485311","0","Monday: 8:00 AM - 4:00 PM Tuesday: 8:00 AM - 4:00 PM Wednesday: 8:00 AM - 4:00 PM Thursday: 8:00 AM - 4:00 PM Friday: 8:00 AM - 4:00 PM ","http://www.ww.tuscaloosa.com/recycle","33.18058","-87.56285","9.30063016338723","Cell Phones; Computer Monitors; Computer (Recycling); Inkjet Printer Cartridges; Batteries (Rechargeable); Laser Toner Cartridges; Printers/Scanners/Fax Machines; Memory (RAM), Flash Card/Drive; Laptop Computers; Tablets; Portable Media Players; Cables & Connectors; Servers; Wire; Microwaves; UPS Batteries/Backup Systems; Computer Peripherals; Network Equipment","false","true","Call to schedule an appointment to drop-off large quantities. All drop-offs will require citizens to come to front door to sign in and let the staff know what type of electronics they have to recycle.","","false","false","false","false"
"Tuscaloosa Environmental Services","Drop-off Recycling Trailer at City of Tuscaloosa Environmental Services","3440 Kauloosa Ave","Tuscaloosa","Tuscaloosa","AL","35401","2052482900","0","Monday: 7:00 AM - 5:00 PM Tuesday: 7:00 AM - 5:00 PM Wednesday: 7:00 AM - 5:00 PM Thursday: 7:00 AM - 5:00 PM Friday: 7:00 AM - 5:00 PM ","http://www.ww.tuscaloosa.com/recycle","33.18058","-87.56285","9.30063016338723","Aluminum Cans; Cardboard; Computer Paper; Glass (Blue); Glass (Brown); Glass (Clear); Glass (Green); Magazines; Newspapers; Office Paper; Paper (Mixed); Plastic #1 (PETE); Plastic #2 (HDPE); Plastic Bottle Caps; Plastic Film; Plastic Shopping Bags; Shredded Paper; Tin or Steel Cans; Unused Paper","false","true","","","false","false","false","false"
"City of Tuscaloosa Environmental Services - Recycling Drop-Off","City of Tuscaloosa Environmental Services - Recycling Drop-Off","3431 Kauloosa Ave","Tuscaloosa","Tuscaloosa","AL","35401","2052482900","0","Monday: 7:00 AM - 5:00 PM Tuesday: 7:00 AM - 5:00 PM Wednesday: 7:00 AM - 5:00 PM Thursday: 7:00 AM - 5:00 PM Friday: 7:00 AM - 5:00 PM ","http://www.tuscaloosa.com/Government/Departments/Environmental-services/Tier-IV/recycling-drop-off","33.18062","-87.56267","9.30610073624988","Plastic #1 (PETE); Plastic #2 (HDPE); Aluminum Cans; Cardboard; Magazines; Paper (Mixed); Newspapers; Paperboard; Plastic Shopping Bags; Tin or Steel Cans; Office Paper; Shredded Paper","false","true","","","false","false","false","false"
"Tuscaloosa Recycling Drop-Off Site - Environmetal Services Department","","3431 Kauloosa Ave","Tuscaloosa","","AL","35406","2053492010","0","","","33.1800084","-87.5626847","9.33520068580252","","false","false","","","false","false","false","false"
"Thermostat Recycling - CITY OF TUSCALOOSA","","3440 Kauloosa Ave.","Tuscaloosa","","AL","35401","2052484900","0","","https://www.thermostat-recycle.org","33.1793069","-87.5633001","9.34424914154167","","false","false","","","false","false","false","false"
"Batteries Plus","Batteries Plus","505 15th St E Ste B","Tuscaloosa","Tuscaloosa","AL","35401","2053431780","2053437487","","http://www.batteriesplus.com/store_details/239.aspx","33.19866","-87.54307","9.39060325387197","Ni-Cd Batteries; Batteries (Rechargeable); Alkaline/Single-Use Batteries; Video Game Consoles; PlayStation Consoles","false","true","Some fees for battery recycling may apply. Please contact your Local store for details.

Batteries Plus lead by example by recycling the majority of the batteries we sell. Not only do we recycle to protect our environment, we support retail and business customers alike by keeping them in full compliance with federal, state, municipal, EPA and DOT regulations governing the disposal and recycling of spent batteries and select electronics.","","false","false","false","false"
"Publix","","4851 Rice Mine Road Northeast","Tuscaloosa","","AL","35406","2052477666","0","","https://sustainability.publix.com/storefront/customer-recycling/","33.2632509","-87.5136969","9.49417993694339","","false","false","","","false","false","false","false"
"Speedy Oil Change","Speedy Oil Change","100 15th St","Tuscaloosa","Tuscaloosa","AL","35401","2053450343","0","Monday: 8:00 AM - 5:30 PM Tuesday: 8:00 AM - 5:30 PM Wednesday: 8:00 AM - 5:30 PM Thursday: 8:00 AM - 5:30 PM Friday: 8:00 AM - 5:30 PM Sunday: 8:00 AM - 4:00 PM ","","33.1986","-87.53899","9.58876401779468","Used Motor Oil; Video Game Consoles; PlayStation Consoles","false","true","","","false","false","false","false"
"Habitat for Humanity ReStore","Habitat for Humanity ReStore","1120 35th St Ste B","Tuscaloosa","Tuscaloosa","AL","35401","2053494620","0","","http://habitattuscaloosa.org/","33.17975","-87.55475","9.67853309453654","Construction Materials (Reuse); Household Goods; Unused Paint; Reusable Appliance Donation; Miscellaneous Tools; Fans; Video Game Consoles; PlayStation Consoles","true","true","Call ext 102 to schedule a pickup.","","false","false","false","false"
"AutoZone","","3500 Greensboro Ave.","Tuscaloosa","","AL","35401","2057588351","0","","https://www.autozone.com/landing/page.jsp?name=in-our-stores","33.1801134","-87.5529119","9.73968299408186","","false","false","","","false","false","false","false"
"University Church of Christ Recycling Drop-Off","University Church of Christ Recycling Drop-Off","1200 Julia Tutwiler Dr","Tuscaloosa","Tuscaloosa","AL","35404","2052484900","0","","http://www.tuscaloosa.com/recycling","33.21273","-87.52499","9.80641600628739","Plastic #1 (PETE); Plastic #2 (HDPE); Aluminum Cans; Cardboard; Magazines; Paper (Mixed); Newspapers; Paperboard; Plastic Shopping Bags; Tin or Steel Cans; Office Paper; Shredded Paper","false","true","","","false","false","false","false"
"Tuscaloosa Recycling Drop-Off Site - University Church of Christ","","1200 Julia Tutwiler Dr","Tuscaloosa","","AL","35404","2053490260","0","","","33.2141258","-87.5220427","9.91827409036829","","false","false","","","false","false","false","false"
"Norman's Chevron Service Center","Norman's Chevron Service Center","201 Hargrove Rd","Tuscaloosa","Tuscaloosa","AL","35401","2057582224","0","Monday: 7:00 AM - 6:00 PM Tuesday: 7:00 AM - 6:00 PM Wednesday: 7:00 AM - 6:00 PM Thursday: 7:00 AM - 6:00 PM Friday: 7:00 AM - 6:00 PM ","","33.18989","-87.53865","9.9493051284276","Used Motor Oil; Video Game Consoles; PlayStation Consoles","false","true","This site accepts small quantities of used oil, please do not mix anything with the oil.","","false","false","false","false"
"AutoZone","AutoZone","3500 Greensboro Ave","Tuscaloosa","Tuscaloosa","AL","35401","2057588351","0","Monday: 7:00 AM - 9:00 PM Tuesday: 7:00 AM - 9:00 PM Wednesday: 7:00 AM - 9:00 PM Thursday: 7:00 AM - 9:00 PM Friday: 7:00 AM - 9:00 PM Saturday: 7:00 AM - 9:00 PM Sunday: 8:00 AM - 9:00 PM ","http://www.autozone.com","33.17852","-87.5492","9.97262754056497","Lead Acid (Pb) Batteries; Used Motor Oil; Video Game Consoles; PlayStation Consoles","false","true","Most AutoZone stores accept used motor oil, transmission fluid, gear oil and automotive batteries. Call to see what your local store is currently accepting.","","false","false","false","false"
