name,description,address,city,region,province,postal_code,phone,fax,hours,url,latitude,longitude,distance,materials,pickup,dropoff,notes,groups,curbside,municipal,national,event_only
"Shred Nations","Shred Nations (inside The UPS Store)","29030 SW Town Center Loop E Ste 202","Wilsonville","Clackamas","OR","97070","8007473365","0","Monday: 8:00 AM - 6:00 PM Tuesday: 8:00 AM - 6:00 PM Wednesday: 8:00 AM - 6:00 PM Thursday: 8:00 AM - 6:00 PM Friday: 8:00 AM - 6:00 PM Saturday: 9:00 AM - 5:00 PM ","http://www.shrednations.com/dropoff/location/wilsonville/52493b96-228c-c4f1-48af-5283cccfbb4c","45.30952","-122.76221","12.2442331197337","Cell Phones; Computer (Recycling); Laptop Computers; Small Televisions; Documents to Shred; Video Game Consoles; PlayStation Consoles","true","true","Shred Nations offers document shredding, hard drive destruction, electronics recycling and more. Visit website for quotes and full list of services offered in your area. ","","false","false","false","false"
"Safeway","","1525 West Main Street","Molalla","","OR","97038","5038294848","0","","https://shop.safeway.com/home.html","45.1516281","-122.6035692","12.2490023887039","","false","false","","","false","false","false","false"
"Keizer Computer Annex","","4118 River Rd NE","Keizer","","OR","97303","5035405909","0","","https://keizercomputerannex.com/","45.0116955","-123.0207333","12.2490387452619","","false","false","","","false","false","false","false"
"Northwest Polymers","","291 Commercial Pkwy","Molalla","","OR","97038","5038293550","0","","http://www.nwpoly.com/","45.1483704","-122.6020249","12.317884196771","","false","false","","","false","false","false","false"
"Newberg Steel","","23995 State Highway 99W","Newberg","","OR","97132","8884022665","0","","https://www.discoverbooks.com/Default.asp","45.2955293","-122.9910177","12.350639765052","","false","false","","","false","false","false","false"
"Newberg Steel","","105 N Main St","Newberg","","OR","97132","8884022665","0","","https://www.discoverbooks.com/Default.asp","45.3006084","-122.9794425","12.3619207299572","","false","false","","","false","false","false","false"
"Newberg Extreme Cycle","Newberg Extreme Cycle","301 W 1st St","Newberg","Yamhill","OR","97132","5035541595","0","","","45.30042","-122.9812","12.3928288991568","Electronics; MP3 Players; Video Game Consoles; PlayStation Consoles","false","true","","","false","false","false","false"
"Pacific Sanitation, Inc.","Pacific Sanitation, Inc.","3475 Blossom Dr NE","Salem","Marion","OR","97305","5033931031","0","Sunday: 12:00 AM - 11:59 PM Monday: 12:00 AM - 11:59 PM Tuesday: 12:00 AM - 11:59 PM Wednesday: 12:00 AM - 11:59 PM Thursday: 12:00 AM - 11:59 PM Friday: 12:00 AM - 11:59 PM Saturday: 12:00 AM - 11:59 PM ","","44.99344","-122.99285","12.4357390484257","Plastic #1 (PETE); Plastic #2 (Color HDPE); Aluminum Cans; Glass (Blue); Glass (Brown); Cardboard; Glass (Clear); Ferrous Metals (Steel or Iron); Gift Boxes; Glass (Green); Greeting Cards; Magazines; Paper (Mixed); Newspapers; Non-ferrous (Copper/Brass/Tin); Latex Paint; Paperboard; Phone books; Alkaline/Single-Use Batteries; Tin or Steel Cans; Used Motor Oil; Office Paper; Video Game Consoles; PlayStation Consoles","false","true","This site accepts small quantities of business recycling.","","false","false","false","false"
"Target","Target","25925 SW Heather Pl","Wilsonville","Washington","OR","97070","5036827781","0","","http://www.target.com/","45.3085","-122.74846","12.4416884654908","Aluminum Cans; Cell Phones; Inkjet Printer Cartridges; MP3 Players; Plastic #1 (PETE); Plastic #2 (HDPE); Plastic Shopping Bags; Video Game Consoles; PlayStation Consoles","false","true","","","false","false","false","false"
"Keller Photo","Keller Photo","5458 River Rd N","Keizer","Marion","OR","97303","5034630538","0","","","45.00442","-123.02547","12.7802981275836","Packing Peanut (Reuse); Video Game Consoles; PlayStation Consoles","false","true","","","false","false","false","false"
"Rite Aid","Rite Aid","5452 River Rd N","Keizer","Marion","OR","97303","5033938950","0","Monday: 9:00 AM - 11:00 PM Tuesday: 9:00 AM - 11:00 PM Wednesday: 9:00 AM - 11:00 PM Thursday: 9:00 AM - 11:00 PM Friday: 9:00 AM - 11:00 PM ","","45.00432","-123.02556","12.7884049065777","Ni-Cd Batteries; Other Batteries; Batteries (Rechargeable); Alkaline/Single-Use Batteries; Video Game Consoles; PlayStation Consoles","false","true","","","false","false","false","false"
"Call2Recycle at RadioShack","Call2Recycle at RadioShack","5410 River Rd N","Keizer","Marion","OR","97303","5033939616","0","","http://www.radioshack.com/","45.00413","-123.02572","12.8034584317222","Cell Phones; Ni-Cd Batteries; Li-Ion Batteries; Ni-MH Batteries; Ni-Zn Batteries; Small Sealed Lead Acid Batteries; Video Game Consoles; PlayStation Consoles","false","true","As the first national retailer to partner with Call2Recycle, RadioShack is at the forefront of the rechargeable battery recycling cause and is pleased to offer battery recycling at thousands of convenient RadioShack locations for free.  Simply drop them off at your local RadioShack and theyll take care of the rest.  Ask a store associate for more details.","","false","false","false","false"
"Albertsons","Albertsons","5450 River Rd N","Keizer","Marion","OR","97303","5033903922","0","","","45.00413","-123.02572","12.8034584317222","Plastic Shopping Bags; Food Storage Bags; Video Game Consoles; PlayStation Consoles","false","true","","","false","false","false","false"
"RadioShack","RadioShack","5410 River Rd N","Keizer","Marion","OR","97303","5033939616","0","Monday: 9:00 AM - 8:00 PM Tuesday: 9:00 AM - 8:00 PM Wednesday: 9:00 AM - 8:00 PM Thursday: 9:00 AM - 8:00 PM Friday: 9:00 AM - 9:00 PM Saturday: 9:00 AM - 9:00 PM Sunday: 10:00 AM - 7:00 PM ","null","45.00413","-123.02572","12.8034584317222","Batteries (Rechargeable); Video Game Consoles; PlayStation Consoles","false","true","This site is located in the Albertson's shopping center.","","false","false","false","false"
"Shred Nations","Shred Nations (inside The UPS Store)","5434 River Rd N","Keizer","Marion","OR","97303","8007473365","0","Monday: 8:00 AM - 6:00 PM Tuesday: 8:00 AM - 6:00 PM Wednesday: 8:00 AM - 6:00 PM Thursday: 8:00 AM - 6:00 PM Friday: 8:00 AM - 6:00 PM Saturday: 8:00 AM - 4:00 PM ","http://www.shrednations.com/dropoff/location/keizer/5ddb3e32-4707-1ec7-4dac-528514df9125","45.00413","-123.02572","12.8034584317222","Cell Phones; Computer (Recycling); Laptop Computers; Small Televisions; Documents to Shred; Video Game Consoles; PlayStation Consoles","true","true","Shred Nations offers document shredding, hard drive destruction, electronics recycling and more. Visit website for quotes and full list of services offered in your area. ","","false","false","false","false"
"Tuscarora","Tuscarora","9740 SW Hillman Ct","Wilsonville","Clackamas","OR","97070","5036828719","0","Monday: 9:00 AM - 3:00 PM Tuesday: 9:00 AM - 3:00 PM Wednesday: 9:00 AM - 3:00 PM Thursday: 9:00 AM - 3:00 PM Friday: 9:00 AM - 3:00 PM ","","45.3217","-122.77616","12.8115725291767","Plastic #6 (Polystyrene); Packing Peanut (Reuse); Video Game Consoles; PlayStation Consoles","false","true","This site accepts number 6 plastic only.  Please contact the site for further information.","","false","false","false","false"
"Marion County Curbside Recycling","Marion County Curbside Recycling","5155 Silverton Rd NE","Salem","Marion","OR","97305","0","0","","http://www.co.marion.or.us/","44.97333","-122.95569","12.825057667953","Aerosol Spray Cans; Aluminum Cans; Book Recycling; Brown Paper Bags; Catalogs; Computer Paper; Greeting Cards; Magazines; Newspapers; Office Paper; Paper (Mixed); Paper Egg Cartons; Paperboard; Phone books; Plant Trays, Pots & Tags; Plastic #1 (PETE); Plastic #2 (HDPE); Plastic #3 (PVC); Plastic #4 (LDPE); Plastic #5 (Polypropylene); Plastic #6 (Polystyrene); Plastic #7; Rigid Plastics; Shredded Paper; Tin or Steel Cans; Compostable Plastic; Alkaline/Single-Use Batteries; Antifreeze; Batteries (Rechargeable); Button Batteries; Cooking Oil; Glass (Blue); Glass (Brown); Glass (Clear); Glass (Green); Latex Paint; Oil-Based Paint; Used Motor Oil","false","false","","","true","false","false","false"
"Albertsons","","5450 River Road North","Keizer","","OR","97303","5033903922","0","","","45.0030893","-123.0248579","12.8308940585499","","false","false","","","false","false","false","false"
"Christmas Tree Collection Event - North Marion Recycling & Transfer Station","","17827 Whitney Lane NE ","Woodburn","","OR","97071","5415885169","0","","http://www.co.marion.or.us/PW/ES/disposal/","45.1781951","-122.8581761","2.3187883445334","","false","false","","","false","false","false","false"
"North Marion County Recycling & Transfer Station","","17827 Whitney Ln NE","Woodburn","","OR","97071","5039814117","0","","http://www.co.marion.or.us/PW/ES/disposal/","45.1781951","-122.8581761","2.3187883445334","","false","false","","","false","false","false","false"
"North Marion Transfer Station","","17827 Whitney Ln NE","Woodburn","","OR","97032","5035814472","0","","","45.1781951","-122.8581761","2.3187883445334","","false","false","","","false","false","false","false"
"Hubbard Cleaners","Hubbard Cleaners","3362 D St","Hubbard","Marion","OR","97032","5039820524","0","Monday: 7:30 AM - 6:00 PM Tuesday: 7:30 AM - 6:00 PM Wednesday: 7:30 AM - 6:00 PM Thursday: 7:30 AM - 6:00 PM Friday: 7:30 AM - 6:00 PM Saturday: 7:30 AM - 1:00 PM ","","45.18102","-122.80457","3.50242527394698","Video Game Consoles; PlayStation Consoles","false","true","","","false","false","false","false"
"North Marion Recycling & Transfer Station","North Marion Recycling & Transfer Station","17827 Whitney Ln NE","Woodburn","Marion","OR","97071","5035885169","0","","http://paintcare.org/","45.14001","-122.94016","4.17464977882982","Unused Paint; Latex Paint; Video Game Consoles; PlayStation Consoles","false","true","Paint is accepted during regular business hours; call ahead for hours and to make sure the store can accept your amount of paint.  
Site accepts most latex and oil based house paint, stains and varnish but not aerosols, auto or industrial paints. 
Please visit <a href="http://www.paintcare.org/oregon/products_fee.php" target="_blank">Paintcare.org</a> for more details and restrictions.","","false","false","false","false"
"North Marion Recycling & Transfer Station","North Marion Recycling & Transfer Station","17827 Whitney Ln NE","Woodburn","Marion","OR","97071","5035885169","0","Monday: 8:00 AM - 5:00 PM Tuesday: 8:00 AM - 5:00 PM Wednesday: 8:00 AM - 5:00 PM Thursday: 8:00 AM - 5:00 PM Friday: 8:00 AM - 5:00 PM Saturday: 8:00 AM - 5:00 PM ","http://www.co.marion.or.us/","45.14001","-122.94016","4.17464977882982","#6 Plastic Cups; Alkaline/Single-Use Batteries; Batteries (Rechargeable); Book Recycling; Brown Paper Bags; Button Batteries; Cardboard; Catalogs; CD/DVD/Blu-ray/UHD discs; Cell Phone Batteries; Cell Phones; Computer Paper; Cameras; DVD Players/Blu-Ray Players/DVRs; Electronics; Eyeglasses; Ferrous Metals (Steel or Iron); Glass (Blue); Glass (Brown); Glass (Clear); Glass (Green); GPS Units; Hearing Aids; Inkjet Printer Cartridges; Laptop Computers; Laser Toner Cartridges; Latex Paint; Lead Acid (Pb) Batteries; Li-Ion Batteries; Magazines; Microwaves; MP3 Players; Newspapers; Ni-Cd Batteries; Ni-MH Batteries; Non-ferrous (Copper/Brass/Tin); Office Equipment; Office Paper; Oil-Based Paint; Paper (Mixed); Paper Egg Cartons; Paperboard; Phone books; Plastic #1 (PETE); Plastic #2 (HDPE); Plastic #3 (PVC); Plastic #4 (LDPE); Plastic #5 (Polypropylene); Plastic #6 (Polystyrene); Plastic #7; Plastic Film; Plastic Shopping Bags; Portable Media Players; Printers/Scanners/Fax Machines; Projectors; Rigid Plastics; Scrap Metal; Small Electronics; Small Sealed Lead Acid Batteries; Small Televisions; Stereo Equipment; Telephones; Televisions; UPS Batteries/Backup Systems; Used Motor Oil; Vacuum Cleaners; VCRs; Compostable Plastic","false","true","","","false","false","false","false"
"Discover Books Drop-off Bin","","13183 Aspen Way NE","Aurora","","OR","97002","8884022665","0","","https://www.discoverbooks.com/Default.asp","45.203558","-122.7911708","5.11040016957775","","false","false","","","false","false","false","false"
"North Willamette Restore","","225 Franklin Street","Mount Angel","","OR","97362","5038454161","0","","https://www.paintcare.org/","45.0722237","-122.7993317","5.69136546459234","","false","false","","","false","false","false","false"
"North Willamette Restore","North Willamette Restore","225 Franklin St","Mount Angel","Marion","OR","97362","5038454161","0","","http://paintcare.org/","45.072","-122.7988","5.71730201870229","Unused Paint; Latex Paint; Video Game Consoles; PlayStation Consoles","false","true","Paint is accepted during regular business hours; call ahead for hours and to make sure the store can accept your amount of paint.  
Site accepts most latex and oil based house paint, stains and varnish but not aerosols, auto or industrial paints. 
Please visit <a href="http://www.paintcare.org/oregon/products_fee.php" target="_blank">Paintcare.org</a> for more details and restrictions.","","false","false","false","false"
"USPS Post Office Box Lobby Recycling Program","US Post Office","90 N Garfield St","Mount Angel","Marion","OR","97362","8002758777","0","","https://www.usps.com/","45.06554","-122.7917","6.2754888882615","Catalogs; Greeting Cards; Magazines; Paper (Mixed)","false","true","","","false","false","false","false"
"Marion Recycling","Marion Recycling","3680 Brooklake Rd NE","Salem","Marion","OR","97303","5033904000","0","Monday: 7:00 AM - 3:00 PM Tuesday: 7:00 AM - 3:00 PM Wednesday: 7:00 AM - 3:00 PM Thursday: 7:00 AM - 3:00 PM Friday: 7:00 AM - 3:00 PM ","null","45.04973","-122.98494","9.13145797017376","Plastic #1 (PETE); Plastic #2 (HDPE); Plastic #3 (PVC); Plastic #4 (LDPE); Plastic #5 (Polypropylene); Plastic #6 (Polystyrene); Plastic #7; Aluminum Cans; Glass (Blue); Books (Reuse); Book Recycling; Glass (Brown); Brown Paper Bags; Cardboard; Glass (Clear); Drink Boxes; Gift Boxes; Glass (Green); Greeting Cards; Large Household Appliances; Magazines; Paper (Mixed); Newspapers; Paperboard; Phone books; Tin or Steel Cans; Office Paper; Unused Paper; Milk Cartons; Video Game Consoles; PlayStation Consoles","false","true","Please contact the site prior to bringing large quantities of items for recycling.","","false","false","false","false"
"Marion County Recycling Center","","3680 Brooklake Rd NE ","Salem","","OR","97303","5033904000","0","","http://www.co.marion.or.us/PW/ES/","45.048662","-122.9851583","9.19203768050486","","false","false","","","false","false","false","false"
"Wurdinger Recycling","Wurdinger Recycling","24621 S Barlow Rd","Aurora","Clackamas","OR","97002","8777276274","0","","http://www.wurdingerrecycling.com/","45.25215","-122.72277","9.81734933119895","Car; Non-ferrous (Copper/Brass/Tin); Video Game Consoles; PlayStation Consoles","true","true","","","false","false","false","false"
"Silverton Goodwill","Silverton Goodwill","601 N Water St","Silverton","Marion","OR","97381","5038736742","0","Monday: 9:00 AM - 9:00 PM Tuesday: 9:00 AM - 9:00 PM Wednesday: 9:00 AM - 9:00 PM Thursday: 9:00 AM - 9:00 PM Friday: 9:00 AM - 9:00 PM Saturday: 9:00 AM - 9:00 PM Sunday: 10:00 AM - 8:00 PM ","","45.00912","-122.78665","9.94040212102023","Computer (Reuse); Computer Monitors; Computer (Recycling); Electronics; Televisions; Laptop Computers; MP3 Players; Video Game Consoles; PlayStation Consoles","false","true","","","false","false","false","false"
"USPS Post Office Box Lobby Recycling Program","US Post Office","551 N Water St","Silverton","Marion","OR","97381","8002758777","0","","https://www.usps.com/","45.00877","-122.78622","9.97021556197226","Catalogs; Greeting Cards; Magazines; Paper (Mixed)","false","true","","","false","false","false","false"
"US Post Office","USPS Discarded Lobby Mail Recycling Program","551 N Water St","Silverton","Marion","OR","97381","0","0","","","45.00877","-122.78622","9.97021556197226","Video Game Consoles; PlayStation Consoles","false","true","","","false","false","false","false"
"City of Silverton Public Works Shops","","830 McClain St","Silverton","","OR","97381","8779811278","0","","http://www.silverton.or.us","45.0062397","-122.7969039","9.97526909432765","","false","false","","","false","false","false","false"
"Allied Waste of Marion County","","830 Mcclaine St","Silverton","","OR","97381","5039811278","0","","http://www.co.marion.or.us/PW/ES/","45.0062397","-122.7969039","9.97526909432765","","false","false","","","false","false","false","false"
