name,description,address,city,region,province,postal_code,phone,fax,hours,url,latitude,longitude,distance,materials,pickup,dropoff,notes,groups,curbside,municipal,national,event_only
"USPS Post Office Box Lobby Recycling Program","US Post Office","525 N 1st St","Woodburn","Marion","OR","97071","8002758777","0","","https://www.usps.com/","45.14404","-122.85613","0.0817945192244936","Catalogs; Greeting Cards; Magazines; Paper (Mixed)","false","true","","","false","false","false","false"
"Woodburn Goodwill","Woodburn Goodwill","948 N Pacific Hwy","Woodburn","Marion","OR","97071","5039816298","0","","","45.14357","-122.83801","0.819907239052881","Electronics; MP3 Players; Video Game Consoles; PlayStation Consoles","false","true","","","false","false","false","false"
"Schucks Auto Supply","Schucks Auto Supply","1090 N Pacific Hwy","Woodburn","Marion","OR","97071","5039825635","0","","http://www.cskauto.com","45.14434","-122.83724","0.853969153176838","Lead Acid (Pb) Batteries; Used Motor Oil; Video Game Consoles; PlayStation Consoles","false","true","","","false","false","false","false"
"AutoZone","AutoZone","1041 N Pacific Hwy","Woodburn","Marion","OR","97071","5039813300","0","","http://www.autozone.com","45.14513","-122.83678","0.876433387224252","Lead Acid (Pb) Batteries; Used Motor Oil; Video Game Consoles; PlayStation Consoles","false","true","Most AutoZone stores accept used motor oil, transmission fluid, gear oil and automotive batteries. Call to see what your local store is currently accepting.","","false","false","false","false"
"O'Reilly Auto Parts","null","1090 North Pacific Hwy","Woodburn","","OR","97071","5039825635","0","","http://oreillyauto.custhelp.com/app/error/error_id/6","45.1449501","-122.8361961","0.904570241423205","","false","false","","","false","false","false","false"
"Allied Waste Woodburn","","2215 N Front St","Woodburn","","OR","97071","5412317414","0","","","45.1550543","-122.8417231","0.955546547075799","","false","false","","","false","false","false","false"
"Allied Waste of Marion County Recycling Drop-off Location","","2215 N Front St ","Woodburn","","OR","97071","5039811278","0","","http://www.co.marion.or.us/PW/ES/","45.1550543","-122.8417231","0.955546547075799","","false","false","","","false","false","false","false"
"Al's Garden Center","","1220 N Pacific Hwy","Woodburn","","OR","97071","5033902381","0","","http://www.agriplasinc.com","45.1466496","-122.8347231","0.985257023446459","","false","false","","","false","false","false","false"
"GW Hardware","","1525 North Pacific Highway","Woodburn","","OR","97071","5039818504","0","","https://www.paintcare.org/","45.150086","-122.8333055","1.10904448128338","","false","false","","","false","false","false","false"
"Call2Recycle at RadioShack","Call2Recycle at RadioShack","1515 N Pacific Hwy","Woodburn","Marion","OR","97071","5039825115","0","","http://www.radioshack.com/","45.14972","-122.83278","1.12519461220756","Cell Phones; Ni-Cd Batteries; Li-Ion Batteries; Ni-MH Batteries; Ni-Zn Batteries; Small Sealed Lead Acid Batteries; Video Game Consoles; PlayStation Consoles","false","true","As the first national retailer to partner with Call2Recycle, RadioShack is at the forefront of the rechargeable battery recycling cause and is pleased to offer battery recycling at thousands of convenient RadioShack locations for free.  Simply drop them off at your local RadioShack and theyll take care of the rest.  Ask a store associate for more details.","","false","false","false","false"
"G W Hardware","G W Hardware","1525 N Pacific Hwy","Woodburn","Marion","OR","97071","5039818504","0","","http://paintcare.org/","45.14972","-122.83278","1.12519461220756","Unused Paint; Latex Paint; Video Game Consoles; PlayStation Consoles","false","true","Paint is accepted during regular business hours; call ahead for hours and to make sure the store can accept your amount of paint.  
Site accepts most latex and oil based house paint, stains and varnish but not aerosols, auto or industrial paints. 
Please visit <a href="http://www.paintcare.org/oregon/products_fee.php" target="_blank">Paintcare.org</a> for more details and restrictions.","","false","false","false","false"
"Walmart","Walmart","3002 Stacey Allison Way","Woodburn","Marion","OR","97071","5039819622","0","","http://www.walmart.com","45.14885","-122.87758","1.14820391866775","Lead Acid (Pb) Batteries; Plastic Shopping Bags; Food Storage Bags; Video Game Consoles; PlayStation Consoles","false","true","","","false","false","false","false"
"Walmart Supercenter","","3002 Stacy Allison Way","Woodburn","","OR","97071","5039819622","0","","https://www.walmart.com/","45.1477804","-122.8801332","1.25455597132076","","false","false","","","false","false","false","false"
"Safeway","","1550 North Pacific Highway","Woodburn","","OR","97071","5039822756","0","","https://shop.safeway.com/home.html","45.1503705","-122.8301469","1.26110074385168","","false","false","","","false","false","false","false"
"AutoZone","","1041 S Pacific Hwy","Woodburn","","OR","97071","5039813300","0","","https://www.autozone.com/landing/page.jsp?name=in-our-stores","45.1248609","-122.8554037","1.37242832884001","","false","false","","","false","false","false","false"
"Nike Reuse-A-Shoe Drop-Off","Nike Reuse-A-Shoe Drop-Off","1001 N Arney Rd Ste 810","Woodburn","Marion","OR","97071","5039820330","0","","http://www.nikereuseashoe.com/","45.15247","-122.88095","1.38412270815326","Shoes; Video Game Consoles; PlayStation Consoles","false","true","Nike's Reuse-A-Shoe program collects old, worn-out athletic shoes for recycling, transforming them into Nike Grind, a material used in creating athletic and playground surfaces as well as select Nike products.","","false","false","false","false"
"Pearl Izumi Factory Store","One World Running Drop-Off at Pearl Izumi Factory Store","1001 N Arney Rd Ste 613","Woodburn","Marion","OR","97071","5039810200","0","","http://oneworldrunning.com/","45.15247","-122.88095","1.38412270815326","Shoes; Video Game Consoles; PlayStation Consoles","false","true","","","false","false","false","false"
"Levi’s® ","Levi’s® Store","1001 N Arney Rd Ste 506","Woodburn","Marion","OR","97071","5039815418","5039825407","","http://www.levistrauss.com/","45.15247","-122.88095","1.38412270815326","Clothing; Denim; Shoes; Video Game Consoles; PlayStation Consoles","false","true","Customers may drop off no-longer-wanted clothing and shoes for recycling in the collection boxes at local Levi’s® stores and Levi’s® Outlet  stores and receive a voucher for 20% off a single regular-priced Levi’s®  item in-store.","","false","false","false","false"
"The PUMA Store","","1001 North Arney Road","Woodburn","","OR","97071","5039824140","0","","https://us.puma.com/en/us/home?locale=en_US&mktID=PL:Brand%252520Marketing:Puma.com-CatchAllPage:United%252520States-en&plinkID=Brand","45.1561405","-122.878519","1.4011570165089","","false","false","","","false","false","false","false"
"Nike Factory Store","","1001 North Arney Road","Woodburn","","OR","97071","5039820330","0","","https://www.nike.com/us/en_us/c/better-world/stories/2012/09/reuse-a-shoe","45.1561405","-122.878519","1.4011570165089","","false","false","","","false","false","false","false"
"Rite-Aid","Rite-Aid","333 Westfield St","Silverton","Marion","OR","97381","5038732460","0","","","45.00378","-122.79237","10.2021959434714","Ni-Cd Batteries; Other Batteries; Batteries (Rechargeable); Alkaline/Single-Use Batteries; Video Game Consoles; PlayStation Consoles","false","true","","","false","false","false","false"
"Safeway","","301 Westfield St","Silverton","","OR","97381","5038731800","0","","https://shop.safeway.com/home.html","45.0032445","-122.7939568","10.214767012893","","false","false","","","false","false","false","false"
"Call2Recycle at Freilinger Electronic Inc","Call2Recycle at Freilinger Electronic Inc","218 W Main St ","Silverton","Marion County","OR","97381","5038744431","0","","http://www.radioshack.com/","45.0045024","-122.7842655","10.2800150633721","Cell Phones; Ni-Cd Batteries; Li-Ion Batteries; Ni-MH Batteries; Ni-Zn Batteries; Small Sealed Lead Acid Batteries; Video Game Consoles; PlayStation Consoles","false","true","The U.S. EPA estimates that more than 350 million rechargeable batteries are purchased annually in the U.S. Thanks to the environmental commitment of this location, its easy and free to recycle your batteries. Bring your rechargeable batteries to this location and look for the recycling box or ask an associate how you can do your part for the environment.","","false","false","false","false"
"Safeway","","1051 SW 1st Ave","Canby","","OR","97013","5032665890","0","","https://shop.safeway.com/home.html","45.2552838","-122.7026078","10.6403238369756","","false","false","","","false","false","false","false"
"Newberg Transfer Station","Newberg Transfer Station","2904 NE Wynooski Rd ","Newberg","Yamhill County","OR","97132","5034347445","0","Monday: 8:00 AM - 5:00 PM Tuesday: 8:00 AM - 5:00 PM Wednesday: 8:00 AM - 5:00 PM Thursday: 8:00 AM - 5:00 PM Friday: 8:00 AM - 5:00 PM Saturday: 8:00 AM - 5:00 PM ","http://wmnorthwest.com/transferstation/newberg.htm","45.28391","-122.948552","10.6451939047285","Plastic #1 (PETE); Plastic #2 (HDPE); Plastic #2 (Color HDPE); Aluminum Cans; Glass (Blue); Glass (Brown); Cardboard; Glass (Clear); Ferrous Metals (Steel or Iron); Glass (Green); Greeting Cards; Magazines; Paper (Mixed); Newspapers; Glass (Other); Phone books; Tin or Steel Cans; Used Motor Oil; Used Tires; Yard Waste","false","true","Some materials are accepted for free at this facility; other materials are accepted for a fee.","","false","false","false","false"
"Newberg Transfer Station and Recycling Drop-off Program","","2904 S Wynooski Road","Newberg","","OR","97132","5035381388","0","","https://www.co.yamhill.or.us","45.28391","-122.9485521","10.6451959918978","","false","false","","","false","false","false","false"
"Walgreens","Walgreens","1080 SW 1st Ave","Canby","Clackamas","OR","97013","5032631600","0","","http://www.walgreens.com","45.25654","-122.70335","10.6777723044624","Cell Phones; Inkjet Printer Cartridges; Video Game Consoles; PlayStation Consoles","false","true","","","false","false","false","false"
"Canby Square Donation Express","Canby Square Donation Express","919 SW 5th Ave ","Canby","Clackamas County","OR","97013","5032336589","0","","","45.2565662","-122.7011154","10.7544545200831","Electronics; MP3 Players; Video Game Consoles; PlayStation Consoles","false","true","","","false","false","false","false"
"Target","Target","6450 Keizer Station Blvd NE","Keizer","Marion","OR","97303","5038560601","0","","http://www.target.com/","45.03157","-123.01354","11.0046933351026","Aluminum Cans; Cell Phones; Inkjet Printer Cartridges; MP3 Players; Plastic #1 (PETE); Plastic #2 (HDPE); Plastic Shopping Bags; Video Game Consoles; PlayStation Consoles","false","true","","","false","false","false","false"
"AT&T Wireless","AT&T Wireless","8599 SW Main St","Wilsonville","Clackamas","OR","97070","5035703830","0","","http://www.att.com/","45.29684","-122.78612","11.0279817608171","Cell Phones; Ni-Cd Batteries; Batteries (Rechargeable); Cell Phone Batteries; Tablets; Li-Ion Batteries; Video Game Consoles; PlayStation Consoles","false","true","Receive an AT&T Promotion Card worth the trade-in value of your smartphone, tablet, or netbook. You can also donate the trade-in value to Cell Phones for Soldiers.","","false","false","false","false"
"Wurdinger Recycling","Wurdinger Recycling","6342 Portland Rd NE","Salem","Marion","OR","97305","5033935401","0","","http://www.wurdingerrecycling.com/","45.0098","-122.97607","11.0418897035284","Car; Non-ferrous (Copper/Brass/Tin); Video Game Consoles; PlayStation Consoles","true","true","","","false","false","false","false"
"O'Reilly Auto Parts","","145 SW 1st Ave","Canby","","OR","97013","5032667500","0","","http://oreillyauto.custhelp.com/app/error/error_id/6","45.2617532","-122.69251","11.303186479048","","false","false","","","false","false","false","false"
"Target Store","","6450 Keizer Station Blvd NE","Keizer","","OR","97303","5038560601","0","","https://corporate.target.com/corporate-responsibility/planet","45.0127818","-122.9947024","11.3890097505515","","false","false","","","false","false","false","false"
"Albertsons","","30299 Southwest Boones Ferry Road","Wilsonville","","OR","97070","5035821876","0","","","45.3005822","-122.7744145","11.4563038335039","","false","false","","","false","false","false","false"
"K B Recycling Inc","","1600 South East 4th Avenue","Canby","","OR","97013","5032667903","0","","","45.2612653","-122.6846184","11.5513910933059","","false","false","","","false","false","false","false"
"K B Recycling Inc","","1600 South East 4th Avenue","Canby","","OR","97013","5032667903","0","","","45.2612653","-122.6846184","11.5513910933059","","false","false","","","false","false","false","false"
"KB Recycling","","1600 SE 4th Ave","Canby","","OR","97013","5032663900","0","","","45.2612653","-122.6846184","11.5513910933059","","false","false","","","false","false","false","false"
"Albertsons","Albertsons","30299 SW Boones Ferry Rd","Wilsonville","Clackamas","OR","97070","5035821876","0","","","45.3021","-122.7731","11.576711031801","Plastic Shopping Bags; Food Storage Bags; Video Game Consoles; PlayStation Consoles","false","true","","","false","false","false","false"
"Staples","Staples","6305 Ulali Drive","Keizer","Marion County","OR","97303","5033930190","0","Monday: 9:00 AM - 8:00 PM Tuesday: 9:00 AM - 8:00 PM Wednesday: 9:00 AM - 8:00 PM Thursday: 9:00 AM - 8:00 PM Friday: 9:00 AM - 8:00 PM Saturday: 9:00 AM - 6:00 PM Sunday: 11:00 AM - 6:00 PM ","https://www.staples.com/recycle","45.0118587","-122.9998445","11.5916211551158","AC Power Plugs; Batteries (Rechargeable); Cables & Connectors; Cell Phone Batteries; Cell Phones; Computer (Recycling); Hard Drives; Computer Monitors; Cameras; DVD Players/Blu-Ray Players/DVRs; Electronics; E-Readers; GPS Units; Headphones; Inkjet Printer Cartridges; Laptop Computers; Laser Toner Cartridges; Li-Ion Batteries; MP3 Players; Network Equipment; Ni-Cd Batteries; Ni-MH Batteries; Ni-Zn Batteries; Computer Peripherals; Portable Media Players; Printers/Scanners/Fax Machines; Small Electronics; Small Sealed Lead Acid Batteries; Stereo Equipment; Tablets; Telephones; UPS Batteries/Backup Systems; VCRs; Video Game Systems; Blu-Ray Players; Digital Converter Boxes; Video Game Consoles; PlayStation Consoles; Alkaline/Single-Use Batteries","false","true","NO TVs; Limit 6 CEDs per day; ","Sony, Vizio, OEM","false","false","false","false"
"Staples","","6305 Ulali Drive","Keizer","","OR","97303","5033930190","0","","https://www.staples.com/sbd/cre/marketing/sustainability-center/recycling-services/","45.01186","-122.9998654","11.5921726648355","Alkaline/Single-Use Batteries; Batteries (Rechargeable); Cell Phone Batteries; Li-Ion Batteries; Ni-Cd Batteries; Ni-MH Batteries; Small Sealed Lead Acid Batteries; Alkaline/Single-Use Batteries; Button Batteries; Non-rechargeable lithium batteries; Cell Phones","false","true","","Call2Recycle","false","false","false","false"
"Walgreens","Walgreens","9450 SW Wilsonville Rd","Wilsonville","Clackamas","OR","97070","5035821498","0","","http://www.walgreens.com","45.30278","-122.77322","11.6188455392233","Cell Phones; Inkjet Printer Cartridges; Video Game Consoles; PlayStation Consoles","false","true","","","false","false","false","false"
"Lowe's","","6225 Ulali Dr NE","Keizer","","OR","97303","5033043010","0","","https://newsroom.lowes.com/responsibility/operational-excellence/","45.0105818","-123.0000387","11.6674090362575","Batteries (Rechargeable); Cell Phone Batteries; Li-Ion Batteries; Ni-Cd Batteries; Ni-MH Batteries; Small Sealed Lead Acid Batteries; Cell Phones","false","true","","Call2Recycle","false","false","false","false"
"Safeway","","Southeast Dayton-Salem Highway","Dayton","","OR","97114","5034353120","0","","https://shop.safeway.com/home.html","45.2190955","-123.0727323","11.7934973274133","","false","false","","","false","false","false","false"
"REI - Salem-Keizer","REI - Salem-Keizer","6035 Ulali Dr. NE","Keizer","Marion ","OR","97303","5033930909","0","","","45.00812145","-123.000670284034","11.8215053802709","E-Bike Batteries","false","true","Call or Check Online for Hours","Call2Recycle","false","false","false","false"
"La Sierra Mexican Grill","","1111 State Highway 99W","Dundee","","OR","97115","8884022665","0","","https://www.discoverbooks.com/Default.asp","45.2740617","-123.0137763","11.8223799113989","","false","false","","","false","false","false","false"
"K B Recycling Inc","K B Recycling Inc","1600 SE 4th Ave","Canby","Clackamas","OR","97013","5032667903","0","Monday: 8:00 AM - 4:30 PM Tuesday: 8:00 AM - 4:30 PM Wednesday: 8:00 AM - 4:30 PM Thursday: 8:00 AM - 4:30 PM Friday: 8:00 AM - 4:30 PM ","http://www.kbrecycling.com/","45.26132","-122.67613","11.8537375380051","Plastic #1 (PETE); Plastic #2 (HDPE); Plastic #2 (Color HDPE); Aluminum Cans; Book Recycling; Glass (Brown); Brown Paper Bags; Cardboard; Catalogs; Chipboard; Glass (Clear); Computer Paper; Ferrous Metals (Steel or Iron); Gift Boxes; Glass (Green); Greeting Cards; Magazines; Paper (Mixed); Newspapers; Non-ferrous (Copper/Brass/Tin); Paperboard; Phone books; Tin or Steel Cans; Office Paper; Video Game Consoles; PlayStation Consoles","false","true","","","false","false","false","false"
"Canby Disposal and Transfer Station","Canby Disposal and Transfer Station","1600 SE 4th Ave","Canby","Clackamas","OR","97013","5032667903","0","Monday: 8:00 AM - 4:30 PM Tuesday: 8:00 AM - 4:30 PM Wednesday: 8:00 AM - 4:30 PM Thursday: 8:00 AM - 4:30 PM Friday: 8:00 AM - 4:30 PM ","","45.26132","-122.67613","11.8537375380051","Computer (Recycling); Electronics; Laptop Computers; MP3 Players; Video Game Consoles; PlayStation Consoles","false","true","","","false","false","false","false"
"Canby Builders Supply","Canby Builders Supply","102 S Pine St","Canby","Clackamas","OR","97013","5032662244","0","","http://www.canbybuilderssupply.com/","45.26592","-122.68229","11.8575598170204","Cell Phones; Ni-Cd Batteries; Li-Ion Batteries; Ni-MH Batteries; Ni-Zn Batteries; Small Sealed Lead Acid Batteries; Video Game Consoles; PlayStation Consoles","false","true","The U.S. EPA estimates that more than 350 million rechargeable batteries are purchased annually in the U.S. Thanks to the environmental commitment of this location, its easy and free to recycle your batteries. Bring your rechargeable batteries to this location and look for the recycling box or ask an associate how you can do your part for the environment.","","false","false","false","false"
"Shred Nations","Shred Nations (inside The UPS Store)","1109 SW 1st Ave Ste F","Canby","Clackamas","OR","97013","5037664737","0","Monday: 7:00 AM - 7:00 PM Tuesday: 7:00 AM - 7:00 PM Wednesday: 7:00 AM - 7:00 PM Thursday: 7:00 AM - 7:00 PM Friday: 7:00 AM - 7:00 PM Tuesday: 10:00 AM - 7:30 PM Wednesday: 10:00 AM - 7:30 PM Thursday: 10:00 AM - 7:30 PM Friday: 9:00 AM - 7:30 PM ","http://www.shrednations.com/dropoff/location/canby/86f6534a-20bc-6834-489b-5282bf670f02","45.26645","-122.68084","11.9333897638669","Cell Phones; Computer (Recycling); Laptop Computers; Small Televisions; Documents to Shred; Video Game Consoles; PlayStation Consoles","true","true","Shred Nations offers document shredding, hard drive destruction, electronics recycling and more. Visit website for quotes and full list of services offered in your area. ","","false","false","false","false"
"City Center Food Mart","","710 State Highway 99W","Dundee","","OR","97115","8884022665","0","","https://www.discoverbooks.com/Default.asp","45.2778765","-123.0114937","11.9514483840988","","false","false","","","false","false","false","false"
"Grocery Outlet","","1510 Portland Rd","Newberg","","OR","97132","8884022665","0","","https://www.discoverbooks.com/Default.asp","45.300755","-122.962562","11.9892138267217","","false","false","","","false","false","false","false"
"Newberg Hardware","","2100 Portland Road","Newberg","","OR","97132","5035385460","0","","https://www.paintcare.org/","45.3019748","-122.9591435","11.9936252143819","","false","false","","","false","false","false","false"
"Lewis Audio Video","","2112 Portland Rd","Newberg","","OR","97132","5035381190","0","","","45.3023169","-122.9585939","12.0037508502977","","false","false","","","false","false","false","false"
"Blue Dolphin Car Wash","","701 Deborah Rd","Newberg","","OR","97132","8884022665","0","","https://www.discoverbooks.com/Default.asp","45.3050053","-122.9499833","12.0045531253568","","false","false","","","false","false","false","false"
"AutoZone","","2320 Portland Rd","Newberg","","OR","97132","5035379214","0","","https://www.autozone.com/landing/page.jsp?name=in-our-stores","45.3031018","-122.9564275","12.0091320736773","","false","false","","","false","false","false","false"
"Walgreens","Walgreens","1840 Portland Rd","Newberg","Yamhill","OR","97132","5035389360","0","","http://www.walgreens.com","45.3019","-122.96095","12.0264572168225","Cell Phones; Inkjet Printer Cartridges; Video Game Consoles; PlayStation Consoles","false","true","","","false","false","false","false"
"AutoZone","AutoZone","2320 Portland Rd","Newberg","Yamhill","OR","97132","5035379214","0","","http://www.autozone.com","45.30367","-122.95554","12.0272278284472","Lead Acid (Pb) Batteries; Used Motor Oil; Video Game Consoles; PlayStation Consoles","false","true","Most AutoZone stores accept used motor oil, transmission fluid, gear oil and automotive batteries. Call to see what your local store is currently accepting.","","false","false","false","false"
"Call2Recycle at RadioShack","Call2Recycle at RadioShack","1433 SE 1st Ave Ste 104","Canby","Clackamas","OR","97013","5032632075","0","","http://www.radioshack.com/","45.26724","-122.67904","12.0339980450058","Cell Phones; Ni-Cd Batteries; Li-Ion Batteries; Ni-MH Batteries; Ni-Zn Batteries; Small Sealed Lead Acid Batteries; Video Game Consoles; PlayStation Consoles","false","true","As the first national retailer to partner with Call2Recycle, RadioShack is at the forefront of the rechargeable battery recycling cause and is pleased to offer battery recycling at thousands of convenient RadioShack locations for free.  Simply drop them off at your local RadioShack and theyll take care of the rest.  Ask a store associate for more details.","","false","false","false","false"
"Call2Recycle at RadioShack","Call2Recycle at RadioShack","1004 N Springbrook Rd","Newberg","Yamhill","OR","97132","5035387336","0","","http://www.radioshack.com/","45.30659","-122.94685","12.0480628777546","Cell Phones; Ni-Cd Batteries; Li-Ion Batteries; Ni-MH Batteries; Ni-Zn Batteries; Small Sealed Lead Acid Batteries; Video Game Consoles; PlayStation Consoles","false","true","As the first national retailer to partner with Call2Recycle, RadioShack is at the forefront of the rechargeable battery recycling cause and is pleased to offer battery recycling at thousands of convenient RadioShack locations for free.  Simply drop them off at your local RadioShack and theyll take care of the rest.  Ask a store associate for more details.","","false","false","false","false"
"USPS Post Office Box Lobby Recycling Program","US Post Office","530 Ferry St","Dayton","Yamhill","OR","97114","8002758777","0","","https://www.usps.com/","45.21837","-123.07981","12.0835347537128","Catalogs; Greeting Cards; Magazines; Paper (Mixed)","false","true","","","false","false","false","false"
"Newberg Mail Room","Newberg Mail Room","1102 N Springbrook Rd ","Newberg","Yamhill County","OR","97132","5035385555","0","Monday: 9:00 AM - 6:00 PM Tuesday: 9:00 AM - 6:00 PM Wednesday: 9:00 AM - 6:00 PM Thursday: 9:00 AM - 6:00 PM Friday: 9:00 AM - 6:00 PM Saturday: 9:00 AM - 2:00 PM ","","45.3084114","-122.9450246","12.13249748204","Plastics (Other); Packing Peanut (Reuse); Video Game Consoles; PlayStation Consoles","false","true","This site is located by the Safeway store.  This site only accepts clean material.","","false","false","false","false"
"Safeway","","1140 North Springbrook Road","Newberg","","OR","97132","5035374001","0","","https://shop.safeway.com/home.html","45.3085733","-122.9454064","12.1496555397989","","false","false","","","false","false","false","false"
"US Post Office","US Post Office","29333 SW Town Center Loop E","Wilsonville","Clackamas","OR","97070","0","0","","https://www.usps.com/ship/recycle-through-usps.htm","45.30735","-122.75953","12.1540928543029","Inkjet Printer Cartridges; Video Game Consoles; PlayStation Consoles","false","true","Free, postage-paid Mail Back envelopes can be found on display in the lobby. There is no limit to the number of envelopes customers may take. The contents of the envelope must weigh less than 13 ounces and the envelope must be able to seal completely. For more details visit<a href="http://www.maxback.com/mxb-postoffice-collaboration" target="_blank">MaxBack</a>.","","false","false","false","false"
"Wilco Farm Store","","197 S Hazel Dell Way","Canby","","OR","97013","8884022665","0","","https://www.discoverbooks.com/Default.asp","45.2663157","-122.6734304","12.1855321174685","","false","false","","","false","false","false","false"
