name,description,address,city,region,province,postal_code,phone,fax,hours,url,latitude,longitude,distance,materials,pickup,dropoff,notes,groups,curbside,municipal,national,event_only
"Walgreens","Walgreens","111 Union Ave","Grants Pass","Josephine","OR","97527","5414714873","0","","http://www.walgreens.com","42.42229","-123.33341","10.2263037721854","Cell Phones; Inkjet Cartridge Refilling; Inkjet Printer Cartridges; Video Game Consoles; PlayStation Consoles","false","true","","","false","false","false","false"
"AutoZone","","1601 Williams Hwy","Grants Pass","","OR","97527","5414729700","0","","https://www.autozone.com/landing/page.jsp?name=in-our-stores","42.4206719","-123.3334802","10.286288461625","","false","false","","","false","false","false","false"
"Safeway","null","1640 Williams Hwy","Grants Pass","","OR","97527","5414761242","0","","https://shop.safeway.com/home.html","42.4211063","-123.3362556","10.3928700354578","","false","false","","","false","false","false","false"
"Call2Recycle at US Cellular","Call2Recycle at US Cellular","1607 Williams Hwy Ste 2","Grants Pass","Josephine","OR","97527","5416608722","0","","http://www.uscellular.com/","42.41983","-123.33557","10.4076223939075","Cell Phones; Ni-Cd Batteries; Li-Ion Batteries; Ni-MH Batteries; Ni-Zn Batteries; Small Sealed Lead Acid Batteries; Video Game Consoles; PlayStation Consoles","false","true","The U.S. EPA estimates that more than 350 million rechargeable batteries are purchased annually in the U.S. Thanks to the environmental commitment of this location, its easy and free to recycle your batteries. Bring your rechargeable batteries to this location and look for the recycling box or ask an associate how you can do your part for the environment.","","false","false","false","false"
"Albertsons","","1690 Allen Creek Road","Grants Pass","","OR","97527","5414712148","0","","","42.4192605","-123.3529014","11.1946210705282","","false","false","","","false","false","false","false"
"Southern Oregon Recycling Center","","1381 Redwood Ave","Grants Pass","","OR","97527","5414795335","0","","https://www.grantspassoregon.gov/215/Recycling-in-the-Grants-Pass-Area","42.4220184","-123.3551453","11.205700921338","","false","false","","","false","false","false","false"
"Southern Oregon Sanitation Inc","Southern Oregon Sanitation Inc","1381 Redwood Ave","Grants Pass","Josephine","OR","97527","5414795335","0","Monday: 8:00 AM - 5:00 PM Tuesday: 8:00 AM - 5:00 PM Wednesday: 8:00 AM - 5:00 PM Thursday: 8:00 AM - 5:00 PM Friday: 8:00 AM - 5:00 PM ","http://www.sosanitation.com/","42.42237","-123.3563","11.2467710643258","Cell Phones; Ni-Cd Batteries; Li-Ion Batteries; Ni-MH Batteries; Ni-Zn Batteries; Small Sealed Lead Acid Batteries; Video Game Consoles; PlayStation Consoles","false","true","The U.S. EPA estimates that more than 350 million rechargeable batteries are purchased annually in the U.S. Thanks to the environmental commitment of this location, its easy and free to recycle your batteries. Bring your rechargeable batteries to this location and look for the recycling box or ask an associate how you can do your part for the environment.","","false","false","false","false"
"Southern Oregon Sanitation","Southern Oregon Sanitation","1381 Redwood Ave","Grants Pass","Josephine","OR","97527","5414795335","0","Monday: 10:00 AM - 5:00 PM Tuesday: 10:00 AM - 5:00 PM Wednesday: 10:00 AM - 5:00 PM Thursday: 10:00 AM - 5:00 PM Friday: 10:00 AM - 5:00 PM ","http://www.sosanitation.com/","42.42237","-123.3563","11.2467710643258","Plastic #1 (PETE); Plastic #2 (HDPE); Plastic #2 (Color HDPE); Plastic #5 (Polypropylene); Glass (Brown); Cardboard; Glass (Clear); Electronics; Glass (Green); Magazines; Newspapers; Phone books; Used Motor Oil; MP3 Players; Video Game Consoles; PlayStation Consoles","true","true","Visit website or call for pricing.","","false","false","false","false"
"Allied Waste Merlin Transfer Station","","1749 Merlin Rd","Grants Pass","","OR","97526","5414793371","0","","https://www.grantspassoregon.gov/215/Recycling-in-the-Grants-Pass-Area","42.5034486","-123.3958496","12.0149959671506","","false","false","","","false","false","false","false"
"Merlin Transfer Station and Recycling Drop-off Program","","1749 Merlin Road","Merlin","","OR","97532","5414745901","0","","https://www.grantspassoregon.gov","42.5034486","-123.3958496","12.0149959671506","","false","false","","","false","false","false","false"
"Rogue Disposal Transfer Station","","Table Rock Rd","White City","","OR","97503","5414945411","0","","","42.4512462","-122.9085473","13.2036709524402","","false","false","","","false","false","false","false"
"JO-GRO Transfer Station and Compost Facility","","8001 Table Rock Rd","White City","","OR","97503","5418265691","0","","https://www.sosanitation.com/","42.4321888","-122.8893348","14.5086368213481","","false","false","","","false","false","false","false"
"Dry Creek Landfill and Recycling Depot","","8001 Table Rock Rd","White City","","OR","97503","5417794161","0","","https://roguedisposal.com//","42.4321888","-122.8893348","14.5086368213481","","false","false","","","false","false","false","false"
"Rogue Transfer Station and Recycling Facility","","8001 Table Rock Road ","White City","","OR","97503","5417794161","0","","https://roguedisposal.com//","42.4321888","-122.8893348","14.5086368213481","","false","false","","","false","false","false","false"
"Josephine County Household Hazardous Waste Collection Program","","8001 Table Rock Road","White City","","OR","97503","5414795335","0","","https://www.sosanitation.com/","42.4321888","-122.8893348","14.5086368213481","","false","false","","","false","false","false","false"
"Rogue Transfer and Recycling Station","Rogue Transfer and Recycling Station","8001 Table Rock Rd","White City","Jackson","OR","97503","5417794161","0","","","42.43184","-122.8877","14.595366407142","Plastic #1 (PETE); Plastic #2 (HDPE); Plastic #2 (Color HDPE); Plastic #3 (PVC); Plastic #4 (LDPE); Plastic #5 (Polypropylene); Plastic #6 (Polystyrene); Plastic #7; Aluminum Cans; Aluminum; Glass (Brown); Lead Acid (Pb) Batteries; Cardboard; Catalogs; Glass (Clear); Glass (Green); Greeting Cards; Magazines; Paper (Mixed); Newspapers; Phone books; Tin or Steel Cans; Used Motor Oil; Office Paper; Video Game Consoles; PlayStation Consoles","false","true","","","false","false","false","false"
"Rogue Transfer & Recycling","Rogue Transfer & Recycling","8001 Table Rock Rd","Medford","Jackson","OR","97503","5417794161","0","","","42.43184","-122.8877","14.595366407142","Plastic #1 (PETE); Plastic #2 (HDPE); Plastic #2 (Color HDPE); Plastic #3 (PVC); Plastic #4 (LDPE); Plastic #5 (Polypropylene); Plastic #6 (Polystyrene); Plastic #7; Aluminum Cans; Glass (Blue); Glass (Brown); Brown Paper Bags; Cardboard; Catalogs; Glass (Clear); Ferrous Metals (Steel or Iron); Glass (Green); Greeting Cards; Large Household Appliances; Magazines; Paper (Mixed); Newspapers; Non-ferrous (Copper/Brass/Tin); Phone books; Tin or Steel Cans; Used Motor Oil; Used Tires; Office Paper; Video Game Consoles; PlayStation Consoles","false","true","Please call for holiday hours.","","false","false","false","false"
"Rogue Disposal Transfer Station","Rogue Disposal Transfer Station","8001 Table Rock Rd","White City","Jackson","OR","97503","5414945411","0","","","42.43184","-122.8877","14.595366407142","Electronics; MP3 Players; Video Game Consoles; PlayStation Consoles","false","true","","","false","false","false","false"
"Medford Recycling Center","Medford Recycling Center","8001 Table Rock Rd","White City","Jackson","OR","97503","0","0","Monday: 8:00 AM - 4:00 PM Tuesday: 8:00 AM - 4:00 PM Wednesday: 8:00 AM - 4:00 PM Thursday: 8:00 AM - 4:00 PM Friday: 8:00 AM - 4:00 PM Saturday: 7:00 AM - 4:00 PM ","http://roguedisposal.com/","42.43184","-122.8877","14.595366407142","Aluminum Cans; Antifreeze; Brown Paper Bags; Brush; Cardboard; Catalogs; Computer (Recycling); Computer Monitors; Computer Paper; DVD Players/Blu-Ray Players/DVRs; Electronics; Ferrous Metals (Steel or Iron); Fluorescent Lamps/Tubes; Glass (Brown); Glass (Clear); Glass (Green); Laptop Computers; Large Household Appliances; Lead Acid (Pb) Batteries; Leaves; Magazines; Microwaves; Newspapers; Office Equipment; Office Paper; Paper (Mixed); Paper Egg Cartons; Paperboard; Computer Peripherals; Phone books; Plastic #1 (PETE); Plastic #2 (HDPE); Plastic Film; Power Supplies; Printers/Scanners/Fax Machines; Propane Tanks; Shredded Paper; Small Appliances; Small Electronics; Small Sealed Lead Acid Batteries; Small Televisions; Stereo Equipment; Televisions; Tin or Steel Cans; Used Motor Oil; Used Tires; VCRs; Yard Waste; Compostable Plastic","false","true","","","false","false","false","false"
"Taul Corporation","","6600 Table Rock Rd","Central Point","","OR","97502","5412824413","0","","","42.4126256","-122.8852871","15.1728015981762","","false","false","","","false","false","false","false"
"Taul Corporation","","6600 Table Rock Rd","Central Point","","OR","97502","5412824413","0","","","42.4126256","-122.8852871","15.1728015981762","","false","false","","","false","false","false","false"
"Central Point Retail","Central Point Retail","507 S Front St ","Central Point","Jackson County","OR","97502","5415356668","0","","","42.3689732","-122.9133787","15.3775504089","Electronics; MP3 Players; Video Game Consoles; PlayStation Consoles","false","true","","","false","false","false","false"
"Albertsons","Albertsons","1360 Plaza Blvd","Central Point","Jackson","OR","97502","5416653761","0","","","42.37673","-122.90623","15.3807789223082","Plastic Shopping Bags; Food Storage Bags; Video Game Consoles; PlayStation Consoles","false","true","","","false","false","false","false"
"Albertsons","","1360 Plaza Boulevard","Central Point","","OR","97502","5416653761","0","","","42.3764149","-122.9042905","15.4758449420411","","false","false","","","false","false","false","false"
"Call2Recycle at Interstate All Battery Center","Call2Recycle at Interstate All Battery Center","894 S Front St","Central Point","Jackson","OR","97502","5416643417","0","","http://www.interstatebatteries.com","42.36679","-122.91175","15.5325777530344","Cell Phones; Ni-Cd Batteries; Li-Ion Batteries; Ni-MH Batteries; Ni-Zn Batteries; Small Sealed Lead Acid Batteries; Video Game Consoles; PlayStation Consoles","false","true","The U.S. EPA estimates that more than 350 million rechargeable batteries are purchased annually in the U.S. Thanks to the environmental commitment of this location, its easy and free to recycle your batteries. Bring your rechargeable batteries to this location and look for the recycling box or ask an associate how you can do your part for the environment.","","false","false","false","false"
"USPS Post Office Box Lobby Recycling Program","US Post Office","175 N Oregon St","Jacksonville","Jackson","OR","97530","8002758777","0","","https://www.usps.com/","42.31433","-122.96859","15.9567764584133","Catalogs; Greeting Cards; Magazines; Paper (Mixed)","false","true","","","false","false","false","false"
"US Post Office","USPS Discarded Lobby Mail Recycling Program","175 N Oregon St","Jacksonville","Jackson","OR","97530","0","0","","","42.31433","-122.96859","15.9567764584133","Video Game Consoles; PlayStation Consoles","false","true","","","false","false","false","false"
"Allied Environmental Services","Allied Environmental Services","8266 13th St","White City","Jackson","OR","97503","5418262773","0","","http://www.aes-uwm.com/","42.43599","-122.85378","16.1713716177855","Computer (Recycling); Large Household Appliances; Televisions; Textiles; Laptop Computers; Shoes; Video Game Consoles; PlayStation Consoles","false","true","","","false","false","false","false"
"Allied Environmental Services LLC","","8266 13th St","White City","","OR","97503","5418262773","0","","http://aes-uwm.com/","42.4350643","-122.8538217","16.1861969149704","","false","false","","","false","false","false","false"
"Town and Country Cleaners","Town and Country Cleaners","2030 Antelope Rd","White City","Jackson","OR","97503","5418265484","0","Monday: 7:00 AM - 6:00 PM Tuesday: 7:00 AM - 6:00 PM Wednesday: 7:00 AM - 6:00 PM Thursday: 7:00 AM - 6:00 PM Friday: 7:00 AM - 6:00 PM Saturday: 8:00 AM - 1:00 PM ","","42.42721","-122.85418","16.3213205991794","Video Game Consoles; PlayStation Consoles","false","true","","","false","false","false","false"
"Itrex, LLC","","6445 Crater Lake Hwy","Central Point","","OR","97502","5418268226","0","","https://dan.com/buy-domain/itrex.co?redirected=true&tld=co","42.4094109","-122.8587869","16.5087886519842","","false","false","","","false","false","false","false"
"MultiNet Information Systems","MultiNet Information Systems","4856 Airway Dr","Central Point","Jackson","OR","97502","5417344475","0","","","42.38699","-122.87187","16.5438773605604","Electronics; MP3 Players; Video Game Consoles; PlayStation Consoles","false","true","","","false","false","false","false"
"Multinet Information Systems","","4856 Airway Dr","Central Point","","OR","97502","5417344475","0","","","42.387667","-122.8713945","16.5439576546218","","false","false","","","false","false","false","false"
"Schnitzer Steel","","2625 Avenue G","White City","","OR","97503","5418265758","0","","http://www.schnitzersteel.com/company_locations.aspx?View=Detail&ID=36","42.4373502","-122.844392","16.6101138725182","","false","false","","","false","false","false","false"
"Schnitzer Steel Products Co","","2625 Avenue G","White City","","OR","97503","5418265758","0","","http://www.schnitzersteel.com/","42.4373502","-122.844392","16.6101138725182","","false","false","","","false","false","false","false"
"Schnitzer Steel Products Co","Schnitzer Steel Products Co","2625 Avenue G","White City","Jackson","OR","97503","5418265758","5418262898","Monday: 8:00 AM - 4:30 PM Tuesday: 8:00 AM - 4:30 PM Wednesday: 8:00 AM - 4:30 PM Thursday: 8:00 AM - 4:30 PM Friday: 8:00 AM - 4:30 PM ","http://www.schn.com","42.43695","-122.84407","16.632928392884","Aluminum; Ferrous Metals (Steel or Iron); Non-ferrous (Copper/Brass/Tin); High-Temp Alloys; Special Metals; Video Game Consoles; PlayStation Consoles","false","true","","","false","false","false","false"
"Drake's Paint & Supply","Drake's Paint & Supply","2929 N Pacific Hwy","Medford","Jackson","OR","97501","5417733335","0","","http://paintcare.org/","42.35108","-122.89631","16.8096906887728","Unused Paint; Latex Paint; Video Game Consoles; PlayStation Consoles","false","true","Paint is accepted during regular business hours; call ahead for hours and to make sure the store can accept your amount of paint.  
Site accepts most latex and oil based house paint, stains and varnish but not aerosols, auto or industrial paints. 
Please visit <a href="http://www.paintcare.org/oregon/products_fee.php" target="_blank">Paintcare.org</a> for more details and restrictions.","","false","false","false","false"
"Drake's Paint & Supply","","2929 North Pacific Highway","Medford","","OR","97501","5417733335","0","","https://www.paintcare.org/","42.3505833","-122.8961468","16.8369796665569","","false","false","","","false","false","false","false"
"Parr Lumber Co","","1231 Disk Drive","Medford","","OR","97501","5419418428","0","","https://www.paintcare.org/","42.3389155","-122.8953791","17.3644145710519","","false","false","","","false","false","false","false"
"Parr Lumber Co","Parr Lumber Co","1231 Disk Dr","Medford","Jackson","OR","97501","5419418428","0","","http://paintcare.org/","42.3383","-122.89487","17.4114010751813","Unused Paint; Latex Paint; Video Game Consoles; PlayStation Consoles","false","true","Paint is accepted during regular business hours; call ahead for hours and to make sure the store can accept your amount of paint.  
Site accepts most latex and oil based house paint, stains and varnish but not aerosols, auto or industrial paints. 
Please visit <a href="http://www.paintcare.org/oregon/products_fee.php" target="_blank">Paintcare.org</a> for more details and restrictions.","","false","false","false","false"
"Public Lands Medford","Public Lands Medford","293 Rossanley Drive","Medford","Jackson ","OR","97501","4582253921","0","","","42.3423832","-122.8856541","17.6063058256588","E-Bike Batteries","false","true","Call or Check Online for Hours","Call2Recycle","false","false","false","false"
"Target","Target","2000 Crater Lake Hwy","Medford","Jackson","OR","97504","5417790856","0","","http://www.target.com/","42.34871","-122.87847","17.6412190772746","Aluminum Cans; Cell Phones; Inkjet Printer Cartridges; MP3 Players; Plastic #1 (PETE); Plastic #2 (HDPE); Plastic Shopping Bags; Video Game Consoles; PlayStation Consoles","false","true","","","false","false","false","false"
"REI - Medford","REI - Medford","85 Rossanley Drive","Medford","Jackson ","OR","97504","5417321938","0","","","42.3431055","-122.8818887","17.7293788979228","E-Bike Batteries","false","true","Call or Check Online for Hours","Call2Recycle","false","false","false","false"
"Target Store","","2000 Crater Lake Hwy","Medford","","OR","97504","5417790856","0","","https://corporate.target.com/corporate-responsibility/planet","42.3476561","-122.8773605","17.7296784213064","","false","false","","","false","false","false","false"
"Walmart Tire and Lube Express","","11500 Hannon Rd","Eagle Point","","OR","97524","5418262210","0","","https://www.walmart.com/cp/ideas/8932632","42.4690233","-122.8138384","17.7499034335643","","false","false","","","false","false","false","false"
"Walmart Supercenter","","11500 Hannon Rd","Eagle Point","","OR","97524","5418262210","0","","https://www.walmart.com/","42.4690233","-122.8138384","17.7499034335643","","false","false","","","false","false","false","false"
"Walmart","","3615 Crater Lake Hwy","Medford","","OR","97504","5417702010","0","","https://www.walmart.com/","42.3670622","-122.8597782","17.7506264775075","","false","false","","","false","false","false","false"
"Sherwin Williams","Sherwin Williams","2560 Crater Lake Hwy","Medford","Jackson","OR","97504","5417705850","0","","http://paintcare.org/","42.35369","-122.87079","17.7672446587995","Unused Paint; Latex Paint; Video Game Consoles; PlayStation Consoles","false","true","Paint is accepted during regular business hours; call ahead for hours and to make sure the store can accept your amount of paint.  
Site accepts most latex and oil based house paint, stains and varnish but not aerosols, auto or industrial paints. 
Please visit <a href="http://www.paintcare.org/oregon/products_fee.php" target="_blank">Paintcare.org</a> for more details and restrictions.","","false","false","false","false"
"Albertsons","","113 Ross Lane","Medford","","OR","97501","5418585937","0","","","42.3251179","-122.9008803","17.7702566998105","","false","false","","","false","false","false","false"
"Kohl's","","1900 North Riverside Avenue","Medford","","OR","97501","5412820337","0","","https://corporate.kohls.com/","42.3456682","-122.8780793","17.7804211430427","","false","false","","","false","false","false","false"
"Southern Oregon Sanitation Recycling","","42 Ball Rd","Eagle Point","","OR","97524","5418265691","0","","https://www.sosanitation.com/eagle-point/","42.5143415","-122.8114574","17.8006953269791","","false","false","","","false","false","false","false"
"Southern Oregon Sanitation","","42 Ball Rd","Eagle Point","","OR","97527","5418265691","0","","https://www.sosanitation.com/eagle-point/","42.5143644","-122.8114206","17.8026692530426","","false","false","","","false","false","false","false"
"Lowe's","","3601 Crater Lake Hwy","Medford","","OR","97504","5417768421","0","","https://newsroom.lowes.com/responsibility/operational-excellence/","42.3652892","-122.85959","17.8212890066282","Batteries (Rechargeable); Cell Phone Batteries; Li-Ion Batteries; Ni-Cd Batteries; Ni-MH Batteries; Small Sealed Lead Acid Batteries; Cell Phones","false","true","","Call2Recycle","false","false","false","false"
"Albertsons","Albertsons","113 N Ross Ln","Medford","Jackson","OR","97501","5418585937","0","","","42.32507","-122.89923","17.8352037791385","Plastic Shopping Bags; Food Storage Bags; Video Game Consoles; PlayStation Consoles","false","true","","","false","false","false","false"
"Walmart Tire & Lube Express","Walmart Tire & Lube Express","3615 Crater Lake Hwy","Medford","Jackson","OR","97504","5417702010","0","","http://www.walmart.com/catalog/catalog.gsp?cat=495843","42.36889","-122.85603","17.852717703974","Lead Acid (Pb) Batteries; Used Motor Oil; Oil Filters; Video Game Consoles; PlayStation Consoles","false","true","","","false","false","false","false"
"Walmart","Walmart","3615 Crater Lake Hwy","Medford","Jackson","OR","97504","5417702010","0","","http://www.walmart.com","42.36889","-122.85603","17.852717703974","Lead Acid (Pb) Batteries; Plastic Shopping Bags; Food Storage Bags; Video Game Consoles; PlayStation Consoles","false","true","","","false","false","false","false"
"Call2Recycle at Lowe's","Call2Recycle at Lowe's","3601 Crater Lake Hwy","Medford","Jackson","OR","97504","5417768421","0","Monday: 6:00 AM - 10:00 PM Tuesday: 6:00 AM - 10:00 PM Wednesday: 6:00 AM - 10:00 PM Thursday: 6:00 AM - 10:00 PM Friday: 6:00 AM - 10:00 PM Saturday: 6:00 AM - 10:00 PM Sunday: 8:00 AM - 8:00 PM ","http://www.lowes.com/","42.36889","-122.85603","17.852717703974","Cell Phones; Compact Fluorescent Lights; Ni-Cd Batteries; Plastic Shopping Bags; Li-Ion Batteries; Ni-MH Batteries; Ni-Zn Batteries; Small Sealed Lead Acid Batteries; Video Game Consoles; PlayStation Consoles","false","true","As an environmentally-committed retailer, Lowes offers a recycling center near store entrances to give consumers a free and easy way to properly dispose of rechargeable batteries, cell phones, CFLs and plastic shopping bags; materials that otherwise could be potentially harmful to the environment.  Look for the recycling center or ask a store associate for more details.","","false","false","false","false"
"Sherwin Williams","","2560 Crater Lake Highway","Medford","","OR","97504","5417705850","0","","https://www.paintcare.org/","42.3548373","-122.8677412","17.8527765143311","","false","false","","","false","false","false","false"
"USPS Post Office Box Lobby Recycling Program","US Post Office","100 Railroad Ave","Wolf Creek","Josephine","OR","97497","8002758777","0","","https://www.usps.com/","42.69214","-123.39061","17.8700839945908","Catalogs; Greeting Cards; Magazines; Paper (Mixed)","false","true","","","false","false","false","false"
"Best Buy","Best Buy","2370 Poplar Dr ","Medford","Jackson County","OR","97504","5417322839","0","","https://www.bestbuy.com/recycle","42.3533017","-122.8681847","17.8926538879065","Large Household Appliances; Refrigerators; Televisions; AC Power Plugs; Batteries (Rechargeable); Cables & Connectors; Car Audio/Video Equipment; Cell Phone Batteries; Cell Phones; Computer (Recycling); Hard Drives; Computer Monitors; Cameras; DVD Players/Blu-Ray Players/DVRs; Electronics; E-Readers; GPS Units; Headphones; Inkjet Printer Cartridges; Laptop Computers; Laser Toner Cartridges; Li-Ion Batteries; MP3 Players; Network Equipment; Ni-Cd Batteries; Ni-MH Batteries; Ni-Zn Batteries; Computer Peripherals; Portable Media Players; Printers/Scanners/Fax Machines; Small Electronics; Small Sealed Lead Acid Batteries; Stereo Equipment; Tablets; Telephones; UPS Batteries/Backup Systems; VCRs; Video Game Systems; Blu-Ray Players; Digital Converter Boxes; Small Televisions; Video Game Consoles; PlayStation Consoles","true","true","2 TVs per visit, 3 e-waste items per day; $25 fee for TVs and Monitors; $19.99 pick-up fee with delivery; $99.99 standalone pickup fee; ","Sony, Vizio, OEM","false","false","false","false"
"Best Buy","","2370 Poplar Dr","Medford","","OR","97504","5417322839","0","","https://www.bestbuy.com/site/services/recycling/pcmcat149900050025.c?id=pcmcat149900050025","42.3533017","-122.8681847","17.8926538879065","","false","false","","","false","false","false","false"
"Call2Recycle at Office Depot","Call2Recycle at Office Depot","3565 Crater Lake Hwy","Medford","Jackson","OR","97504","5417725571","0","","http://www.officedepot.com/","42.36714","-122.85602","17.9135563065977","Cell Phones; Ni-Cd Batteries; Li-Ion Batteries; Ni-MH Batteries; Ni-Zn Batteries; Small Sealed Lead Acid Batteries; Video Game Consoles; PlayStation Consoles","false","true","The U.S. EPA estimates that more than 350 million rechargeable batteries are purchased annually in the U.S. Thanks to the environmental commitment of this location, its easy and free to recycle your batteries. Bring your rechargeable batteries to this location and look for the recycling box or ask an associate how you can do your part for the environment.","","false","false","false","false"
"Schucks Auto Supply","Schucks Auto Supply","3555 Crater Lake Hwy","Medford","Jackson","OR","97504","5417760480","0","","http://www.cskauto.com","42.36714","-122.85602","17.9135563065977","Lead Acid (Pb) Batteries; Used Motor Oil; Video Game Consoles; PlayStation Consoles","false","true","","","false","false","false","false"
"Batteries Plus","Batteries Plus","3599 Crater Lake Hwy","Medford","Jackson","OR","97504","5418585103","5417764972","","http://www.batteriesplus.com/store_details/208.aspx","42.36714","-122.85602","17.9135563065977","Compact Fluorescent Lights; Batteries (Rechargeable); Alkaline/Single-Use Batteries; Video Game Consoles; PlayStation Consoles","false","true","Some fees for battery recycling may apply.  Please contact your Local store for details. 
<p>
Batteries Plus lead by example by recycling the majority of the batteries we sell. Not only do we recycle to protect our environment, we support retail and business customers alike by keeping them in full compliance with federal, state, municipal, EPA and DOT regulations governing the disposal and recycling of spent batteries and select electronics.","","false","false","false","false"
