name,description,address,city,region,province,postal_code,phone,fax,hours,url,latitude,longitude,distance,materials,pickup,dropoff,notes,groups,curbside,municipal,national,event_only
"USPS Post Office Box Lobby Recycling Program","US Post Office","522 E Main St","Rogue River","Jackson","OR","97537","8002758777","0","","https://www.usps.com/","42.43278","-123.16497","4.43756656157599","Catalogs; Greeting Cards; Magazines; Paper (Mixed)","false","true","","","false","false","false","false"
"US Post Office","USPS Discarded Lobby Mail Recycling Program","522 E Main St","Rogue River","Jackson","OR","97537","0","0","","","42.43278","-123.16497","4.43756656157599","Video Game Consoles; PlayStation Consoles","false","true","","","false","false","false","false"
"USPS Post Office Box Lobby Recycling Program","US Post Office","375 2nd Ave","Gold Hill","Jackson","OR","97525","8002758777","0","","https://www.usps.com/","42.42322","-123.09921","5.9637939548137","Catalogs; Greeting Cards; Magazines; Paper (Mixed)","false","true","","","false","false","false","false"
"US Post Office","USPS Discarded Lobby Mail Recycling Program","375 2nd Ave","Gold Hill","Jackson","OR","97525","0","0","","","42.42322","-123.09921","5.9637939548137","Video Game Consoles; PlayStation Consoles","false","true","","","false","false","false","false"
"AT&T Wireless","AT&T Wireless","150 NE Agness Ave","Grants Pass","Josephine","OR","97526","5414711915","0","","http://www.att.com/","42.43663","-123.29807","8.17063709409627","Cell Phones; Ni-Cd Batteries; Batteries (Rechargeable); Cell Phone Batteries; Tablets; Li-Ion Batteries; Video Game Consoles; PlayStation Consoles","false","true","Receive an AT&T Promotion Card worth the trade-in value of your smartphone, tablet, or netbook. You can also donate the trade-in value to Cell Phones for Soldiers.","","false","false","false","false"
"Walmart Tire & Lube Express","Walmart Tire & Lube Express","135 NE Terry Ln","Grants Pass","Josephine","OR","97526","5414712822","0","","http://www.walmart.com/catalog/catalog.gsp?cat=495843","42.43918","-123.30276","8.29085996020949","Lead Acid (Pb) Batteries; Used Motor Oil; Oil Filters; Video Game Consoles; PlayStation Consoles","false","true","","","false","false","false","false"
"Schucks Auto Supply","Schucks Auto Supply","150 NE Terry Ln","Grants Pass","Josephine","OR","97526","5414714495","0","","http://www.cskauto.com","42.43925","-123.30295","8.29702360131068","Lead Acid (Pb) Batteries; Used Motor Oil; Video Game Consoles; PlayStation Consoles","false","true","","","false","false","false","false"
"Walmart Supercenter","","135 NE Terry Ln","Grants Pass","","OR","97526","5414712822","0","","https://www.walmart.com/","42.4344169","-123.3019268","8.41785467223919","","false","false","","","false","false","false","false"
"Walmart Tire and Lube Express","","135 NE Terry Ln","Grants Pass","","OR","97526","5414712822","0","","https://www.walmart.com/cp/ideas/8932632","42.4344169","-123.3019268","8.41785467223919","","false","false","","","false","false","false","false"
"Walmart","Walmart","135 NE Terry Ln ","Grants Pass","Josephine County","OR","97526","5414712822","0","","http://www.walmart.com","42.4343432","-123.3024722","8.44433796525237","Lead Acid (Pb) Batteries; Plastic Shopping Bags; Food Storage Bags; Video Game Consoles; PlayStation Consoles","false","true","","","false","false","false","false"
"O'Reilly Auto Parts","null","150 Ne Terry Lane ","Grants Pass","","OR","97526","5414714495","0","","http://oreillyauto.custhelp.com/app/error/error_id/6","42.4364311","-123.3044027","8.45670452002995","","false","false","","","false","false","false","false"
"Albertsons","Albertsons","340 NE Beacon Dr","Grants Pass","Josephine","OR","97526","5414766334","0","","","42.43984","-123.30779","8.49519489050528","Plastic Shopping Bags; Food Storage Bags; Video Game Consoles; PlayStation Consoles","false","true","","","false","false","false","false"
"Glidden Professional","Glidden Professional","310 NE Beacon Dr","Grants Pass","Josephine","OR","97526","5414792546","0","","http://paintcare.org/","42.43984","-123.30779","8.49519489050528","Unused Paint; Latex Paint; Video Game Consoles; PlayStation Consoles","false","true","Paint is accepted during regular business hours; call ahead for hours and to make sure the store can accept your amount of paint.  
Site accepts most latex and oil based house paint, stains and varnish but not aerosols, auto or industrial paints. 
Please visit <a href="http://www.paintcare.org/oregon/products_fee.php" target="_blank">Paintcare.org</a> for more details and restrictions.","","false","false","false","false"
"Call2Recycle at RadioShack","Call2Recycle at RadioShack","1893 NE 7th St","Grants Pass","Josephine","OR","97526","5414765814","0","","http://www.radioshack.com/","42.45895","-123.32065","8.58907484144884","Cell Phones; Ni-Cd Batteries; Li-Ion Batteries; Ni-MH Batteries; Ni-Zn Batteries; Small Sealed Lead Acid Batteries; Video Game Consoles; PlayStation Consoles","false","true","As the first national retailer to partner with Call2Recycle, RadioShack is at the forefront of the rechargeable battery recycling cause and is pleased to offer battery recycling at thousands of convenient RadioShack locations for free.  Simply drop them off at your local RadioShack and theyll take care of the rest.  Ask a store associate for more details.","","false","false","false","false"
"Grants Pass Goodwill","Grants Pass Goodwill","1101 NE D St","Grants Pass","Josephine","OR","97526","5419555245","0","Monday: 10:00 AM - 7:00 PM Tuesday: 10:00 AM - 7:00 PM Wednesday: 10:00 AM - 7:00 PM Thursday: 10:00 AM - 7:00 PM Friday: 10:00 AM - 7:00 PM Saturday: 10:00 AM - 7:00 PM Sunday: 11:00 AM - 5:00 PM ","","42.44002","-123.31014","8.59575504819192","Books (Reuse); Clothing; Computer (Reuse); Computer (Recycling); Electronics; Fluorescent Lamps/Tubes; Sporting Goods; Televisions; Stereo Equipment; Small Appliances; Shoes; MP3 Players; Video Game Consoles; PlayStation Consoles","false","true","","","false","false","false","false"
"Glidden Professional Paint Center","","310 Northeast Beacon Drive","Grants Pass","","OR","97526","5414792546","0","","https://www.paintcare.org/","42.4387848","-123.3099909","8.62845184944297","","false","false","","","false","false","false","false"
"Call2Recycle at US Cellular","Call2Recycle at US Cellular","162 NE Beacon Dr Ste 109","Grants Pass","Josephine","OR","97526","5414793744","0","","http://www.uscellular.com/","42.43545","-123.30775","8.63860317360542","Cell Phones; Ni-Cd Batteries; Li-Ion Batteries; Ni-MH Batteries; Ni-Zn Batteries; Small Sealed Lead Acid Batteries; Video Game Consoles; PlayStation Consoles","false","true","The U.S. EPA estimates that more than 350 million rechargeable batteries are purchased annually in the U.S. Thanks to the environmental commitment of this location, its easy and free to recycle your batteries. Bring your rechargeable batteries to this location and look for the recycling box or ask an associate how you can do your part for the environment.","","false","false","false","false"
"JCPenney","","939 NE D St","Grants Pass","","OR","97526","5414799784","0","","https://www.jcpenney.com/","42.439593","-123.311687","8.67939018495008","","false","false","","","false","false","false","false"
"AutoZone","","1695 NE 6th St","Grants Pass","","OR","97526","5419561190","0","","https://www.autozone.com/landing/page.jsp?name=in-our-stores","42.4576177","-123.322033","8.68462392578693","","false","false","","","false","false","false","false"
"Staples","","901 Northeast D Street","Grants Pass","","OR","97526","5419555018","0","","https://www.staples.com/sbd/cre/marketing/sustainability-center/recycling-services/","42.4395782","-123.3131395","8.74579089936308","Alkaline/Single-Use Batteries","false","true","","","false","false","false","false"
"Staples","Staples","901 NE D St","Grants Pass","Josephine County","OR","97526","5419555018","0","Monday: 8:00 AM - 9:00 PM Tuesday: 8:00 AM - 9:00 PM Wednesday: 8:00 AM - 9:00 PM Thursday: 8:00 AM - 9:00 PM Friday: 8:00 AM - 9:00 PM Sunday: 10:00 AM - 6:00 PM Saturday: 8:00 AM - 7:00 PM ","https://www.staples.com/recycle","42.4395844","-123.3131919","8.74797762091063","AC Power Plugs; Batteries (Rechargeable); Cables & Connectors; Cell Phone Batteries; Cell Phones; Computer (Recycling); Hard Drives; Computer Monitors; Cameras; DVD Players/Blu-Ray Players/DVRs; Electronics; E-Readers; GPS Units; Headphones; Inkjet Printer Cartridges; Laptop Computers; Laser Toner Cartridges; Li-Ion Batteries; MP3 Players; Network Equipment; Ni-Cd Batteries; Ni-MH Batteries; Ni-Zn Batteries; Computer Peripherals; Portable Media Players; Printers/Scanners/Fax Machines; Small Electronics; Small Sealed Lead Acid Batteries; Stereo Equipment; Tablets; Telephones; UPS Batteries/Backup Systems; VCRs; Video Game Systems; Blu-Ray Players; Digital Converter Boxes; Video Game Consoles; PlayStation Consoles; Alkaline/Single-Use Batteries; Batteries (Rechargeable); Cell Phone Batteries; Li-Ion Batteries; Ni-Cd Batteries; Ni-MH Batteries; Small Sealed Lead Acid Batteries; Alkaline/Single-Use Batteries; Button Batteries; Non-rechargeable lithium batteries; Cell Phones","false","true","NO TVs; Limit 6 CEDs per day; ","Sony, Vizio, OEM, Call2Recycle","false","false","false","false"
"Allied Waste","Allied Waste","1920 NW Washington Blvd","Grants Pass","Josephine","OR","97526","5414793371","0","","http://www.republicservices.com/","42.46158","-123.32523","8.75906304415936","Cell Phones; Ni-Cd Batteries; Li-Ion Batteries; Ni-MH Batteries; Ni-Zn Batteries; Small Sealed Lead Acid Batteries; Video Game Consoles; PlayStation Consoles","false","true","The U.S. EPA estimates that more than 350 million rechargeable batteries are purchased annually in the U.S. Thanks to the environmental commitment of this location, its easy and free to recycle your batteries. Bring your rechargeable batteries to this location and look for the recycling box or ask an associate how you can do your part for the environment.","","false","false","false","false"
"AutoZone","AutoZone","1695 NE 6th St","Grants Pass","Josephine","OR","97526","5419561190","0","","http://www.autozone.com","42.45504","-123.32251","8.76503222713605","Lead Acid (Pb) Batteries; Used Motor Oil; Video Game Consoles; PlayStation Consoles","false","true","Most AutoZone stores accept used motor oil, transmission fluid, gear oil and automotive batteries. Call to see what your local store is currently accepting.","","false","false","false","false"
"Republic Services Recycle Center","","1920 NW Washington Blvd","Grants Pass","","OR","97526","5414793371","0","","https://www.grantspassoregon.gov/215/Recycling-in-the-Grants-Pass-Area","42.4610829","-123.325706","8.79199926121774","","false","false","","","false","false","false","false"
"USPS Post Office Box Lobby Recycling Program","US Post Office","1636 NW Washington Blvd","Grants Pass","Josephine","OR","97526","8002758777","0","","https://www.usps.com/","42.45725","-123.32531","8.85125120991062","Catalogs; Greeting Cards; Magazines; Paper (Mixed)","false","true","","","false","false","false","false"
"US Post Office","USPS Discarded Lobby Mail Recycling Program","1636 NW Washington Blvd","Grants Pass","Josephine","OR","97526","0","0","","","42.45725","-123.32531","8.85125120991062","Video Game Consoles; PlayStation Consoles","false","true","","","false","false","false","false"
"Call2Recycle at the Home Depot","Call2Recycle at the Home Depot","111 NE Mill St","Grants Pass","Josephine","OR","97526","5412260114","0","","http://www.homedepot.com/","42.43664","-123.31691","9.00971011566915","Cell Phones; Compact Fluorescent Lights; Ni-Cd Batteries; Li-Ion Batteries; Ni-MH Batteries; Ni-Zn Batteries; Small Sealed Lead Acid Batteries; Video Game Consoles; PlayStation Consoles","false","true","The Home Depot accepts used rechargeable batteries and compact fluorescent bulbs. Look for the orange drop boxes, usually located near the front entrance near the customer service desk, or ask a store associate for more details.","","false","false","false","false"
"Home Depot","","111 NE Mill St","Grants Pass","","OR","97526","5412260114","0","","https://ecooptions.homedepot.com/","42.4363693","-123.3169396","9.01972108413231","Batteries (Rechargeable); Cell Phone Batteries; Li-Ion Batteries; Ni-Cd Batteries; Ni-MH Batteries; Small Sealed Lead Acid Batteries","false","true","","Call2Recycle","false","false","false","false"
"Safeway","null","115 SE 7th St","Grants Pass","","OR","97526","5419567540","0","","https://shop.safeway.com/home.html","42.4386874","-123.324775","9.30486236881156","","false","false","","","false","false","false","false"
"Schucks Auto Supply","Schucks Auto Supply","105 NE 7th St","Grants Pass","Josephine","OR","97526","5414768442","0","","http://www.cskauto.com","42.43872","-123.32563","9.34320244476782","Lead Acid (Pb) Batteries; Video Game Consoles; PlayStation Consoles","false","true","","","false","false","false","false"
"Call2Recycle at Photo Den Vision and Sound","Call2Recycle at Photo Den Vision and Sound","315 SE 7th St","Grants Pass","Josephine","OR","97526","5414791833","0","","http://www.photoden.com/","42.43771","-123.32658","9.41708979932304","Cell Phones; Ni-Cd Batteries; Li-Ion Batteries; Ni-MH Batteries; Ni-Zn Batteries; Small Sealed Lead Acid Batteries; Video Game Consoles; PlayStation Consoles","false","true","The U.S. EPA estimates that more than 350 million rechargeable batteries are purchased annually in the U.S. Thanks to the environmental commitment of this location, its easy and free to recycle your batteries. Bring your rechargeable batteries to this location and look for the recycling box or ask an associate how you can do your part for the environment.","","false","false","false","false"
"Don's Bike Center","Don's Bike Center","201 SW G St","Grants Pass","Josephine ","OR","97526","5414713494","0","","","42.439286","-123.328579","9.46253791524276","E-Bike Batteries","false","true","Call or Check Online for Hours","Call2Recycle","false","false","false","false"
"Sherwin Williams","","1072 Rogue River Highway","Grants Pass","","OR","97527","5414745985","0","","https://www.paintcare.org/","42.4237849","-123.3181115","9.50557402523818","","false","false","","","false","false","false","false"
"Sherwin Williams #8192","Sherwin Williams #8192","1072 Rogue River Hwy","Grants Pass","Josephine","OR","97527","5414745985","0","","http://paintcare.org/","42.42325","-123.31836","9.53600606991389","Unused Paint; Latex Paint; Video Game Consoles; PlayStation Consoles","false","true","Paint is accepted during regular business hours; call ahead for hours and to make sure the store can accept your amount of paint.  
Site accepts most latex and oil based house paint, stains and varnish but not aerosols, auto or industrial paints. 
Please visit <a href="http://www.paintcare.org/oregon/products_fee.php" target="_blank">Paintcare.org</a> for more details and restrictions.","","false","false","false","false"
"ExpertTire Store","ExpertTire Store","610 SW 6th St","Grants Pass","Josephine","OR","97526","5414718973","0","","http://www.firestone.com","42.43592","-123.32925","9.59362871460948","Lead Acid (Pb) Batteries; Used Motor Oil; Video Game Consoles; PlayStation Consoles","false","true","","","false","false","false","false"
"Call2Recycle at Interstate Batteries of Southern Oregon","Call2Recycle at Interstate Batteries of Southern Oregon","116 SE M St ","Grants Pass","Josephine County","OR","97526","5414760703","0","","http://www.interstatebatteries.com","42.4335465","-123.3293774","9.67271354964201","Cell Phones; Ni-Cd Batteries; Li-Ion Batteries; Ni-MH Batteries; Ni-Zn Batteries; Small Sealed Lead Acid Batteries; Video Game Consoles; PlayStation Consoles","false","true","The U.S. EPA estimates that more than 350 million rechargeable batteries are purchased annually in the U.S. Thanks to the environmental commitment of this location, its easy and free to recycle your batteries. Bring your rechargeable batteries to this location and look for the recycling box or ask an associate how you can do your part for the environment.","","false","false","false","false"
