name,description,address,city,region,province,postal_code,phone,fax,hours,url,latitude,longitude,distance,materials,pickup,dropoff,notes,groups,curbside,municipal,national,event_only
"GreenSpot DropOff","GreenSpot DropOff at The Storage Place","1119 E Moore Ave","Terrell","Kaufman","TX","75160","9725631244","0","Monday: 9:00 AM - 6:00 PM Tuesday: 9:00 AM - 6:00 PM Wednesday: 9:00 AM - 6:00 PM Thursday: 9:00 AM - 6:00 PM Friday: 9:00 AM - 6:00 PM Saturday: 9:00 AM - 2:00 PM Sunday: 2:00 PM - 6:00 PM ","http://www.greenspotdropoff.org","32.73471","-96.26118","37.0705821035386","Cables & Connectors; Computer (Recycling); Hard Drives; Computer Monitors; DVD Players/Blu-Ray Players/DVRs; Laptop Computers; Memory (RAM), Flash Card/Drive; Computer Peripherals; Printers/Scanners/Fax Machines; Small Televisions; Stereo Equipment; Telephones; Televisions; VCRs; Inkjet Printer Cartridges; Laser Toner Cartridges; Electronics; Tablets; Video Game Consoles; PlayStation Consoles","false","true","Greenspot Dropoff provides free and convenient e-waste recycling at a dropoff location near you. We collect anything you plug in and want to throw away (excluding appliances).","","false","false","false","false"
"Goodwill Industries of Northeast Texas - Dell Reconnect Donation Site","","1655 North Center Street","Bonham","","TX","75418","9035838626","0","","http://goodwillnorthtexas.org","33.5907675","-96.1780142","37.2406007462208","","false","false","","","false","false","false","false"
"Performance Lube & Muffler","Performance Lube & Muffler","2170 W Princeton Dr","Princeton","Collin","TX","75407","9725299730","0","","","33.17132","-96.47807","37.305377798237","Used Motor Oil; Oil Filters; Computer (Recycling); Computer Monitors; Electronics; Laptop Computers; Computer Peripherals; Small Televisions; Tablets; Televisions; Video Game Consoles; PlayStation Consoles","false","true","","","false","false","false","false"
"Pauls Oil Station, Inc.","Pauls Oil Station, Inc.","611 W Moore Ave","Terrell","Kaufman","TX","75160","9724124751","0","","","32.73589","-96.27085","37.3868396053963","Used Motor Oil; Oil Filters; Computer (Recycling); Computer Monitors; Electronics; Laptop Computers; Computer Peripherals; Small Televisions; Tablets; Televisions; Video Game Consoles; PlayStation Consoles","false","true","","","false","false","false","false"
"Falcon Metals, LP","","707 East Grove Street","Terrell","","TX","75160","2146605400","0","","https://www.falconmetals.net/","32.7346971","-96.2714114","37.4696839346533","","false","false","","","false","false","false","false"
"Falcon Metals LP","Falcon Metals LP","707 E Grove St","Terrell","Kaufman","TX","75160","2146605400","0","","http://www.falconmetals.net","32.73401","-96.27206","37.53015724197","Aluminum; Computer (Recycling); Ferrous Metals (Steel or Iron); Non-ferrous (Copper/Brass/Tin); Wire; High-Temp Alloys; Special Metals; Computer Monitors; Electronics; Laptop Computers; Computer Peripherals; Small Televisions; Tablets; Televisions; Video Game Consoles; PlayStation Consoles","false","true","","","false","false","false","false"
"Terrell Metal Recycling","Terrell Metal Recycling","707 E Grove St","Terrell","Kaufman","TX","75160","2146605400","0","Monday: 8:00 AM - 5:00 PM Tuesday: 8:00 AM - 5:00 PM Wednesday: 8:00 AM - 5:00 PM Thursday: 8:00 AM - 5:00 PM Friday: 8:00 AM - 5:00 PM Saturday: 8:00 AM - 11:59 PM ","http://www.terrellrecycling.com","32.73401","-96.27206","37.53015724197","Aluminum Cans; Aluminum; Lead Acid (Pb) Batteries; Cardboard; Electronics; Ferrous Metals (Steel or Iron); Paper (Mixed); Non-ferrous (Copper/Brass/Tin); Tin or Steel Cans; Wire; High-Temp Alloys; Special Metals; Computer (Recycling); Computer Monitors; Laptop Computers; Computer Peripherals; Small Televisions; Tablets; Televisions; Video Game Consoles; PlayStation Consoles","false","true","","","false","false","false","false"
"GreenSpot DropOff","GreenSpot DropOff at The Storage Place","161 Business Cir","Terrell","Kaufman","TX","75160","9725244452","0","Monday: 8:00 AM - 4:30 PM Tuesday: 8:00 AM - 4:30 PM Wednesday: 8:00 AM - 4:30 PM Thursday: 8:00 AM - 4:30 PM Friday: 8:00 AM - 4:30 PM Saturday: 12:30 PM - 4:30 PM ","http://www.greenspotdropoff.org","32.75125","-96.29472","37.580323990261","Cables & Connectors; Computer (Recycling); Hard Drives; Computer Monitors; DVD Players/Blu-Ray Players/DVRs; Laptop Computers; Memory (RAM), Flash Card/Drive; Computer Peripherals; Printers/Scanners/Fax Machines; Small Televisions; Stereo Equipment; Telephones; Televisions; VCRs; Inkjet Printer Cartridges; Laser Toner Cartridges; Electronics; Tablets; Video Game Consoles; PlayStation Consoles","false","true","Greenspot Dropoff provides free and convenient e-waste recycling at a dropoff location near you. We collect anything you plug in and want to throw away (excluding appliances).","","false","false","false","false"
"AutoZone","AutoZone","403 W Moore Ave","Terrell","Kaufman","TX","75160","9725511561","0","","http://www.autozone.com","32.73683","-96.28175","37.7699666358807","Lead Acid (Pb) Batteries; Used Motor Oil; Computer (Recycling); Computer Monitors; Electronics; Laptop Computers; Computer Peripherals; Small Televisions; Tablets; Televisions; Video Game Consoles; PlayStation Consoles","false","true","Most AutoZone stores accept used motor oil, transmission fluid, gear oil and automotive batteries. Call to see what your local store is currently accepting.","","false","false","false","false"
"AutoZone","","1805 N Hwy 121","Bonham","","TX","75418","9036400612","0","","https://www.autozone.com/landing/page.jsp?name=in-our-stores","33.5936651","-96.1928663","37.8709665567265","","false","false","","","false","false","false","false"
"Terrell Iron & Metal","Terrell Iron & Metal","1031 S Delphine St","Terrell","Kaufman","TX","75160","9725635386","0","Monday: 8:00 AM - 5:00 PM Tuesday: 8:00 AM - 5:00 PM Wednesday: 8:00 AM - 5:00 PM Thursday: 8:00 AM - 5:00 PM Friday: 8:00 AM - 5:00 PM Saturday: 8:00 AM - 12:00 PM ","","32.72744","-96.27538","37.9958215959948","Aluminum Cans; Lead Acid (Pb) Batteries; Ferrous Metals (Steel or Iron); Non-ferrous (Copper/Brass/Tin); Tin or Steel Cans; Computer (Recycling); Computer Monitors; Electronics; Laptop Computers; Computer Peripherals; Small Televisions; Tablets; Televisions; Video Game Consoles; PlayStation Consoles","false","true","","","false","false","false","false"
"Terrell Iron & Metal Co","Terrell Iron & Metal Co","1031 S Delphine St","Terrell","Kaufman","TX","75160","9725635386","0","Monday: 8:00 AM - 5:00 PM Tuesday: 8:00 AM - 5:00 PM Wednesday: 8:00 AM - 5:00 PM Thursday: 8:00 AM - 5:00 PM Friday: 8:00 AM - 5:00 PM Saturday: 8:00 AM - 11:59 PM ","http://terrellscrapmetal.com","32.72744","-96.27538","37.9958215959948","Aluminum Cans; Aluminum; Cardboard; Cell Phones; Computer (Recycling); Electronics; Ferrous Metals (Steel or Iron); Video Game Systems; Large Household Appliances; Non-ferrous (Copper/Brass/Tin); Tin or Steel Cans; Laptop Computers; Tablets; MP3 Players; AC Power Plugs; Portable Media Players; Wire; Power Supplies; Computer Peripherals; VCRs; DVD Players/Blu-Ray Players/DVRs; Computer Monitors; Small Televisions; Televisions; Video Game Consoles; PlayStation Consoles","false","true","","","false","false","false","false"
"Firestone Complete Auto Care","","909 W Moore Ave","Terrell","","TX","75160","9725241151","0","","https://www.firestonecompleteautocare.com/","32.7375188","-96.2887626","38.0158249859737","","false","false","","","false","false","false","false"
"Firestone Complete Auto Care Store","Firestone Complete Auto Care Store","909 W Moore Ave","Terrell","Kaufman","TX","75160","9722102108","0","","http://www.firestonecompleteautocare.com/","32.73752","-96.28887","38.0200790449232","Lead Acid (Pb) Batteries; Used Motor Oil; Computer (Recycling); Computer Monitors; Electronics; Laptop Computers; Computer Peripherals; Small Televisions; Tablets; Televisions; Video Game Consoles; PlayStation Consoles","false","true","","","false","false","false","false"
"Kaufman County Christmas Tree Recycling Event - Ben Gill Park","","399 Lane St","Terrell","","TX","75160","9725516678","0","","https://www.cityofterrell.org","32.7415902","-96.2939452","38.0229002834349","","false","false","","","false","false","false","false"
"City of Rockwall Household Hazardous Waste Collection Day","","","Rockwall","","TX","75087","9727717736","0","","http://www.rockwall.com/","32.9682679","-96.4609998","38.0447106247391","","false","false","","","false","false","false","false"
"Terrell Iron & Metal Co","","1031 South Delphine Street","Terrell","","TX","75160","9725635386","0","","","32.7261502","-96.275396","38.0625558501023","","false","false","","","false","false","false","false"
"Walmart Supercenter","","2021 State Highway 121","Bonham","","TX","75418","9035839591","0","","https://www.walmart.com/","33.596427","-96.1946346","38.0863721839041","","false","false","","","false","false","false","false"
"Randalls","","3070 N Goliad St","Rockwall","","TX","75087","9729619330","0","","https://shop.safeway.com/home.html","32.9645094","-96.4624985","38.207168911498","","false","false","","","false","false","false","false"
"Goodwill Industries of East Texas - Dell Reconnect Donation Site","","201 Newsome","Mineola","","TX","75773","9035693404","0","","http://www.goodwilleasttexas.com/","32.6644865","-95.4869979","38.2184563513625","","false","false","","","false","false","false","false"
"Tractor Supply","","2205 State Highway 121 North","Bonham","","TX","75418","9036408085","0","","https://www.tractorsupply.com/","33.5997121","-96.193391","38.2377027115381","","false","false","","","false","false","false","false"
"City of Paris Compost Facility","","Field Rd","Paris","","TX","75460","9037849289","0","","https://www.paristexas.gov/112/Sanitation-Division","33.6405792","-95.5640517","38.2988252951024","","false","false","","","false","false","false","false"
"Kwik Kar Lube & Tune","Kwik Kar Lube & Tune","96 State Highway 205","Terrell","Kaufman","TX","75160","9725519200","0","","","32.74175","-96.30387","38.4203661155723","Used Motor Oil; Oil Filters; Computer (Recycling); Computer Monitors; Electronics; Laptop Computers; Computer Peripherals; Small Televisions; Tablets; Televisions; Video Game Consoles; PlayStation Consoles","false","true","","","false","false","false","false"
"Verizon Wireless","Verizon Wireless","1039 E Interstate 30 Ste 101","Rockwall","Rockwall","TX","75087","8666444532","0","","http://www.verizonwireless.com/","32.9159","-96.44482","38.4341499354996","Cell Phones; Cell Phone Batteries; Computer (Recycling); Computer Monitors; Electronics; Laptop Computers; Computer Peripherals; Small Televisions; Tablets; Televisions; Video Game Consoles; PlayStation Consoles","false","true","<A Href="https://www.trade-in.vzw.com/home.aspx">
The Verizon Wireless Trade-In Program</A> allows you to trade in your used handset or tablet in a convenient and responsible way. 
<P>
<P>
Verizon Wireless works every day to protect our environment and give our customers opportunities to do the same. <A Href="http://aboutus.vzw.com/Green_Initiative/overview.html">Click here</A> for more examples of the earth-friendly initiatives and programs Verizon Wireless is proud to offer and support.","","false","false","false","false"
"Tractor Supply","","100 State Highway 205, #100","Terrell","","TX","75160","9725512600","0","","https://www.tractorsupply.com/","32.7392952","-96.3015093","38.4440528064528","","false","false","","","false","false","false","false"
"AutoZone","null"," 202 E Princeton","Princeton","","TX","75407","9727362227","0","","https://www.autozone.com/landing/page.jsp?name=in-our-stores","33.1746715","-96.4979364","38.4672276778072","","false","false","","","false","false","false","false"
"Ymca","","1210 N Goliad St","Rockwall","","TX","75087","8008741301","0","","http://paperretriever.com/","32.945115","-96.4600997","38.5128683842328","","false","false","","","false","false","false","false"
"Discount Tire & Service","Discount Tire & Service","180 State Highway 205","Terrell","Kaufman","TX","75160","9725639700","0","","","32.7389","-96.30331","38.5370466223929","Used Motor Oil; Oil Filters; Computer (Recycling); Computer Monitors; Electronics; Laptop Computers; Computer Peripherals; Small Televisions; Tablets; Televisions; Video Game Consoles; PlayStation Consoles","false","true","","","false","false","false","false"
"Discount Tire and Service","Discount Tire and Service","180 State Highway 205","Terrell","Kaufman","TX","75160","9725639700","0","","","32.7389","-96.30331","38.5370466223929","Antifreeze; Used Motor Oil; Oil Filters; Computer (Recycling); Computer Monitors; Electronics; Laptop Computers; Computer Peripherals; Small Televisions; Tablets; Televisions; Video Game Consoles; PlayStation Consoles","false","true","","","false","false","false","false"
"Walmart Tire & Lube Express","Walmart Tire & Lube Express","1900 W Moore Ave","Terrell","Kaufman","TX","75160","9725637638","0","","http://www.walmart.com/catalog/catalog.gsp?cat=495843","32.73726","-96.30348","38.6245809498076","Lead Acid (Pb) Batteries; Used Motor Oil; Oil Filters; Computer (Recycling); Computer Monitors; Electronics; Laptop Computers; Computer Peripherals; Small Televisions; Tablets; Televisions; Video Game Consoles; PlayStation Consoles","false","true","","","false","false","false","false"
"O'Reilly Auto Parts","null","208 West Princeton Drive","Princeton","","TX","75407","9727362375","0","","http://oreillyauto.custhelp.com/app/error/error_id/6","33.1750489","-96.5024353","38.7285743888319","","false","false","","","false","false","false","false"
"USPS Post Office Box Lobby Recycling Program","US Post Office","609 W Main St","Campbell","Hunt","TX","75422","8002758777","0","","https://www.usps.com/","33.14725","-95.9604","7.32950652436102","Catalogs; Greeting Cards; Magazines; Paper (Mixed)","false","true","","","false","false","false","false"
"Walmart Supercenter","","2701 State Highway 50","Commerce","","TX","75428","9038863108","0","","https://www.walmart.com/","33.2350875","-95.9147219","8.3579663853585","","false","false","","","false","false","false","false"
"O'Reilly Auto Parts","O'Reilly Auto Parts","1812 Live Oak St","Commerce","Hunt","TX","75428","4178622674","0","","http://www.oreillyauto.com/","33.24737","-95.90619","8.83499072114038","Used Motor Oil; Oil Filters; Computer (Recycling); Computer Monitors; Electronics; Laptop Computers; Computer Peripherals; Small Televisions; Tablets; Televisions; Video Game Consoles; PlayStation Consoles","false","true","Most stores offer Used Oil & Battery Recycling, Battery Testing, 
Electrical & Module Testing, Loaner Tool Program, Drum / Rotor Resurfacing. Call your location for more details.","","false","false","false","false"
"Walmart","Walmart","2701 State Highway 50","Commerce","Hunt","TX","75428","9038863108","0","","http://www.walmart.com","33.24501","-95.91225","8.8634146001546","Lead Acid (Pb) Batteries; Plastic Shopping Bags; Food Storage Bags; Computer (Recycling); Computer Monitors; Electronics; Laptop Computers; Computer Peripherals; Small Televisions; Tablets; Televisions; Video Game Consoles; PlayStation Consoles","false","true","","","false","false","false","false"
"O'Reilly Auto Parts","null","1812 Live Oak Street","Commerce","","TX","75428","9038861755","0","","http://oreillyauto.custhelp.com/app/error/error_id/6","33.2475632","-95.9070887","8.87120186032702","","false","false","","","false","false","false","false"
"Goodwill Industries of Northeast Texas - Dell Reconnect Donation Site","","2214 Live Oak Street","Commerce","","TX","75428","9038863600","0","","http://goodwillnorthtexas.org","33.2482275","-95.9133602","9.08775348163732","","false","false","","","false","false","false","false"
"Goodwill Industries of Northeast Texas - Dell Reconnect Donation Site","","2214 Live Oak Street","Commerce","","TX","75428","9038863600","0","","http://goodwillnorthtexas.org","33.2482275","-95.9133602","9.08775348163732","","false","false","","","false","false","false","false"
