name,description,address,city,region,province,postal_code,phone,fax,hours,url,latitude,longitude,distance,materials,pickup,dropoff,notes,groups,curbside,municipal,national,event_only
"Alliance Document Shredding","","178 CR 1106","Sulphur Springs","","TX","75482","9034852373","0","","http://www.adocshred.com/","33.0831141","-95.6601942","10.698828840184","","false","false","","","false","false","false","false"
"Goodwill Industries of Northeast Texas - Dell Reconnect Donation Site","","1320 Shannon Road West","Sulphur Springs","","TX","75482","9038857460","0","","http://goodwillnorthtexas.org","33.1179439","-95.6297769","11.9077876772028","","false","false","","","false","false","false","false"
"Whitson's Auto Lube Inc.","Whitson's Auto Lube Inc.","917 Main St","Sulphur Springs","Hopkins","TX","75482","9038855823","0","Monday: 8:00 AM - 5:30 PM Tuesday: 8:00 AM - 5:30 PM Wednesday: 8:00 AM - 5:30 PM Thursday: 8:00 AM - 5:30 PM Friday: 8:00 AM - 5:30 PM Saturday: 8:00 AM - 5:30 PM ","","33.13397","-95.61421","12.7531104332477","Antifreeze; Brake Fluid; Transmission Fluid; Used Motor Oil; Oil Filters; Computer (Recycling); Computer Monitors; Electronics; Laptop Computers; Computer Peripherals; Small Televisions; Tablets; Televisions; Video Game Consoles; PlayStation Consoles","false","true","","","false","false","false","false"
"O'Reilly Auto Parts","O'Reilly Auto Parts","840 Gilmer","Sulphur Springs","Hopkins","TX","75482","9034381319","0","","http://www.oreillyauto.com/","33.12688","-95.59877","13.6567471097167","Used Motor Oil; Oil Filters; Computer (Recycling); Computer Monitors; Electronics; Laptop Computers; Computer Peripherals; Small Televisions; Tablets; Televisions; Video Game Consoles; PlayStation Consoles","false","true","Most stores offer Used Oil & Battery Recycling, Battery Testing, 
Electrical & Module Testing, Loaner Tool Program, Drum / Rotor Resurfacing. Call your location for more details.","","false","false","false","false"
"United Cellular, Inc.","","200 Shannon Rd W","Sulphur Springs","","TX","75482","9038853596","0","","","33.1155202","-95.5980911","13.7489548165497","","false","false","","","false","false","false","false"
"Lowe's","","1711 S Broadway St","Sulphur Springs","","TX","75482","9034383000","0","","https://newsroom.lowes.com/responsibility/operational-excellence/","33.1075022","-95.5989851","13.761822873636","Batteries (Rechargeable); Cell Phone Batteries; Li-Ion Batteries; Ni-Cd Batteries; Ni-MH Batteries; Small Sealed Lead Acid Batteries; Cell Phones","false","true","","Call2Recycle","false","false","false","false"
"AutoZone","AutoZone","1187 S Broadway St","Sulphur Springs","Hopkins","TX","75482","9038852882","0","","http://www.autozone.com","33.12052","-95.59627","13.8252555091015","Lead Acid (Pb) Batteries; Used Motor Oil; Computer (Recycling); Computer Monitors; Electronics; Laptop Computers; Computer Peripherals; Small Televisions; Tablets; Televisions; Video Game Consoles; PlayStation Consoles","false","true","Most AutoZone stores accept used motor oil, transmission fluid, gear oil and automotive batteries. Call to see what your local store is currently accepting.","","false","false","false","false"
"Tractor Supply","","1737 South Broadway","Sulphur Springs","","TX","75482","9034394908","0","","https://www.tractorsupply.com/","33.1058854","-95.5979179","13.838586119829","","false","false","","","false","false","false","false"
"RadioShack","RadioShack","1339 S Broadway St","Sulphur Springs","Hopkins","TX","75482","9038859494","0","Monday: 9:00 AM - 8:00 PM Tuesday: 9:00 AM - 8:00 PM Wednesday: 9:00 AM - 8:00 PM Thursday: 9:00 AM - 8:00 PM Friday: 9:00 AM - 8:00 PM Saturday: 9:00 AM - 8:00 PM Sunday: 12:00 PM - 6:00 PM ","http://www.radioshack.com","33.11521","-95.59649","13.8432408295205","Ni-Cd Batteries; Batteries (Rechargeable); Computer (Recycling); Computer Monitors; Electronics; Laptop Computers; Computer Peripherals; Small Televisions; Tablets; Televisions; Video Game Consoles; PlayStation Consoles","false","true","","","false","false","false","false"
"Call2Recycle at Lowe's","Call2Recycle at Lowe's","1711 S Broadway St","Sulphur Springs","Hopkins","TX","75482","9034383000","0","Monday: 6:00 AM - 10:00 PM Tuesday: 6:00 AM - 10:00 PM Wednesday: 6:00 AM - 10:00 PM Thursday: 6:00 AM - 10:00 PM Friday: 6:00 AM - 10:00 PM Saturday: 6:00 AM - 10:00 PM Sunday: 8:00 AM - 8:00 PM ","http://www.lowes.com/","33.10566","-95.59703","13.8916767745847","Cell Phones; Compact Fluorescent Lights; Ni-Cd Batteries; Plastic Shopping Bags; Li-Ion Batteries; Ni-MH Batteries; Ni-Zn Batteries; Small Sealed Lead Acid Batteries; Computer (Recycling); Computer Monitors; Electronics; Laptop Computers; Computer Peripherals; Small Televisions; Tablets; Televisions; Video Game Consoles; PlayStation Consoles","false","true","As an environmentally-committed retailer, Lowes offers a recycling center near store entrances to give consumers a free and easy way to properly dispose of rechargeable batteries, cell phones, CFLs and plastic shopping bags; materials that otherwise could be potentially harmful to the environment.  Look for the recycling center or ask a store associate for more details.","","false","false","false","false"
"Walmart","Walmart","1750 S Broadway St","Sulphur Springs","Hopkins","TX","75482","9034393144","0","","http://www.walmart.com","33.10524","-95.59696","13.8998913644658","Lead Acid (Pb) Batteries; Plastic Shopping Bags; Food Storage Bags; Computer (Recycling); Computer Monitors; Electronics; Laptop Computers; Computer Peripherals; Small Televisions; Tablets; Televisions; Video Game Consoles; PlayStation Consoles","false","true","","","false","false","false","false"
"Verizon Wireless","Verizon Wireless","380 Shannon Rd E","Sulphur Springs","Hopkins","TX","75482","8666444532","0","","http://www.verizonwireless.com/","33.1159","-95.59466","13.9441459577171","Cell Phones; Cell Phone Batteries; Computer (Recycling); Computer Monitors; Electronics; Laptop Computers; Computer Peripherals; Small Televisions; Tablets; Televisions; Video Game Consoles; PlayStation Consoles","false","true","<A Href="https://www.trade-in.vzw.com/home.aspx">
The Verizon Wireless Trade-In Program</A> allows you to trade in your used handset or tablet in a convenient and responsible way. 
<P>
<P>
Verizon Wireless works every day to protect our environment and give our customers opportunities to do the same. <A Href="http://aboutus.vzw.com/Green_Initiative/overview.html">Click here</A> for more examples of the earth-friendly initiatives and programs Verizon Wireless is proud to offer and support.","","false","false","false","false"
"Walmart Supercenter","","1750 S Broadway St","Sulphur Springs","","TX","75482","9034393144","0","","https://www.walmart.com/","33.1057293","-95.5955374","13.9764813900394","","false","false","","","false","false","false","false"
"Goodwill Industries of Northeast Texas - Dell Reconnect Donation Site","","1803 IH-30","Greenville","","TX","75401","9034557419","0","","http://goodwillnorthtexas.org","33.1211228","-96.0950032","15.0923450626577","","false","false","","","false","false","false","false"
"Home Depot","","Center Point Rd","Greenville","","TX","75402","9034542125","0","","https://ecooptions.homedepot.com/","33.0982946","-96.0933643","15.1777949300106","","false","false","","","false","false","false","false"
"City of Greenville Drop-Off Recycling Site","","Washington St & Bois D Arc St","Greenville","","TX","75401","9034573116","0","","http://www.ci.greenville.tx.us/217/Garbage-Collection-Recycling","33.1358414","-96.1037477","15.5695109665035","","false","false","","","false","false","false","false"
"The Home Depot","The Home Depot","7101 Centerpoint Ln ","Greenville","Hunt County","TX","75402","9034542125","0","","null","33.0977312","-96.1037585","15.7776672265532","Batteries (Rechargeable); Cell Phone Batteries; Li-Ion Batteries; Ni-Cd Batteries; Ni-MH Batteries; Small Sealed Lead Acid Batteries","false","true","Call or Check Online for Hours","Call2Recycle","false","false","false","false"
"Valvoline Express Care","Valvoline Express Care","4608 Stonewall St ","Greenville","Hunt County","TX","75401","9034549721","0","","","33.1240051","-96.1079017","15.8268115396038","Used Motor Oil; Oil Filters; Computer (Recycling); Computer Monitors; Electronics; Laptop Computers; Computer Peripherals; Small Televisions; Tablets; Televisions; Video Game Consoles; PlayStation Consoles","false","true","","","false","false","false","false"
"Valvoline Express Care","","4608 Stonewall Street","Greenville","","TX","75402","9034549721","0","","","33.123956","-96.1079348","15.8288830692219","","false","false","","","false","false","false","false"
"Keep America Beautiful Cars to Donate","","","Greenville","","TX","75403","8554262474","0","","https://www.kab.org/?pagename=car_donation","33.1390681","-96.109013","15.876820893488","","false","false","","","false","false","false","false"
"AutoZone","","3816 Wesley St","Greenville","","TX","75401","9034540193","0","","https://www.autozone.com/landing/page.jsp?name=in-our-stores","33.1303988","-96.1095492","15.9076962573063","","false","false","","","false","false","false","false"
"O'Reilly Auto Parts","O'Reilly Auto Parts","5500 Wesley St","Greenville","Hunt","TX","75402","4178622674","0","Monday: 7:30 AM - 10:00 PM Tuesday: 7:30 AM - 10:00 PM Wednesday: 7:30 AM - 10:00 PM Thursday: 7:30 AM - 10:00 PM Friday: 7:30 AM - 10:00 PM Saturday: 7:30 AM - 10:00 PM Sunday: 8:00 AM - 10:00 PM ","http://www.oreillyauto.com/","33.11377","-96.10987","15.9889096164066","Used Motor Oil; Oil Filters; Computer (Recycling); Computer Monitors; Electronics; Laptop Computers; Computer Peripherals; Small Televisions; Tablets; Televisions; Video Game Consoles; PlayStation Consoles","false","true","Most stores offer Used Oil & Battery Recycling, Battery Testing, 
Electrical & Module Testing, Loaner Tool Program, Drum / Rotor Resurfacing. Call your location for more details.","","false","false","false","false"
"O'Reilly Auto Parts","null","5500 Wesley Street","Greenville","","TX","75402","9034554119","0","","http://oreillyauto.custhelp.com/app/error/error_id/6","33.113699","-96.1100045","15.9971049346942","","false","false","","","false","false","false","false"
"Walmart Tire & Lube Express","Walmart Tire & Lube Express","7401 Interstate Highway 30","Greenville","Hunt","TX","75402","9034551792","0","","http://www.walmart.com/","33.10286","-96.10859","16.0011739909968","Lead Acid (Pb) Batteries; Used Motor Oil; Oil Filters; Computer (Recycling); Computer Monitors; Electronics; Laptop Computers; Computer Peripherals; Small Televisions; Tablets; Televisions; Video Game Consoles; PlayStation Consoles","false","true","","","false","false","false","false"
"Walmart Tire and Lube Express","","7401 Interstate Highway 30","Greenville","","TX","75402","9034551792","0","","https://www.walmart.com/cp/ideas/8932632","33.093752","-96.1071576","16.0180798798729","","false","false","","","false","false","false","false"
"Walmart Supercenter","","7401 Interstate Highway 30","Greenville","","TX","75402","9034551792","0","","https://www.walmart.com/","33.093752","-96.1071576","16.0180798798729","","false","false","","","false","false","false","false"
"Kwik Kar Lube & Tune","","6102 Wesley Street","Greenville","","TX","75402","9034546454","0","","","33.1087084","-96.1100045","16.0320279317019","","false","false","","","false","false","false","false"
"Kwik Kar Lube & Tune","Kwik Kar Lube & Tune","6102 Wesley St","Greenville","Hunt","TX","75402","9034546454","0","","","33.1083","-96.11","16.0349519008039","Antifreeze; Used Motor Oil; Oil Filters; Computer (Recycling); Computer Monitors; Electronics; Laptop Computers; Computer Peripherals; Small Televisions; Tablets; Televisions; Video Game Consoles; PlayStation Consoles","false","true","","","false","false","false","false"
"Greenville-Hunt County Regional Household Hazardous Waste Collection Facility","","3108 Sockwell Blvd","Greenville","","TX","75401","9034572958","0","","http://www.ci.greenville.tx.us/658/Greenville-Hunt-County-HHW-Collection-Ce","33.1542266","-96.1122607","16.1184600423195","","false","false","","","false","false","false","false"
"Tractor Supply","","2703 Traders Road","Greenville","","TX","75402","9034541400","0","","https://www.tractorsupply.com/","33.0910473","-96.1085557","16.1316124645103","","false","false","","","false","false","false","false"
"Walmart","Walmart","7401 I-30 ","Greenville","Hunt County","TX","75402","9034551792","0","","http://www.walmart.com","33.094328","-96.109557","16.1478817094555","Lead Acid (Pb) Batteries; Plastic Shopping Bags; Food Storage Bags; Computer (Recycling); Computer Monitors; Electronics; Laptop Computers; Computer Peripherals; Small Televisions; Tablets; Televisions; Video Game Consoles; PlayStation Consoles","false","true","","","false","false","false","false"
"Eddie Jones Garage","Eddie Jones Garage","69 Highway ","Emory","Rains County","TX","75440","9034732211","0","Monday: 8:00 AM - 5:00 PM Tuesday: 8:00 AM - 5:00 PM Wednesday: 8:00 AM - 5:00 PM Thursday: 8:00 AM - 5:00 PM Friday: 8:00 AM - 5:00 PM ","","32.901131","-95.812951","16.1639450685878","Used Motor Oil; Computer (Recycling); Computer Monitors; Electronics; Laptop Computers; Computer Peripherals; Small Televisions; Tablets; Televisions; Video Game Consoles; PlayStation Consoles","false","true","","","false","false","false","false"
"JCPenney","","6834 Wesley St","Greenville","","TX","75402","9034555252","0","","https://www.jcpenney.com/","33.1005293","-96.1110669","16.1658985213326","","false","false","","","false","false","false","false"
"Staples","","6834 Wesley Street","Greenville","","TX","75402","9034509899","0","","https://www.staples.com/sbd/cre/marketing/sustainability-center/recycling-services/","33.1005293","-96.1110669","16.1658985213326","Alkaline/Single-Use Batteries; Batteries (Rechargeable); Cell Phone Batteries; Li-Ion Batteries; Ni-Cd Batteries; Ni-MH Batteries; Small Sealed Lead Acid Batteries; Alkaline/Single-Use Batteries; Button Batteries; Non-rechargeable lithium batteries; Cell Phones","false","true","","Call2Recycle","false","false","false","false"
"RadioShack","","2715 Traders Rd Suite G","Greenville","","TX","75403","9034542601","0","","","33.090961","-96.109425","16.1821591730175","","false","false","","","false","false","false","false"
"Call2Recycle at Lowe's","Call2Recycle at Lowe's","3122 Interstate Highway 30","Greenville","Hunt","TX","75402","9034533170","0","Monday: 6:00 AM - 10:00 PM Tuesday: 6:00 AM - 10:00 PM Wednesday: 6:00 AM - 10:00 PM Thursday: 6:00 AM - 10:00 PM Friday: 6:00 AM - 10:00 PM Saturday: 6:00 AM - 10:00 PM Sunday: 8:00 AM - 8:00 PM ","http://www.lowes.com/","33.09884","-96.11279","16.2819100959418","Cell Phones; Compact Fluorescent Lights; Ni-Cd Batteries; Plastic Shopping Bags; Li-Ion Batteries; Ni-MH Batteries; Ni-Zn Batteries; Small Sealed Lead Acid Batteries; Computer (Recycling); Computer Monitors; Electronics; Laptop Computers; Computer Peripherals; Small Televisions; Tablets; Televisions; Video Game Consoles; PlayStation Consoles; Batteries (Rechargeable); Cell Phone Batteries; Li-Ion Batteries; Ni-Cd Batteries; Ni-MH Batteries; Small Sealed Lead Acid Batteries; Cell Phones","false","true","As an environmentally-committed retailer, Lowes offers a recycling center near store entrances to give consumers a free and easy way to properly dispose of rechargeable batteries, cell phones, CFLs and plastic shopping bags; materials that otherwise could be potentially harmful to the environment.  Look for the recycling center or ask a store associate for more details.","Call2Recycle","false","false","false","false"
"United Cellular, Inc.","","3130 Interstate Hwy 30","Greenville","","TX","75402","9034557771","0","","","33.0953845","-96.1138194","16.3786862178523","","false","false","","","false","false","false","false"
"US Post Office","US Post Office","620 TX-19 ","Emory","Rains County","TX","75440","8002758777","0","","","32.8824899","-95.7612721","17.9145723540921","Catalogs; Greeting Cards; Magazines; Paper (Mixed)","false","true","","","false","false","false","false"
"New Phoenix Metals, Ltd","New Phoenix Metals, Ltd","6400 Industrial Dr","Greenville","Hunt","TX","75402","9034553000","0","Monday: 7:30 AM - 4:00 PM Tuesday: 7:30 AM - 4:00 PM Wednesday: 7:30 AM - 4:00 PM Thursday: 7:30 AM - 4:00 PM Friday: 7:30 AM - 4:00 PM Saturday: 7:30 AM - 12:00 PM ","null","33.1264","-96.14768","18.1202364491535","Aluminum Cans; Computer (Recycling); Computer Monitors; Electronics; Laptop Computers; Computer Peripherals; Small Televisions; Tablets; Televisions; Video Game Consoles; PlayStation Consoles","false","true","","","false","false","false","false"
"O'Reilly Auto Parts","O'Reilly Auto Parts","8830 State Highway 34 South","Quinlan","Hunt","TX","75474","9033563587","0","","http://www.oreillyauto.com/","32.89836","-96.08588","21.8575195318337","Used Motor Oil; Oil Filters; Computer (Recycling); Computer Monitors; Electronics; Laptop Computers; Computer Peripherals; Small Televisions; Tablets; Televisions; Video Game Consoles; PlayStation Consoles","false","true","Most stores offer Used Oil & Battery Recycling, Battery Testing, 
Electrical & Module Testing, Loaner Tool Program, Drum / Rotor Resurfacing. Call your location for more details.","","false","false","false","false"
"USPS Post Office Box Lobby Recycling Program","US Post Office","8570 State Highway 34 S","Quinlan","Hunt","TX","75474","8002758777","0","","https://www.usps.com/","32.89836","-96.08588","21.8575195318337","Catalogs; Greeting Cards; Magazines; Paper (Mixed)","false","true","","","false","false","false","false"
"US Post Office","USPS Discarded Lobby Mail Recycling Program","8570 State Highway 34 S","Quinlan","Hunt","TX","75474","0","0","","","32.89836","-96.08588","21.8575195318337","Computer (Recycling); Computer Monitors; Electronics; Laptop Computers; Computer Peripherals; Small Televisions; Tablets; Televisions; Video Game Consoles; PlayStation Consoles","false","true","","","false","false","false","false"
"Walmart Supercenter","","8801 State Highway 34 S","Quinlan","","TX","75474","9033561000","0","","https://www.walmart.com/","32.9085205","-96.1253643","22.9594722411895","","false","false","","","false","false","false","false"
"AutoZone","AutoZone","409 Hwy 34 S","Quinlan","Hunt","TX","75474","9033565200","0","","http://www.autozone.com","32.90578","-96.12791","23.196558822707","Lead Acid (Pb) Batteries; Used Motor Oil; Computer (Recycling); Computer Monitors; Electronics; Laptop Computers; Computer Peripherals; Small Televisions; Tablets; Televisions; Video Game Consoles; PlayStation Consoles","false","true","Most AutoZone stores accept used motor oil, transmission fluid, gear oil and automotive batteries. Call to see what your local store is currently accepting.","","false","false","false","false"
"Parks Recycling","","921 W Main St","Quinlan","","TX","75474","9033567873","0","","","32.9096558","-96.1518493","24.0566799829242","","false","false","","","false","false","false","false"
"Custom Recycling Solutions, LLC","Custom Recycling Solutions, LLC","6027 W Interstate 30 Bldg C","Royse City","Hunt","TX","75189","9723427639","0","Monday: 9:00 AM - 6:00 PM Tuesday: 9:00 AM - 6:00 PM Wednesday: 9:00 AM - 6:00 PM Thursday: 9:00 AM - 6:00 PM Friday: 9:00 AM - 6:00 PM Saturday: 8:00 AM - 11:59 PM ","http://www.customrecycling.net/","32.96212","-96.22846","25.7253799505385","Plastic #1 (PETE); Plastic #2 (HDPE); Plastic #3 (PVC); Plastic #4 (LDPE); Plastic #5 (Polypropylene); Plastic #6 (Polystyrene); Plastic #7; Aluminum Cans; Aluminum; Glass (Brown); Brown Paper Bags; Lead Acid (Pb) Batteries; Cardboard; Catalogs; Glass (Clear); Computer Paper; Ferrous Metals (Steel or Iron); Glass (Green); Magazines; Paper (Mixed); Newspapers; Non-ferrous (Copper/Brass/Tin); Office Paper; Unused Paper; Wire; Scrap Metal; Radiators; Motors; Computer (Recycling); Computer Monitors; Electronics; Laptop Computers; Computer Peripherals; Small Televisions; Tablets; Televisions; Video Game Consoles; PlayStation Consoles","false","true","If you do not see your item listed or not sure if we will accept it, give us a call. We will be more than happy to help!","","false","false","false","false"
"City of Farmersville Recycling Center","","S Johnson St","Farmersville","","TX","75442","9727827310","0","","http://www.farmersvilletx.com/","33.1601278","-96.3627253","30.5997983711475","","false","false","","","false","false","false","false"
"Green Planet Inc","Green Planet Inc","6297 State Highway 276 W","Royse City","Rockwall","TX","75189","9726361515","0","","","32.89885","-96.29109","31.0491676948969","Plastic #1 (PETE); Plastic #2 (HDPE); Aluminum Cans; Cardboard; Paper (Mixed); Computer (Recycling); Computer Monitors; Electronics; Laptop Computers; Computer Peripherals; Small Televisions; Tablets; Televisions; Video Game Consoles; PlayStation Consoles","true","true","","","false","false","false","false"
"Leon Wheeler Garage","Leon Wheeler Garage","928 Houston St","Wills Point","Van Zandt","TX","75169","9038732662","0","Sunday: 12:00 AM - 11:59 PM Monday: 12:00 AM - 11:59 PM Tuesday: 12:00 AM - 11:59 PM Wednesday: 12:00 AM - 11:59 PM Thursday: 12:00 AM - 11:59 PM Friday: 12:00 AM - 11:59 PM Saturday: 12:00 AM - 11:59 PM ","","32.70255","-95.9978","31.2996994788595","Used Motor Oil; Oil Filters; Computer (Recycling); Computer Monitors; Electronics; Laptop Computers; Computer Peripherals; Small Televisions; Tablets; Televisions; Video Game Consoles; PlayStation Consoles","false","true","","","false","false","false","false"
"Grand Saline Auto Parts","Grand Saline Auto Parts","136 E Garland St","Grand Saline","Van Zandt","TX","75140","9039627531","0","Sunday: 12:00 AM - 11:59 PM Monday: 12:00 AM - 11:59 PM Tuesday: 12:00 AM - 11:59 PM Wednesday: 12:00 AM - 11:59 PM Thursday: 12:00 AM - 11:59 PM Friday: 12:00 AM - 11:59 PM Saturday: 12:00 AM - 11:59 PM ","","32.67445","-95.70888","32.6030059336339","Used Motor Oil; Computer (Recycling); Computer Monitors; Electronics; Laptop Computers; Computer Peripherals; Small Televisions; Tablets; Televisions; Video Game Consoles; PlayStation Consoles","false","true","","","false","false","false","false"
"Mitchells Quick Lube & Auto Center","Mitchells Quick Lube & Auto Center","201 E Coke Rd","Winnsboro","Wood","TX","75494","9033425398","0","","","32.94917","-95.29134","33.9681974130674","Antifreeze; Used Motor Oil; Oil Filters; Computer (Recycling); Computer Monitors; Electronics; Laptop Computers; Computer Peripherals; Small Televisions; Tablets; Televisions; Video Game Consoles; PlayStation Consoles","false","true","","","false","false","false","false"
"Citizens Convenience Station","","County Road 319","Terrell","","TX","75160","9725516600","0","","https://www.cityofterrell.org","32.7605662","-96.2432445","35.0461814822105","","false","false","","","false","false","false","false"
"City of Terrell Convenience Station","","County Road 319","Terrell","","TX","75161","9725516600","0","","https://www.cityofterrell.org","32.7605662","-96.2432445","35.0461814822105","","false","false","","","false","false","false","false"
"Trenton Recycling by S.C.R.","","101 North Pearl Street","Trenton","","TX","75490","4692076451","0","","","33.4296067","-96.3383731","35.5322146561727","","false","false","","","false","false","false","false"
"Superior Comuter Recycling","","105 North Pearl Street","Trenton","","TX","75490","9032098981","0","","","33.4299337","-96.3385387","35.5529732218797","","false","false","","","false","false","false","false"
"Superior Comuter Recycling","","105 North Pearl Street","Trenton","","TX","75490","9032098981","0","","","33.4299337","-96.3385387","35.5529732218797","","false","false","","","false","false","false","false"
"City of Bonham Christmas Tree Recycling Event","","905 E Sam Rayburn Dr","Bonham","","TX","75418","9035837555","0","","http://www.cobon.net/","33.5769534","-96.1692844","36.1653809139619","","false","false","","","false","false","false","false"
"TCOG Household Hazardous Waste Collection Event - Fannin County","","","Bonham","","TX","75418","9038133550","0","","https://www.tcog.com","33.5773275","-96.1783111","36.4678707826267","","false","false","","","false","false","false","false"
"O'Reilly Auto Parts","null","425 W Sam Rayburn Drive ","Bonham","","TX","75418","9035838492","0","","http://oreillyauto.custhelp.com/app/error/error_id/6","33.5767252","-96.1835677","36.599012871855","","false","false","","","false","false","false","false"
"O'Reilly Auto Parts","","425 W Sam Rayburn Dr","Bonham","","TX","75418","9035838492","0","","http://oreillyauto.custhelp.com/app/error/error_id/6","33.5767252","-96.1835677","36.599012871855","","false","false","","","false","false","false","false"
"Walmart Tire & Lube Express","Walmart Tire & Lube Express","135 NE Loop 564","Mineola","Wood","TX","75773","9035690180","0","","http://www.walmart.com/catalog/catalog.gsp?cat=495843","32.69553","-95.47948","36.6554419468136","Lead Acid (Pb) Batteries; Used Motor Oil; Oil Filters; Computer (Recycling); Computer Monitors; Electronics; Laptop Computers; Computer Peripherals; Small Televisions; Tablets; Televisions; Video Game Consoles; PlayStation Consoles","false","true","","","false","false","false","false"
"Walmart","Walmart","135 NE Loop 564 ","Mineola","Wood County","TX","75773","9035690180","0","","http://www.walmart.com","32.6897701","-95.4818436","36.909481059324","Lead Acid (Pb) Batteries; Plastic Shopping Bags; Food Storage Bags; Computer (Recycling); Computer Monitors; Electronics; Laptop Computers; Computer Peripherals; Small Televisions; Tablets; Televisions; Video Game Consoles; PlayStation Consoles","false","true","","","false","false","false","false"
