name,description,address,city,region,province,postal_code,phone,fax,hours,url,latitude,longitude,distance,materials,pickup,dropoff,notes,groups,curbside,municipal,national,event_only
"AutoZone","AutoZone","1851 E Mayfield Rd","Arlington","Tarrant","TX","76014","8175571297","0","","http://www.autozone.com","32.6923","-97.0823","0.410221251548518","Lead Acid (Pb) Batteries; Used Motor Oil; Computer (Recycling); Computer Monitors; Electronics; Laptop Computers; Computer Peripherals; Small Televisions; Tablets; Televisions; Video Game Consoles; PlayStation Consoles","false","true","Most AutoZone stores accept used motor oil, transmission fluid, gear oil and automotive batteries. Call to see what your local store is currently accepting.","","false","false","false","false"
"Colonial Car Wash & Lube","Colonial Car Wash & Lube","3408 S Collins St","Arlington","Tarrant","TX","76014","8174679846","0","","","32.6908","-97.09816","0.599528674242985","Antifreeze; Transmission Fluid; Used Motor Oil; Oil Filters; Computer (Recycling); Computer Monitors; Electronics; Laptop Computers; Computer Peripherals; Small Televisions; Tablets; Televisions; Video Game Consoles; PlayStation Consoles","false","true","This site will accept up to five gallons of used motor oil.  Please do not mix automotive fluids together or with any other fluids.","","false","false","false","false"
"O'Reilly Auto Parts","null","2311 South Collins","Arlington","","TX","76014","8174602666","0","","http://oreillyauto.custhelp.com/app/error/error_id/6","32.7057957","-97.097123","0.915803619815419","","false","false","","","false","false","false","false"
"Workman Junior High School","","701 E Arbrook Blvd","Arlington","","TX","76014","8008741301","0","","http://paperretriever.com/","32.685292","-97.1017934","0.986585600341176","","false","false","","","false","false","false","false"
"Colonial Car Wash & Lube Center","Colonial Car Wash & Lube Center","1219 E Pioneer Pkwy","Arlington","Tarrant","TX","76010","8172770202","0","Monday: 8:00 AM - 7:00 PM Tuesday: 8:00 AM - 7:00 PM Wednesday: 8:00 AM - 7:00 PM Thursday: 8:00 AM - 7:00 PM Friday: 8:00 AM - 7:00 PM Saturday: 8:00 AM - 7:00 PM Sunday: 9:00 AM - 6:00 PM ","","32.70885","-97.09071","0.996054457890256","Used Motor Oil; Oil Filters; Computer (Recycling); Computer Monitors; Electronics; Laptop Computers; Computer Peripherals; Small Televisions; Tablets; Televisions; Video Game Consoles; PlayStation Consoles","false","true","","","false","false","false","false"
"US Post Office","US Post Office","1301 E Bardin Rd","Arlington","Tarrant","TX","76018","0","0","","https://www.usps.com/ship/recycle-through-usps.htm","32.67427","-97.08863","1.39905875353556","Inkjet Printer Cartridges; Computer (Recycling); Computer Monitors; Electronics; Laptop Computers; Computer Peripherals; Small Televisions; Tablets; Televisions; Video Game Consoles; PlayStation Consoles","false","true","Free, postage-paid Mail Back envelopes can be found on display in the lobby. There is no limit to the number of envelopes customers may take. The contents of the envelope must weigh less than 13 ounces and the envelope must be able to seal completely. For more details visit<a href="http://www.maxback.com/mxb-postoffice-collaboration" target="_blank">MaxBack</a>.","","false","false","false","false"
"USPS Post Office Box Lobby Recycling Program","US Post Office","1301 E Bardin Rd","Arlington","Tarrant","TX","76096","8002758777","0","","https://www.usps.com/","32.67319","-97.08589","1.48359862786206","Catalogs; Greeting Cards; Magazines; Paper (Mixed)","false","true","","","false","false","false","false"
"US Post Office","USPS Discarded Lobby Mail Recycling Program","1301 E Bardin Rd","Arlington","Tarrant","TX","76096","0","0","","","32.67319","-97.08589","1.48359862786206","Computer (Recycling); Computer Monitors; Electronics; Laptop Computers; Computer Peripherals; Small Televisions; Tablets; Televisions; Video Game Consoles; PlayStation Consoles","false","true","","","false","false","false","false"
"Sprint Store","null","3900 Arlington Highlands Blvd Ste 137,","Arlington","","TX","76018","8174683974","0","","https://newsroom.sprint.com/csr/device-donations/","32.6810652","-97.1097784","1.53160471812687","","false","false","","","false","false","false","false"
"Staples","","203 Merchants Row","Arlington","","TX","76018","8174664017","0","","https://www.staples.com/sbd/cre/marketing/sustainability-center/recycling-services/","32.6818323","-97.1108723","1.55209065306637","","false","false","","","false","false","false","false"
"Walgreens","Walgreens","3400 Matlock Rd","Arlington","Tarrant","TX","76015","8174190569","0","","http://www.walgreens.com","32.69044","-97.11551","1.57589492224678","Cell Phones; Inkjet Cartridge Refilling; Inkjet Printer Cartridges; Computer (Recycling); Computer Monitors; Electronics; Laptop Computers; Computer Peripherals; Small Televisions; Tablets; Televisions; Video Game Consoles; PlayStation Consoles","false","true","","","false","false","false","false"
"AT&T Wireless","AT&T Wireless","311 E Interstate 20","Arlington","Tarrant","TX","76018","8174660701","0","","http://www.att.com/","32.67866","-97.10946","1.624087920052","Cell Phones; Ni-Cd Batteries; Batteries (Rechargeable); Cell Phone Batteries; Tablets; Li-Ion Batteries; Computer (Recycling); Computer Monitors; Electronics; Laptop Computers; Computer Peripherals; Small Televisions; Televisions; Video Game Consoles; PlayStation Consoles","false","true","Receive an AT&T Promotion Card worth the trade-in value of your smartphone, tablet, or netbook. You can also donate the trade-in value to Cell Phones for Soldiers.","","false","false","false","false"
"Cartridge World","","3648 Matlock Road","Arlington","","TX","76002","8175570300","0","","","32.6851738","-97.1155872","1.68374060933432","","false","false","","","false","false","false","false"
"City of Arlington Recycling Drop-Off Site - East Branch Library","","1624 New York Ave","Arlington","","TX","76010","8174596777","0","","https://www.arlingtontx.gov","32.7189546","-97.0825365","1.72761937613205","","false","false","","","false","false","false","false"
"East Branch Library","East Branch Library Recycling Drop-Off","1624 New York Ave","Arlington","Tarrant","TX","76010","8174596777","0","","http://www.arlington-tx.gov/recycle/recycling-information-drop-off-locations/","32.71902","-97.08249","1.73260947784701","Aerosol Spray Cans; Aluminum Cans; Brown Paper Bags; Cardboard; Computer Paper; Glass (Brown); Glass (Clear); Glass (Green); Magazines; Newspapers; Office Paper; Paper (Mixed); Paper Egg Cartons; Paperboard; Plastic #1 (PETE); Plastic #2 (HDPE); Plastic #5 (Polypropylene); Plastic Shopping Bags; Shredded Paper; Tin or Steel Cans; Unused Paper","false","true","","","false","false","false","false"
"O'Reilly Auto Parts","null","625 West Pioneer Parkway","Arlington","","TX","76010","8175240150","0","","http://oreillyauto.custhelp.com/app/error/error_id/6","32.7088807","-97.1139413","1.76454423919898","","false","false","","","false","false","false","false"
"Call2Recycle at Fry's Electronics","Call2Recycle at Fry's Electronics","102 E Interstate 20","Arlington","Tarrant","TX","76018","8175576500","0","Monday: 8:00 AM - 9:00 PM Tuesday: 8:00 AM - 9:00 PM Wednesday: 8:00 AM - 9:00 PM Thursday: 8:00 AM - 9:00 PM Friday: 8:00 AM - 9:00 PM Saturday: 9:00 AM - 9:00 PM Sunday: 9:00 AM - 8:00 PM ","http://www.frys.com/","32.67751","-97.11192","1.78368685935027","Cell Phones; Ni-Cd Batteries; Li-Ion Batteries; Ni-MH Batteries; Ni-Zn Batteries; Small Sealed Lead Acid Batteries; Computer (Recycling); Computer Monitors; Electronics; Laptop Computers; Computer Peripherals; Small Televisions; Tablets; Televisions; Video Game Consoles; PlayStation Consoles","false","true","The U.S. EPA estimates that more than 350 million rechargeable batteries are purchased annually in the U.S. Thanks to the environmental commitment of this location, its easy and free to recycle your batteries. Bring your rechargeable batteries to this location and look for the recycling box or ask an associate how you can do your part for the environment.","","false","false","false","false"
"AutoZone","AutoZone","2101 S Cooper","Arlington","Tarrant","TX","76010","8172760399","0","","http://www.autozone.com","32.70969","-97.11408","1.80313147457708","Lead Acid (Pb) Batteries; Used Motor Oil; Computer (Recycling); Computer Monitors; Electronics; Laptop Computers; Computer Peripherals; Small Televisions; Tablets; Televisions; Video Game Consoles; PlayStation Consoles","false","true","Most AutoZone stores accept used motor oil, transmission fluid, gear oil and automotive batteries. Call to see what your local store is currently accepting.","","false","false","false","false"
"O'Reilly Auto Parts","null","1511 New York Avenue","Arlington","","TX","76010","8175251023","0","","http://oreillyauto.custhelp.com/app/error/error_id/6","32.720351","-97.0787959","1.87789774107018","","false","false","","","false","false","false","false"
"Habitat for Humanity Restore Arlington","Habitat for Humanity Restore Arlington","905 W Mayfield Rd","Arlington","Tarrant","TX","76015","6824330006","0","Tuesday: 9:00 AM - 6:00 PM Wednesday: 9:00 AM - 6:00 PM Thursday: 9:00 AM - 6:00 PM Friday: 9:00 AM - 6:00 PM Saturday: 9:00 AM - 6:00 PM ","http://www.trinityhabitat.org/","32.69151","-97.12131","1.89913321590285","Brick(s); Carpet; Ceiling Tiles; Ceramic Tiles; Construction Materials (Reuse); Drywall; Linoleum; Paint Donation; Porcelain; Roofing Materials; Stone; Windows; Computer (Recycling); Computer Monitors; Electronics; Laptop Computers; Computer Peripherals; Small Televisions; Tablets; Televisions; Video Game Consoles; PlayStation Consoles","false","true","The ReStore raises funds by selling merchandise and, after expenses, uses all profits to build more homes.  Habitat also provides families an opportunity to buy building materials that they may not otherwise be able to afford. This will help raise the standards of housing. By recycling goods that would have been sent to a landfill, the ReStore also helps reduce waste disposal costs. If you have materials to donate, please call for more information. The Habitat ReStore takes most materials and the staff will be glad to talk with you.","","false","false","false","false"
"Nike Reuse-A-Shoe Drop-Off","Nike Reuse-A-Shoe Drop-Off","2950 W Interstate 20 Ste 755","Grand Prairie","Tarrant","TX","75052","9725225970","0","","http://www.nikereuseashoe.com/","32.67727","-97.0614","1.99172088868411","Shoes; Computer (Recycling); Computer Monitors; Electronics; Laptop Computers; Computer Peripherals; Small Televisions; Tablets; Televisions; Video Game Consoles; PlayStation Consoles","false","true","Nike's Reuse-A-Shoe program collects old, worn-out athletic shoes for recycling, transforming them into Nike Grind, a material used in creating athletic and playground surfaces as well as select Nike products.","","false","false","false","false"
"Levi’s® ","Levi’s® Store","2950 W Interstate 20 Ste 1015","Grand Prairie","Tarrant","TX","75052","9726029788","9726029994","","http://www.levistrauss.com/","32.67727","-97.0614","1.99172088868411","Clothing; Denim; Shoes; Computer (Recycling); Computer Monitors; Electronics; Laptop Computers; Computer Peripherals; Small Televisions; Tablets; Televisions; Video Game Consoles; PlayStation Consoles","false","true","Customers may drop off no-longer-wanted clothing and shoes for recycling in the collection boxes at local Levi’s® stores and Levi’s® Outlet  stores and receive a voucher for 20% off a single regular-priced Levi’s®  item in-store.","","false","false","false","false"
"Pep Boys Auto","Pep Boys Auto","2710 S Cooper St","Arlington","Tarrant","TX","76015","8007372697","0","","http://www.pepboys.com","32.7005","-97.12287","2.02102230267312","Used Motor Oil; Computer (Recycling); Computer Monitors; Electronics; Laptop Computers; Computer Peripherals; Small Televisions; Tablets; Televisions; Video Game Consoles; PlayStation Consoles","false","true","","","false","false","false","false"
"Arlington Goodwill","Arlington Goodwill","1100 W Arkansas Ln","Arlington","Tarrant","TX","76013","8174592688","0","Monday: 9:00 AM - 9:00 PM Tuesday: 9:00 AM - 9:00 PM Wednesday: 9:00 AM - 9:00 PM Thursday: 9:00 AM - 9:00 PM Friday: 9:00 AM - 9:00 PM Saturday: 9:00 AM - 9:00 PM Sunday: 11:00 AM - 7:00 PM ","http://www.goodwillfortworth.org","32.70638","-97.1209","2.03593112710944","Electronics; MP3 Players; Computer (Recycling); Computer Monitors; Laptop Computers; Computer Peripherals; Small Televisions; Tablets; Televisions; Video Game Consoles; PlayStation Consoles","false","true","","","false","false","false","false"
"O'Reilly Auto Parts","null","4404 Matlock Road","Arlington","","TX","76018","8174655054","0","","http://oreillyauto.custhelp.com/app/error/error_id/6","32.6747601","-97.1156654","2.07271934199826","","false","false","","","false","false","false","false"
"Lowe's","","1000 West Arbrook Boulevard","Arlington","","TX","76015","8174199755","0","","https://newsroom.lowes.com/responsibility/operational-excellence/","32.6808028","-97.1221418","2.15567139921257","Batteries (Rechargeable); Cell Phone Batteries; Li-Ion Batteries; Ni-Cd Batteries; Ni-MH Batteries; Small Sealed Lead Acid Batteries; Cell Phones","false","true","","Call2Recycle","false","false","false","false"
"Colonial Car Wash & Lube Center","Colonial Car Wash & Lube Center","3022 S Cooper St","Arlington","Tarrant","TX","76015","8174670623","0","","","32.69537","-97.12645","2.18732627530936","Used Motor Oil; Oil Filters; Computer (Recycling); Computer Monitors; Electronics; Laptop Computers; Computer Peripherals; Small Televisions; Tablets; Televisions; Video Game Consoles; PlayStation Consoles","false","true","","","false","false","false","false"
"GreenSpot DropOff","GreenSpot DropOff at Store More Self Storage","4660 S State Highway 360","Grand Prairie","Tarrant","TX","75052","9726413200","0","Monday: 9:00 AM - 6:00 PM Tuesday: 9:00 AM - 6:00 PM Wednesday: 9:00 AM - 6:00 PM Thursday: 9:00 AM - 6:00 PM Friday: 9:00 AM - 6:00 PM Saturday: 8:00 AM - 3:00 PM ","http://www.greenspotdropoff.org","32.67051","-97.06274","2.24851736586291","Cables & Connectors; Computer (Recycling); Hard Drives; Computer Monitors; DVD Players/Blu-Ray Players/DVRs; Laptop Computers; Memory (RAM), Flash Card/Drive; Computer Peripherals; Printers/Scanners/Fax Machines; Small Televisions; Stereo Equipment; Telephones; Televisions; VCRs; Inkjet Printer Cartridges; Laser Toner Cartridges; Electronics; Tablets; Video Game Consoles; PlayStation Consoles","false","true","Greenspot Dropoff provides free and convenient e-waste recycling at a dropoff location near you. We collect anything you plug in and want to throw away (excluding appliances).","","false","false","false","false"
"Texas Oil Xchange","Texas Oil Xchange","1531 S Cooper St","Arlington","Tarrant","TX","76010","8172619450","0","","","32.71915","-97.11426","2.25370658060028","Used Motor Oil; Oil Filters; Computer (Recycling); Computer Monitors; Electronics; Laptop Computers; Computer Peripherals; Small Televisions; Tablets; Televisions; Video Game Consoles; PlayStation Consoles","false","true","","","false","false","false","false"
"Texas Oil X Change","","1531 South Cooper Street","Arlington","","TX","76010","8172619450","0","","","32.7191529","-97.1142988","2.25533725601044","","false","false","","","false","false","false","false"
"Nike Factory Store","","2950 Interstate 20","Grand Prairie","","TX","75052","9725225970","0","","https://www.nike.com/us/en_us/c/better-world/stories/2012/09/reuse-a-shoe","32.6786512","-97.0545496","2.2756587714864","","false","false","","","false","false","false","false"
"RadioShack","","3006 E Pioneer Parkway","Arlington","","TX","76010","8176493371","0","","","32.7118204","-97.0550265","2.3009425940621","","false","false","","","false","false","false","false"
"Texas Oil X Change","","4810 Matlock Road","Arlington","","TX","76017","8177848899","0","","","32.6694798","-97.1154762","2.32190688082249","","false","false","","","false","false","false","false"
"Walgreens","Walgreens","617 W Park Row Dr","Arlington","Tarrant","TX","76010","8172740214","0","","http://www.walgreens.com","32.7216","-97.11354","2.35838083978271","Cell Phones; Inkjet Cartridge Refilling; Inkjet Printer Cartridges; Computer (Recycling); Computer Monitors; Electronics; Laptop Computers; Computer Peripherals; Small Televisions; Tablets; Televisions; Video Game Consoles; PlayStation Consoles","false","true","","","false","false","false","false"
"Batteries Plus Bulbs","","3430 S. Cooper St","Arlington","","TX","76015","8174670613","0","","https://www.batteriesplus.com/store-locator/tx/151?utm_source=local&utm_medium=earth911","32.6900091","-97.129952","2.41044918480715","","false","false","","","false","false","false","false"
"Batteries Plus","Batteries Plus","3430 S Cooper St","Arlington","Tarrant","TX","76015","8174670613","8175572388","","http://www.batteriesplus.com/store_details/151.aspx","32.69095","-97.13075","2.44905743547913","Compact Fluorescent Lights; Batteries (Rechargeable); Alkaline/Single-Use Batteries; Computer (Recycling); Computer Monitors; Electronics; Laptop Computers; Computer Peripherals; Small Televisions; Tablets; Televisions; Video Game Consoles; PlayStation Consoles","false","true","Some fees for battery recycling may apply.  Please contact your Local store for details. 
<p>
Batteries Plus lead by example by recycling the majority of the batteries we sell. Not only do we recycle to protect our environment, we support retail and business customers alike by keeping them in full compliance with federal, state, municipal, EPA and DOT regulations governing the disposal and recycling of spent batteries and select electronics.","","false","false","false","false"
"Office Depot","Office Depot","3611 S Cooper St","Arlington","Tarrant","TX","76015","8174689066","0","Monday: 8:00 AM - 9:00 PM Tuesday: 8:00 AM - 9:00 PM Wednesday: 8:00 AM - 9:00 PM Thursday: 8:00 AM - 9:00 PM Friday: 8:00 AM - 9:00 PM Saturday: 9:00 AM - 9:00 PM Sunday: 10:00 AM - 7:00 PM ","http://www.officedepot.com/","32.6867","-97.13021","2.46519015413493","Cell Phones; Computer Monitors; Electronics; Inkjet Printer Cartridges; Ni-Cd Batteries; Office Equipment; Batteries (Rechargeable); Laser Toner Cartridges; MP3 Players; Small Televisions; Computer (Recycling); Laptop Computers; Computer Peripherals; Tablets; Televisions; Video Game Consoles; PlayStation Consoles","false","true","Office Depot offers electronics recycling for a small fee. Visit their Web site for more details and store locations. Recycle cell phones, PDAs, rechargeable batteries and ink and toner cartridges for FREE!","","false","false","false","false"
"Verizon Wireless","Verizon Wireless","1109 W Interstate 20 Ste 121","Arlington","Tarrant","TX","76017","8666444532","0","","http://www.verizonwireless.com/","32.67732","-97.12635","2.48364950767121","Cell Phones; Cell Phone Batteries; Computer (Recycling); Computer Monitors; Electronics; Laptop Computers; Computer Peripherals; Small Televisions; Tablets; Televisions; Video Game Consoles; PlayStation Consoles","false","true","<A Href="https://www.trade-in.vzw.com/home.aspx">
The Verizon Wireless Trade-In Program</A> allows you to trade in your used handset or tablet in a convenient and responsible way. 
<P>
<P>
Verizon Wireless works every day to protect our environment and give our customers opportunities to do the same. <A Href="http://aboutus.vzw.com/Green_Initiative/overview.html">Click here</A> for more examples of the earth-friendly initiatives and programs Verizon Wireless is proud to offer and support.","","false","false","false","false"
"Woodland West Branch Library","Woodland West Branch Recycling Drop-Off","2837 E Park Row Dr ","Arlington","Tarrant County","TX","76010","8174596777","0","","http://www.arlington-tx.gov/recycle/recycling-information-drop-off-locations/","32.7207669","-97.0588589","2.51542316016877","Aerosol Spray Cans; Aluminum Cans; Brown Paper Bags; Cardboard; Catalogs; Computer Paper; Dairy Tubs; Glass (Brown); Glass (Clear); Glass (Green); Magazines; Newspapers; Office Paper; Paper (Mixed); Paperboard; Phone books; Plastic #1 (PETE); Plastic #2 (HDPE); Plastic #5 (Polypropylene); Plastic Shopping Bags; Shredded Paper; Tin or Steel Cans","false","true","","","false","false","false","false"
"The Parks at Arlington","","3811 S Cooper St","Arlington","","TX","76015","8589993200","0","","http://www.ecoatm.com/","32.680856","-97.1298581","2.56491363592911","","false","false","","","false","false","false","false"
"Best Buy Mobile","null","1515 W State Hwy 114","Grapevine","","TX","76015","8174429912","0","","https://www.bestbuy.com/site/services/recycling/pcmcat149900050025.c?id=pcmcat149900050025","32.680856","-97.1298581","2.56491363592911","","false","false","","","false","false","false","false"
"American Wireless Business Solutions","","3811 S Cooper St","Arlington","","TX","76015","6827102124","0","","","32.680856","-97.1298581","2.56491363592911","","false","false","","","false","false","false","false"
"The Parks at Arlington 1","The Parks at Arlington 1","3811 S Cooper St","Arlington","Tarrant","TX","76015","8583244111","0","","http://www.ecoatm.com/","32.67983","-97.13","2.59944747915727","Cell Phones; Tablets; MP3 Players; Computer (Recycling); Computer Monitors; Electronics; Laptop Computers; Computer Peripherals; Small Televisions; Televisions; Video Game Consoles; PlayStation Consoles","false","true","ecoATM is an automated, consumer self-serve kiosk that quickly buys back and recycles old phones, mp3 players and tablets.
</br>
Call or email <a href="mailto:max@ecoATM.com">customer support</a> with questions.","","false","false","false","false"
"The Parks at Arlington 2","The Parks at Arlington 2","3811 S Cooper St","Arlington","Tarrant","TX","76015","8583244111","0","","http://www.ecoatm.com/","32.67983","-97.13","2.59944747915727","Cell Phones; Tablets; MP3 Players; Computer (Recycling); Computer Monitors; Electronics; Laptop Computers; Computer Peripherals; Small Televisions; Televisions; Video Game Consoles; PlayStation Consoles","false","true","ecoATM is an automated, consumer self-serve kiosk that quickly buys back and recycles old phones, mp3 players and tablets.
</br>
Call or email <a href="mailto:max@ecoATM.com">customer support</a> with questions.","","false","false","false","false"
"JCPenney","","3851 S Cooper St","Arlington","","TX","76015","8175579292","0","","https://www.jcpenney.com/","32.6835519","-97.1321107","2.6274618725071","","false","false","","","false","false","false","false"
"RadioShack","","2425 Se Green Oaks Blvd","Arlington","","TX","76018","8174684706","0","","","32.6614883","-97.065348","2.65988173347118","","false","false","","","false","false","false","false"
"O'Reilly Auto Parts","null","5521 New York Avenue","Arlington","","TX","76018","8175240041","0","","http://oreillyauto.custhelp.com/app/error/error_id/6","32.6569092","-97.0764625","2.69638286929218","","false","false","","","false","false","false","false"
"Call2Recycle at the Home Depot","Call2Recycle at the Home Depot","3850 S Carrier Pkwy","Grand Prairie","Tarrant","TX","75052","9722370025","0","","http://www.homedepot.com/","32.66345","-97.05962","2.73787313448626","Cell Phones; Compact Fluorescent Lights; Ni-Cd Batteries; Li-Ion Batteries; Ni-MH Batteries; Ni-Zn Batteries; Small Sealed Lead Acid Batteries; Computer (Recycling); Computer Monitors; Electronics; Laptop Computers; Computer Peripherals; Small Televisions; Tablets; Televisions; Video Game Consoles; PlayStation Consoles","false","true","The Home Depot accepts used rechargeable batteries and compact fluorescent bulbs. Look for the orange drop boxes, usually located near the front entrance near the customer service desk, or ask a store associate for more details.","","false","false","false","false"
"Target","Target","5270 S State Highway 360","Grand Prairie","Tarrant","TX","75052","4693482100","0","","http://www.target.com/","32.66345","-97.05962","2.73787313448626","Aluminum Cans; Cell Phones; Inkjet Printer Cartridges; MP3 Players; Plastic #1 (PETE); Plastic #2 (HDPE); Plastic Shopping Bags; Computer (Recycling); Computer Monitors; Electronics; Laptop Computers; Computer Peripherals; Small Televisions; Tablets; Televisions; Video Game Consoles; PlayStation Consoles","false","true","","","false","false","false","false"
"DFW Aluminum Can Bank","DFW Aluminum Can Bank","111 SE Green Oaks Blvd","Arlington","Tarrant","TX","76018","2144210247","0","Sunday: 12:00 AM - 11:59 PM Monday: 12:00 AM - 11:59 PM Tuesday: 12:00 AM - 11:59 PM Wednesday: 12:00 AM - 11:59 PM Thursday: 12:00 AM - 11:59 PM Friday: 12:00 AM - 11:59 PM Saturday: 12:00 AM - 11:59 PM ","http://www.goldmetal.com","32.6596","-97.11208","2.76521134131437","Aluminum Cans; Computer (Recycling); Computer Monitors; Electronics; Laptop Computers; Computer Peripherals; Small Televisions; Tablets; Televisions; Video Game Consoles; PlayStation Consoles","false","true","","","false","false","false","false"
"DFW Aluminum Can Bank","DFW Aluminum Can Bank","2625 W Pioneer Pkwy","Grand Prairie","Tarrant","TX","75051","2144210247","0","Sunday: 12:00 AM - 11:59 PM Monday: 12:00 AM - 11:59 PM Tuesday: 12:00 AM - 11:59 PM Wednesday: 12:00 AM - 11:59 PM Thursday: 12:00 AM - 11:59 PM Friday: 12:00 AM - 11:59 PM Saturday: 12:00 AM - 11:59 PM ","http://www.goldmetal.com","32.71181","-97.04593","2.76619447651777","Aluminum Cans; Computer (Recycling); Computer Monitors; Electronics; Laptop Computers; Computer Peripherals; Small Televisions; Tablets; Televisions; Video Game Consoles; PlayStation Consoles","false","true","","","false","false","false","false"
