name,description,address,city,region,province,postal_code,phone,fax,hours,url,latitude,longitude,distance,materials,pickup,dropoff,notes,groups,curbside,municipal,national,event_only
"Southeast Branch Library","Southeast Branch Library Recycling Drop-Off","900 SE Green Oaks Blvd","Arlington","Tarrant","TX","76018","8174596777","0","","http://www.arlington-tx.gov/recycle/recycling-information-drop-off-locations/","32.65574","-97.10208","2.78762548863371","Aerosol Spray Cans; Aluminum Cans; Brown Paper Bags; Cardboard; Computer Paper; Dairy Tubs; Drink Boxes; Glass (Brown); Glass (Clear); Glass (Green); Magazines; Milk Cartons; Newspapers; Office Paper; Paper (Mixed); Paperboard; Phone books; Plastic #1 (PETE); Plastic #2 (HDPE); Plastic #5 (Polypropylene); Plastic Shopping Bags; Shredded Paper; Tin or Steel Cans; Unused Paper","false","true","","","false","false","false","false"
"Target","Target","1600 W Arbrook Blvd","Arlington","Tarrant","TX","76015","8175572177","0","","http://www.target.com/","32.68394","-97.13571","2.82143266880644","Aluminum Cans; Cell Phones; Inkjet Printer Cartridges; MP3 Players; Plastic #1 (PETE); Plastic #2 (HDPE); Plastic Shopping Bags; Computer (Recycling); Computer Monitors; Electronics; Laptop Computers; Computer Peripherals; Small Televisions; Tablets; Televisions; Video Game Consoles; PlayStation Consoles","false","true","","","false","false","false","false"
"Walgreens","Walgreens","5600 New York Ave","Arlington","Tarrant","TX","76018","8174655048","0","","http://www.walgreens.com","32.65463","-97.07772","2.83084411771296","Cell Phones; Inkjet Printer Cartridges; Computer (Recycling); Computer Monitors; Electronics; Laptop Computers; Computer Peripherals; Small Televisions; Tablets; Televisions; Video Game Consoles; PlayStation Consoles","false","true","","","false","false","false","false"
"Sprint Store","","4211 S Cooper St","Arlington","","TX","76015","8174191000","0","","https://newsroom.sprint.com/csr/device-donations/","32.6776013","-97.1336948","2.8579758307065","","false","false","","","false","false","false","false"
"PGM of Texas LLC","PGM of Texas LLC","2100 S Great Southwest Pkwy Ste 108","Grand Prairie","Tarrant","TX","75051","8179172846","9723526382","","http://www.pgmoftexas.com","32.71278","-97.04467","2.86133993523862","Catalytic Converters; Computer (Recycling); Computer Monitors; Electronics; Laptop Computers; Computer Peripherals; Small Televisions; Tablets; Televisions; Video Game Consoles; PlayStation Consoles","false","true","","","false","false","false","false"
"The Salvation Army","null","1301 E Abram St ","Arlington","Tarrant County","TX","76010","8007287825","0","Monday: 10:00 AM - 6:00 PM Tuesday: 10:00 AM - 6:00 PM Wednesday: 10:00 AM - 6:00 PM Thursday: 10:00 AM - 6:00 PM Friday: 10:00 AM - 6:00 PM Saturday: 10:00 AM - 6:00 PM Sunday:  -  ","http://www.salvationarmyusa.org","32.7359484","-97.0924567","2.87005081954144","Bikes; Books (Reuse); CD/DVD/Blu-ray/UHD discs; Cell Phones; Children's Toys; Clothing; Computer (Reuse); Hard Drives; Computer Monitors; Cameras; DVD Players/Blu-Ray Players/DVRs; Electronics; E-Readers; Furniture; Gift Bags; Headphones; Household Goods; Laptop Computers; Lawn Equipment; Miscellaneous Tools; MP3 Players; Musical Instruments; Network Equipment; Ornaments; Computer Peripherals; Portable Media Players; Printers/Scanners/Fax Machines; Reusable Appliance Donation; Small Appliances; Small Electronics; Small Televisions; Sporting Goods; Stereo Equipment; Tablets; Telephones; Televisions; VCRs; VHS & Cassette Tapes; Video Game Systems; Blu-Ray Players; Digital Converter Boxes; Computer (Recycling); Video Game Consoles; PlayStation Consoles","false","true","No CRT Televisions","Sony, Vizio, OEM, Salvation Army","false","false","false","false"
"USPS Post Office Box Lobby Recycling Program","US Post Office","300 E South St","Arlington","Tarrant","TX","76004","8002758777","0","","https://www.usps.com/","32.73423","-97.10413","2.88393904872478","Catalogs; Greeting Cards; Magazines; Paper (Mixed)","false","true","","","false","false","false","false"
"US Post Office","US Post Office","300 E South St","Arlington","Tarrant","TX","76004","0","0","","https://www.usps.com/ship/recycle-through-usps.htm","32.73423","-97.10413","2.88393904872478","Inkjet Printer Cartridges; Computer (Recycling); Computer Monitors; Electronics; Laptop Computers; Computer Peripherals; Small Televisions; Tablets; Televisions; Video Game Consoles; PlayStation Consoles","false","true","Free, postage-paid Mail Back envelopes can be found on display in the lobby. There is no limit to the number of envelopes customers may take. The contents of the envelope must weigh less than 13 ounces and the envelope must be able to seal completely. For more details visit<a href="http://www.maxback.com/mxb-postoffice-collaboration" target="_blank">MaxBack</a>.","","false","false","false","false"
"Target Store","","1600 W Arbrook Blvd","Arlington","","TX","76015","8175572177","0","","https://corporate.target.com/corporate-responsibility/planet","32.6836586","-97.136779","2.88651185704907","","false","false","","","false","false","false","false"
"Battery Center, Inc.","Battery Center, Inc.","131 Stadium Dr","Arlington","Tarrant","TX","76010","8172751411","0","Monday: 8:00 AM - 5:00 PM Tuesday: 8:00 AM - 5:00 PM Wednesday: 8:00 AM - 5:00 PM Thursday: 8:00 AM - 5:00 PM Friday: 8:00 AM - 5:00 PM Saturday: 9:00 AM - 11:59 PM ","http://www.batterycenterinc.com/","32.73614","-97.08331","2.89353266770357","Cell Phones; Ni-Cd Batteries; Li-Ion Batteries; Ni-MH Batteries; Ni-Zn Batteries; Small Sealed Lead Acid Batteries; Computer (Recycling); Computer Monitors; Electronics; Laptop Computers; Computer Peripherals; Small Televisions; Tablets; Televisions; Video Game Consoles; PlayStation Consoles","false","true","The U.S. EPA estimates that more than 350 million rechargeable batteries are purchased annually in the U.S. Thanks to the environmental commitment of this location, its easy and free to recycle your batteries. Bring your rechargeable batteries to this location and look for the recycling box or ask an associate how you can do your part for the environment.","","false","false","false","false"
"O'Reilly Auto Parts","null","1001 East Abram Street","Arlington","","TX","76010","8178615966","0","","http://oreillyauto.custhelp.com/app/error/error_id/6","32.7360533","-97.09603","2.89984888515522","","false","false","","","false","false","false","false"
"O'Reilly Auto Parts","","1001 E Abram St","Arlington","","TX","76010","8178615966","0","","http://oreillyauto.custhelp.com/app/error/error_id/6","32.7360533","-97.09603","2.89984888515522","","false","false","","","false","false","false","false"
"City of Arlington Recycling Drop-Off Site - Southeast Branch Library","","900 SE Green Oaks Blvd","Arlington","","TX","76018","8174596777","0","","https://www.arlingtontx.gov","32.6525033","-97.0961561","2.93384770301214","","false","false","","","false","false","false","false"
"USPS Post Office Box Lobby Recycling Program","US Post Office","3903 Melear Dr","Arlington","Tarrant","TX","76015","8002758777","0","","https://www.usps.com/","32.68368","-97.13763","2.9339440506637","Catalogs; Greeting Cards; Magazines; Paper (Mixed)","false","true","","","false","false","false","false"
"US Post Office","USPS Discarded Lobby Mail Recycling Program","3903 Melear Dr","Arlington","Tarrant","TX","76015","0","0","","","32.68368","-97.13763","2.9339440506637","Computer (Recycling); Computer Monitors; Electronics; Laptop Computers; Computer Peripherals; Small Televisions; Tablets; Televisions; Video Game Consoles; PlayStation Consoles","false","true","","","false","false","false","false"
"Home Depot","","4611 S Cooper St","Arlington","","TX","76017","8174684224","0","","https://ecooptions.homedepot.com/","32.6723963","-97.1321735","2.94699557261413","Batteries (Rechargeable); Cell Phone Batteries; Li-Ion Batteries; Ni-Cd Batteries; Ni-MH Batteries; Small Sealed Lead Acid Batteries","false","true","","Call2Recycle","false","false","false","false"
"OfficeMax","","4619 S Cooper St","Arlington","","TX","76017","8174725194","0","","","32.6710519","-97.1314789","2.96235216346588","","false","false","","","false","false","false","false"
"Firestone Complete Auto Care Store","Firestone Complete Auto Care Store","2510 W Interstate 20","Grand Prairie","Tarrant","TX","75052","9727309181","0","Monday: 7:00 AM - 7:00 PM Tuesday: 7:00 AM - 7:00 PM Wednesday: 7:00 AM - 7:00 PM Thursday: 7:00 AM - 7:00 PM Friday: 7:00 AM - 7:00 PM Saturday: 7:00 AM - 7:00 PM Sunday: 9:00 AM - 5:00 PM ","http://www.firestonecompleteautocare.com/","32.6762","-97.04244","2.98045223890856","Lead Acid (Pb) Batteries; Used Motor Oil; Computer (Recycling); Computer Monitors; Electronics; Laptop Computers; Computer Peripherals; Small Televisions; Tablets; Televisions; Video Game Consoles; PlayStation Consoles","false","true","","","false","false","false","false"
"Firestone Complete Auto Care","","1918 W Pioneer Pkwy","Arlington","","TX","76013","8172777658","0","","https://www.firestonecompleteautocare.com/","32.708688","-97.13741","2.98846024909565","","false","false","","","false","false","false","false"
"Firestone Complete Auto Care Store","Firestone Complete Auto Care Store","1918 W Pioneer Pkwy","Arlington","Tarrant","TX","76013","8176177025","0","Monday: 7:00 AM - 7:00 PM Tuesday: 7:00 AM - 7:00 PM Wednesday: 7:00 AM - 7:00 PM Thursday: 7:00 AM - 7:00 PM Friday: 7:00 AM - 7:00 PM Saturday: 7:00 AM - 7:00 PM Sunday: 9:00 AM - 5:00 PM ","http://www.firestonecompleteautocare.com/","32.70855","-97.13748","2.9892021795795","Lead Acid (Pb) Batteries; Used Motor Oil; Computer (Recycling); Computer Monitors; Electronics; Laptop Computers; Computer Peripherals; Small Televisions; Tablets; Televisions; Video Game Consoles; PlayStation Consoles","false","true","","","false","false","false","false"
"Arlington Recycling Drop-Off","Arlington Recycling Drop-Off","101 S Mesquite St","Arlington","Tarrant","TX","76010","8174596777","0","","http://www.arlington-tx.gov/recycle/recycling-information-drop-off-locations/","32.73621","-97.10433","3.01782124275553","Aerosol Spray Cans; Aluminum Cans; Brown Paper Bags; Cardboard; Catalogs; Computer Paper; Dairy Tubs; Drink Boxes; Glass (Brown); Glass (Clear); Glass (Green); Magazines; Milk Cartons; Newspapers; Office Paper; Paper (Mixed); Paper Egg Cartons; Paperboard; Phone books; Plastic #1 (PETE); Plastic #2 (HDPE); Plastic #5 (Polypropylene); Plastic Shopping Bags; Shredded Paper; Tin or Steel Cans; Unused Paper","false","true","","","false","false","false","false"
"City of Arlington Recycling Drop-Off Site - Central Library","","101 E Abram St","Arlington","","TX","76010","8174596777","0","","https://www.arlingtontx.gov","32.7360309","-97.1064092","3.04439266384155","","false","false","","","false","false","false","false"
"Sprint","Sprint","2501 W Interstate 20 Ste 120","Grand Prairie","Tarrant","TX","75052","9726607313","0","Monday: 10:00 AM - 7:00 PM Tuesday: 10:00 AM - 7:00 PM Wednesday: 10:00 AM - 7:00 PM Thursday: 10:00 AM - 7:00 PM Friday: 10:00 AM - 7:00 PM Saturday: 10:00 AM - 7:00 PM Sunday: 12:00 PM - 5:00 PM ","http://www.sprint.com/","32.67592","-97.04127","3.05028822460659","Cell Phones; Computer (Recycling); Computer Monitors; Electronics; Laptop Computers; Computer Peripherals; Small Televisions; Tablets; Televisions; Video Game Consoles; PlayStation Consoles","false","true","","","false","false","false","false"
"Best Buy","Best Buy","1730 Pleasant Pl ","Arlington","Tarrant County","TX","76015","8174673155","0","","https://www.bestbuy.com/recycle","32.6773053","-97.1374571","3.06680290420688","Large Household Appliances; Refrigerators; Televisions; AC Power Plugs; Batteries (Rechargeable); Cables & Connectors; Car Audio/Video Equipment; Cell Phone Batteries; Cell Phones; Computer (Recycling); Hard Drives; Computer Monitors; Cameras; DVD Players/Blu-Ray Players/DVRs; Electronics; E-Readers; GPS Units; Headphones; Inkjet Printer Cartridges; Laptop Computers; Laser Toner Cartridges; Li-Ion Batteries; MP3 Players; Network Equipment; Ni-Cd Batteries; Ni-MH Batteries; Ni-Zn Batteries; Computer Peripherals; Portable Media Players; Printers/Scanners/Fax Machines; Small Electronics; Small Sealed Lead Acid Batteries; Stereo Equipment; Tablets; Telephones; UPS Batteries/Backup Systems; VCRs; Video Game Systems; Blu-Ray Players; Digital Converter Boxes; Small Televisions; Video Game Consoles; PlayStation Consoles","true","true","2 TVs per visit, 3 e-waste items per day; $25 fee for TVs and Monitors; $19.99 pick-up fee with delivery; $99.99 standalone pickup fee; TVs and monitors collected at Best Buy stores are not manufacturer supported in this state, listing provided as an additional option for consumers.","Sony, Vizio, OEM","false","false","false","false"
"Best Buy","","1730 Pleasant Pl","Arlington","","TX","76015","8174673155","0","","https://www.bestbuy.com/site/services/recycling/pcmcat149900050025.c?id=pcmcat149900050025","32.6773053","-97.1374571","3.06680290420688","","false","false","","","false","false","false","false"
"Firestone Complete Auto Care","","2513 Sara Jane Pkwy","Grand Prairie","","TX","75052","9726062650","0","","https://www.firestonecompleteautocare.com/","32.6777297","-97.0399928","3.06835865413071","","false","false","","","false","false","false","false"
"Walmart Supercenter","","4801 S Cooper St","Arlington","","TX","76017","8174651000","0","","https://www.walmart.com/","32.6687293","-97.1318344","3.06997155991188","","false","false","","","false","false","false","false"
"Walmart Tire and Lube Express","","4801 S Cooper St","Arlington","","TX","76017","8174651000","0","","https://www.walmart.com/cp/ideas/8932632","32.6687293","-97.1318344","3.06997155991188","","false","false","","","false","false","false","false"
"Home Depot","Home Depot","4611 S Cooper St","Arlington","Tarrant","TX","76017","8174684224","0","","http://www.homedepot.com","32.67177","-97.13429","3.07479161076127","Compact Fluorescent Lights; Batteries (Rechargeable); Computer (Recycling); Computer Monitors; Electronics; Laptop Computers; Computer Peripherals; Small Televisions; Tablets; Televisions; Video Game Consoles; PlayStation Consoles","false","true","Home Depot accepts compact fluorescent bulbs and used power tool rechargeable batteries. Look for the orange drop boxes, usually located near the front entrance near the customer service desk.","","false","false","false","false"
"Call2Recycle at the Home Depot","Call2Recycle at the Home Depot","4611 S Cooper St","Arlington","Tarrant","TX","76017","8174684224","0","","http://www.homedepot.com/","32.67177","-97.13429","3.07479161076127","Cell Phones; Compact Fluorescent Lights; Ni-Cd Batteries; Li-Ion Batteries; Ni-MH Batteries; Ni-Zn Batteries; Small Sealed Lead Acid Batteries; Computer (Recycling); Computer Monitors; Electronics; Laptop Computers; Computer Peripherals; Small Televisions; Tablets; Televisions; Video Game Consoles; PlayStation Consoles","false","true","The Home Depot accepts used rechargeable batteries and compact fluorescent bulbs. Look for the orange drop boxes, usually located near the front entrance near the customer service desk, or ask a store associate for more details.","","false","false","false","false"
"Arlington Curbside Collection","Arlington Curbside Collection","101 W Abram St","Arlington","Tarrant","TX","76010","8174596777","0","","http://www.arlington-tx.gov/recycle/","32.73634","-97.10784","3.0932255081497","Aerosol Spray Cans; Aluminum Cans; Brown Paper Bags; Cardboard; Computer Paper; Dairy Tubs; Drink Boxes; Glass (Brown); Glass (Clear); Glass (Green); Milk Cartons; Newspapers; Office Paper; Paper (Mixed); Paperboard; Phone books; Plastic #1 (PETE); Plastic #2 (HDPE); Plastic #5 (Polypropylene); Plastic Shopping Bags; Shredded Paper; Tin or Steel Cans; Unused Paper","false","false","New residents should call 817-459-6778 to request a cart or send an email including your address to recycling@arlingtontx.gov. To ensure pick-up, recyclables should be placed at the curb no later than 7 a.m. on your collection day.","","true","false","false","false"
"HobbyTown USA","HobbyTown USA","4634 S Cooper St Ste 182","Arlington","Tarrant","TX","76017","8175572225","0","","http://www.hobbytown.com/","32.6711","-97.13445","3.10665637321021","Cell Phones; Ni-Cd Batteries; Li-Ion Batteries; Ni-MH Batteries; Ni-Zn Batteries; Small Sealed Lead Acid Batteries; Computer (Recycling); Computer Monitors; Electronics; Laptop Computers; Computer Peripherals; Small Televisions; Tablets; Televisions; Video Game Consoles; PlayStation Consoles","false","true","The U.S. EPA estimates that more than 350 million rechargeable batteries are purchased annually in the U.S. Thanks to the environmental commitment of this location, its easy and free to recycle your batteries. Bring your rechargeable batteries to this location and look for the recycling box or ask an associate how you can do your part for the environment.","","false","false","false","false"
"Sprint Store","null","2501 W Interstate 20 Ste 120","Grand Prairie","","TX","75052","9726607313","0","","https://newsroom.sprint.com/csr/device-donations/","32.673528","-97.0414826","3.11259608087323","","false","false","","","false","false","false","false"
"AutoZone","AutoZone","811 E Division","Arlington","Tarrant","TX","76011","8174599444","0","","http://www.autozone.com","32.73887","-97.09882","3.11859997064708","Lead Acid (Pb) Batteries; Used Motor Oil; Computer (Recycling); Computer Monitors; Electronics; Laptop Computers; Computer Peripherals; Small Televisions; Tablets; Televisions; Video Game Consoles; PlayStation Consoles","false","true","Most AutoZone stores accept used motor oil, transmission fluid, gear oil and automotive batteries. Call to see what your local store is currently accepting.","","false","false","false","false"
"Walmart Tire & Lube Express","Walmart Tire & Lube Express","4801 S Cooper St","Arlington","Tarrant","TX","76017","8174651000","0","","http://www.walmart.com/catalog/catalog.gsp?cat=495843","32.66895","-97.13414","3.17158434429408","Lead Acid (Pb) Batteries; Used Motor Oil; Oil Filters; Computer (Recycling); Computer Monitors; Electronics; Laptop Computers; Computer Peripherals; Small Televisions; Tablets; Televisions; Video Game Consoles; PlayStation Consoles","false","true","","","false","false","false","false"
"Asurion Tech Repair & Solutions","Asurion Tech Repair & Solutions","4654 S Cooper St","Arlington","Tarrant ","TX","76017","8178731114","0","","","32.6689203012743","-97.134301551584","3.18053185260752","Batteries (Rechargeable); Cell Phone Batteries; Cell Phones; Li-Ion Batteries; Ni-Cd Batteries; Ni-MH Batteries; Small Sealed Lead Acid Batteries","false","true","Call or Check Online for Hours","Call2Recycle","false","false","false","false"
"Sams Club","","2325 Interstate 20","Grand Prairie","","TX","75051","9726603405","0","","https://www.samsclub.com/","32.6733535","-97.0399518","3.19712797335399","","false","false","","","false","false","false","false"
"Walmart","Walmart","2225 W Interstate 20","Grand Prairie","Tarrant","TX","75052","9726604200","0","","http://www.walmart.com","32.66995","-97.04088","3.26510979228742","Lead Acid (Pb) Batteries; Plastic Shopping Bags; Food Storage Bags; Computer (Recycling); Computer Monitors; Electronics; Laptop Computers; Computer Peripherals; Small Televisions; Tablets; Televisions; Video Game Consoles; PlayStation Consoles","false","true","","","false","false","false","false"
"Walmart Tire & Lube Express","Walmart Tire & Lube Express","2225 W Interstate 20","Grand Prairie","Tarrant","TX","75052","9726604200","0","","http://www.walmart.com/catalog/catalog.gsp?cat=495843","32.66995","-97.04088","3.26510979228742","Lead Acid (Pb) Batteries; Used Motor Oil; Oil Filters; Computer (Recycling); Computer Monitors; Electronics; Laptop Computers; Computer Peripherals; Small Televisions; Tablets; Televisions; Video Game Consoles; PlayStation Consoles","false","true","","","false","false","false","false"
"Walmart 08961","Walmart 08961","2225 W Interstate 20","Grand Prairie","Tarrant","TX","75052","8583244111","0","","http://www.ecoatm.com/","32.66995","-97.04088","3.26510979228742","Cell Phones; Tablets; MP3 Players; Computer (Recycling); Computer Monitors; Electronics; Laptop Computers; Computer Peripherals; Small Televisions; Televisions; Video Game Consoles; PlayStation Consoles","false","true","ecoATM is an automated, consumer self-serve kiosk that quickly buys back and recycles old phones, mp3 players and tablets.
</br>
Call or email <a href="mailto:max@ecoATM.com">customer support</a> with questions.","","false","false","false","false"
"City of Arlington Christmas Tree Recycling Event - Calloways Nursery","","4940 S Cooper St","Arlington","","TX","76017","8174652838","0","","","32.6654158","-97.134844","3.346477265118","","false","false","","","false","false","false","false"
"O'Reilly Auto Parts","O'Reilly Auto Parts","2231 W Pioneer Pkwy","Pantego","Tarrant","TX","76013","4178622674","0","Monday: 7:30 AM - 9:00 PM Tuesday: 7:30 AM - 9:00 PM Wednesday: 7:30 AM - 9:00 PM Thursday: 7:30 AM - 9:00 PM Friday: 7:30 AM - 9:00 PM Saturday: 7:30 AM - 9:00 PM Sunday: 8:00 AM - 9:00 PM ","http://www.oreillyauto.com/","32.71016","-97.14364","3.36404653516991","Used Motor Oil; Oil Filters; Computer (Recycling); Computer Monitors; Electronics; Laptop Computers; Computer Peripherals; Small Televisions; Tablets; Televisions; Video Game Consoles; PlayStation Consoles","false","true","Most stores offer Used Oil & Battery Recycling, Battery Testing, 
Electrical & Module Testing, Loaner Tool Program, Drum / Rotor Resurfacing. Call your location for more details.","","false","false","false","false"
"O'Reilly Auto Parts","null","2231 West Pioneer Pkwy","Pantego","","TX","76013","8174614456","0","","http://oreillyauto.custhelp.com/app/error/error_id/6","32.7102135","-97.1437622","3.37196120607966","","false","false","","","false","false","false","false"
"AT&T Wireless","AT&T Wireless","2305 W Interstate 20","Grand Prairie","Tarrant","TX","75052","9726068885","0","","http://www.att.com/","32.66696","-97.04058","3.39158171885252","Cell Phones; Ni-Cd Batteries; Batteries (Rechargeable); Cell Phone Batteries; Tablets; Li-Ion Batteries; Computer (Recycling); Computer Monitors; Electronics; Laptop Computers; Computer Peripherals; Small Televisions; Televisions; Video Game Consoles; PlayStation Consoles","false","true","Receive an AT&T Promotion Card worth the trade-in value of your smartphone, tablet, or netbook. You can also donate the trade-in value to Cell Phones for Soldiers.","","false","false","false","false"
"Walmart Supercenter","","2225 W Interstate 20","Grand Prairie","","TX","75052","9726604200","0","","https://www.walmart.com/","32.673212","-97.0352892","3.44464174311913","","false","false","","","false","false","false","false"
"Walmart Tire and Lube Express","","2225 Interstate 20","Grand Prairie","","TX","75052","9726604200","0","","https://www.walmart.com/cp/ideas/8932632","32.673212","-97.0352892","3.44464174311913","","false","false","","","false","false","false","false"
"Walgreens","Walgreens","2420 W Arkansas Ln","Arlington","Tarrant","TX","76013","8177958166","0","","http://www.walgreens.com","32.70665","-97.14666","3.46431328216286","Cell Phones; Inkjet Cartridge Refilling; Inkjet Printer Cartridges; Computer (Recycling); Computer Monitors; Electronics; Laptop Computers; Computer Peripherals; Small Televisions; Tablets; Televisions; Video Game Consoles; PlayStation Consoles","false","true","","","false","false","false","false"
"Waste Management Arlington Materials Recovery Facility","","1921 Meridian St","Arlington","","TX","76011","8172746107","0","","","32.7441671","-97.0781208","3.48635935708961","","false","false","","","false","false","false","false"
"Sealed Air Corporation","Sealed Air Corporation","2401 Dillard St","Grand Prairie","Tarrant","TX","75051","9726471030","0","","http://www.sealedairprotects.com/","32.72819","-97.04315","3.53097603213825","Polyethylene Foam (PE); Computer (Recycling); Computer Monitors; Electronics; Laptop Computers; Computer Peripherals; Small Televisions; Tablets; Televisions; Video Game Consoles; PlayStation Consoles","false","true","Please ship prepaid. COD's will not be accepted.","","false","false","false","false"
