name,description,address,city,region,province,postal_code,phone,fax,hours,url,latitude,longitude,distance,materials,pickup,dropoff,notes,groups,curbside,municipal,national,event_only
"The Salvation Army","null","229 E Felix St ","Fort Worth","Tarrant County","TX","76115","8007287825","0","Monday: 10:00 AM - 6:00 PM Tuesday: 10:00 AM - 6:00 PM Wednesday: 10:00 AM - 6:00 PM Thursday: 10:00 AM - 6:00 PM Friday: 10:00 AM - 6:00 PM Saturday: 10:00 AM - 6:00 PM Sunday:  -  ","http://www.salvationarmyusa.org","32.6778742","-97.3238941","0.394036933812207","Bikes; Books (Reuse); CD/DVD/Blu-ray/UHD discs; Cell Phones; Children's Toys; Clothing; Computer (Reuse); Hard Drives; Computer Monitors; Cameras; DVD Players/Blu-Ray Players/DVRs; Electronics; E-Readers; Furniture; Gift Bags; Headphones; Household Goods; Laptop Computers; Lawn Equipment; Miscellaneous Tools; MP3 Players; Musical Instruments; Network Equipment; Ornaments; Computer Peripherals; Portable Media Players; Printers/Scanners/Fax Machines; Reusable Appliance Donation; Small Appliances; Small Electronics; Small Televisions; Sporting Goods; Stereo Equipment; Tablets; Telephones; Televisions; VCRs; VHS & Cassette Tapes; Video Game Systems; Blu-Ray Players; Digital Converter Boxes; Computer (Recycling); Video Game Consoles; PlayStation Consoles","false","true","No CRT Televisions","Sony, Vizio, OEM, Salvation Army","false","false","false","false"
"Pep Boys Auto","Pep Boys Auto","101 W Seminary Dr","Fort Worth","Tarrant","TX","76115","8179267737","0","Monday: 8:00 AM - 8:00 PM Tuesday: 8:00 AM - 8:00 PM Wednesday: 8:00 AM - 8:00 PM Thursday: 8:00 AM - 8:00 PM Friday: 8:00 AM - 8:00 PM Saturday: 8:00 AM - 8:00 PM Sunday: 9:00 AM - 6:00 PM ","http://www.pepboys.com","32.68422","-97.32605","0.478005752666934","Used Motor Oil; Computer (Recycling); Computer Monitors; Electronics; Laptop Computers; Computer Peripherals; Small Televisions; Tablets; Televisions; Video Game Consoles; PlayStation Consoles","false","true","","","false","false","false","false"
"Thelin Recycling","Thelin Recycling","5225 Thelin St","Fort Worth","Tarrant","TX","76115","8179230011","0","Monday: 6:00 AM - 6:00 PM Tuesday: 6:00 AM - 6:00 PM Wednesday: 6:00 AM - 6:00 PM Thursday: 6:00 AM - 6:00 PM Friday: 6:00 AM - 6:00 PM Saturday: 7:00 AM - 4:00 PM ","http://www.thelinrecycling.com","32.67024","-97.32873","0.579676790371557","Broken Asphalt/Aggregate; Concrete (Set); Construction Materials; Shingles; Wood; Scrap Metal; Computer (Recycling); Computer Monitors; Electronics; Laptop Computers; Computer Peripherals; Small Televisions; Tablets; Televisions; Video Game Consoles; PlayStation Consoles","false","true","","","false","false","false","false"
"La Gran Plaza de Fort Worth","","4200 South Freeway Street","Fort Worth","","TX","76115","8589993200","0","","http://www.ecoatm.com/","32.6849588","-97.3220803","0.669265420273692","","false","false","","","false","false","false","false"
"RadioShack","","4200 S Fwy I35W P-21","Fort Worth","","TX","76115","8179277480","0","","","32.6849588","-97.3220803","0.669265420273692","","false","false","","","false","false","false","false"
"La Gran Plaza de Fort Worth 1","La Gran Plaza de Fort Worth 1","4200 South Fwy","Fort Worth","Tarrant","TX","76115","8583244111","0","","http://www.ecoatm.com/","32.68634","-97.32104","0.778671185862925","Cell Phones; Tablets; MP3 Players; Computer (Recycling); Computer Monitors; Electronics; Laptop Computers; Computer Peripherals; Small Televisions; Televisions; Video Game Consoles; PlayStation Consoles","false","true","ecoATM is an automated, consumer self-serve kiosk that quickly buys back and recycles old phones, mp3 players and tablets.
</br>
Call or email <a href="mailto:max@ecoATM.com">customer support</a> with questions.","","false","false","false","false"
"La Gran Plaza de Fort Worth 2","La Gran Plaza de Fort Worth 2","4200 South Fwy","Fort Worth","Tarrant","TX","76115","8583244111","0","","http://www.ecoatm.com/","32.68634","-97.32104","0.778671185862925","Cell Phones; Tablets; MP3 Players; Computer (Recycling); Computer Monitors; Electronics; Laptop Computers; Computer Peripherals; Small Televisions; Televisions; Video Game Consoles; PlayStation Consoles","false","true","ecoATM is an automated, consumer self-serve kiosk that quickly buys back and recycles old phones, mp3 players and tablets.
</br>
Call or email <a href="mailto:max@ecoATM.com">customer support</a> with questions.","","false","false","false","false"
"Call2Recycle at RadioShack","Call2Recycle at RadioShack","4200 South Fwy # P21","Fort Worth","Tarrant","TX","76115","8179277480","0","","http://www.radioshack.com/","32.68634","-97.32104","0.778671185862925","Cell Phones; Ni-Cd Batteries; Li-Ion Batteries; Ni-MH Batteries; Ni-Zn Batteries; Small Sealed Lead Acid Batteries; Computer (Recycling); Computer Monitors; Electronics; Laptop Computers; Computer Peripherals; Small Televisions; Tablets; Televisions; Video Game Consoles; PlayStation Consoles","false","true","As the first national retailer to partner with Call2Recycle, RadioShack is at the forefront of the rechargeable battery recycling cause and is pleased to offer battery recycling at thousands of convenient RadioShack locations for free.  Simply drop them off at your local RadioShack and theyll take care of the rest.  Ask a store associate for more details.","","false","false","false","false"
"Firestone Complete Auto Care","","609 Bolt St","Fort Worth","","TX","76110","8179238273","0","","https://www.firestonecompleteautocare.com/","32.6888666","-97.321328","0.898931675646355","","false","false","","","false","false","false","false"
"The Salvation Army","null","5616 Crowley Rd ","Fort Worth","Tarrant County","TX","76134","8007287825","0","Monday: 10:00 AM - 6:00 PM Tuesday: 10:00 AM - 6:00 PM Wednesday: 10:00 AM - 6:00 PM Thursday: 10:00 AM - 6:00 PM Friday: 10:00 AM - 6:00 PM Saturday: 10:00 AM - 6:00 PM Sunday:  -  ","http://www.salvationarmyusa.org","32.665442","-97.347818","1.34534376329338","Bikes; Books (Reuse); CD/DVD/Blu-ray/UHD discs; Cell Phones; Children's Toys; Clothing; Computer (Reuse); Hard Drives; Computer Monitors; Cameras; DVD Players/Blu-Ray Players/DVRs; Electronics; E-Readers; Furniture; Gift Bags; Headphones; Household Goods; Laptop Computers; Lawn Equipment; Miscellaneous Tools; MP3 Players; Musical Instruments; Network Equipment; Ornaments; Computer Peripherals; Portable Media Players; Printers/Scanners/Fax Machines; Reusable Appliance Donation; Small Appliances; Small Electronics; Small Televisions; Sporting Goods; Stereo Equipment; Tablets; Telephones; Televisions; VCRs; VHS & Cassette Tapes; Video Game Systems; Blu-Ray Players; Digital Converter Boxes; Computer (Recycling); Video Game Consoles; PlayStation Consoles","false","true","No CRT Televisions","Sony, Vizio, OEM, Salvation Army","false","false","false","false"
"Old Hemphill Road Drop-Off Station","Old Hemphill Road Drop-Off Station","6260 Old Hemphill Rd ","Fort Worth","Tarrant County","TX","76134","8173923279","0","Monday: 8:00 AM - 6:00 PM Tuesday: 8:00 AM - 6:00 PM Wednesday: 8:00 AM - 6:00 PM Thursday: 8:00 AM - 6:00 PM Friday: 8:00 AM - 6:00 PM Saturday: 8:00 AM - 5:00 PM ","http://fortworthtexas.gov/solidwaste/dropoff/","32.657466","-97.324402","1.49612126373746","Plastic #1 (PETE); Plastic #2 (HDPE); Plastic #2 (Color HDPE); Plastic #3 (PVC); Plastic #4 (LDPE); Plastic #5 (Polypropylene); Plastic #6 (Polystyrene); Plastic #7; Aerosol Spray Cans; Aluminum Cans; Glass (Blue); Book Recycling; Glass (Brown); Brown Paper Bags; Brush; Cardboard; Carpet; Carpet Padding; Catalogs; Ceramic Tiles; Chipboard; Glass (Clear); Computer Paper; Computer (Recycling); Electronics; Gift Boxes; Grass Clippings; Glass (Green); Greeting Cards; Furniture; Large Household Appliances; Leaves; Linoleum; Magazines; Bed Mattresses; Paper (Mixed); Newspapers; Glass (Other); Wood Pallets; Paperboard; Phone books; Porcelain; Televisions; Tin or Steel Cans; Tree Trimmings; Used Tires; Weeds; Office Paper; Windows; Wood; Yard Waste; MP3 Players","false","true","Drop-off stations are open to Fort Worth homeowners and some renters for disposal of trash, brush and recyclables. To use a drop-off station, show a recent Fort Worth water bill or current drivers license with a Fort Worth address to prove you have an active sanitation account. Renters with a Fort Worth address may use drop-off stations if they have a current Fort Worth water bill. Apartment renters may use the stations for recyclables only.","","false","false","false","false"
"City of Fort Worth Recycling Drop-Off Station - Old Hemphill Road","","6260 Old Hemphill Rd","Fort Worth","","TX","76134","8173923279","0","","http://fortworthtexas.gov/solidwaste/dropoff/","32.657466","-97.324402","1.49612126373746","","false","false","","","false","false","false","false"
"Habitat for Humanity Restore South","Habitat for Humanity Restore South","3420 S Grove St","Fort Worth","Tarrant","TX","76110","8179209203","0","Tuesday: 8:00 AM - 6:00 PM Wednesday: 8:00 AM - 6:00 PM Thursday: 8:00 AM - 6:00 PM Friday: 8:00 AM - 6:00 PM Saturday: 8:00 AM - 6:00 PM ","http://www.habitat.org","32.70003","-97.32232","1.56563435987161","Brick(s); Carpet; Ceiling Tiles; Ceramic Tiles; Construction Materials (Reuse); Drywall; Linoleum; Paint Donation; Porcelain; Roofing Materials; Stone; Windows; Computer (Recycling); Computer Monitors; Electronics; Laptop Computers; Computer Peripherals; Small Televisions; Tablets; Televisions; Video Game Consoles; PlayStation Consoles","false","true","The ReStore raises funds by selling merchandise and, after expenses, uses all profits to build more homes.  Habitat also provides families an opportunity to buy building materials that they may not otherwise be able to afford. This will help raise the standards of housing. By recycling goods that would have been sent to a landfill, the ReStore also helps reduce waste disposal costs. If you have materials to donate, please call for more information. The Habitat ReStore takes most materials and the staff will be glad to talk with you.","","false","false","false","false"
"O'Reilly Auto Parts","null","601 West Berry Street ","Fort Worth","","TX","76110","8179268911","0","","http://oreillyauto.custhelp.com/app/error/error_id/6","32.7055277","-97.3313186","1.86942828288286","","false","false","","","false","false","false","false"
"O'Reilly Auto Parts","O'Reilly Auto Parts","601 W Berry St","Fort Worth","Tarrant","TX","76110","8179268911","0","Monday: 7:30 AM - 10:00 PM Tuesday: 7:30 AM - 10:00 PM Wednesday: 7:30 AM - 10:00 PM Thursday: 7:30 AM - 10:00 PM Friday: 7:30 AM - 10:00 PM Saturday: 7:30 AM - 10:00 PM Sunday: 8:00 AM - 9:00 PM ","http://www.oreillyauto.com/","32.70577","-97.33033","1.88582421462803","Used Motor Oil; Oil Filters; Computer (Recycling); Computer Monitors; Electronics; Laptop Computers; Computer Peripherals; Small Televisions; Tablets; Televisions; Video Game Consoles; PlayStation Consoles","false","true","Most stores offer Used Oil & Battery Recycling, Battery Testing, 
Electrical & Module Testing, Loaner Tool Program, Drum / Rotor Resurfacing. Call your location for more details.","","false","false","false","false"
"Lighting Resources, LLC","","101 East Bowie Street","Fort Worth","","TX","76110","8179211440","0","","https://ezontheearth.com/","32.7081153","-97.3260876","2.06475613726958","","false","false","","","false","false","false","false"
"Sams Club","","2440 SE Loop 820","Fort Worth","","TX","76134","8172939225","0","","https://www.samsclub.com/","32.6639069","-97.2968243","2.20889019737501","","false","false","","","false","false","false","false"
"O'Reilly Auto Parts","null","2100 West Berry Street ","Fort Worth","","TX","76110","8179264636","0","","http://oreillyauto.custhelp.com/app/error/error_id/6","32.7063676","-97.3495669","2.21936431661335","","false","false","","","false","false","false","false"
"Goodwill Industries of Fort Worth Inc. - Fort Worth","Goodwill Industries of Fort Worth Inc. - Fort Worth","4005 Campus Dr","Fort Worth","Tarrant","TX","76119","8174592688","0","Monday: 9:00 AM - 9:00 PM Tuesday: 9:00 AM - 9:00 PM Wednesday: 9:00 AM - 9:00 PM Thursday: 9:00 AM - 9:00 PM Friday: 9:00 AM - 9:00 PM Saturday: 9:00 AM - 9:00 PM Sunday: 11:00 AM - 7:00 PM ","http://www.goodwillfortworth.org","32.68986","-97.29481","2.22660108643791","Bikes; Books (Reuse); Cell Phones; Clothing; CD/DVD/Blu-ray/UHD discs; Computer (Reuse); Computer Monitors; Computer (Recycling); Electronics; Gift Bags; Eyeglasses; Furniture; Household Goods; Lawn Equipment; Musical Instruments; Office Furniture; Office Equipment; Ornaments; Reusable Appliance Donation; Sporting Goods; Telephones; Televisions; Miscellaneous Tools; Children's Toys; Car Donation; VHS & Cassette Tapes; MP3 Players; Laptop Computers; Computer Peripherals; Small Televisions; Tablets; Video Game Consoles; PlayStation Consoles","false","true","This store will accept gently used items in good, clean, working condition.  This store also operates Goodwill  Computer Works of Fort Worth.  For more information about this program, please call 817-534-4493, ext. 290.","","false","false","false","false"
"AutoZone","AutoZone","2900 W Cleburne Rd","Fort Worth","Tarrant","TX","76110","8179239023","0","Monday: 7:30 AM - 10:00 PM Tuesday: 7:30 AM - 10:00 PM Wednesday: 7:30 AM - 10:00 PM Thursday: 7:30 AM - 10:00 PM Friday: 7:30 AM - 10:00 PM Saturday: 7:30 AM - 10:00 PM Sunday: 8:00 AM - 9:00 PM ","http://www.autozone.com","32.70895","-97.34519","2.26923136808805","Lead Acid (Pb) Batteries; Used Motor Oil; Computer (Recycling); Computer Monitors; Electronics; Laptop Computers; Computer Peripherals; Small Televisions; Tablets; Televisions; Video Game Consoles; PlayStation Consoles","false","true","Most AutoZone stores accept used motor oil, transmission fluid, gear oil and automotive batteries. Call to see what your local store is currently accepting.","","false","false","false","false"
"Guess Automotive","Guess Automotive","3508 SW Loop 820","Fort Worth","Tarrant","TX","76133","8179269601","0","","http://www.tomguessauto.com/","32.67162","-97.36935","2.30097686184078","Used Motor Oil; Oil Filters; Computer (Recycling); Computer Monitors; Electronics; Laptop Computers; Computer Peripherals; Small Televisions; Tablets; Televisions; Video Game Consoles; PlayStation Consoles","false","true","","","false","false","false","false"
"Walgreens","Walgreens","6205 Westcreek Dr","Fort Worth","Tarrant","TX","76133","8172630962","0","","http://www.walgreens.com","32.65467","-97.36132","2.42713339480409","Cell Phones; Inkjet Cartridge Refilling; Inkjet Printer Cartridges; Computer (Recycling); Computer Monitors; Electronics; Laptop Computers; Computer Peripherals; Small Televisions; Tablets; Televisions; Video Game Consoles; PlayStation Consoles","false","true","","","false","false","false","false"
"RadioShack","RadioShack","3107 Greene Ave","Fort Worth","Tarrant","TX","76109","8179237238","0","Monday: 9:00 AM - 9:00 PM Tuesday: 9:00 AM - 9:00 PM Wednesday: 9:00 AM - 9:00 PM Thursday: 9:00 AM - 9:00 PM Friday: 9:00 AM - 9:00 PM Saturday: 9:00 AM - 9:00 PM Sunday: 10:00 AM - 7:00 PM ","http://www.radioshack.com","32.70553","-97.35819","2.4619781011584","Ni-Cd Batteries; Batteries (Rechargeable); Computer (Recycling); Computer Monitors; Electronics; Laptop Computers; Computer Peripherals; Small Televisions; Tablets; Televisions; Video Game Consoles; PlayStation Consoles","false","true","","","false","false","false","false"
"UNICOR FCI Forth Worth Collection Center","UNICOR FCI Forth Worth Collection Center","3150 Horton Rd","Forest Hill","Tarrant","TX","76119","8008273168","0","","http://www.unicor.gov/","32.68022","-97.2869","2.5460186007744","Car Audio/Video Equipment; Cell Phones; Computer (Recycling); Hard Drives; Computer Monitors; Cameras; Electronics; Laptop Computers; Medical Equipment; Memory (RAM), Flash Card/Drive; MP3 Players; Office Equipment; Computer Peripherals; Portable Media Players; Power Supplies; Printers/Scanners/Fax Machines; Small Electronics; Small Televisions; Telephones; Televisions; Video Game Systems; Calculator; Tablets; Video Game Consoles; PlayStation Consoles","false","true","Drop off must be scheduled in advance. ","","false","false","false","false"
"Texas Christian University - Grand Mark Dorm","","2855 W Bowie St","Fort Worth","","TX","76109","8179242900","0","","","32.707554","-97.3576428","2.55002789205524","","false","false","","","false","false","false","false"
"Texas Christian University - Grand Mark Dorm","","2855 W Bowie St","Fort Worth","","TX","76109","8179242900","0","","","32.707554","-97.3576428","2.55002789205524","","false","false","","","false","false","false","false"
"US Post Office","US Post Office","2600 8th Ave","Fort Worth","Tarrant","TX","76110","0","0","","https://www.usps.com/ship/recycle-through-usps.htm","32.71364","-97.34473","2.56403478489136","Inkjet Printer Cartridges; Computer (Recycling); Computer Monitors; Electronics; Laptop Computers; Computer Peripherals; Small Televisions; Tablets; Televisions; Video Game Consoles; PlayStation Consoles","false","true","Free, postage-paid Mail Back envelopes can be found on display in the lobby. There is no limit to the number of envelopes customers may take. The contents of the envelope must weigh less than 13 ounces and the envelope must be able to seal completely. For more details visit<a href="http://www.maxback.com/mxb-postoffice-collaboration" target="_blank">MaxBack</a>.","","false","false","false","false"
"Albertsons","","3563 Alton Road","Fort Worth","","TX","76109","8175481415","0","","","32.6978435","-97.3694819","2.62559300844314","","false","false","","","false","false","false","false"
"Shred Nations","Shred Nations (inside The Box)","3023 S University Dr","Fort Worth","Tarrant","TX","76109","8178407705","0","","http://www.shrednations.com/dropoff/location/fort-worth/ea17a53e-d3c0-fd1f-6309-51a6a143b174","32.70742","-97.36046","2.64705237577124","Cell Phones; Computer (Recycling); Laptop Computers; Small Televisions; Documents to Shred; Computer Monitors; Electronics; Computer Peripherals; Tablets; Televisions; Video Game Consoles; PlayStation Consoles","true","true","Shred Nations offers document shredding, hard drive destruction, electronics recycling and more. Visit website for quotes and full list of services offered in your area. ","","false","false","false","false"
"Albertsons","Albertsons","3563 Alton Rd","Fort Worth","Tarrant","TX","76109","8175481415","0","","http://albertsons.mywebgrocer.com/","32.69833","-97.36983","2.66019814016726","Food Storage Bags; Plastic Shopping Bags; Computer (Recycling); Computer Monitors; Electronics; Laptop Computers; Computer Peripherals; Small Televisions; Tablets; Televisions; Video Game Consoles; PlayStation Consoles","false","true","","","false","false","false","false"
"SW Paper Stock","SW Paper Stock","2301 Hemphill St","Fort Worth","Tarrant","TX","76110","8179248005","0","Monday: 8:00 AM - 4:00 PM Tuesday: 8:00 AM - 4:00 PM Wednesday: 8:00 AM - 4:00 PM Thursday: 8:00 AM - 4:00 PM Friday: 8:00 AM - 4:00 PM Saturday: 8:00 AM - 11:59 PM ","http://www.servicewaste.com/partner.htm","32.7176","-97.33114","2.70323851986682","Cardboard; Computer Paper; Greeting Cards; Paper (Mixed); Newspapers; Documents to Shred; Computer (Recycling); Computer Monitors; Electronics; Laptop Computers; Computer Peripherals; Small Televisions; Tablets; Televisions; Video Game Consoles; PlayStation Consoles","false","true","","","false","false","false","false"
"RadioShack","","3075 Mansfield Hwy Suite A","Fort Worth","","TX","76119","8175312121","0","","","32.68547","-97.2839169","2.75920532158102","","false","false","","","false","false","false","false"
"Firestone Complete Auto Care","","6451 Mc Cart","Fort Worth","","TX","76133","8172920501","0","","https://www.firestonecompleteautocare.com/","32.6501063","-97.3655409","2.82213177833592","","false","false","","","false","false","false","false"
"Firestone Complete Auto Care Store","Firestone Complete Auto Care Store","6451 McCart Ave","Fort Worth","Tarrant","TX","76133","8177698573","0","Monday: 7:00 AM - 7:00 PM Tuesday: 7:00 AM - 7:00 PM Wednesday: 7:00 AM - 7:00 PM Thursday: 7:00 AM - 7:00 PM Friday: 7:00 AM - 7:00 PM Saturday: 7:00 AM - 7:00 PM Sunday: 9:00 AM - 5:00 PM ","http://www.firestonecompleteautocare.com/","32.65045","-97.36687","2.86212923078311","Lead Acid (Pb) Batteries; Used Motor Oil; Computer (Recycling); Computer Monitors; Electronics; Laptop Computers; Computer Peripherals; Small Televisions; Tablets; Televisions; Video Game Consoles; PlayStation Consoles","false","true","","","false","false","false","false"
"RadioShack","","3401 Alta Mesa Space 122","Fort Worth","","TX","76133","8173460083","0","","","32.6482987","-97.3649207","2.88521985633901","","false","false","","","false","false","false","false"
"Associated Wholesale Grocers (AWG)","","7550 Oak Grove Rd","Fort Worth","","TX","76140","8175683751","0","","","32.6405215","-97.3094692","2.89682634946097","","false","false","","","false","false","false","false"
"Texas Christian University - Rec Center","","Bellaire Dr N","Fort Worth","","TX","76109","8172577865","0","","","32.707059","-97.3672094","2.902246157501","","false","false","","","false","false","false","false"
"US Post Office","US Post Office","1001 Altamesa Blvd","Fort Worth","Tarrant","TX","76134","0","0","","https://www.usps.com/ship/recycle-through-usps.htm","32.63636","-97.33264","2.91213771975607","Inkjet Printer Cartridges; Computer (Recycling); Computer Monitors; Electronics; Laptop Computers; Computer Peripherals; Small Televisions; Tablets; Televisions; Video Game Consoles; PlayStation Consoles","false","true","Free, postage-paid Mail Back envelopes can be found on display in the lobby. There is no limit to the number of envelopes customers may take. The contents of the envelope must weigh less than 13 ounces and the envelope must be able to seal completely. For more details visit<a href="http://www.maxback.com/mxb-postoffice-collaboration" target="_blank">MaxBack</a>.","","false","false","false","false"
"Texas Christian University - Shirley Dorm","","W Cantey St","Fort Worth","","TX","76129","8172577865","0","","","32.711695","-97.3622228","2.93960594465226","","false","false","","","false","false","false","false"
"O'Reilly Auto Parts","null","5023 Granbury Road ","Fort Worth","","TX","76133","8173700800","0","","http://oreillyauto.custhelp.com/app/error/error_id/6","32.673452","-97.3820886","3.01255491952557","","false","false","","","false","false","false","false"
"O'Reilly Auto Parts","O'Reilly Auto Parts","5023 Granbury Rd","Fort Worth","Tarrant","TX","76133","8173700800","0","Monday: 7:30 AM - 10:00 PM Tuesday: 7:30 AM - 10:00 PM Wednesday: 7:30 AM - 10:00 PM Thursday: 7:30 AM - 10:00 PM Friday: 7:30 AM - 10:00 PM Saturday: 7:30 AM - 10:00 PM Sunday: 9:00 AM - 8:00 PM ","http://www.oreillyauto.com/","32.67391","-97.38219","3.01493004932449","Used Motor Oil; Oil Filters; Computer (Recycling); Computer Monitors; Electronics; Laptop Computers; Computer Peripherals; Small Televisions; Tablets; Televisions; Video Game Consoles; PlayStation Consoles","false","true","Most stores offer Used Oil & Battery Recycling, Battery Testing, 
Electrical & Module Testing, Loaner Tool Program, Drum / Rotor Resurfacing. Call your location for more details.","","false","false","false","false"
"Cordy Tire Factory Outlet","Cordy Tire Factory Outlet","3310 Mansfield Hwy","Forest Hill","Tarrant","TX","76119","8175344964","0","Monday: 8:00 AM - 5:30 PM Tuesday: 8:00 AM - 5:30 PM Wednesday: 8:00 AM - 5:30 PM Thursday: 8:00 AM - 5:30 PM Friday: 8:00 AM - 5:30 PM Saturday: 8:00 AM - 3:00 PM ","null","32.68182","-97.27737","3.10594501242371","Antifreeze; Used Motor Oil; Oil Filters; Used Tires; Computer (Recycling); Computer Monitors; Electronics; Laptop Computers; Computer Peripherals; Small Televisions; Tablets; Televisions; Video Game Consoles; PlayStation Consoles","false","true","","","false","false","false","false"
"Aztec Auto Salvage","Aztec Auto Salvage","2370 S Riverside Dr","Fort Worth","Tarrant","TX","76104","8174786999","8175357472","Monday: 8:00 AM - 6:00 PM Tuesday: 8:00 AM - 6:00 PM Wednesday: 8:00 AM - 6:00 PM Thursday: 8:00 AM - 6:00 PM Friday: 8:00 AM - 6:00 PM Saturday: 8:00 AM - 6:00 PM ","","32.7183","-97.30465","3.13885269710648","Car; Automobile Parts; Windows; Scrap Metal; Computer (Recycling); Computer Monitors; Electronics; Laptop Computers; Computer Peripherals; Small Televisions; Tablets; Televisions; Video Game Consoles; PlayStation Consoles","false","true","","","false","false","false","false"
"Home Depot","","7950 South Fwy","Fort Worth","","TX","76134","8172930343","0","","https://ecooptions.homedepot.com/","32.6334159","-97.323641","3.13964943940988","Batteries (Rechargeable); Cell Phone Batteries; Li-Ion Batteries; Ni-Cd Batteries; Ni-MH Batteries; Small Sealed Lead Acid Batteries","false","true","","Call2Recycle","false","false","false","false"
"O'Reilly Auto Parts","null","3351 Mansfield Highway","Fort Worth","","TX","76119","8175345100","0","","http://oreillyauto.custhelp.com/app/error/error_id/6","32.6820163","-97.2761182","3.17955485667202","","false","false","","","false","false","false","false"
