name,description,address,city,region,province,postal_code,phone,fax,hours,url,latitude,longitude,distance,materials,pickup,dropoff,notes,groups,curbside,municipal,national,event_only
"Shred Nations","Shred Nations (inside Pack N Mail Plus)","5358 Wedgmont Cir N","Fort Worth","Tarrant","TX","76133","8173497344","0","Monday: 9:00 AM - 6:00 PM Tuesday: 9:00 AM - 6:00 PM Wednesday: 9:00 AM - 6:00 PM Thursday: 9:00 AM - 6:00 PM Friday: 9:00 AM - 6:00 PM Saturday: 10:00 AM - 2:00 PM ","http://www.shrednations.com/dropoff/location/fort-worth/19599168-6b13-9e78-0424-51accf311537","32.66941","-97.38487","3.21590611535139","Cell Phones; Computer (Recycling); Laptop Computers; Small Televisions; Documents to Shred; Computer Monitors; Electronics; Computer Peripherals; Tablets; Televisions; Video Game Consoles; PlayStation Consoles","true","true","Shred Nations offers document shredding, hard drive destruction, electronics recycling and more. Visit website for quotes and full list of services offered in your area. ","","false","false","false","false"
"Pep Boys Auto","Pep Boys Auto","6725 McCart Ave","Fort Worth","Tarrant","TX","76133","8172943311","0","Monday: 8:00 AM - 8:00 PM Tuesday: 8:00 AM - 8:00 PM Wednesday: 8:00 AM - 8:00 PM Thursday: 8:00 AM - 8:00 PM Friday: 8:00 AM - 8:00 PM Saturday: 8:00 AM - 8:00 PM Sunday: 9:00 AM - 6:00 PM ","http://www.pepboys.com","32.64397","-97.36879","3.25723661525893","Used Motor Oil; Computer (Recycling); Computer Monitors; Electronics; Laptop Computers; Computer Peripherals; Small Televisions; Tablets; Televisions; Video Game Consoles; PlayStation Consoles","false","true","","","false","false","false","false"
"Colonial Car Wash & Lube Center","Colonial Car Wash & Lube Center","3815 Altamesa Blvd","Fort Worth","Tarrant","TX","76133","8172941836","0","","","32.64989","-97.37561","3.27787554343691","Used Motor Oil; Oil Filters; Computer (Recycling); Computer Monitors; Electronics; Laptop Computers; Computer Peripherals; Small Televisions; Tablets; Televisions; Video Game Consoles; PlayStation Consoles","false","true","","","false","false","false","false"
"O'Reilly Auto Parts","null","7144 Mccart Avenue","Fort Worth","","TX","76133","8173466811","0","","http://oreillyauto.custhelp.com/app/error/error_id/6","32.6396377","-97.3702519","3.53712921713466","","false","false","","","false","false","false","false"
"Walmart Supercenter","","7451 McCart Ave","Fort Worth","","TX","76133","8173616032","0","","https://www.walmart.com/","32.6366088","-97.3673559","3.59586774006992","","false","false","","","false","false","false","false"
"Walmart Tire and Lube Express","","7451 McCart Ave","Fort Worth","","TX","76133","8173616032","0","","https://www.walmart.com/cp/ideas/8932632","32.6366088","-97.3673559","3.59586774006992","","false","false","","","false","false","false","false"
"Evergreen Recycling","","1110 Everman Pkwy.","Fort Worth","","TX","76140","8174803617","0","","http://www.evergreen-recycling.com/","32.6263151","-97.3166391","3.69457901459637","","false","false","","","false","false","false","false"
"Walmart Tire & Lube Express","Walmart Tire & Lube Express","7451 McCart Ave","Fort Worth","Tarrant","TX","76133","8173616032","0","","http://www.walmart.com/catalog/catalog.gsp?cat=495843","32.63607","-97.36986","3.71356254694658","Lead Acid (Pb) Batteries; Used Motor Oil; Oil Filters; Computer (Recycling); Computer Monitors; Electronics; Laptop Computers; Computer Peripherals; Small Televisions; Tablets; Televisions; Video Game Consoles; PlayStation Consoles","false","true","","","false","false","false","false"
"Walmart 29781","Walmart 29781","7451 McCart Ave","Fort Worth","Tarrant","TX","76133","8583244111","0","","http://www.ecoatm.com/","32.63607","-97.36986","3.71356254694658","Cell Phones; Tablets; MP3 Players; Computer (Recycling); Computer Monitors; Electronics; Laptop Computers; Computer Peripherals; Small Televisions; Televisions; Video Game Consoles; PlayStation Consoles","false","true","ecoATM is an automated, consumer self-serve kiosk that quickly buys back and recycles old phones, mp3 players and tablets.
</br>
Call or email <a href="mailto:max@ecoATM.com">customer support</a> with questions.","","false","false","false","false"
"Call2Recycle at the Home Depot","Call2Recycle at the Home Depot","4850 Sw Loop 820 # R Blvd R","Fort Worth","Tarrant","TX","76109","8177379220","0","","http://www.homedepot.com/","32.68551","-97.39404","3.71917123377384","Cell Phones; Compact Fluorescent Lights; Ni-Cd Batteries; Li-Ion Batteries; Ni-MH Batteries; Ni-Zn Batteries; Small Sealed Lead Acid Batteries; Computer (Recycling); Computer Monitors; Electronics; Laptop Computers; Computer Peripherals; Small Televisions; Tablets; Televisions; Video Game Consoles; PlayStation Consoles","false","true","The Home Depot accepts used rechargeable batteries and compact fluorescent bulbs. Look for the orange drop boxes, usually located near the front entrance near the customer service desk, or ask a store associate for more details.","","false","false","false","false"
"Evergreen Paper Recycling Inc.","Evergreen Paper Recycling Inc.","1110 Everman Pkwy","Fort Worth","Tarrant","TX","76140","8172934400","0","","http://www.evergreen-recycling.com","32.62649","-97.31252","3.74305430246831","Plastic #1 (PETE); Plastic #2 (HDPE); Plastic #3 (PVC); Plastic #4 (LDPE); Plastic #5 (Polypropylene); Plastic #6 (Polystyrene); Brown Paper Bags; Cardboard; Computer Paper; Office Paper; Computer (Recycling); Computer Monitors; Electronics; Laptop Computers; Computer Peripherals; Small Televisions; Tablets; Televisions; Video Game Consoles; PlayStation Consoles","false","true","","","false","false","false","false"
"RadioShack","RadioShack","4801 S Hulen St Ste 128","Fort Worth","Tarrant","TX","76132","8172928611","0","Monday: 9:00 AM - 9:00 PM Tuesday: 9:00 AM - 9:00 PM Wednesday: 9:00 AM - 9:00 PM Thursday: 9:00 AM - 9:00 PM Friday: 9:00 AM - 9:00 PM Saturday: 9:00 AM - 9:00 PM Sunday: 10:00 AM - 7:00 PM ","http://www.radioshack.com","32.67713","-97.39502","3.74560236232094","Ni-Cd Batteries; Batteries (Rechargeable); Computer (Recycling); Computer Monitors; Electronics; Laptop Computers; Computer Peripherals; Small Televisions; Tablets; Televisions; Video Game Consoles; PlayStation Consoles","false","true","","","false","false","false","false"
"Keep America Beautiful Cars to Donate","","","Fort Worth","","TX","76133","8554262474","0","","https://www.kab.org/?pagename=car_donation","32.6477436","-97.3840729","3.76432788490549","","false","false","","","false","false","false","false"
"Walgreens","Walgreens","3425 Sycamore School Rd","Fort Worth","Tarrant","TX","76123","8173700505","0","","http://www.walgreens.com","32.63483","-97.36945","3.76718671453945","Cell Phones; Inkjet Printer Cartridges; Computer (Recycling); Computer Monitors; Electronics; Laptop Computers; Computer Peripherals; Small Televisions; Tablets; Televisions; Video Game Consoles; PlayStation Consoles","false","true","","","false","false","false","false"
"Staples","Staples","1660 S. University Drive","Fort Worth","Tarrant County","TX","76107","8173361616","0","Monday: 9:00 AM - 8:00 PM Tuesday: 9:00 AM - 8:00 PM Wednesday: 9:00 AM - 8:00 PM Thursday: 9:00 AM - 8:00 PM Friday: 9:00 AM - 8:00 PM Saturday: 10:00 AM - 7:00 PM Sunday: 11:00 AM - 6:00 PM ","https://www.staples.com/recycle","32.7268926","-97.3620377","3.81097374778275","AC Power Plugs; Batteries (Rechargeable); Cables & Connectors; Cell Phone Batteries; Cell Phones; Computer (Recycling); Hard Drives; Computer Monitors; Cameras; DVD Players/Blu-Ray Players/DVRs; Electronics; E-Readers; GPS Units; Headphones; Inkjet Printer Cartridges; Laptop Computers; Laser Toner Cartridges; Li-Ion Batteries; MP3 Players; Network Equipment; Ni-Cd Batteries; Ni-MH Batteries; Ni-Zn Batteries; Computer Peripherals; Portable Media Players; Printers/Scanners/Fax Machines; Small Electronics; Small Sealed Lead Acid Batteries; Stereo Equipment; Tablets; Telephones; UPS Batteries/Backup Systems; VCRs; Video Game Systems; Blu-Ray Players; Digital Converter Boxes; Small Televisions; Televisions; Video Game Consoles; PlayStation Consoles; Alkaline/Single-Use Batteries; Batteries (Rechargeable); Cell Phone Batteries; Li-Ion Batteries; Ni-Cd Batteries; Ni-MH Batteries; Small Sealed Lead Acid Batteries; Alkaline/Single-Use Batteries; Button Batteries; Non-rechargeable lithium batteries; Cell Phones","false","true","NO TVs; Limit 6 CEDs per day; ","Sony, Vizio, OEM, Call2Recycle","false","false","false","false"
"Staples","","1660 South University Drive","Fort Worth","","TX","76107","8173361616","0","","https://www.staples.com/sbd/cre/marketing/sustainability-center/recycling-services/","32.7268926","-97.3620377","3.81097374778275","Alkaline/Single-Use Batteries","false","true","","","false","false","false","false"
"City of Forest Hill Recycling Drop-Off Site - City Hall","","6800 Forest Hill Dr","Forest Hill","","TX","76140","8172222221","0","","http://www.foresthilltx.org","32.6563698","-97.2702171","3.83138443388238","","false","false","","","false","false","false","false"
"Shred Nations","Shred Nations (inside Pack 'N' Mail)","3000 S Hulen St Ste 124","Fort Worth","Tarrant","TX","76109","8173497407","0","Monday: 9:00 AM - 6:00 PM Tuesday: 9:00 AM - 6:00 PM Wednesday: 9:00 AM - 6:00 PM Thursday: 9:00 AM - 6:00 PM Friday: 9:00 AM - 6:00 PM Saturday: 10:00 AM - 2:00 PM ","http://www.shrednations.com/","32.7071","-97.38788","3.87182759231421","Cell Phones; Computer (Recycling); Laptop Computers; Small Televisions; Documents to Shred; Computer Monitors; Electronics; Computer Peripherals; Tablets; Televisions; Video Game Consoles; PlayStation Consoles","true","true","Shred Nations offers document shredding, hard drive destruction, electronics recycling and more. Visit website for quotes and full list of services offered in your area. ","","false","false","false","false"
"Pearl Izumi Factory Store","One World Running Drop-Off at Pearl Izumi Factory Store","3000 S Hulen St Ste 156","Fort Worth","Tarrant","TX","76109","8173778200","0","","http://oneworldrunning.com/","32.7071","-97.38788","3.87182759231421","Shoes; Computer (Recycling); Computer Monitors; Electronics; Laptop Computers; Computer Peripherals; Small Televisions; Tablets; Televisions; Video Game Consoles; PlayStation Consoles","false","true","","","false","false","false","false"
"Albertsons","Albertsons","3525 Sycamore School Rd","Fort Worth","Tarrant","TX","76133","8173466497","0","","http://albertsons.mywebgrocer.com/","32.6339","-97.37138","3.8862554437203","Food Storage Bags; Plastic Shopping Bags; Computer (Recycling); Computer Monitors; Electronics; Laptop Computers; Computer Peripherals; Small Televisions; Tablets; Televisions; Video Game Consoles; PlayStation Consoles","false","true","","","false","false","false","false"
"Randalls","","3100 South Hulen Street","Fort Worth","","TX","76109","8175702950","0","","https://shop.safeway.com/home.html","32.7064005","-97.3889283","3.90023369479801","","false","false","","","false","false","false","false"
"Albertsons","","3525 Sycamore School Road","Fort Worth","","TX","76133","8173466497","0","","","32.6335607","-97.3714081","3.90585409032757","","false","false","","","false","false","false","false"
"Hulen Mall 1","Hulen Mall 1","4800 S Hulen St","Fort Worth","Tarrant","TX","76132","8583244111","0","","http://www.ecoatm.com/","32.67843","-97.39811","3.92411767988831","Cell Phones; Tablets; MP3 Players; Computer (Recycling); Computer Monitors; Electronics; Laptop Computers; Computer Peripherals; Small Televisions; Televisions; Video Game Consoles; PlayStation Consoles","false","true","ecoATM is an automated, consumer self-serve kiosk that quickly buys back and recycles old phones, mp3 players and tablets.
</br>
Call or email <a href="mailto:max@ecoATM.com">customer support</a> with questions.","","false","false","false","false"
"Hulen Mall","","4800 S Hulen St","Fort Worth","","TX","76132","8589993200","0","","http://www.ecoatm.com/","32.6783274","-97.3984298","3.94272967704995","","false","false","","","false","false","false","false"
"Best Buy Mobile","null","5604 SW Loop 820","Fort Worth","","TX","76132","8175701770","0","","https://www.bestbuy.com/site/services/recycling/pcmcat149900050025.c?id=pcmcat149900050025","32.6783274","-97.3984298","3.94272967704995","","false","false","","","false","false","false","false"
"RadioShack","","4800 S Hulen St","Fort Worth","","TX","76132","8172923781","0","","","32.6783274","-97.3984298","3.94272967704995","","false","false","","","false","false","false","false"
"Cartridge World","","2830 South Hulen Street","Fort Worth","","TX","76109","8179212344","0","","","32.7102022","-97.3871444","3.94986508973777","","false","false","","","false","false","false","false"
"Sprint Store","null","3000 S Hulen St Ste 100,","Fort Worth","","TX","76109","8173773580","0","","https://newsroom.sprint.com/csr/device-donations/","32.7058357","-97.3903217","3.95204570397837","","false","false","","","false","false","false","false"
"Home Depot","","4850 Southwest Loop 820","Fort Worth","","TX","76109","8177379220","0","","https://ecooptions.homedepot.com/","32.6864317","-97.3990246","4.01492909666701","Batteries (Rechargeable); Cell Phone Batteries; Li-Ion Batteries; Ni-Cd Batteries; Ni-MH Batteries; Small Sealed Lead Acid Batteries","false","true","","Call2Recycle","false","false","false","false"
"US Post Office","US Post Office","4450 Oak Park Ln","Fort Worth","Tarrant","TX","76109","0","0","","https://www.usps.com/ship/recycle-through-usps.htm","32.71088","-97.38834","4.03367206926183","Inkjet Printer Cartridges; Computer (Recycling); Computer Monitors; Electronics; Laptop Computers; Computer Peripherals; Small Televisions; Tablets; Televisions; Video Game Consoles; PlayStation Consoles","false","true","Free, postage-paid Mail Back envelopes can be found on display in the lobby. There is no limit to the number of envelopes customers may take. The contents of the envelope must weigh less than 13 ounces and the envelope must be able to seal completely. For more details visit<a href="http://www.maxback.com/mxb-postoffice-collaboration" target="_blank">MaxBack</a>.","","false","false","false","false"
"AT&T Wireless","AT&T Wireless","2834 S Hulen St","Fort Worth","Tarrant","TX","76109","8179218300","0","Monday: 10:00 AM - 8:00 PM Tuesday: 10:00 AM - 8:00 PM Wednesday: 10:00 AM - 8:00 PM Thursday: 10:00 AM - 8:00 PM Friday: 10:00 AM - 8:00 PM Saturday: 10:00 AM - 7:00 PM Sunday: 12:00 PM - 6:00 PM ","http://www.att.com/","32.71455","-97.38521","4.03504352679198","Cell Phones; Ni-Cd Batteries; Batteries (Rechargeable); Cell Phone Batteries; Tablets; Li-Ion Batteries; Computer (Recycling); Computer Monitors; Electronics; Laptop Computers; Computer Peripherals; Small Televisions; Televisions; Video Game Consoles; PlayStation Consoles","false","true","Receive an AT&T Promotion Card worth the trade-in value of your smartphone, tablet, or netbook. You can also donate the trade-in value to Cell Phones for Soldiers.","","false","false","false","false"
"OfficeMax","null","4613 SOUTH HULEN SUITE B","Fort Worth","","TX","76132","8173467600","0","","null","32.6730226","-97.4005405","4.08300415401314","","false","false","","","false","false","false","false"
"Auto Excel Lube Center, Inc.","Auto Excel Lube Center, Inc.","4015 Sycamore School Rd","Fort Worth","Tarrant","TX","76133","8172635500","0","Monday: 8:00 AM - 6:00 PM Tuesday: 8:00 AM - 6:00 PM Wednesday: 8:00 AM - 6:00 PM Thursday: 8:00 AM - 6:00 PM Friday: 8:00 AM - 6:00 PM Saturday: 8:00 AM - 5:00 PM Sunday: 11:00 AM - 4:00 PM ","","32.63485","-97.38071","4.19167983487816","Antifreeze; Brake Fluid; Transmission Fluid; Used Motor Oil; Oil Filters; Computer (Recycling); Computer Monitors; Electronics; Laptop Computers; Computer Peripherals; Small Televisions; Tablets; Televisions; Video Game Consoles; PlayStation Consoles","false","true","","","false","false","false","false"
"Batteries Plus Bulbs","","5733 South Hulen St","Fort Worth","","TX","76132","8177447636","0","","https://www.batteriesplus.com/store-locator/tx/486?utm_source=local&utm_medium=earth911","32.6651099","-97.4009829","4.19441207736835","","false","false","","","false","false","false","false"
"FedEx Office","FedEx Office","5737 S Hulen St","Fort Worth","Tarrant","TX","76132","8172925693","0","Monday: 7:30 AM - 9:00 PM Tuesday: 7:30 AM - 9:00 PM Wednesday: 7:30 AM - 9:00 PM Thursday: 7:30 AM - 9:00 PM Friday: 7:30 AM - 9:00 PM Saturday: 8:00 AM - 6:00 PM Sunday: 12:00 PM - 6:00 PM ","http://www.fedex.com/","32.66559","-97.40135","4.2080875932189","Inkjet Printer Cartridges; Computer (Recycling); Computer Monitors; Electronics; Laptop Computers; Computer Peripherals; Small Televisions; Tablets; Televisions; Video Game Consoles; PlayStation Consoles","false","true","","","false","false","false","false"
"Batteries Plus","Batteries Plus","5733 S Hulen St","Fort Worth","Tarrant","TX","76132","8177447636","0","Monday: 8:00 AM - 8:00 PM Tuesday: 8:00 AM - 8:00 PM Wednesday: 8:00 AM - 8:00 PM Thursday: 8:00 AM - 8:00 PM Friday: 8:00 AM - 8:00 PM Saturday: 8:00 AM - 7:00 PM Sunday: 10:00 AM - 5:00 PM ","http://www.batteriesplus.com/","32.66559","-97.40135","4.2080875932189","Cell Phones; Ni-Cd Batteries; Li-Ion Batteries; Ni-MH Batteries; Ni-Zn Batteries; Small Sealed Lead Acid Batteries; Computer (Recycling); Computer Monitors; Electronics; Laptop Computers; Computer Peripherals; Small Televisions; Tablets; Televisions; Video Game Consoles; PlayStation Consoles","false","true","The U.S. EPA estimates that more than 350 million rechargeable batteries are purchased annually in the U.S. Thanks to the environmental commitment of this location, its easy and free to recycle your batteries. Bring your rechargeable batteries to this location and look for the recycling box or ask an associate how you can do your part for the environment.","","false","false","false","false"
"Bike Mart Trailhead","Bike Mart Trailhead","4801  Edwards Ranch Road","Fort Worth","Tarrant ","TX","76109","8178214780","0","","","32.7069505","-97.3949065","4.22340125944282","E-Bike Batteries","false","true","Call or Check Online for Hours","Call2Recycle","false","false","false","false"
"Firestone Complete Auto Care","","6233 Granbury Rd","Fort Worth","","TX","76133","8173467405","0","","https://www.firestonecompleteautocare.com/","32.6578431","-97.3994585","4.24924959633645","","false","false","","","false","false","false","false"
"Firestone Complete Auto Care Store","Firestone Complete Auto Care Store","6233 Granbury Rd","Fort Worth","Tarrant","TX","76133","8177172878","0","Monday: 7:00 AM - 7:00 PM Tuesday: 7:00 AM - 7:00 PM Wednesday: 7:00 AM - 7:00 PM Thursday: 7:00 AM - 7:00 PM Friday: 7:00 AM - 7:00 PM Saturday: 7:00 AM - 7:00 PM Sunday: 9:00 AM - 5:00 PM ","http://www.firestonecompleteautocare.com/","32.65836","-97.40091","4.31723029784264","Lead Acid (Pb) Batteries; Used Motor Oil; Computer (Recycling); Computer Monitors; Electronics; Laptop Computers; Computer Peripherals; Small Televisions; Tablets; Televisions; Video Game Consoles; PlayStation Consoles","false","true","","","false","false","false","false"
"Goodwill Industries of Fort Worth Inc. - Fort Worth Store","Goodwill Industries of Fort Worth Inc. - Fort Worth Store","6297 Granbury Rd","Fort Worth","Tarrant","TX","76133","8172920740","0","Monday: 9:00 AM - 9:00 PM Tuesday: 9:00 AM - 9:00 PM Wednesday: 9:00 AM - 9:00 PM Thursday: 9:00 AM - 9:00 PM Friday: 9:00 AM - 9:00 PM Saturday: 9:00 AM - 9:00 PM Sunday: 11:00 AM - 7:00 PM ","http://www.goodwillfortworth.org","32.65836","-97.40091","4.31723029784264","Bikes; Books (Reuse); Cell Phones; Clothing; CD/DVD/Blu-ray/UHD discs; Computer (Reuse); Computer Monitors; Computer (Recycling); Electronics; Gift Bags; Eyeglasses; Furniture; Household Goods; Lawn Equipment; Musical Instruments; Office Furniture; Office Equipment; Ornaments; Reusable Appliance Donation; Sporting Goods; Telephones; Televisions; Miscellaneous Tools; Children's Toys; Car Donation; VHS & Cassette Tapes; MP3 Players; Laptop Computers; Computer Peripherals; Small Televisions; Tablets; Video Game Consoles; PlayStation Consoles","false","true","This store will accept gently used items in good, clean, working condition.","","false","false","false","false"
"Albertsons","Albertsons","7400 Oakmont Blvd","Fort Worth","Tarrant County","TX","76132","8174239556","0","","http://albertsons.mywebgrocer.com/","32.6630042","-97.4029189","4.33790359951562","Food Storage Bags; Plastic Shopping Bags; Computer (Recycling); Computer Monitors; Electronics; Laptop Computers; Computer Peripherals; Small Televisions; Tablets; Televisions; Video Game Consoles; PlayStation Consoles","false","true","","","false","false","false","false"
"Walmart Supercenter","","6300 Oakmont Blvd","Fort Worth","","TX","76132","8172634065","0","","https://www.walmart.com/","32.6649828","-97.4049448","4.42131317709297","","false","false","","","false","false","false","false"
"Walmart Tire and Lube Express","","6300 Oakmont Blvd","Fort Worth","","TX","76132","8172634065","0","","https://www.walmart.com/cp/ideas/8932632","32.6649828","-97.4049448","4.42131317709297","","false","false","","","false","false","false","false"
"Walmart 05901","Walmart 05901","6300 Oakmont Blvd","Fort Worth","Tarrant","TX","76132","8583244111","0","","http://www.ecoatm.com/","32.66439","-97.40499","4.43270845618312","Cell Phones; Tablets; MP3 Players; Computer (Recycling); Computer Monitors; Electronics; Laptop Computers; Computer Peripherals; Small Televisions; Televisions; Video Game Consoles; PlayStation Consoles","false","true","ecoATM is an automated, consumer self-serve kiosk that quickly buys back and recycles old phones, mp3 players and tablets.
</br>
Call or email <a href="mailto:max@ecoATM.com">customer support</a> with questions.","","false","false","false","false"
"Kohl's","","5520 Southwest Loop 820","Fort Worth","","TX","76132","8175697550","0","","https://corporate.kohls.com/","32.6855356","-97.4069836","4.46668529480614","","false","false","","","false","false","false","false"
"Lone Star Metals","Lone Star Metals","1401 Stella St","Fort Worth","Tarrant","TX","76104","8175347161","0","","http://lonestarmetals.net/","32.74095","-97.3087","4.50069830295236","Aluminum Cans; Aluminum; Electronics; Ferrous Metals (Steel or Iron); Non-ferrous (Copper/Brass/Tin); Other Batteries; Tin or Steel Cans; Radiators; High-Temp Alloys; Motors; Computer (Recycling); Computer Monitors; Laptop Computers; Computer Peripherals; Small Televisions; Tablets; Televisions; Video Game Consoles; PlayStation Consoles","false","true","","","false","false","false","false"
"Lone Star Metals","","1401 Stella Street","Fort Worth","","TX","76104","8175347161","0","","http://us.emrgroup.com/","32.7412356","-97.3088788","4.51670375342327","","false","false","","","false","false","false","false"
"Best Buy","","5604 SW Loop 820","Fort Worth","","TX","76132","8175701770","0","","https://www.bestbuy.com/site/services/recycling/pcmcat149900050025.c?id=pcmcat149900050025","32.6858412","-97.4088194","4.57510915281761","","false","false","","","false","false","false","false"
"Best Buy","Best Buy","5604 SW Loop 820 ","Fort Worth","Tarrant County","TX","76132","8175701770","0","","https://www.bestbuy.com/recycle","32.6858753","-97.4088181","4.57529580547854","Large Household Appliances; Refrigerators; Televisions; AC Power Plugs; Batteries (Rechargeable); Cables & Connectors; Car Audio/Video Equipment; Cell Phone Batteries; Cell Phones; Computer (Recycling); Hard Drives; Computer Monitors; Cameras; DVD Players/Blu-Ray Players/DVRs; Electronics; E-Readers; GPS Units; Headphones; Inkjet Printer Cartridges; Laptop Computers; Laser Toner Cartridges; Li-Ion Batteries; MP3 Players; Network Equipment; Ni-Cd Batteries; Ni-MH Batteries; Ni-Zn Batteries; Computer Peripherals; Portable Media Players; Printers/Scanners/Fax Machines; Small Electronics; Small Sealed Lead Acid Batteries; Stereo Equipment; Tablets; Telephones; UPS Batteries/Backup Systems; VCRs; Video Game Systems; Blu-Ray Players; Digital Converter Boxes; Small Televisions; Video Game Consoles; PlayStation Consoles","true","true","2 TVs per visit, 3 e-waste items per day; $25 fee for TVs and Monitors; $19.99 pick-up fee with delivery; $99.99 standalone pickup fee; TVs and monitors collected at Best Buy stores are not manufacturer supported in this state, listing provided as an additional option for consumers.","Sony, Vizio, OEM","false","false","false","false"
"S&S Auto Supply","","3411 Miller Avenue","Fort Worth","","TX","76119","8175343221","0","","","32.7117696","-97.2625464","4.5784898458242","","false","false","","","false","false","false","false"
"S&S Auto Supply","S&S Auto Supply","3411 Miller Ave","Fort Worth","Tarrant","TX","76119","8175343221","0","","","32.71187","-97.26249","4.58481034918996","Used Motor Oil; Oil Filters; Computer (Recycling); Computer Monitors; Electronics; Laptop Computers; Computer Peripherals; Small Televisions; Tablets; Televisions; Video Game Consoles; PlayStation Consoles","false","true","","","false","false","false","false"
