name,description,address,city,region,province,postal_code,phone,fax,hours,url,latitude,longitude,distance,materials,pickup,dropoff,notes,groups,curbside,municipal,national,event_only
"NAPA Auto Parts","NAPA Auto Parts","800 SE 1st St","Mineral Wells","Palo Pinto","TX","76067","9403259564","0","Monday: 8:00 AM - 6:00 PM Tuesday: 8:00 AM - 6:00 PM Wednesday: 8:00 AM - 6:00 PM Thursday: 8:00 AM - 6:00 PM Friday: 8:00 AM - 6:00 PM Saturday: 8:00 AM - 5:00 PM ","","32.80831","-98.10513","48.8233524490692","Used Motor Oil; Oil Filters; Computer (Recycling); Computer Monitors; Electronics; Laptop Computers; Computer Peripherals; Small Televisions; Tablets; Televisions; Video Game Consoles; PlayStation Consoles","false","true","","","false","false","false","false"
"USPS Post Office Box Lobby Recycling Program","US Post Office","600 Center Ave","Brownwood","Brown","TX","76804","8002758777","0","","https://www.usps.com/","31.71872","-98.98417","49.100890107016","Catalogs; Greeting Cards; Magazines; Paper (Mixed)","false","true","","","false","false","false","false"
"US Post Office","USPS Discarded Lobby Mail Recycling Program","600 Center Ave","Brownwood","Brown","TX","76804","0","0","","","31.71872","-98.98417","49.100890107016","Computer (Recycling); Computer Monitors; Electronics; Laptop Computers; Computer Peripherals; Small Televisions; Tablets; Televisions; Video Game Consoles; PlayStation Consoles","false","true","","","false","false","false","false"
"O'Reilly Auto Parts","null","1501 East Hubbard Street ","Mineral Wells","","TX","76067","9403256488","0","","http://oreillyauto.custhelp.com/app/error/error_id/6","32.8096295","-98.0991727","49.1614195885976","","false","false","","","false","false","false","false"
"RadioShack","","1704 Se 1St St","Mineral Wells","","TX","76067","9403259775","0","","","32.8080108","-98.0971255","49.1982914494879","","false","false","","","false","false","false","false"
"Mineral Wells/True Value Hardware","","1812 Southeast 1st Street","Mineral Wells","","TX","76067","9403255233","0","","https://www.truevalue.com/","32.8078365","-98.0957608","49.2576649876845","","false","false","","","false","false","false","false"
"Keep Brownwood Beautiful Recycling Drop-off Site","","Brady Ave & Ave A","Brownwood","","TX","76801","3256410533","0","","","31.7140228","-98.981","49.3773475044987","","false","false","","","false","false","false","false"
"AutoZone","","2401 E Hubbard St","Mineral Wells","","TX","76067","9403259169","0","","https://www.autozone.com/landing/page.jsp?name=in-our-stores","32.8096329","-98.0937137","49.4253319077757","","false","false","","","false","false","false","false"
"AutoZone","AutoZone","2401 E Hubbard St","Mineral Wells","Palo Pinto","TX","76067","8173259204","0","","http://www.autozone.com","32.80923","-98.09299","49.4449699241427","Lead Acid (Pb) Batteries; Used Motor Oil; Computer (Recycling); Computer Monitors; Electronics; Laptop Computers; Computer Peripherals; Small Televisions; Tablets; Televisions; Video Game Consoles; PlayStation Consoles","false","true","Most AutoZone stores accept used motor oil, transmission fluid, gear oil and automotive batteries. Call to see what your local store is currently accepting.","","false","false","false","false"
"Brownwood Iron & Metal Co","Brownwood Iron & Metal Co","1500 Melwood Ave","Brownwood","Brown","TX","76801","3256467058","0","","","31.71475","-98.99393","49.4967117837779","Aluminum; Ferrous Metals (Steel or Iron); Non-ferrous (Copper/Brass/Tin); High-Temp Alloys; Special Metals; Computer (Recycling); Computer Monitors; Electronics; Laptop Computers; Computer Peripherals; Small Televisions; Tablets; Televisions; Video Game Consoles; PlayStation Consoles","false","true","","","false","false","false","false"
"Cordy Tire","Cordy Tire","609 4th St","Graham","Young","TX","76450","9405494582","0","Monday: 8:00 AM - 5:00 PM Tuesday: 8:00 AM - 5:00 PM Wednesday: 8:00 AM - 5:00 PM Thursday: 8:00 AM - 5:00 PM Friday: 8:00 AM - 5:00 PM Saturday: 8:00 AM - 12:00 PM ","","33.10713","-98.58889","49.5641529348196","Used Motor Oil; Oil Filters; Used Tires; Computer (Recycling); Computer Monitors; Electronics; Laptop Computers; Computer Peripherals; Small Televisions; Tablets; Televisions; Video Game Consoles; PlayStation Consoles","false","true","","","false","false","false","false"
"Tractor Supply","Tractor Supply","200 Garrett Morris PKWY","Mineral Wells","Palo Pinto","TX","76067","9403256312","0","","http://www.tractorsupply.com","32.80535","-98.08602","49.6363654578278","Transmission Fluid; Used Motor Oil; Computer (Recycling); Computer Monitors; Electronics; Laptop Computers; Computer Peripherals; Small Televisions; Tablets; Televisions; Video Game Consoles; PlayStation Consoles","false","true","","","false","false","false","false"
"AutoZone","","315 Elm St","Graham","","TX","76450","9405498429","0","","https://www.autozone.com/landing/page.jsp?name=in-our-stores","33.1106083","-98.5889722","49.7958175103559","","false","false","","","false","false","false","false"
"Tractor Supply","","200 Garrett Morris Parkway","Mineral Wells","","TX","76067","9403256312","0","","https://www.tractorsupply.com/","32.8080651","-98.0834364","49.864420637504","","false","false","","","false","false","false","false"
"Walmart Supercenter","","601 FM 1821","Mineral Wells","","TX","76067","9403257808","0","","https://www.walmart.com/","32.8135748","-98.0862508","49.9369987271306","","false","false","","","false","false","false","false"
"Walmart Tire and Lube Express","","601 Fm 1821","Mineral Wells","","TX","76067","9403257808","0","","https://www.walmart.com/cp/ideas/8932632","32.8135748","-98.0862508","49.9369987271306","","false","false","","","false","false","false","false"
"Walgreens","Walgreens","201 FM 1821","Mineral Wells","Palo Pinto","TX","76067","9403256084","0","","http://www.walgreens.com","32.81083","-98.07984","50.1437003521531","Cell Phones; Inkjet Printer Cartridges; Computer (Recycling); Computer Monitors; Electronics; Laptop Computers; Computer Peripherals; Small Televisions; Tablets; Televisions; Video Game Consoles; PlayStation Consoles","false","true","","","false","false","false","false"
"Tractor Supply","null","1551 Fourth ST","Graham","","TX","76450","9405210389","0","","https://www.tractorsupply.com/","33.1117445","-98.5642901","50.2431526114953","","false","false","","","false","false","false","false"
"Walmart Tire & Lube Express","Walmart Tire & Lube Express","601 FM 1821","Mineral Wells","Palo Pinto","TX","76067","9403257808","0","","http://www.walmart.com/catalog/catalog.gsp?cat=495843","32.81945","-98.07381","50.7633843117491","Lead Acid (Pb) Batteries; Used Motor Oil; Oil Filters; Computer (Recycling); Computer Monitors; Electronics; Laptop Computers; Computer Peripherals; Small Televisions; Tablets; Televisions; Video Game Consoles; PlayStation Consoles","false","true","","","false","false","false","false"
"Liberty Metal Recycling","","4100 Liberty Boulevard","Abilene","","TX","79601","9363364152","0","","http://us.emrgroup.com/","32.4901465","-99.6850233","51.8975013642369","","false","false","","","false","false","false","false"
"USPS Post Office Box Lobby Recycling Program","US Post Office","103 Fairview Rd","Millsap","Parker","TX","76066","8002758777","0","","https://www.usps.com/","32.74609","-97.99888","52.0234606128711","Catalogs; Greeting Cards; Magazines; Paper (Mixed)","false","true","","","false","false","false","false"
"Lowe's","","1634 E Musgrave Blvd","Abilene","","TX","79601","3256905670","0","","https://newsroom.lowes.com/responsibility/operational-excellence/","32.4760944","-99.6929657","52.2709078962899","Batteries (Rechargeable); Cell Phone Batteries; Li-Ion Batteries; Ni-Cd Batteries; Ni-MH Batteries; Small Sealed Lead Acid Batteries; Cell Phones","false","true","","Call2Recycle","false","false","false","false"
"Call2Recycle at Lowe's","Call2Recycle at Lowe's","1634 E Musgrave Blvd","Abilene","Taylor","TX","79601","3256905670","0","Monday: 6:00 AM - 10:00 PM Tuesday: 6:00 AM - 10:00 PM Wednesday: 6:00 AM - 10:00 PM Thursday: 6:00 AM - 10:00 PM Friday: 6:00 AM - 10:00 PM Saturday: 6:00 AM - 10:00 PM Sunday: 8:00 AM - 8:00 PM ","http://www.lowes.com/","32.47593","-99.69299","52.2714058779564","Cell Phones; Compact Fluorescent Lights; Ni-Cd Batteries; Plastic Shopping Bags; Li-Ion Batteries; Ni-MH Batteries; Ni-Zn Batteries; Small Sealed Lead Acid Batteries; Computer (Recycling); Computer Monitors; Electronics; Laptop Computers; Computer Peripherals; Small Televisions; Tablets; Televisions; Video Game Consoles; PlayStation Consoles","false","true","As an environmentally-committed retailer, Lowes offers a recycling center near store entrances to give consumers a free and easy way to properly dispose of rechargeable batteries, cell phones, CFLs and plastic shopping bags; materials that otherwise could be potentially harmful to the environment.  Look for the recycling center or ask a store associate for more details.","","false","false","false","false"
"RadioShack","","1648 State Hwy 351","Abilene","","TX","79601","3256722531","0","","","32.4791129","-99.6972534","52.5371335863523","","false","false","","","false","false","false","false"
"Walmart Tire and Lube Express","","1650 State Highway 351","Abilene","","TX","79601","3256775584","0","","https://www.walmart.com/cp/ideas/8932632","32.4807838","-99.6980152","52.5911999066522","","false","false","","","false","false","false","false"
"Walmart Supercenter","","1650 State Highway 351","Abilene","","TX","79601","3256775584","0","","https://www.walmart.com/","32.4807838","-99.6980152","52.5911999066522","","false","false","","","false","false","false","false"
"Lone Star Unlimited","Lone Star Unlimited","997 E N 10th St ","Abilene","Taylor County","TX","79601","9156959292","0","","","32.459835","-99.7064571","52.977563817178","Used Motor Oil; Oil Filters; Computer (Recycling); Computer Monitors; Electronics; Laptop Computers; Computer Peripherals; Small Televisions; Tablets; Televisions; Video Game Consoles; PlayStation Consoles","false","true","","","false","false","false","false"
"City of Brownwood Recycling Center","","6800 FM-45 S","Brownwood","","TX","76804","3256418832","0","","http://www.ci.brownwood.tx.us/149/Portal","31.6463879","-98.9595677","53.7181081638937","","false","false","","","false","false","false","false"
"City of Brownwood Christmas Tree Drop-Off Site","","6800 FM 45 S","Brownwood","","TX","76801","3256418832","0","","http://www.ci.brownwood.tx.us/149/Portal","31.6463879","-98.9595677","53.7181081638937","","false","false","","","false","false","false","false"
"Effluent Recycling Ranger Plant","","1117 South Commerce Street","Ranger","","TX","76470","8174418344","0","","","32.4525423","-98.6912862","6.91473934335745","","false","false","","","false","false","false","false"
"Effluent Recycling Ranger Plant","Effluent Recycling Ranger Plant","1117 S Commerce St","Ranger","Eastland","TX","76470","8174418344","0","","","32.45778","-98.6867","7.30907367861828","Used Motor Oil; Oil Filters; Computer (Recycling); Computer Monitors; Electronics; Laptop Computers; Computer Peripherals; Small Televisions; Tablets; Televisions; Video Game Consoles; PlayStation Consoles","false","true","","","false","false","false","false"
