name,description,address,city,region,province,postal_code,phone,fax,hours,url,latitude,longitude,distance,materials,pickup,dropoff,notes,groups,curbside,municipal,national,event_only
"Walmart Supercenter","","1410 E Main St","Eastland","","TX","76448","2546293371","0","","https://www.walmart.com/","32.4047064","-98.7930432","0.635631823271558","","false","false","","","false","false","false","false"
"AutoZone","","1301 E Main St","Eastland","","TX","76448","2546298240","0","","https://www.autozone.com/landing/page.jsp?name=in-our-stores","32.4012016","-98.7973923","0.757590329387639","","false","false","","","false","false","false","false"
"Tractor Supply","","1401 East Main Street","Eastland","","TX","76448","2546292088","0","","https://www.tractorsupply.com/","32.400633","-98.7948525","0.834163518563874","","false","false","","","false","false","false","false"
"O'Reilly Auto Parts","null","1405 E Main St Suite 180","Eastland","","TX","76448","2546292248","0","","http://oreillyauto.custhelp.com/app/error/error_id/6","32.4007053","-98.7938193","0.851879369335231","","false","false","","","false","false","false","false"
"O'Reilly Auto Parts","O'Reilly Auto Parts","1405 E Main St Suite 180","Eastland","Eastland County","TX","76448","2546292248","0","","http://www.oreillyauto.com/","32.4006666","-98.7936764","0.857706332255459","Used Motor Oil; Oil Filters; Computer (Recycling); Computer Monitors; Electronics; Laptop Computers; Computer Peripherals; Small Televisions; Tablets; Televisions; Video Game Consoles; PlayStation Consoles","false","true","Most stores offer Used Oil & Battery Recycling, Battery Testing, 
Electrical & Module Testing, Loaner Tool Program, Drum / Rotor Resurfacing. Call your location for more details.","","false","false","false","false"
"Goodwill Industries of Abilene - Dell Reconnect Donation Site","","2000 IH-20W","Eastland","","TX","76448","2546298611","0","","https://www.goodwillwesttexas.org/","32.4015198","-98.8175623","1.26872185877539","","false","false","","","false","false","false","false"
"RadioShack","","105 W Main","Eastland","","TX","76448","2546298942","0","","","32.4020115","-98.8184032","1.29084458862167","","false","false","","","false","false","false","false"
"O'Reilly Auto Parts","null","1517 West Walker Street","Breckenridge","","TX","76424","2545592566","0","","http://oreillyauto.custhelp.com/app/error/error_id/6","32.755006","-98.9228527","24.7595495003181","","false","false","","","false","false","false","false"
"Walmart Tire & Lube Express","Walmart Tire & Lube Express","3800 W Walker St, ","Breckenridge","Stephens","TX","76424","2545596579","0","","http://www.walmart.com/catalog/catalog.gsp?cat=495843","32.75785","-98.92266","24.9444336465248","Lead Acid (Pb) Batteries; Used Motor Oil; Oil Filters; Computer (Recycling); Computer Monitors; Electronics; Laptop Computers; Computer Peripherals; Small Televisions; Tablets; Televisions; Video Game Consoles; PlayStation Consoles","false","true","","","false","false","false","false"
"Walmart","","3732 W Walker St","Breckenridge","","TX","76424","2545596579","0","","https://www.walmart.com/","32.760338","-98.9448071","25.50662208385","","false","false","","","false","false","false","false"
"Walmart Tire and Lube Express","","3732 W Walker St","Breckenridge","","TX","76424","2545596579","0","","https://www.walmart.com/cp/ideas/8932632","32.760338","-98.9448071","25.50662208385","","false","false","","","false","false","false","false"
"The UPS Store","The UPS Store","601 TX-206 ","Cross Plains","Callahan County","TX","76443","9088746200","0","Monday: 8:30 AM - 7:00 PM Tuesday: 8:30 AM - 7:00 PM Wednesday: 8:30 AM - 7:00 PM Thursday: 8:30 AM - 7:00 PM Friday: 8:30 AM - 7:00 PM Saturday: 8:00 AM - 5:00 PM ","http://www.ups.com","32.1300017","-99.1653713","28.912095874509","Plastics (Other); Packing Peanut (Reuse); Computer (Recycling); Computer Monitors; Electronics; Laptop Computers; Computer Peripherals; Small Televisions; Tablets; Televisions; Video Game Consoles; PlayStation Consoles","false","true","","","false","false","false","false"
"Erath Iron & Metal","Erath Iron & Metal","251 County Road 378","Stephenville","Erath","TX","76401","2549686401","0","","null","32.18209","-98.26952","34.7993341086974","Aluminum; Ferrous Metals (Steel or Iron); Non-ferrous (Copper/Brass/Tin); Scrap Metal; High-Temp Alloys; Special Metals; Computer (Recycling); Computer Monitors; Electronics; Laptop Computers; Computer Peripherals; Small Televisions; Tablets; Televisions; Video Game Consoles; PlayStation Consoles","false","true","","","false","false","false","false"
"Erath Iron and Metal Inc.","","6970 U.S. 377","Stephenville","","TX","76401","0","0","","","32.1810219","-98.2689799","34.8612819540741","","false","false","","","false","false","false","false"
"Tractor Supply","null","2900 West Washington Street, # 35","Stephenville","","TX","76401","2549658900","0","","https://www.tractorsupply.com/","32.2007434","-98.2442003","35.5703834516129","","false","false","","","false","false","false","false"
"RadioShack","","2900 W Washington St #74","Stephenville","","TX","76401","2549687495","0","","","32.2007434","-98.2442003","35.5703834516129","","false","false","","","false","false","false","false"
"JCPenney","","2900 W Washington St","Stephenville","","TX","76401","2549653171","0","","https://www.jcpenney.com/","32.2007434","-98.2442003","35.5703834516129","","false","false","","","false","false","false","false"
"Tractor Supply","Tractor Supply","2900 West Washington #35","Stephenville","Erath","TX","76401","2549658900","0","","http://www.tractorsupply.com","32.20231","-98.24332","35.5727959364189","Transmission Fluid; Used Motor Oil; Computer (Recycling); Computer Monitors; Electronics; Laptop Computers; Computer Peripherals; Small Televisions; Tablets; Televisions; Video Game Consoles; PlayStation Consoles","false","true","","","false","false","false","false"
"AT&T Wireless","AT&T Wireless","2811 W Washington St","Stephenville","Erath","TX","76401","2549682020","0","","http://www.att.com/","32.20256","-98.24315","35.5747928902603","Cell Phones; Ni-Cd Batteries; Batteries (Rechargeable); Cell Phone Batteries; Tablets; Li-Ion Batteries; Computer (Recycling); Computer Monitors; Electronics; Laptop Computers; Computer Peripherals; Small Televisions; Televisions; Video Game Consoles; PlayStation Consoles","false","true","Receive an AT&T Promotion Card worth the trade-in value of your smartphone, tablet, or netbook. You can also donate the trade-in value to Cell Phones for Soldiers.","","false","false","false","false"
"City of Stephenville Christmas Tree Recycling Event - Jaycee City Park","","1380 N Harbin Dr","Stephenville","","TX","76401","2549181292","0","","","32.2237112","-98.231915","35.6121898964062","","false","false","","","false","false","false","false"
"Staples","Staples","200 Wolfe Nursery Road","Stephenville","Erath County","TX","76401","2549658500","0","Monday: 9:00 AM - 8:00 PM Tuesday: 9:00 AM - 8:00 PM Wednesday: 9:00 AM - 8:00 PM Thursday: 9:00 AM - 8:00 PM Friday: 9:00 AM - 8:00 PM Saturday: 10:00 AM - 7:00 PM Sunday: 11:00 AM - 6:00 PM ","https://www.staples.com/recycle","32.2060471","-98.2398415","35.6539687174992","AC Power Plugs; Batteries (Rechargeable); Cables & Connectors; Cell Phone Batteries; Cell Phones; Computer (Recycling); Hard Drives; Computer Monitors; Cameras; DVD Players/Blu-Ray Players/DVRs; Electronics; E-Readers; GPS Units; Headphones; Inkjet Printer Cartridges; Laptop Computers; Laser Toner Cartridges; Li-Ion Batteries; MP3 Players; Network Equipment; Ni-Cd Batteries; Ni-MH Batteries; Ni-Zn Batteries; Computer Peripherals; Portable Media Players; Printers/Scanners/Fax Machines; Small Electronics; Small Sealed Lead Acid Batteries; Stereo Equipment; Tablets; Telephones; UPS Batteries/Backup Systems; VCRs; Video Game Systems; Blu-Ray Players; Digital Converter Boxes; Small Televisions; Televisions; Video Game Consoles; PlayStation Consoles; Alkaline/Single-Use Batteries","false","true","NO TVs; Limit 6 CEDs per day; ","Sony, Vizio, OEM","false","false","false","false"
"Staples","","200 Wolfe Nursery Road","Stephenville","","TX","76401","2549658500","0","","https://www.staples.com/sbd/cre/marketing/sustainability-center/recycling-services/","32.2060471","-98.2398415","35.6539687174992","Alkaline/Single-Use Batteries; Batteries (Rechargeable); Cell Phone Batteries; Li-Ion Batteries; Ni-Cd Batteries; Ni-MH Batteries; Small Sealed Lead Acid Batteries; Alkaline/Single-Use Batteries; Button Batteries; Non-rechargeable lithium batteries; Cell Phones","false","true","","Call2Recycle","false","false","false","false"
"Walmart Supercenter","","2765 W Washington St","Stephenville","","TX","76401","2549657766","0","","https://www.walmart.com/","32.2073201","-98.2378758","35.7241281233654","","false","false","","","false","false","false","false"
"Walmart Tire and Lube Express","","2765 W Washington St","Stephenville","","TX","76401","2549657766","0","","https://www.walmart.com/cp/ideas/8932632","32.2073201","-98.2378758","35.7241281233654","","false","false","","","false","false","false","false"
"O'Reilly Auto Parts","O'Reilly Auto Parts","2609 W Washington St","Stephenville","Erath","TX","76401","2549657644","0","","http://www.oreillyauto.com/","32.20608","-98.23334","36.001483923252","Used Motor Oil; Oil Filters; Computer (Recycling); Computer Monitors; Electronics; Laptop Computers; Computer Peripherals; Small Televisions; Tablets; Televisions; Video Game Consoles; PlayStation Consoles","false","true","Most stores offer Used Oil & Battery Recycling, Battery Testing, 
Electrical & Module Testing, Loaner Tool Program, Drum / Rotor Resurfacing. Call your location for more details.","","false","false","false","false"
"O'Reilly Auto Parts","null","2609 West Washington","Stephenville","","TX","76401","2549657644","0","","http://oreillyauto.custhelp.com/app/error/error_id/6","32.2069259","-98.2324491","36.0261120951193","","false","false","","","false","false","false","false"
"Walmart Tire & Lube Express","Walmart Tire & Lube Express","2765 W Washington St","Stephenville","Erath","TX","76401","2549657766","0","","http://www.walmart.com/catalog/catalog.gsp?cat=495843","32.20671","-98.23209","36.0512942198283","Lead Acid (Pb) Batteries; Used Motor Oil; Oil Filters; Computer (Recycling); Computer Monitors; Electronics; Laptop Computers; Computer Peripherals; Small Televisions; Tablets; Televisions; Video Game Consoles; PlayStation Consoles","false","true","","","false","false","false","false"
"United Cellular, Inc.","","2101 W Washington St","Stephenville","","TX","76401","2549680118","0","","","32.2104869","-98.2251002","36.3254396066428","","false","false","","","false","false","false","false"
"H-E-B","","2150 W Washington","Stephenville","","TX","76401","2549657063","0","","","32.2084038","-98.2253139","36.3696889248944","","false","false","","","false","false","false","false"
"Kwik Kar Oil & Lube","Kwik Kar Oil & Lube","1595 N Graham St","Stephenville","Erath","TX","76401","2549688200","0","Sunday: 12:00 AM - 11:59 PM Monday: 12:00 AM - 11:59 PM Tuesday: 12:00 AM - 11:59 PM Wednesday: 12:00 AM - 11:59 PM Thursday: 12:00 AM - 11:59 PM Friday: 12:00 AM - 11:59 PM Saturday: 12:00 AM - 11:59 PM ","","32.23158","-98.20955","36.6409866022433","Used Motor Oil; Computer (Recycling); Computer Monitors; Electronics; Laptop Computers; Computer Peripherals; Small Televisions; Tablets; Televisions; Video Game Consoles; PlayStation Consoles","false","true","","","false","false","false","false"
"City of Stephenville Recycling Convenience Center - IESI Complex","","1291 N Bates","Stephenville","","TX","76401","2549687070","0","","","32.2315227","-98.2052576","36.878097939668","","false","false","","","false","false","false","false"
"USPS Post Office Box Lobby Recycling Program","US Post Office","431 N Graham St","Stephenville","Erath","TX","76401","8002758777","0","","https://www.usps.com/","32.22232","-98.20317","37.2136010697659","Catalogs; Greeting Cards; Magazines; Paper (Mixed)","false","true","","","false","false","false","false"
"US Post Office","USPS Discarded Lobby Mail Recycling Program","431 N Graham St","Stephenville","Erath","TX","76401","0","0","","","32.22232","-98.20317","37.2136010697659","Computer (Recycling); Computer Monitors; Electronics; Laptop Computers; Computer Peripherals; Small Televisions; Tablets; Televisions; Video Game Consoles; PlayStation Consoles","false","true","","","false","false","false","false"
"City of Stephenville Household Hazardous Waste Collection Program","","","Stephenville","","TX","76401","2549181230","0","","","32.2206958","-98.2022633","37.303058272543","","false","false","","","false","false","false","false"
"RadioShack","","101 N Houston","Comanche","","TX","76442","3253562545","0","","","31.897638","-98.605357","37.3105681211877","","false","false","","","false","false","false","false"
"AutoZone","null","2008 W Washington St","Stephenville","","TX","76401","2549682119","0","","https://www.autozone.com/landing/page.jsp?name=in-our-stores","32.2310519","-98.1833495","38.0950756444095","","false","false","","","false","false","false","false"
"Stephenville Iron and Metal","","3229 N US HIGHWAY 377","Stephenville","","TX","76401","2549684766","0","","https://stephenvillemetals.com/","32.232016","-98.1708171","38.765400778918","","false","false","","","false","false","false","false"
"Big Country Used Oil Recyclers","Big Country Used Oil Recyclers","2906 County Road 281","Baird","Callahan","TX","79504","9156729903","0","","","32.39002","-99.46688","38.9490221269792","Antifreeze; Used Motor Oil; Oil Filters; Computer (Recycling); Computer Monitors; Electronics; Laptop Computers; Computer Peripherals; Small Televisions; Tablets; Televisions; Video Game Consoles; PlayStation Consoles","false","true","","","false","false","false","false"
"Abilene Goodwill Industries Retail Store","Abilene Goodwill Industries Retail Store","125 S Access Rd","Clyde","Callahan","TX","79510","3258932743","0","Monday: 9:00 AM - 7:00 PM Tuesday: 9:00 AM - 7:00 PM Wednesday: 9:00 AM - 7:00 PM Thursday: 9:00 AM - 7:00 PM Friday: 9:00 AM - 7:00 PM Saturday: 9:00 AM - 7:00 PM ","http://www.goodwill.org/","32.4112885","-99.4904638","40.2904375485802","Bikes; Books (Reuse); Cell Phones; Clothing; CD/DVD/Blu-ray/UHD discs; Computer (Reuse); Computer Monitors; Electronics; Gift Bags; Furniture; Household Goods; Lawn Equipment; Musical Instruments; Office Furniture; Office Equipment; Ornaments; Reusable Appliance Donation; Sporting Goods; Telephones; Televisions; Miscellaneous Tools; Children's Toys; Car Donation; VHS & Cassette Tapes; MP3 Players; Computer (Recycling); Laptop Computers; Computer Peripherals; Small Televisions; Tablets; Video Game Consoles; PlayStation Consoles","false","true","This site accepts gently used items that are in good, workable, and reuseable condition.","","false","false","false","false"
"Goodwill Industries of Abilene - Dell Reconnect Donation Site","","125 South Access Road","Clyde","","TX","79510","3258932743","0","","https://www.goodwillwesttexas.org/","32.4123961","-99.4958372","40.6035816766586","","false","false","","","false","false","false","false"
"City of Abilene Recycling Drop-Off Site","","Hwy 351","Abilene","","TX","79601","3256722209","0","","http://abilenetx.gov","32.5336732","-99.5935894","47.0314103426055","","false","false","","","false","false","false","false"
"JCPenney","","300 Early Blvd","Early","","TX","76802","3256463537","0","","https://www.jcpenney.com/","31.7380764","-98.9612807","47.5121243305147","","false","false","","","false","false","false","false"
"AT&T Wireless","AT&T Wireless","300 Early Blvd","Early","Brown","TX","76802","3256419278","0","","http://www.att.com/","31.73557","-98.96255","47.696660714016","Cell Phones; Ni-Cd Batteries; Batteries (Rechargeable); Cell Phone Batteries; Tablets; Li-Ion Batteries; Computer (Recycling); Computer Monitors; Electronics; Laptop Computers; Computer Peripherals; Small Televisions; Televisions; Video Game Consoles; PlayStation Consoles","false","true","Receive an AT&T Promotion Card worth the trade-in value of your smartphone, tablet, or netbook. You can also donate the trade-in value to Cell Phones for Soldiers.","","false","false","false","false"
"Walmart","Walmart","2121 State Highway 16 S","Graham","Young","TX","76450","9405497714","0","","http://www.walmart.com","33.08059","-98.58258","47.8852881613124","Lead Acid (Pb) Batteries; Plastic Shopping Bags; Food Storage Bags; Computer (Recycling); Computer Monitors; Electronics; Laptop Computers; Computer Peripherals; Small Televisions; Tablets; Televisions; Video Game Consoles; PlayStation Consoles","false","true","","","false","false","false","false"
"Walmart Tire & Lube Express","Walmart Tire & Lube Express","2121 State Highway 16 S","Graham","Young","TX","76450","9405497714","0","","http://www.walmart.com/catalog/catalog.gsp?cat=495843","33.08059","-98.58258","47.8852881613124","Lead Acid (Pb) Batteries; Used Motor Oil; Oil Filters; Computer (Recycling); Computer Monitors; Electronics; Laptop Computers; Computer Peripherals; Small Televisions; Tablets; Televisions; Video Game Consoles; PlayStation Consoles","false","true","","","false","false","false","false"
"O'Reilly Auto Parts","null","106 Early Boulevard","Early","","TX","76802","3256464632","0","","http://oreillyauto.custhelp.com/app/error/error_id/6","31.7329558","-98.9706426","47.9702725923329","","false","false","","","false","false","false","false"
"Walmart Tire and Lube Express","","2121 State Highway 16","Graham","","TX","76450","9405497714","0","","https://www.walmart.com/cp/ideas/8932632","33.0822476","-98.5808584","48.022137394788","","false","false","","","false","false","false","false"
"Walmart Supercenter","","2121 State Highway 16","Graham","","TX","76450","9405497714","0","","https://www.walmart.com/","33.0822476","-98.5808584","48.022137394788","","false","false","","","false","false","false","false"
"Home Depot","","100 Market Pl Blvd","Brownwood","","TX","76801","3256431381","0","","https://ecooptions.homedepot.com/","31.73157","-98.97938","48.1730416366192","","false","false","","","false","false","false","false"
"Walmart Supercenter","","401 W Commerce St","Brownwood","","TX","76801","3256439727","0","","https://www.walmart.com/","31.7320215","-98.9819905","48.1762209678717","","false","false","","","false","false","false","false"
"Walmart Tire and Lube Express","","401 W Commerce St","Brownwood","","TX","76801","3256439727","0","","https://www.walmart.com/cp/ideas/8932632","31.7320215","-98.9819905","48.1762209678717","","false","false","","","false","false","false","false"
"AutoZone","null","311 E Commerce St","Brownwood","","TX","76801","3256462296","0","","https://www.autozone.com/landing/page.jsp?name=in-our-stores","31.7297001","-98.975475","48.2498683276668","","false","false","","","false","false","false","false"
"Call2Recycle at the Home Depot","Call2Recycle at the Home Depot","100 Market Place Blvd","Brownwood","Brown","TX","76801","3256431381","0","","http://www.homedepot.com/","31.73172","-98.98992","48.3014570382798","Cell Phones; Compact Fluorescent Lights; Ni-Cd Batteries; Li-Ion Batteries; Ni-MH Batteries; Ni-Zn Batteries; Small Sealed Lead Acid Batteries; Computer (Recycling); Computer Monitors; Electronics; Laptop Computers; Computer Peripherals; Small Televisions; Tablets; Televisions; Video Game Consoles; PlayStation Consoles; Batteries (Rechargeable); Cell Phone Batteries; Li-Ion Batteries; Ni-Cd Batteries; Ni-MH Batteries; Small Sealed Lead Acid Batteries","false","true","The Home Depot accepts used rechargeable batteries and compact fluorescent bulbs. Look for the orange drop boxes, usually located near the front entrance near the customer service desk, or ask a store associate for more details.","Call2Recycle","false","false","false","false"
"Staples","","531 West Commerce Street","Brownwood","","TX","76801","3256431200","0","","https://www.staples.com/sbd/cre/marketing/sustainability-center/recycling-services/","31.7310253","-98.9866489","48.304418695479","","false","false","","","false","false","false","false"
"Tractor Supply","","315-A East Commerce Street","Brownwood","","TX","76801","3256432256","0","","https://www.tractorsupply.com/","31.7280389","-98.9733608","48.335837623552","","false","false","","","false","false","false","false"
"Firestone Complete Auto Care","","509 W Commerce Square","Brownwood","","TX","76801","3256466513","0","","https://www.firestonecompleteautocare.com/","31.7298255","-98.9843207","48.3545250960471","","false","false","","","false","false","false","false"
"Kwik Kar Lube & Tune","Kwik Kar Lube & Tune","212 E Commerce St","Brownwood","Brown","TX","76801","9156436415","0","","","31.72868","-98.97849","48.3566424413553","Antifreeze; Used Motor Oil; Oil Filters; Computer (Recycling); Computer Monitors; Electronics; Laptop Computers; Computer Peripherals; Small Televisions; Tablets; Televisions; Video Game Consoles; PlayStation Consoles","false","true","","","false","false","false","false"
"RadioShack","","1103 Clements St #8","Brownwood","","TX","76801","3256466123","0","","","31.728931","-98.9805054","48.3653968975883","","false","false","","","false","false","false","false"
"AT&T Wireless","AT&T Wireless","1107 Riverside Dr","Brownwood","Brown","TX","76801","3256432355","0","","http://www.att.com/","31.72835","-98.97779","48.3700551583208","Cell Phones; Ni-Cd Batteries; Batteries (Rechargeable); Cell Phone Batteries; Tablets; Li-Ion Batteries; Computer (Recycling); Computer Monitors; Electronics; Laptop Computers; Computer Peripherals; Small Televisions; Televisions; Video Game Consoles; PlayStation Consoles","false","true","Receive an AT&T Promotion Card worth the trade-in value of your smartphone, tablet, or netbook. You can also donate the trade-in value to Cell Phones for Soldiers.","","false","false","false","false"
"USPS Post Office Box Lobby Recycling Program","US Post Office","200 SW 1st Ave","Mineral Wells","Palo Pinto","TX","76067","8002758777","0","","https://www.usps.com/","32.80774","-98.11389","48.3799439447985","Catalogs; Greeting Cards; Magazines; Paper (Mixed)","false","true","","","false","false","false","false"
"AutoZone","AutoZone","311 E Commerce St","Brownwood","Brown","TX","76801","3256462296","0","","http://www.autozone.com","31.72898","-98.98481","48.4178794186125","Lead Acid (Pb) Batteries; Used Motor Oil; Computer (Recycling); Computer Monitors; Electronics; Laptop Computers; Computer Peripherals; Small Televisions; Tablets; Televisions; Video Game Consoles; PlayStation Consoles","false","true","Most AutoZone stores accept used motor oil, transmission fluid, gear oil and automotive batteries. Call to see what your local store is currently accepting.","","false","false","false","false"
"Walmart Tire & Lube Express","Walmart Tire & Lube Express","401 W Commerce St","Brownwood","Brown","TX","76801","3256439727","0","","http://www.walmart.com/catalog/catalog.gsp?cat=495843","31.72909","-98.98569","48.4220307936923","Lead Acid (Pb) Batteries; Used Motor Oil; Oil Filters; Computer (Recycling); Computer Monitors; Electronics; Laptop Computers; Computer Peripherals; Small Televisions; Tablets; Televisions; Video Game Consoles; PlayStation Consoles","false","true","","","false","false","false","false"
"Firestone Complete Auto Care Store","Firestone Complete Auto Care Store","509 W Commerce St","Brownwood","Brown","TX","76801","3256466513","0","","http://www.firestonecompleteautocare.com/","31.72926","-98.98692","48.4268326893915","Lead Acid (Pb) Batteries; Used Motor Oil; Computer (Recycling); Computer Monitors; Electronics; Laptop Computers; Computer Peripherals; Small Televisions; Tablets; Televisions; Video Game Consoles; PlayStation Consoles","false","true","","","false","false","false","false"
"Box-N-Mail Express","","901 N Fisk Ave","Brownwood","","TX","76801","3256431037","0","","","31.7263101","-98.9797035","48.5319169507314","","false","false","","","false","false","false","false"
"Goodwill Industries of Abilene - Dell Reconnect Donation Site","","829 West Commerce","Brownwood","","TX","76801","3256439896","0","","https://www.goodwillwesttexas.org/","31.7293192","-98.9958432","48.5437705462135","","false","false","","","false","false","false","false"
"O'Reilly Auto Parts","O'Reilly Auto Parts","1118 State Highway 16s","Graham","Young","TX","76450","9405219550","0","","http://www.oreillyauto.com/","33.09298","-98.58892","48.6172565099372","Used Motor Oil; Oil Filters; Computer (Recycling); Computer Monitors; Electronics; Laptop Computers; Computer Peripherals; Small Televisions; Tablets; Televisions; Video Game Consoles; PlayStation Consoles","false","true","Most stores offer Used Oil & Battery Recycling, Battery Testing, 
Electrical & Module Testing, Loaner Tool Program, Drum / Rotor Resurfacing. Call your location for more details.","","false","false","false","false"
"Advance Auto Parts","","300 N Main St","Brownwood","","TX","76801","3256432330","0","","http://shop.advanceautoparts.com/webapp/wcs/stores/servlet/home___","31.7249517","-98.9814295","48.6455529976968","","false","false","","","false","false","false","false"
"O'Reilly Auto Parts","null","1118 State Highway 16s","Graham","","TX","76450","9405219550","0","","http://oreillyauto.custhelp.com/app/error/error_id/6","33.0948048","-98.5904319","48.7172448172462","","false","false","","","false","false","false","false"
"Mineral Wells Junior High","","1301 SE 14th Ave","Mineral Wells","","TX","76067","9403250711","0","","","32.7986422","-98.0991301","48.7454468017546","","false","false","","","false","false","false","false"
