name,description,address,city,region,province,postal_code,phone,fax,hours,url,latitude,longitude,distance,materials,pickup,dropoff,notes,groups,curbside,municipal,national,event_only
"Hadlock True Value","","901 Ness Corner Road","Port Hadlock","","WA","98339","3603851771","0","","https://www.truevalue.com/","48.0327527","-122.7624571","0.112142387098796","","false","false","","","false","false","false","false"
"Hadlock True Value","Hadlock True Value","901 Ness Corner Rd","Port Hadlock","Jefferson","WA","98339","3603851771","0","","http://www.truevalue.com","48.03232","-122.76264","0.115941045175255","Transmission Fluid; Used Motor Oil; Video Game Consoles; PlayStation Consoles","false","true","","","false","false","false","false"
"Jefferson County Recycling Drop-Off Site - Port Hadlock","","202 Elkins Rd","Port Hadlock","","WA","98339","3603859160","0","","https://www.co.jefferson.wa.us","48.0230347","-122.7634057","0.703351229625079","","false","false","","","false","false","false","false"
"Port Hadlock Bay Marina Drop-off Site","Port Hadlock Bay Marina Drop-off Site","310 Hadlock Bay Rd","Port Hadlock","Jefferson","WA","98339","3603856368","0","Sunday: 12:00 AM - 11:59 PM Monday: 12:00 AM - 11:59 PM Tuesday: 12:00 AM - 11:59 PM Wednesday: 12:00 AM - 11:59 PM Thursday: 12:00 AM - 11:59 PM Friday: 12:00 AM - 11:59 PM Saturday: 12:00 AM - 11:59 PM ","","48.02772","-122.74271","1.0880012938957","Antifreeze; Used Motor Oil; Video Game Consoles; PlayStation Consoles","false","true","","","false","false","false","false"
"Chimacum School","Chimacum School","91 W Valley Rd","Chimacum","Jefferson","WA","98325","3603853156","0","","null","48.01348","-122.77785","1.48813682488085","Plastic #2 (HDPE); Aluminum Cans; Catalogs; Magazines; Newspapers; Phone books; Tin or Steel Cans; Video Game Consoles; PlayStation Consoles","false","true","","","false","false","false","false"
"EcycleNW","EcycleNW","272693 Highway 101","Sequim","Clallam","WA","98382","3607750467","0","","http://ecyclenw.com","48.04068","-122.9834","10.1119114398346","Compact Fluorescent Lights; Computer Monitors; Computer (Recycling); Electronics; Fluorescent Lamps/Tubes; Telephones; Televisions; MP3 Players; Video Game Consoles; PlayStation Consoles","true","true","","","false","false","false","false"
"EcycleNW","","272693 U.S. 101","Sequim","","WA","98382","3606818645","0","","http://ecyclenw.com/","48.0409263","-122.983922","10.1368555946767","","false","false","","","false","false","false","false"
"USPS Post Office Box Lobby Recycling Program","US Post Office","1619 Main St","Freeland","Island","WA","98249","8002758777","0","","https://www.usps.com/","48.00967","-122.52593","11.1573044387087","Catalogs; Greeting Cards; Magazines; Paper (Mixed)","false","true","","","false","false","false","false"
"Call2Recycle at Whidbeytronics","Call2Recycle at Whidbeytronics","1688 E Main St 101","Freeland","Island County","WA","98249","3603311676","0","","http://www.radioshack.com/","48.0096395","-122.5238332","11.2534843623164","Cell Phones; Ni-Cd Batteries; Li-Ion Batteries; Ni-MH Batteries; Ni-Zn Batteries; Small Sealed Lead Acid Batteries; Video Game Consoles; PlayStation Consoles","false","true","The U.S. EPA estimates that more than 350 million rechargeable batteries are purchased annually in the U.S. Thanks to the environmental commitment of this location, its easy and free to recycle your batteries. Bring your rechargeable batteries to this location and look for the recycling box or ask an associate how you can do your part for the environment.","","false","false","false","false"
"City of Sequim Recycling Drop-Off Site","","2577 W Sequim Bay Rd","Sequim","","WA","98382","3606834139","0","","","48.0620874","-123.0406831","12.8979173909994","","false","false","","","false","false","false","false"
"Hansville Repair","Hansville Repair","7538 Buck Lake Rd NE","Hansville","Kitsap","WA","98340","3606382372","0","Monday: 8:00 AM - 6:00 PM Tuesday: 8:00 AM - 6:00 PM Wednesday: 8:00 AM - 6:00 PM Thursday: 8:00 AM - 6:00 PM Friday: 8:00 AM - 6:00 PM ","","47.915","-122.54751","12.9488041933989","Antifreeze; Brake Fluid; Lead Acid (Pb) Batteries; Transmission Fluid; Used Motor Oil; Used Tires; Video Game Consoles; PlayStation Consoles","false","true","","","false","false","false","false"
"Island County Household Hazardous Waste Collection Facility - Coupeville","","20018 State Route 20","Coupeville","","WA","98239","3606797386","0","","","48.2078866","-122.6487327","13.2048546431989","","false","false","","","false","false","false","false"
"Coupeville Transfer Station & Recycle Park","","20018 State Route 20","Coupeville","","WA","98239","3606787478","0","","https://www.islandcountywa.gov/PublicWorks/solidwaste/Pages/Coupeville.aspx","48.2078866","-122.6487327","13.2048546431989","","false","false","","","false","false","false","false"
"City of Oak Harbor Christmas Tree Recycling  Drop-Off Site - Island County Solid Waste","","20062 State Route 20","Coupeville","","WA","98239","3606797386","0","","http://www.oakharbor.org/page.cfm?pageId=156","48.2072408","-122.6450883","13.2333402771538","","false","false","","","false","false","false","false"
"Island County Solid Waste","Island County Solid Waste","20018 WA-20 ","Coupeville","Island County","WA","98239","3606797386","0","","http://www.call2recycle.org/","48.2077729","-122.6445761","13.2765963729688","Cell Phones; Ni-Cd Batteries; Li-Ion Batteries; Ni-MH Batteries; Ni-Zn Batteries; Small Sealed Lead Acid Batteries; Video Game Consoles; PlayStation Consoles; Batteries (Rechargeable); Cell Phone Batteries; Li-Ion Batteries; Ni-Cd Batteries; Ni-MH Batteries; Small Sealed Lead Acid Batteries; Cell Phones","false","true","The U.S. EPA estimates that more than 350 million rechargeable batteries are purchased annually in the U.S. Thanks to the environmental commitment of this location, its easy and free to recycle your rechargeable batteries. Look for the recycling box or ask a staff member how you can do your part for the environment.","Call2Recycle","false","false","false","false"
"Coupeville Recycle Park","Island Recycling","20018 WA-20 ","Coupeville","Island County","WA","98239","3606787478","0","Sunday: 9:30 AM - 5:00 PM Monday: 9:30 AM - 5:00 PM Tuesday: 9:30 AM - 5:00 PM Wednesday: 9:30 AM - 5:00 PM Thursday: 9:30 AM - 5:00 PM Friday: 9:30 AM - 5:00 PM Saturday: 9:30 AM - 5:00 PM ","http://www.islandrecycling.com/","48.2077729","-122.6445761","13.2765963729688","Air Conditioners; Alkaline/Single-Use Batteries; Antifreeze; Bed Mattresses; Brick(s); Cell Phones; Compact Fluorescent Lights; Computer (Recycling); Computer Monitors; Concrete (Set); Construction Materials; Cooking Oil; Dehumidifiers; E-Readers; Fertilizer; Gasoline and Unwanted Fuels; Laptop Computers; Large Household Appliances; Lead Acid (Pb) Batteries; Mercury Containing Items; Oil-Based Paint; PCB Ballasts; Pesticides; Propane Tanks; Refrigerators; Small Televisions; Soil; Tablets; Televisions; Wood; Electric Motors","false","true","Source separated recycling - see website for details.","","false","false","false","false"
"USPS Post Office Box Lobby Recycling Program","US Post Office","201 NW Coveland St","Coupeville","Island","WA","98239","8002758777","0","","https://www.usps.com/","48.22037","-122.68959","13.3905274377259","Catalogs; Greeting Cards; Magazines; Paper (Mixed)","false","true","","","false","false","false","false"
"US Post Office","USPS Discarded Lobby Mail Recycling Program","201 NW Coveland St","Coupeville","Island","WA","98239","0","0","","","48.22037","-122.68959","13.3905274377259","Video Game Consoles; PlayStation Consoles","false","true","","","false","false","false","false"
"Bayview Drop Box Station","","5790 Kramer Rd","Langley","","WA","98260","3603214505","0","","","48.0007152","-122.4565628","14.4206974183937","","false","false","","","false","false","false","false"
"Bayview Solid Waste Dropbox and Recycle Park","Island County Solid Waste","5790 Kramer Rd ","Langley","Island County","WA","98260","3603214505","0","Sunday: 9:30 AM - 5:00 PM Monday: 9:30 AM - 5:00 PM Wednesday: 9:30 AM - 5:00 PM Saturday: 9:30 AM - 5:00 PM ","http://www.islandcounty.net/PublicWorks/Solidwaste/","48.0008097","-122.4561007","14.4407686905676","Alkaline/Single-Use Batteries; Aluminum; Aluminum Cans; Antifreeze; Brown Paper Bags; Cardboard; Cell Phones; Clothing; Compact Fluorescent Lights; Computer Paper; Construction Materials; Cooking Oil; Dairy Tubs; Fertilizer; Glass (Brown); Glass (Clear); Glass (Green); Lead Acid (Pb) Batteries; Magazines; Mercury Containing Items; Newspapers; Office Paper; Paper (Mixed); Paper Egg Cartons; Paperboard; PCB Ballasts; Pesticides; Pizza Boxes; Plastic #1 (PETE); Plastic #2 (HDPE); Plastic #5 (Polypropylene); Propane Tanks; Scrap Metal; Tin or Steel Cans; Unused Paper; Used Motor Oil; Yard Waste","false","true","Source separated recycling - see website for details.","","false","false","false","false"
"Transfer Station HHW Drop-Off Site","Island County Bayview Transfer Station HHW Drop-Off Site","5790 S Kramer Rd","Langley","Island","WA","98260","3603214505","0","Monday: 9:30 AM - 5:00 PM Wednesday: 9:30 AM - 5:00 PM Saturday: 9:30 AM - 5:00 PM Sunday: 9:30 AM - 5:00 PM ","http://www.islandcounty.net/","48.0008097","-122.456098384","14.4408744336402","Aluminum Cans; Antifreeze; Glass (Brown); Lead Acid (Pb) Batteries; Cardboard; Glass (Clear); Clothing; Gasoline and Unwanted Fuels; Glass (Green); Newspapers; Ni-Cd Batteries; Alkaline/Single-Use Batteries; Tin or Steel Cans; Used Motor Oil; Oil Filters","false","true","","","false","false","false","false"
"Staples","","990 East Washington Street","Sequim","","WA","98382","3606815493","0","","https://www.staples.com/sbd/cre/marketing/sustainability-center/recycling-services/","48.0781295","-123.0874822","15.2217518674515","","false","false","","","false","false","false","false"
"Quilcene Recycling Drop Box","","295312 Hwy 101","Quilcene","","WA","98376","3603859160","0","","https://www.co.jefferson.wa.us","47.8212652","-122.8861927","15.682178175054","","false","false","","","false","false","false","false"
"USPS Post Office Box Lobby Recycling Program","US Post Office","4839 NE View Dr","Port Gamble","Kitsap","WA","98364","8002758777","0","","https://www.usps.com/","47.83694","-122.59439","15.6854130421252","Catalogs; Greeting Cards; Magazines; Paper (Mixed)","false","true","","","false","false","false","false"
"CLALLAM CO-OP TRUE VALUE","CLALLAM CO-OP TRUE VALUE","216 E Washington St","Sequim","Clallam","WA","98382","3606834111","0","","http://www.truevalue.com","48.08009","-123.09995","15.812761445576","Cell Phones; Ni-Cd Batteries; Li-Ion Batteries; Ni-MH Batteries; Ni-Zn Batteries; Small Sealed Lead Acid Batteries; Video Game Consoles; PlayStation Consoles","false","true","The U.S. EPA estimates that more than 350 million rechargeable batteries are purchased annually in the U.S. Thanks to the environmental commitment of this location, its easy and free to recycle your batteries. Bring your rechargeable batteries to this location and look for the recycling box or ask an associate how you can do your part for the environment.","","false","false","false","false"
"Mad Maggi Salon","","131 E Washington St","Sequim","","WA","98382","3605453429","0","","","48.0794589","-123.1014804","15.8731913241956","","false","false","","","false","false","false","false"
"Seegert Crushing","","","Camano Island","","WA","98282","3603877533","0","","http://www.seegertcrushing.com/","48.1712723","-122.487614","15.9560870167306","","false","false","","","false","false","false","false"
"Serenity House Thrift Store","","215 West Washington Street","Sequim","","WA","98382","3606838269","0","","https://www.serenityhouseclallam.org","48.0793858","-123.1056174","16.0593712127178","","false","false","","","false","false","false","false"
"Hansville Drop Box Facility","Hansville Drop Box Facility","7791 NE Ecology Rd ","Kingston","Kitsap County","WA","98346","3606382710","0","","http://www.kitsapgov.com/sw","47.848934","-122.549102","16.1769077513325","Plastic #1 (PETE); Plastic #2 (HDPE); Plastic #2 (Color HDPE); Plastic #3 (PVC); Plastic #4 (LDPE); Plastic #5 (Polypropylene); Plastic #6 (Polystyrene); Aluminum Cans; Antifreeze; Glass (Blue); Glass (Brown); Brown Paper Bags; Brush; Lead Acid (Pb) Batteries; Cardboard; Catalogs; Chipboard; Glass (Clear); Clothing; Computer Paper; Gift Boxes; Grass Clippings; Glass (Green); Greeting Cards; Large Household Appliances; Leaves; Magazines; Needles / Medical Sharps; Paper (Mixed); Newspapers; Ni-Cd Batteries; Paperboard; Phone books; Batteries (Rechargeable); Alkaline/Single-Use Batteries; Tin or Steel Cans; Tree Trimmings; Used Motor Oil; Used Tires; Office Paper","false","true","Continue on Hansville Road past the Point Casino until you come to Ecology Road Turn left.","","false","false","false","false"
"Hansville Recycling Facility","","7791 NE Ecology Rd","Kingston","","WA","98346","3606382710","0","","https://www.kitsapgov.com","47.848934","-122.549102","16.1769077513325","","false","false","","","false","false","false","false"
"Kitsap County Public Works: Hansville Recycling and Garbage Facility","Kitsap County Public Works: Hansville Recycling and Garbage Facility","31645 Hansville Rd NE ","Kingston","Kitsap County","WA","98346","3603375777","0","Monday: 8:00 AM - 3:30 PM Tuesday: 8:00 AM - 3:30 PM Wednesday: 8:00 AM - 3:30 PM ","http://www.kitsapgov.com/sw/hansville.htm","47.8494188","-122.5413826","16.3737881458997","Plastic #1 (PETE); Plastic #2 (HDPE); Plastic #2 (Color HDPE); Plastic #3 (PVC); Plastic #4 (LDPE); Plastic #5 (Polypropylene); Aluminum Cans; Antifreeze; Glass (Blue); Glass (Brown); Brown Paper Bags; Lead Acid (Pb) Batteries; Cardboard; Catalogs; Chipboard; Glass (Clear); Computer Paper; Gift Boxes; Glass (Green); Greeting Cards; Magazines; Needles / Medical Sharps; Paper (Mixed); Newspapers; Ni-Cd Batteries; Paperboard; Phone books; Batteries (Rechargeable); Alkaline/Single-Use Batteries; Tin or Steel Cans; Used Motor Oil; Office Paper; Video Game Consoles; PlayStation Consoles","false","true","Please call or visit the website for information about sorting recyclables.   The site may be reached directly by calling 360-638-2710.","","false","false","false","false"
"Kitsap County Public Works - Hansville Recycling and Garbage Facility","","31645 Hansville Road Northeast","Kingston","","WA","98346","3603375777","0","","https://www.kitsapgov.com","47.8494189","-122.5413641","16.3743235266013","","false","false","","","false","false","false","false"
"Sequim Wrap Parcel n Post","","489 West Washington Street","Sequim","","WA","98382","3606838676","0","","","48.0793982","-123.1128596","16.3874367318556","","false","false","","","false","false","false","false"
"Quilcene Boat Haven","Quilcene Boat Haven","1731 Linger Longer Rd","Quilcene","Jefferson","WA","98376","3607653131","0","Sunday: 12:00 AM - 11:59 PM Monday: 12:00 AM - 11:59 PM Tuesday: 12:00 AM - 11:59 PM Wednesday: 12:00 AM - 11:59 PM Thursday: 12:00 AM - 11:59 PM Friday: 12:00 AM - 11:59 PM Saturday: 12:00 AM - 11:59 PM ","","47.80662","-122.87032","16.397252472733","Used Motor Oil; Video Game Consoles; PlayStation Consoles","false","true","","","false","false","false","false"
"USPS Post Office Box Lobby Recycling Program","US Post Office","115 2nd St","Langley","Island","WA","98260","8002758777","0","","https://www.usps.com/","48.03987","-122.40918","16.4353479116075","Catalogs; Greeting Cards; Magazines; Paper (Mixed)","false","true","","","false","false","false","false"
"US Post Office","USPS Discarded Lobby Mail Recycling Program","115 2nd St","Langley","Island","WA","98260","0","0","","","48.03987","-122.40918","16.4353479116075","Video Game Consoles; PlayStation Consoles","false","true","","","false","false","false","false"
"Safeway","null","680F W Washington St","Sequim","","WA","98382","3606812905","0","","https://shop.safeway.com/home.html","48.0806046","-123.1163082","16.5597734846567","","false","false","","","false","false","false","false"
"Goodwill Industries","","680 W. Washington","Sequim","","WA","98382","3606812635","0","","https://www.goodwillwa.org/","48.0806046","-123.1163082","16.5597734846567","","false","false","","","false","false","false","false"
"City of Sequim Recycling Drop-Off Site","","651 W Washington St","Sequim","","WA","98382","3606834139","0","","","48.0783256","-123.1177684","16.595912360007","","false","false","","","false","false","false","false"
"JCPenney","","651 W Washington St","Sequim","","WA","98382","3606812833","0","","https://www.jcpenney.com/","48.0783256","-123.1177684","16.595912360007","","false","false","","","false","false","false","false"
"Lycorp Of Sequim, Inc.","Lycorp Of Sequim, Inc.","680 W Washington St Ste B106","Sequim","Clallam","WA","98382","3606833033","0","","http://www.radioshack.com/","48.0806","-123.11732","16.6055140102696","Cell Phones; Ni-Cd Batteries; Li-Ion Batteries; Ni-MH Batteries; Ni-Zn Batteries; Small Sealed Lead Acid Batteries; Video Game Consoles; PlayStation Consoles","false","true","The U.S. EPA estimates that more than 350 million rechargeable batteries are purchased annually in the U.S. Thanks to the environmental commitment of this location, its easy and free to recycle your batteries. Bring your rechargeable batteries to this location and look for the recycling box or ask an associate how you can do your part for the environment.","","false","false","false","false"
"Call2Recycle at Remote Control Hobbies","Call2Recycle at Remote Control Hobbies","680 W Washington St Ste B105","Sequim","Clallam","WA","98382","3606810506","0","","http://www.rc-hobbies.com/","48.0806","-123.11732","16.6055140102696","Cell Phones; Ni-Cd Batteries; Li-Ion Batteries; Ni-MH Batteries; Ni-Zn Batteries; Small Sealed Lead Acid Batteries; Video Game Consoles; PlayStation Consoles","false","true","The U.S. EPA estimates that more than 350 million rechargeable batteries are purchased annually in the U.S. Thanks to the environmental commitment of this location, its easy and free to recycle your batteries. Bring your rechargeable batteries to this location and look for the recycling box or ask an associate how you can do your part for the environment.","","false","false","false","false"
"Davis Sand & Gravel-Sequim Redi Mix","","432 Evans Road","Sequim","","WA","98382","3606835680","0","","","48.100488","-123.1126488","16.720043160856","","false","false","","","false","false","false","false"
"Walmart","Walmart","1110 W Washington St","Sequim","Clallam","WA","98382","3606839346","0","","http://www.walmart.com","48.07876","-123.12549","16.9517543141673","Lead Acid (Pb) Batteries; Plastic Shopping Bags; Food Storage Bags; Video Game Consoles; PlayStation Consoles","false","true","","","false","false","false","false"
"Home Depot","Home Depot","1145 W Washington St","Sequim","Clallam","WA","98382","3605821620","0","","http://www.homedepot.com","48.07876","-123.12549","16.9517543141673","Compact Fluorescent Lights; Batteries (Rechargeable); Video Game Consoles; PlayStation Consoles","false","true","Home Depot accepts compact fluorescent bulbs and used power tool rechargeable batteries. Look for the orange drop boxes, usually located near the front entrance near the customer service desk.","","false","false","false","false"
"Walmart Tire & Lube Express","Walmart Tire & Lube Express","1110 W Washington St","Sequim","Clallam","WA","98382","3606839346","0","","http://www.walmart.com/catalog/catalog.gsp?cat=495843","48.07876","-123.12549","16.9517543141673","Lead Acid (Pb) Batteries; Used Motor Oil; Oil Filters; Video Game Consoles; PlayStation Consoles","false","true","","","false","false","false","false"
"Call2Recycle at the Home Depot","Call2Recycle at the Home Depot","1145 W Washington St","Sequim","Clallam","WA","98382","3605821620","0","","http://www.homedepot.com/","48.07876","-123.12549","16.9517543141673","Cell Phones; Compact Fluorescent Lights; Ni-Cd Batteries; Li-Ion Batteries; Ni-MH Batteries; Ni-Zn Batteries; Small Sealed Lead Acid Batteries; Video Game Consoles; PlayStation Consoles","false","true","The Home Depot accepts used rechargeable batteries and compact fluorescent bulbs. Look for the orange drop boxes, usually located near the front entrance near the customer service desk, or ask a store associate for more details.","","false","false","false","false"
"Camano Island Transfer Station & Recycle Park","","75 Old Camano Hill Rd","Camano Island","","WA","98282","3603879696","0","","","48.1954485","-122.4883042","16.9814901566614","","false","false","","","false","false","false","false"
"Island County Household Hazardous Waste Collection Facility - Camano Island","","75 Old Camano Hill Rd","Camano Island","","WA","98282","3603879696","0","","","48.1954485","-122.4883042","16.9814901566614","","false","false","","","false","false","false","false"
"Home Depot","","1145 W Washington St","Sequim","","WA","98382","3605821620","0","","https://ecooptions.homedepot.com/","48.0764653","-123.1306772","17.1592103455451","Batteries (Rechargeable); Cell Phone Batteries; Li-Ion Batteries; Ni-Cd Batteries; Ni-MH Batteries; Small Sealed Lead Acid Batteries","false","true","","Call2Recycle","false","false","false","false"
"Walmart Tire and Lube Express","","1110 W Washington St","Sequim","","WA","98382","3606839346","0","","https://www.walmart.com/cp/ideas/8932632","48.0800895","-123.1342053","17.3640753190435","","false","false","","","false","false","false","false"
"Walmart Supercenter","","1110 W Washington St","Sequim","","WA","98382","3606839346","0","","https://www.walmart.com/","48.0800895","-123.1342053","17.3640753190435","","false","false","","","false","false","false","false"
"The UPS Store 5637","","1400 W Washington St Ste 104","Sequim","","WA","98382","3605829534","0","","https://locations.theupsstore.com/wa/sequim/1400-w-washington-st","48.0781877","-123.1368798","17.4618570955196","","false","false","","","false","false","false","false"
"Camano Island Transfer Station and Recycling Park","Island County Solid Waste","75 S Camano Hill Rd ","Camano Island","Island County","WA","98282","3603879696","0","Sunday: 9:30 AM - 5:00 PM Monday: 9:30 AM - 5:00 PM Tuesday: 9:30 AM - 5:00 PM Wednesday: 9:30 AM - 5:00 PM Thursday: 9:30 AM - 5:00 PM Friday: 9:30 AM - 5:00 PM Saturday: 9:30 AM - 5:00 PM ","http://www.islandcounty.net/PublicWorks/Solidwaste/","48.2062703","-122.4808108","17.7368479173698","Aluminum; Aluminum Cans; Brown Paper Bags; Cardboard; Cell Phones; Compact Fluorescent Lights; Computer (Recycling); Computer Monitors; Computer Paper; Cooking Oil; Dairy Tubs; E-Readers; Glass (Blue); Glass (Brown); Glass (Clear); Glass (Green); Greeting Cards; Inkjet Printer Cartridges; Laptop Computers; Large Household Appliances; Milk Cartons; Newspapers; Office Paper; Paper (Mixed); Phone books; Plastic #1 (PETE); Plastic #2 (HDPE); Plastic #5 (Polypropylene); Scrap Metal; Small Televisions; Tablets; Televisions; Tin or Steel Cans; Unused Paper; Used Motor Oil","false","true","Closed on holidays. Commingled recycling - see website for details. ","","false","false","false","false"
"Albertsons","Albertsons","1450 SW Erie St","Oak Harbor","Island","WA","98277","3602798828","0","","","48.28602","-122.66227","18.0970861985997","Plastic Shopping Bags; Food Storage Bags; Video Game Consoles; PlayStation Consoles","false","true","","","false","false","false","false"
"Albertsons","","1450 Southwest Erie Street","Oak Harbor","","WA","98277","3602798828","0","","","48.2864147","-122.6613996","18.1339069596925","","false","false","","","false","false","false","false"
"O'Reilly Auto Parts","null","  31821 Sr 20","Oak Harbor","","WA","98277","3606796610","0","","http://oreillyauto.custhelp.com/app/error/error_id/6","48.2863292","-122.6585958","18.1626047388396","","false","false","","","false","false","false","false"
"Schucks Auto Supply","Schucks Auto Supply","31370 State Route 20","Oak Harbor","Island","WA","98277","3606766610","0","","http://www.cskauto.com","48.28649","-122.65897","18.1686643130283","Lead Acid (Pb) Batteries; Used Motor Oil; Oil Filters; Video Game Consoles; PlayStation Consoles","false","true","","","false","false","false","false"
"USPS Post Office Box Lobby Recycling Program","US Post Office","4801 Deer Lake Rd","Clinton","Island","WA","98236","8002758777","0","","https://www.usps.com/","47.97153","-122.38015","18.2846191119832","Catalogs; Greeting Cards; Magazines; Paper (Mixed)","false","true","","","false","false","false","false"
"US Post Office","USPS Discarded Lobby Mail Recycling Program","4801 Deer Lake Rd","Clinton","Island","WA","98236","0","0","","","47.97153","-122.38015","18.2846191119832","Video Game Consoles; PlayStation Consoles","false","true","","","false","false","false","false"
"Walmart","","1250 SW Erie St","Oak Harbor","","WA","98277","3602790665","0","","https://www.walmart.com/","48.2889348","-122.6622239","18.2920731441659","","false","false","","","false","false","false","false"
"Walmart Tire and Lube Express","","1250 SW Erie St","Oak Harbor","","WA","98277","3602790665","0","","https://www.walmart.com/cp/ideas/8932632","48.2889348","-122.6622239","18.2920731441659","","false","false","","","false","false","false","false"
"Around Again","","22 Gilbert Rd","Sequim","","WA","98382","3606837862","0","","https://www.aroundagainstore.org/","48.0772607","-123.1561401","18.3271703280159","","false","false","","","false","false","false","false"
