name,description,address,city,region,province,postal_code,phone,fax,hours,url,latitude,longitude,distance,materials,pickup,dropoff,notes,groups,curbside,municipal,national,event_only
"Pony Mailing & Business Center","Pony Mailing & Business Center","316 SE Pioneer Way","Oak Harbor","Island","WA","98277","3606795519","0","Monday: 8:00 AM - 6:00 PM Tuesday: 8:00 AM - 6:00 PM Wednesday: 8:00 AM - 6:00 PM Thursday: 8:00 AM - 6:00 PM Friday: 8:00 AM - 6:00 PM Saturday: 10:00 AM - 4:00 PM ","http://www.ponymailing.com","48.28795","-122.6538","18.33089436704","Packing Peanut (Reuse); Video Game Consoles; PlayStation Consoles","false","true","","","false","false","false","false"
"Safeway","","31565 Highway 20","Oak Harbor","","WA","98277","3606793011","0","","https://shop.safeway.com/home.html","48.2895376","-122.6595114","18.3649341699898","","false","false","","","false","false","false","false"
"US Post Office","US Post Office","1155 SE City Beach St","Oak Harbor","Island","WA","98277","0","0","","https://www.usps.com/ship/recycle-through-usps.htm","48.28866","-122.65309","18.3871294315891","Inkjet Printer Cartridges; Video Game Consoles; PlayStation Consoles","false","true","Free, postage-paid Mail Back envelopes can be found on display in the lobby. There is no limit to the number of envelopes customers may take. The contents of the envelope must weigh less than 13 ounces and the envelope must be able to seal completely. For more details visit<a href="http://www.maxback.com/mxb-postoffice-collaboration" target="_blank">MaxBack</a>.","","false","false","false","false"
"Call2Recycle at RadioShack","Call2Recycle at RadioShack","31595 State Route 20 Ste 1","Oak Harbor","Island","WA","98277","3606793581","0","","http://www.radioshack.com/","48.29037","-122.6579","18.4400978578949","Cell Phones; Ni-Cd Batteries; Li-Ion Batteries; Ni-MH Batteries; Ni-Zn Batteries; Small Sealed Lead Acid Batteries; Video Game Consoles; PlayStation Consoles","false","true","As the first national retailer to partner with Call2Recycle, RadioShack is at the forefront of the rechargeable battery recycling cause and is pleased to offer battery recycling at thousands of convenient RadioShack locations for free.  Simply drop them off at your local RadioShack and theyll take care of the rest.  Ask a store associate for more details.","","false","false","false","false"
"Walmart Tire & Lube Express","Walmart Tire & Lube Express","21200 Olhava Way NW","Poulsbo","Kitsap","WA","98370","3606973670","0","","http://www.walmart.com/catalog/catalog.gsp?cat=495843","47.77265","-122.66693","18.5615208838256","Lead Acid (Pb) Batteries; Used Motor Oil; Oil Filters; Video Game Consoles; PlayStation Consoles","false","true","","","false","false","false","false"
"Walmart","Walmart","21200 Olhava Way NW","Poulsbo","Kitsap","WA","98370","3606973670","0","","http://www.walmart.com","47.77265","-122.66693","18.5615208838256","Lead Acid (Pb) Batteries; Plastic Shopping Bags; Food Storage Bags; Video Game Consoles; PlayStation Consoles","false","true","","","false","false","false","false"
"AutoZone","AutoZone","31820 Hwy 20","Oak Harbor","Island","WA","98277","3602400258","0","","http://www.autozone.com","48.29301","-122.6575","18.6207821743041","Lead Acid (Pb) Batteries; Used Motor Oil; Video Game Consoles; PlayStation Consoles","false","true","Most AutoZone stores accept used motor oil, transmission fluid, gear oil and automotive batteries. Call to see what your local store is currently accepting.","","false","false","false","false"
"Walmart Tire & Lube Express","Walmart Tire & Lube Express","1250 SW Erie St","Oak Harbor","Island","WA","98277","3602790665","0","","http://www.walmart.com/catalog/catalog.gsp?cat=495843","48.29455","-122.66416","18.6446572318489","Lead Acid (Pb) Batteries; Used Motor Oil; Oil Filters; Video Game Consoles; PlayStation Consoles","false","true","","","false","false","false","false"
"Seegert, Inc.","Seegert, Inc.","585 Waynes Ridge Cir","Camano Island","Island","WA","98282","3605072736","0","","","48.23114","-122.4891","18.6734716371117","Broken Asphalt/Aggregate; Brick(s); Concrete (Set); Video Game Consoles; PlayStation Consoles","false","true","This is a mobile recycling unit, please call for additional information.","","false","false","false","false"
"Home Depot","Home Depot","31800 WA-20 ","Oak Harbor","Island County","WA","98277","3606750105","0","","http://www.homedepot.com","48.2932477","-122.6545149","18.673583674739","Compact Fluorescent Lights; Batteries (Rechargeable); Video Game Consoles; PlayStation Consoles","false","true","Home Depot accepts compact fluorescent bulbs and used power tool rechargeable batteries. Look for the orange drop boxes, usually located near the front entrance near the customer service desk.","","false","false","false","false"
"Call2Recycle at the Home Depot","Call2Recycle at the Home Depot","31800 Sr 20","Oak Harbor","Island County","WA","98277","3606750105","0","","http://www.homedepot.com/","48.2932477","-122.6545149","18.673583674739","Cell Phones; Compact Fluorescent Lights; Ni-Cd Batteries; Li-Ion Batteries; Ni-MH Batteries; Ni-Zn Batteries; Small Sealed Lead Acid Batteries; Video Game Consoles; PlayStation Consoles; Batteries (Rechargeable); Cell Phone Batteries; Li-Ion Batteries; Ni-Cd Batteries; Ni-MH Batteries; Small Sealed Lead Acid Batteries","false","true","The Home Depot accepts used rechargeable batteries and compact fluorescent bulbs. Look for the orange drop boxes, usually located near the front entrance near the customer service desk, or ask a store associate for more details.","Call2Recycle","false","false","false","false"
"Home Depot","","31800 State Route 20","Oak Harbor","","WA","98277","3606750105","0","","https://ecooptions.homedepot.com/","48.2932477","-122.6545149","18.673583674739","","false","false","","","false","false","false","false"
"AutoZone","","31820 Hwy 20","Oak Harbor","","WA","98277","3602400258","0","","https://www.autozone.com/landing/page.jsp?name=in-our-stores","48.2938248","-122.6563524","18.6891237008441","","false","false","","","false","false","false","false"
"Ecycle Northwest","Ecycle Northwest","40 Harrison Rd","Sequim","Clallam","WA","98382","3606818645","0","Tuesday: 9:00 AM - 4:00 PM Thursday: 9:00 AM - 2:00 PM ","http://www.ecyclenw.com","48.07785","-123.17155","19.0357314134027","Lead Acid (Pb) Batteries; Compact Fluorescent Lights; Computer Monitors; Computer (Recycling); Electronics; Fluorescent Lamps/Tubes; Mercury Containing Items; Ni-Cd Batteries; Batteries (Rechargeable); Alkaline/Single-Use Batteries; Televisions; MP3 Players; Video Game Consoles; PlayStation Consoles","true","true","This site has a fee schedule on most items. Please call for more information.","","false","false","false","false"
"Jim's Auto Wrecking","Jim's Auto Wrecking","23719 Stottlemeyer Rd NE","Poulsbo","Kitsap","WA","98370","3607793344","0","Monday: 9:00 AM - 5:00 PM Tuesday: 9:00 AM - 5:00 PM Wednesday: 9:00 AM - 5:00 PM Thursday: 9:00 AM - 5:00 PM Friday: 9:00 AM - 5:00 PM Saturday: 9:00 AM - 5:00 PM ","","47.77783","-122.60686","19.0980360138965","Antifreeze; Brake Fluid; Lead Acid (Pb) Batteries; Transmission Fluid; Used Motor Oil; Used Tires; Video Game Consoles; PlayStation Consoles","false","true","","","false","false","false","false"
"Anjo Soils","","762 Carlsborg Rd","Sequim","","WA","98382","3606835138","0","","","48.0903319","-123.1723929","19.2303049060186","","false","false","","","false","false","false","false"
"Home Depot","","21750 Market Pl NW","Poulsbo","","WA","98370","3607799924","0","","https://ecooptions.homedepot.com/","47.7602594","-122.66238","19.4432717160541","Batteries (Rechargeable); Cell Phone Batteries; Li-Ion Batteries; Ni-Cd Batteries; Ni-MH Batteries; Small Sealed Lead Acid Batteries","false","true","","Call2Recycle","false","false","false","false"
"Home Depot","Home Depot","21750 Market Pl NW","Poulsbo","Kitsap","WA","98370","3607799924","0","","http://www.homedepot.com","47.76013","-122.66252","19.4503625223158","Compact Fluorescent Lights; Batteries (Rechargeable); Video Game Consoles; PlayStation Consoles","false","true","Home Depot accepts compact fluorescent bulbs and used power tool rechargeable batteries. Look for the orange drop boxes, usually located near the front entrance near the customer service desk.","","false","false","false","false"
"Laser Green Inc.","Laser Green Inc.","111 4 Corners Rd","Port Townsend","Jefferson","WA","98368","3603791779","0","Monday: 9:00 AM - 5:00 PM Tuesday: 9:00 AM - 5:00 PM Wednesday: 9:00 AM - 5:00 PM Thursday: 9:00 AM - 5:00 PM Friday: 9:00 AM - 5:00 PM ","","48.04909","-122.81771","2.68004334287536","Inkjet Printer Cartridges; Laser Toner Cartridges; Video Game Consoles; PlayStation Consoles","true","true","Please call for further information regarding pick-up service.","","false","false","false","false"
"Edensaw Woods LTD","Edensaw Woods LTD","211 Seton Rd","Port Townsend","Jefferson","WA","98368","3623857878","0","","http://www.call2recycle.org/","48.08289","-122.81393","4.11656147405393","Cell Phones; Ni-Cd Batteries; Li-Ion Batteries; Ni-MH Batteries; Ni-Zn Batteries; Small Sealed Lead Acid Batteries; Video Game Consoles; PlayStation Consoles","false","true","The U.S. EPA estimates that more than 350 million rechargeable batteries are purchased annually in the U.S. Thanks to the environmental commitment of this location, its easy and free to recycle your batteries. Bring your rechargeable batteries to this location and look for the recycling box or ask an associate how you can do your part for the environment.","","false","false","false","false"
"Jefferson County Public Works","Jefferson County Public Works","623 Sheridan St","Port Townsend","Jefferson","WA","98368","3603859230","0","Monday: 8:00 AM - 5:00 PM Tuesday: 8:00 AM - 5:00 PM Wednesday: 8:00 AM - 5:00 PM Thursday: 8:00 AM - 5:00 PM Friday: 8:00 AM - 5:00 PM ","http://www.call2recycle.org/","48.10437","-122.79038","5.05883102049413","Cell Phones; Ni-Cd Batteries; Li-Ion Batteries; Ni-MH Batteries; Ni-Zn Batteries; Small Sealed Lead Acid Batteries; Video Game Consoles; PlayStation Consoles","false","true","The U.S. EPA estimates that more than 350 million rechargeable batteries are purchased annually in the U.S. Thanks to the environmental commitment of this location, its easy and free to recycle your rechargeable batteries. Look for the recycling box or ask a staff member how you can do your part for the environment.","","false","false","false","false"
"Port Townsend Curbside Recycling","Port Townsend Curbside Recycling","2153 4th St","Port Townsend","Jefferson","WA","98368","3603856612","0","","http://www.cityofpt.us/","48.1026","-122.8005","5.07203248972051","Aluminum Cans; Cardboard; Catalogs; Glass (Brown); Glass (Clear); Glass (Green); Magazines; Newspapers; Phone books; Plastic #1 (PETE); Plastic #2 (HDPE); Tin or Steel Cans; Yard Waste; Paper Egg Cartons","false","false","","","true","false","false","false"
"Jefferson City Department Of Public Works","","623 Sheridan St","Port Townsend","","WA","98368","3603859243","0","","https://www.co.jefferson.wa.us","48.1046936","-122.7905881","5.08281441588739","","false","false","","","false","false","false","false"
"Waste Not-Want Not","Waste Not-Want Not","304 10th St","Port Townsend","Jefferson","WA","98368","3603796838","0","Tuesday: 10:00 AM - 5:00 PM Wednesday: 10:00 AM - 5:00 PM Thursday: 10:00 AM - 5:00 PM Friday: 10:00 AM - 5:00 PM Saturday: 10:00 AM - 5:00 PM ","","48.10727","-122.78068","5.17164625665476","Brick(s); Carpet Padding; Ceramic Tiles; Large Household Appliances; Porcelain; Stone; Windows; Video Game Consoles; PlayStation Consoles","false","true","This site sells salvageable building materials. They will accept doors, good used carpet, light fixtures, material cabinets, and vanities. Please call 206-523-1367 before going to this facility.","","false","false","false","false"
"Jefferson County Moderate Risk Waste Facility","","282 10th St","Port Townsend","","WA","98368","3603796911","0","","https://jeffersoncountysolidwaste.com","48.1074022","-122.7795338","5.17346550106626","","false","false","","","false","false","false","false"
"Safeway","","442 W Sims Way","Port Townsend","","WA","98368","3603852806","0","","https://shop.safeway.com/home.html","48.1081301","-122.782699","5.24435191549726","","false","false","","","false","false","false","false"
"O'Reilly Auto Parts","","2223 E Sims Way","Port Townsend","","WA","98368","3603851656","0","","http://oreillyauto.custhelp.com/app/error/error_id/6","48.109397","-122.771356","5.27507010327508","","false","false","","","false","false","false","false"
"Call2Recycle at Soehl Electronics","Call2Recycle at Soehl Electronics","1300 Water St Ste 102","Port Townsend","Jefferson","WA","98368","3603852022","0","","http://www.call2recycle.org/","48.1126","-122.76104","5.49042799136509","Cell Phones; Ni-Cd Batteries; Li-Ion Batteries; Ni-MH Batteries; Ni-Zn Batteries; Small Sealed Lead Acid Batteries; Video Game Consoles; PlayStation Consoles","false","true","The U.S. EPA estimates that more than 350 million rechargeable batteries are purchased annually in the U.S. Thanks to the environmental commitment of this location, its easy and free to recycle your batteries. Bring your rechargeable batteries to this location and look for the recycling box or ask an associate how you can do your part for the environment.","","false","false","false","false"
"Jefferson County Recycling Drop-Off Site - Port Townsend","","1322 Washington St","Port Townsend","","WA","98368","3603859160","0","","https://www.co.jefferson.wa.us","48.1134311","-122.7619319","5.54668395571555","","false","false","","","false","false","false","false"
"Jefferson County Transfer Station","Jefferson County Transfer Station","325 County Landfill Rd ","Port Townsend","Jefferson County","WA","98368","3603794458","0","","null","48.1033709","-122.8310087","5.73291438439563","Batteries (Rechargeable); Cell Phone Batteries; Cell Phones; Li-Ion Batteries; Ni-Cd Batteries; Ni-MH Batteries; Small Sealed Lead Acid Batteries","false","true","Call or Check Online for Hours","Call2Recycle","false","false","false","false"
"Jefferson County Transfer Station","","301 County Landfill Rd.","Port Townsend","","WA","98368","3603857678","0","","https://jeffersoncountysolidwaste.com","48.1036684","-122.831036","5.75097912617211","","false","false","","","false","false","false","false"
"Jefferson County Cardboard Recycling Drop-Off Site - Port Townsend","","Tyler St","Port Townsend","","WA","98368","3603859160","0","","https://jeffersoncountysolidwaste.com","48.1187724","-122.7619558","5.91559087782231","","false","false","","","false","false","false","false"
"Jefferson County Cardboard Recycling Drop-Off Site - Port Townsend","","Tyler St","Port Townsend","","WA","98368","3603859160","0","","https://jeffersoncountysolidwaste.com","48.1187724","-122.7619558","5.91559087782231","","false","false","","","false","false","false","false"
"Jefferson County Recycling Drop-Off Site - Port Ludlow","","40 Village Way","Port Ludlow","","WA","98365","3603859160","0","","https://www.co.jefferson.wa.us","47.9204944","-122.7017666","8.31290740423862","","false","false","","","false","false","false","false"
"Island Recycling","","5089 State Route 525","Freeland","","WA","98249","3603311727","0","","","48.0328941","-122.5629849","9.32409312715841","","false","false","","","false","false","false","false"
"Island Recycling","Island Recycling","20014 WA-525 ","Freeland","Island County","WA","98249","3603311727","0","Sunday: 9:00 AM - 5:00 PM Tuesday: 9:00 AM - 5:00 PM Wednesday: 9:00 AM - 5:00 PM Thursday: 9:00 AM - 5:00 PM Friday: 9:00 AM - 5:00 PM Saturday: 9:00 AM - 5:00 PM ","http://www.island-recycling.com/","48.0288149","-122.5613889","9.40300137606637","Plastic #1 (PETE); Plastic #2 (HDPE); Plastic #2 (Color HDPE); Plastic #3 (PVC); Plastic #4 (LDPE); Plastic #5 (Polypropylene); Plastic #6 (Polystyrene); Plastic #7; Aluminum Cans; Bikes; Glass (Brown); Lead Acid (Pb) Batteries; Cardboard; Catalogs; Chipboard; Glass (Clear); Computer Paper; Computer (Recycling); Ferrous Metals (Steel or Iron); Glass (Green); Greeting Cards; Large Household Appliances; Magazines; Paper (Mixed); Newspapers; Ni-Cd Batteries; Non-ferrous (Copper/Brass/Tin); Phone books; Alkaline/Single-Use Batteries; Tin or Steel Cans; Used Tires; Office Paper; Computer Monitors; Laptop Computers; Small Televisions; Televisions; Video Game Consoles; PlayStation Consoles","false","true","","","false","false","false","false"
"Island Recycling, Inc.","","20014 Rte 525","Greenbank","","WA","98253","3603311727","0","","","48.0255554","-122.5578244","9.57763981146201","","false","false","","","false","false","false","false"
