name,description,address,city,region,province,postal_code,phone,fax,hours,url,latitude,longitude,distance,materials,pickup,dropoff,notes,groups,curbside,municipal,national,event_only
"Walmart Tire and Lube Express","","7701 Frontage Rd","Overland Park","","KS","66204","9136485885","0","","https://www.walmart.com/cp/ideas/8932632","38.9897579","-94.6988003","1.88613303507036","","false","false","","","false","false","false","false"
"Overland Park Christmas Tree Drop-Off Event - Young's Park","","7701 Antioch Rd","Overland Park","","KS","66204","9138956273","0","","https://www.opkansas.org/events/christmas-tree-recycling/","38.988096","-94.6841603","1.89290533834535","","false","false","","","false","false","false","false"
"Overland Park Christmas Tree Drop-Off Event - Indian Creek Rec Center","","10308 Marty St","Overland Park","","KS","66212","9138956273","0","","https://www.opkansas.org/events/christmas-tree-recycling/","38.9419204","-94.6730622","1.90837989559342","","false","false","","","false","false","false","false"
"USPS Post Office Box Lobby Recycling Program","US Post Office","8010 Conser St","Overland Park","Johnson","KS","66204","8002758777","0","","https://www.usps.com/","38.98381","-94.67363","1.92570492234254","Catalogs; Greeting Cards; Magazines; Paper (Mixed)","false","true","","","false","false","false","false"
"US Post Office","USPS Discarded Lobby Mail Recycling Program","8010 Conser St","Overland Park","Johnson","KS","66204","0","0","","","38.98381","-94.67363","1.92570492234254","Video Game Consoles; PlayStation Consoles","false","true","","","false","false","false","false"
"Mail Services Etc.","Mail Services Etc.","10308 Metcalf Ave","Shawnee Mission","Johnson","KS","66212","9133812313","0","Monday: 8:00 AM - 5:30 PM Tuesday: 8:00 AM - 5:30 PM Wednesday: 8:00 AM - 5:30 PM Thursday: 8:00 AM - 5:30 PM Friday: 8:00 AM - 5:30 PM Saturday: 9:00 AM - 3:00 PM ","","38.94161","-94.66759","2.13028435439494","Packing Peanut (Reuse); Video Game Consoles; PlayStation Consoles","false","true","","","false","false","false","false"
"Call2Recycle at Overland Tool, Inc.","Call2Recycle at Overland Tool, Inc.","7905 Nieman Rd","Overland Park","Johnson","KS","66214","9135994044","0","","http://www.overlandtool.com/","38.99016","-94.71432","2.13112450056857","Cell Phones; Ni-Cd Batteries; Li-Ion Batteries; Ni-MH Batteries; Ni-Zn Batteries; Small Sealed Lead Acid Batteries; Video Game Consoles; PlayStation Consoles","false","true","The U.S. EPA estimates that more than 350 million rechargeable batteries are purchased annually in the U.S. Thanks to the environmental commitment of this location, its easy and free to recycle your batteries. Bring your rechargeable batteries to this location and look for the recycling box or ask an associate how you can do your part for the environment.","","false","false","false","false"
"Jiffy Lube","Jiffy Lube","10201 W 75th St","Shawnee Mission","Johnson","KS","66204","9136316260","0","Monday: 7:00 AM - 7:00 PM Tuesday: 7:00 AM - 7:00 PM Wednesday: 7:00 AM - 7:00 PM Thursday: 7:00 AM - 7:00 PM Friday: 7:00 AM - 6:00 PM Saturday: 8:00 AM - 5:00 PM Sunday: 10:00 AM - 4:00 PM ","http://www.jiffylube.com","38.99288","-94.7041","2.13545549239594","Transmission Fluid; Used Motor Oil; Video Game Consoles; PlayStation Consoles","false","true","","","false","false","false","false"
"Walmart","Walmart","10303 Metcalf Ave","Overland Park","Johnson","KS","66212","9136423544","0","","http://www.walmart.com","38.94127","-94.66752","2.14902223832745","Lead Acid (Pb) Batteries; Plastic Shopping Bags; Food Storage Bags; Video Game Consoles; PlayStation Consoles","false","true","","","false","false","false","false"
"O'Reilly Auto Parts","null","9500 Marshall Drive ","Lenexa","","KS","66215","9138887101","0","","http://oreillyauto.custhelp.com/app/error/error_id/6","38.955501","-94.7359142","2.15920030618328","","false","false","","","false","false","false","false"
"Firestone Complete Auto Care Store","Firestone Complete Auto Care Store","7200 W 79th St","Overland Park","Johnson","KS","66204","9133966718","0","","http://www.firestonecompleteautocare.com/","38.98598","-94.66918","2.19609095484384","Lead Acid (Pb) Batteries; Used Motor Oil; Video Game Consoles; PlayStation Consoles","false","true","","","false","false","false","false"
"Camera Repair Service","Camera Repair Service","7232 W 79th St","Overland Park","Johnson","KS","66204","9133416325","0","Monday: 9:00 AM - 5:00 PM Tuesday: 9:00 AM - 5:00 PM Wednesday: 9:00 AM - 5:00 PM Thursday: 9:00 AM - 5:00 PM Friday: 9:00 AM - 5:00 PM ","","38.98598","-94.66918","2.19609095484384","Other Batteries; Video Game Consoles; PlayStation Consoles","false","true","","","false","false","false","false"
"Firestone Complete Auto Care","","7200 W 79th St","Overland Park","","KS","66204","9133819500","0","","https://www.firestonecompleteautocare.com/","38.9861621","-94.6692154","2.204121589761","","false","false","","","false","false","false","false"
"Call2Recycle at RadioShack","Call2Recycle at RadioShack","10400 Metcalf Ave","Overland Park","Johnson","KS","66212","9133818363","0","","http://www.radioshack.com/","38.93926","-94.66761","2.24275945827955","Cell Phones; Ni-Cd Batteries; Li-Ion Batteries; Ni-MH Batteries; Ni-Zn Batteries; Small Sealed Lead Acid Batteries; Video Game Consoles; PlayStation Consoles","false","true","As the first national retailer to partner with Call2Recycle, RadioShack is at the forefront of the rechargeable battery recycling cause and is pleased to offer battery recycling at thousands of convenient RadioShack locations for free.  Simply drop them off at your local RadioShack and theyll take care of the rest.  Ask a store associate for more details.","","false","false","false","false"
"Neighborhood Market by Walmart","","10303 Metcalf Ave","Overland Park","","KS","66212","9136423544","0","","https://www.walmart.com/","38.9407901","-94.6655412","2.24987019865135","","false","false","","","false","false","false","false"
"Hobby Haven","Hobby Haven","10560 Metcalf Ave","Overland Park","Johnson","KS","66212","9133813111","0","","http://hobbyhaven-kc.com/","38.9374","-94.66761","2.33651737616584","Cell Phones; Ni-Cd Batteries; Li-Ion Batteries; Ni-MH Batteries; Ni-Zn Batteries; Small Sealed Lead Acid Batteries; Video Game Consoles; PlayStation Consoles","false","true","The U.S. EPA estimates that more than 350 million rechargeable batteries are purchased annually in the U.S. Thanks to the environmental commitment of this location, its easy and free to recycle your batteries. Bring your rechargeable batteries to this location and look for the recycling box or ask an associate how you can do your part for the environment.","","false","false","false","false"
"Office Depot","Office Depot","10551 Metcalf Ave Ste B","Overland Park","Johnson","KS","66212","9133819387","0","Monday: 8:00 AM - 9:00 PM Tuesday: 8:00 AM - 9:00 PM Wednesday: 8:00 AM - 9:00 PM Thursday: 8:00 AM - 9:00 PM Friday: 8:00 AM - 9:00 PM Saturday: 9:00 AM - 9:00 PM Sunday: 10:00 AM - 6:00 PM ","http://www.officedepot.com/techrecycling","38.9371","-94.66743","2.35839586420037","Cell Phones; Electronics; Inkjet Printer Cartridges; Batteries (Rechargeable); MP3 Players; Video Game Consoles; PlayStation Consoles","false","true","Office Depot offers electronics recycling for a small fee. Visit their Web site for more details and store locations. Recycle cell phones, PDAs, rechargeable batteries and ink and toner cartridges for FREE!","","false","false","false","false"
"Walmart","Walmart","11010 W 74th Ter","Shawnee","Johnson","KS","66203","9132683356","0","","http://www.walmart.com","38.9943","-94.71364","2.37673677449182","Lead Acid (Pb) Batteries; Plastic Shopping Bags; Food Storage Bags; Video Game Consoles; PlayStation Consoles","false","true","","","false","false","false","false"
"Neighborhood Market by Walmart","","11010 W 74th Terrace","Shawnee","","KS","66203","9132683356","0","","https://www.walmart.com/","38.9945146","-94.7133651","2.38488139597201","","false","false","","","false","false","false","false"
"RadioShack","RadioShack","13316 W 87th Street Pkwy","Lenexa","Johnson","KS","66215","9138944006","0","Monday: 9:00 AM - 8:00 PM Tuesday: 9:00 AM - 8:00 PM Wednesday: 9:00 AM - 8:00 PM Thursday: 9:00 AM - 8:00 PM Friday: 9:00 AM - 8:00 PM Saturday: 9:00 AM - 8:00 PM Sunday: 11:00 AM - 6:00 PM ","http://www.radioshack.com","38.97111","-94.74015","2.40618775375117","Ni-Cd Batteries; Batteries (Rechargeable); Video Game Consoles; PlayStation Consoles","false","true","","","false","false","false","false"
"Firestone Complete Auto Care","","9502 Nall Ave","Overland Park","","KS","66207","9133411125","0","","https://www.firestonecompleteautocare.com/","38.956064","-94.6513515","2.47903798112756","","false","false","","","false","false","false","false"
"FedEx Office","FedEx Office","13450 W 87th Street Pkwy","Lenexa","Johnson","KS","66215","9138942010","0","Monday: 7:00 AM - 11:00 PM Tuesday: 7:00 AM - 11:00 PM Wednesday: 7:00 AM - 11:00 PM Thursday: 7:00 AM - 11:00 PM Friday: 7:00 AM - 11:00 PM ","http://www.fedex.com/us/office/","38.97114","-94.74172","2.48849331405789","Inkjet Printer Cartridges; Laser Toner Cartridges; Video Game Consoles; PlayStation Consoles","false","true","","","false","false","false","false"
"Overland Park South Amoco","Overland Park South Amoco","10701 Metcalf Ave","Overland Park","Johnson","KS","66210","9133817103","0","Sunday: 12:00 AM - 11:59 PM Monday: 12:00 AM - 11:59 PM Tuesday: 12:00 AM - 11:59 PM Wednesday: 12:00 AM - 11:59 PM Thursday: 12:00 AM - 11:59 PM Friday: 12:00 AM - 11:59 PM Saturday: 12:00 AM - 11:59 PM ","","38.93422","-94.66747","2.50867835911618","Lead Acid (Pb) Batteries; Transmission Fluid; Used Motor Oil; Oil Filters; Used Tires; Video Game Consoles; PlayStation Consoles","false","true","","","false","false","false","false"
"Marbeck Small Appliance Service","Marbeck Small Appliance Service","9522 Nall Ave ","Overland Park","Johnson County","KS","66207","8165236931","0","","http://www.marbeck.com/","38.955345","-94.650682","2.52370781396747","Cell Phones; Ni-Cd Batteries; Li-Ion Batteries; Ni-MH Batteries; Ni-Zn Batteries; Small Sealed Lead Acid Batteries; Video Game Consoles; PlayStation Consoles","false","true","The U.S. EPA estimates that more than 350 million rechargeable batteries are purchased annually in the U.S. Thanks to the environmental commitment of this location, its easy and free to recycle your batteries. Bring your rechargeable batteries to this location and look for the recycling box or ask an associate how you can do your part for the environment.","","false","false","false","false"
"The UPS Store","The UPS Store","11184 Antioch","Overland Park","Johnson","KS","66210","9133452663","0","Monday: 8:00 AM - 6:00 PM Tuesday: 8:00 AM - 6:00 PM Wednesday: 8:00 AM - 6:00 PM Thursday: 8:00 AM - 6:00 PM Friday: 8:00 AM - 6:00 PM Saturday: 9:00 AM - 3:00 PM ","null","38.92689","-94.68631","2.52373193460065","Packing Peanut (Reuse); Video Game Consoles; PlayStation Consoles","false","true","","","false","false","false","false"
"Shred Nations","Shred Nations (inside The UPS Store)","11184 Antioch Rd","Overland Park","Johnson","KS","66210","9134164708","0","Monday: 8:00 AM - 7:00 PM Tuesday: 8:00 AM - 7:00 PM Wednesday: 8:00 AM - 7:00 PM Thursday: 8:00 AM - 7:00 PM Friday: 8:00 AM - 7:00 PM Saturday: 9:00 AM - 4:00 PM ","http://www.shrednations.com/dropoff/location/overland-park/fde506a5-49de-138d-7cc6-5281564fb326","38.92689","-94.68631","2.52373193460065","Cell Phones; Computer (Recycling); Laptop Computers; Small Televisions; Documents to Shred; Video Game Consoles; PlayStation Consoles","true","true","Shred Nations offers document shredding, hard drive destruction, electronics recycling and more. Visit website for quotes and full list of services offered in your area. ","","false","false","false","false"
"The UPS Store","The UPS Store","7457 Quivira Rd","Shawnee","Johnson","KS","66216","9139625500","0","Monday: 8:00 AM - 7:00 PM Tuesday: 8:00 AM - 7:00 PM Wednesday: 8:00 AM - 7:00 PM Thursday: 8:00 AM - 7:00 PM Friday: 8:00 AM - 7:00 PM Saturday: 10:00 AM - 4:00 PM ","http://www.theupsstore.com","38.99342","-94.72362","2.57789313535964","Packing Peanut (Reuse); Video Game Consoles; PlayStation Consoles","false","true","","","false","false","false","false"
"Walgreens","Walgreens","7500 Metcalf Ave","Overland Park","Johnson","KS","66204","9133411725","0","","http://www.walgreens.com","38.9926","-94.66777","2.5971933808445","Cell Phones; Inkjet Cartridge Refilling; Inkjet Printer Cartridges; Video Game Consoles; PlayStation Consoles","false","true","","","false","false","false","false"
"Firestone Complete Auto Care Store","Firestone Complete Auto Care Store","9502 Nall Ave","Overland Park","Johnson","KS","66207","9139673407","0","","http://www.firestonecompleteautocare.com/","38.95603","-94.6491","2.59852723660038","Lead Acid (Pb) Batteries; Used Motor Oil; Video Game Consoles; PlayStation Consoles","false","true","","","false","false","false","false"
"Osco","Osco","7501 Metcalf Ave","Overland Park","Johnson","KS","66204","9136426100","0","","","38.99267","-94.66759","2.60686245116841","Plastic Shopping Bags; Food Storage Bags; Video Game Consoles; PlayStation Consoles","false","true","","","false","false","false","false"
"Advance Auto Parts","Advance Auto Parts","7525 Metcalf Ave","Overland Park","Johnson","KS","66204","9133815905","0","Monday: 7:30 AM - 9:00 PM Tuesday: 7:30 AM - 9:00 PM Wednesday: 7:30 AM - 9:00 PM Thursday: 7:30 AM - 9:00 PM Friday: 7:30 AM - 9:00 PM Saturday: 7:30 AM - 9:00 PM Sunday: 9:00 AM - 8:00 PM ","http://www.advanceautoparts.com","38.99267","-94.66759","2.60686245116841","Lead Acid (Pb) Batteries; Used Motor Oil; Video Game Consoles; PlayStation Consoles","false","true","","","false","false","false","false"
"Ferrellgas/Blue Rhino","","7500 College Boulevard Suite 1000","Overland Park","","KS","66212","8883377355","0","","https://www.ferrellgas.com/","38.9291313","-94.6731725","2.63081618928838","","false","false","","","false","false","false","false"
"Price Chopper, Overland Park KS","Price Chopper, Overland Park KS","7000 W 75th St","Overland Park","Johnson","KS","66204","8162214527","0","","http://www.rippleglass.com/","38.99321","-94.66668","2.66609816562989","Glass (Blue); Glass (Brown); Glass (Clear); Glass (Green); Glass (Other); Video Game Consoles; PlayStation Consoles","false","true","Ripple Glass bins do not require color sorting. All colors of glass can be recycled from our containers, and sheet glass as well. No light bulbs, ceramic, pyrex or safety glass.","","false","false","false","false"
"Savers","","5441 W 95th St","Overland Park","","KS","66207","9136494381","0","","https://www.savers.com/donate/what-we-take","38.9560669","-94.6476988","2.67228643201114","","false","false","","","false","false","false","false"
"Tires Plus Store","Tires Plus Store","7425A Metcalf Ave ","Overland Park","Johnson County","KS","66204","9138319955","0","","http://www.firestone.com","38.9937695","-94.6673414","2.67583549788884","Lead Acid (Pb) Batteries; Used Motor Oil; Video Game Consoles; PlayStation Consoles","false","true","","","false","false","false","false"
"RadioShack","RadioShack","6945 W 75th St","Overland Park","Johnson","KS","66204","9133418006","0","Monday: 10:00 AM - 9:00 PM Tuesday: 10:00 AM - 9:00 PM Wednesday: 10:00 AM - 9:00 PM Thursday: 10:00 AM - 9:00 PM Friday: 10:00 AM - 9:00 PM Saturday: 10:00 AM - 9:00 PM Sunday: 11:00 AM - 6:00 PM ","http://www.radioshack.com","38.99303","-94.66595","2.68023199698206","Ni-Cd Batteries; Batteries (Rechargeable); Video Game Consoles; PlayStation Consoles","false","true","","","false","false","false","false"
"Call2Recycle at RadioShack","Call2Recycle at RadioShack","6945 W 75th St","Overland Park","Johnson","KS","66204","9133418006","0","","http://www.radioshack.com/","38.99303","-94.66595","2.68023199698206","Cell Phones; Ni-Cd Batteries; Li-Ion Batteries; Ni-MH Batteries; Ni-Zn Batteries; Small Sealed Lead Acid Batteries; Video Game Consoles; PlayStation Consoles","false","true","As the first national retailer to partner with Call2Recycle, RadioShack is at the forefront of the rechargeable battery recycling cause and is pleased to offer battery recycling at thousands of convenient RadioShack locations for free.  Simply drop them off at your local RadioShack and theyll take care of the rest.  Ask a store associate for more details.","","false","false","false","false"
"The UPS Store","The UPS Store","6933 W 75th St","Overland Park","Johnson","KS","66204","9133415630","0","Monday: 8:30 AM - 7:00 PM Tuesday: 8:30 AM - 7:00 PM Wednesday: 8:30 AM - 7:00 PM Thursday: 8:30 AM - 7:00 PM Friday: 8:30 AM - 7:00 PM Saturday: 10:00 AM - 4:00 PM ","http://www.theupsstore.com","38.99303","-94.66595","2.68023199698206","Packing Materials; Packing Peanut (Reuse); Video Game Consoles; PlayStation Consoles","false","true","","","false","false","false","false"
"Tires Plus","","7425 Metcalf Ave","Overland Park","","KS","66204","9138319955","0","","https://www.tiresplus.com/","38.9937275","-94.6671158","2.68066948906209","","false","false","","","false","false","false","false"
"The UPS Store","The UPS Store","7325 Quivira Rd","Shawnee","Johnson","KS","66216","9132680005","0","Monday: 9:00 AM - 7:00 PM Tuesday: 9:00 AM - 7:00 PM Wednesday: 9:00 AM - 7:00 PM Thursday: 9:00 AM - 7:00 PM Friday: 9:00 AM - 7:00 PM Saturday: 9:00 AM - 4:00 PM Sunday: 12:00 PM - 4:00 PM ","","38.99551","-94.72363","2.69902164821051","Plastic #6 (Polystyrene); Cardboard; Packing Materials; Packing Peanut (Reuse); Video Game Consoles; PlayStation Consoles","false","true","","","false","false","false","false"
"The UPS Store","The UPS Store","7419 Metcalf Ave","Overland Park","Johnson","KS","66204","9133621515","0","Monday: 8:30 AM - 6:30 PM Tuesday: 8:30 AM - 6:30 PM Wednesday: 8:30 AM - 6:30 PM Thursday: 8:30 AM - 6:30 PM Friday: 8:30 AM - 6:30 PM Saturday: 10:00 AM - 3:00 PM ","","38.99472","-94.66769","2.71832480013437","Packing Materials; Packing Peanut (Reuse); Video Game Consoles; PlayStation Consoles","false","true","","","false","false","false","false"
