name,description,address,city,region,province,postal_code,phone,fax,hours,url,latitude,longitude,distance,materials,pickup,dropoff,notes,groups,curbside,municipal,national,event_only
"Jim's Salvage","Jim's Salvage","96 KS-254 ","El Dorado","Butler County","KS","67042","3163213208","0","Monday: 8:30 AM - 5:00 PM Tuesday: 8:30 AM - 5:00 PM Wednesday: 8:30 AM - 5:00 PM Thursday: 8:30 AM - 5:00 PM Friday: 8:30 AM - 5:00 PM ","","37.817478","-96.8498839","0.252407705058124","Aluminum Cans; Ferrous Metals (Steel or Iron); Large Household Appliances; Non-ferrous (Copper/Brass/Tin); Video Game Consoles; PlayStation Consoles","false","true","This site is located west over the Turnpike.","","false","false","false","false"
"City of El Dorado Recycling Center","","222 E Locust Ave","El Dorado","","KS","67042","3163224481","0","","","37.8141575","-96.8476213","0.445445105288722","","false","false","","","false","false","false","false"
"Walgreens","Walgreens","119 W 6th Ave","El Dorado","Butler","KS","67042","3163216700","0","","http://www.walgreens.com","37.82471","-96.84996","0.549009668951355","Cell Phones; Inkjet Printer Cartridges; Video Game Consoles; PlayStation Consoles","false","true","","","false","false","false","false"
"O'Reilly Auto Parts","null","1816 West Central","El Dorado","","KS","67042","3163214371","0","","http://oreillyauto.custhelp.com/app/error/error_id/6","37.8177824","-96.873258","1.02357555977635","","false","false","","","false","false","false","false"
"O'Reilly Auto Parts","O'Reilly Auto Parts","1816 W Central Ave","El Dorado","Butler","KS","67042","3163214371","0","Monday: 8:00 AM - 9:00 PM Tuesday: 8:00 AM - 9:00 PM Wednesday: 8:00 AM - 9:00 PM Thursday: 8:00 AM - 9:00 PM Friday: 8:00 AM - 9:00 PM Saturday: 8:00 AM - 8:00 PM Sunday: 9:00 AM - 6:00 PM ","http://www.oreillyauto.com/","37.81747","-96.8741","1.06952324852456","Used Motor Oil; Video Game Consoles; PlayStation Consoles","false","true","Most stores offer Used Oil & Battery Recycling, Battery Testing, 
Electrical & Module Testing, Loaner Tool Program, Drum / Rotor Resurfacing. Call your location for more details.","","false","false","false","false"
"Goodwill Easter Seals of Kansas Inc. - Dell Reconnect Donation Site","","2336 West Central","El Dorado","","KS","67042","3163213125","0","","https://goodwillks.org/","37.8185214","-96.8818057","1.49132795472683","","false","false","","","false","false","false","false"
"Walmart","Walmart","301 S Village Rd","El Dorado","Butler","KS","67042","3163228100","0","","http://www.walmart.com","37.82029","-96.88956","1.92209064721623","Lead Acid (Pb) Batteries; Plastic Shopping Bags; Food Storage Bags; Video Game Consoles; PlayStation Consoles","false","true","","","false","false","false","false"
"Walmart Tire & Lube Express","Walmart Tire & Lube Express","301 S Village Rd","El Dorado","Butler","KS","67042","3163228100","0","","http://www.walmart.com/catalog/catalog.gsp?cat=495843","37.82029","-96.88956","1.92209064721623","Lead Acid (Pb) Batteries; Used Motor Oil; Oil Filters; Video Game Consoles; PlayStation Consoles","false","true","","","false","false","false","false"
"Call2Recycle at RadioShack","Call2Recycle at RadioShack","2710 W Central Ave Ste E","El Dorado","Butler","KS","67042","3163210810","0","","http://www.radioshack.com/","37.81742","-96.89069","1.97498480066919","Cell Phones; Ni-Cd Batteries; Li-Ion Batteries; Ni-MH Batteries; Ni-Zn Batteries; Small Sealed Lead Acid Batteries; Video Game Consoles; PlayStation Consoles","false","true","As the first national retailer to partner with Call2Recycle, RadioShack is at the forefront of the rechargeable battery recycling cause and is pleased to offer battery recycling at thousands of convenient RadioShack locations for free.  Simply drop them off at your local RadioShack and theyll take care of the rest.  Ask a store associate for more details.","","false","false","false","false"
"Walmart","","1618 Ohio St","Augusta","","KS","67010","3167752254","0","","https://www.walmart.com/","37.691593","-96.9698204","10.7468964577945","","false","false","","","false","false","false","false"
"Walmart","Walmart","1618 Ohio St","Augusta","Butler","KS","67010","3167752254","0","","http://www.walmart.com","37.69062","-96.97133","10.8497560690981","Lead Acid (Pb) Batteries; Plastic Shopping Bags; Food Storage Bags; Video Game Consoles; PlayStation Consoles","false","true","","","false","false","false","false"
"City of Augusta Compost/Limb Yard","","400 Grove St","Augusta","","KS","67010","3167754560","0","","https://www.augustaks.org/departments/sanitation","37.6754694","-96.9742893","11.8017169372835","","false","false","","","false","false","false","false"
"O'Reilly Auto Parts","O'Reilly Auto Parts","335 West 7th Street","Augusta","Butler","KS","67010","3167753611","0","Monday: 8:00 AM - 8:00 PM Tuesday: 8:00 AM - 8:00 PM Wednesday: 8:00 AM - 8:00 PM Thursday: 8:00 AM - 8:00 PM Friday: 8:00 AM - 8:00 PM Saturday: 8:00 AM - 7:00 PM Sunday: 9:00 AM - 6:00 PM ","http://www.oreillyauto.com/","37.67933","-96.98181","11.817618607725","Used Motor Oil; Video Game Consoles; PlayStation Consoles","false","true","Most stores offer Used Oil & Battery Recycling, Battery Testing, 
Electrical & Module Testing, Loaner Tool Program, Drum / Rotor Resurfacing. Call your location for more details.","","false","false","false","false"
"O'Reilly Auto Parts","null","335 West 7th Street ","Augusta","","KS","67010","3167753611","0","","http://oreillyauto.custhelp.com/app/error/error_id/6","37.6789449","-96.9828332","11.8720728933688","","false","false","","","false","false","false","false"
"USPS Post Office Box Lobby Recycling Program","US Post Office","119 E 5th Ave","Augusta","Butler","KS","67010","8002758777","0","","https://www.usps.com/","37.67609","-96.97781","11.8740934304096","Catalogs; Greeting Cards; Magazines; Paper (Mixed)","false","true","","","false","false","false","false"
"Potwin PRIDE/Lions Club","Potwin PRIDE/Lions Club","100 Marshall Ave ","Potwin","Butler County","KS","67123","6207523221","0","Sunday: 12:00 AM - 11:59 PM Monday: 12:00 AM - 11:59 PM Tuesday: 12:00 AM - 11:59 PM Wednesday: 12:00 AM - 11:59 PM Thursday: 12:00 AM - 11:59 PM Friday: 12:00 AM - 11:59 PM Saturday: 12:00 AM - 11:59 PM ","null","37.9384332","-97.020095","12.2970404474086","Aluminum Cans; Video Game Consoles; PlayStation Consoles","false","true","","","false","false","false","false"
"Waste Connections","","","Andover","","KS","67002","3168384920","0","","https://www.wasteconnectionswichita.com/","37.700398","-97.1144039","16.3439638655471","","false","false","","","false","false","false","false"
"Walgreens","Walgreens","440 N Andover Rd","Andover","Butler","KS","67002","3162180819","0","","http://www.walgreens.com","37.69293","-97.13511","17.5830553997768","Cell Phones; Inkjet Cartridge Refilling; Inkjet Printer Cartridges; Video Game Consoles; PlayStation Consoles","false","true","","","false","false","false","false"
"City of Andover Composting Site","","2115 E Harry St","Andover","","KS","67002","3167332621","0","","https://www.andoverks.com/326/Recycling-and-Green-Waste-Disposal","37.6647318","-97.1122729","17.6044281483847","","false","false","","","false","false","false","false"
"Senior Citizens Center","Senior Citizens Center","311 W Central Ave","Andover","Butler","KS","67002","3167334441","0","Sunday: 12:00 AM - 11:59 PM Monday: 12:00 AM - 11:59 PM Tuesday: 12:00 AM - 11:59 PM Wednesday: 12:00 AM - 11:59 PM Thursday: 12:00 AM - 11:59 PM Friday: 12:00 AM - 11:59 PM Saturday: 12:00 AM - 11:59 PM ","","37.69393","-97.13784","17.679615373425","Aluminum Cans; Video Game Consoles; PlayStation Consoles","false","true","","","false","false","false","false"
"O'Reilly Auto Parts","null","253 North Andover Road","Andover","","KS","67002","3167335797","0","","http://oreillyauto.custhelp.com/app/error/error_id/6","37.6900801","-97.1358508","17.7157104499093","","false","false","","","false","false","false","false"
"Goodwill Easter Seals of Kansas Inc. - Dell Reconnect Donation Site","","415 South Andover Road","Andover","","KS","67002","3162181800","0","","https://goodwillks.org/","37.6806404","-97.1362101","18.066529974756","","false","false","","","false","false","false","false"
"Walmart Supercenter","","301 Village Rd","El Dorado","","KS","67042","3163228100","0","","https://www.walmart.com/","37.8146324","-96.8922443","2.0701301797309","","false","false","","","false","false","false","false"
"Walmart Tire and Lube Express","","301 Village Rd","El Dorado","","KS","67042","3163228100","0","","https://www.walmart.com/cp/ideas/8932632","37.8146324","-96.8922443","2.0701301797309","","false","false","","","false","false","false","false"
"REI - Wichita","REI - Wichita","2774 N. Greenwich Ct.","Wichita","Sedgwick ","KS","67226","3167688865","0","","","37.7331254","-97.2069980817903","20.1153744477237","E-Bike Batteries","false","true","Call or Check Online for Hours","Call2Recycle","false","false","false","false"
"Firestone Complete Auto Care","","2424 N Greenwich Rd","Wichita","","KS","67226","3166369931","0","","https://www.firestonecompleteautocare.com/","37.7274143","-97.2074463","20.2574075957579","","false","false","","","false","false","false","false"
"Post Net","","2350 N Greenwich Rd #100","Wichita","","KS","67226","3166369300","0","","https://www.postnet.com/","37.7260893","-97.2070652","20.2661483602424","","false","false","","","false","false","false","false"
"uBreakiFix","uBreakiFix","2350 N Greenwich Rd.","Wichita","Sedgwick ","KS","67226","3162850055","0","","","37.7255207226577","-97.2079013528516","20.3218741442131","Batteries (Rechargeable); Cell Phone Batteries; Cell Phones; Li-Ion Batteries; Ni-Cd Batteries; Ni-MH Batteries; Small Sealed Lead Acid Batteries","false","true","Call or Check Online for Hours","Call2Recycle","false","false","false","false"
"Target Store","","10800 E 21st St N","Wichita","","KS","67206","3166364206","0","","https://corporate.target.com/corporate-responsibility/planet","37.724525","-97.2123712","20.5753779063174","","false","false","","","false","false","false","false"
"Target","Target","10800 E 21st St N","Wichita","Sedgwick","KS","67206","3166364206","0","","http://www.target.com/","37.72318","-97.21323","20.6492784048787","Aluminum Cans; Cell Phones; Inkjet Printer Cartridges; MP3 Players; Plastic #1 (PETE); Plastic #2 (HDPE); Plastic Shopping Bags; Video Game Consoles; PlayStation Consoles","false","true","","","false","false","false","false"
"Sears Repair Services","Sears Repair Services","11333 E Kellogg Dr","Wichita","Sedgwick","KS","67207","3166126860","0","","http://www.sears.com/","37.67928","-97.19024","20.6821780672859","Cell Phones; Ni-Cd Batteries; Li-Ion Batteries; Ni-MH Batteries; Ni-Zn Batteries; Small Sealed Lead Acid Batteries; Video Game Consoles; PlayStation Consoles","false","true","The U.S. EPA estimates that more than 350 million rechargeable batteries are purchased annually in the U.S. Thanks to the environmental commitment of this location, its easy and free to recycle your batteries. Bring your rechargeable batteries to this location and look for the recycling box or ask an associate how you can do your part for the environment.","","false","false","false","false"
"Call2Recycle at Lowe's","Call2Recycle at Lowe's","11959 E Kellogg Dr","Wichita","Sedgwick","KS","67207","3166843117","0","Monday: 6:00 AM - 10:00 PM Tuesday: 6:00 AM - 10:00 PM Wednesday: 6:00 AM - 10:00 PM Thursday: 6:00 AM - 10:00 PM Friday: 6:00 AM - 10:00 PM Saturday: 6:00 AM - 10:00 PM Sunday: 8:00 AM - 8:00 PM ","http://www.lowes.com/","37.679","-97.19861","21.097537637267","Cell Phones; Compact Fluorescent Lights; Ni-Cd Batteries; Plastic Shopping Bags; Li-Ion Batteries; Ni-MH Batteries; Ni-Zn Batteries; Small Sealed Lead Acid Batteries; Video Game Consoles; PlayStation Consoles","false","true","As an environmentally-committed retailer, Lowes offers a recycling center near store entrances to give consumers a free and easy way to properly dispose of rechargeable batteries, cell phones, CFLs and plastic shopping bags; materials that otherwise could be potentially harmful to the environment.  Look for the recycling center or ask a store associate for more details.","","false","false","false","false"
"Lowe's","","11959 E Kellogg Dr","Wichita","","KS","67207","3166843117","0","","https://newsroom.lowes.com/responsibility/operational-excellence/","37.6764553","-97.1982228","21.1594406041021","Batteries (Rechargeable); Cell Phone Batteries; Li-Ion Batteries; Ni-Cd Batteries; Ni-MH Batteries; Small Sealed Lead Acid Batteries; Cell Phones","false","true","","Call2Recycle","false","false","false","false"
"AT&T Wireless","AT&T Wireless","11661 E. Kellogg Avenue Suite 101","Wichita","Sedgwick","KS","67207","3166836024","0","","http://www.att.com/","37.67888","-97.20254","21.2928044293181","Cell Phones; Ni-Cd Batteries; Batteries (Rechargeable); Cell Phone Batteries; Tablets; Li-Ion Batteries; Video Game Consoles; PlayStation Consoles","false","true","Receive an AT&T Promotion Card worth the trade-in value of your smartphone, tablet, or netbook. You can also donate the trade-in value to Cell Phones for Soldiers.","","false","false","false","false"
"Cartridge World","","11333 East Kellogg Avenue","Wichita","","KS","67207","3166843455","0","","","37.6787655","-97.203583","21.3472656405609","","false","false","","","false","false","false","false"
"Wireless Lifestyle","","11333 E Kellogg Ave","Wichita","","KS","67207","3166810494","0","","","37.6787655","-97.203583","21.3472656405609","","false","false","","","false","false","false","false"
"Walgreens","Walgreens","9525 E 21st St N","Wichita","Sedgwick","KS","67206","3166311401","0","","http://www.walgreens.com","37.72293","-97.22769","21.4052885483914","Cell Phones; Inkjet Cartridge Refilling; Inkjet Printer Cartridges; Video Game Consoles; PlayStation Consoles","false","true","","","false","false","false","false"
"Walmart Supercenter","","11411 E Kellogg Dr","Wichita","","KS","67207","3166830735","0","","https://www.walmart.com/","37.6761697","-97.2033031","21.4151522310526","","false","false","","","false","false","false","false"
"Walmart Tire and Lube Express","","11411 E Kellogg Dr","Wichita","","KS","67207","3166830735","0","","https://www.walmart.com/cp/ideas/8932632","37.6761697","-97.2033031","21.4151522310526","","false","false","","","false","false","false","false"
"Walmart","Walmart","11411 E Kellogg Dr","Wichita","Sedgwick","KS","67207","3166830735","0","","http://www.walmart.com","37.67899","-97.20593","21.454927636284","Lead Acid (Pb) Batteries; Plastic Shopping Bags; Food Storage Bags; Video Game Consoles; PlayStation Consoles","false","true","","","false","false","false","false"
"Walmart Tire & Lube Express","Walmart Tire & Lube Express","11411 E Kellogg Dr","Wichita","Sedgwick","KS","67207","3166830735","0","","http://www.walmart.com/catalog/catalog.gsp?cat=495843","37.67899","-97.20593","21.454927636284","Lead Acid (Pb) Batteries; Used Motor Oil; Oil Filters; Video Game Consoles; PlayStation Consoles","false","true","","","false","false","false","false"
"Wal-mart Tire and Lube Express Center","Wal-mart Tire and Lube Express Center","11411 E Kellogg Dr","Wichita","Sedgwick","KS","67207","3166830735","0","","http://www.walmart.com/tires","37.67899","-97.20593","21.454927636284","Lead Acid (Pb) Batteries; Used Motor Oil; Oil Filters; Used Tires; Video Game Consoles; PlayStation Consoles","false","true","","","false","false","false","false"
"Tires Plus","","3745 N Rock Rd","Wichita","","KS","67226","3163150363","0","","https://www.tiresplus.com/","37.75135","-97.2452647","21.8224801393951","","false","false","","","false","false","false","false"
"Walmart Supercenter","","3030 N Rock Rd","Wichita","","KS","67226","3166364482","0","","https://www.walmart.com/","37.7385598","-97.2414425","21.8244871000774","","false","false","","","false","false","false","false"
"Walmart Tire and Lube Express","","3030 N Rock Rd","Wichita","","KS","67226","3166364482","0","","https://www.walmart.com/cp/ideas/8932632","37.7385598","-97.2414425","21.8244871000774","","false","false","","","false","false","false","false"
"Sam's Club","Sam's Club","3415 N Rock Rd","Wichita","Sedgwick","KS","67226","3166346007","0","","http://www.samsclub.com","37.74533","-97.24482","21.8907223361374","Lead Acid (Pb) Batteries; Video Game Consoles; PlayStation Consoles","false","true","","","false","false","false","false"
"RadioShack","RadioShack","3411 N Rock Rd Ste 110","Wichita","Sedgwick","KS","67226","3163166346417","0","Monday: 9:00 AM - 9:00 PM Tuesday: 9:00 AM - 9:00 PM Wednesday: 9:00 AM - 9:00 PM Thursday: 9:00 AM - 9:00 PM Friday: 9:00 AM - 9:00 PM Saturday: 10:00 AM - 9:00 PM Sunday: 11:00 AM - 6:00 PM ","http://www.radioshack.com","37.74523","-97.24483","21.8928453651393","Ni-Cd Batteries; Batteries (Rechargeable); Video Game Consoles; PlayStation Consoles","false","true","","","false","false","false","false"
"Call2Recycle at RadioShack","Call2Recycle at RadioShack","3411 N Rock Rd Ste 110","Wichita","Sedgwick","KS","67226","3166346417","0","","http://www.radioshack.com/","37.74523","-97.24483","21.8928453651393","Cell Phones; Ni-Cd Batteries; Li-Ion Batteries; Ni-MH Batteries; Ni-Zn Batteries; Small Sealed Lead Acid Batteries; Video Game Consoles; PlayStation Consoles","false","true","As the first national retailer to partner with Call2Recycle, RadioShack is at the forefront of the rechargeable battery recycling cause and is pleased to offer battery recycling at thousands of convenient RadioShack locations for free.  Simply drop them off at your local RadioShack and theyll take care of the rest.  Ask a store associate for more details.","","false","false","false","false"
"AutoZone","AutoZone","10221 E Kellogg Dr","Wichita","Sedgwick","KS","67207","3166841145","0","","http://www.autozone.com","37.67923","-97.21524","21.9039417063359","Lead Acid (Pb) Batteries; Used Motor Oil; Video Game Consoles; PlayStation Consoles","false","true","Most AutoZone stores accept used motor oil, transmission fluid, gear oil and automotive batteries. Call to see what your local store is currently accepting.","","false","false","false","false"
"AT&T Wireless","AT&T Wireless","3300 North Rock Road Suite J","Wichita","Sedgwick","KS","67226","3166362355","0","","http://www.att.com/","37.7434","-97.24457","21.9085282510461","Cell Phones; Ni-Cd Batteries; Batteries (Rechargeable); Cell Phone Batteries; Tablets; Li-Ion Batteries; Video Game Consoles; PlayStation Consoles","false","true","Receive an AT&T Promotion Card worth the trade-in value of your smartphone, tablet, or netbook. You can also donate the trade-in value to Cell Phones for Soldiers.","","false","false","false","false"
"Sprint","Sprint","3101 N Rock Rd Ste 175","Wichita","Sedgwick","KS","67226","3166344900","0","Monday: 9:00 AM - 8:00 PM Tuesday: 9:00 AM - 8:00 PM Wednesday: 9:00 AM - 8:00 PM Thursday: 9:00 AM - 8:00 PM Friday: 9:00 AM - 8:00 PM Saturday: 9:00 AM - 8:00 PM Sunday: 11:00 AM - 6:00 PM ","http://green.sprint.com/","37.74004","-97.24474","21.9734950920331","Cell Phones; Video Game Consoles; PlayStation Consoles","false","true","","","false","false","false","false"
"Sams Club","","3415 N Rock Rd","Wichita","","KS","67226","3166346007","0","","https://www.samsclub.com/","37.7471786","-97.2470812","21.9820665999873","","false","false","","","false","false","false","false"
"Kohl's","","3561 North Rock Road","Wichita","","KS","67226","3166361126","0","","https://corporate.kohls.com/","37.7486342","-97.2475868","21.986764440265","","false","false","","","false","false","false","false"
"Office Depot","Office Depot","3035 N Rock Rd","Wichita","Sedgwick","KS","67226","3166311451","0","Monday: 8:00 AM - 9:00 PM Tuesday: 8:00 AM - 9:00 PM Wednesday: 8:00 AM - 9:00 PM Thursday: 8:00 AM - 9:00 PM Friday: 8:00 AM - 9:00 PM Saturday: 9:00 AM - 9:00 PM Sunday: 10:00 AM - 6:00 PM ","http://www.officedepot.com/techrecycling","37.73885","-97.24474","21.9938611768822","Cell Phones; Electronics; Inkjet Printer Cartridges; Batteries (Rechargeable); MP3 Players; Video Game Consoles; PlayStation Consoles","false","true","Office Depot offers electronics recycling for a small fee. Visit their Web site for more details and store locations. Recycle cell phones, PDAs, rechargeable batteries and ink and toner cartridges for FREE!","","false","false","false","false"
"Walmart Tire & Lube Express","Walmart Tire & Lube Express","3030 N Rock Rd","Wichita","Sedgwick","KS","67226","3166364482","0","","http://www.walmart.com/catalog/catalog.gsp?cat=495843","37.73854","-97.24465","21.9944532924467","Lead Acid (Pb) Batteries; Used Motor Oil; Oil Filters; Video Game Consoles; PlayStation Consoles","false","true","","","false","false","false","false"
"Walmart","Walmart","3030 N Rock Rd","Wichita","Sedgwick","KS","67226","3166364482","0","","http://www.walmart.com","37.73854","-97.24465","21.9944532924467","Lead Acid (Pb) Batteries; Plastic Shopping Bags; Food Storage Bags; Video Game Consoles; PlayStation Consoles","false","true","","","false","false","false","false"
"OfficeMax","null","3535 N Rock Rd","Wichita","","KS","67226","3166311451","0","","null","37.7476522","-97.2475799","22.0013433328859","","false","false","","","false","false","false","false"
"Sprint Store","null","3101 N Rock Rd Ste 175 & 180,","Wichita","","KS","67226","3166344900","0","","https://newsroom.sprint.com/csr/device-donations/","37.7401529","-97.2457536","22.0252645747516","","false","false","","","false","false","false","false"
"Cartridge World","","2250 North Rock Road","Wichita","","KS","67226","3166811183","0","","","37.724878","-97.243125","22.1698682453826","","false","false","","","false","false","false","false"
"Verizon Wireless","Verizon Wireless","2161 N Rock Rd Ste 120","Wichita","Sedgwick","KS","67206","8666444532","0","","http://www.verizonwireless.com/","37.72257","-97.24469","22.2984620301403","Cell Phones; Cell Phone Batteries; Video Game Consoles; PlayStation Consoles","false","true","<A Href="https://www.trade-in.vzw.com/home.aspx">
The Verizon Wireless Trade-In Program</A> allows you to trade in your used handset or tablet in a convenient and responsible way. 
<P>
<P>
Verizon Wireless works every day to protect our environment and give our customers opportunities to do the same. <A Href="http://aboutus.vzw.com/Green_Initiative/overview.html">Click here</A> for more examples of the earth-friendly initiatives and programs Verizon Wireless is proud to offer and support.","","false","false","false","false"
"Caster Excavating","Caster Excavating","6609 N Woodlawn St","Kechi","Sedgwick","KS","67067","3167441206","0","Monday: 8:00 AM - 5:00 PM Tuesday: 8:00 AM - 5:00 PM Wednesday: 8:00 AM - 5:00 PM Thursday: 8:00 AM - 5:00 PM Friday: 8:00 AM - 5:00 PM ","","37.80365","-97.26271","22.3023210116863","Car; Ferrous Metals (Steel or Iron); Large Household Appliances; Non-ferrous (Copper/Brass/Tin); Video Game Consoles; PlayStation Consoles","false","true","","","false","false","false","false"
"Best Buy","Best Buy","2111 N Rock Rd ","Wichita","Sedgwick County","KS","67206","3166845026","0","","https://www.bestbuy.com/recycle","37.7219713","-97.2465559","22.4081131676055","Large Household Appliances; Refrigerators; Televisions; AC Power Plugs; Batteries (Rechargeable); Cables & Connectors; Car Audio/Video Equipment; Cell Phone Batteries; Cell Phones; Computer (Recycling); Hard Drives; Computer Monitors; Cameras; DVD Players/Blu-Ray Players/DVRs; Electronics; E-Readers; GPS Units; Headphones; Inkjet Printer Cartridges; Laptop Computers; Laser Toner Cartridges; Li-Ion Batteries; MP3 Players; Network Equipment; Ni-Cd Batteries; Ni-MH Batteries; Ni-Zn Batteries; Computer Peripherals; Portable Media Players; Printers/Scanners/Fax Machines; Small Electronics; Small Sealed Lead Acid Batteries; Stereo Equipment; Tablets; Telephones; UPS Batteries/Backup Systems; VCRs; Video Game Systems; Blu-Ray Players; Digital Converter Boxes; Small Televisions; Video Game Consoles; PlayStation Consoles","true","true","2 TVs per visit, 3 e-waste items per day; $25 fee for TVs and Monitors; $19.99 pick-up fee with delivery; $99.99 standalone pickup fee; ","Sony, Vizio, OEM","false","false","false","false"
"Best Buy","null","2111 North Rock Rd","Wichita","","KS","67206","3166845026","0","","https://www.bestbuy.com/site/services/recycling/pcmcat149900050025.c?id=pcmcat149900050025","37.7219713","-97.2465559","22.4081131676055","","false","false","","","false","false","false","false"
"US Post Office","US Post Office","9350 E Corporate Hills Dr","Wichita","Sedgwick","KS","67207","0","0","","https://www.usps.com/ship/recycle-through-usps.htm","37.68199","-97.22813","22.4590109468655","Inkjet Printer Cartridges; Video Game Consoles; PlayStation Consoles","false","true","Free, postage-paid Mail Back envelopes can be found on display in the lobby. There is no limit to the number of envelopes customers may take. The contents of the envelope must weigh less than 13 ounces and the envelope must be able to seal completely. For more details visit<a href="http://www.maxback.com/mxb-postoffice-collaboration" target="_blank">MaxBack</a>.","","false","false","false","false"
"Walgreens","Walgreens","3770 N Woodlawn Blvd","Wichita","Sedgwick","KS","67220","3166861838","0","","http://www.walgreens.com","37.75185","-97.26237","22.7295328796617","Cell Phones; Inkjet Cartridge Refilling; Inkjet Printer Cartridges; Video Game Consoles; PlayStation Consoles","false","true","","","false","false","false","false"
"Home Depot","","3350 N Woodlawn Blvd","Wichita","","KS","67226","3166810899","0","","https://ecooptions.homedepot.com/","37.7442869","-97.2612125","22.7792209752269","Batteries (Rechargeable); Cell Phone Batteries; Li-Ion Batteries; Ni-Cd Batteries; Ni-MH Batteries; Small Sealed Lead Acid Batteries","false","true","","Call2Recycle","false","false","false","false"
