name,description,address,city,region,province,postal_code,phone,fax,hours,url,latitude,longitude,distance,materials,pickup,dropoff,notes,groups,curbside,municipal,national,event_only
"AutoZone","","9701 E Harry St","Wichita","","KS","67207","3166863284","0","","https://www.autozone.com/landing/page.jsp?name=in-our-stores","37.6641552","-97.2242171","22.8130860272185","","false","false","","","false","false","false","false"
"AutoZone","AutoZone","9701 E Harry St","Wichita","Sedgwick","KS","67207","3166863284","0","","http://www.autozone.com","37.66456","-97.22503","22.8394081150154","Lead Acid (Pb) Batteries; Used Motor Oil; Video Game Consoles; PlayStation Consoles","false","true","Most AutoZone stores accept used motor oil, transmission fluid, gear oil and automotive batteries. Call to see what your local store is currently accepting.","","false","false","false","false"
"Home Depot","Home Depot","3350 N Woodlawn Blvd","Wichita","Sedgwick","KS","67220","3166810899","0","","http://www.homedepot.com","37.74376","-97.26224","22.8421087938812","Compact Fluorescent Lights; Batteries (Rechargeable); Video Game Consoles; PlayStation Consoles","false","true","Home Depot accepts compact fluorescent bulbs and used power tool rechargeable batteries. Look for the orange drop boxes, usually located near the front entrance near the customer service desk.","","false","false","false","false"
"Call2Recycle at the Home Depot","Call2Recycle at the Home Depot","3350 N Woodlawn","Wichita","Sedgwick","KS","67220","3166810899","0","","http://www.homedepot.com/","37.74376","-97.26224","22.8421087938812","Cell Phones; Compact Fluorescent Lights; Ni-Cd Batteries; Li-Ion Batteries; Ni-MH Batteries; Ni-Zn Batteries; Small Sealed Lead Acid Batteries; Video Game Consoles; PlayStation Consoles","false","true","The Home Depot accepts used rechargeable batteries and compact fluorescent bulbs. Look for the orange drop boxes, usually located near the front entrance near the customer service desk, or ask a store associate for more details.","","false","false","false","false"
"Neighborhood Market by Walmart","","9831 E Harry St","Wichita","","KS","67207","3163613305","0","","https://www.walmart.com/","37.6628042","-97.2239954","22.846076577825","","false","false","","","false","false","false","false"
"Walgreens","Walgreens","1625 S Webb Rd","Wichita","Sedgwick","KS","67207","3166529147","0","","http://www.walgreens.com","37.66383","-97.22625","22.9219329765146","Cell Phones; Inkjet Printer Cartridges; Video Game Consoles; PlayStation Consoles","false","true","","","false","false","false","false"
"Sedgwick County Christmas Tree Drop-Off Event - Great Plains Nature Center","","6232 E 29th St N","Wichita","","KS","67220","3166607200","0","","https://www.sedgwickcounty.org/","37.7392484","-97.2638248","22.9985201684064","","false","false","","","false","false","false","false"
"BICYCLE PEDALER","BICYCLE PEDALER","330 N Rock Rd.","Wichita","Sedgwick ","KS","67206","3166854545","0","","","37.6908648411687","-97.2444060443892","23.0287581353382","E-Bike Batteries","false","true","Call or Check Online for Hours","Call2Recycle","false","false","false","false"
"OfficeMax","null","8147 EAST KELLOG","Wichita","","KS","67207","3166861401","0","","null","37.6777763","-97.2400872","23.1746573463952","","false","false","","","false","false","false","false"
"OfficeMax","OfficeMax","8147 E Kellogg Dr","Wichita","Sedgwick","KS","67207","3166861401","0","Monday: 8:00 AM - 9:00 PM Tuesday: 8:00 AM - 9:00 PM Wednesday: 8:00 AM - 9:00 PM Thursday: 8:00 AM - 9:00 PM Friday: 8:00 AM - 9:00 PM Saturday: 9:00 AM - 9:00 PM Sunday: 11:00 AM - 6:00 PM ","http://www.officemax.com","37.67895","-97.24158","23.2150730237843","Inkjet Cartridge Refilling; Inkjet Printer Cartridges; Laser Toner Cartridges; Video Game Consoles; PlayStation Consoles","false","true","This location features Phoenix Ink refill kiosks.","","false","false","false","false"
"Packaging Store","Packaging Store","6249 E 21st St N Ste 116","Wichita","Sedgwick","KS","67208","3166856086","0","Monday: 9:00 AM - 6:00 PM Tuesday: 9:00 AM - 6:00 PM Wednesday: 9:00 AM - 6:00 PM Thursday: 9:00 AM - 6:00 PM Friday: 9:00 AM - 6:00 PM Saturday: 9:00 AM - 2:00 PM ","","37.72291","-97.26405","23.3043149867591","Packing Materials; Packing Peanut (Reuse); Video Game Consoles; PlayStation Consoles","false","true","","","false","false","false","false"
"Call2Recycle at RadioShack","Call2Recycle at RadioShack","448 S Rock Rd","Wichita","Sedgwick","KS","67207","3166869671","0","","http://www.radioshack.com/","37.68025","-97.24449","23.3231044701786","Cell Phones; Ni-Cd Batteries; Li-Ion Batteries; Ni-MH Batteries; Ni-Zn Batteries; Small Sealed Lead Acid Batteries; Video Game Consoles; PlayStation Consoles","false","true","As the first national retailer to partner with Call2Recycle, RadioShack is at the forefront of the rechargeable battery recycling cause and is pleased to offer battery recycling at thousands of convenient RadioShack locations for free.  Simply drop them off at your local RadioShack and theyll take care of the rest.  Ask a store associate for more details.","","false","false","false","false"
"Wireless Lifestyle","","7700 E Kellogg Dr","Wichita","","KS","67207","3166918536","0","","","37.6826997","-97.2474183","23.4010638165854","","false","false","","","false","false","false","false"
"JCPenney","","7700 E Kellogg Dr","Wichita","","KS","67207","3166856261","0","","https://www.jcpenney.com/","37.6826997","-97.2474183","23.4010638165854","","false","false","","","false","false","false","false"
"Firestone Complete Auto Care","","7700 E Kellogg","Wichita","","KS","67207","3166842682","0","","https://www.firestonecompleteautocare.com/","37.6826997","-97.2474183","23.4010638165854","","false","false","","","false","false","false","false"
"Best Buy Mobile","","7700 E Kellogg","Wichita","","KS","67207","3166181200","0","","https://www.bestbuy.com/site/services/recycling/pcmcat149900050025.c?id=pcmcat149900050025","37.6826997","-97.2474183","23.4010638165854","","false","false","","","false","false","false","false"
"Jiffy Lube","Jiffy Lube","6025 E 21st St N","Wichita","Sedgwick","KS","67208","3166885566","0","Monday: 8:00 AM - 6:00 PM Tuesday: 8:00 AM - 6:00 PM Wednesday: 8:00 AM - 6:00 PM Thursday: 8:00 AM - 6:00 PM Friday: 8:00 AM - 6:00 PM Saturday: 8:00 AM - 5:00 PM ","","37.7229","-97.26624","23.4193257269227","Used Motor Oil; Video Game Consoles; PlayStation Consoles","false","true","","","false","false","false","false"
"City of Kechi Christmas Tree Drop-Off Event","","107 Sioux St","Kechi","","KS","67067","3166607200","0","","https://www.sedgwickcounty.org/","37.7971894","-97.2829473","23.4296378740821","","false","false","","","false","false","false","false"
"FedEx Office","FedEx Office","7701 E Kellogg Dr","Wichita","Sedgwick","KS","67207","3166821327","0","Monday: 7:00 AM - 11:00 PM Tuesday: 7:00 AM - 11:00 PM Wednesday: 7:00 AM - 11:00 PM Thursday: 7:00 AM - 11:00 PM Friday: 7:00 AM - 9:00 PM ","http://www.fedex.com/us/office/","37.67897","-97.24742","23.5054779687351","Inkjet Printer Cartridges; Video Game Consoles; PlayStation Consoles","false","true","","","false","false","false","false"
"Walgreens","Walgreens","1330 N Woodlawn St","Wichita","Sedgwick","KS","67208","3166842828","0","","http://www.walgreens.com","37.70702","-97.26216","23.5406803041787","Cell Phones; Inkjet Printer Cartridges; Video Game Consoles; PlayStation Consoles","false","true","","","false","false","false","false"
"Target Store","","301 S Towne East Mall Dr","Wichita","","KS","67207","3166881556","0","","https://corporate.target.com/corporate-responsibility/planet","37.6831112","-97.2521822","23.6287449019165","","false","false","","","false","false","false","false"
"Target Store","","301 S Towne East Mall Dr","Wichita","","KS","67207","3166881556","0","","https://corporate.target.com/corporate-responsibility/planet","37.6831112","-97.2521822","23.6287449019165","","false","false","","","false","false","false","false"
"Goodwill Easter Seals of Kansas Inc. - Dell Reconnect Donation Site","","3636 N. Oliver","Wichita","","KS","67220","3167443822","0","","https://goodwillks.org/","37.7503131","-97.2792797","23.6558142596358","","false","false","","","false","false","false","false"
"Goodwill Industries","Goodwill Industries","3636 N Oliver St","Wichita","Sedgwick","KS","67220","3167443822","0","Monday: 9:00 AM - 8:00 PM Tuesday: 9:00 AM - 8:00 PM Wednesday: 9:00 AM - 8:00 PM Thursday: 9:00 AM - 8:00 PM Friday: 9:00 AM - 8:00 PM Saturday: 9:00 AM - 8:00 PM Sunday: 1:00 PM - 6:00 PM ","http://www.goodwill.org","37.74934","-97.28054","23.736712554711","Books (Reuse); Clothing; Electronics; Video Game Systems; Furniture; Household Goods; Reusable Appliance Donation; Sporting Goods; Miscellaneous Tools; Children's Toys; MP3 Players; Video Game Consoles; PlayStation Consoles","false","true","","","false","false","false","false"
"The UPS Store","The UPS Store","6505 E Central Ave","Wichita","Sedgwick","KS","67206","3166851717","0","Monday: 8:30 AM - 6:00 PM Tuesday: 8:30 AM - 6:00 PM Wednesday: 8:30 AM - 6:00 PM Thursday: 8:30 AM - 6:00 PM Friday: 8:30 AM - 6:00 PM Saturday: 9:30 AM - 3:00 PM ","","37.69372","-97.26014","23.7537033918076","Cardboard; Packing Materials; Packing Peanut (Reuse); Video Game Consoles; PlayStation Consoles","false","true","","","false","false","false","false"
"Custom Pack and Ship","Custom Pack and Ship","513 S Woodlawn Blvd","Wichita","Sedgwick","KS","67218","3166881329","0","Monday: 9:00 AM - 5:30 PM Tuesday: 9:00 AM - 5:30 PM Wednesday: 9:00 AM - 5:30 PM Thursday: 9:00 AM - 5:30 PM Friday: 9:00 AM - 5:30 PM Saturday: 10:00 AM - 3:00 PM ","","37.69405","-97.26227","23.8540562380414","Cardboard; Packing Materials; Packing Peanut (Reuse); Video Game Consoles; PlayStation Consoles","false","true","","","false","false","false","false"
"Goodwill Easter Seals of Kansas Inc. - Dell Reconnect Donation Site","","1625 South Rock Road Suite 115A","Wichita","","KS","67207","3166919341","0","","https://goodwillks.org/","37.6642383","-97.2461135","23.8762539982604","","false","false","","","false","false","false","false"
"Jiffy Lube","Jiffy Lube","7718 E Harry St","Wichita","Sedgwick","KS","67207","3166863379","0","Monday: 8:00 AM - 6:00 PM Tuesday: 8:00 AM - 6:00 PM Wednesday: 8:00 AM - 6:00 PM Thursday: 8:00 AM - 6:00 PM Friday: 8:00 AM - 6:00 PM Saturday: 8:00 AM - 5:00 PM ","","37.66478","-97.24865","23.9839451283554","Used Motor Oil; Video Game Consoles; PlayStation Consoles","false","true","","","false","false","false","false"
"Wichita Public Library - Rockwell Branch","Wichita Public Library - Rockwell Branch","5939 E 9th St N","Wichita","Sedgwick","KS","67208","3166889361","0","Monday: 10:00 AM - 9:00 PM Tuesday: 10:00 AM - 9:00 PM Wednesday: 10:00 AM - 9:00 PM Thursday: 10:00 AM - 9:00 PM Friday: 10:00 AM - 5:00 PM Saturday: 10:00 AM - 5:00 PM ","http://www.wichita.lib.ks.us/","37.701","-97.26827","23.993903163452","Books (Reuse); Video Game Consoles; PlayStation Consoles","false","true","","","false","false","false","false"
"Sedgwick County Christmas Tree Drop-Off Event - Edgemoor Park","","5815 East 9th St N","Wichita","","KS","67208","3166607200","0","","https://www.sedgwickcounty.org/","37.700126","-97.269029","24.053395365268","","false","false","","","false","false","false","false"
"The UPS Store","The UPS Store","2250 N Rock Rd Ste 118","Wichita","Sedgwick","KS","67226","3166866190","0","Monday: 9:00 AM - 6:00 PM Tuesday: 9:00 AM - 6:00 PM Wednesday: 9:00 AM - 6:00 PM Thursday: 9:00 AM - 6:00 PM Friday: 9:00 AM - 6:00 PM Saturday: 10:00 AM - 3:00 PM ","","37.6524","-97.24438","24.1683305555561","Cardboard; Packing Materials; Packing Peanut (Reuse); Video Game Consoles; PlayStation Consoles","false","true","","","false","false","false","false"
"Cartridge World","Cartridge World","2250 N Rock Rd","Wichita","Sedgwick","KS","67226","3106811183","0","Monday: 9:00 AM - 6:00 PM Tuesday: 9:00 AM - 6:00 PM Wednesday: 9:00 AM - 6:00 PM Thursday: 9:00 AM - 6:00 PM Friday: 9:00 AM - 6:00 PM Saturday: 10:00 AM - 4:00 PM ","http://www.cartridgeworld.com","37.6524","-97.24438","24.1683305555561","Inkjet Cartridge Refilling; Inkjet Printer Cartridges; Laser Toner Refilling; Laser Toner Cartridges; Video Game Consoles; PlayStation Consoles","false","true","This site specializes in refilling and remanufacturing all kinds of inkjet, laser, fax and copier cartridges.  This site will also purchase empty used refillable cartridges.","","false","false","false","false"
"Integrated Plastics Solutions, LLC","","420 N Industrial Rd","El Dorado","","KS","67042","3169426900","0","","","37.822211","-96.911203","3.11061897993431","","false","false","","","false","false","false","false"
"Butler County HHW Drop-off Site","","Southwest 40th Street","El Dorado","","KS","67042","3163219278","0","","https://www.bucoks.com/DocumentCenter/View/357/hhwflyer2019?bidId=","37.7663688","-96.8984774","4.27815259962881","","false","false","","","false","false","false","false"
