name,description,address,city,region,province,postal_code,phone,fax,hours,url,latitude,longitude,distance,materials,pickup,dropoff,notes,groups,curbside,municipal,national,event_only
"O'Reilly Auto Parts","null","1702 North Buckeye Avenue ","Abilene","","KS","67410","7852634200","0","","http://oreillyauto.custhelp.com/app/error/error_id/6","38.933622","-97.2146875","21.4183651945341","","false","false","","","false","false","false","false"
"AutoZone","AutoZone","1610 N Buckeye Ave","Abilene","Dickinson","KS","67410","7852630106","0","","http://www.autozone.com","38.93295","-97.21468","21.4329432879552","Lead Acid (Pb) Batteries; Used Motor Oil; Video Game Consoles; PlayStation Consoles","false","true","Most AutoZone stores accept used motor oil, transmission fluid, gear oil and automotive batteries. Call to see what your local store is currently accepting.","","false","false","false","false"
"AutoZone","","1610 N Buckeye Ave","Abilene","","KS","67410","7852630106","0","","https://www.autozone.com/landing/page.jsp?name=in-our-stores","38.9328916","-97.2146875","21.4337975060304","","false","false","","","false","false","false","false"
"RadioShack","RadioShack","317 NE 14th St","Abilene","Dickinson","KS","67410","7852631847","0","Monday: 9:00 AM - 6:00 PM Tuesday: 9:00 AM - 6:00 PM Wednesday: 9:00 AM - 6:00 PM Thursday: 9:00 AM - 6:00 PM Friday: 9:00 AM - 6:00 PM ","http://www.radioshack.com","38.93008","-97.2109","21.687494895203","Ni-Cd Batteries; Batteries (Rechargeable); Video Game Consoles; PlayStation Consoles","false","true","","","false","false","false","false"
"USPS Post Office Box Lobby Recycling Program","US Post Office","116 S Center St","Assaria","Saline","KS","67416","8002758777","0","","https://www.usps.com/","38.69879","-97.62068","22.7518732048343","Catalogs; Greeting Cards; Magazines; Paper (Mixed)","false","true","","","false","false","false","false"
"Dickinson County HHW Drop-off Site","","2363 Jeep Rd","Abilene","","KS","67410","7852634780","0","","http://www.dkcoks.org/96/Household-Hazardous-Waste","38.939427","-97.169904","23.6144903697091","","false","false","","","false","false","false","false"
"McPherson County Recycling Drop-Off Site - Lindsborg","","100 E Lindsborg","Lindsborg","","KS","67456","7852273355","0","","http://www.maswu.org/","38.5679234","-97.674372","32.0387319547277","","false","false","","","false","false","false","false"
"Senior Citizens Center","Senior Citizens Center","808 Knollwood St ","Wakefield","Clay County","KS","67487","7854615713","0","Sunday: 12:00 AM - 11:59 PM Monday: 12:00 AM - 11:59 PM Tuesday: 12:00 AM - 11:59 PM Wednesday: 12:00 AM - 11:59 PM Thursday: 12:00 AM - 11:59 PM Friday: 12:00 AM - 11:59 PM Saturday: 12:00 AM - 11:59 PM ","","39.218379","-97.0217781","33.4241488312258","Aluminum Cans; Video Game Consoles; PlayStation Consoles","false","true","","","false","false","false","false"
"Hess Salvage","Hess Salvage","404 Bridge St","Clay Center","Clay","KS","67432","7856325233","0","Monday: 8:00 AM - 5:00 PM Tuesday: 8:00 AM - 5:00 PM Wednesday: 8:00 AM - 5:00 PM Thursday: 8:00 AM - 5:00 PM Friday: 8:00 AM - 5:00 PM Saturday: 9:00 AM - 12:00 PM ","null","39.36893","-97.12655","34.4237375568699","Car; Ferrous Metals (Steel or Iron); Non-ferrous (Copper/Brass/Tin); Video Game Consoles; PlayStation Consoles","false","true","","","false","false","false","false"
"Cash Back Recycling","Cash Back Recycling","802 McBratney St","Clay Center","Clay","KS","67432","7856323031","0","Monday: 8:00 AM - 5:00 PM Tuesday: 8:00 AM - 5:00 PM Wednesday: 8:00 AM - 5:00 PM Thursday: 8:00 AM - 5:00 PM Friday: 8:00 AM - 5:00 PM Saturday: 8:00 AM - 2:00 PM ","","39.37091","-97.12086","34.7392606152172","Plastic #1 (PETE); Plastic #2 (HDPE); Plastic #2 (Color HDPE); Aerosol Spray Cans; Aluminum Cans; Aluminum; Car; Glass (Brown); Brown Paper Bags; Cardboard; Chipboard; Glass (Clear); Ferrous Metals (Steel or Iron); Glass (Green); Large Household Appliances; Clothes Hangers (Metal); Non-ferrous (Copper/Brass/Tin); Wood Pallets; Tin or Steel Cans; Wood; Yard Waste; Video Game Consoles; PlayStation Consoles","false","true","","","false","false","false","false"
"Call2Recycle at Patterson Healthmart Pharmacy","Call2Recycle at Patterson Healthmart Pharmacy","422 Lincoln Ave","Clay Center","Clay","KS","67432","7856322525","0","","http://www.radioshack.com/","39.37618","-97.12684","34.7567944727261","Cell Phones; Ni-Cd Batteries; Li-Ion Batteries; Ni-MH Batteries; Ni-Zn Batteries; Small Sealed Lead Acid Batteries; Video Game Consoles; PlayStation Consoles","false","true","The U.S. EPA estimates that more than 350 million rechargeable batteries are purchased annually in the U.S. Thanks to the environmental commitment of this location, its easy and free to recycle your batteries. Bring your rechargeable batteries to this location and look for the recycling box or ask an associate how you can do your part for the environment.","","false","false","false","false"
"McPherson County Recycling Drop-Off Site - Marquette","","308 N Phillips","Marquette","","KS","67464","7855462205","0","","http://www.maswu.org/","38.5555348","-97.8302218","34.9851250086493","","false","false","","","false","false","false","false"
"Kanopolis State Park","","","Marquette","","KS","67464","7855462565","0","","","38.5555632","-97.8336559","35.0507444870933","","false","false","","","false","false","false","false"
"Walmart Supercenter","","College Dr","Concordia","","KS","66901","7852432602","0","","https://www.walmart.com/","39.5536168","-97.6603312","36.5195301631919","","false","false","","","false","false","false","false"
"Clay County HHW Drop-Off Site","","1330 21st Rd","Clay Center","","KS","67432","7856322487","0","","https://www.claycountykansas.org","39.4226997","-97.140214","36.5714523331347","","false","false","","","false","false","false","false"
"Walmart","Walmart","140 E College Dr","Concordia","Cloud","KS","66901","7852432602","0","","http://www.walmart.com","39.55867","-97.6665","36.8998723050837","Lead Acid (Pb) Batteries; Plastic Shopping Bags; Food Storage Bags; Video Game Consoles; PlayStation Consoles","false","true","","","false","false","false","false"
"O'Reilly Auto Parts","null","1601 Lincoln Street ","Concordia","","KS","66901","7852434225","0","","http://oreillyauto.custhelp.com/app/error/error_id/6","39.5611585","-97.6568031","37.0208168392267","","false","false","","","false","false","false","false"
"Champlin Tire Recycling Inc","Champlin Tire Recycling Inc","PO Box 445","Concordia","Cloud","KS","66901","7852433345","0","","http://www.champlintirerecycling.com","39.56369","-97.65334","37.1789576611118","Plastic #2 (HDPE); Plastic #3 (PVC); Plastic #4 (LDPE); Plastic #5 (Polypropylene); Plastic #6 (Polystyrene); Ferrous Metals (Steel or Iron); Used Tires; Rubber; Video Game Consoles; PlayStation Consoles","false","true","","","false","false","false","false"
"USPS Post Office Box Lobby Recycling Program","US Post Office","101 N Kansas St","Kanopolis","Ellsworth","KS","67454","8002758777","0","","https://www.usps.com/","38.71146","-98.15848","37.3658039516689","Catalogs; Greeting Cards; Magazines; Paper (Mixed)","false","true","","","false","false","false","false"
"Second Chance Recycling","","102 East 2nd Street","Kanopolis","","KS","67454","7854723707","0","","","38.7078499","-98.1578569","37.4856238759996","","false","false","","","false","false","false","false"
"McPherson County Household Hazardous Waste Drop-off","","1481 Pueblo Rd","Mcpherson","","KS","67456","6206543793","0","","http://www.maswu.org","38.480355","-97.650709","37.9207762227524","","false","false","","","false","false","false","false"
"Champlin Tire Recycling, Inc. - A Waste Cap  NE Member","","301 Cedar Street","Concordia","","KS","66901","7852433345","0","","","39.5744378","-97.6642212","37.9713855452529","","false","false","","","false","false","false","false"
"Brown Disposal and Recycling","Brown Disposal and Recycling","630 W 2nd St ","Concordia","Cloud County","KS","66901","7852434412","0","","","39.5757577","-97.66859","38.0856337904354","Aluminum Cans; Cardboard; Greeting Cards; Paper (Mixed); Video Game Consoles; PlayStation Consoles","false","true","","","false","false","false","false"
"Brown Disposal & Recycling","Brown Disposal & Recycling","101 E 1st St","Concordia","Cloud","KS","66901","7852434412","0","","","39.57689","-97.65754","38.1068758524676","Aluminum Cans; Cardboard; Greeting Cards; Paper (Mixed); Video Game Consoles; PlayStation Consoles","false","true","","","false","false","false","false"
"USPS Post Office Box Lobby Recycling Program","US Post Office","123 W 2nd St","Ellsworth","Ellsworth","KS","67439","8002758777","0","","https://www.usps.com/","38.7306","-98.23015","39.8567605212851","Catalogs; Greeting Cards; Magazines; Paper (Mixed)","false","true","","","false","false","false","false"
"Goodwill Easter Seals of Kansas Inc. - Dell Reconnect Donation Site","","1008 West 6th","Junction City","","KS","66441","7852388920","0","","https://goodwillks.org/","39.0289483","-96.8473277","40.1162233290084","","false","false","","","false","false","false","false"
"Carnahan Curbside Recycling","","","Junction City","","KS","66441","7853200739","0","","http://ww1.carnahancurbside.com/?subid1=ba4253e8-8317-11e9-bf32-6fc1264d2455","39.0286093","-96.8313978","40.971243379764","","false","false","","","false","false","false","false"
"Firestone Complete Auto Care","","128 W 8th St","Junction City","","KS","66441","7852385111","0","","https://www.firestonecompleteautocare.com/","39.0306454","-96.8307033","41.0084365039955","","false","false","","","false","false","false","false"
"O'Reilly Auto Parts","O'Reilly Auto Parts","134 E 6th St","Junction City","Geary","KS","66441","7857622112","0","Monday: 8:00 AM - 8:00 PM Tuesday: 8:00 AM - 8:00 PM Wednesday: 8:00 AM - 8:00 PM Thursday: 8:00 AM - 8:00 PM Friday: 8:00 AM - 8:00 PM Saturday: 8:00 AM - 8:00 PM Sunday: 9:00 AM - 5:00 PM ","http://www.oreillyauto.com/","39.02834","-96.83014","41.0387979510174","Used Motor Oil; Video Game Consoles; PlayStation Consoles","false","true","Most stores offer Used Oil & Battery Recycling, Battery Testing, 
Electrical & Module Testing, Loaner Tool Program, Drum / Rotor Resurfacing. Call your location for more details.","","false","false","false","false"
"Firestone Complete Auto Care Store","Firestone Complete Auto Care Store","128 W 8th St","Junction City","Geary","KS","66441","7852093513","0","","http://www.firestonecompleteautocare.com/","39.03044","-96.83001","41.0456321759594","Lead Acid (Pb) Batteries; Used Motor Oil; Video Game Consoles; PlayStation Consoles","false","true","","","false","false","false","false"
"Disabled American Veterans Economy Store","Disabled American Veterans Economy Store","123 W 7th St","Junction City","Geary","KS","66441","7852381430","0","Monday: 9:00 AM - 5:00 PM Tuesday: 9:00 AM - 5:00 PM Wednesday: 9:00 AM - 5:00 PM Thursday: 9:00 AM - 5:00 PM Friday: 9:00 AM - 5:00 PM Saturday: 9:00 AM - 5:00 PM ","","39.02921","-96.8298","41.0569246044184","Books (Reuse); Clothing; Gift Bags; Furniture; Household Goods; Large Household Appliances; Ornaments; Miscellaneous Tools; Video Game Consoles; PlayStation Consoles","false","true","","","false","false","false","false"
"Call2Recycle at Waters True Value Hardware","Call2Recycle at Waters True Value Hardware","129 E 6th St","Junction City","Geary","KS","66441","7852383114","0","","http://www.waterstruevalue.com","39.02816","-96.82973","41.0608393321166","Cell Phones; Ni-Cd Batteries; Li-Ion Batteries; Ni-MH Batteries; Ni-Zn Batteries; Small Sealed Lead Acid Batteries; Video Game Consoles; PlayStation Consoles; Batteries (Rechargeable); Cell Phone Batteries; Li-Ion Batteries; Ni-Cd Batteries; Ni-MH Batteries; Small Sealed Lead Acid Batteries; Alkaline/Single-Use Batteries; Button Batteries; Non-rechargeable lithium batteries; Cell Phones","false","true","The U.S. EPA estimates that more than 350 million rechargeable batteries are purchased annually in the U.S. Thanks to the environmental commitment of this location, its easy and free to recycle your batteries. Bring your rechargeable batteries to this location and look for the recycling box or ask an associate how you can do your part for the environment.","Call2Recycle","false","false","false","false"
"F & S Color TV Service","F & S Color TV Service","620 N Washington St","Junction City","Geary","KS","66441","7852388069","0","","http://www.radioshack.com/","39.02832","-96.82953","41.0715412753689","Cell Phones; Ni-Cd Batteries; Li-Ion Batteries; Ni-MH Batteries; Ni-Zn Batteries; Small Sealed Lead Acid Batteries; Video Game Consoles; PlayStation Consoles","false","true","The U.S. EPA estimates that more than 350 million rechargeable batteries are purchased annually in the U.S. Thanks to the environmental commitment of this location, its easy and free to recycle your batteries. Bring your rechargeable batteries to this location and look for the recycling box or ask an associate how you can do your part for the environment.","","false","false","false","false"
"Sprint Store","","701 N Washington St","Junction City","","KS","66441","7857623434","0","","https://newsroom.sprint.com/csr/device-donations/","39.0294485","-96.8291646","41.0910089644264","","false","false","","","false","false","false","false"
"OCCK, Inc.","OCCK, Inc.","501 W 7th St","Beloit","Mitchell","KS","67420","7857385423","0","Monday: 8:30 AM - 3:00 PM Tuesday: 8:30 AM - 3:00 PM Wednesday: 8:30 AM - 3:00 PM Thursday: 8:30 AM - 3:00 PM Friday: 8:30 AM - 3:00 PM ","http://www.occk.com","39.46513","-98.11553","41.1177858593208","Plastic #1 (PETE); Plastic #2 (HDPE); Plastic #2 (Color HDPE); Aluminum Cans; Glass (Brown); Cardboard; Catalogs; Glass (Clear); Computer Paper; Glass (Green); Greeting Cards; Magazines; Paper (Mixed); Newspapers; Tin or Steel Cans; Office Paper; Video Game Consoles; PlayStation Consoles","false","true","","","false","false","false","false"
"O'Reilly Auto Parts","null","134 East Sixth Street","Junction City","","KS","66441","7857622112","0","","http://oreillyauto.custhelp.com/app/error/error_id/6","39.0286847","-96.8281911","41.1433389453607","","false","false","","","false","false","false","false"
"Riley New Main Store","","Trooper Dr","Fort Riley","","KS","66442","7857842026","0","","","39.0780326","-96.8297638","41.1928477649654","","false","false","","","false","false","false","false"
"Ottawa Recycle","Ottawa Recycle","311 W 1st St","Minneapolis","Ottawa","KS","67467","7853922122","0","Friday: 9:00 AM - 6:00 PM Saturday: 8:00 AM - 11:59 PM ","http://ottawa.ca/en/residents/garbage-and-recycling","39.12136","-97.70936","8.93586827678035","Plastic #1 (PETE); Plastic #2 (HDPE); Plastic #2 (Color HDPE); Aluminum Cans; Aluminum; Glass (Brown); Brown Paper Bags; Cardboard; Chipboard; Glass (Clear); Computer Paper; Glass (Green); Greeting Cards; Paper (Mixed); Newspapers; Alkaline/Single-Use Batteries; Tin or Steel Cans; Office Paper; Video Game Consoles; PlayStation Consoles","false","true","","","false","false","false","false"
"Hometown True Value Hardware","Hometown True Value Hardware","317 W 2nd St","Minneapolis","Ottawa","KS","67467","7853922692","0","","http://www.truevalue.com","39.12228","-97.70837","8.94583328991854","Transmission Fluid; Used Motor Oil; Video Game Consoles; PlayStation Consoles","false","true","","","false","false","false","false"
"Hometown True Value Hardware","","317 West 2nd Street","Minneapolis","","KS","67467","7853922692","0","","https://www.truevalue.com/","39.1220748","-97.7090006","8.95856328036581","","false","false","","","false","false","false","false"
