name,description,address,city,region,province,postal_code,phone,fax,hours,url,latitude,longitude,distance,materials,pickup,dropoff,notes,groups,curbside,municipal,national,event_only
"O'Reilly Auto Parts","","523 W Kansas Ave","Mcpherson","","KS","67460","6202411212","0","","http://oreillyauto.custhelp.com/app/error/error_id/6","38.3688681","-97.6737175","36.2694161197629","","false","false","","","false","false","false","false"
"Farmers' Co-op","Farmers' Co-op","400 Main St ","Zenda","Kingman County","KS","67159","6202435421","0","Monday: 8:00 AM - 5:00 PM Tuesday: 8:00 AM - 5:00 PM Wednesday: 8:00 AM - 5:00 PM Thursday: 8:00 AM - 5:00 PM Friday: 8:00 AM - 5:00 PM Saturday: 8:00 AM - 12:00 PM ","","37.4454567","-98.2819066","36.9268419286828","Used Motor Oil; Video Game Consoles; PlayStation Consoles","false","true","","","false","false","false","false"
"Goodwill Easter Seals of Kansas Inc. - Dell Reconnect Donation Site","","3737 North Maize Road","Maize","","KS","67205","3167449290","0","","https://goodwillks.org/","37.7505538","-97.4639124","36.9610064454277","","false","false","","","false","false","false","false"
"Zenda Library","Zenda Library","215 N Main St","Zenda","Kingman","KS","67159","6202435791","0","Wednesday: 1:00 PM - 5:00 PM Saturday: 8:00 AM - 12:00 PM ","null","37.44396","-98.28204","37.0280505711935","Books (Reuse); Catalogs; Magazines; VHS & Cassette Tapes; Video Game Consoles; PlayStation Consoles","false","true","","","false","false","false","false"
"RadioShack","RadioShack","1316 N Main St","Mc Pherson","McPherson","KS","67460","6202415913","0","Monday: 9:00 AM - 7:00 PM Tuesday: 9:00 AM - 7:00 PM Wednesday: 9:00 AM - 7:00 PM Thursday: 9:00 AM - 7:00 PM Friday: 9:00 AM - 7:00 PM Saturday: 9:00 AM - 7:00 PM Sunday: 12:00 PM - 6:00 PM ","http://www.radioshack.com","38.38391","-97.66676","37.3186627613824","Ni-Cd Batteries; Batteries (Rechargeable); Video Game Consoles; PlayStation Consoles","false","true","","","false","false","false","false"
"Tractor Supply","Tractor Supply","1330 North Main ST","McPherson","McPherson","KS","67460","6202459900","0","","http://www.tractorsupply.com","38.38391","-97.66676","37.3186627613824","Transmission Fluid; Used Motor Oil; Video Game Consoles; PlayStation Consoles","false","true","","","false","false","false","false"
"Tractor Supply","","1330 North Main Street","Mcpherson","","KS","67460","6202459900","0","","https://www.tractorsupply.com/","38.3843094","-97.6652386","37.3911779339293","","false","false","","","false","false","false","false"
"Target Store","null","2727 N Maize Rd","Wichita","","KS","67205","3167214289","0","","https://corporate.target.com/corporate-responsibility/planet","37.7325155","-97.4653923","37.3913006507454","","false","false","","","false","false","false","false"
"uBreakiFix","uBreakiFix","2441 N Maize Rd","Wichita","Sedgwick ","KS","67205","3162850055","0","","","37.7299337","-97.4663233","37.420280430366","Batteries (Rechargeable); Cell Phone Batteries; Cell Phones; Li-Ion Batteries; Ni-Cd Batteries; Ni-MH Batteries; Small Sealed Lead Acid Batteries","false","true","Call or Check Online for Hours","Call2Recycle","false","false","false","false"
"Target","Target","2727 N Maize Rd","Wichita","Sedgwick","KS","67205","3167214289","0","","http://www.target.com/","37.73589","-97.46277","37.4247199512487","Aluminum Cans; Cell Phones; Inkjet Printer Cartridges; MP3 Players; Plastic #1 (PETE); Plastic #2 (HDPE); Plastic Shopping Bags; Video Game Consoles; PlayStation Consoles","false","true","","","false","false","false","false"
"Call2Recycle at Lowe's","Call2Recycle at Lowe's","2626 N Maize Rd","Wichita","Sedgwick","KS","67205","3162061030","0","Monday: 6:00 AM - 10:00 PM Tuesday: 6:00 AM - 10:00 PM Wednesday: 6:00 AM - 10:00 PM Thursday: 6:00 AM - 10:00 PM Friday: 6:00 AM - 10:00 PM Saturday: 6:00 AM - 10:00 PM Sunday: 8:00 AM - 8:00 PM ","http://www.lowes.com/","37.73534","-97.46259","37.4493612093817","Cell Phones; Compact Fluorescent Lights; Ni-Cd Batteries; Plastic Shopping Bags; Li-Ion Batteries; Ni-MH Batteries; Ni-Zn Batteries; Small Sealed Lead Acid Batteries; Video Game Consoles; PlayStation Consoles","false","true","As an environmentally-committed retailer, Lowes offers a recycling center near store entrances to give consumers a free and easy way to properly dispose of rechargeable batteries, cell phones, CFLs and plastic shopping bags; materials that otherwise could be potentially harmful to the environment.  Look for the recycling center or ask a store associate for more details.","","false","false","false","false"
"Best Buy","null","2441 N Maize Rd","Wichita","","KS","67205","3165242079","0","","https://www.bestbuy.com/site/services/recycling/pcmcat149900050025.c?id=pcmcat149900050025","37.7298943","-97.4655209","37.4611592162604","","false","false","","","false","false","false","false"
"Walgreens","Walgreens","13534 W Maple St","Wichita","Sedgwick","KS","67235","3167733162","0","","http://www.walgreens.com","37.67879","-97.49861","37.5249048289783","Cell Phones; Inkjet Printer Cartridges; Video Game Consoles; PlayStation Consoles","false","true","","","false","false","false","false"
"Best Buy","Best Buy","2441 N Maize Rd ","Wichita","Sedgwick County","KS","67205","3165242079","0","","https://www.bestbuy.com/recycle","37.7285147","-97.464925","37.5310518850833","Large Household Appliances; Refrigerators; Televisions; AC Power Plugs; Batteries (Rechargeable); Cables & Connectors; Car Audio/Video Equipment; Cell Phone Batteries; Cell Phones; Computer (Recycling); Hard Drives; Computer Monitors; Cameras; DVD Players/Blu-Ray Players/DVRs; Electronics; E-Readers; GPS Units; Headphones; Inkjet Printer Cartridges; Laptop Computers; Laser Toner Cartridges; Li-Ion Batteries; MP3 Players; Network Equipment; Ni-Cd Batteries; Ni-MH Batteries; Ni-Zn Batteries; Computer Peripherals; Portable Media Players; Printers/Scanners/Fax Machines; Small Electronics; Small Sealed Lead Acid Batteries; Stereo Equipment; Tablets; Telephones; UPS Batteries/Backup Systems; VCRs; Video Game Systems; Blu-Ray Players; Digital Converter Boxes; Small Televisions; Video Game Consoles; PlayStation Consoles","true","true","2 TVs per visit, 3 e-waste items per day; $25 fee for TVs and Monitors; $19.99 pick-up fee with delivery; $99.99 standalone pickup fee; ","Sony, Vizio, OEM","false","false","false","false"
"AutoZone","AutoZone","2068 E Kansas Ave","McPherson","McPherson","KS","67460","6202450119","0","","http://www.autozone.com","38.37009","-97.63675","37.61416923263","Lead Acid (Pb) Batteries; Used Motor Oil; Video Game Consoles; PlayStation Consoles","false","true","Most AutoZone stores accept used motor oil, transmission fluid, gear oil and automotive batteries. Call to see what your local store is currently accepting.","","false","false","false","false"
"Walmart Supercenter","","10600 W 21St St N","Wichita","","KS","67205","3167295446","0","","https://www.walmart.com/","37.724605","-97.4655301","37.6167319956117","","false","false","","","false","false","false","false"
"Walmart Tire and Lube Express","","10600 W 21st St N","Wichita","","KS","67205","3167295446","0","","https://www.walmart.com/cp/ideas/8932632","37.724605","-97.4655301","37.6167319956117","","false","false","","","false","false","false","false"
"Walmart Tire & Lube Express","Walmart Tire & Lube Express","10600 W 21st St N","Wichita","Sedgwick","KS","67205","3167295446","0","","http://www.walmart.com/catalog/catalog.gsp?cat=495843","37.72275","-97.46518","37.6893793358648","Lead Acid (Pb) Batteries; Used Motor Oil; Oil Filters; Video Game Consoles; PlayStation Consoles","false","true","","","false","false","false","false"
"Walmart","Walmart","10600 W 21st St N","Wichita","Sedgwick","KS","67205","3167295446","0","","http://www.walmart.com","37.72275","-97.46518","37.6893793358648","Lead Acid (Pb) Batteries; Plastic Shopping Bags; Food Storage Bags; Video Game Consoles; PlayStation Consoles","false","true","","","false","false","false","false"
"Lowe's","","2626 N Maize Rd","Wichita","","KS","67205","3162061030","0","","https://newsroom.lowes.com/responsibility/operational-excellence/","37.7307222","-97.4602797","37.696873845965","Batteries (Rechargeable); Cell Phone Batteries; Li-Ion Batteries; Ni-Cd Batteries; Ni-MH Batteries; Small Sealed Lead Acid Batteries; Cell Phones","false","true","","Call2Recycle","false","false","false","false"
"AutoZone","","2068 E Kansas Ave","Mcpherson","","KS","67460","6202450119","0","","https://www.autozone.com/landing/page.jsp?name=in-our-stores","38.3697676","-97.6330706","37.7281346702267","","false","false","","","false","false","false","false"
"Firestone Complete Auto Care","","2318 N Maize Rd","Wichita","","KS","67205","3167732900","0","","https://www.firestonecompleteautocare.com/","37.7253621","-97.4620972","37.7636910215672","","false","false","","","false","false","false","false"
"OfficeMax","","2414 N Maize Rd","Wichita","","KS","67205","3167733062","0","","","37.7266366","-97.4610488","37.7779358158997","","false","false","","","false","false","false","false"
"Walmart","Walmart","205 S Centennial Dr","McPherson","McPherson","KS","67460","6202410800","0","","http://www.walmart.com","38.36857","-97.62978","37.7835431620168","Lead Acid (Pb) Batteries; Plastic Shopping Bags; Food Storage Bags; Video Game Consoles; PlayStation Consoles","false","true","","","false","false","false","false"
"Walmart Tire & Lube Express","Walmart Tire & Lube Express","205 S Centennial Dr","McPherson","McPherson","KS","67460","6202410800","0","","http://www.walmart.com/catalog/catalog.gsp?cat=495843","38.36857","-97.62978","37.7835431620168","Lead Acid (Pb) Batteries; Used Motor Oil; Oil Filters; Video Game Consoles; PlayStation Consoles","false","true","","","false","false","false","false"
"Verizon Wireless","Verizon Wireless","2441 N Maize Rd Suite 1509","Wichita","Sedgwick","KS","67205","8666444532","0","","http://www.verizonwireless.com/","37.72351","-97.46275","37.78642987461","Cell Phones; Cell Phone Batteries; Video Game Consoles; PlayStation Consoles","false","true","<A Href="https://www.trade-in.vzw.com/home.aspx">
The Verizon Wireless Trade-In Program</A> allows you to trade in your used handset or tablet in a convenient and responsible way. 
<P>
<P>
Verizon Wireless works every day to protect our environment and give our customers opportunities to do the same. <A Href="http://aboutus.vzw.com/Green_Initiative/overview.html">Click here</A> for more examples of the earth-friendly initiatives and programs Verizon Wireless is proud to offer and support.","","false","false","false","false"
"Call2Recycle at RadioShack","Call2Recycle at RadioShack","2413 N Maize Rd Ste 101","Wichita","Sedgwick","KS","67205","3167221992","0","","http://www.radioshack.com/","37.72342","-97.46275","37.7891104670716","Cell Phones; Ni-Cd Batteries; Li-Ion Batteries; Ni-MH Batteries; Ni-Zn Batteries; Small Sealed Lead Acid Batteries; Video Game Consoles; PlayStation Consoles","false","true","As the first national retailer to partner with Call2Recycle, RadioShack is at the forefront of the rechargeable battery recycling cause and is pleased to offer battery recycling at thousands of convenient RadioShack locations for free.  Simply drop them off at your local RadioShack and theyll take care of the rest.  Ask a store associate for more details.","","false","false","false","false"
"RadioShack","RadioShack","2413 N Maize Rd Ste 101","Wichita","Sedgwick","KS","67205","3167221992","0","Monday: 9:00 AM - 9:00 PM Tuesday: 9:00 AM - 9:00 PM Wednesday: 9:00 AM - 9:00 PM Thursday: 9:00 AM - 9:00 PM Friday: 9:00 AM - 9:00 PM Saturday: 9:00 AM - 9:00 PM Sunday: 11:00 AM - 6:00 PM ","http://www.radioshack.com","37.72342","-97.46275","37.7891104670716","Ni-Cd Batteries; Batteries (Rechargeable); Video Game Consoles; PlayStation Consoles","false","true","","","false","false","false","false"
"AT&T Wireless","AT&T Wireless","2404 N Maize Rd","Wichita","Sedgwick","KS","67205","3167732355","0","","http://www.att.com/","37.7237","-97.46257","37.7896511482573","Cell Phones; Ni-Cd Batteries; Batteries (Rechargeable); Cell Phone Batteries; Tablets; Li-Ion Batteries; Video Game Consoles; PlayStation Consoles","false","true","Receive an AT&T Promotion Card worth the trade-in value of your smartphone, tablet, or netbook. You can also donate the trade-in value to Cell Phones for Soldiers.","","false","false","false","false"
"Walmart Supercenter","","205 S Centennial Dr","Mcpherson","","KS","67460","6202410800","0","","https://www.walmart.com/","38.3676721","-97.628198","37.7938684530335","","false","false","","","false","false","false","false"
"Stutzman Refuse Disposal, Inc.","","","Arlington","","KS","67514","6206622559","0","","","37.8966808","-98.1786739","6.46358878286636","","false","false","","","false","false","false","false"
"Reno County Landfill","Reno County Landfill","703 S Mohawk Rd","Hutchinson","Reno","KS","67501","6206942587","0","Monday: 8:00 AM - 5:00 PM Tuesday: 8:00 AM - 5:00 PM Wednesday: 8:00 AM - 5:00 PM Thursday: 8:00 AM - 5:00 PM Friday: 8:00 AM - 5:00 PM Saturday: 8:00 AM - 5:00 PM ","http://www.renogov.org/253/Landfill","38.0355","-97.99559","7.39236053490281","Glue & Adhesives; Antifreeze; Brake Fluid; Brush; Lead Acid (Pb) Batteries; Construction Materials; Degreasers; Fertilizer; Fungicides; Herbicides; Household Cleaners; Insecticides; Large Household Appliances; Mercury Containing Items; Ni-Cd Batteries; Other Batteries; Unused Paint; Paint Thinner; Pesticides; Photography Chemicals; Pool Chemicals; Batteries (Rechargeable); Alkaline/Single-Use Batteries; Solvents; Transmission Fluid; Used Motor Oil; Used Tires; Food Scraps; Scrap Metal","false","true","","","false","false","false","false"
"Reno County Landfill & HHW Drop-off Site","","703 S Mohawk Rd","Hutchinson","","KS","67501","6206942586","0","","https://www.renogov.org/255/Recycling-Guide","38.0422045","-97.9956469","7.73397378826217","","false","false","","","false","false","false","false"
"Reno County Government","Reno County Government","4015 W Clark Rd","Hutchinson","Reno ","KS","67501","6206942586","0","","","38.0425580959337","-97.9945153886712","7.792825578691","Batteries (Rechargeable); Cell Phone Batteries; Cell Phones; Li-Ion Batteries; Ni-Cd Batteries; Ni-MH Batteries; Small Sealed Lead Acid Batteries","false","true","Call or Check Online for Hours","Call2Recycle","false","false","false","false"
"Stutzman Refuse Disposal, Inc.","Stutzman Refuse Disposal, Inc.","315 W Blanchard Ave","South Hutchinson","Reno","KS","67505","6206622559","0","Monday: 8:00 AM - 5:00 PM Tuesday: 8:00 AM - 5:00 PM Wednesday: 8:00 AM - 5:00 PM Thursday: 8:00 AM - 5:00 PM Friday: 8:00 AM - 5:00 PM ","","38.02783","-97.94951","8.99717399767852","Cardboard; Computer Paper; Greeting Cards; Paper (Mixed); Newspapers; Office Paper; Video Game Consoles; PlayStation Consoles","false","true","","","false","false","false","false"
"Stutzman Refuse Disposal, Inc.","Stutzman Refuse Disposal, Inc.","215 N Walnut St","South Hutchinson","Reno","KS","67505","6206622559","0","Monday: 8:00 AM - 5:00 PM Tuesday: 8:00 AM - 5:00 PM Wednesday: 8:00 AM - 5:00 PM Thursday: 8:00 AM - 5:00 PM Friday: 8:00 AM - 5:00 PM ","","38.03056","-97.93873","9.59434070274104","Cardboard; Computer Paper; Greeting Cards; Paper (Mixed); Newspapers; Office Paper; Video Game Consoles; PlayStation Consoles","false","true","","","false","false","false","false"
