name,description,address,city,region,province,postal_code,phone,fax,hours,url,latitude,longitude,distance,materials,pickup,dropoff,notes,groups,curbside,municipal,national,event_only
"Jiffy Lube","Jiffy Lube","132 Blanding Blvd","Orange Park","Clay","FL","32073","9042724676","0","Monday: 8:00 AM - 7:00 PM Tuesday: 8:00 AM - 7:00 PM Wednesday: 8:00 AM - 7:00 PM Thursday: 8:00 AM - 7:00 PM Friday: 8:00 AM - 7:00 PM Saturday: 8:00 AM - 5:00 PM Sunday: 9:00 AM - 4:00 PM ","http://www.jiffylube.com/","30.1799","-81.74091","5.01761515789653","Used Motor Oil; Video Game Consoles; PlayStation Consoles","false","true","","","false","false","false","false"
"Calvary United Methodist Church (Cub Pack 418)","Calvary United Methodist Church (Cub Pack 418)","112 Blanding Blvd","Orange Park","Clay","FL","32073","9043541669","0","","","30.18184","-81.74012","5.13212269266367","Magazines; Newspapers; Office Paper; Video Game Consoles; PlayStation Consoles","false","true","","","false","false","false","false"
"Best Buy Mobile","","1910 Wells Rd","Orange Park","","FL","32073","9045411772","0","","https://www.bestbuy.com/site/services/recycling/pcmcat149900050025.c?id=pcmcat149900050025","30.1831879","-81.7387891","5.19995406244746","","false","false","","","false","false","false","false"
"5 Star Cellular","","1910 Wells Rd","Orange Park","","FL","32073","9042157001","0","","","30.1831879","-81.7387891","5.19995406244746","","false","false","","","false","false","false","false"
"Call2Recycle at RadioShack","Call2Recycle at RadioShack","1910 Wells Rd","Orange Park","Clay","FL","32073","9042692316","0","","http://www.radioshack.com/","30.1846","-81.73479","5.23725436226794","Cell Phones; Ni-Cd Batteries; Li-Ion Batteries; Ni-MH Batteries; Ni-Zn Batteries; Small Sealed Lead Acid Batteries; Video Game Consoles; PlayStation Consoles","false","true","As the first national retailer to partner with Call2Recycle, RadioShack is at the forefront of the rechargeable battery recycling cause and is pleased to offer battery recycling at thousands of convenient RadioShack locations for free.  Simply drop them off at your local RadioShack and theyll take care of the rest.  Ask a store associate for more details.","","false","false","false","false"
"Call2Recycle at Sears","Call2Recycle at Sears","1910 Wells Rd Ste 8520","Orange Park","Clay","FL","32073","9042698401","0","","http://www.sears.com/","30.1846","-81.73479","5.23725436226794","Cell Phones; Ni-Cd Batteries; Li-Ion Batteries; Ni-MH Batteries; Ni-Zn Batteries; Small Sealed Lead Acid Batteries; Video Game Consoles; PlayStation Consoles","false","true","The U.S. EPA estimates that more than 350 million rechargeable batteries are purchased annually in the U.S. Thanks to the environmental commitment of this location, its easy and free to recycle your batteries. Bring your rechargeable batteries to this location and look for the recycling box or ask an associate how you can do your part for the environment.","","false","false","false","false"
"Better World Books - Julington Village","","450 State Rd. 13 North","Jacksonville","","FL","32259","8885107107","0","","https://www.betterworldbooks.com/","30.1193922","-81.6269694","5.34441171864524","","false","false","","","false","false","false","false"
"Tractor Supply","","1455 Blanding Boulevard","Orange Park","","FL","32065","9042721970","0","","https://www.tractorsupply.com/","30.1178683","-81.8055756","5.38806606212174","","false","false","","","false","false","false","false"
"Southeast Branch Library","Southeast Branch Library","60 Davis Pond Blvd","Saint Johns","Saint Johns","FL","32259","9043541669","0","","","30.10721","-81.62555","5.39995584087712","Magazines; Newspapers; Office Paper; Video Game Consoles; PlayStation Consoles","false","true","","","false","false","false","false"
"Walgreens","Walgreens","42 Blanding Blvd","Orange Park","Clay","FL","32073","9042982103","0","","http://www.walgreens.com","30.18608","-81.74006","5.41275833679898","Cell Phones; Inkjet Printer Cartridges; Video Game Consoles; PlayStation Consoles","false","true","","","false","false","false","false"
"Publix","","450 Florida 13","Saint Johns","","FL","32259","9042303201","0","","https://sustainability.publix.com/storefront/customer-recycling/","30.1192839","-81.6256415","5.4224345254301","","false","false","","","false","false","false","false"
"Tractor Supply","Tractor Supply","1455 Blanding Blvd","Orange Park","Clay","FL","32065","9042721970","0","","http://www.tractorsupply.com","30.1176","-81.80629","5.42890044684261","Transmission Fluid; Used Motor Oil; Video Game Consoles; PlayStation Consoles","false","true","","","false","false","false","false"
"Verizon Wireless","Verizon Wireless","1911 Wells Rd Ste 3","Orange Park","Clay","FL","32073","8666444532","0","","http://www.verizonwireless.com/","30.1873","-81.73665","5.44385168966816","Cell Phones; Cell Phone Batteries; Video Game Consoles; PlayStation Consoles","false","true","<A Href="https://www.trade-in.vzw.com/home.aspx">
The Verizon Wireless Trade-In Program</A> allows you to trade in your used handset or tablet in a convenient and responsible way. 
<P>
<P>
Verizon Wireless works every day to protect our environment and give our customers opportunities to do the same. <A Href="http://aboutus.vzw.com/Green_Initiative/overview.html">Click here</A> for more examples of the earth-friendly initiatives and programs Verizon Wireless is proud to offer and support.","","false","false","false","false"
"Call2Recycle at RadioShack","Call2Recycle at RadioShack","450 State Road 13 Ste 112","Jacksonville","Saint Johns","FL","32259","9042873875","0","","http://www.radioshack.com/","30.12032","-81.62538","5.44630698602306","Cell Phones; Ni-Cd Batteries; Li-Ion Batteries; Ni-MH Batteries; Ni-Zn Batteries; Small Sealed Lead Acid Batteries; Video Game Consoles; PlayStation Consoles","false","true","As the first national retailer to partner with Call2Recycle, RadioShack is at the forefront of the rechargeable battery recycling cause and is pleased to offer battery recycling at thousands of convenient RadioShack locations for free.  Simply drop them off at your local RadioShack and theyll take care of the rest.  Ask a store associate for more details.","","false","false","false","false"
"O'Reilly Auto Parts","null","  1980 Wells Road Ste 2","Orange Park","","FL","32073","9042726177","0","","http://oreillyauto.custhelp.com/app/error/error_id/6","30.1863837","-81.7411927","5.45141096369793","","false","false","","","false","false","false","false"
"USPS Post Office Box Lobby Recycling Program","US Post Office","4380 Lewis Ave","Green Cove Springs","Clay","FL","32043","8002758777","0","","https://www.usps.com/","30.04422","-81.76545","5.462228473927","Catalogs; Greeting Cards; Magazines; Paper (Mixed)","false","true","","","false","false","false","false"
"Walgreens","Walgreens","390 State Road 13","Saint Johns","Saint Johns","FL","32259","9042304696","0","","http://www.walgreens.com","30.12172","-81.62526","5.4661473831424","Cell Phones; Inkjet Cartridge Refilling; Inkjet Printer Cartridges; Video Game Consoles; PlayStation Consoles","false","true","","","false","false","false","false"
"Sprint Store","","1939 Wells Rd","Orange Park","","FL","32073","9042641123","0","","https://newsroom.sprint.com/csr/device-donations/","30.1873294","-81.7382943","5.46912043575018","","false","false","","","false","false","false","false"
"Goodwill of North Florida Inc. - Dell Reconnect Donation Site","","465 State Road 13","Saint Johns","","FL","32259","9042301804","0","","https://www.dellreconnect.com/","30.1187545","-81.6247005","5.47445720085584","","false","false","","","false","false","false","false"
"Batteries Plus","Batteries Plus","36 Blanding Blvd # A","Orange Park","Clay","FL","32073","9043750495","0","Monday: 8:00 AM - 8:00 PM Tuesday: 8:00 AM - 8:00 PM Wednesday: 8:00 AM - 8:00 PM Thursday: 8:00 AM - 8:00 PM Friday: 8:00 AM - 8:00 PM Saturday: 8:00 AM - 8:00 PM Sunday: 10:00 AM - 6:00 PM ","http://www.batteriesplus.com/","30.18718","-81.73954","5.4778998325553","Cell Phones; Ni-Cd Batteries; Li-Ion Batteries; Ni-MH Batteries; Ni-Zn Batteries; Small Sealed Lead Acid Batteries; Video Game Consoles; PlayStation Consoles","false","true","The U.S. EPA estimates that more than 350 million rechargeable batteries are purchased annually in the U.S. Thanks to the environmental commitment of this location, its easy and free to recycle your batteries. Bring your rechargeable batteries to this location and look for the recycling box or ask an associate how you can do your part for the environment.","","false","false","false","false"
"Batteries Plus","Batteries Plus","36A Blanding Blvd","Orange Park","Clay","FL","32073","9043750495","9043752370","","http://www.batteriesplus.com/store_details/485.aspx","30.18718","-81.73954","5.4778998325553","Compact Fluorescent Lights; Batteries (Rechargeable); Alkaline/Single-Use Batteries; Video Game Consoles; PlayStation Consoles","false","true","Some fees for battery recycling may apply.  Please contact your Local store for details. 
<p>
Batteries Plus lead by example by recycling the majority of the batteries we sell. Not only do we recycle to protect our environment, we support retail and business customers alike by keeping them in full compliance with federal, state, municipal, EPA and DOT regulations governing the disposal and recycling of spent batteries and select electronics.","","false","false","false","false"
"Batteries Plus Bulbs","","36 A Blanding Blvd","Orange Park","","FL","32073","9043750495","0","","https://www.batteriesplus.com/store-locator/fl/485?utm_source=local&utm_medium=earth911","30.1874308","-81.7401297","5.50383271419763","","false","false","","","false","false","false","false"
"Home Depot","","1919 Wells Rd","Orange Park","","FL","32073","9042693117","0","","https://ecooptions.homedepot.com/","30.1887228","-81.734258","5.50923958300246","Batteries (Rechargeable); Cell Phone Batteries; Li-Ion Batteries; Ni-Cd Batteries; Ni-MH Batteries; Small Sealed Lead Acid Batteries","false","true","","Call2Recycle","false","false","false","false"
"Target Store","","1919 Wells Rd","Orange Park","","FL","32073","9042642748","0","","https://corporate.target.com/corporate-responsibility/planet","30.1887228","-81.734258","5.50923958300246","","false","false","","","false","false","false","false"
"Home Depot","Home Depot","1919 Wells Rd","Orange Park","Clay","FL","32073","9042693117","0","Monday: 6:00 AM - 10:00 PM Tuesday: 6:00 AM - 10:00 PM Wednesday: 6:00 AM - 10:00 PM Thursday: 6:00 AM - 10:00 PM Friday: 6:00 AM - 10:00 PM Saturday: 6:00 AM - 10:00 PM Sunday: 8:00 AM - 8:00 PM ","http://www.homedepot.com","30.1885","-81.73646","5.52204726828418","Compact Fluorescent Lights; Batteries (Rechargeable); Video Game Consoles; PlayStation Consoles","false","true","Home Depot accepts compact fluorescent bulbs and used power tool rechargeable batteries. Look for the orange drop boxes, usually located near the front entrance near the customer service desk.","","false","false","false","false"
"Call2Recycle at the Home Depot","Call2Recycle at the Home Depot","1919 Wells Rd","Orange Park","Clay","FL","32073","9042693117","0","","http://www.homedepot.com/","30.1885","-81.73646","5.52204726828418","Cell Phones; Compact Fluorescent Lights; Ni-Cd Batteries; Li-Ion Batteries; Ni-MH Batteries; Ni-Zn Batteries; Small Sealed Lead Acid Batteries; Video Game Consoles; PlayStation Consoles","false","true","The Home Depot accepts used rechargeable batteries and compact fluorescent bulbs. Look for the orange drop boxes, usually located near the front entrance near the customer service desk, or ask a store associate for more details.","","false","false","false","false"
"NAPA","NAPA","1505 Wells Rd","Orange Park","Clay","FL","32073","9042644527","0","Monday: 7:30 AM - 7:00 PM Tuesday: 7:30 AM - 7:00 PM Wednesday: 7:30 AM - 7:00 PM Thursday: 7:30 AM - 7:00 PM Friday: 7:30 AM - 7:00 PM Saturday: 7:30 AM - 6:00 PM Sunday: 9:00 AM - 5:00 PM ","http://www.napaonline.com/","30.19051","-81.7117","5.52686413724552","Used Motor Oil; Video Game Consoles; PlayStation Consoles","false","true","","","false","false","false","false"
"Goodwill of North Florida Inc. - Dell Reconnect Donation Site","","12200-19 San Jose Blvd","Jacksonville","","FL","32223","9042921103","0","","https://www.goodwilljax.org/","30.1484363","-81.6342863","5.52896354761108","","false","false","","","false","false","false","false"
"uBreakiFix","uBreakiFix","16 Blanding Blvd","Orange Park","Clay ","FL","32073","9042576303","0","","","30.1884119801054","-81.7395255128533","5.55993908226398","Batteries (Rechargeable); Cell Phone Batteries; Cell Phones; Li-Ion Batteries; Ni-Cd Batteries; Ni-MH Batteries; Small Sealed Lead Acid Batteries","false","true","Call or Check Online for Hours","Call2Recycle","false","false","false","false"
"Walgreens","Walgreens","12145 San Jose Blvd","Jacksonville","Duval","FL","32223","9042626808","0","","http://www.walgreens.com","30.15007","-81.63192","5.70698587657538","Cell Phones; Inkjet Cartridge Refilling; Inkjet Printer Cartridges; Video Game Consoles; PlayStation Consoles","false","true","","","false","false","false","false"
"Tires Plus Store","Tires Plus Store","12015 San Jose Blvd","Jacksonville","Duval","FL","32223","9042604011","0","Monday: 7:00 AM - 7:00 PM Tuesday: 7:00 AM - 7:00 PM Wednesday: 7:00 AM - 7:00 PM Thursday: 7:00 AM - 7:00 PM Friday: 7:00 AM - 8:00 PM Saturday: 7:00 AM - 6:00 PM Sunday: 8:00 AM - 5:00 PM ","http://www.tiresplus.com/","30.15257","-81.6321","5.7821572397673","Lead Acid (Pb) Batteries; Used Motor Oil; Video Game Consoles; PlayStation Consoles","false","true","","","false","false","false","false"
"Tires Plus","","12015 San Jose Blvd","Jacksonville","","FL","32223","9042604011","0","","https://www.tiresplus.com/","30.1525819","-81.6321058","5.78226958919989","","false","false","","","false","false","false","false"
"Mandarin Lutheran Church","Mandarin Lutheran Church","11900 San Jose Blvd","Jacksonville","Duval","FL","32223","9043541669","0","","","30.1553","-81.63383","5.79126429184209","Magazines; Newspapers; Office Paper; Video Game Consoles; PlayStation Consoles","false","true","","","false","false","false","false"
"Advance Auto Parts","Advance Auto Parts","6251 Argyle Forest Blvd Ste 112","Jacksonville","Duval","FL","32244","9047782723","0","Monday: 7:30 AM - 9:00 PM Tuesday: 7:30 AM - 9:00 PM Wednesday: 7:30 AM - 9:00 PM Thursday: 7:30 AM - 9:00 PM Friday: 7:30 AM - 9:00 PM Saturday: 7:30 AM - 9:00 PM Sunday: 9:00 AM - 7:00 PM ","http://www.advanceautoparts.com","30.19176","-81.74458","5.86518260099252","Lead Acid (Pb) Batteries; Used Motor Oil; Video Game Consoles; PlayStation Consoles","false","true","","","false","false","false","false"
"Publix","","6001 Argyle Forest Boulevard","Jacksonville","","FL","32244","9049085906","0","","https://sustainability.publix.com/storefront/customer-recycling/","30.1935391","-81.7424651","5.94774827747398","","false","false","","","false","false","false","false"
"AT&T Wireless","AT&T Wireless","6001 Argyle Forest Blvd Ste 31","Jacksonville","Duval","FL","32244","9045733380","0","","http://www.att.com/","30.19355","-81.74305","5.95792191115535","Cell Phones; Ni-Cd Batteries; Batteries (Rechargeable); Cell Phone Batteries; Tablets; Li-Ion Batteries; Video Game Consoles; PlayStation Consoles","false","true","Receive an AT&T Promotion Card worth the trade-in value of your smartphone, tablet, or netbook. You can also donate the trade-in value to Cell Phones for Soldiers.","","false","false","false","false"
"The UPS Store","The UPS Store","6001 Argyle Forest Blvd Ste 21","Jacksonville","Duval","FL","32244","9047783334","0","Monday: 8:30 AM - 7:00 PM Tuesday: 8:30 AM - 7:00 PM Wednesday: 8:30 AM - 7:00 PM Thursday: 8:30 AM - 7:00 PM Friday: 8:30 AM - 7:00 PM Saturday: 9:30 AM - 3:30 PM ","http://www.upsstore.com","30.19355","-81.74305","5.95792191115535","Packing Peanut (Reuse); Video Game Consoles; PlayStation Consoles","false","true","","","false","false","false","false"
