name,description,address,city,region,province,postal_code,phone,fax,hours,url,latitude,longitude,distance,materials,pickup,dropoff,notes,groups,curbside,municipal,national,event_only
"Webb's Transmissions, Inc.","Webb's Transmissions, Inc.","307 Racetrack Rd NW","Fort Walton Beach","Okaloosa","FL","32547","8508621824","0","","","30.44891","-86.62714","19.4697499648817","Used Motor Oil; Video Game Consoles; PlayStation Consoles","false","true","","","false","false","false","false"
"Costal City Metals","","42 NW Hollywood Blvd","Fort Walton Beach","","FL","32548","8502225099","0","","","30.4124215","-86.6189825","19.4852803731086","","false","false","","","false","false","false","false"
"Walgreens","Walgreens","1103 US Highway 331 S","Defuniak Springs","Walton","FL","32435","8509519880","0","","http://www.walgreens.com","30.72851","-86.13476","19.5597323003152","Cell Phones; Inkjet Printer Cartridges; Video Game Consoles; PlayStation Consoles","false","true","","","false","false","false","false"
"Walmart Tire & Lube Express","Walmart Tire & Lube Express","1226 US Highway 331 S","Defuniak Springs","Walton","FL","32435","8508923138","0","","http://www.walmart.com/catalog/catalog.gsp?cat=495843","30.73082","-86.13921","19.5640070672373","Lead Acid (Pb) Batteries; Used Motor Oil; Oil Filters; Video Game Consoles; PlayStation Consoles","false","true","","","false","false","false","false"
"Walmart","Walmart","1226 US Highway 331 S","Defuniak Springs","Walton","FL","32435","8508923138","0","","http://www.walmart.com","30.73082","-86.13921","19.5640070672373","Lead Acid (Pb) Batteries; Plastic Shopping Bags; Food Storage Bags; Video Game Consoles; PlayStation Consoles","false","true","","","false","false","false","false"
"Call2Recycle at S and S ELECTRONICS INC","Call2Recycle at S and S ELECTRONICS INC","598 US Highway 90 W","Defuniak Springs","Walton","FL","32433","8508923564","0","","http://www.radioshack.com/","30.72569","-86.1284","19.5903015064334","Cell Phones; Ni-Cd Batteries; Li-Ion Batteries; Ni-MH Batteries; Ni-Zn Batteries; Small Sealed Lead Acid Batteries; Video Game Consoles; PlayStation Consoles","false","true","The U.S. EPA estimates that more than 350 million rechargeable batteries are purchased annually in the U.S. Thanks to the environmental commitment of this location, its easy and free to recycle your batteries. Bring your rechargeable batteries to this location and look for the recycling box or ask an associate how you can do your part for the environment.","","false","false","false","false"
"Advance Auto Parts","","38 E Nelson Ave","Defuniak Springs","","FL","32433","8508927576","0","","http://shop.advanceautoparts.com/webapp/wcs/stores/servlet/home___","30.7214659","-86.1199611","19.6173123113027","","false","false","","","false","false","false","false"
"O'Reilly Auto Parts","null"," 394 Us Hwy 90 West ","Defuniak Springs","","FL","32433","8508921036","0","","http://oreillyauto.custhelp.com/app/error/error_id/6","30.7251189","-86.1259189","19.6355503502471","","false","false","","","false","false","false","false"
"City of Fort Walton Beach Recycling Drop-Off Site - Fred Hedricks Recreation Center","","132 Jet Drive NW ","Fort Walton Beach","","FL","32548","8508339655","0","","","30.4157686","-86.6232361","19.6721823299832","","false","false","","","false","false","false","false"
"AutoZone","AutoZone","131 E Nelson Ave","Defuniak Springs","Walton","FL","32433","8509511123","0","","http://www.autozone.com","30.72187","-86.11829","19.6957586080226","Lead Acid (Pb) Batteries; Used Motor Oil; Video Game Consoles; PlayStation Consoles","false","true","Most AutoZone stores accept used motor oil, transmission fluid, gear oil and automotive batteries. Call to see what your local store is currently accepting.","","false","false","false","false"
"AutoZone","null","131 E Nelson Ave","Defuniak Springs","","FL","32433","8509511123","0","","https://www.autozone.com/landing/page.jsp?name=in-our-stores","30.722029","-86.1185203","19.6972476434481","","false","false","","","false","false","false","false"
"Walton County Household Hazardous Waste Collection Event Program","","","De Funiak Springs","","FL","32435","8508928180","0","","https://www.co.walton.fl.us/224/Solid-Waste-Recycling","30.7210227","-86.1152184","19.7498622821326","","false","false","","","false","false","false","false"
"Walton County Recycling Drop-Off Site - Choctaw Beach Fire Station","","13837 State Highway 20","Niceville","","FL","32578","8508928180","0","","https://www.co.walton.fl.us/224/Solid-Waste-Recycling","30.4696084","-86.3439376","2.6695136279746","","false","false","","","false","false","false","false"
"Walgreens Pharmacy Prescription Drop-Off","","4582 E Hwy 20","Niceville","","FL","32578","8508971368","0","","https://www.walgreens.com/","30.4815088","-86.4128381","6.54984720554277","","false","false","","","false","false","false","false"
"Super-Lube #331","Super-Lube #331","1520 Vucovich Dr","Niceville","Okaloosa","FL","32578","8508970303","0","","","30.48302","-86.41539","6.69846934241701","Used Motor Oil; Video Game Consoles; PlayStation Consoles","false","true","","","false","false","false","false"
"Call2Recycle at Walker's Ace Hardware","Call2Recycle at Walker's Ace Hardware","4550 FL-20 ","Niceville","Okaloosa County","FL","32578","9046784222","0","","http://www.acehardware.com/","30.485912","-86.416858","6.7842699406111","Cell Phones; Ni-Cd Batteries; Li-Ion Batteries; Ni-MH Batteries; Ni-Zn Batteries; Small Sealed Lead Acid Batteries; Video Game Consoles; PlayStation Consoles","false","true","The U.S. EPA estimates that more than 350 million rechargeable batteries are purchased annually in the U.S. Thanks to the environmental commitment of this location, its easy and free to recycle your batteries. Bring your rechargeable batteries to this location and look for the recycling box or ask an associate how you can do your part for the environment.","","false","false","false","false"
"Walgreens","Walgreens","4582 E Highway 20","Niceville","Okaloosa","FL","32578","8508971368","0","","http://www.walgreens.com","30.48389","-86.41708","6.79797382488148","Cell Phones; Inkjet Printer Cartridges; Video Game Consoles; PlayStation Consoles","false","true","","","false","false","false","false"
"Pak Mail Center US447","","4516 E Hwy 20","Niceville","","FL","32578","8508979688","0","","https://www.pakmail.com/","30.4862992","-86.4200253","6.97307000956873","","false","false","","","false","false","false","false"
"Publix","","725 Grand Boulevard","Miramar Beach","","FL","32550","8506222326","0","","https://sustainability.publix.com/storefront/customer-recycling/","30.3794943","-86.3116064","7.32112765047408","","false","false","","","false","false","false","false"
"Walmart Supercenter","","6712 U.S. 98","Santa Rosa Beach","","FL","32459","8506226237","0","","https://www.walmart.com/","30.3770561","-86.2889331","7.51752707132608","","false","false","","","false","false","false","false"
"Goodwill Industries-Big Bend Inc. - Dell Reconnect Donation Site","","10896 Highway 98","Sandestin","","FL","32550","8506502082","0","","http://www.goodwillbigbend.org/","30.3808355","-86.3555565","7.86258276483919","","false","false","","","false","false","false","false"
"Sony Outlet","","10562 Hwy 98","Destin","","FL","32550","8506544013","0","","","30.3788565","-86.3514979","7.89637928732715","","false","false","","","false","false","false","false"
"Nike Reuse-A-Shoe Drop-Off","Nike Reuse-A-Shoe Drop-Off","10746 US Highway 98 W Ste","Destin","Walton","FL","32550","8506500111","0","","http://www.nikereuseashoe.com/","30.3793","-86.35349","7.91229912137174","Shoes; Video Game Consoles; PlayStation Consoles","false","true","Nike's Reuse-A-Shoe program collects old, worn-out athletic shoes for recycling, transforming them into Nike Grind, a material used in creating athletic and playground surfaces as well as select Nike products.","","false","false","false","false"
"Levi’s® ","Levi’s® Store","10562 US Highway 98 W Ste 121","Destin","Walton","FL","32550","8508374698","8508372869","","http://www.levistrauss.com/","30.37798","-86.35111","7.9443776460383","Clothing; Denim; Shoes; Video Game Consoles; PlayStation Consoles","false","true","Customers may drop off no-longer-wanted clothing and shoes for recycling in the collection boxes at local Levi’s® stores and Levi’s® Outlet  stores and receive a voucher for 20% off a single regular-priced Levi’s®  item in-store.","","false","false","false","false"
"Walton County Recycling Drop-Off Site - Miramar Fire Station","","217 South Geronimo St","Destin","","FL","32550","8508928180","0","","https://www.co.walton.fl.us/224/Solid-Waste-Recycling","30.3805133","-86.3593378","7.97529130753711","","false","false","","","false","false","false","false"
"Walton County Recycling Drop-Off Site - Mosquito Control","","Chat Holley Rd & Hwy 393","Santa Rosa Beach","","FL","32459","8508928180","0","","https://www.co.walton.fl.us/224/Solid-Waste-Recycling","30.3888508","-86.2287114","7.99028169513538","","false","false","","","false","false","false","false"
"Goodwill Industries-Big Bend Inc. - Dell Reconnect Donation Site","","3223 US Highway 98 West","Santa Rosa Beach","","FL","32549","8502670555","0","","http://www.goodwillbigbend.org/","30.3734442","-86.2316497","8.81103890089","","false","false","","","false","false","false","false"
"Walton County Recycling Drop-Off Site - Inlet Beach Fire Station","","Hwy 98","Santa Rosa Beach","","FL","32459","8508928180","0","","https://www.co.walton.fl.us/224/Solid-Waste-Recycling","30.3741081","-86.2295011","8.83353264592624","","false","false","","","false","false","false","false"
"Walton County Recycling Drop-Off Site - South Walton Fire Department Yard","","Hwy 98 & Hwy 393","Santa Rosa Beach","","FL","32459","8508928180","0","","https://www.co.walton.fl.us/224/Solid-Waste-Recycling","30.3740981","-86.2290463","8.84757739913186","","false","false","","","false","false","false","false"
"Publix","","2038 US Highway 98 West","Santa Rosa Beach","","FL","32459","8502670582","0","","https://sustainability.publix.com/storefront/customer-recycling/","30.3752264","-86.2131145","9.29207061669133","","false","false","","","false","false","false","false"
"Lowe's","","4405 Legendary Dr","Destin","","FL","32541","8502697040","0","","https://newsroom.lowes.com/responsibility/operational-excellence/","30.3915726","-86.4196798","9.49828247547681","Batteries (Rechargeable); Cell Phone Batteries; Li-Ion Batteries; Ni-Cd Batteries; Ni-MH Batteries; Small Sealed Lead Acid Batteries; Cell Phones","false","true","","Call2Recycle","false","false","false","false"
"Walmart Supercenter","","1300 E John Sims Pkwy","Niceville","","FL","32578","8503893013","0","","https://www.walmart.com/","30.5172615","-86.4603154","9.62835137765047","","false","false","","","false","false","false","false"
"Call2Recycle at Lowe's","Call2Recycle at Lowe's","4405 Legendary Dr","Destin","Okaloosa","FL","32541","8502697040","0","Monday: 6:00 AM - 10:00 PM Tuesday: 6:00 AM - 10:00 PM Wednesday: 6:00 AM - 10:00 PM Thursday: 6:00 AM - 10:00 PM Friday: 6:00 AM - 10:00 PM Saturday: 6:00 AM - 10:00 PM Sunday: 8:00 AM - 8:00 PM ","http://www.lowes.com/","30.39367","-86.42641","9.70052618602281","Cell Phones; Compact Fluorescent Lights; Ni-Cd Batteries; Plastic Shopping Bags; Li-Ion Batteries; Ni-MH Batteries; Ni-Zn Batteries; Small Sealed Lead Acid Batteries; Video Game Consoles; PlayStation Consoles","false","true","As an environmentally-committed retailer, Lowes offers a recycling center near store entrances to give consumers a free and easy way to properly dispose of rechargeable batteries, cell phones, CFLs and plastic shopping bags; materials that otherwise could be potentially harmful to the environment.  Look for the recycling center or ask a store associate for more details.","","false","false","false","false"
"Best Buy","null","34940 Emerald Coast Pkwy","Destin","","FL","32541","8502692140","0","","https://www.bestbuy.com/site/services/recycling/pcmcat149900050025.c?id=pcmcat149900050025","30.3877451","-86.424425","9.88545884058039","","false","false","","","false","false","false","false"
"Walton County Recycling Drop-Off Site - Freeport City Hall","","112 State Highway 20","Freeport","","FL","32439","8508928180","0","","https://www.co.walton.fl.us/224/Solid-Waste-Recycling","30.499256","-86.137504","9.89544553053326","","false","false","","","false","false","false","false"
"Walgreens Pharmacy Prescription Drop-Off","","34909 Emerald Coast Pkwy","Destin","","FL","32541","8506547291","0","","https://www.walgreens.com/","30.3895249","-86.4270346","9.9174174436078","","false","false","","","false","false","false","false"
"Walgreens","Walgreens","34909 Emerald Coast Pkwy","Destin","Okaloosa","FL","32541","8506547291","0","","http://www.walgreens.com","30.38926","-86.42768","9.958291905573","Cell Phones; Inkjet Cartridge Refilling; Inkjet Printer Cartridges; Video Game Consoles; PlayStation Consoles","false","true","","","false","false","false","false"
