name,description,address,city,region,province,postal_code,phone,fax,hours,url,latitude,longitude,distance,materials,pickup,dropoff,notes,groups,curbside,municipal,national,event_only
"Firestone Complete Auto Care Store","Firestone Complete Auto Care Store","2335 Highway 80 W","Jackson","Hinds","MS","39204","6013262365","0","","http://www.firestonecompleteautocare.com/","32.2901","-90.22528","6.1399178079471","Lead Acid (Pb) Batteries; Used Motor Oil; Video Game Consoles; PlayStation Consoles","false","true","","","false","false","false","false"
"May & Company Inc.","May & Company Inc.","838 W Capitol St","Jackson","Hinds","MS","39203","8003980749","0","","http://mayxco.com/","32.30493","-90.19842","6.18952625644215","Cell Phones; Ni-Cd Batteries; Li-Ion Batteries; Ni-MH Batteries; Ni-Zn Batteries; Small Sealed Lead Acid Batteries; Video Game Consoles; PlayStation Consoles","false","true","The U.S. EPA estimates that more than 350 million rechargeable batteries are purchased annually in the U.S. Thanks to the environmental commitment of this location, its easy and free to recycle your batteries. Bring your rechargeable batteries to this location and look for the recycling box or ask an associate how you can do your part for the environment.","","false","false","false","false"
"Walgreens","Walgreens","955 N State St","Jackson","Hinds","MS","39202","6019695388","0","","http://www.walgreens.com","32.31075","-90.17833","6.22752258164857","Cell Phones; Inkjet Cartridge Refilling; Inkjet Printer Cartridges; Video Game Consoles; PlayStation Consoles","false","true","","","false","false","false","false"
"A-1 Pallet Company Incorporated","A-1 Pallet Company Incorporated","1000 N Mill St","Jackson","Hinds","MS","39202","6013520586","0","Monday: 7:00 AM - 4:00 PM Tuesday: 7:00 AM - 4:00 PM Wednesday: 7:00 AM - 4:00 PM Thursday: 7:00 AM - 4:00 PM Friday: 7:00 AM - 4:00 PM ","","32.31079","-90.1888","6.37965160432688","Wood Pallets; Video Game Consoles; PlayStation Consoles","false","true","","","false","false","false","false"
"AutoZone","","1419 Ellis Ave","Jackson","","MS","39204","6013538116","0","","https://www.autozone.com/landing/page.jsp?name=in-our-stores","32.2925622","-90.2286434","6.39690092398509","","false","false","","","false","false","false","false"
"AutoZone","AutoZone","1419 Ellis Ave","Jackson","Hinds","MS","39204","6013538116","0","","http://www.autozone.com","32.29313","-90.22791","6.39892213075717","Lead Acid (Pb) Batteries; Used Motor Oil; Video Game Consoles; PlayStation Consoles","false","true","Most AutoZone stores accept used motor oil, transmission fluid, gear oil and automotive batteries. Call to see what your local store is currently accepting.","","false","false","false","false"
"Recycle America","Recycle America","841 Palmyra St","Jackson","Hinds","MS","39203","6013541749","0","Monday: 7:30 AM - 3:00 PM Tuesday: 7:30 AM - 3:00 PM Wednesday: 7:30 AM - 3:00 PM Thursday: 7:30 AM - 3:00 PM Friday: 7:30 AM - 3:00 PM ","","32.30953","-90.19623","6.43703300143588","Plastic #1 (PETE); Plastic #2 (HDPE); Plastic #2 (Color HDPE); Catalogs; Computer Paper; Magazines; Newspapers; Office Paper; Video Game Consoles; PlayStation Consoles","false","true","","","false","false","false","false"
"Global Plastics Recyclers","","841 Palmyra St","Jackson","","MS","39203","6019220884","0","","","32.309427","-90.196978","6.44600358552127","","false","false","","","false","false","false","false"
"Davis Tire and Auto","Davis Tire and Auto","5758 Terry Rd","Jackson","Hinds","MS","39272","6013720872","0","Monday: 7:30 AM - 5:30 PM Tuesday: 7:30 AM - 5:30 PM Wednesday: 7:30 AM - 5:30 PM Thursday: 7:30 AM - 5:30 PM Friday: 7:30 AM - 5:30 PM Saturday: 7:30 AM - 1:00 PM ","","32.18584","-90.26074","6.55892853356379","Used Motor Oil; Oil Filters; Video Game Consoles; PlayStation Consoles","false","true","","","false","false","false","false"
"O'Reilly Auto Parts","null","  1220 Ellis Avenue","Jackson","","MS","39209","6019696013","0","","http://oreillyauto.custhelp.com/app/error/error_id/6","32.2968616","-90.2272143","6.57247876269928","","false","false","","","false","false","false","false"
"Advance Auto Parts","","1259 Ellis Ave","Jackson","","MS","39209","6013541670","0","","http://shop.advanceautoparts.com/webapp/wcs/stores/servlet/home___","32.2964168","-90.2282403","6.58607003869711","","false","false","","","false","false","false","false"
"Battery Sales & Service","Battery Sales & Service","605 W Fortification St","Jackson","Hinds","MS","39203","6013522112","0","Monday: 8:00 AM - 4:30 PM Tuesday: 8:00 AM - 4:30 PM Wednesday: 8:00 AM - 4:30 PM Thursday: 8:00 AM - 4:30 PM Friday: 8:00 AM - 4:30 PM ","http://www.batterysalesandservice.com/","32.31163","-90.19799","6.60927755184021","Cell Phones; Ni-Cd Batteries; Li-Ion Batteries; Ni-MH Batteries; Ni-Zn Batteries; Small Sealed Lead Acid Batteries; Video Game Consoles; PlayStation Consoles","false","true","The U.S. EPA estimates that more than 350 million rechargeable batteries are purchased annually in the U.S. Thanks to the environmental commitment of this location, its easy and free to recycle your batteries. Bring your rechargeable batteries to this location and look for the recycling box or ask an associate how you can do your part for the environment.","","false","false","false","false"
"USPS Post Office Box Lobby Recycling Program","US Post Office","5654 Terry Rd","Byram","Hinds","MS","39272","8002758777","0","","https://www.usps.com/","32.18519","-90.26139","6.6113670102729","Catalogs; Greeting Cards; Magazines; Paper (Mixed)","false","true","","","false","false","false","false"
"US Post Office","USPS Discarded Lobby Mail Recycling Program","5654 Terry Rd","Byram","Hinds","MS","39272","0","0","","","32.18519","-90.26139","6.6113670102729","Video Game Consoles; PlayStation Consoles","false","true","","","false","false","false","false"
"Discount Auto Zone","Discount Auto Zone","1259 Ellis Ave","Jackson","Hinds","MS","39209","6013541670","0","Monday: 8:00 AM - 8:00 PM Tuesday: 8:00 AM - 8:00 PM Wednesday: 8:00 AM - 8:00 PM Thursday: 8:00 AM - 8:00 PM Friday: 8:00 AM - 8:00 PM Saturday: 8:00 AM - 8:00 PM Sunday: 9:00 AM - 6:00 PM ","","32.29736","-90.22792","6.62509394265661","Lead Acid (Pb) Batteries; Used Motor Oil; Video Game Consoles; PlayStation Consoles","false","true","","","false","false","false","false"
"Advance Auto Parts","Advance Auto Parts","1259 Ellis Ave","Jackson","Hinds","MS","39209","6013541670","0","Monday: 7:00 AM - 9:00 PM Tuesday: 7:00 AM - 9:00 PM Wednesday: 7:00 AM - 9:00 PM Thursday: 7:00 AM - 9:00 PM Friday: 7:00 AM - 9:00 PM Saturday: 7:00 AM - 9:00 PM Sunday: 10:00 AM - 8:00 PM ","http://www.advanceautoparts.com","32.29736","-90.22792","6.62509394265661","Lead Acid (Pb) Batteries; Used Motor Oil; Video Game Consoles; PlayStation Consoles","false","true","","","false","false","false","false"
"Tire Zone, Inc.","Tire Zone, Inc.","2911 Highway 80 W","Jackson","Hinds","MS","39204","6013558473","0","Monday: 8:00 AM - 5:30 PM Tuesday: 8:00 AM - 5:30 PM Wednesday: 8:00 AM - 5:30 PM Thursday: 8:00 AM - 5:30 PM Friday: 8:00 AM - 5:30 PM ","","32.29433","-90.23404","6.69706025841669","Used Tires; Video Game Consoles; PlayStation Consoles","false","true","","","false","false","false","false"
"Magnolia Data Solutions, LLC","","160 Fairbanks St","Jackson","","MS","39202","6019190062","0","","http://magnoliadatasolutions.com/","32.3167252","-90.1873304","6.75030201134694","","false","false","","","false","false","false","false"
"O'Reilly Auto Parts","null","7365 Siwell Road","Byram","","MS","39212","6013713088","0","","http://oreillyauto.custhelp.com/app/error/error_id/6","32.1886506","-90.265562","6.75033905382701","","false","false","","","false","false","false","false"
"AutoZone","","101 Byram Pkwy","Byram","","MS","39272","6013720115","0","","https://www.autozone.com/landing/page.jsp?name=in-our-stores","32.1887383","-90.2660021","6.77240306619339","","false","false","","","false","false","false","false"
"General Recycling of Mississippi, LLC","","2050 Flowood Drive","Flowood","","MS","39232","6019391347","0","","","32.3193333","-90.1265385","6.93239667067469","","false","false","","","false","false","false","false"
"Nucor Steel Jackson Inc","Nucor Steel Jackson Inc","2050 Flowood Dr","Flowood","Rankin","MS","39232","6019391347","0","","http://www.nucor.com","32.31986","-90.12543","6.98448361319206","Aluminum; Ferrous Metals (Steel or Iron); Video Game Consoles; PlayStation Consoles","true","true","","","false","false","false","false"
"Walgreens","Walgreens","2896 McDowell Road Ext","Jackson","Hinds","MS","39204","6013717350","0","","http://www.walgreens.com","32.27029","-90.26309","7.01652849232892","Cell Phones; Inkjet Printer Cartridges; Video Game Consoles; PlayStation Consoles","false","true","","","false","false","false","false"
"Quality Car Care","Quality Car Care","5408 Robinson Road Ext","Jackson","Hinds","MS","39204","6013721248","0","Monday: 7:00 AM - 5:15 PM Tuesday: 7:00 AM - 5:15 PM Wednesday: 7:00 AM - 5:15 PM Thursday: 7:00 AM - 5:15 PM Friday: 7:00 AM - 5:15 PM Saturday: 7:00 AM - 4:15 PM ","","32.27485","-90.26036","7.03314921700523","Used Motor Oil; Video Game Consoles; PlayStation Consoles","false","true","","","false","false","false","false"
"Walgreens","Walgreens","977 Ellis Ave","Jackson","Hinds","MS","39209","6019449965","0","","http://www.walgreens.com","32.30625","-90.22786","7.11338876038409","Cell Phones; Inkjet Printer Cartridges; Video Game Consoles; PlayStation Consoles","false","true","","","false","false","false","false"
"USPS Post Office Box Lobby Recycling Program","US Post Office","905 Ellis Ave","Jackson","Hinds","MS","39209","8002758777","0","","https://www.usps.com/","32.30625","-90.22786","7.11338876038409","Catalogs; Greeting Cards; Magazines; Paper (Mixed)","false","true","","","false","false","false","false"
"US Post Office","USPS Discarded Lobby Mail Recycling Program","905 Ellis Ave","Jackson","Hinds","MS","39209","0","0","","","32.30625","-90.22786","7.11338876038409","Video Game Consoles; PlayStation Consoles","false","true","","","false","false","false","false"
"Call2Recycle at Saks Incorporated","Call2Recycle at Saks Incorporated","3455 Highway 80 W","Jackson","Hinds","MS","39209","6015928655","0","","https://www.saksincorporated.com/","32.29791","-90.24119","7.16202048531342","Cell Phones; Ni-Cd Batteries; Li-Ion Batteries; Ni-MH Batteries; Ni-Zn Batteries; Small Sealed Lead Acid Batteries; Video Game Consoles; PlayStation Consoles","false","true","The U.S. EPA estimates that more than 350 million rechargeable batteries are purchased annually in the U.S. Thanks to the environmental commitment of this location, its easy and free to recycle your batteries. Bring your rechargeable batteries to this location and look for the recycling box or ask an associate how you can do your part for the environment.","","false","false","false","false"
"AutoZone","AutoZone","3030 McDowell Road Ext","Jackson","Hinds","MS","39204","6013465622","0","","http://www.autozone.com","32.27109","-90.26564","7.17399907617277","Lead Acid (Pb) Batteries; Used Motor Oil; Video Game Consoles; PlayStation Consoles","false","true","Most AutoZone stores accept used motor oil, transmission fluid, gear oil and automotive batteries. Call to see what your local store is currently accepting.","","false","false","false","false"
"Advantage E-Cycling","","121 Hillandale Ln","Pearl","","MS","39208","6018263781","0","","https://advantageecycling.com/","32.2848479","-90.057289","7.25901864483663","","false","false","","","false","false","false","false"
"AutoZone","","3030 Mcdowell Rd","Jackson","","MS","39204","6013465622","0","","https://www.autozone.com/landing/page.jsp?name=in-our-stores","32.2721504","-90.2681296","7.33681123593429","","false","false","","","false","false","false","false"
"Discount Auto Zone","Discount Auto Zone","2020 Raymond Rd","Jackson","Hinds","MS","39204","6013738289","0","Monday: 8:00 AM - 8:00 PM Tuesday: 8:00 AM - 8:00 PM Wednesday: 8:00 AM - 8:00 PM Thursday: 8:00 AM - 8:00 PM Friday: 8:00 AM - 8:00 PM Saturday: 8:00 AM - 8:00 PM Sunday: 9:00 AM - 6:00 PM ","","32.27368","-90.26839","7.40021715152987","Lead Acid (Pb) Batteries; Used Motor Oil; Video Game Consoles; PlayStation Consoles","false","true","","","false","false","false","false"
"Advance Auto Parts","Advance Auto Parts","2020 Raymond Rd","Jackson","Hinds","MS","39204","6013731833","0","Monday: 7:00 AM - 9:00 PM Tuesday: 7:00 AM - 9:00 PM Wednesday: 7:00 AM - 9:00 PM Thursday: 7:00 AM - 9:00 PM Friday: 7:00 AM - 9:00 PM Saturday: 7:00 AM - 9:00 PM Sunday: 10:00 AM - 8:00 PM ","http://www.advanceautoparts.com","32.27368","-90.26839","7.40021715152987","Lead Acid (Pb) Batteries; Used Motor Oil; Video Game Consoles; PlayStation Consoles","false","true","","","false","false","false","false"
"Advance Auto Parts","","2020 Raymond Rd","Jackson","","MS","39204","6013731833","0","","http://shop.advanceautoparts.com/webapp/wcs/stores/servlet/home___","32.2731225","-90.2693768","7.43267268450631","","false","false","","","false","false","false","false"
