name,description,address,city,region,province,postal_code,phone,fax,hours,url,latitude,longitude,distance,materials,pickup,dropoff,notes,groups,curbside,municipal,national,event_only
"Walmart Supercenter","","Marketplace Dr","Richland","","MS","39218","6019390538","0","","https://www.walmart.com/","32.219891","-90.1543126","0.242073307682148","","false","false","","","false","false","false","false"
"Walmart Tire and Lube Express","null","200 Market Place Dr, ","Richland","","MS","39218","6019390538","0","","https://www.walmart.com/cp/ideas/8932632","32.219891","-90.1543126","0.242073307682148","","false","false","","","false","false","false","false"
"Walmart Tire & Lube Express","Walmart Tire & Lube Express","200 Market Pl","Richland","Rankin","MS","39218","6019390538","0","","http://www.walmart.com/catalog/catalog.gsp?cat=495843","32.22974","-90.14946","0.679506889712766","Lead Acid (Pb) Batteries; Used Motor Oil; Oil Filters; Video Game Consoles; PlayStation Consoles","false","true","","","false","false","false","false"
"Walmart","Walmart","200 Market Pl","Richland","Rankin","MS","39218","6019390538","0","","http://www.walmart.com","32.22974","-90.14946","0.679506889712766","Lead Acid (Pb) Batteries; Plastic Shopping Bags; Food Storage Bags; Video Game Consoles; PlayStation Consoles","false","true","","","false","false","false","false"
"Pit Stop","Pit Stop","561 Highway 49 S","Richland","Rankin","MS","39218","6019393852","0","Monday: 8:00 AM - 5:30 PM Tuesday: 8:00 AM - 5:30 PM Wednesday: 8:00 AM - 5:30 PM Thursday: 8:00 AM - 5:30 PM Friday: 8:00 AM - 5:30 PM Saturday: 8:00 AM - 1:00 PM ","","32.20614","-90.14739","1.26144460944712","Used Motor Oil; Video Game Consoles; PlayStation Consoles","false","true","","","false","false","false","false"
"Advance Auto Parts","null","1187 Highway 49 S","Richland","","MS","39218","6019391367","0","","http://shop.advanceautoparts.com/webapp/wcs/stores/servlet/home___","32.2419178","-90.1652454","1.42795929152451","","false","false","","","false","false","false","false"
"AutoZone","","1009 Hwy 49 South","Richland","","MS","39218","6016640409","0","","https://www.autozone.com/landing/page.jsp?name=in-our-stores","32.2419178","-90.1652454","1.42795929152451","","false","false","","","false","false","false","false"
"Sams Club","","90 Bass Pro Drive","Pearl","","MS","39208","6019394161","0","","https://www.samsclub.com/","32.2690241","-90.1481824","3.2639457901272","","false","false","","","false","false","false","false"
"Car Care Clinic","Car Care Clinic","135 S Pearson Rd","Jackson","Rankin","MS","39208","6019328877","0","Monday: 7:30 AM - 5:30 PM Tuesday: 7:30 AM - 5:30 PM Wednesday: 7:30 AM - 5:30 PM Thursday: 7:30 AM - 5:30 PM Friday: 7:30 AM - 5:30 PM Saturday: 7:30 AM - 5:00 PM ","","32.27367","-90.1368","3.73732237143167","Used Motor Oil; Video Game Consoles; PlayStation Consoles","false","true","","","false","false","false","false"
"Call2Recycle at Grainger","Call2Recycle at Grainger","3551 I 55 S","Jackson","Hinds","MS","39212","6013722525","0","","http://www.grainger.com/","32.25139","-90.21333","3.84325604565535","Cell Phones; Ni-Cd Batteries; Li-Ion Batteries; Ni-MH Batteries; Ni-Zn Batteries; Small Sealed Lead Acid Batteries; Video Game Consoles; PlayStation Consoles","false","true","The U.S. EPA estimates that more than 350 million rechargeable batteries are purchased annually in the U.S. Thanks to the environmental commitment of this location, its easy and free to recycle your batteries. Bring your rechargeable batteries to this location and look for the recycling box or ask an associate how you can do your part for the environment.","","false","false","false","false"
"APAC - Mississippi, INC. - Jackson","","2900 Meter Road","Jackson","","MS","39204","0","0","","http://www.apac-ms.com/","32.263688","-90.207057","4.07728178950997","","false","false","","","false","false","false","false"
"USPS Post Office Box Lobby Recycling Program","US Post Office","2300 Highway 80 E","Pearl","Rankin","MS","39208","8002758777","0","","https://www.usps.com/","32.27991","-90.13608","4.16047736959084","Catalogs; Greeting Cards; Magazines; Paper (Mixed)","false","true","","","false","false","false","false"
"US Post Office","USPS Discarded Lobby Mail Recycling Program","2300 Highway 80 E","Pearl","Rankin","MS","39208","0","0","","","32.27991","-90.13608","4.16047736959084","Video Game Consoles; PlayStation Consoles","false","true","","","false","false","false","false"
"Tire Technology Inc.","Tire Technology Inc.","2845 Meter Rd","Jackson","Hinds","MS","39204","6019496900","0","Monday: 8:30 AM - 4:30 PM Tuesday: 8:30 AM - 4:30 PM Wednesday: 8:30 AM - 4:30 PM Thursday: 8:30 AM - 4:30 PM Friday: 8:30 AM - 4:30 PM ","","32.26659","-90.20635","4.19153557929845","Used Tires; Video Game Consoles; PlayStation Consoles","false","true","This site charges a fee for dropping off tires.","","false","false","false","false"
"Goodwill Industries","Goodwill Industries","426 N Bierdeman Rd","Pearl","Rankin","MS","39208","6019398726","0","Monday: 8:30 AM - 5:30 PM Tuesday: 8:30 AM - 5:30 PM Wednesday: 8:30 AM - 5:30 PM Thursday: 8:30 AM - 5:30 PM Friday: 8:30 AM - 5:30 PM Saturday: 8:30 AM - 5:30 PM ","http://www.goodwillms.org","32.2793","-90.12983","4.24396055790772","Bikes; Books (Reuse); Clothing; Computer (Reuse); Hard Drives; Gift Bags; Eyeglasses; Household Goods; Lawn Equipment; Ornaments; Reusable Appliance Donation; Sporting Goods; Telephones; Miscellaneous Tools; Children's Toys; Video Game Consoles; PlayStation Consoles","false","true","","","false","false","false","false"
"O'Reilly Auto Parts","null","2795 Highway 49 South","Florence","","MS","39073","6018451459","0","","http://oreillyauto.custhelp.com/app/error/error_id/6","32.1650032","-90.1303045","4.26610179612594","","false","false","","","false","false","false","false"
"USPS Post Office Box Lobby Recycling Program","US Post Office","105 Hogg Creek Dr","Flowood","Rankin","MS","39232","8002758777","0","","https://www.usps.com/","32.28508","-90.15652","4.33060582202638","Catalogs; Greeting Cards; Magazines; Paper (Mixed)","false","true","","","false","false","false","false"
"US Post Office","USPS Discarded Lobby Mail Recycling Program","105 Hogg Creek Dr","Flowood","Rankin","MS","39232","0","0","","","32.28508","-90.15652","4.33060582202638","Video Game Consoles; PlayStation Consoles","false","true","","","false","false","false","false"
"AutoZone","","3256 Terry Rd","Jackson","","MS","39212","6013711033","0","","https://www.autozone.com/landing/page.jsp?name=in-our-stores","32.2561995","-90.2220113","4.44937461420619","","false","false","","","false","false","false","false"
"AutoZone","AutoZone","3256 Terry Rd","Jackson","Hinds","MS","39212","6013711033","0","","http://www.autozone.com","32.25054","-90.22582","4.45648118194042","Lead Acid (Pb) Batteries; Used Motor Oil; Video Game Consoles; PlayStation Consoles","false","true","Most AutoZone stores accept used motor oil, transmission fluid, gear oil and automotive batteries. Call to see what your local store is currently accepting.","","false","false","false","false"
"AutoZone","","2835 Hwy 80 E","Pearl","","MS","39208","6019391872","0","","https://www.autozone.com/landing/page.jsp?name=in-our-stores","32.2810557","-90.1250414","4.46685632490766","","false","false","","","false","false","false","false"
"Walgreens","Walgreens","3445 Terry Rd","Jackson","Hinds","MS","39212","6013728750","0","","http://www.walgreens.com","32.24623","-90.22862","4.48676570245536","Cell Phones; Inkjet Printer Cartridges; Video Game Consoles; PlayStation Consoles","false","true","","","false","false","false","false"
"O'Reilly Auto Parts","null","3110 Terry Road","Jackson","","MS","39212","6013717393","0","","http://oreillyauto.custhelp.com/app/error/error_id/6","32.2593921","-90.2207657","4.5087860398427","","false","false","","","false","false","false","false"
"O'Reilly Auto Parts","null","2730 Highway 80 East","Pearl","","MS","39208","6019325863","0","","http://oreillyauto.custhelp.com/app/error/error_id/6","32.2823838","-90.1260648","4.52589252394564","","false","false","","","false","false","false","false"
"AutoZone","AutoZone"," 2835 Hwy 80 E","Pearl","Rankin","MS","39208","6019391872","0","","http://www.autozone.com","32.28197","-90.12424","4.54388619094979","Lead Acid (Pb) Batteries; Used Motor Oil; Video Game Consoles; PlayStation Consoles","false","true","Most AutoZone stores accept used motor oil, transmission fluid, gear oil and automotive batteries. Call to see what your local store is currently accepting.","","false","false","false","false"
"Firestone Complete Auto Care Store","Firestone Complete Auto Care Store","2914 Us-80","Pearl","Rankin","MS","39208","6013262358","0","","http://www.firestonecompleteautocare.com/","32.28192","-90.12334","4.56331043057915","Lead Acid (Pb) Batteries; Used Motor Oil; Video Game Consoles; PlayStation Consoles","false","true","","","false","false","false","false"
"Firestone Complete Auto Care","","2914 Hwy 80 E","Pearl","","MS","39208","6019325591","0","","https://www.firestonecompleteautocare.com/","32.2829636","-90.1220813","4.66029667899428","","false","false","","","false","false","false","false"
"Resource Recovery","Resource Recovery","980 N Bierdeman Rd","Pearl","Rankin","MS","39208","6019328004","0","Monday: 8:00 AM - 5:00 PM Tuesday: 8:00 AM - 5:00 PM Wednesday: 8:00 AM - 5:00 PM Thursday: 8:00 AM - 5:00 PM Friday: 8:00 AM - 5:00 PM ","","32.28792","-90.13749","4.67084694965241","Used Motor Oil; Video Game Consoles; PlayStation Consoles","false","true","","","false","false","false","false"
"Jackson Iron & Metal Co Inc","Jackson Iron & Metal Co Inc","1404 Allen St","Jackson","Hinds","MS","39201","6019696910","0","Monday: 8:00 AM - 4:30 PM Tuesday: 8:00 AM - 4:30 PM Wednesday: 8:00 AM - 4:30 PM Thursday: 8:00 AM - 4:30 PM Friday: 8:00 AM - 4:30 PM ","http://www.metalprocessorsinc.com","32.28464","-90.18908","4.68611822865464","Aluminum; Ferrous Metals (Steel or Iron); Large Household Appliances; Non-ferrous (Copper/Brass/Tin); Wire; Scrap Metal; Video Game Consoles; PlayStation Consoles","false","true","","","false","false","false","false"
"Metal Processors Inc A Division of Jackson Iron & Metal Inc","Metal Processors Inc A Division of Jackson Iron & Metal Inc","1435 Allen St","Jackson","Hinds","MS","39201","6019692871","0","Monday: 8:00 AM - 4:00 PM Tuesday: 8:00 AM - 4:00 PM Wednesday: 8:00 AM - 4:00 PM Thursday: 8:00 AM - 4:00 PM Friday: 8:00 AM - 4:00 PM ","http://www.metalprocessorsinc.com","32.28468","-90.18936","4.69517748634748","Aluminum; Ferrous Metals (Steel or Iron); Non-ferrous (Copper/Brass/Tin); Video Game Consoles; PlayStation Consoles","false","true","","","false","false","false","false"
"Jackson Iron & Metal Co Inc","","1404 Allen St","Jackson","","MS","39201","6017607003","0","","","32.2849803","-90.1891429","4.70915566148415","","false","false","","","false","false","false","false"
"Metal Processors Incorporated","Metal Processors Incorporated","120 Beatty St","Jackson","Hinds","MS","39201","6019692871","0","Monday: 8:00 AM - 4:30 PM Tuesday: 8:00 AM - 4:30 PM Wednesday: 8:00 AM - 4:30 PM Thursday: 8:00 AM - 4:30 PM Friday: 8:00 AM - 4:30 PM ","","32.28523","-90.18939","4.73072003936061","Aluminum Cans; Ferrous Metals (Steel or Iron); Non-ferrous (Copper/Brass/Tin); Tin or Steel Cans; Video Game Consoles; PlayStation Consoles","false","true","","","false","false","false","false"
"AutoZone","AutoZone","101 Byram Pkwy","Byram","Hinds","MS","39272","6017201150","0","","http://www.autozone.com","32.23879","-90.23648","4.76970390399449","Lead Acid (Pb) Batteries; Used Motor Oil; Video Game Consoles; PlayStation Consoles","false","true","Most AutoZone stores accept used motor oil, transmission fluid, gear oil and automotive batteries. Call to see what your local store is currently accepting.","","false","false","false","false"
"Advance Auto Parts","null","3107 Highway 80 E","Pearl","","MS","39208","6019362199","0","","http://shop.advanceautoparts.com/webapp/wcs/stores/servlet/home___","32.2823044","-90.1164174","4.77567433067673","","false","false","","","false","false","false","false"
"Keep America Beautiful Cars to Donate","","","Pearl","","MS","39208","8554262474","0","","https://www.kab.org/?pagename=car_donation","32.2540172","-90.0840215","4.80206794939289","","false","false","","","false","false","false","false"
"Rankin County Curbside Christmas Tree Collection Program","","","Pearl","","MS","39208","6019229647","0","","https://www.rankincounty.org/","32.2540172","-90.0840215","4.80206794939289","","false","false","","","false","false","false","false"
"Advance Auto Parts","Advance Auto Parts","3107 Highway 80 E","Pearl","Rankin","MS","39208","6019362199","0","Monday: 7:00 AM - 9:00 PM Tuesday: 7:00 AM - 9:00 PM Wednesday: 7:00 AM - 9:00 PM Thursday: 7:00 AM - 9:00 PM Friday: 7:00 AM - 9:00 PM Saturday: 7:00 AM - 9:00 PM Sunday: 10:00 AM - 8:00 PM ","http://www.advanceautoparts.com","32.28286","-90.11593","4.82315029499074","Lead Acid (Pb) Batteries; Used Motor Oil; Video Game Consoles; PlayStation Consoles","false","true","","","false","false","false","false"
"Walgreens","Walgreens","3189 Highway 80 E","Pearl","Rankin","MS","39208","6016640641","0","","http://www.walgreens.com","32.28286","-90.11593","4.82315029499074","Cell Phones; Inkjet Printer Cartridges; Video Game Consoles; PlayStation Consoles","false","true","","","false","false","false","false"
"Jackson State University/Hinds County/Mississippi Department of Environmental Quality Computer Recycling Program","Jackson State University/Hinds County/Mississippi Department of Environmental Quality Computer Recycling Program","1400 J R Lynch St","Jackson","Hinds","MS","39217","6019798261","0","Monday: 8:00 AM - 5:00 PM Tuesday: 8:00 AM - 5:00 PM Wednesday: 8:00 AM - 5:00 PM Thursday: 8:00 AM - 5:00 PM Friday: 8:00 AM - 5:00 PM ","","32.28894","-90.18609","4.89719192009395","Cell Phones; Computer Monitors; Computer (Recycling); Electronics; Office Equipment; MP3 Players; Video Game Consoles; PlayStation Consoles","true","true","This site collects used computers, refurbishes them, and returns them to communities and will make pick-up arrangements.  Please call for additional information.","","false","false","false","false"
"Call2Recycle at Shank Communications","Call2Recycle at Shank Communications","105 E Porter St","Jackson","Hinds","MS","39201","6013555023","0","","http://www.shankcomm.com/","32.28819","-90.18982","4.92869062622245","Cell Phones; Ni-Cd Batteries; Li-Ion Batteries; Ni-MH Batteries; Ni-Zn Batteries; Small Sealed Lead Acid Batteries; Video Game Consoles; PlayStation Consoles","false","true","The U.S. EPA estimates that more than 350 million rechargeable batteries are purchased annually in the U.S. Thanks to the environmental commitment of this location, its easy and free to recycle your batteries. Bring your rechargeable batteries to this location and look for the recycling box or ask an associate how you can do your part for the environment.","","false","false","false","false"
"RadioShack","RadioShack","3210 U.S. 80 ","Pearl","Rankin County","MS","39208","6019330893","0","Monday: 9:00 AM - 9:00 PM Tuesday: 9:00 AM - 9:00 PM Wednesday: 9:00 AM - 9:00 PM Thursday: 9:00 AM - 9:00 PM Friday: 9:00 AM - 9:00 PM Saturday: 9:00 AM - 9:00 PM Sunday: 11:00 AM - 7:00 PM ","http://www.radioshack.com","32.2833194","-90.1130408","4.93675869655493","Cell Phones; Ni-Cd Batteries; Batteries (Rechargeable); Cell Phone Batteries; Video Game Consoles; PlayStation Consoles","false","true","","","false","false","false","false"
"The Breast Cancer Research Foundation Car Donation Program","","","Jackson","","MS","39201","8554502873","0","","https://cardonationfoundation.org/","32.2907734","-90.1846217","4.98807172091583","","false","false","","","false","false","false","false"
"US Post Office","USPS Discarded Lobby Mail Recycling Program","401 E South St","Jackson","Hinds","MS","39225","0","0","","","32.29145","-90.18351","5.01206137947052","Video Game Consoles; PlayStation Consoles","false","true","","","false","false","false","false"
"I-20 Auto & Truck Express","I-20 Auto & Truck Express","916 I 20 Frontage Rd","Jackson","Hinds","MS","39201","6013555953","0","Monday: 8:00 AM - 5:00 PM Tuesday: 8:00 AM - 5:00 PM Wednesday: 8:00 AM - 5:00 PM Thursday: 8:00 AM - 5:00 PM Friday: 8:00 AM - 5:00 PM ","","32.27958","-90.21009","5.01558452266036","Used Motor Oil; Oil Filters; Video Game Consoles; PlayStation Consoles","false","true","","","false","false","false","false"
"US Post Office","US Post Office","401 E South St ","Jackson","Hinds County","MS","39201","8002758777","0","","","32.2932395","-90.1841851","5.14183214169381","Catalogs; Greeting Cards; Magazines; Paper (Mixed)","false","true","","","false","false","false","false"
"City of Florence Recycling Drop-Off","","203 College Street","Florence","","MS","39073","6018452462","0","","","32.1520975","-90.1280352","5.14801210300337","","false","false","","","false","false","false","false"
"Call2Recycle at Mid South Uniform & Supply, Inc","Call2Recycle at Mid South Uniform & Supply, Inc","1825 University Blvd","Jackson","Hinds","MS","39204","6013733613","0","","http://www.call2recycle.org/","32.28199","-90.21018","5.15088687541509","Cell Phones; Ni-Cd Batteries; Li-Ion Batteries; Ni-MH Batteries; Ni-Zn Batteries; Small Sealed Lead Acid Batteries; Video Game Consoles; PlayStation Consoles","false","true","The U.S. EPA estimates that more than 350 million rechargeable batteries are purchased annually in the U.S. Thanks to the environmental commitment of this location, its easy and free to recycle your batteries. Bring your rechargeable batteries to this location and look for the recycling box or ask an associate how you can do your part for the environment.","","false","false","false","false"
"City of Jackson Environmental Service Center HHW Drop-Off","City of Jackson Environmental Service Center HHW Drop-Off","1570 Terry Rd","Jackson","Hinds","MS","39204","6019601193","0","Tuesday: 8:00 AM - 3:30 PM Thursday: 8:00 AM - 3:30 PM ","http://jacksonms.gov/","32.2851928","-90.207054","5.22540396848671","Glue & Adhesives; Aerosol Spray Cans; Antifreeze; Brake Fluid; Lead Acid (Pb) Batteries; Cell Phones; Compact Fluorescent Lights; Degreasers; Fertilizer; Fungicides; Gasoline and Unwanted Fuels; Herbicides; Household Cleaners; Insecticides; Ni-Cd Batteries; Unused Paint; Paint Thinner; Pesticides; Photography Chemicals; Pool Chemicals; Propane Tanks; Alkaline/Single-Use Batteries; Solvents; Used Motor Oil; Oil Filters","false","true","This site is located on the corner of Terry Road and Highway 80.  Please call or visit website for more information.
Also open the 4th Saturday of each month 8:00AM-3:00PM.","","false","false","false","false"
"City of Jackson Recycling Drop-Off","City of Jackson Recycling Drop-Off","1570 Terry Rd","Jackson","","MS","39204","0","0","Tuesday: 8:00 AM - 3:00 PM Thursday: 8:00 AM - 3:00 PM ","http://www.city.jackson.ms.us/","32.2851928","-90.207054","5.22540396848671","Plastic #1 (PETE); Plastic #2 (HDPE); Plastic #3 (PVC); Plastic #4 (LDPE); Plastic #5 (Polypropylene); Plastic #6 (Polystyrene); Plastic #7; Aluminum Cans; Cardboard; Magazines; Paper (Mixed); Newspapers; Phone books; Tin or Steel Cans; Office Paper","true","true","Also open the 4th Saturday of each month. ","","false","false","false","false"
"Environmental Service Center Household Hazardous Waste Collection Facility","","1570 Terry Rd","Jackson","","MS","39204","6019602045","0","","http://www.jacksonms.gov","32.2861786","-90.2059776","5.24765658909216","","false","false","","","false","false","false","false"
"US Post Office","USPS Discarded Lobby Mail Recycling Program","401 E South St","Jackson","Hinds","MS","39215","0","0","","","32.29717","-90.18369","5.39256934365064","Video Game Consoles; PlayStation Consoles","false","true","","","false","false","false","false"
"City of Jackson Curbside Recycling","City of Jackson Curbside Recycling","200 S President St Ste 504","Jackson","Hinds","MS","39201","6019601111","0","","http://www.jacksonms.gov/","32.29815","-90.18193","5.42919748483909","Aluminum Cans; Cardboard; Magazines; Newspapers; Office Paper; Paper (Mixed); Phone books; Plastic #1 (PETE); Plastic #2 (Color HDPE); Plastic #2 (HDPE); Plastic #3 (PVC); Plastic #4 (LDPE); Plastic #5 (Polypropylene); Plastic #6 (Polystyrene); Plastic #7; Tin or Steel Cans","false","false","To get started recycling, come to the Solid Waste Division at 200 South President Street, Suite 504 to receive up to 2 recycling bins. Collection occurs on one of your normal household garbage collection days, every other week. Set recycling containers at the curb before 7:00AM.","","true","false","false","false"
"AutoZone","AutoZone","1009 Hwy 49 S","Richland","Rankin","MS","39218","6016640409","0","","http://www.autozone.com","32.15074","-90.11761","5.46559660196344","Lead Acid (Pb) Batteries; Used Motor Oil; Video Game Consoles; PlayStation Consoles","false","true","Most AutoZone stores accept used motor oil, transmission fluid, gear oil and automotive batteries. Call to see what your local store is currently accepting.","","false","false","false","false"
"Mississippi Department of Environmental Quality","","","Jackson","","MS","39289","8887860661","0","","https://www.mdeq.ms.gov/","32.2987573","-90.1848103","5.51649143564701","","false","false","","","false","false","false","false"
"Firestone Complete Auto Care Store","Firestone Complete Auto Care Store","125 W Pascagoula St","Jackson","Hinds","MS","39201","6019481671","0","","http://www.firestonecompleteautocare.com/","32.29814","-90.18852","5.54344052508473","Lead Acid (Pb) Batteries; Used Motor Oil; Video Game Consoles; PlayStation Consoles","false","true","","","false","false","false","false"
"Salvation Army","Salvation Army","426 W Pascagoula St","Jackson","Hinds","MS","39203","6019683985","0","Monday: 8:00 AM - 5:00 PM Tuesday: 8:00 AM - 5:00 PM Wednesday: 8:00 AM - 5:00 PM Thursday: 8:00 AM - 5:00 PM Friday: 8:00 AM - 5:00 PM ","http://www.salvationarmy.org","32.29886","-90.19358","5.69403700408508","Books (Reuse); Clothing; Gift Bags; Household Goods; Ornaments; Children's Toys; Small Appliances; Video Game Consoles; PlayStation Consoles","false","true","This site accepts clean items in good condition.  It does not accept broken items.","Sony","false","false","false","false"
"USPS Post Office Box Lobby Recycling Program","US Post Office","820 Cooper Rd","Jackson","Hinds","MS","39212","8002758777","0","","https://www.usps.com/","32.25396","-90.24812","5.74317754575303","Catalogs; Greeting Cards; Magazines; Paper (Mixed)","false","true","","","false","false","false","false"
"US Post Office","USPS Discarded Lobby Mail Recycling Program","820 Cooper Rd","Jackson","Hinds","MS","39212","0","0","","","32.25396","-90.24812","5.74317754575303","Video Game Consoles; PlayStation Consoles","false","true","","","false","false","false","false"
"Advance Auto Parts","Advance Auto Parts","1187 Highway 49 S","Richland","Rankin","MS","39218","6019391367","0","Monday: 7:00 AM - 9:00 PM Tuesday: 7:00 AM - 9:00 PM Wednesday: 7:00 AM - 9:00 PM Thursday: 7:00 AM - 9:00 PM Friday: 7:00 AM - 9:00 PM Saturday: 7:00 AM - 9:00 PM Sunday: 10:00 AM - 8:00 PM ","http://www.advanceautoparts.com","32.14802","-90.11172","5.78639077309129","Lead Acid (Pb) Batteries; Used Motor Oil; Video Game Consoles; PlayStation Consoles","false","true","","","false","false","false","false"
"Walgreens","Walgreens","1199 Highway 49 S","Richland","Rankin","MS","39218","6019323818","0","","http://www.walgreens.com","32.14802","-90.11172","5.78639077309129","Cell Phones; Inkjet Printer Cartridges; Video Game Consoles; PlayStation Consoles","false","true","","","false","false","false","false"
"Aluminum Recycling of Mississippi","Aluminum Recycling of Mississippi","1919 Valley St ","Jackson","Hinds County","MS","39204","6013555777","0","Monday: 8:30 AM - 4:30 PM Tuesday: 8:30 AM - 4:30 PM Wednesday: 8:30 AM - 4:30 PM Thursday: 8:30 AM - 4:30 PM Friday: 8:30 AM - 4:30 PM Saturday: 8:00 AM - 11:00 AM ","null","32.2899814","-90.2158398","5.79123068921791","Aluminum Cans; Car; Lead Acid (Pb) Batteries; Cardboard; Ferrous Metals (Steel or Iron); Non-ferrous (Copper/Brass/Tin); Tin or Steel Cans; Video Game Consoles; PlayStation Consoles","false","true","","","false","false","false","false"
"US Post Office","USPS Discarded Lobby Mail Recycling Program","401 E South St","Jackson","Hinds","MS","39205","0","0","","","32.30432","-90.18252","5.84982195966025","Video Game Consoles; PlayStation Consoles","false","true","","","false","false","false","false"
"United Cellular, Inc.","","1400 John R. Lynch St","Jackson","","MS","39203","6019836009","0","","","32.2978909","-90.2062972","5.95228152257471","","false","false","","","false","false","false","false"
"USPS Post Office Box Lobby Recycling Program","US Post Office","250 S Church St","Florence","Rankin","MS","39073","8002758777","0","","https://www.usps.com/","32.13942","-90.12879","5.96908555840383","Catalogs; Greeting Cards; Magazines; Paper (Mixed)","false","true","","","false","false","false","false"
"US Post Office","USPS Discarded Lobby Mail Recycling Program","250 S Church St","Florence","Rankin","MS","39073","0","0","","","32.13942","-90.12879","5.96908555840383","Video Game Consoles; PlayStation Consoles","false","true","","","false","false","false","false"
"Firestone Complete Auto Care","","2335 Us Hwy 80","Jackson","","MS","39205","6013554726","0","","https://www.firestonecompleteautocare.com/","32.2896005","-90.2251624","6.10920827297072","","false","false","","","false","false","false","false"
