name,description,address,city,region,province,postal_code,phone,fax,hours,url,latitude,longitude,distance,materials,pickup,dropoff,notes,groups,curbside,municipal,national,event_only
"Jackson County Household Hazardous Waste Collection Program","","","Gautier","","MS","39553","2288728340","0","","https://www.co.jackson.ms.us","30.4172273","-88.6434308","10.0867167541702","","false","false","","","false","false","false","false"
"United Cellular, Inc.","","3680 Sangani Blvd","D'iberville","","MS","39540","2283548751","0","","","30.459538","-88.8960314","10.4138063714028","","false","false","","","false","false","false","false"
"Call2Recycle at Smokescreen, LLC","Call2Recycle at Smokescreen, LLC","4351 Gautier Vancleave Rd Ste D","Gautier","Jackson","MS","39553","2284473880","0","","http://www.smokescreenllc.com/smokescreen-store#!__smokescreen-store/contact-and-where-are-we?","30.40431","-88.6555","10.4351278376634","Cell Phones; Ni-Cd Batteries; Li-Ion Batteries; Ni-MH Batteries; Ni-Zn Batteries; Small Sealed Lead Acid Batteries; Video Game Consoles; PlayStation Consoles","false","true","The U.S. EPA estimates that more than 350 million rechargeable batteries are purchased annually in the U.S. Thanks to the environmental commitment of this location, its easy and free to recycle your batteries. Bring your rechargeable batteries to this location and look for the recycling box or ask an associate how you can do your part for the environment.","","false","false","false","false"
"Walmart","Walmart","3615 Sangani Blvd","Diberville","Harrison","MS","39540","2283964740","0","","http://www.walmart.com","30.45685","-88.89503","10.4563312681124","Lead Acid (Pb) Batteries; Plastic Shopping Bags; Food Storage Bags; Video Game Consoles; PlayStation Consoles","false","true","","","false","false","false","false"
"Walmart Tire & Lube Express","Walmart Tire & Lube Express","3615 Sangani Blvd","Diberville","Harrison","MS","39540","2283964740","0","","http://www.walmart.com/catalog/catalog.gsp?cat=495843","30.45685","-88.89503","10.4563312681124","Lead Acid (Pb) Batteries; Used Motor Oil; Oil Filters; Video Game Consoles; PlayStation Consoles","false","true","","","false","false","false","false"
"Walmart Supercenter","","3615 Sangani Blvd","D'iberville","","MS","39540","2283964740","0","","https://www.walmart.com/","30.4564907","-88.8951207","10.4737366584956","","false","false","","","false","false","false","false"
"Walmart Tire and Lube Express","","3615 Sangani Blvd","D'iberville","","MS","39540","2283964740","0","","https://www.walmart.com/cp/ideas/8932632","30.4564907","-88.8951207","10.4737366584956","","false","false","","","false","false","false","false"
"Lowe's","","3700 Sangani Boulevard","D'iberville","","MS","39540","2283927103","0","","https://newsroom.lowes.com/responsibility/operational-excellence/","30.4595693","-88.8973678","10.4818252058978","","false","false","","","false","false","false","false"
"Call2Recycle at Lowe's","Call2Recycle at Lowe's","3700 Sangani Blvd","Diberville","Harrison","MS","39540","2283927103","0","Monday: 6:00 AM - 10:00 PM Tuesday: 6:00 AM - 10:00 PM Wednesday: 6:00 AM - 10:00 PM Thursday: 6:00 AM - 10:00 PM Friday: 6:00 AM - 10:00 PM Saturday: 6:00 AM - 10:00 PM Sunday: 8:00 AM - 8:00 PM ","http://www.lowes.com/","30.4588","-88.89851","10.5672426789123","Cell Phones; Compact Fluorescent Lights; Ni-Cd Batteries; Plastic Shopping Bags; Li-Ion Batteries; Ni-MH Batteries; Ni-Zn Batteries; Small Sealed Lead Acid Batteries; Video Game Consoles; PlayStation Consoles; Batteries (Rechargeable); Cell Phone Batteries; Li-Ion Batteries; Ni-Cd Batteries; Ni-MH Batteries; Small Sealed Lead Acid Batteries; Cell Phones","false","true","As an environmentally-committed retailer, Lowes offers a recycling center near store entrances to give consumers a free and easy way to properly dispose of rechargeable batteries, cell phones, CFLs and plastic shopping bags; materials that otherwise could be potentially harmful to the environment.  Look for the recycling center or ask a store associate for more details.","Call2Recycle","false","false","false","false"
"Call2Recycle at RadioShack","Call2Recycle at RadioShack","3661 Sangani Blvd Ste A","Diberville","Harrison","MS","39540","2283963926","0","","http://www.radioshack.com/","30.45822","-88.89823","10.5727112166697","Cell Phones; Ni-Cd Batteries; Li-Ion Batteries; Ni-MH Batteries; Ni-Zn Batteries; Small Sealed Lead Acid Batteries; Video Game Consoles; PlayStation Consoles","false","true","As the first national retailer to partner with Call2Recycle, RadioShack is at the forefront of the rechargeable battery recycling cause and is pleased to offer battery recycling at thousands of convenient RadioShack locations for free.  Simply drop them off at your local RadioShack and theyll take care of the rest.  Ask a store associate for more details.","","false","false","false","false"
"RadioShack","RadioShack","3661 Sangani Blvd","Diberville","Harrison","MS","39540","2283963926","0","Monday: 8:30 AM - 9:00 PM Tuesday: 8:30 AM - 9:00 PM Wednesday: 8:30 AM - 9:00 PM Thursday: 8:30 AM - 9:00 PM Friday: 8:30 AM - 9:00 PM Saturday: 9:30 AM - 9:00 PM Sunday: 10:00 AM - 7:00 PM ","http://www.radioshack.com","30.45822","-88.89823","10.5727112166697","Ni-Cd Batteries; Batteries (Rechargeable); Video Game Consoles; PlayStation Consoles","false","true","","","false","false","false","false"
"Applewhite Industries","Applewhite Industries","4501 Beasley Rd","Gautier","Jackson","MS","39553","2284974130","0","Monday: 7:00 AM - 4:00 PM Tuesday: 7:00 AM - 4:00 PM Wednesday: 7:00 AM - 4:00 PM Thursday: 7:00 AM - 4:00 PM Friday: 7:00 AM - 4:00 PM Saturday: 7:30 AM - 12:00 PM ","","30.39631","-88.66511","10.64990998175","Used Motor Oil; Video Game Consoles; PlayStation Consoles","false","true","","","false","false","false","false"
"Waste Oil Collectors","Waste Oil Collectors","4001 Old Spanish Trl","Gautier","Jackson","MS","39553","2284974585","0","","http://www.woci.com/","30.39162","-88.67632","10.6707681252874","Glue & Adhesives; Brake Fluid; Degreasers; Fertilizer; Fungicides; Gasoline and Unwanted Fuels; Herbicides; Household Cleaners; Insecticides; Unused Paint; Paint Donation; Paint Thinner; Pesticides; Photography Chemicals; Pool Chemicals; Solvents; Transmission Fluid; Used Motor Oil; Oil Filters; Video Game Consoles; PlayStation Consoles","false","true","","","false","false","false","false"
"Waste Oil Collectors","","4001 Old Spanish Trail","Gautier","","MS","39553","2284974585","0","","","30.391849","-88.6751064","10.683789948848","","false","false","","","false","false","false","false"
"Target Store","","3867 Promenade Pkwy","D'iberville","","MS","39540","2282333301","0","","https://corporate.target.com/corporate-responsibility/planet","30.4557758","-88.8995201","10.7241333686738","","false","false","","","false","false","false","false"
"Lowe's","","3200 U.S. 90","Gautier","","MS","39553","2284970524","0","","https://newsroom.lowes.com/responsibility/operational-excellence/","30.3950934","-88.6621151","10.8049500103147","","false","false","","","false","false","false","false"
"Best Buy","Best Buy","3889 Promenade Pkwy ","D'Iberville","Harrison County","MS","39540","2283549799","0","","https://www.bestbuy.com/recycle","30.4534882","-88.900703","10.8655623052483","Large Household Appliances; Refrigerators; Televisions; AC Power Plugs; Batteries (Rechargeable); Cables & Connectors; Car Audio/Video Equipment; Cell Phone Batteries; Cell Phones; Computer (Recycling); Hard Drives; Computer Monitors; Cameras; DVD Players/Blu-Ray Players/DVRs; Electronics; E-Readers; GPS Units; Headphones; Inkjet Printer Cartridges; Laptop Computers; Laser Toner Cartridges; Li-Ion Batteries; MP3 Players; Network Equipment; Ni-Cd Batteries; Ni-MH Batteries; Ni-Zn Batteries; Computer Peripherals; Portable Media Players; Printers/Scanners/Fax Machines; Small Electronics; Small Sealed Lead Acid Batteries; Stereo Equipment; Tablets; Telephones; UPS Batteries/Backup Systems; VCRs; Video Game Systems; Blu-Ray Players; Digital Converter Boxes; Small Televisions; Video Game Consoles; PlayStation Consoles","true","true","2 TVs per visit, 3 e-waste items per day; $25 fee for TVs and Monitors; $19.99 pick-up fee with delivery; $99.99 standalone pickup fee; ","Sony, Vizio, OEM","false","false","false","false"
"Best Buy","","3889 Promenade Pkwy","Diberville","","MS","39540","2283549799","0","","https://www.bestbuy.com/site/services/recycling/pcmcat149900050025.c?id=pcmcat149900050025","30.4534882","-88.900703","10.8655623052483","","false","false","","","false","false","false","false"
"Call2Recycle at Lowe's","Call2Recycle at Lowe's","3200 Highway 90","Gautier","Jackson","MS","39553","2284970524","0","Monday: 6:00 AM - 10:00 PM Tuesday: 6:00 AM - 10:00 PM Wednesday: 6:00 AM - 10:00 PM Thursday: 6:00 AM - 10:00 PM Friday: 6:00 AM - 10:00 PM Saturday: 6:00 AM - 10:00 PM Sunday: 8:00 AM - 8:00 PM ","http://www.lowes.com/","30.39365","-88.66212","10.8938398300384","Cell Phones; Compact Fluorescent Lights; Ni-Cd Batteries; Plastic Shopping Bags; Li-Ion Batteries; Ni-MH Batteries; Ni-Zn Batteries; Small Sealed Lead Acid Batteries; Video Game Consoles; PlayStation Consoles; Batteries (Rechargeable); Cell Phone Batteries; Li-Ion Batteries; Ni-Cd Batteries; Ni-MH Batteries; Small Sealed Lead Acid Batteries; Cell Phones","false","true","As an environmentally-committed retailer, Lowes offers a recycling center near store entrances to give consumers a free and easy way to properly dispose of rechargeable batteries, cell phones, CFLs and plastic shopping bags; materials that otherwise could be potentially harmful to the environment.  Look for the recycling center or ask a store associate for more details.","Call2Recycle","false","false","false","false"
"O'Reilly Auto Parts","null","3251 Highway 90","Gautier","","MS","39553","2285221972","0","","http://oreillyauto.custhelp.com/app/error/error_id/6","30.3928003","-88.6623787","10.9394533718319","","false","false","","","false","false","false","false"
"Kohl's","","3901 Promenade Parkway","D'iberville","","MS","39540","2283921202","0","","https://corporate.kohls.com/","30.4536072","-88.9024063","10.9483863878313","","false","false","","","false","false","false","false"
"JCPenney","","2800 Hwy 90","Gautier","","MS","39553","2284976363","0","","https://www.jcpenney.com/","30.3941331","-88.6562395","11.0261861320125","","false","false","","","false","false","false","false"
"Advance Auto Parts","Advance Auto Parts","10301 Diberville Blvd","Diberville","Harrison","MS","39540","2283927478","0","Monday: 7:00 AM - 9:00 PM Tuesday: 7:00 AM - 9:00 PM Wednesday: 7:00 AM - 9:00 PM Thursday: 7:00 AM - 9:00 PM Friday: 7:00 AM - 9:00 PM Saturday: 7:00 AM - 9:00 PM Sunday: 10:00 AM - 8:00 PM ","http://www.advanceautoparts.com","30.43623","-88.89284","11.1511787312208","Lead Acid (Pb) Batteries; Used Motor Oil; Video Game Consoles; PlayStation Consoles","false","true","","","false","false","false","false"
"Advance Auto Parts","","10301 Diberville Blvd","Diberville","","MS","39540","2283927478","0","","http://shop.advanceautoparts.com/webapp/wcs/stores/servlet/home___","30.4356331","-88.8924615","11.1585380057724","","false","false","","","false","false","false","false"
"Advance Auto Parts","Advance Auto Parts","3501 Gautier Vancleave Rd","Gautier","Jackson","MS","39553","2284972247","0","Monday: 7:00 AM - 9:00 PM Tuesday: 7:00 AM - 9:00 PM Wednesday: 7:00 AM - 9:00 PM Thursday: 7:00 AM - 9:00 PM Friday: 7:00 AM - 9:00 PM Saturday: 7:00 AM - 9:00 PM Sunday: 10:00 AM - 8:00 PM ","http://www.advanceautoparts.com","30.39361","-88.65203","11.1790454231928","Lead Acid (Pb) Batteries; Used Motor Oil; Video Game Consoles; PlayStation Consoles","false","true","","","false","false","false","false"
"AutoZone","","10229 Central Ave","Diberville","","MS","39540","2283549100","0","","https://www.autozone.com/landing/page.jsp?name=in-our-stores","30.434458","-88.8918622","11.1804116584128","","false","false","","","false","false","false","false"
"AutoZone","","10229 Central Ave","Diberville","","MS","39540","2283549100","0","","https://www.autozone.com/landing/page.jsp?name=in-our-stores","30.434458","-88.8918622","11.1804116584128","","false","false","","","false","false","false","false"
"D'lberville","D'lberville","10111 Gorenflo Rd ","D'Iberville","Harrison County","MS","39540","2283962777","0","Monday: 8:30 AM - 4:30 PM Tuesday: 8:30 AM - 4:30 PM Wednesday: 8:30 AM - 4:30 PM Thursday: 8:30 AM - 4:30 PM Friday: 8:30 AM - 4:30 PM ","","30.4309852","-88.888699","11.1850482340623","Used Motor Oil; Video Game Consoles; PlayStation Consoles","false","true","","","false","false","false","false"
"Home Depot","Home Depot","1680 Elizabeth Blvd","Biloxi","Harrison","MS","39532","2283548872","0","","http://www.homedepot.com","30.48961","-88.92497","11.1934627146288","Compact Fluorescent Lights; Batteries (Rechargeable); Video Game Consoles; PlayStation Consoles","false","true","Home Depot accepts compact fluorescent bulbs and used power tool rechargeable batteries. Look for the orange drop boxes, usually located near the front entrance near the customer service desk.","","false","false","false","false"
"Call2Recycle at the Home Depot","Call2Recycle at the Home Depot","1680 Elizabeth Blvd","Biloxi","Harrison","MS","39532","2283548872","0","","http://www.homedepot.com/","30.48961","-88.92497","11.1934627146288","Cell Phones; Compact Fluorescent Lights; Ni-Cd Batteries; Li-Ion Batteries; Ni-MH Batteries; Ni-Zn Batteries; Small Sealed Lead Acid Batteries; Video Game Consoles; PlayStation Consoles; Batteries (Rechargeable); Cell Phone Batteries; Li-Ion Batteries; Ni-Cd Batteries; Ni-MH Batteries; Small Sealed Lead Acid Batteries","false","true","The Home Depot accepts used rechargeable batteries and compact fluorescent bulbs. Look for the orange drop boxes, usually located near the front entrance near the customer service desk, or ask a store associate for more details.","Call2Recycle","false","false","false","false"
"AutoZone","AutoZone","10229 Central Ave","Diberville","Harrison","MS","39540","2283549100","0","","http://www.autozone.com","30.43451","-88.89231","11.1991579819604","Lead Acid (Pb) Batteries; Used Motor Oil; Video Game Consoles; PlayStation Consoles","false","true","Most AutoZone stores accept used motor oil, transmission fluid, gear oil and automotive batteries. Call to see what your local store is currently accepting.","","false","false","false","false"
"Advance Auto Parts","","3501 Gautier Van Cleave Rd","Gautier","","MS","39553","2284972247","0","","http://shop.advanceautoparts.com/webapp/wcs/stores/servlet/home___","30.3931606","-88.6521501","11.2025977703989","","false","false","","","false","false","false","false"
"Goodwill Industries","Goodwill Industries","2707 Highway 90 Ste 14","Gautier","Jackson","MS","39553","2285226737","0","Monday: 9:00 AM - 6:00 PM Tuesday: 9:00 AM - 6:00 PM Wednesday: 9:00 AM - 6:00 PM Thursday: 9:00 AM - 6:00 PM Friday: 9:00 AM - 6:00 PM Saturday: 9:00 AM - 6:00 PM ","http://www.goodwillsms.org","30.39187","-88.65294","11.2576335894556","Bikes; Books (Reuse); Clothing; Computer (Reuse); Hard Drives; Gift Bags; Eyeglasses; Household Goods; Lawn Equipment; Ornaments; Reusable Appliance Donation; Sporting Goods; Telephones; Miscellaneous Tools; Children's Toys; Video Game Consoles; PlayStation Consoles","false","true","","","false","false","false","false"
"Sims Metal Management","","11415 Old Highway 67","Biloxi","","MS","39532","2283926070","0","","","30.4679029","-88.9174179","11.2874982908321","","false","false","","","false","false","false","false"
"Goodwill Industries","Goodwill Industries","10109 Central Ave","Diberville","Harrison","MS","39540","2283928708","0","Monday: 9:00 AM - 6:00 PM Tuesday: 9:00 AM - 6:00 PM Wednesday: 9:00 AM - 6:00 PM Thursday: 9:00 AM - 6:00 PM Friday: 9:00 AM - 6:00 PM Saturday: 9:00 AM - 6:00 PM ","http://www.goodwillms.org","30.43125","-88.89144","11.2994171557365","Bikes; Books (Reuse); Clothing; Computer (Reuse); Hard Drives; Gift Bags; Eyeglasses; Household Goods; Lawn Equipment; Ornaments; Reusable Appliance Donation; Sporting Goods; Telephones; Miscellaneous Tools; Children's Toys; Video Game Consoles; PlayStation Consoles","false","true","This site is located next to Rent USA.","","false","false","false","false"
"Walgreens","Walgreens","2601 Highway 90","Gautier","Jackson","MS","39553","2284978110","0","","http://www.walgreens.com","30.39147","-88.6504","11.3555525370508","Cell Phones; Inkjet Printer Cartridges; Video Game Consoles; PlayStation Consoles","false","true","","","false","false","false","false"
"David Scrapy Company","David Scrapy Company","12360 Hickman Rd","Biloxi","Harrison","MS","39532","2283926070","0","Tuesday: 8:00 AM - 12:00 PM Wednesday: 8:00 AM - 12:00 PM Thursday: 8:00 AM - 12:00 PM Friday: 8:00 AM - 12:00 PM Saturday: 8:00 AM - 12:00 PM Tuesday: 1:00 PM - 5:00 PM Wednesday: 1:00 PM - 5:00 PM Thursday: 1:00 PM - 5:00 PM Friday: 1:00 PM - 5:00 PM Saturday: 1:00 PM - 5:00 PM ","null","30.46505","-88.91816","11.4095001595077","Ferrous Metals (Steel or Iron); Large Household Appliances; Video Game Consoles; PlayStation Consoles","false","true","","","false","false","false","false"
"Call2Recycle at Cellular South","Call2Recycle at Cellular South","3887 Promenade Pkwy","Diberville","Harrison","MS","39540","2283921121","0","Monday: 9:00 AM - 8:00 PM Tuesday: 9:00 AM - 8:00 PM Wednesday: 9:00 AM - 8:00 PM Thursday: 9:00 AM - 8:00 PM Friday: 9:00 AM - 8:00 PM Saturday: 9:00 AM - 8:00 PM ","http://www.cspire.com/","30.4262","-88.89083","11.4954969329857","Cell Phones; Ni-Cd Batteries; Li-Ion Batteries; Ni-MH Batteries; Ni-Zn Batteries; Small Sealed Lead Acid Batteries; Video Game Consoles; PlayStation Consoles","false","true","The U.S. EPA estimates that more than 350 million rechargeable batteries are purchased annually in the U.S. Thanks to the environmental commitment of this location, its easy and free to recycle your batteries. Bring your rechargeable batteries to this location and look for the recycling box or ask an associate how you can do your part for the environment.","","false","false","false","false"
"AT&T Wireless","AT&T Wireless","3865 Promenade Pkwy","Diberville","Harrison","MS","39540","2283961329","0","","http://www.att.com/","30.4262","-88.89083","11.4954969329857","Cell Phones; Ni-Cd Batteries; Batteries (Rechargeable); Cell Phone Batteries; Tablets; Li-Ion Batteries; Video Game Consoles; PlayStation Consoles","false","true","Receive an AT&T Promotion Card worth the trade-in value of your smartphone, tablet, or netbook. You can also donate the trade-in value to Cell Phones for Soldiers.","","false","false","false","false"
"Verizon Wireless","Verizon Wireless","3821 Promenade Pkwy Ste L","Diberville","Harrison","MS","39540","8666444532","0","","http://www.verizonwireless.com/","30.4262","-88.89083","11.4954969329857","Cell Phones; Cell Phone Batteries; Video Game Consoles; PlayStation Consoles","false","true","<A Href="https://www.trade-in.vzw.com/home.aspx">
The Verizon Wireless Trade-In Program</A> allows you to trade in your used handset or tablet in a convenient and responsible way. 
<P>
<P>
Verizon Wireless works every day to protect our environment and give our customers opportunities to do the same. <A Href="http://aboutus.vzw.com/Green_Initiative/overview.html">Click here</A> for more examples of the earth-friendly initiatives and programs Verizon Wireless is proud to offer and support.","","false","false","false","false"
"Target","Target","3867 Promenade Pkwy","Diberville","Harrison","MS","39540","2282333301","0","","http://www.target.com/","30.4262","-88.89083","11.4954969329857","Aluminum Cans; Cell Phones; Inkjet Printer Cartridges; MP3 Players; Plastic #1 (PETE); Plastic #2 (HDPE); Plastic Shopping Bags; Video Game Consoles; PlayStation Consoles","false","true","","","false","false","false","false"
"USPS Post Office Box Lobby Recycling Program","US Post Office","1800 Highway 90","Gautier","Jackson","MS","39553","8002758777","0","","https://www.usps.com/","30.38971","-88.63729","11.8620323616359","Catalogs; Greeting Cards; Magazines; Paper (Mixed)","false","true","","","false","false","false","false"
"US Post Office","USPS Discarded Lobby Mail Recycling Program","1800 Highway 90","Gautier","Jackson","MS","39553","0","0","","","30.38971","-88.63729","11.8620323616359","Video Game Consoles; PlayStation Consoles","false","true","","","false","false","false","false"
"Home Depot","","Elizabeth Blvd","Biloxi","","MS","39532","2283548872","0","","https://ecooptions.homedepot.com/","30.4466596","-88.9330729","12.7741455770108","","false","false","","","false","false","false","false"
"USPS Post Office Box Lobby Recycling Program","US Post Office","135 Main St","Biloxi","Harrison","MS","39530","8002758777","0","","https://www.usps.com/","30.39508","-88.88563","12.7932721167206","Catalogs; Greeting Cards; Magazines; Paper (Mixed)","false","true","","","false","false","false","false"
"US Post Office","USPS Discarded Lobby Mail Recycling Program","135 Main St","Biloxi","Harrison","MS","39530","0","0","","","30.39508","-88.88563","12.7932721167206","Video Game Consoles; PlayStation Consoles","false","true","","","false","false","false","false"
"O'Reilly Auto Parts","null","956 Cedar Lake Road","Biloxi","","MS","39532","2283921705","0","","http://oreillyauto.custhelp.com/app/error/error_id/6","30.4459417","-88.9335482","12.822686506586","","false","false","","","false","false","false","false"
"Firestone Complete Auto Care","","887 Howard Ave","Biloxi","","MS","39530","2283746732","0","","https://www.firestonecompleteautocare.com/","30.3968853","-88.8918716","12.9489011654025","","false","false","","","false","false","false","false"
"Firestone Complete Auto Care Store","Firestone Complete Auto Care Store","887 Howard Ave","Biloxi","Harrison","MS","39530","2283746732","0","","http://www.firestonecompleteautocare.com/","30.39656","-88.89192","12.9673794056648","Lead Acid (Pb) Batteries; Used Motor Oil; Video Game Consoles; PlayStation Consoles","false","true","","","false","false","false","false"
"USPS Post Office Box Lobby Recycling Program","US Post Office","4100 Rabby St","Escatawpa","Jackson","MS","39552","8002758777","0","","https://www.usps.com/","30.45048","-88.54096","13.4256423369389","Catalogs; Greeting Cards; Magazines; Paper (Mixed)","false","true","","","false","false","false","false"
"US Post Office","USPS Discarded Lobby Mail Recycling Program","4100 Rabby St","Escatawpa","Jackson","MS","39552","0","0","","","30.45048","-88.54096","13.4256423369389","Video Game Consoles; PlayStation Consoles","false","true","","","false","false","false","false"
"Goodwill Industries","Goodwill Industries","1131 Judge Sekul Ave","Biloxi","Harrison","MS","39530","2284355050","0","Monday: 8:00 AM - 4:00 PM Tuesday: 8:00 AM - 4:00 PM Wednesday: 8:00 AM - 4:00 PM Thursday: 8:00 AM - 4:00 PM Friday: 8:00 AM - 4:00 PM ","http://www.goodwill.org","30.40112","-88.90841","13.434013775286","Bikes; Books (Reuse); Clothing; Computer (Reuse); Hard Drives; Gift Bags; Eyeglasses; Household Goods; Lawn Equipment; Ornaments; Reusable Appliance Donation; Sporting Goods; Telephones; Miscellaneous Tools; Children's Toys; Video Game Consoles; PlayStation Consoles","false","true","","","false","false","false","false"
"M & M Car Care","M & M Car Care","7200 MS-613 ","Moss Point","Jackson County","MS","39563","2284742246","0","Monday: 7:30 AM - 5:00 PM Tuesday: 7:30 AM - 5:00 PM Wednesday: 7:30 AM - 5:00 PM Thursday: 7:30 AM - 5:00 PM Friday: 7:30 AM - 5:00 PM ","","30.44576","-88.542103","13.5094632387929","Used Motor Oil; Oil Filters; Video Game Consoles; PlayStation Consoles","false","true","","","false","false","false","false"
"Keesler","","Keesler AFB (BIX)","Biloxi","","MS","39534","2284322404","0","","","30.4094159","-88.9252664","13.8150047132946","","false","false","","","false","false","false","false"
"Habitat for Humanity","Habitat for Humanity","1400 Leggett Dr","Biloxi","Harrison","MS","39530","2283744946","0","Monday: 9:00 AM - 4:00 PM Tuesday: 9:00 AM - 4:00 PM Wednesday: 9:00 AM - 4:00 PM Thursday: 9:00 AM - 4:00 PM Friday: 9:00 AM - 4:00 PM ","http://www.habitat.org","30.39564","-88.92228","14.2978578997244","Ceramic Tiles; Linoleum; Porcelain; Wood; Video Game Consoles; PlayStation Consoles","false","true","Please call for further information regarding items that may be donated.","","false","false","false","false"
"USPS Post Office Box Lobby Recycling Program","US Post Office","4537 Bowen St","Moss Point","Jackson","MS","39562","8002758777","0","","https://www.usps.com/","30.40633","-88.54015","15.0403962497647","Catalogs; Greeting Cards; Magazines; Paper (Mixed)","false","true","","","false","false","false","false"
"US Post Office","USPS Discarded Lobby Mail Recycling Program","4537 Bowen St","Moss Point","Jackson","MS","39562","0","0","","","30.40633","-88.54015","15.0403962497647","Video Game Consoles; PlayStation Consoles","false","true","","","false","false","false","false"
"Advance Auto Parts","Advance Auto Parts","4212 Main St","Moss Point","Jackson","MS","39563","2284757440","0","Monday: 7:00 AM - 9:00 PM Tuesday: 7:00 AM - 9:00 PM Wednesday: 7:00 AM - 9:00 PM Thursday: 7:00 AM - 9:00 PM Friday: 7:00 AM - 9:00 PM Saturday: 7:00 AM - 9:00 PM Sunday: 10:00 AM - 8:00 PM ","http://www.advanceautoparts.com","30.40421","-88.53838","15.2120480642809","Lead Acid (Pb) Batteries; Used Motor Oil; Video Game Consoles; PlayStation Consoles","false","true","","","false","false","false","false"
